,begin,end,subtitles_text
1,00:00:00.00,00:00:00.00, >> JEFF: Previously on
2,00:00:02.75,00:00:02.75,"Survivor: In the jungles of Guatemala,"
3,00:00:05.12,00:00:05.12,"among the ruins of an ancient civilization, 16"
4,00:00:08.38,00:00:08.38,Americans began their adventure with a big surprise.
5,00:00:11.67,00:00:11.67,Come on out. I'm sure you guys recognize
6,00:00:14.58,00:00:14.58,Bobby Jon and Stephenie from Survivor Palau.
7,00:00:17.46,00:00:17.46,Stephenie is a member of Yaxha. Bobby Jon is a member of Nakum.
8,00:00:23.88,00:00:23.88,>> We were just thrilled to have Bobby Jon because he's not going
9,00:00:26.58,00:00:26.58,"to quit for anything. I was like, oh, we're winning."
10,00:00:30.96,00:00:30.96,"We got Stephenie, like, we're good to go."
11,00:00:34.38,00:00:34.38,>> JEFF: But some weren't so sure.
12,00:00:36.83,00:00:36.83,>> How am I going to win a million now that she's here?
13,00:00:39.08,00:00:39.08,>> JEFF: The tribes immediately faced off in their first
14,00:00:41.38,00:00:41.38,reward challenge. It's a grueling 11-mile race
15,00:00:44.71,00:00:44.71,through the jungles of Guatemala.
16,00:00:48.54,00:00:48.54,The winning tribe claims the right to the better camp;
17,00:00:50.92,00:00:50.92,they also get flint to make fire.
18,00:00:53.58,00:00:53.58,"Survivors, ready, go! And the game was on."
19,00:00:57.50,00:00:57.50,">> Got to make time. You drop it, you leave it,"
20,00:00:59.62,00:00:59.62,"you go. >> On Stephenie's Yaxha tribe,"
21,00:01:01.79,00:01:01.79,Gary kept his true identity a secret.
22,00:01:03.38,00:01:03.38,">> Gary, what do you do? >> All right!"
23,00:01:09.08,00:01:09.08,I was in the NFL for 11 years. My real name is Gary Hogeboom.
24,00:01:12.25,00:01:12.25,"If somebody does recognize me, Just gonna say that's not me."
25,00:01:15.25,00:01:15.25,I'm Gary Hawkins. >> JEFF: And Bobby Jon's Nakum
26,00:01:19.04,00:01:19.04,tribe faced a setback when Blake got hurt.
27,00:01:21.83,00:01:21.83,>> MARGARET: One of these trees that have briars that
28,00:01:24.46,00:01:24.46,look like spikes actually broke on Blake's shoulder.
29,00:01:27.38,00:01:27.38,That really took him down a couple notches.
30,00:01:30.96,00:01:30.96,>> JEFF: After a grueling night in the jungle...
31,00:01:33.17,00:01:33.17,">> Guys, wait, wait, wait, please."
32,00:01:35.38,00:01:35.38,"JEFF: The tribes stayed close. >> They're catching up, they're"
33,00:01:37.54,00:01:37.54,"behind us. >> We need to, like, get right"
34,00:01:40.71,00:01:40.71,"on their ass, if not pass them. >> JEFF: With Yaxha on their"
35,00:01:44.00,00:01:44.00,"heels, Bobby Jon's Nakum tribe narrowly pulled it off."
36,00:01:47.12,00:01:47.12,">> Oh, yeah! >> JEFF: Congratulations."
37,00:01:49.46,00:01:49.46,The losing Yaxha was sent out to find their camp.
38,00:01:52.42,00:01:52.42,You've got more paddling to do. Even though they had no flint
39,00:01:55.21,00:01:55.21,"to make fire, Yaxha made the best of their situation."
40,00:01:58.75,00:01:58.75,">> I am so psyched. Finally, I'm on a tribe that's"
41,00:02:02.12,00:02:02.12,got as much heart and determination as me.
42,00:02:05.21,00:02:05.21,">> JEFF: Back at Nakum, the victory had come at a high"
43,00:02:07.71,00:02:07.71,price. >> ( retching )
44,00:02:09.79,00:02:09.79,">> You okay back there? Breathe through your nose,"
45,00:02:12.25,00:02:12.25,Blake. >> Bobby Jon?
46,00:02:14.46,00:02:14.46,>> Huh? His eyes are rolling back
47,00:02:16.83,00:02:16.83,">> We have these big strong guys, strong as oxes, and"
48,00:02:18.96,00:02:18.96,they're all down. >> JEFF: At the first immunity
49,00:02:21.25,00:02:21.25,"challenge, the Yaxha spirit secured them a victory..."
50,00:02:25.21,00:02:25.21,Yaxha wins immunity! ...sending a depleted
51,00:02:28.21,00:02:28.21,"Nakum to Tribal Council. Though Blake, Judd and Bobby Jon"
52,00:02:32.21,00:02:32.21,"were physically ailing, Jim was the worst off and was"
53,00:02:36.83,00:02:36.83,"voted out of the tribe. >> Jim, the tribe has spoken."
54,00:02:42.38,00:02:42.38,17 are left. Who will be voted out tonight?
55,00:03:59.42,00:03:59.42,">> A rock, a rock. Watch, watch, watch."
56,00:04:02.92,00:04:02.92,Has anybody found the trail yet? >> This is a place where you
57,00:04:06.29,00:04:06.29,"could break your leg, your ankle."
58,00:04:09.29,00:04:09.29,">> Tonight we had Tribal Council, and it seems like"
59,00:04:12.21,00:04:12.21,that's where I live. It seems like I'm paying rent at
60,00:04:14.08,00:04:14.08,Tribal Council. I'm waiting for it to change.
61,00:04:18.88,00:04:18.88,">> You know what. Just go lay down, okay?"
62,00:04:21.58,00:04:21.58,>> ( coughing ) >> We just don't have the energy
63,00:04:25.67,00:04:25.67,to suffer the emotional hit-- the physical hit is bad enough.
64,00:04:31.38,00:04:31.38,The emotional toll that Tribal Council takes on you is
65,00:04:34.54,00:04:34.54,"terrible. It's just a sick, sick feeling"
66,00:04:38.54,00:04:38.54,knowing we had to go and even worse coming back.
67,00:04:43.25,00:04:43.25,( coughing ) >> They just don't look like
68,00:05:08.92,00:05:08.92,they're having fun. >> They are so serious and they
69,00:05:12.21,00:05:12.21,"are not like buddy-buddy, you know?"
70,00:05:15.00,00:05:15.00,">> I'm telling you, it's Bobby Jon."
71,00:05:16.04,00:05:16.04,He's so damn serious. >> It's day four and we're
72,00:05:19.21,00:05:19.21,getting to know each other really well.
73,00:05:21.42,00:05:21.42,We all have different qualities. We have an amazing tribe.
74,00:05:25.21,00:05:25.21,>> Better to be diverse like we are.
75,00:05:29.17,00:05:29.17,>> We got the most diverse group there.
76,00:05:31.83,00:05:31.83,We got a bum. We got a police officer.
77,00:05:35.33,00:05:35.33,We got a magician's assistant. We got a fish monger.
78,00:05:40.04,00:05:40.04,We got a gay guy and we got a landscaper-- but we all come
79,00:05:43.42,00:05:43.42,"together and it's brilliant. >> Are you guys cold, or no?"
80,00:05:46.75,00:05:46.75,">> No, but a tarantula jumped on my arm."
81,00:05:49.04,00:05:49.04,>> A tarantula? How big?
82,00:05:51.21,00:05:51.21,>> About that big. >> You saw a tarantula?
83,00:05:54.12,00:05:54.12,">> GARY: You know, they've asked me what I do, and I told them I"
84,00:05:56.17,00:05:56.17,"was a landscaper, not a quarterback."
85,00:05:58.00,00:05:58.00,"Nobody has asked me what I did 15 years ago, so I guess I don't"
86,00:06:02.17,00:06:02.17,have to tell them. >> All right.
87,00:06:07.88,00:06:07.88,Head back. >> Want one or two?
88,00:06:12.12,00:06:12.12,>> You braiding hair? >> I want to French braid yours.
89,00:06:14.58,00:06:14.58,I want to learn how to do it. >> No?
90,00:06:17.21,00:06:17.21,>> You want to learn on my head? Why you want to learn on myhead?
91,00:06:19.25,00:06:19.25,head? It's just like a fun camp life
92,00:06:22.67,00:06:22.67,It's much different from anything I had experienced
93,00:06:24.75,00:06:24.75,before So I think the fact that we get
94,00:06:28.17,00:06:28.17,"along so well is huge, Cause we do have good team"
95,00:06:30.42,00:06:30.42,"morale. It's become like a family, and"
96,00:06:33.12,00:06:33.12,we're hoping to keep that family together for a long time.
97,00:06:39.96,00:06:39.96,">> Got some tree mail, folks. >> Want me to read it?"
98,00:06:44.50,00:06:44.50,>> Go ahead. >> Yeah.
99,00:06:47.50,00:06:47.50,">> ""Hunger is a burden. You need energy to compete."
100,00:06:50.08,00:06:50.08,You've been caught in a web of hardship.
101,00:06:53.17,00:06:53.17,"Winning this one will help you eat."""
102,00:06:56.08,00:06:56.08,">> We just got tree mail, and that's the last thing I wanted"
103,00:06:58.83,00:06:58.83,to hear. For some reason I just can't
104,00:07:02.00,00:07:02.00,"breathe, and I've been struggling for the last"
105,00:07:05.25,00:07:05.25,"three or four days. I haven't slept and so forth,"
106,00:07:08.17,00:07:08.17,and drinking water doesn't seem to help.
107,00:07:13.92,00:07:13.92,">> Blake... Lay down, hon."
108,00:07:16.25,00:07:16.25,Lay down if you feel short of breath.
109,00:07:17.62,00:07:17.62,">> I can't breathe. >> I'm really, really worried"
110,00:07:21.25,00:07:21.25,"about Blake. He's a strong, you know,"
111,00:07:24.92,00:07:24.92,young guy. He's heaving.
112,00:07:26.75,00:07:26.75,He's struggling to get breaths and something's not right.
113,00:07:31.04,00:07:31.04,>> ( gasping ) >> Breathe through your nose.
114,00:07:35.38,00:07:35.38,"Breathe through your nose. >> Oh, God."
115,00:07:38.25,00:07:38.25,>> We got you-- okay. >> It's okay.
116,00:07:42.33,00:07:42.33,">> Blake, like, he is-- I don't think he can really handle it"
117,00:07:46.46,00:07:46.46,"out here, because he's just, you know, on his hands and knees and"
118,00:07:50.42,00:07:50.42,just breathing hard and has been having problems the whole time
119,00:07:54.21,00:07:54.21,"we've been out here. >> Blake, are you going to be"
120,00:07:58.83,00:07:58.83,able to do it? >> I ain't got anything against
121,00:08:03.21,00:08:03.21,the guy. I think he's a good guy and
122,00:08:05.00,00:08:05.00,"everything, but I'm more one of those, like a tougher guy which,"
123,00:08:08.17,00:08:08.17,"you know, you're hurting and everything, but you've just got"
124,00:08:11.33,00:08:11.33,"to man up. >> JEFF: Come on in, guys."
125,00:08:32.79,00:08:32.79,Yaxha getting your first look at the new Nakum.
126,00:08:36.79,00:08:36.79,"Jim, voted out at the first Tribal Council."
127,00:08:41.08,00:08:41.08,All right. You guys ready to get to today's
128,00:08:43.50,00:08:43.50,challenge? >> Yes.
129,00:08:45.58,00:08:45.58,>> JEFF: It is for reward. Here's how it works.
130,00:08:47.88,00:08:47.88,"On my go, you will race one at a time up a ramp, across the net"
131,00:08:50.42,00:08:50.42,"run, out on to a rope spider web."
132,00:08:54.29,00:08:54.29,Attached to the web are eight bags.
133,00:08:57.75,00:08:57.75,Crawling underneath the web you'll attempt to retrieve a
134,00:09:01.33,00:09:01.33,"bag. Once you have a bag, drop"
135,00:09:04.08,00:09:04.08,"yourself into the water, make your way back."
136,00:09:06.04,00:09:06.04,"If you fall into the water without a bag, you've got to"
137,00:09:09.04,00:09:09.04,come back to the start-- next person goes.
138,00:09:11.21,00:09:11.21,Everybody must attempt this course at least once.
139,00:09:15.04,00:09:15.04,"After that, you can go in any order you want and send whoever"
140,00:09:18.38,00:09:18.38,you want. First tribe to retrieve all
141,00:09:21.21,00:09:21.21,eight bags wins reward. Want to know what you're playing
142,00:09:24.08,00:09:24.08,for? >> Yeah.
143,00:09:25.88,00:09:25.88,>> JEFF: Fishing items. >> Wow.
144,00:09:28.12,00:09:28.12,>> JEFF: Worms. >> Yeah!
145,00:09:30.25,00:09:30.25,">> JEFF: Filet knife. Lots of hooks, corks, weights,"
146,00:09:36.00,00:09:36.00,"twine. Because, in addition to the"
147,00:09:39.17,00:09:39.17,"crocs, there are lots of fish in that lake."
148,00:09:41.83,00:09:41.83,"Yaxha, you have one extra member."
149,00:09:43.96,00:09:43.96,You're sitting somebody out. Keeping mind you cannot sit
150,00:09:46.33,00:09:46.33,out the same person in back-to- back challenges.
151,00:09:48.46,00:09:48.46,"Who's sitting out? Amy, You're going to sit this"
152,00:09:50.12,00:09:50.12,one out? >> Right.
153,00:09:52.38,00:09:52.38,>> Take your spots. Wait for my go.
154,00:09:55.25,00:09:55.25,">> JEFF: All right, guys. First two up at the red start."
155,00:09:58.21,00:09:58.21,"Jamie and Bobby Jon. Here we go, for reward."
156,00:10:02.54,00:10:02.54,Survivors ready. Go!
157,00:10:05.17,00:10:05.17,">> Go, Jamie! >> Go, go, go!"
158,00:10:07.79,00:10:07.79,">> Jamie! >> There you go, Jamie, you got"
159,00:10:12.17,00:10:12.17,it. >> Go up the center.
160,00:10:14.04,00:10:14.04,Go up the center. >> Jamie!
161,00:10:16.12,00:10:16.12,>> JEFF: Jamie making quick work of it.
162,00:10:18.04,00:10:18.04,Bobby Jon trying to hang on. Jamie at his bag.
163,00:10:20.92,00:10:20.92,Bobby Jon closing in on a bag. >> Jamie!
164,00:10:23.88,00:10:23.88,>> JEFF: Jamie has his bag. He's in the water and heading
165,00:10:25.83,00:10:25.83,back. Bobby Jon right behind.
166,00:10:28.67,00:10:28.67,"He's got his bag. >> Come on, Jamie!"
167,00:10:30.54,00:10:30.54,>> JEFF: He's in the water heading back.
168,00:10:32.17,00:10:32.17,">> Yeah, Jamie, come on! >> Come on, Jamie!"
169,00:10:34.54,00:10:34.54,Nice work! >> JEFF: Brian on the course for
170,00:10:38.08,00:10:38.08,Yaxha. Bobby Jon taking a long time
171,00:10:41.08,00:10:41.08,"getting back, losing a lot of ground for Nakum."
172,00:10:44.00,00:10:44.00,">> Let's go, Bobby Jon! Brian going straight up the big"
173,00:10:46.50,00:10:46.50,rope. >> Go Brian!
174,00:10:49.46,00:10:49.46,">> JEFF: Cindy on the course for Nakum, a lot of ground to make"
175,00:10:52.46,00:10:52.46,"up. >> Go, Cindy!"
176,00:10:55.08,00:10:55.08,>> JEFF: Brian going for a near bag.
177,00:10:57.33,00:10:57.33,">> Come on, Brian! You got it, baby!"
178,00:10:59.38,00:10:59.38,>> JEFF: Cindy right on top of Brian.
179,00:11:01.46,00:11:01.46,">> Good girl! >> JEFF: Brian has a bag, Cindy"
180,00:11:04.12,00:11:04.12,"has a bag. >> Come on, Brian!"
181,00:11:05.54,00:11:05.54,>> JEFF: Cindy made up a lot of time for Nakum.
182,00:11:08.08,00:11:08.08,">> Yeah, Cindy! >> JEFF: Cindy giving Nakum the"
183,00:11:11.12,00:11:11.12,lead. Blake and Stephenie on the
184,00:11:14.96,00:11:14.96,"course. Trying to figure out a strategy,"
185,00:11:21.33,00:11:21.33,"best way to work this web. Blake moving quickly, Steph"
186,00:11:24.21,00:11:24.21,"fighting hard. >> Come on, Steph!"
187,00:11:27.42,00:11:27.42,Steph knows what bag she's going for.
188,00:11:30.21,00:11:30.21,"Blake at his bag, trying to untie it."
189,00:11:32.75,00:11:32.75,"Stephenie at her bag, trying to untie it."
190,00:11:35.50,00:11:35.50,Blake has his. Stephenie has hers!
191,00:11:37.75,00:11:37.75,We're still dead-even with the third bag.
192,00:11:40.25,00:11:40.25,Stephenie first up the ladder. Yaxha is back in the lead now.
193,00:11:45.08,00:11:45.08,">> Here we go, guys! You're doing great!"
194,00:11:48.58,00:11:48.58,>> JEFF: Gary for Yaxha. Brandon out for Nakum.
195,00:11:55.92,00:11:55.92,Yaxha with a bit of a lead. Gary is gonna have to make his
196,00:11:58.79,00:11:58.79,way deep for a deep bag. Brandon really working the
197,00:12:02.04,00:12:02.04,"course, going all the way to the back, Gary right there with him."
198,00:12:05.21,00:12:05.21,"Both Gary and Brandon untying their bags, Brandon has his."
199,00:12:09.75,00:12:09.75,He's heading back. >> JEFF: Gary has his bag and a
200,00:12:15.25,00:12:15.25,big splash in the water. Margaret on the course for
201,00:12:19.46,00:12:19.46,"Nakum. >> Come on, Gary."
202,00:12:22.04,00:12:22.04,>> JEFF: Gary back with the fourth bag for Yaxha.
203,00:12:24.62,00:12:24.62,Rafe on the course for Yaxha. Rafe knows right where he's
204,00:12:28.96,00:12:28.96,heading. Margaret untying her bag.
205,00:12:33.08,00:12:33.08,">> Let's go, Margaret! >> JEFF: She has it... Nakum"
206,00:12:36.08,00:12:36.08,still with the lead. Rafe struggling to hang on.
207,00:12:39.21,00:12:39.21,">> You got it, Rafe! >> JEFF: Rafe can't hang on."
208,00:12:42.54,00:12:42.54,"That's going to hurt Yaxha. >> Come on, Rafe!"
209,00:12:45.21,00:12:45.21,>> JEFF: Margaret able to get a bag.
210,00:12:47.42,00:12:47.42,Rafe unable to get a bag. Could be the difference.
211,00:12:50.17,00:12:50.17,">> Come on, Rafe. >> JEFF: Rafe struggling to get"
212,00:12:53.21,00:12:53.21,"up the ladder. Nakum, now with a one-bag lead."
213,00:12:56.12,00:12:56.12,Judd on the course for Nakum. Judd takes a header into the
214,00:12:59.08,00:12:59.08,net. Rafe still cannot get back up
215,00:13:02.04,00:13:02.04,"the ladder. >> Come on, Rafe."
216,00:13:04.42,00:13:04.42,">> Come on, Rafe! >> JEFF: Rafe, got to pull"
217,00:13:06.71,00:13:06.71,"yourself up. Judd, hanging on."
218,00:13:09.67,00:13:09.67,Getting inventive. He's still in.
219,00:13:11.75,00:13:11.75,">> Come on, Rafe! Yaxha losing a lot of ground."
220,00:13:15.79,00:13:15.79,">> Come on, Rafe. >> JEFF: Rafe's finally up."
221,00:13:21.38,00:13:21.38,Four days and no water really taking its toll.
222,00:13:25.12,00:13:25.12,">> Come on, Rafe! Morgan on the course trying to"
223,00:13:28.71,00:13:28.71,"make up some ground. >> Go, Morgan!"
224,00:13:31.25,00:13:31.25,"Nakum leads five bags-four. >> Judd, he's dropped."
225,00:13:34.79,00:13:34.79,Drop. >> JEFF: Judd is in the water.
226,00:13:37.50,00:13:37.50,Judd cannot get a bag. A chance for Yaxha to catch up.
227,00:13:40.79,00:13:40.79,Morgan needs to get a bag on this one.
228,00:13:44.08,00:13:44.08,Judd heading back. Danni on the course for Nakum.
229,00:13:47.12,00:13:47.12,">> Come on, Morgan, you got this!"
230,00:13:49.58,00:13:49.58,>> JEFF: Bags are deep on the course.
231,00:13:52.12,00:13:52.12,"It's a lot of climbing now. >> Yes, Morgan, yes!"
232,00:13:54.75,00:13:54.75,">> JEFF: Morgan's at a bag. >> Come on, Danni."
233,00:13:57.71,00:13:57.71,>> JEFF: Morgan has the fifth bag for Yaxha.
234,00:14:00.92,00:14:00.92,Got to get back quickly. Brianna waiting for her shot.
235,00:14:03.79,00:14:03.79,">> Good job, good job, good job! >> JEFF: We are tied five bags"
236,00:14:07.33,00:14:07.33,each. Brianna on the course for Yaxha.
237,00:14:10.04,00:14:10.04,">> Here we go, Brianna! >> JEFF: All the bags now at the"
238,00:14:13.04,00:14:13.04,far end of the spider web. Brianna-- got to hang on.
239,00:14:16.58,00:14:16.58,>> You can do it! >> JEFF: Brianna can't hang on.
240,00:14:19.38,00:14:19.38,"Once again, Yaxha unable to get a bag."
241,00:14:22.83,00:14:22.83,Big advantage for Nakum. Brianna has got to get back.
242,00:14:25.79,00:14:25.79,">> Let's go, Danni! >> JEFF: Lydia on the course for"
243,00:14:29.75,00:14:29.75,Yaxha. Maybe she can get a bag.
244,00:14:33.08,00:14:33.08,Danni has a bag. >> Danni!
245,00:14:36.04,00:14:36.04,">> Come on, girl! Come on, Danni!"
246,00:14:39.25,00:14:39.25,"Get the last! Come on, let's go!"
247,00:14:41.62,00:14:41.62,>> JEFF: Danni coming back with the sixth bag for Nakum.
248,00:14:43.83,00:14:43.83,">> Come on, Danni! Come on, girl!"
249,00:14:45.54,00:14:45.54,>> JEFF: Nakum leads six bags to five.
250,00:14:47.83,00:14:47.83,"Brooke on the course for Nakum. >> Go, Brooke!"
251,00:14:50.25,00:14:50.25,>> JEFF: Lydia at a bag for Yaxha.
252,00:14:52.50,00:14:52.50,Working around the outside of the course.
253,00:14:54.46,00:14:54.46,Lydia with the sixth bag for Yaxha.
254,00:14:57.58,00:14:57.58,>> Yeah! >> JEFF: Brooke got a bag now!
255,00:14:59.92,00:14:59.92,">> Come on, Lydia! >> JEFF: We are tied six bags"
256,00:15:02.79,00:15:02.79,each. Jamie on the course.
257,00:15:05.96,00:15:05.96,"Brooke untying the knot. >> Come on, Brooke!"
258,00:15:09.12,00:15:09.12,">> JEFF: Brooke has it. >> Go, go, go."
259,00:15:11.42,00:15:11.42,>> JEFF: Lets herself in the water.
260,00:15:13.21,00:15:13.21,"Jamie now with his bag, Brooke trying to get up the"
261,00:15:15.62,00:15:15.62,ladder. Can't slow down now.
262,00:15:18.50,00:15:18.50,Jamie has his bag. Jamie in the water.
263,00:15:22.21,00:15:22.21,Jamie made up a tremendous amount of time.
264,00:15:27.29,00:15:27.29,We are tied seven bags each. Blake on the course.
265,00:15:31.46,00:15:31.46,Brian now on the course. Coming down to the final bag.
266,00:15:35.38,00:15:35.38,"Blake making up a lot of time. Blake at the eighth bag, Brian"
267,00:15:41.08,00:15:41.08,"got to get back to that bag, time is slipping away, Brian"
268,00:15:45.00,00:15:45.00,trying to get there as fast as he can.
269,00:15:47.04,00:15:47.04,"Blake has his bag, Brian at his bag."
270,00:15:49.75,00:15:49.75,Got to get it untied. Brian has his bag.
271,00:15:52.71,00:15:52.71,Brian and Blake both in the water with the last bags.
272,00:15:55.92,00:15:55.92,Fishing gear at stake. It's gonna be a race to the
273,00:15:59.00,00:15:59.00,finish. Blake pulling himself up the
274,00:16:01.75,00:16:01.75,"ladder. >> Come on, Brian."
275,00:16:04.25,00:16:04.25,>> JEFF: Brian has got to move. Got to move.
276,00:16:12.08,00:16:12.08,Nakum wins reward! >> ( cheering )
277,00:16:20.21,00:16:20.21,">> JEFF: Nakum, obviously, you could use some food, fishing"
278,00:16:25.12,00:16:25.12,"gear, worms. Hopefully that will help you in"
279,00:16:27.33,00:16:27.33,that endeavor. Good effort.
280,00:16:29.33,00:16:29.33,"Yaxha, close. Both tribes have been neck-and-"
281,00:16:32.08,00:16:32.08,"neck in every challenge so far, four days in."
282,00:16:34.92,00:16:34.92,Doesn't get you anything on this one.
283,00:16:38.17,00:16:38.17,"Head on back. All right, guys, grab your"
284,00:16:43.04,00:16:43.04,"stuff, head on out. >> We decided that we were going"
285,00:17:11.00,00:17:11.00,"to go fishing with our newly acquired fishing gear, so, you"
286,00:17:14.88,00:17:14.88,"know, we got up at the butt-crack of dawn."
287,00:17:20.21,00:17:20.21,"We're like, all right, we're gonna get us a big fish."
288,00:17:26.92,00:17:26.92,>> That steady on...? >> Nice!
289,00:17:32.58,00:17:32.58,">> Good job. >> Today, we were just so ready"
290,00:17:36.54,00:17:36.54,to get on the boat. I wanted to get out there and
291,00:17:39.12,00:17:39.12,fish so bad. I'm feeling better a little bit
292,00:17:41.08,00:17:41.08,right now. I'm not panting as much.
293,00:17:43.62,00:17:43.62,Just as long as I'm competitive and I can play like I did
294,00:17:46.62,00:17:46.62,"yesterday, I'm good. >> I got one, I got one."
295,00:17:50.62,00:17:50.62,">> Yes, yes! >> Breakfast."
296,00:18:10.17,00:18:10.17,What do you think's in these things?
297,00:18:12.62,00:18:12.62,">> Maybe we should have some corn, what do you think?"
298,00:18:14.79,00:18:14.79,>> Excellent. I was going to suggest that.
299,00:18:16.46,00:18:16.46,It'd be such a treat. >> Yaxha is in desperation food
300,00:18:20.12,00:18:20.12,"mode right now. Everything out here we will try,"
301,00:18:24.12,00:18:24.12,at least once. What is that?
302,00:18:26.67,00:18:26.67,"Oh, wow! Does anyone want to eat a"
303,00:18:28.33,00:18:28.33,grasshopper? >> No.
304,00:18:30.29,00:18:30.29,>> That's a grasshopper? >> That's a grasshopper.
305,00:18:33.21,00:18:33.21,>> That's a huge grasshopper. >> It's a busy morning.
306,00:18:40.75,00:18:40.75,"Everybody is working, except for right now, I would say Morgan is"
307,00:18:44.17,00:18:44.17,the one that's not doing as much around the camp as everybody
308,00:18:46.79,00:18:46.79,"else. I love Morgan, but you've got to"
309,00:18:49.92,00:18:49.92,work around camp if you want tribe mates to be on your side.
310,00:18:53.04,00:18:53.04,">> ( swishing water ) >> I'm making a cove inlet, as"
311,00:19:06.50,00:19:06.50,you can see. It's pretty wide and a little
312,00:19:10.38,00:19:10.38,opening in the front there... And after everything settles
313,00:19:14.12,00:19:14.12,I'll cover it up with a burlap sack and I'll catch a little
314,00:19:16.50,00:19:16.50,protein. We need some protein.
315,00:19:20.92,00:19:20.92,>> You want to eat ants? >> I thought it was going to be
316,00:19:25.08,00:19:25.08,"termites. >> Yeah, I thought it was going"
317,00:19:27.92,00:19:27.92,"to be, too, but those are ants. >> We need protein."
318,00:19:29.88,00:19:29.88,>> I'll eat ants. Let's do it.
319,00:19:31.46,00:19:31.46,">> Okay, go. >> I don't know."
320,00:19:35.21,00:19:35.21,>> Where did you get that nest thing from?
321,00:19:38.08,00:19:38.08,">> Was there like millions? >> I mean, we've probably got"
322,00:19:41.62,00:19:41.62,like 200 ants here. >> Rafe and Gary decided to go
323,00:19:45.83,00:19:45.83,"get an ant nest because ants are apparently full of protein,"
324,00:19:50.08,00:19:50.08,which is so nasty. >> What do you think?
325,00:19:52.42,00:19:52.42,"I can't believe I'm eating ants >> Ants can't bite, can they?"
326,00:19:55.58,00:19:55.58,>> Yep. >> Oh.
327,00:19:58.12,00:19:58.12,>> Mine almost had like a nice little zing to them.
328,00:20:01.04,00:20:01.04,I'm not going to be eating ants As long as I have corn and water
329,00:20:04.83,00:20:04.83,that's what I'll sustain myself on until I win a food challenge.
330,00:20:10.00,00:20:10.00,>> You have any luck down there with the burlap sack?
331,00:20:13.04,00:20:13.04,>> Ten little minnows. >> You got ten minnows?
332,00:20:15.92,00:20:15.92,">> Little tiny guys, but it's something."
333,00:20:18.04,00:20:18.04,>> That's a minnow each! >> You are a work horse.
334,00:20:21.00,00:20:21.00,"I think we need you. >> What do you think, fish"
335,00:20:23.58,00:20:23.58,"monger, how long does a fish like this go?"
336,00:20:25.12,00:20:25.12,>> Fry it to a crisp. >> We don't need those hooks
337,00:20:28.08,00:20:28.08,"and lines. >> Cheers, cheers."
338,00:20:30.46,00:20:30.46,>> Enjoy. >> Oh! Mm-mm!
339,00:20:34.42,00:20:34.42,">> You know what they say, the way to a man's heart is through"
340,00:20:37.88,00:20:37.88,their stomachs. Tastes like trout on a grill.
341,00:20:44.54,00:20:44.54,>> ( breathing deeply ) ( mumbling )
342,00:21:02.04,00:21:02.04,( belches ) >> Let me tell you something
343,00:21:06.67,00:21:06.67,about Blake. He does basically nothing in
344,00:21:09.17,00:21:09.17,"camp. I mean, the guy's a great guy,"
345,00:21:11.29,00:21:11.29,but he does nothing in camp. And then you got Margaret just
346,00:21:13.33,00:21:13.33,"nurturing him all day. >> Every time I turn around,"
347,00:21:22.04,00:21:22.04,that's all I hear: Sit down and relax.
348,00:21:24.38,00:21:24.38,"Get some water. Sit down, relax, get some water."
349,00:21:27.08,00:21:27.08,"And I'm saying to myself, damn, how much more relaxing does this"
350,00:21:31.50,00:21:31.50,"dude need, man? The guy sleeps all day, man,"
351,00:21:35.96,00:21:35.96,"you know. I'm getting screwed, man, me and"
352,00:21:38.58,00:21:38.58,you bringing this damn water up and going up there all...
