,begin,end,subtitles_text
343,00:21:59.96,00:21:59.96,"nice... ""Like, I want to massageeverybody."""
344,00:22:02.42,00:22:02.42,But you know there's a littleextra something going into
345,00:22:04.58,00:22:04.58,"Austin and Nick's massages.>> Is there a teacher, Misty, or"
346,00:22:07.92,00:22:07.92,"is this just your natural,evolved method?"
347,00:22:10.04,00:22:10.04,">> It's my natural, evolvedmethod."
348,00:22:12.33,00:22:12.33,Is it working?>> I think it is.
349,00:22:14.38,00:22:14.38,">> Okay.>> We work well together, 'cause"
350,00:22:16.38,00:22:16.38,"she has, like, that southern,kind of flirty charm, and I'm"
351,00:22:19.04,00:22:19.04,"just, like, the pal, you know?Like, ""What's up, guys?"
352,00:22:22.08,00:22:22.08,"Let's hang out.""I think between the two of us,"
353,00:22:24.50,00:22:24.50,"we're doing okay.>> Look, man, if we get into"
354,00:22:27.25,00:22:27.25,"this four strong into the merge,we're already ahead."
355,00:22:31.17,00:22:31.17,"Then can we pretend like we'reweak-- ""Oh, weak ladies."
356,00:22:33.88,00:22:33.88,"We just want to go as far as wecan."""
357,00:22:36.42,00:22:36.42,"I mean, I don't think it's goingto come to that, 'cause they're"
358,00:22:38.75,00:22:38.75,"smart guys, but...>> You're so cute."
359,00:22:40.62,00:22:40.62,"I mean, you're, like, ""Come on.We're just little girls."""
360,00:22:42.62,00:22:42.62,">> We're just little girls.>> ""We just want to get as far"
361,00:22:44.62,00:22:44.62,"as we can."">> I am in a position that I"
362,00:22:54.79,00:22:54.79,didn't necessarily want to bein.
363,00:22:58.17,00:22:58.17,"I'm the one that everybody'skind of come to, saying, ""Hey,"
364,00:23:00.58,00:23:00.58,"we really trust you.Um, we need you on our side."""
365,00:23:05.04,00:23:05.04,It could be construed as verydangerous to align yourself with
366,00:23:07.12,00:23:07.12,"strong guys, especially when Ihave two girls who seem to"
367,00:23:10.58,00:23:10.58,really trust me and-and thinkthat I'm a really good guy.
368,00:23:14.58,00:23:14.58,>> How are we doing here?>> Good job.
369,00:23:17.46,00:23:17.46,">> My goal is to keep working onAustin and to keep, you know,"
370,00:23:20.67,00:23:20.67,"showing him that as much aspossible, Terry is a power"
371,00:23:23.71,00:23:23.71,"player, and he's going to havea huge mark on his back, and it"
372,00:23:25.88,00:23:25.88,might be wiser for those guys toalign themselves with us in case
373,00:23:28.33,00:23:28.33,they make it to the merge.They're going to need us.
374,00:23:30.33,00:23:30.33,"We'll see what happens.>> PROBST: Come on in, guys!"
375,00:23:45.04,00:23:45.04,"We'll now bring in Bruce, onceagain returning from Exile"
376,00:23:48.50,00:23:48.50,"Island.>> Boy, Bruce!"
377,00:23:51.12,00:23:51.12,>> Let's go.>> Bring it back.
378,00:23:58.21,00:23:58.21,>> Nice to have you back...>> PROBST: You guys ready to get
379,00:24:03.29,00:24:03.29,to today's challenge?>> Yeah!
380,00:24:05.17,00:24:05.17,">> PROBST: First things first.Dan, say good-bye."
381,00:24:11.96,00:24:11.96,"Immunity, back up for grabs.Today's challenge is going to be"
382,00:24:15.71,00:24:15.71,"a physical, head-to-head battle.There are five circles in the"
383,00:24:20.71,00:24:20.71,sand.Buried within each circle is a
384,00:24:23.50,00:24:23.50,"bag.On my go, you'll race out to the"
385,00:24:26.21,00:24:26.21,"circle, dig and find the bag,and then get back to your finish"
386,00:24:29.83,00:24:29.83,mat.That's where it's going to get
387,00:24:31.75,00:24:31.75,physical.Both tribes will be battling for
388,00:24:33.92,00:24:33.92,"the same bag.To score, you got to have at"
389,00:24:36.33,00:24:36.33,least one hand on the bag whileany part of your body touches
390,00:24:39.21,00:24:39.21,the finish mat.First tribe to three wins
391,00:24:43.04,00:24:43.04,"immunity.Losers, somebody going home."
392,00:24:46.12,00:24:46.12,The matchups will vary fromround to round.
393,00:24:49.17,00:24:49.17,Drop your gear.We'll get started.
394,00:24:53.29,00:24:53.29,"All right, here we go.First round is two women taking"
395,00:24:56.46,00:24:56.46,on two women.It's going to be Cirie and
396,00:24:58.54,00:24:58.54,Danielle taking on Sallyand Misty.
397,00:25:02.25,00:25:02.25,"For immunity, survivors ready?Go!"
398,00:25:05.62,00:25:05.62,">> Go, go, go!Go, go, go!"
399,00:25:07.54,00:25:07.54,>> PROBST: Got to find the bagand get it back to your mat.
400,00:25:09.17,00:25:09.17,">> Good, Cirie. Stay there.Be ready to knock 'em down."
401,00:25:11.17,00:25:11.17,">> Stay there, Cirie.>> PROBST: It's getting physical"
402,00:25:12.88,00:25:12.88,"quickly.>> Danielle, push Misty down!"
403,00:25:16.62,00:25:16.62,>> PROBST: Misty and Daniellegetting into it.
404,00:25:18.25,00:25:18.25,">> Keep her down, Danielle!>> I see it."
405,00:25:22.21,00:25:22.21,">> Sit on her, Cirie.Sit on... Cirie."
406,00:25:24.38,00:25:24.38,>> PROBST: Cirie sitting onSally now.
407,00:25:27.46,00:25:27.46,>> PROBST: They found the bag.Danielle has it.
408,00:25:29.67,00:25:29.67,">> Cirie, go help!>> PROBST: Cirie gets up and"
409,00:25:31.92,00:25:31.92,lets Sally go.Cirie takes Misty down.
410,00:25:35.17,00:25:35.17,>> Cirie!>> PROBST: Cirie's got it.
411,00:25:37.75,00:25:37.75,"Now it's Cirie and Sally.>> There you are, Misty."
412,00:25:40.33,00:25:40.33,>> PROST: Misty doing her bestto take it from Cirie.
413,00:25:43.71,00:25:43.71,">> There you go, Misty!>> PROBST: Nobody giving up."
414,00:25:45.46,00:25:45.46,"Everybody fighting hard.>> That's a cross right, Sally."
415,00:25:49.08,00:25:49.08,Excellent.>> PROBST: Danielle trying to
416,00:25:53.50,00:25:53.50,get free of Sally.Danielle shoves Sally down.
417,00:25:56.38,00:25:56.38,">> Help her out!>> Come on, D., get it! Get it!"
418,00:25:59.12,00:25:59.12,>> PROBST: It's a free-for-allon the bag again.
419,00:26:01.25,00:26:01.25,(all talking at once)Danielle has it.
420,00:26:03.33,00:26:03.33,Misty's down.Cirie wants it!
421,00:26:06.62,00:26:06.62,"(indistinct, overlappingchatter)"
422,00:26:09.04,00:26:09.04,Cirie's got to touch the mat andthe bag!
423,00:26:11.46,00:26:11.46,(cheering)Casaya scores first point!
424,00:26:14.04,00:26:14.04,>> Yes! Yes!>> PROBST: Next round is two men
425,00:26:18.88,00:26:18.88,taking on two men.Got Nick and Terry taking on
426,00:26:21.62,00:26:21.62,Bruce and Bobby.Survivors ready?
427,00:26:25.96,00:26:25.96,Go!Bruce tries to tackle Terry and
428,00:26:29.46,00:26:29.46,Nick.It doesn't work.
429,00:26:32.83,00:26:32.83,Bobby throws Terry out of theway.
430,00:26:35.21,00:26:35.21,Bruce working on Nick.Very physical very quickly.
431,00:26:39.21,00:26:39.21,Terry and Bobby going at it.>> Terry!
432,00:26:41.92,00:26:41.92,">> Get him, Bob!>> Okay, Bobby, it's here."
433,00:26:44.54,00:26:44.54,">> PROBST: Nick has position.>> Use that karate, Bruce!"
434,00:26:48.17,00:26:48.17,"(groans)>> Okay, Bobby, get up now!"
435,00:26:50.17,00:26:50.17,">> Bobby, get up.>> Come on, Bobby!"
436,00:26:52.25,00:26:52.25,>> PROBST: Terry is not lettingBobby move.
437,00:26:56.46,00:26:56.46,"Nick has the bag, and he's free.>> Get him, Bob!"
438,00:26:59.12,00:26:59.12,"Get him, Bob!>> PROBST: Nick's got it!"
439,00:27:01.25,00:27:01.25,(whooping and applause)La Mina scores.
440,00:27:05.46,00:27:05.46,"We're tied, one-one.Next round is two men, one"
441,00:27:09.62,00:27:09.62,"woman.For Casaya, it's Shane, Courtney"
442,00:27:13.08,00:27:13.08,"and Aras.For La Mina-- Austin, Ruth Marie"
443,00:27:16.75,00:27:16.75,and Dan.Survivors ready?
444,00:27:20.21,00:27:20.21,"Go!>> Go, Aras!"
445,00:27:22.25,00:27:22.25,">> Get him, Courtney!(grunts)"
446,00:27:25.42,00:27:25.42,">> PROBST: Shane tries to takeout Dan, but Dan fighting back."
447,00:27:28.21,00:27:28.21,(grunts)Shane tosses Dan down hard.
448,00:27:32.00,00:27:32.00,">> Oh, Aras!>> PROBST: Austin and Aras."
449,00:27:36.00,00:27:36.00,"Aras has the bag quickly.>> Go, Aras!"
450,00:27:38.62,00:27:38.62,>> PROBST: Austin takes himdown.
451,00:27:40.92,00:27:40.92,The bag was found fast.Shane and Dan are out of it.
452,00:27:43.71,00:27:43.71,"Ruth Marie getting in on it.>> Shane, help..."
453,00:27:47.12,00:27:47.12,>> PROBST: Aras trying to get itto Shane.
454,00:27:48.96,00:27:48.96,">> Shane, help him. Shane!>> PROBST: Shane has it."
455,00:27:51.62,00:27:51.62,"It's Shane and Austin!>> Come on, Shane!"
456,00:27:54.04,00:27:54.04,Come on!>> PROBST: Ruth Marie and
457,00:27:56.83,00:27:56.83,Courtney are out of it.Aras and Dan are out of it.
458,00:27:59.04,00:27:59.04,">> Keep him there, Danny!Come on!"
459,00:28:00.67,00:28:00.67,">> One on one, Aus. Let's go!>> PROBST: Shane, inch by inch,"
460,00:28:04.42,00:28:04.42,"getting closer.>> You got it, Shane?"
461,00:28:07.21,00:28:07.21,">> Come on, Aus! Come on, Aus!>> Way to go, Shane!"
462,00:28:10.00,00:28:10.00,>> PROBST: Now Austin pullingShane back toward the middle.
463,00:28:12.29,00:28:12.29,Could go either way.>> PROBST: Austin scores for La
464,00:28:16.58,00:28:16.58,Mina!(cheering)
465,00:28:20.38,00:28:20.38,">> PROBST: Next round, twowomen, one man."
466,00:28:23.08,00:28:23.08,"Courtney, Cirie, Aras taking onSally, Misty and Nick."
467,00:28:28.75,00:28:28.75,We're playing to three.La Mina leads two-one.
468,00:28:31.17,00:28:31.17,Survivors ready?Go!
469,00:28:34.12,00:28:34.12,>> Take your time now.Take your time.
470,00:28:36.08,00:28:36.08,">> Oh, they're relaxing.You relax. Don't use energy."
471,00:28:39.71,00:28:39.71,>> PROBST: Different strategythis time.
472,00:28:41.42,00:28:41.42,Everybody taking their time.Everybody watching everybody.
473,00:28:46.83,00:28:46.83,">> Okay, Aras, come here.>> PROBST: Cirie found the bag."
474,00:28:51.67,00:28:51.67,Nick's pulling it up now.Aras pulling Nick out.
475,00:28:55.58,00:28:55.58,">> Run, Courtney!>> PROBST: Courtney's got it if"
476,00:28:57.17,00:28:57.17,"she can get free.>> Come on, Courtney!"
477,00:28:59.25,00:28:59.25,"Pull, Courtney! You got it!>> PROBST: Nick will got give up"
478,00:29:01.67,00:29:01.67,"the bag.>> Come on, Nick! Get up, buddy!"
479,00:29:04.38,00:29:04.38,>> PROBST: Aras trying to stealit.
480,00:29:06.21,00:29:06.21,">> Come on, Aras!>> Aras, fight!"
481,00:29:08.04,00:29:08.04,">> Misty, take out Aras!>> PROBST: Misty trying to take"
482,00:29:11.04,00:29:11.04,"out Aras, and she does.(overlapping chatter)"
483,00:29:15.33,00:29:15.33,>> Nick!>> PROBST: All six in on this.
484,00:29:18.38,00:29:18.38,One big game of Twister.>> Stop choking me!
485,00:29:22.08,00:29:22.08,">> PROBST: Misty, watch thechoke."
486,00:29:24.25,00:29:24.25,"Don't make me call it.No choking, guys!"
487,00:29:27.29,00:29:27.29,"Watch the kicking.>> Cirie, pull Misty."
488,00:29:30.21,00:29:30.21,Push Misty back!>> PROBST: Cirie tosses Misty
489,00:29:32.54,00:29:32.54,"off.>> Aras, bring me the bag!"
490,00:29:39.00,00:29:39.00,>> PROBST: Aras using somelittle yoga move.
491,00:29:41.04,00:29:41.04,Aras has the bag!>> Bring me the bag!
492,00:29:45.21,00:29:45.21,I told you to bring me the bag!(cheering)
493,00:29:49.75,00:29:49.75,">> PROBST: Casaya scores.We're tied, two-two."
494,00:29:52.62,00:29:52.62,(whooping)We are tied.
495,00:29:55.96,00:29:55.96,This is the final round.It's going to be one man and
496,00:29:58.79,00:29:58.79,one woman from each tribe.It's going to be Bobby and
497,00:30:02.12,00:30:02.12,Danielle taking on Ruth Marieand Terry for immunity.
498,00:30:07.04,00:30:07.04,This is it.Survivors ready?
499,00:30:10.25,00:30:10.25,"Go!>> Go, Bob! Go, Bob, go!"
500,00:30:14.62,00:30:14.62,">> Terry, keep your eye on Bob!>> PROBST: Danielle picks up"
501,00:30:18.04,00:30:18.04,Ruth Marie...(indistinct shout)
502,00:30:20.17,00:30:20.17,>> PROBST: ...and drops her.>> Oh!
503,00:30:23.58,00:30:23.58,"(Terry grunts)>> Bob, get Terry!"
504,00:30:27.08,00:30:27.08,>> Throw him!>> PROBST: Bobby trying to move
505,00:30:29.79,00:30:29.79,"Terry out of the way.>> Come on, Bobby!"
506,00:30:33.12,00:30:33.12,>> PROBST: Bobby pulling the bagout.
507,00:30:35.21,00:30:35.21,Bobby's got it.Terry almost had it free.
508,00:30:38.25,00:30:38.25,">> Danielle, grab the bag!>> PROBST: Danielle with a hand"
509,00:30:41.33,00:30:41.33,"on the bag now.>> Get it, Bob!"
510,00:30:43.29,00:30:43.29,>> PROBST: Terry's got the bag.Bobby trying to take him down.
511,00:30:48.17,00:30:48.17,Terry not going down.Bobby grabs him!
512,00:30:51.04,00:30:51.04,(indistinct shouting)Takes him back down again.
513,00:30:54.58,00:30:54.58,>> Which one?>> PROBST: Terry hands off to
514,00:30:57.12,00:30:57.12,"Ruth Marie.>> Hey, Ruth Marie!"
515,00:30:59.92,00:30:59.92,">> PROBST: She's got to outraceBobby, who is lagging behind."
516,00:31:02.25,00:31:02.25,Ruth Marie getting closer.Bobby grabs her.
517,00:31:07.04,00:31:07.04,He's dragging her to his mat.Bobby wins it for Casaya!
518,00:31:11.12,00:31:11.12,(cheering)>> Bobby!
519,00:31:13.62,00:31:13.62,">> Oh, Bobby!>> Yeah!"
520,00:31:19.21,00:31:19.21,>> PROBST: Casaya-- safe fromTribal Council.
521,00:31:22.25,00:31:22.25,"Nobody going home.La Mina, you'll get your first"
522,00:31:25.25,00:31:25.25,visit as a tribe to TribalCouncil tonight.
523,00:31:27.67,00:31:27.67,Somebody going home.You have the afternoon to
524,00:31:30.00,00:31:30.00,figure out who that's gonna be.Head on out.
525,00:31:41.83,00:31:41.83,"♪ ♪>> That was... guys, we gave"
526,00:32:00.04,00:32:00.04,it... we did everything wecould.
527,00:32:02.25,00:32:02.25,">> Losing feels terrible, buttoday's loss was hard."
528,00:32:06.42,00:32:06.42,"It was hard because it wasphysical, and we gave it"
529,00:32:08.38,00:32:08.38,"everything we had, and it wasclose."
530,00:32:10.12,00:32:10.12,They have so much more weightthan we do.
531,00:32:12.08,00:32:12.08,">> Yeah, that was tailor-madefor them."
532,00:32:14.33,00:32:14.33,>> It totally is a bummer.My goal was to bring this tribe
533,00:32:16.96,00:32:16.96,"intact to the merge, and now wegot to make a tough decision."
534,00:32:19.83,00:32:19.83,"I'm bummed that we've got tolose one of our tribe mates, but"
535,00:32:23.54,00:32:23.54,"the game moves on, and there'salways tomorrow."
536,00:32:49.08,00:32:49.08,">> Dan and I, as soon as we gotthe two younger guys, we got on"
537,00:32:51.71,00:32:51.71,them quickly and came up withwho we're going to have to vote
538,00:32:56.96,00:32:56.96,off tonight.And the plan at Tribal Council
539,00:32:59.17,00:32:59.17,tonight is to vote off Misty.She's an engineer.
540,00:33:06.08,00:33:06.08,She's smart as hell.And she could cause some
541,00:33:08.62,00:33:08.62,trouble.>> I would look at it
542,00:33:18.58,00:33:18.58,personally and say Ruth Marieor Dan.
543,00:33:20.96,00:33:20.96,"I love Ruth Marie, but I justthink down the road, as far as"
544,00:33:25.38,00:33:25.38,"contribution, like Dan mightnot be the fastest guy, but look"
545,00:33:28.88,00:33:28.88,"at him today, he did awesome.And he's so brilliant."
546,00:33:31.88,00:33:31.88,He's so brilliant.>> I can't vote for Dan.
547,00:33:34.21,00:33:34.21,">> Good, then that's easy.>> Yeah."
548,00:33:39.38,00:33:39.38,">> If I take myself out of itand I say who is going to,"
549,00:33:42.04,00:33:42.04,"like, who is going tocontribute the most in all"
550,00:33:45.12,00:33:45.12,"areas, Dan is high up on thelist."
551,00:33:47.88,00:33:47.88,>> Yeah.>> Ruth Marie is pretty weak
552,00:33:51.25,00:33:51.25,"right now.I mean, she's struggling."
553,00:33:53.33,00:33:53.33,"Like, she's been struggling fora couple days."
554,00:33:56.75,00:33:56.75,"Right now, I think it would bemost advantageous to us as a"
555,00:33:59.58,00:33:59.58,"tribe, and also to myself, forit to be Ruth Marie."
556,00:34:04.12,00:34:04.12,(Dan sighs)>> You got thrown between a rock
557,00:34:16.04,00:34:16.04,"and a hard place, didn't you?>> Yep."
558,00:34:19.21,00:34:19.21,">> Yeah, it happens to me everyday, bro."
559,00:34:22.00,00:34:22.00,"My two options I have,personally-- and when I say"
560,00:34:25.58,00:34:25.58,"""personally"" I'm linked toNick-- we could either go with"
561,00:34:28.88,00:34:28.88,"Sally and Misty, or we go withDan and Terry."
562,00:34:34.12,00:34:34.12,I have the makings right now toget all the way to where I want
563,00:34:38.62,00:34:38.62,to be in this game because ofthe way that I'm aligned.
564,00:35:00.12,00:35:00.12,">> PROBST: For those of you whodon't have torches, grab a"
565,00:35:03.38,00:35:03.38,"torch, approach the flame, dipyour torch in, and get fire."
566,00:35:09.08,00:35:09.08,This is part of the ritual atTribal Council because in this
567,00:35:12.71,00:35:12.71,"game, fire represents your life.As long as you have fire,"
568,00:35:15.88,00:35:15.88,"you're in the game.When your fire is gone, so are"
569,00:35:18.17,00:35:18.17,"you.So, catch me up."
570,00:35:23.88,00:35:23.88,"Terry, eight days out here,compared to the experiences"
571,00:35:27.12,00:35:27.12,"you've had in life, where doesthis rank in terms of tough?"
572,00:35:30.08,00:35:30.08,>> It's definitely up there onthe physical side.
573,00:35:32.17,00:35:32.17,"On the mental side, not thereyet, I'm sure it will be."
574,00:35:35.83,00:35:35.83,And I'm ready for what comesdown the road.
575,00:35:37.71,00:35:37.71,">> PROBST: How about you, Dan?You hanging in there?"
576,00:35:40.54,00:35:40.54,">> Oh, absolutely.There's certainly deprivation"
577,00:35:42.83,00:35:42.83,"involved, and it's difficult togo many, many days without"
578,00:35:47.12,00:35:47.12,"food, but the companionship isexcellent."
579,00:35:49.12,00:35:49.12,For strangers to come togetherand work together so well so
580,00:35:52.21,00:35:52.21,"fast, that's impressive.>> PROBST: Sally, how about the"
581,00:35:57.25,00:35:57.25,first eight days for you?>> The first eight days for me
582,00:36:00.33,00:36:00.33,have been everything I thoughtthey could be.
583,00:36:04.17,00:36:04.17,Other than the fact that Ididn't think I would come in
584,00:36:06.46,00:36:06.46,here and actually care aboutthese people as much as I could
585,00:36:09.08,00:36:09.08,"in eight days.>> PROBST: Austin, what's the"
586,00:36:11.62,00:36:11.62,"food situation?>> The X factor, Terry caught a"
587,00:36:14.67,00:36:14.67,fish yesterday that was nobigger than this.
588,00:36:17.12,00:36:17.12,"But, man, when you haven't hadany protein in days, that will"
589,00:36:20.21,00:36:20.21,do wonders for you.I am by no means a strong
590,00:36:23.33,00:36:23.33,"fisherman, and all we can catchare the puffer fish, which,"
591,00:36:25.96,00:36:25.96,those things are poisonous.So we just hadn't had any luck
592,00:36:29.00,00:36:29.00,"Jeff, it sucks.>> PROBST: Well, what are you"
593,00:36:31.25,00:36:31.25,doing with the spear?>> We had a little incident with
594,00:36:33.21,00:36:33.21,"the spear.We, uh... the spear hasn't been"
595,00:36:36.12,00:36:36.12,"much luck for us, let's just putit that way."
596,00:36:38.54,00:36:38.54,">> PROBST: Misty, looking atthis tribe, it seems like,"
597,00:36:41.83,00:36:41.83,"based on today, guys that are inpretty good shape."
598,00:36:44.25,00:36:44.25,">> Oh, yeah.>> PROBST: Is there a pressure"
599,00:36:47.79,00:36:47.79,"from the women that, ""We haveto live up to this""?"
600,00:36:50.17,00:36:50.17,>> I think in any situationwhen you've got a mixed group
601,00:36:53.04,00:36:53.04,"like this, there's always apressure that we've got to step"
602,00:36:56.33,00:36:56.33,up to the plate and play justas well as the men are.
603,00:36:59.12,00:36:59.12,>> PROBST: Do you truly thinkall seven people here are all
604,00:37:01.83,00:37:01.83,"playing for this tribe?>> I absolutely believe that,"
605,00:37:05.29,00:37:05.29,"100%, wholeheartedly.And that's something I didn't"
606,00:37:08.12,00:37:08.12,expect coming into this game.I expected to have the little
607,00:37:10.25,00:37:10.25,"sects of people, you know,trying to pretend to pull"
608,00:37:14.08,00:37:14.08,"together and make a team out ofit, but we don't have that"
609,00:37:16.08,00:37:16.08,"issue, we really are a team.>> PROBST: So, Terry, if you"
610,00:37:20.04,00:37:20.04,"really are this unified, how doyou make a vote tonight?"
611,00:37:25.08,00:37:25.08,Are people coming here andmaking individual votes and
612,00:37:27.25,00:37:27.25,"we'll just see what happens?>> Obviously, there's been some"
613,00:37:30.00,00:37:30.00,talk.It's all part of the game to
614,00:37:31.33,00:37:31.33,"talk to different people onwhat their feeling is, and we"
615,00:37:34.17,00:37:34.17,all understand that someone hasto go tonight.
616,00:37:38.33,00:37:38.33,">> PROBST: Ruth Marie, you'rethe only person in this tribe"
617,00:37:41.17,00:37:41.17,that came into this tribewithout somebody.
618,00:37:44.08,00:37:44.08,"Did you feel that initially?>> I noticed that right away,"
619,00:37:46.92,00:37:46.92,"Jeff, yeah, um...I'm definitely the odd man out."
620,00:37:51.04,00:37:51.04,And it's a... it's a vulnerableseat to be in tonight.
621,00:37:55.88,00:37:55.88,">> PROBST: How about for you,Nick?"
622,00:37:58.00,00:37:58.00,Are you basing your vote onwhat you think?
623,00:38:00.62,00:38:00.62,You basing it on a group?>> I'm basing my vote on
624,00:38:03.71,00:38:03.71,probably more... with a grouptonight.
625,00:38:08.04,00:38:08.04,There's conversations in camp.There's strategy being plotted.
626,00:38:11.79,00:38:11.79,"So, yeah, I think tonight morethan individually, I'm going"
627,00:38:15.29,00:38:15.29,"with the group.>> PROBST: Okay, there is one"
628,00:38:18.38,00:38:18.38,"more thing to deal with, thehidden immunity idol."
629,00:38:21.92,00:38:21.92,"Misty, you're the only personfrom this tribe to go to Exile"
630,00:38:23.96,00:38:23.96,"Island.If, after the vote, you have"
631,00:38:26.96,00:38:26.96,"the most votes, that is whenyou would reveal whether or not"
632,00:38:29.67,00:38:29.67,"you found the idol.Otherwise, it remains a mystery."
633,00:38:33.33,00:38:33.33,"Okay, it is time to vote.Austin, you're up."
634,00:38:53.12,00:38:53.12,>> This is just team play.That's all.
635,00:39:06.25,00:39:06.25,">> Misty, you're a smart girl.I wish it didn't have to be"
636,00:39:10.25,00:39:10.25,this way.>> I'm going with the strength
637,00:39:25.08,00:39:25.08,of the tribe and we think thatyou're probably the least
638,00:39:27.50,00:39:27.50,"strong member of the triberight now, and I'm very sorry."
639,00:39:37.29,00:39:37.29,>> PROBST: I'll go tally thevotes.
640,00:39:49.25,00:39:49.25,">> PROBST: Once the votes areread, the decision is final."
641,00:39:51.75,00:39:51.75,The person voted out will beasked to leave the Tribal
642,00:39:54.04,00:39:54.04,Council area immediately.I'll read the votes.
643,00:39:57.62,00:39:57.62,First vote...Ruth Marie.
644,00:40:02.92,00:40:02.92,"Misty.One vote Misty, one vote Ruth"
645,00:40:05.38,00:40:05.38,Marie.Ruth Marie.
646,00:40:11.21,00:40:11.21,"Two votes Ruth, one vote Misty.Misty."
647,00:40:17.88,00:40:17.88,"We're tied-- two votes Misty,two votes Ruth Marie."
648,00:40:22.54,00:40:22.54,"Misty.That's three votes Misty, two"
649,00:40:24.67,00:40:24.67,votes Ruth Marie.Third person voted out of
650,00:40:31.38,00:40:31.38,Survivor: Exile Island...Misty.
651,00:40:35.17,00:40:35.17,"Misty, that's enough votes.One question left: Did you find"
652,00:40:37.46,00:40:37.46,"the immunity idol?>> No, I did not."
653,00:40:45.25,00:40:45.25,>> PROBST: You need to bring meyour torch.
654,00:40:55.08,00:40:55.08,"Misty, the tribe has spoken.It's time for you to go."
655,00:41:12.54,00:41:12.54,"Well, based on what Iheard tonight, it does seem like"
656,00:41:15.96,00:41:15.96,"you're a very unified tribe.But as the vote tonight shows,"
657,00:41:20.21,00:41:20.21,"even in the tightest of groups,somebody is always on the"
658,00:41:24.12,00:41:24.12,"outside.Grab your torches, head on back"
659,00:41:26.21,00:41:26.21,to camp.Good night.
660,00:41:29.42,00:41:29.42, Captioning sponsored by Media Access Group at WGBH 
661,00:41:37.42,00:41:37.42,access.wgbh.org>> PROBST: Stay tuned for scenes
662,00:41:46.08,00:41:46.08,from our next episode.>> PROBST: Next time on
663,00:41:51.33,00:41:51.33,Survivor: La Mina is on the verge of starvation.
664,00:41:53.50,00:41:53.50,>> Ten days in and we reallyhaven't had anything to eat.
665,00:41:55.29,00:41:55.29,>> I figure we got about threemore days before the entire
666,00:41:58.04,00:41:58.04,tribe can't get out of bed.>> PROBST: And at Casaya...
667,00:42:00.96,00:42:00.96,>> What are you talking about?>> We're not going to have this
668,00:42:02.46,00:42:02.46,discussion.>> PROBST: ...friction rattles
669,00:42:04.29,00:42:04.29,the alliance of four.>> Everybody here won't tell
670,00:42:06.25,00:42:06.25,"you, they're afraid to tell youthe truth."
671,00:42:14.79,00:42:14.79,">> Well, tonight was definitelya shock to me."
672,00:42:17.12,00:42:17.12,"I didn't expect it so soon,that's for sure."
673,00:42:20.21,00:42:20.21,"I was excited, and exuberant,and I thought we had a great"
674,00:42:23.42,00:42:23.42,"thing going, so obviously I wasoutplayed and out-strategized."
675,00:42:26.62,00:42:26.62,"I had a good time out here.I met some great, great people,"
676,00:42:29.96,00:42:29.96,and I wish my tribe all theluck.
677,00:42:31.33,00:42:31.33,I hope they go all the way.
