,begin,end,subtitles_text
0,00:00:00.00,00:00:00.00,">> JEFF PROBST: 36 days ago, 16"
1,00:00:10.00,00:00:10.00,Americans set foot on asmall remote island off the
2,00:00:13.17,00:00:13.17,coast of Panama...Welcome to Survivor.
3,00:00:15.71,00:00:15.71,"In a new social experiment, theywere split into four tribes:"
4,00:00:19.62,00:00:19.62,"the younger men, the youngerwomen, the older men and the"
5,00:00:23.00,00:00:23.00,"older women.And in a new twist, this"
6,00:00:25.96,00:00:25.96,isolated isle would become alooming force in the strategy of
7,00:00:29.75,00:00:29.75,the game.This is Exile Island.
8,00:00:32.08,00:00:32.08,"Throughout this game, tribemembers will be banished to this"
9,00:00:35.25,00:00:35.25,"island. Go!In the first challenge, the"
10,00:00:37.54,00:00:37.54,young women finish last andchose Misty to stay behind on
11,00:00:41.21,00:00:41.21,Exile Island...>> I'm here.
12,00:00:42.83,00:00:42.83,>> PROBST: ...and a secret wasrevealed.
13,00:00:44.75,00:00:44.75,Hidden on this island is animmunity idol.
14,00:00:48.25,00:00:48.25,"Along the way, you'll be givenclues as to the whereabouts"
15,00:00:51.17,00:00:51.17,"of that idol.>> Okay, here we go kids."
16,00:00:55.58,00:00:55.58,>> PROBST: The two older tribesfared well.
17,00:00:57.17,00:00:57.17,>> That's the best stinking fireI've seen in a long time.
18,00:01:00.83,00:01:00.83,>> PROBST: The two youngertribes floundered.
19,00:01:03.71,00:01:03.71,">> That's a shelter right there,gentleman."
20,00:01:05.38,00:01:05.38,>> That is the sorriest shelterI think we could have possibly
21,00:01:08.17,00:01:08.17,come up with.>> PROBST: Misty failed to find
22,00:01:10.17,00:01:10.17,the hidden idol on Exile Islandand rejoined her tribe...
23,00:01:14.12,00:01:14.12,Young women doing a good job....to play for immunity.
24,00:01:17.21,00:01:17.21,(cheering)Older women going to Tribal
25,00:01:21.50,00:01:21.50,Council!Cirie immediately undertook a
26,00:01:25.54,00:01:25.54,bold plan to get the mostproductive of the older women
27,00:01:28.58,00:01:28.58,ousted.>> I'm gonna try to get rid of
28,00:01:32.04,00:01:32.04,the lumberjack lady.First person voted out of
29,00:01:34.83,00:01:34.83,Survivor: Exile Island...The plan worked and Tina was the
30,00:01:37.79,00:01:37.79,first to be voted out.The tribe has spoken.
31,00:01:42.21,00:01:42.21,"From the beginning, theexperience of survival took its"
32,00:01:45.08,00:01:45.08,toll.>> I smoked three packs of
33,00:01:50.29,00:01:50.29,"cigarettes a day for 20 years,and I haven't had a cigarette"
34,00:01:54.25,00:01:54.25,"in, like, 31 hours.I don't know why I did this to"
35,00:01:56.88,00:01:56.88,myself.>> Green sweats.
36,00:01:58.62,00:01:58.62,>> PROBST: In a schoolyardpick...
37,00:02:00.21,00:02:00.21,>> Cool guy....that brought new hope.
38,00:02:01.67,00:02:01.67,>> The cool guy.>> PROBST: ...the four tribes
39,00:02:03.25,00:02:03.25,became two: La Mina and Casaya.>> Terry makes an unbelievable
40,00:02:10.25,00:02:10.25,catch!La Mina enjoyed an early winning
41,00:02:13.29,00:02:13.29,streak.La Mina wins immunity!
42,00:02:15.96,00:02:15.96,"Casaya, Tribal Council tonight.It's gonna cost you a member."
43,00:02:19.17,00:02:19.17,"Before Casaya went to Tribal Council, Shane wanted to quit."
44,00:02:23.75,00:02:23.75,>> I'm gonna quit.I have to quit.
45,00:02:25.67,00:02:25.67,>> PROBST: But Aras managed tochange his mind.
46,00:02:27.38,00:02:27.38,">> Just try it, okay?>> All right."
47,00:02:29.25,00:02:29.25,>> PROBST: With Shane back inthe fold...
48,00:02:31.17,00:02:31.17,">> You guys, now we have to talkabout who we're gonna vote off."
49,00:02:33.79,00:02:33.79,"I just want to do this withhonesty and, like, openness."
50,00:02:36.46,00:02:36.46,>> PROBST: ...it became clearthat Melinda and Cirie were
51,00:02:38.92,00:02:38.92,doomed.>> I don't care which one of you
52,00:02:41.12,00:02:41.12,"goes.Like, whoever doesn't go now is"
53,00:02:43.29,00:02:43.29,going next.>> PROBST: Melinda went first...
54,00:02:45.17,00:02:45.17,"Melinda, the tribe has spoken....and Cirie's situation seemed"
55,00:02:49.21,00:02:49.21,hopeless.>> I'm walking on egg shells as
56,00:02:51.58,00:02:51.58,it is.I was told I'd be the next to
57,00:02:54.00,00:02:54.00,go. You were right.>> PROBST: But her social skills
58,00:02:56.17,00:02:56.17,and patience would take her faras she sat back and watched
59,00:02:59.54,00:02:59.54,Casaya fall apart.>> Why are you so sensitive?!
60,00:03:03.54,00:03:03.54,>> PROBST: Shane was usually thecatalyst for drama at Casaya.
61,00:03:06.96,00:03:06.96,>> Everybody here won't tell youbecause they're afraid to tell
62,00:03:10.00,00:03:10.00,you the truth!I want one! This one!
63,00:03:12.71,00:03:12.71,"I just want mine!>> It's just constant, constant"
64,00:03:16.08,00:03:16.08,"drama.I love it, love it, love it,"
65,00:03:18.04,00:03:18.04,yes!>> Right there!
66,00:03:20.12,00:03:20.12,>> PROBST: But the dysfunctionalCasaya enjoyed an impressive
67,00:03:22.50,00:03:22.50,five-challenge winning streak.Casaya wins immunity!
68,00:03:27.38,00:03:27.38,And La Mina lost Misty and RuthMarie.
69,00:03:31.00,00:03:31.00,"Casaya sent Terry to ExileIsland, and he quickly turned"
70,00:03:34.33,00:03:34.33,banishment into a position ofpower.
71,00:03:37.04,00:03:37.04,">> ""This talisman canbe used to keep you safe from"
72,00:03:39.29,00:03:39.29,"the vote at Tribal Council.""All right!"
73,00:03:43.00,00:03:43.00,>> PROBST: His possession of theidol-- or the suspicion that he
74,00:03:45.88,00:03:45.88,might have it-- would affect thenature of the game up to the
75,00:03:48.58,00:03:48.58,"very end.Terry, Danielle diving in."
76,00:03:50.92,00:03:50.92,And Terry's luck continued whenLa Mina managed to win the next
77,00:03:54.00,00:03:54.00,immunity challenge.La Mina wins immunity!
78,00:03:58.58,00:03:58.58,"Bruce was in serious danger ofbeing chopped from Casaya, but"
79,00:04:02.21,00:04:02.21,"Danielle made a power play.>> Courtney, why don't we switch"
80,00:04:05.08,00:04:05.08,this game up right now?I wanted Bruce to stay and I
81,00:04:08.08,00:04:08.08,wanted Bobby to go.>> PROBST: Bruce was saved and
82,00:04:11.25,00:04:11.25,Bobby took the fall.The tribe has spoken.
83,00:04:15.17,00:04:15.17,>> That's it. That's it.>> PROBST: Casaya was able to
84,00:04:17.12,00:04:17.12,make a comeback.Casaya wins immunity!
85,00:04:20.04,00:04:20.04,"And at Tribal Council, Dan wasvoted out."
86,00:04:23.79,00:04:23.79,"The tribe has spoken.On day 16, Casaya had the"
87,00:04:28.29,00:04:28.29,advantage in numbers; six to LaMina's four.
88,00:04:32.12,00:04:32.12,>> There they are.>> PROBST: And when the Casaya
89,00:04:33.71,00:04:33.71,six saw La Mina approaching forthe merge...
90,00:04:35.67,00:04:35.67,">> Hey, come here quickly.>> PROBST: ...they circled up"
91,00:04:38.00,00:04:38.00,"against them.>> We stay together, we'll get"
92,00:04:39.58,00:04:39.58,"to the top six.One, two, three, win."
93,00:04:42.21,00:04:42.21,Come on in.>> PROBST: Terry did his best to
94,00:04:44.04,00:04:44.04,get someone from Casaya to flop.>> You might be on the chopping
95,00:04:47.08,00:04:47.08,block.Come over and we will go to the
96,00:04:49.25,00:04:49.25,final five.Our group of four would like to
97,00:04:51.54,00:04:51.54,offer you more time of worry-free life around here.
98,00:04:54.04,00:04:54.04,>> PROBST: But nobody fromCasaya would budge...
99,00:04:55.96,00:04:55.96,>> It was almost laughable.I don't think he's in a position
100,00:04:58.83,00:04:58.83,to offer me anything.>> PROBST: ...so his only option
101,00:05:01.79,00:05:01.79,was individual immunity.Terry wins the first individual
102,00:05:05.67,00:05:05.67,"immunity.And in an amazing feat, Terry"
103,00:05:08.29,00:05:08.29,the fighter pilot continued todominate at the individual
104,00:05:11.12,00:05:11.12,challenges.With Terry perpetually safe from
105,00:05:14.88,00:05:14.88,the vote and with the hiddenimmunity idol in his back
106,00:05:17.54,00:05:17.54,"pocket, the other former La Minatribe mates were picked off one"
107,00:05:21.00,00:05:21.00,by one.Nick.
108,00:05:22.71,00:05:22.71,Austin.Sally.
109,00:05:24.50,00:05:24.50,Terry was the last La Minamember standing.
110,00:05:27.17,00:05:27.17,"On day 25, a prickly rewardchallenge revealed what the"
111,00:05:31.54,00:05:31.54,tribe really thought of eachother.
112,00:05:33.92,00:05:33.92,"""Who is the most annoying personout here?"""
113,00:05:37.25,00:05:37.25,"Everybody says ""Courtney."">> God!"
114,00:05:39.25,00:05:39.25,>> PROBST: But Courtney'sunpopularity made her a popular
115,00:05:41.46,00:05:41.46,"candidate for the final two.>> If I need your vote, would"
116,00:05:45.12,00:05:45.12,you trust me and not break myback?
117,00:05:46.79,00:05:46.79,">> You know, I want to be onyour back side and I would like"
118,00:05:49.62,00:05:49.62,you to be on mine.>> Okay. She is a dream to
119,00:05:51.96,00:05:51.96,take to the final two.Anyone could win against her.
120,00:05:55.00,00:05:55.00,"(groans)>> PROBST: On day 25, Bruce's"
121,00:05:57.58,00:05:57.58,internal pain became a medicalemergency.
122,00:06:00.29,00:06:00.29,>> Bruce? You allergic to anything?
123,00:06:02.04,00:06:02.04,(gasps)>> PROBST: He was evacuated and
124,00:06:04.00,00:06:04.00,forced to leave the game.Terry continued to hang on with
125,00:06:09.21,00:06:09.21,all his might.(gasps)
126,00:06:11.62,00:06:11.62,Terry wins his fourth straightimmunity.
127,00:06:15.62,00:06:15.62,>> I am totally motivated tokick their butts at everything
128,00:06:18.04,00:06:18.04,that comes down the road.I'm gonna have to take you to
129,00:06:20.75,00:06:20.75,"the bank the whole time.>> If you do that, man, hats'"
130,00:06:23.92,00:06:23.92,off.>> PROBST: And he stayed true
131,00:06:25.33,00:06:25.33,to his word.Terry wins immunity for the
132,00:06:28.50,00:06:28.50,fifth straight time!The day of reckoning finally
133,00:06:32.25,00:06:32.25,came when the former Casayaswere forced to turn on one of
134,00:06:35.29,00:06:35.29,"their own, and Shane targetedDanielle."
135,00:06:38.17,00:06:38.17,>> We're gonna vote offDanielle.
136,00:06:40.17,00:06:40.17,>> But then there's stillCourtney.
137,00:06:41.67,00:06:41.67,"It'll be me, you and Courtney.>> Right."
138,00:06:43.38,00:06:43.38,>> PROBST: Shane's plan madeCirie suspicious.
139,00:06:46.33,00:06:46.33,">> If he can take Courtney tothe final two, he just may win"
140,00:06:49.21,00:06:49.21,a million dollars.So Courtney's going.
141,00:06:51.17,00:06:51.17,">> PROBST: And at TribalCouncil, Cirie's scheme took"
142,00:06:54.17,00:06:54.17,"Courtney out of the equation.Courtney, the tribe has spoken."
143,00:06:57.92,00:06:57.92,"With the former Casaya bondfinally broken, it became"
144,00:07:01.17,00:07:01.17,every man for himself.Terry and Shane banded together
145,00:07:05.42,00:07:05.42,in another attempt to oustDanielle.
146,00:07:09.71,00:07:09.71,>> She's depressed because sheknows she's next.
147,00:07:11.50,00:07:11.50,>> PROBST: And they wereconfident they would be
148,00:07:13.50,00:07:13.50,"successful.>> I feel like, at this point, I"
149,00:07:15.33,00:07:15.33,could beat anybody.>> PROBST: But at Tribal
150,00:07:17.12,00:07:17.12,Council...The 12th person voted out of
151,00:07:19.21,00:07:19.21,Survivor: Exile Island.Shane was completely blindsided
152,00:07:22.96,00:07:22.96,"by Cirie, Aras and Danielle.>> Oh, my God, I'm gonna have a"
153,00:07:26.71,00:07:26.71,"chocolate ice cream bar in aboutone, I mean, one minute!"
154,00:07:31.08,00:07:31.08,">> PROBST: Shane, the tribe hasspoken."
155,00:07:34.50,00:07:34.50,"...leaving Aras, Danielle, Terryand Cirie as the final four."
156,00:07:40.62,00:07:40.62,"Go!At the next reward challenge,"
157,00:07:43.00,00:07:43.00,the rivalry between Terry andAras got physical.
158,00:07:45.75,00:07:45.75,"Whoa! Easy, guys!Two battering rams!"
159,00:07:50.83,00:07:50.83,And when Aras won the reward...Aras wins reward!
160,00:07:54.25,00:07:54.25,>> Yes!>> PROBST: ...things got
161,00:07:55.54,00:07:55.54,personal.>> The first time out we we were
162,00:07:57.38,00:07:57.38,only allowed one pass.>> PROBST: Yes.
163,00:07:59.12,00:07:59.12,">> Terry, every time somebodyelse wins, are you gonna say you"
164,00:08:01.33,00:08:01.33,got hosed?>> Keep it up. Just keep it up.
165,00:08:03.21,00:08:03.21,">> PROBST: For the reward, Araschose Cirie to join him on a"
166,00:08:06.54,00:08:06.54,luxury yacht.>> Hopefully both of us making
167,00:08:08.83,00:08:08.83,"final three.>> Final two. What, are you"
168,00:08:10.96,00:08:10.96,"joking?>> Yeah, final two."
169,00:08:12.04,00:08:12.04,>> PROBST: Danielle and Terrywere both sent to Exile Island
170,00:08:15.38,00:08:15.38,where they made their own pactto the final two.
171,00:08:18.00,00:08:18.00,>> I'm not here to make friends.I'm here to win the million
172,00:08:21.04,00:08:21.04,dollars.It's the right time to align
173,00:08:23.12,00:08:23.12,myself with Terry.>> PROBST: At the immunity
174,00:08:25.71,00:08:25.71,challenge...Go!
175,00:08:26.88,00:08:26.88,"...all four fought hard to piecetogether a win, but Aras came"
176,00:08:30.17,00:08:30.17,away victorious.Aras wins immunity!
177,00:08:33.58,00:08:33.58,First time somebody other thanTerry is wearing individual
178,00:08:37.08,00:08:37.08,immunity.With Aras immune and Terry in
179,00:08:39.08,00:08:39.08,"possession of the hidden idol, Danielle and Cirie knew it could"
180,00:08:42.08,00:08:42.08,be a tricky Tribal Council.>> Probably Aras and Cirie are
181,00:08:46.00,00:08:46.00,"gonna vote me, and then me andTerry would vote Cirie."
182,00:08:49.54,00:08:49.54,So I think me and you are goingup against something tonight?
183,00:08:53.17,00:08:53.17,">> Probably fire.>> You know the technique,"
184,00:08:55.50,00:08:55.50,right?>> PROBST: With the possibility
185,00:08:57.08,00:08:57.08,"of a tie vote looming, Terry andAras coach their allies in"
186,00:09:00.33,00:09:00.33,fire-making.>> Just take the flint and
187,00:09:02.58,00:09:02.58,"you...>> PROBST: Meanwhile, Danielle"
188,00:09:05.17,00:09:05.17,still pushed Terry to give herhis hidden immunity idol.
189,00:09:08.21,00:09:08.21,">> If I have two and she hastwo, I think it doesn't matter"
190,00:09:10.96,00:09:10.96,if you have the idol.>> It's a huge gamble.
191,00:09:14.25,00:09:14.25,>> I'm gonna work him until wego to Tribal Council to try to
192,00:09:17.21,00:09:17.21,give me that hidden immunityidol.
193,00:09:19.17,00:09:19.17,>> PROBST: This was Terry's lastchance to play the hidden
194,00:09:22.04,00:09:22.04,immunity idol...We have a tie: Cirie with two
195,00:09:25.12,00:09:25.12,"votes, Danielle with two votes....but he kept it for himself."
196,00:09:28.54,00:09:28.54,Cirie and Danielle prepared fora trial by fire.
197,00:09:31.75,00:09:31.75,Here we go.Survivors ready?
198,00:09:33.46,00:09:33.46,"Now only four remain: Cirie,Aras, Danielle and Terry."
199,00:09:38.25,00:09:38.25,"Begin.Tonight, the tiebreaker between"
200,00:09:40.79,00:09:40.79,"Cirie and Danielle will bedecided, and the final three"
201,00:09:44.08,00:09:44.08,will compete in the lastimmunity challenge.
202,00:09:46.67,00:09:46.67,"Two will go on to face the jury,one will outlast all the rest"
203,00:09:51.46,00:09:51.46,and become the sole Survivor. Captioning sponsored by
204,00:09:56.42,00:09:56.42, CBS PARAMOUNT NETWORK TELEVISION
205,00:10:00.54,00:10:00.54,"(theme music plays)>> PROBST: Okay, Danielle,"
206,00:11:10.08,00:11:10.08,"Cirie, you're going to takepart in a tie-breaker challenge."
207,00:11:13.17,00:11:13.17,"You each have in your kit, amagnesium flint, you have a"
208,00:11:17.17,00:11:17.17,"knife, and you have all sortsof kindling and other ways to"
209,00:11:20.08,00:11:20.08,"start a fire-- coconut husks,things like that."
210,00:11:23.38,00:11:23.38,"On my ""go,"" you will begin.First person to burn through"
211,00:11:29.12,00:11:29.12,that rope and raise the flagstays in this game.
212,00:11:32.50,00:11:32.50,Here we go.Survivors ready?
213,00:11:37.83,00:11:37.83,Begin.Both Danielle and Cirie
214,00:11:44.29,00:11:44.29,scraping magnesium.Both are using coconut husks.
215,00:11:53.04,00:11:53.04,Cirie has a flame.Can she keep it going?
216,00:12:00.58,00:12:00.58,Danielle not giving up.Danielle not panicking.
217,00:12:04.12,00:12:04.12,Cirie has a healthy flame allof a sudden.
218,00:12:07.12,00:12:07.12,Trying to keep it going beforeit burns out.
219,00:12:09.38,00:12:09.38,"Danielle now has flame, but itgoes out."
220,00:12:12.17,00:12:12.17,You have to build a fire with aflame high enough to burn
221,00:12:15.21,00:12:15.21,through that rope.Just putting more coconut husk
222,00:12:18.33,00:12:18.33,on it may not be enough.Now it's Danielle who has flame.
223,00:12:26.00,00:12:26.00,Danielle has a big flame.Is it enough to burn through
224,00:12:29.25,00:12:29.25,the rope?Danielle blowing on it to keep
225,00:12:32.08,00:12:32.08,it going.Cirie paying attention to
226,00:12:34.62,00:12:34.62,Danielle.Should be working on her fire.
227,00:12:40.88,00:12:40.88,Danielle's fire is out.Cirie has flame again.
228,00:12:46.29,00:12:46.29,Can she figure out how to buildit?
229,00:12:48.50,00:12:48.50,"Danielle has fire, Cirie hasfire."
230,00:12:51.04,00:12:51.04,Somebody is going to have toget a fire burning long enough
231,00:12:53.08,00:12:53.08,to burn through that rope.Cirie's is out again.
232,00:12:56.29,00:12:56.29,Danielle's is still going.Danielle has a nice little fire
233,00:13:00.21,00:13:00.21,"going.She's protecting it, going to"
234,00:13:02.21,00:13:02.21,"let it grow, using littlepieces."
235,00:13:05.96,00:13:05.96,Cirie's got to get flame again.Cirie now has a flame.
236,00:13:13.12,00:13:13.12,"Danielle putting a bigger stickon, getting closer now to the"
237,00:13:16.38,00:13:16.38,"rope, building a bigger fire.Cirie nurturing a very small"
238,00:13:22.00,00:13:22.00,flame.Can she figure this out?
239,00:13:27.12,00:13:27.12,>> Burn.>> PROBST: Cirie's getting a
240,00:13:29.75,00:13:29.75,bigger flame.It may not be enough.
241,00:13:32.17,00:13:32.17,Danielle's flame has beensitting on that rope.
242,00:13:36.25,00:13:36.25,"The rope's on fire.Cirie, you've got to hurry."
243,00:13:42.04,00:13:42.04,Danielle wins the challenge.Danielle stays in the game.
244,00:13:47.12,00:13:47.12,Cirie becomes the sixth memberof our jury.
245,00:13:57.62,00:13:57.62,">> (sniffling)>> PROBST: Cirie, you need to"
246,00:14:10.17,00:14:10.17,bring me your torch.Cirie?
247,00:14:19.58,00:14:19.58,>> Yep.>> PROBST: The tribe has spoken.
248,00:14:24.67,00:14:24.67,>> All righty.>> PROBST: It's time for you to
249,00:14:26.83,00:14:26.83,"go.>> Bye, Cirie."
250,00:14:38.04,00:14:38.04,">> PROBST: Well, you have madeit to the final three."
251,00:14:41.58,00:14:41.58,"Over the next three days, wewill have two challenges, two"
252,00:14:45.58,00:14:45.58,"Tribal Councils, one winner.Grab your torches and head back"
253,00:14:50.38,00:14:50.38,to camp.Good night.
254,00:14:57.21,00:14:57.21,">> Well, my time here is up.I lasted far beyond my highest"
255,00:15:04.17,00:15:04.17,expectations.I hope that my family is proud.
256,00:15:08.29,00:15:08.29,"Sorry, guys, I let you down.I couldn't get the fire going."
257,00:15:12.00,00:15:12.00,But I feel like I can stillhold my head up high.
258,00:15:14.67,00:15:14.67,So I'm extremely proud to beout on day 36.
259,00:15:38.50,00:15:38.50,>> I was determined to not gohome tonight at Tribal Council.
260,00:15:43.42,00:15:43.42,>> Whoa!>> I was just so happy that I
261,00:15:45.67,00:15:45.67,got it together and I got myfire going.
262,00:15:49.08,00:15:49.08,"And I won, and I'm ecstaticright now."
263,00:15:52.62,00:15:52.62,I'm so happy.>> Feed it a little bit of
264,00:15:55.54,00:15:55.54,straw.I'm going to get more straw.
265,00:15:59.08,00:15:59.08,"I've been extremely happy sinceTribal Council, period, when"
266,00:16:03.08,00:16:03.08,Danielle won.Danielle and I have a pact so
267,00:16:07.62,00:16:07.62,"that if either one of us wins,we'll take the other one to the"
268,00:16:09.75,00:16:09.75,final.So we have a 66% chance of
269,00:16:13.12,00:16:13.12,getting to the final.So we're totally stoked about
270,00:16:15.75,00:16:15.75,"that, and we're happy.Danielle and I are going to"
271,00:16:18.21,00:16:18.21,"take it to Aras, and we'regoing to go to the final."
272,00:16:38.58,00:16:38.58,">> There you go, it's got Shanehair."
273,00:16:40.75,00:16:40.75,"This idol is worth about 25cents right now, I think, in a"
274,00:16:43.54,00:16:43.54,pawn shop or something.It's not worth very much.
275,00:16:47.00,00:16:47.00,"But yeah, but that's it for thehidden immunity idol."
276,00:16:49.21,00:16:49.21,"It's no longer a part of thisgame, and I got enough wins"
277,00:16:53.17,00:16:53.17,under my belt where I didn'thave to use it.
278,00:16:56.04,00:16:56.04,"He had some jingly stuff onit, but I didn't think I could"
279,00:16:59.21,00:16:59.21,hide it very well.>> Yeah.
280,00:17:01.58,00:17:01.58,">> I flattened it out rightaway, and I kept it in my pants"
281,00:17:06.46,00:17:06.46,pocket all the time.>> You didn't bring that last
282,00:17:08.83,00:17:08.83,"night?>> Oh, yeah."
283,00:17:10.12,00:17:10.12,>> You did bring it?>> It was in my shorts.
284,00:17:11.67,00:17:11.67,>> Oh.>> It's not that bad-looking of
285,00:17:13.33,00:17:13.33,"a guy.>> I thought it was, like, a"
286,00:17:16.00,00:17:16.00,rabbit's foot.>> Mm-hmm.
287,00:17:19.04,00:17:19.04,">> Aras and I were sitting bythe fire, and Terry just kind of"
288,00:17:21.75,00:17:21.75,"took the hidden immunity idoland waved it in Aras' face, and"
289,00:17:25.17,00:17:25.17,I think Terry did thatjust to... another like strike
290,00:17:27.54,00:17:27.54,"at Aras, you know, like ha-ha, Ihad the hidden immunity idol."
291,00:17:30.79,00:17:30.79,"Ha-ha, I'm the bigger man.>> Aw, suck."
292,00:17:36.25,00:17:36.25,"Look at that, almost all theway through."
293,00:17:39.42,00:17:39.42,>> Aras and Terry'srelationship is based on
294,00:17:42.83,00:17:42.83,rivalry.It's just that macho thing.
295,00:17:49.62,00:17:49.62,"I'm definitely caught in themiddle between, you know, these"
296,00:17:52.79,00:17:52.79,two guys that have thistestosterone match every day--
297,00:17:57.58,00:17:57.58,"who can catch the biggest fish,the most fish."
298,00:18:00.71,00:18:00.71,Who can beat who?Who's better?
299,00:18:03.08,00:18:03.08,Who's the tough guy?They just... they go back and
300,00:18:05.62,00:18:05.62,forth all the time.>> Dude!
301,00:18:10.33,00:18:10.33,>> Catch one?>> Five small ones.
302,00:18:12.46,00:18:12.46,One kind of medium and foursmall.
303,00:18:15.33,00:18:15.33,>> The bad news is that Icaught freaking huge ones.
304,00:18:18.71,00:18:18.71,>> No!All right!
305,00:18:22.17,00:18:22.17,">> Oh, beautiful!>> Oh, man!"
306,00:18:24.50,00:18:24.50,">> Wait, wait, wait.>> Giving us the silent"
307,00:18:26.29,00:18:26.29,"treatment!Oh, very nice."
308,00:18:30.50,00:18:30.50,">> Good job, Aras!>> That rocks, man!"
309,00:18:33.08,00:18:33.08,Fish feast.Look at the teeth on that
310,00:18:35.42,00:18:35.42,"parrot fish.>> Terry and Aras, deep down"
311,00:18:47.00,00:18:47.00,"inside, we all know that theydon't like each other."
312,00:18:52.04,00:18:52.04,>> Eyeball socket.>> The fact that Aras beat out
313,00:18:56.75,00:18:56.75,"Terry in the past twochallenges, Terry's ready for"
314,00:19:00.79,00:19:00.79,revenge.I can see it.
315,00:19:03.88,00:19:03.88,So Aras better give him arun for his money at the
316,00:19:07.50,00:19:07.50,"immunity challenge, or elseAras will be going home."
317,00:19:22.17,00:19:22.17,">> PROBST: Come in, guys.How's it going, guys?"
318,00:19:29.83,00:19:29.83,">> Awesome.>> Hey, Jeff."
319,00:19:33.58,00:19:33.58,>> PROBST: You guys ready toget to today's challenge?
320,00:19:35.46,00:19:35.46,">> Yeah.>> PROBST: All right, well, I"
321,00:19:37.08,00:19:37.08,"know you were probably expectingan immunity challenge, but"
322,00:19:39.67,00:19:39.67,"instead, today you are playingfor reward."
323,00:19:43.08,00:19:43.08,"For today's challenge, you willrace to the top of a"
324,00:19:46.38,00:19:46.38,"three-story climbing wall,using four individually shaped"
325,00:19:50.67,00:19:50.67,pegs to help you get up there.Here's how it will work: on my
326,00:19:53.88,00:19:53.88,"""go,"" you'll make your waythrough a table maze."
327,00:19:56.25,00:19:56.25,"When you get to the end of themaze, you'll release a bag"
328,00:19:59.25,00:19:59.25,with your first two pegs.You'll then move to a spinning
329,00:20:02.50,00:20:02.50,"wheel.Read the clues, and like a"
330,00:20:05.21,00:20:05.21,"combination lock spin thewheel, clockwise and"
331,00:20:08.46,00:20:08.46,"counterclockwise, clockwiseagain until you find the one"
332,00:20:12.83,00:20:12.83,bag that contains your finaltwo pegs.
333,00:20:15.38,00:20:15.38,You will use the pegs to helpyou get to the top of the wall.
334,00:20:19.04,00:20:19.04,"Once you reach the top, placeeach of the four pegs in their"
335,00:20:23.54,00:20:23.54,individual finish slots.That will raise the flag.
336,00:20:27.92,00:20:27.92,First person to raise theirflag wins reward.
337,00:20:30.29,00:20:30.29,Want to know what you'replaying for?
338,00:20:31.79,00:20:31.79,>> Yeah.>> Yeah.
339,00:20:33.38,00:20:33.38,>> PROBST: Today's reward isdesigned specifically to give
340,00:20:35.92,00:20:35.92,the winner a huge advantage intomorrow's final immunity
341,00:20:39.83,00:20:39.83,challenge.Immediately following this
342,00:20:42.08,00:20:42.08,"challenge, the winner will sitdown and enjoy a power meal--"
343,00:20:46.25,00:20:46.25,"chicken breast, vegetables,fruit, everything your body is"
344,00:20:50.25,00:20:50.25,"craving right now.In addition, you will take back"
345,00:20:52.96,00:20:52.96,"to camp with you an individualcot, a pillow and a blanket to"
346,00:20:56.54,00:20:56.54,help you get a get good night'ssleep.
