,begin,end,subtitles_text
686,00:48:20.17,00:48:20.17,No doubt about it.When Terry and Danielle went to
687,00:48:23.58,00:48:23.58,"get water, I had my first bit ofparanoia in this game, more"
688,00:48:26.17,00:48:26.17,"than just a bit.I was, like, ""Man, what's going"
689,00:48:28.25,00:48:28.25,on?Are they talking about me?
690,00:48:29.62,00:48:29.62,"I mean, I know they're talkingabout me, but is she gonna get"
691,00:48:32.21,00:48:32.21,swayed?Is Terry gonna be able to sway
692,00:48:34.25,00:48:34.25,"her, bla-bla, bla?My mind starts racing."
693,00:48:35.58,00:48:35.58,"Like, I would just feel soburned if, like, you voted for"
694,00:48:38.17,00:48:38.17,"Terry instead of me, and mydumbass jumped off the lily pad"
695,00:48:40.58,00:48:40.58,"because you said ""Yeah,"" youknow?"
696,00:48:43.67,00:48:43.67,>> I haven't... I'm just goingover stuff in my head.
697,00:48:45.88,00:48:45.88,This is a huge decision.>> I know.
698,00:48:47.17,00:48:47.17,>> I wasn't expecting to winthis today.
699,00:48:49.25,00:48:49.25,"Like, I wasn't expecting it togo my way."
700,00:48:51.92,00:48:51.92,">> I think, honestly, I thinkyou have ten times better chance"
701,00:48:54.96,00:48:54.96,"against me than Terry, andthat's not trying to be"
702,00:48:57.12,00:48:57.12,"manipulative, but if you do voteTerry, then you lose me and"
703,00:48:59.83,00:48:59.83,Cirie anyways.>> All right.
704,00:49:12.25,00:49:12.25,>> I thought we were golden onceyou said we are.
705,00:49:15.04,00:49:15.04,">> We, we really, we pretty muchare."
706,00:49:17.08,00:49:17.08,">> Pretty much are?You can't, D, you can't do this"
707,00:49:20.12,00:49:20.12,to me.>> I need to go off by myself
708,00:49:22.04,00:49:22.04,"and just think about this.>> Either way, would you tell me"
709,00:49:24.46,00:49:24.46,either way so I don't go inlike an idiot?
710,00:49:26.67,00:49:26.67,">> Yes, yes, yes.>> And remember that you did"
711,00:49:29.08,00:49:29.08,give me your word when I was onthe lily pad.
712,00:49:31.17,00:49:31.17,">> I know, I know, I know.All right, I'll be back."
713,00:49:33.71,00:49:33.71,>> All right.>> Listening to Aras' sales
714,00:49:37.38,00:49:37.38,pitch was just mind-boggling.Aras is all about honesty and
715,00:49:41.83,00:49:41.83,"integrity, but, in the samesense, he's contradicting"
716,00:49:45.79,00:49:45.79,himself because he's basicallythreatening me.
717,00:49:48.46,00:49:48.46,">> You better bring me, I swearto God."
718,00:49:50.50,00:49:50.50,"I will be shocked if you don't,let's just say that."
719,00:49:53.92,00:49:53.92,>> All right. (groans)Part of Aras' sales pitch to me
720,00:49:58.92,00:49:58.92,"was that he would not vote forme if I took Terry, so I would"
721,00:50:02.33,00:50:02.33,"lose his vote and Cirie's vote,which I think is completely"
722,00:50:06.25,00:50:06.25,"messed up.Aras is very manipulative, so"
723,00:50:08.75,00:50:08.75,that's why I'm kinda hesitant totake him or even listen to what
724,00:50:14.21,00:50:14.21,he says because I want themillion dollars.
725,00:50:16.50,00:50:16.50,"I'm not gonna base my losing amillion dollars to, ""Oh,  told "
726,00:50:20.75,00:50:20.75,"Aras I would take him.""I'm gonna go with what I think."
727,00:50:24.04,00:50:24.04,This is how I've played thisgame so far and I believe that's
728,00:50:27.29,00:50:27.29,why I'm where I am right now.>> You know what?
729,00:50:46.33,00:50:46.33,"It's your decision to make.You won the thing today, so if"
730,00:50:49.62,00:50:49.62,"you think I'll be better totake, do that."
731,00:50:52.50,00:50:52.50,"If you think Aras would bebetter to take, do that."
732,00:50:54.88,00:50:54.88,">> Okay.>> Terry, regardless, man."
733,00:51:04.25,00:51:04.25,"It's been a pleasure.It's been a journey with you,"
734,00:51:07.75,00:51:07.75,man.Battle on.
735,00:51:37.33,00:51:37.33,>> PROBST: We'll now bring inthe members of the jury:
736,00:51:40.79,00:51:40.79,"Austin, Sally...Bruce, Courtney..."
737,00:51:47.12,00:51:47.12,Shane and Cirie.Let's talk about the final
738,00:51:57.17,00:51:57.17,"immunity challenge.The two big dogs, Terry and"
739,00:52:00.96,00:52:00.96,"Aras, don't come through,and Danielle, suddenly, you're"
740,00:52:05.12,00:52:05.12,sitting in the most enviableposition in this game.
741,00:52:07.62,00:52:07.62,How does it feel having thatimmunity necklace around you?
742,00:52:10.33,00:52:10.33,>> It feels great and it was anhonor to be able to win the most
743,00:52:15.04,00:52:15.04,"important challenge of theentire game, but the decision "
744,00:52:19.04,00:52:19.04,that I have to make tonight isone of the most difficult
745,00:52:22.29,00:52:22.29,"decisions I've probably, I willhave to make ever in my life."
746,00:52:26.46,00:52:26.46,It's like a scary feeling 'causeI'm not sure which way I want to
747,00:52:30.17,00:52:30.17,"go, and my brain is about toexplode out of my head."
748,00:52:33.08,00:52:33.08,So I just wanted them both tounderstand and respect where I'm
749,00:52:36.54,00:52:36.54,coming from and just don't hateme after this.
750,00:52:40.00,00:52:40.00,">> PROBST: Terry, you playedthis game as competitively as it"
751,00:52:44.67,00:52:44.67,can be played for 38 days.Are you able to respect the
752,00:52:48.25,00:52:48.25,position that Danielle's in?>> That part of not winning the
753,00:52:52.17,00:52:52.17,"last immunity challenge, it'sfrustrating to have come through"
754,00:52:55.08,00:52:55.08,this with both the hiddenimmunity idol and the necklace
755,00:52:57.92,00:52:57.92,most of the time.>> PROBST: So you did have the
756,00:53:00.25,00:53:00.25,"hidden immunity idol?>> Oh yeah, oh, yeah."
757,00:53:03.12,00:53:03.12,"Had that the whole time.Uh, I can separate myself"
758,00:53:07.29,00:53:07.29,because I have to.It's a different part of the
759,00:53:09.79,00:53:09.79,game than the competition side.It's a number-crunching thing.
760,00:53:13.08,00:53:13.08,"You know, I think it's in mybetter interest and her better"
761,00:53:15.67,00:53:15.67,interest to go with my side.But it's now a mental thing for
762,00:53:20.17,00:53:20.17,"her to go through, but you know,do I want to go home tonight?"
763,00:53:23.75,00:53:23.75,"No stinking way.>> PROBST: Aras, you come up to"
764,00:53:28.04,00:53:28.04,Danielle who you've been with inthe same tribe and the same
765,00:53:31.58,00:53:31.58,alliance for a long time.What do you say at this point?
766,00:53:35.50,00:53:35.50,">> To be honest with you, Ithought I was golden."
767,00:53:38.25,00:53:38.25,"And obviously, it's a bigdecision for D, I understand"
768,00:53:40.46,00:53:40.46,"that, and she's starting toworry, and then I begin to get a"
769,00:53:43.29,00:53:43.29,"little paranoid, so I just toldher, this is, like, basically"
770,00:53:45.96,00:53:45.96,"the situation, it's in both ofour best interests to be in the"
771,00:53:48.79,00:53:48.79,"final two together.We have the best shot, and"
772,00:53:51.00,00:53:51.00,that's kinda how I threw it outthere.
773,00:53:52.71,00:53:52.71,">> PROBST: Danielle, as youthink about this more and more,"
774,00:53:56.00,00:53:56.00,does it get more and morecomplicated?
775,00:53:58.12,00:53:58.12,">> Yeah, it is.I just feel like crying."
776,00:54:01.29,00:54:01.29,"Like, right after you put thenecklace around my neck, I just"
777,00:54:05.21,00:54:05.21,started thinking about it and Ihaven't stopped since...
778,00:54:07.54,00:54:07.54,"I'm still thinking about it.I mean, I'm just... Ah!"
779,00:54:12.58,00:54:12.58,"I don't know.>> PROBST: Okay, let's get to"
780,00:54:20.00,00:54:20.00,the vote.Danielle has immunity.
781,00:54:22.21,00:54:22.21,"You cannot vote for her, soAras, you can only vote for"
782,00:54:24.96,00:54:24.96,"Terry, Terry can only vote forAras."
783,00:54:27.08,00:54:27.08,Your votes cancel each otherout.
784,00:54:29.04,00:54:29.04,Danielle will be the onlyperson to vote.
785,00:54:31.04,00:54:31.04,"In doing so, you will vote the14th person out of this game and"
786,00:54:35.46,00:54:35.46,you will also decide who's gonnasit next to you at the final
787,00:54:38.42,00:54:38.42,Tribal Council.It is time to vote.
788,00:54:41.92,00:54:41.92,"Danielle, you're up.♪ ♪"
789,00:55:24.50,00:55:24.50,"I'll go get the vote.Once the votes are read, the"
790,00:55:47.67,00:55:47.67,decision is final.The person voted out will be
791,00:55:50.17,00:55:50.17,asked to leave the TribalCouncil area immediately.
792,00:55:51.88,00:55:51.88,I'll read the vote.The 14th person voted out of
793,00:55:59.67,00:55:59.67,Survivor: Exile Island...Terry. You need to bring me your
794,00:56:12.08,00:56:12.08,torch.>> Thank you.
795,00:56:15.21,00:56:15.21,">> Wow.>> PROBST: Terry, the tribe has"
796,00:56:28.71,00:56:28.71,"spoken.>> Thanks for the journey, you"
797,00:56:36.92,00:56:36.92,"guys.>> PROBST: Danielle, Aras,"
798,00:56:45.42,00:56:45.42,congratulations.You've made it as far as you can
799,00:56:47.88,00:56:47.88,go in this game.The power now shifts to the
800,00:56:50.42,00:56:50.42,jury and the decision they willultimately make.
801,00:56:54.17,00:56:54.17,You two have one more night inPanama.
802,00:56:56.92,00:56:56.92,Enjoy it.See you tomorrow for final
803,00:56:58.54,00:56:58.54,Tribal Council.Grab your torches.
804,00:57:00.25,00:57:00.25,Back to camp. Good night.>> The biggest mistake I made
805,00:57:08.04,00:57:08.04,was not keeping the game in myown hands and then relying on
806,00:57:12.42,00:57:12.42,somebody else to take care of itfor me.
807,00:57:15.42,00:57:15.42,"That's what got me.But, uh, it was not bad for a"
808,00:57:18.79,00:57:18.79,46-year-old guy.And I hope I made my friends and
809,00:57:21.21,00:57:21.21,"family proud, and Terry Dietz isnot a perfect guy, and there's"
810,00:57:25.21,00:57:25.21,"always room for better change.>> Oh, my God. Final two."
811,00:57:44.71,00:57:44.71,"D, I'm so happy!We're the two youngest people in"
812,00:57:48.62,00:57:48.62,"the game, I think.>> I know."
813,00:57:52.50,00:57:52.50,">> It was a tense, tense TribalCouncil for me, and it made"
814,00:57:55.42,00:57:55.42,getting into the final two thatmuch sweeter for me.
815,00:58:00.25,00:58:00.25,"I mean, I am ecstatic right now.I'm so happy."
816,00:58:03.21,00:58:03.21,"Oh, my God, we did it, girl.>> We did it."
817,00:58:06.04,00:58:06.04,"Do you think they were shockedthat I picked Terry, or do you"
818,00:58:08.12,00:58:08.12,think they knew that?>> I think they knew that.
819,00:58:10.12,00:58:10.12,">> Yeah.>> Oh, come here."
820,00:58:13.46,00:58:13.46,"Regardless of the results, Iplayed this game the full 39"
821,00:58:17.17,00:58:17.17,"days, I played it with integrityand I played it with a lot of"
822,00:58:20.33,00:58:20.33,"intensity, and more importantlythan anything else, I really"
823,00:58:25.42,00:58:25.42,"enjoyed myself out here.Oh, my gosh."
824,00:58:29.25,00:58:29.25,">> I can't believe it.>> I'm so glad it's me and you,"
825,00:58:31.92,00:58:31.92,too.>> I know.
826,00:58:34.33,00:58:34.33,It's great.>> Just chilling tonight.
827,00:58:37.21,00:58:37.21,">> Who would've thought, huh?>> The reason why I decided to"
828,00:58:39.58,00:58:39.58,take Aras is because Aras is apart of the former Casaya Tribe.
829,00:58:45.71,00:58:45.71,">> Whoa, everything must burn.For me at the end, to go ahead"
830,00:58:51.62,00:58:51.62,"and pick Terry over Aras, Ithink would've been a slap in"
831,00:58:55.62,00:58:55.62,"everybody's face.So, my gut choice was Aras."
832,00:58:59.75,00:58:59.75,That's just what it was and Iwent with it.
833,00:59:02.88,00:59:02.88,"That's what I've been doing thisentire game, and I think that's"
834,00:59:05.04,00:59:05.04,why I've gotten this far.I can't believe this is the last
835,00:59:08.21,00:59:08.21,night.>> The last night.
836,00:59:10.17,00:59:10.17,"Today would've been the hardestday to go home, I think,"
837,00:59:13.25,00:59:13.25,"'cause you're so close.>> Yeah, yeah."
838,00:59:15.38,00:59:15.38,My job isn't done yet.I'm still not satisfied.
839,00:59:18.33,00:59:18.33,"I'm in sales, so hopefully, Ican, uh, do some persuading to"
840,00:59:21.42,00:59:21.42,the jury and hope for the best.Because I want that million
841,00:59:26.12,00:59:26.12,"dollars, I don't want to settlefor anything less than first"
842,00:59:28.71,00:59:28.71,place.>> Ah...
843,00:59:44.71,00:59:44.71,">> Look at that.>> Oh, my God."
844,00:59:47.38,00:59:47.38,">> Get out of Dodge.>> Yay! Thank you, Lord!"
845,00:59:51.83,00:59:51.83,">> ""Congratulations.You've outwitted, outlasted and"
846,00:59:54.17,00:59:54.17,outplayed 14 others.Now there are seven who hold
847,00:59:56.88,00:59:56.88,your fate in their hands.So relax and enjoy your final
848,00:59:59.75,00:59:59.75,"day on the island, becausetonight you will be held"
849,01:00:02.12,01:00:02.12,"accountable and one of you willbe named the sole survivor."""
850,01:00:07.04,01:00:07.04,>> Oh! I'm so happy.>> We need to cook the eggs.
851,01:00:10.88,01:00:10.88,">> Yeah, we do.>> To our surprise, there was"
852,01:00:13.17,01:00:13.17,"milk, orange juice, champagne,pancake mix, eggs."
853,01:00:18.08,01:00:18.08,>> You want to have a glass oforange juice right now or do you
854,01:00:21.04,01:00:21.04,want to have a mimosa?>> Let's have a mimosa right
855,01:00:22.62,01:00:22.62,now.>> All right.
856,01:00:24.17,01:00:24.17,">> Everything that we werecraving was just right there, at"
857,01:00:27.08,01:00:27.08,tree mail.>> Thank you for this wonderful
858,01:00:29.54,01:00:29.54,food!>> Feels great.
859,01:00:32.67,01:00:32.67,I need some fat in my body rightnow.
860,01:00:35.71,01:00:35.71,">> Mmm, mmm-mmm-mmm.>> Mmm!"
861,01:00:38.21,01:00:38.21,>> This is so bomb.>> We're going to go for a walk
862,01:00:42.25,01:00:42.25,now and enjoy some champagne andput everything into perspective
863,01:00:46.17,01:00:46.17,"our last day here.You know, leave a game that"
864,01:00:49.21,01:00:49.21,sometimes didn't feel so civilin a very civil manner.
865,01:01:05.58,01:01:05.58,>> Oh!(glass shatters)
866,01:01:15.75,01:01:15.75,"(groans)>> Oh, that's nasty."
867,01:01:36.00,01:01:36.00,I've been out on those rocksmaybe a hundred times.
868,01:01:38.12,01:01:38.12,"I'm not really sure exactly howI went down, but I knew right"
869,01:01:40.71,01:01:40.71,"away something was wrong.I tried to get up, I was kind of"
870,01:01:43.42,01:01:43.42,lightheaded.I thought I was going to faint.
871,01:01:56.12,01:01:56.12,>> 39 days and Arasdoes this on the last day.
872,01:02:08.04,01:02:08.04,>> I was a little nervouswhen Aras was saying he felt
873,01:02:10.04,01:02:10.04,"faint, you know, I was getting a little nervous, 'cause I saw"
874,01:02:12.92,01:02:12.92,all the blood.>> The thought of seeing blood
875,01:02:20.21,01:02:20.21,"scares me and to actually see itgushing out like it did, freaked"
876,01:02:23.50,01:02:23.50,"me out, absolutely.So it looks like he's going to"
877,01:02:27.62,01:02:27.62,have to get some stitches.It's pretty bad.
878,01:02:38.12,01:02:38.12,>> ...I've seen better days.>> I got a cut in my back.
879,01:02:42.54,01:02:42.54,"There was a shard, I had to pullit out."
880,01:02:45.25,01:02:45.25,It was pretty deep in there.>> Drug him up.
881,01:03:07.62,01:03:07.62,>> Are you just going to numbthe whole hand?
882,01:03:10.08,01:03:10.08,">> No, just around where thelacerations are, mate."
883,01:03:12.46,01:03:12.46,Get a 23-gauge.This is going to be a bit of a
884,01:03:15.54,01:03:15.54,"sting, as you know.>> Burning."
885,01:03:22.71,01:03:22.71,>> Uh!I was trying to watch them stick
886,01:03:25.25,01:03:25.25,the needle in.I was just imagining it being
887,01:03:27.08,01:03:27.08,"myself, and it just looked sopainful."
888,01:03:30.21,01:03:30.21,">> Had to keep it interesting onday 39, you know."
889,01:03:33.04,01:03:33.04,>> Last day.>> He ended up getting three
890,01:03:37.25,01:03:37.25,"stitches on one side of hisfinger, four stitches on the"
891,01:03:39.79,01:03:39.79,"palm of his hand, and thenanother stitch on his back."
892,01:03:43.08,01:03:43.08,>> You don't think I'll feelanything tonight?
893,01:03:45.21,01:03:45.21,">> So, I mean, he got stitchedup pretty nice."
894,01:03:48.00,01:03:48.00,>> I got my butt kicked out hereby the elements.
895,01:03:51.04,01:03:51.04,I got my butt kicked by TerryDeitz a lot of the time.
896,01:03:54.04,01:03:54.04,I got my butt kicked by my ownshortsightedness-- falling down
897,01:03:57.29,01:03:57.29,on the rocks.Despite the fact that I made it
898,01:04:00.12,01:04:00.12,"39 days, I feel like my ego hasbeen crushed."
899,01:04:05.42,01:04:05.42,"I feel so stupid for falling.>> It's so funny, day 39 this"
900,01:04:25.83,01:04:25.83,happens.I just feel terrible.
901,01:04:29.92,01:04:29.92,>> Don't feel like that.It was an accident.
902,01:04:33.04,01:04:33.04,">> I wanted to, like, go out...cool thing and then I go out."
903,01:04:37.58,01:04:37.58,>> This day was definitely yourday.
904,01:04:41.17,01:04:41.17,>> My day to be a...I kind of came in as a buffoon
905,01:04:45.71,01:04:45.71,"and I kind of went out as abuffoon, and in between I did"
906,01:04:49.12,01:04:49.12,some pretty cool things.That's life.
907,01:04:52.71,01:04:52.71,"I mean, you fall, you get backup and you try again."
908,01:04:57.58,01:04:57.58,Sometimes you need to getstitched up before you can try
909,01:05:00.25,01:05:00.25,again.Falling down and hurting myself
910,01:05:05.12,01:05:05.12,"today reminded me just how humanI am, and reminded me just how"
911,01:05:08.88,01:05:08.88,"much of a game this is.What that is is saying, ""Look,"
912,01:05:12.96,01:05:12.96,"Aras, you don't have to be asuperman, you don't have to be a"
913,01:05:15.96,01:05:15.96,"superhero and you'll be okay.""And so, with that perspective,"
914,01:05:20.38,01:05:20.38,"coming into Tribal Council,maybe I'll be able to connect"
915,01:05:23.12,01:05:23.12,with people at a deeper level.That's the hope.
916,01:05:42.96,01:05:42.96,>> I can't really say there'sone thing that I've learned
917,01:05:46.17,01:05:46.17,about myself that I didn't knowcoming into this.
918,01:05:50.50,01:05:50.50,It just drew a clearer picturefor me.
919,01:05:54.04,01:05:54.04,"It let me know I'm strong,you know, I'm a strong,"
920,01:05:56.62,01:05:56.62,"independent woman, and I knew Icould get through it, and I did"
921,01:05:59.21,01:05:59.21,"it.I'm so proud of myself, I"
922,01:06:02.21,01:06:02.21,really am.I just hope people dig deep
923,01:06:06.08,01:06:06.08,tonight in the jury.I hope they pick the right
924,01:06:10.00,01:06:10.00,"person, being me.>> You all packed up?"
925,01:06:22.12,01:06:22.12,>> Yeah.It's like weird.
926,01:06:25.00,01:06:25.00,">> It is weird, isn't it?This is the last day."
927,01:06:29.62,01:06:29.62,"Come here, stand up, give me ahug."
928,01:06:33.46,01:06:33.46,"Oh, whatever happens tonight, D,I'm so happy I got to share this"
929,01:06:36.17,01:06:36.17,with you.This has been an amazing ride.
930,01:06:40.17,01:06:40.17,"And hopefully, there will be anamazing reward at the end of it."
931,01:06:44.38,01:06:44.38,But I'm just so grateful that Igot the time out here that I
932,01:06:47.42,01:06:47.42,got.I'll never forget the moments
933,01:06:50.71,01:06:50.71,"that I spent out here, and thepeople that I spent the moments"
934,01:06:53.58,01:06:53.58,with.>> PROBST: I'll now bring in the
935,01:07:21.79,01:07:21.79,"members of the jury.Austin, Sally..."
936,01:07:28.46,01:07:28.46,"Bruce, Courtney, Shane, Cirie, and Terry, voted out at"
937,01:07:36.17,01:07:36.17,the last Tribal Council.Welcome to your final Tribal
938,01:07:42.67,01:07:42.67,Council.Before we get to the proceedings
939,01:07:45.58,01:07:45.58,"tonight, Aras, you're bandagedup, what happened?"
940,01:07:49.12,01:07:49.12,>> Danielle and I were walkingout to the rocks to like spend
941,01:07:52.79,01:07:52.79,one last moment together.And these rocks I must've been
942,01:07:57.00,01:07:57.00,"on 50 times, you know,throughout this game, and I just"
943,01:08:00.17,01:08:00.17,"slipped, and I split my palm andmy pinky, and the medical team"
944,01:08:04.50,01:08:04.50,came in and stitched me up allover the place.
945,01:08:08.83,01:08:08.83,"But I'm all right now.>> PROBST: Well, the good news"
946,01:08:11.42,01:08:11.42,is you won't be going back tothat beach anymore.
947,01:08:14.50,01:08:14.50,Congratulations to you bothbecause you have done what 14
948,01:08:17.29,01:08:17.29,other people weren't able to doin this game-- make it to the
949,01:08:20.58,01:08:20.58,final two.But the power tonight shifts
950,01:08:23.92,01:08:23.92,"away from you two, overto the jury."
951,01:08:27.12,01:08:27.12,Seven people that you two eitherdirectly or indirectly had a
952,01:08:30.58,01:08:30.58,hand in voting out of this gamenow hold your fate in their
953,01:08:33.83,01:08:33.83,"hands.Tonight, they will decide who"
954,01:08:36.79,01:08:36.79,they think is most deserving ofthe title of sole survivor and
955,01:08:40.08,01:08:40.08,the million-dollar checkthat goes along with it.
956,01:08:44.25,01:08:44.25,Here's how it's going to work.You'll each get a chance to make
957,01:08:47.58,01:08:47.58,"an opening statement, this is anopportunity to make your case"
958,01:08:50.88,01:08:50.88,about why you deserve to winthis game.
959,01:08:54.67,01:08:54.67,Then the jury will get the firstchance to address you with a
960,01:08:57.67,01:08:57.67,comment or a question.Then you'll get a chance for a
961,01:09:01.88,01:09:01.88,"final, closing comment.Make sense?"
962,01:09:05.08,01:09:05.08,>> Yeah.Opening statements-- Aras.
963,01:09:09.58,01:09:09.58,">> Wow, guys.Um, first, I just want to say"
964,01:09:13.71,01:09:13.71,thank you.This has been an amazing
965,01:09:15.79,01:09:15.79,experience for me.And I hope when you guys vote
966,01:09:18.67,01:09:18.67,"tonight, that you guys willlook at the way that I played"
967,01:09:21.04,01:09:21.04,"the game.You know, I worked my butt off"
968,01:09:23.21,01:09:23.21,"at camp, I think.I worked hard in the challenges."
969,01:09:26.25,01:09:26.25,"And I really made an effort toget to know each one of you,"
970,01:09:29.25,01:09:29.25,"not because I wanted your vote,but I really feel like I made"
971,01:09:31.92,01:09:31.92,an effort to get to know youguys and connect.
972,01:09:34.42,01:09:34.42,"I set out to play this gamewith honesty and integrity, and"
973,01:09:36.96,01:09:36.96,I feel like for the most part Idid that.
974,01:09:39.21,01:09:39.21,And I hope that you guys willsee that.
975,01:09:41.17,01:09:41.17,"And honestly, whichever way youguys decide to vote, it's been"
976,01:09:43.67,01:09:43.67,an amazing experience.>> PROBST: Danielle.
977,01:09:50.33,01:09:50.33,">> Guys, just want to thank youfor making this an unbelievable"
978,01:09:55.04,01:09:55.04,journey for me.I just came into this thinking
979,01:09:58.79,01:09:58.79,that I just wanted to be myself.I wanted to do the best that I
980,01:10:03.00,01:10:03.00,could do out here.I wanted to build relationships.
981,01:10:07.04,01:10:07.04,I wanted to seek out who Icould trust and who I could
982,01:10:09.29,01:10:09.29,"relate to.I mean, in a perfect world,"
983,01:10:12.04,01:10:12.04,everybody wants to play thisgame with integrity and
984,01:10:14.25,01:10:14.25,"honesty, but let's be realistichere."
985,01:10:16.67,01:10:16.67,"I mean, at some point in thegame, you're going to have to"
986,01:10:19.25,01:10:19.25,"deceive somebody, and you justhave to make that decision"
987,01:10:22.04,01:10:22.04,whether it's the right time todo that.
988,01:10:25.12,01:10:25.12,"Anyways, to get down to thepoint-- this is going to be a"
989,01:10:28.08,01:10:28.08,difficult decision for you guys.I just hope you make the right
990,01:10:31.08,01:10:31.08,"decision.>> PROBST: All right, jury, in"
991,01:10:35.46,01:10:35.46,"a moment, you're going to getyour first chance to address"
992,01:10:38.29,01:10:38.29,Danielle and Aras.I'll give you a minute to think
993,01:10:40.96,01:10:40.96,"about what you want to say.>> PROBST: All right, jury, some"
994,01:10:55.04,01:10:55.04,of you have been waiting a longtime for this: your first
995,01:10:58.58,01:10:58.58,opportunity to address Danielleand Aras to get the information
996,01:11:02.75,01:11:02.75,you need to make a milliondollar vote.
997,01:11:06.58,01:11:06.58,"Let's get started.Sally, you're up first."
998,01:11:14.17,01:11:14.17,">> Hey, guys.Congratulations to you both."
999,01:11:17.79,01:11:17.79,You should feel very proud ofwhere you're sitting.
1000,01:11:20.04,01:11:20.04,"You guys worked hard, and Ireally haven't made my decision"
1001,01:11:22.00,01:11:22.00,"yet, so I do have a questionthat I'm going to ask."
1002,01:11:25.08,01:11:25.08,Of the six original Casayamembers that you had such a
1003,01:11:28.12,01:11:28.12,strong connection with that Icould not for the life of me
1004,01:11:30.58,01:11:30.58,"figure out how to get into, ofthose six, who contributed the"
1005,01:11:34.46,01:11:34.46,most to why you're sittingthere?
1006,01:11:36.46,01:11:36.46,"Danielle, you can go first.>> Cirie would be the one"
1007,01:11:40.17,01:11:40.17,person that I would say is thereason why I'm sitting here.
1008,01:11:43.79,01:11:43.79,I just had a connection withher.
1009,01:11:45.62,01:11:45.62,I was at Exile six days out ofthe 39 days.
1010,01:11:49.12,01:11:49.12,"And when you come back fromExile Island, you don't know"
1011,01:11:51.17,01:11:51.17,"what's been going on, so Ialways had Cirie to fill me in,"
1012,01:11:55.46,01:11:55.46,and she did.And I always trusted her.
1013,01:11:59.79,01:11:59.79,>> Thank you.Aras.
1014,01:12:02.83,01:12:02.83,">> Ironically, I also would sayCirie."
1015,01:12:06.33,01:12:06.33,"One, just as a friend.You need to have somebody you"
1016,01:12:08.88,01:12:08.88,"can just relate to, and then atother times it's strategic."
1017,01:12:11.92,01:12:11.92,And we helped each other.We took each other on a reward.
1018,01:12:14.00,01:12:14.00,It was a mutually beneficialrelationship.
