,begin,end,subtitles_text
347,00:20:58.71,00:20:58.71,Could mean the differencebetween winning this game and
348,00:21:00.50,00:21:00.50,not.Worth playing for?
349,00:21:01.96,00:21:01.96,>> Yeah.>> Yeah.
350,00:21:02.71,00:21:02.71,">> PROBST: We'll draw for spots,we'll get started."
351,00:21:04.75,00:21:04.75,This way.Here we go.
352,00:21:16.08,00:21:16.08,"For reward, survivors ready?Go!"
353,00:21:19.50,00:21:19.50,"Make your way through the maze.Once you get to the end, you'll"
354,00:21:24.92,00:21:24.92,release the first two pegs.Aras moving quickly through the
355,00:21:32.00,00:21:32.00,maze.>> What the hell...
356,00:21:36.62,00:21:36.62,">> PROBST: Danielle struggling.>> Oh, man!"
357,00:21:41.29,00:21:41.29,>> PROBST: Terry reaches a deadend.
358,00:21:48.29,00:21:48.29,Aras drops his first set ofpegs.
359,00:21:51.38,00:21:51.38,He's untying them.Danielle still struggling.
360,00:21:58.08,00:21:58.08,Terry back on track.Terry's dropped his first bag.
361,00:22:06.29,00:22:06.29,Aras moving on to the spinningwheel.
362,00:22:09.12,00:22:09.12,You've got to read the clues.Spin the wheel in the right
363,00:22:11.42,00:22:11.42,"direction, and find the one bagthat contains your final two"
364,00:22:14.54,00:22:14.54,pegs.Terry at the spinning wheel.
365,00:22:24.17,00:22:24.17,Danielle drops her first bag.Aras and Terry both working on
366,00:22:29.75,00:22:29.75,the bags.Danielle now in it.
367,00:22:34.71,00:22:34.71,Everybody in this challenge.Aras thinks he has his second
368,00:22:38.21,00:22:38.21,bag.Terry found his second set of
369,00:22:41.08,00:22:41.08,pegs.He's got to get them out of the
370,00:22:42.46,00:22:42.46,bag.Aras moving on to the wall
371,00:22:46.21,00:22:46.21,first.Danielle has her second bag.
372,00:22:55.12,00:22:55.12,"Aras at the wall.He's got all four pegs,"
373,00:22:58.00,00:22:58.00,starting up.Got to get to the top with all
374,00:23:00.08,00:23:00.08,"four.Danielle, first pegs are not"
375,00:23:05.71,00:23:05.71,right.They'll be color-coded.
376,00:23:07.42,00:23:07.42,Go back to the start; read thedirections again.
377,00:23:10.42,00:23:10.42,Terry has all four pegs.He's on the wall.
378,00:23:14.12,00:23:14.12,"It's Aras and Terry.Aras, working the walls."
379,00:23:18.83,00:23:18.83,"Got a good strategy.Terry, sliding down."
380,00:23:23.92,00:23:23.92,"Nice move.Aras, still with a big lead."
381,00:23:28.12,00:23:28.12,"Terry, not giving up.Aras, sliding down."
382,00:23:35.42,00:23:35.42,"His shirt saves him.Aras, hanging from his shirt."
383,00:23:38.92,00:23:38.92,"Terry, trying to make up someground."
384,00:23:41.71,00:23:41.71,"Terry, digging in.Terry and Aras, neck and neck."
385,00:23:46.79,00:23:46.79,"Aras, to the top.He's got three pegs; he needs"
386,00:23:49.12,00:23:49.12,his last one.Aras frees his last peg.
387,00:23:53.71,00:23:53.71,"Aras, to the top.Terry, right behind him, to the"
388,00:23:56.25,00:23:56.25,top.Got to get 'em in.
389,00:23:58.25,00:23:58.25,"Four slots, got to get all fourin and drop your flag."
390,00:24:01.04,00:24:01.04,"It's Aras.Terry, making up ground."
391,00:24:03.04,00:24:03.04,Terry comes from behind towin reward.
392,00:24:07.54,00:24:07.54,">> You are the ultimatecompetitor, man, ultimate."
393,00:24:10.17,00:24:10.17,"I'm telling you, you work me.>> PROBST: Wow. Incredible."
394,00:24:21.25,00:24:21.25,">> Good job, guys.Good job."
395,00:24:25.33,00:24:25.33,">> PROBST: Aras, Terry, anothergreat challenge between you two"
396,00:24:28.00,00:24:28.00,guys.Terry came out on top.
397,00:24:30.58,00:24:30.58,The good news is because thehidden immunity idol is no
398,00:24:33.12,00:24:33.12,"longer in play, nobody going toExile Island."
399,00:24:35.92,00:24:35.92,"Aras, Danielle, grab your stuff.Head back to camp."
400,00:24:39.17,00:24:39.17,">> Congrats.>> PROBST: Terry, you got some"
401,00:24:49.04,00:24:49.04,"eating to do.Get your stuff, go."
402,00:25:13.79,00:25:13.79,">> Terry's probably eatingsomething a little bit nicer,"
403,00:25:16.62,00:25:16.62,"but, uh, you know what?This is food, and, uh, we've"
404,00:25:19.79,00:25:19.79,been luck today; we've eaten alot.
405,00:25:22.58,00:25:22.58,"This is going to be our seventhfish, three of them, pretty"
406,00:25:25.50,00:25:25.50,"big-size fish.So don't get me wrong, Terry's"
407,00:25:28.46,00:25:28.46,"grubbing and he's happy aboutit, and that's great for Terry,"
408,00:25:30.92,00:25:30.92,but this is great for Aras andDanielle right now too.
409,00:25:37.12,00:25:37.12,">> D, one of us has to wintomorrow, if one of us wants"
410,00:25:39.46,00:25:39.46,to win a million dollars.>> Tomorrow's gonna be like a
411,00:25:42.29,00:25:42.29,"willpower one, and I'm notgiving up, so don't worry."
412,00:25:46.21,00:25:46.21,">> I'm not worried about you.I know you're tough as nails, D."
413,00:25:50.42,00:25:50.42,>> I will not give up.>> How was it?
414,00:26:12.67,00:26:12.67,">> You know what?It was, uh, it was good."
415,00:26:15.50,00:26:15.50,"It wasn't like a crap-load offood, but it was all good."
416,00:26:19.54,00:26:19.54,">> What'd you get?>> Uh, a whole bunch of steamed"
417,00:26:23.54,00:26:23.54,"vegetables, like, uh,cauliflower, carrots, string"
418,00:26:26.83,00:26:26.83,"beans, spinach, and then twochicken breasts, a big thing of"
419,00:26:31.83,00:26:31.83,"rice and two pieces ofmultigrain bread, like, about 32"
420,00:26:35.79,00:26:35.79,ounces of water and then about a16-ounce protein drink.
421,00:26:39.29,00:26:39.29,"That was it.Oh, and I had a banana, that"
422,00:26:42.12,00:26:42.12,"was it.>> Oh, yum."
423,00:26:44.25,00:26:44.25,">> But, um... that was it.>> Thank you."
424,00:26:54.50,00:26:54.50,>> There's absolutely anadvantage to having a meal the
425,00:26:56.88,00:26:56.88,day before the biggestimmunity challenge of the game.
426,00:26:59.75,00:26:59.75,"The thing of it is, though, isit can also be a psychological"
427,00:27:03.46,00:27:03.46,disadvantage.(thunder crashes)
428,00:27:11.12,00:27:11.12,Now the onus to win is really onyou.
429,00:27:13.79,00:27:13.79,"I mean, everybody expects you towin now-- you're super-dad and"
430,00:27:16.54,00:27:16.54,"you've got all this food in yourbody, that kind of puts the"
431,00:27:19.08,00:27:19.08,pressure on a little bit forTerry.
432,00:27:29.29,00:27:29.29,">> I hope I have it, I hope I'mhere for two nights."
433,00:27:39.42,00:27:39.42,>> I think you'll have to fightDanielle for that.
434,00:27:42.29,00:27:42.29,>> I don't think Terry'sapparent dominance has a
435,00:27:44.08,00:27:44.08,"psychological effect on me,personally."
436,00:27:46.62,00:27:46.62,Everybody and their motherexpects Terry to win this
437,00:27:49.00,00:27:49.00,"next immunity challenge.So I go out there, I give it my"
438,00:27:52.29,00:27:52.29,"best, I expect me to win.And if I don't win, well, hey,"
439,00:27:55.79,00:27:55.79,"I gave it my best.If I do win, beautiful."
440,00:28:18.50,00:28:18.50,">> ""A boat will soon arrive totake you to Exile Island for the"
441,00:28:22.12,00:28:22.12,final time.Collect the torches of those who
442,00:28:25.50,00:28:25.50,"came before you, place them onthe skull, raise the Exile flag"
443,00:28:30.04,00:28:30.04,and set the skull ablaze as atribute to your fallen
444,00:28:33.00,00:28:33.00,comrades.Prepare yourself for the final
445,00:28:35.21,00:28:35.21,"immunity challenge, which willgive one of you the power to"
446,00:28:38.62,00:28:38.62,decide who will be the last tojoin the jury and who will face
447,00:28:41.96,00:28:41.96,"the jury.""It's funny the last three of us"
448,00:28:48.21,00:28:48.21,"that are still here, the finalthree, all have spent the most"
449,00:28:51.79,00:28:51.79,"days on Exile Island, so, youknow, burning down the skull"
450,00:28:55.83,00:28:55.83,"will be symbolic like, it'sover, it's done."
451,00:29:09.21,00:29:09.21,">> Tina, you were thefirst one out."
452,00:29:12.00,00:29:12.00,">> For the very short time thatI was there, I would've done"
453,00:29:15.12,00:29:15.12,nothing differently.I don't want anyone to have
454,00:29:17.71,00:29:17.71,any pity upon me for thisexperience.
455,00:29:21.88,00:29:21.88,My son died five months ago.It was the biggest
456,00:29:26.08,00:29:26.08,"challenge of my life, and itwill remain the largest"
457,00:29:30.29,00:29:30.29,challenge for the rest of mylife.
458,00:29:44.17,00:29:44.17,>> Melinda.>> I'm taking away from the
459,00:29:49.21,00:29:49.21,"experience, I guess, a littlebit more knowing who I am."
460,00:29:52.38,00:29:52.38,"I learned that I'm a lottougher, actually, than I even"
461,00:29:54.17,00:29:54.17,"thought I was.I mean, it's awful out here."
462,00:29:58.96,00:29:58.96,">> Beautiful blue eyes.>> Misty, first person here on"
463,00:30:08.58,00:30:08.58,Exile Island.>> It definitely threw me for a
464,00:30:12.33,00:30:12.33,loop at the very beginning.Being stuck on Exile Island put
465,00:30:15.42,00:30:15.42,"me in a vulnerable position, butmostly, it was a positive"
466,00:30:19.08,00:30:19.08,"experience all around.I learned a lot about myself,"
467,00:30:22.42,00:30:22.42,"and I know that from now on,whether in life or a game, I'm"
468,00:30:25.17,00:30:25.17,never going to go into anythingbeing anyone other than myself.
469,00:30:34.29,00:30:34.29,">> Certainly, this experiencewill change my perspective."
470,00:30:37.71,00:30:37.71,"I'm coming away, you know, moregrateful, more humble than I"
471,00:30:41.50,00:30:41.50,even was coming here.And to be lucky enough to be
472,00:30:46.67,00:30:46.67,"involved in something like thisis, um, it's just a blessing."
473,00:30:52.79,00:30:52.79,>> Bob Dog.>> It was great having Bob Dog
474,00:30:57.58,00:30:57.58,"at camp, and Bob Dog in thechallenges."
475,00:30:59.04,00:30:59.04,>> The thing that I thinkwill shock people the most is
476,00:31:02.08,00:31:02.08,exactly how beat down you arewhen show up each day for those
477,00:31:05.04,00:31:05.04,challenges.Knowing exactly how debilitated
478,00:31:07.12,00:31:07.12,"we were, I mean, it was tough,but, like I'm a tough dude, I"
479,00:31:09.96,00:31:09.96,expect to be able to thrive incircumstances like this.
480,00:31:12.29,00:31:12.29,"I just came out here to, youknow, put the smack-down on a"
481,00:31:15.04,00:31:15.04,"few fools and maybe take a shotat a million, and it didn't"
482,00:31:17.42,00:31:17.42,work out.>> Dan the man.
483,00:31:24.21,00:31:24.21,>> Dan was a confidante.He was a survivor.
484,00:31:27.25,00:31:27.25,"He taught us stuff around camp.The man had it all, definitely"
485,00:31:31.38,00:31:31.38,had the right stuff.>> I expected this to be
486,00:31:34.75,00:31:34.75,"interesting and difficult, andmy biggest surprise was that it"
487,00:31:38.79,00:31:38.79,"was not only interesting anddifficult, but it was fun."
488,00:31:42.29,00:31:42.29,It was fun!This game was energizing
489,00:31:46.00,00:31:46.00,spiritually.It was very hard physically.
490,00:31:48.71,00:31:48.71,"But, uh, it's a joyousexperience."
491,00:31:56.00,00:31:56.00,">> Nick was one of the mostmature, well-spoken and"
492,00:32:00.21,00:32:00.21,well-mannered 24-year-old kids Ihave ever met.
493,00:32:04.25,00:32:04.25,">> The first 12 days were themost miserable days, perhaps in"
494,00:32:07.12,00:32:07.12,"my life, but, uh, withoutquestion, this was the hardest"
495,00:32:10.04,00:32:10.04,but yet one of the mostrewarding experiences I've ever
496,00:32:13.62,00:32:13.62,had.>> Austin.
497,00:32:19.12,00:32:19.12,>> This is a tough game.It really is.
498,00:32:22.33,00:32:22.33,I had no idea coming out herehow hard it was going to be.
499,00:32:25.12,00:32:25.12,All I know is that it is such anhonor to be able to play the
500,00:32:27.21,00:32:27.21,"game of Survivor, and that honoris just magnified by having a"
501,00:32:32.04,00:32:32.04,chance to sit on the jury andhave a say in who walks away
502,00:32:35.67,00:32:35.67,with a million bucks.>> Survivor Sal.
503,00:32:40.96,00:32:40.96,>> It was fun having Sallyaround camp.
504,00:32:44.17,00:32:44.17,"She's a real sweetheart, areal genuine girl."
505,00:32:47.17,00:32:47.17,>> My Survivor experience waseverything I could've imagined
506,00:32:52.88,00:32:52.88,"or hoped, and then to say, Imade it to the final eight was"
507,00:32:57.12,00:32:57.12,"thrilling.>> Bruce, sensei."
508,00:33:08.92,00:33:08.92,">> Such a kindhearted man.>> I came to this, probably, one"
509,00:33:12.92,00:33:12.92,"of the smallest and the oldestperson, but I've always been"
510,00:33:16.08,00:33:16.08,"challenged that way as eitherthe smallest, weakest,"
511,00:33:19.88,00:33:19.88,"last-picked all the time, and soI just relish that kind of"
512,00:33:23.25,00:33:23.25,challenge to prove people wrong.The hardest part was getting
513,00:33:27.21,00:33:27.21,sick and being sick for days.And that was probably the most
514,00:33:30.42,00:33:30.42,"excruciating pain in my life,but that made me think a lot and"
515,00:33:33.21,00:33:33.21,"I felt, uh, coming off theisland, I was a much stronger"
516,00:33:35.75,00:33:35.75,person.>> Courtney.
517,00:33:43.25,00:33:43.25,>> It's been a rollercoaster ofa ride for me.
518,00:33:45.21,00:33:45.21,"My life is about growth, it'sabout experience, and it's about"
519,00:33:48.21,00:33:48.21,"living your dreams, and this ismy current dream, and I lived"
520,00:33:52.58,00:33:52.58,"it, and I did the best that Icould."
521,00:33:55.79,00:33:55.79,I stayed the real me throughoutit all.
522,00:33:59.54,00:33:59.54,You know what?I'm not going to be handed a
523,00:34:01.25,00:34:01.25,"million dollars, but I'm goingto make it on my own."
524,00:34:10.17,00:34:10.17,">> Shane.Wow. Crazy, ugly, beautiful..."
525,00:34:14.79,00:34:14.79,"insane, somebody who I willalways, always hold in my heart."
526,00:34:19.17,00:34:19.17,>> I feel completely at peacewith the way I played the game.
527,00:34:23.29,00:34:23.29,"And there are so many thingsthat I have learned about me,"
528,00:34:26.29,00:34:26.29,"about what I'm capable of, aboutwhat I can do, which is"
529,00:34:29.75,00:34:29.75,anything.And that's only going to make me
530,00:34:33.33,00:34:33.33,a stronger and more effectiveperson to the planet.
531,00:34:37.04,00:34:37.04,And I'm going to remember thisexperience forever.
532,00:34:44.04,00:34:44.04,>> Cirie was the mom aroundcamp.
533,00:34:46.50,00:34:46.50,"I mean, she was just amazing.>> I felt like this was a"
534,00:34:50.38,00:34:50.38,"life-changing experience forme, just in the fact that I"
535,00:34:54.25,00:34:54.25,won't be as fearful of theunknown.
536,00:34:58.08,00:34:58.08,Because that's what kind ofkept me on the couch.
537,00:35:01.92,00:35:01.92,"Hopefully, it won't be as big apart of my life anymore, being"
538,00:35:05.08,00:35:05.08,that I've overcome a lot ofthings that I would have never
539,00:35:09.00,00:35:09.00,thought I could have donebefore.
540,00:35:34.21,00:35:34.21,♪ ♪(fire crackling)
541,00:36:41.38,00:36:41.38,">> PROBST: So how did thismorning go, Aras?"
542,00:36:43.25,00:36:43.25,>> This morning was nice.We got to pay our respects to
543,00:36:46.12,00:36:46.12,"the 13 other members, and Ithink most important for all of"
544,00:36:49.50,00:36:49.50,"us, is the burning of theskull, knowing that none of us"
545,00:36:52.08,00:36:52.08,ever have to spend anothernight there.
546,00:36:54.08,00:36:54.08,">> PROBST: All right, you guysready to get to your final"
547,00:36:55.83,00:36:55.83,immunity challenge?>> Yeah.
548,00:36:57.50,00:36:57.50,">> PROBST: First things first:Aras, give it up."
549,00:37:01.42,00:37:01.42,"For the last time, immunity isback up for grabs."
550,00:37:06.96,00:37:06.96,"For today's final immunitychallenge, you must balance on"
551,00:37:11.21,00:37:11.21,a series of floating platforms.We will start on the largest of
552,00:37:14.96,00:37:14.96,the four platforms.Every 15 minutes you'll move to
553,00:37:18.21,00:37:18.21,"the next smallest platform.As the platform gets smaller,"
554,00:37:21.88,00:37:21.88,it will get tougher to keepyour balance.
555,00:37:24.17,00:37:24.17,"If we make it to the lastplatform, there will be no time"
556,00:37:27.04,00:37:27.04,limit.We will go until there's only
557,00:37:28.92,00:37:28.92,one person left.Here are the rules: only your
558,00:37:31.50,00:37:31.50,feet can touch the platform.If your hands or your bottom
559,00:37:35.17,00:37:35.17,"touch the platform, you're out.If you fall off, you're out."
560,00:37:38.67,00:37:38.67,"At the end of every 15 minutesthat round will be over, you'll"
561,00:37:42.08,00:37:42.08,"crawl over to the next platform,you'll have one minute to"
562,00:37:45.21,00:37:45.21,"regain your balance, we'llbegin again."
563,00:37:47.83,00:37:47.83,"Last person left standing, winsimmunity, guaranteed a spot in"
564,00:37:51.58,00:37:51.58,the final two and decides whosits next to them at that final
565,00:37:55.71,00:37:55.71,Tribal Council.Clear?
566,00:37:57.08,00:37:57.08,">> Yeah.>> PROBST: All right, we'll get"
567,00:37:58.33,00:37:58.33,started.Everybody step onto your first
568,00:38:04.04,00:38:04.04,platform and get your balance.This challenge has begun.
569,00:38:18.88,00:38:18.88,15 minutes on this firstplatform.
570,00:38:28.67,00:38:28.67,"How you feeling, Terry?Doing all right, Danielle?"
571,00:38:32.88,00:38:32.88,Aras?Nobody wants to talk.
572,00:38:38.12,00:38:38.12,I understand.This challenge requires intense
573,00:38:42.21,00:38:42.21,concentration.Lose your focus for just a
574,00:38:45.38,00:38:45.38,"moment, you'll be in the water.We're now at the ten minute"
575,00:39:00.92,00:39:00.92,mark.Five more minutes on this
576,00:39:02.88,00:39:02.88,"platform, we move to the nextone."
577,00:39:05.71,00:39:05.71,Terry's looking very strong.Aras has not moved.
578,00:39:09.96,00:39:09.96,Danielle's very steady.>> There's tons of fish on the
579,00:39:12.29,00:39:12.29,bottom.Should have had a drop line
580,00:39:14.33,00:39:14.33,with us.>> PROBST: You want to put your
581,00:39:16.12,00:39:16.12,"drop line in here?>> Yeah, I see some huge fish."
582,00:39:21.62,00:39:21.62,">> PROBST: Even in the middleof a challenge, Danielle"
583,00:39:23.92,00:39:23.92,thinking about food.>> (laughs)
584,00:39:32.29,00:39:32.29,>> PROBST: 15 seconds left inthis round.
585,00:39:39.17,00:39:39.17,"Five, four, three, two, one.Crawl onto your next platform."
586,00:39:46.17,00:39:46.17,Find a new balance point.You have one minute.
587,00:39:50.46,00:39:50.46,"This will be a little moredifficult, less room."
588,00:39:54.08,00:39:54.08,You'll feel the effects of thewater more.
589,00:40:07.25,00:40:07.25,Everybody's up.Challenge is back on.
590,00:40:30.08,00:40:30.08,"You're eight minutes in, overhalfway."
591,00:40:38.12,00:40:38.12,"Aras wobbling just a bit, butrecovering."
592,00:40:42.12,00:40:42.12,Danielle very steady.Terry very steady.
593,00:40:50.21,00:40:50.21,"15 seconds left in this round.Three, two, one."
594,00:40:57.54,00:40:57.54,Crawl to your third platform.This is where you will begin to
595,00:41:01.21,00:41:01.21,notice a significant increasein difficulty.
596,00:41:05.58,00:41:05.58,You have one minute to get intoa standing position.
597,00:41:24.25,00:41:24.25,45 seconds left.Nobody panicking.
598,00:41:31.54,00:41:31.54,"Everybody taking their time.That's it, Aras."
599,00:41:34.58,00:41:34.58,"Aras is up.That's it, Terry."
600,00:41:37.12,00:41:37.12,Fight to find it.Aras holding steady.
601,00:41:44.54,00:41:44.54,"Terry still struggling.You've got 30 seconds, Terry."
602,00:41:56.62,00:41:56.62,20 second left to get thosehands up.
603,00:41:59.79,00:41:59.79,Danielle is up.Aras is up.
604,00:42:02.33,00:42:02.33,"Terry, you need to get up in 15seconds."
605,00:42:05.29,00:42:05.29,"14, 13.,,This is it, Terry."
606,00:42:11.33,00:42:11.33,Ten seconds.Aras and Danielle are up.
607,00:42:15.17,00:42:15.17,Terry's having trouble gettingup.
608,00:42:22.08,00:42:22.08,"Four, three, put your hands up,Terry."
609,00:42:26.08,00:42:26.08,You've got to do it.Terry is up.
610,00:42:28.25,00:42:28.25,"At the last second, he foundbalance."
611,00:42:30.17,00:42:30.17,Everybody is up.The challenge is back on.
612,00:42:44.00,00:42:44.00,Terry cannot hang on.The first person out of this
613,00:42:47.92,00:42:47.92,challenge.It's down to Aras and Danielle
614,00:42:58.92,00:42:58.92,"for final immunity.Aras is out of the challenge,"
615,00:43:12.62,00:43:12.62,Danielle wins immunity.Danielle going to the final two.
616,00:43:19.25,00:43:19.25,"Danielle, come on over.The first one, but it couldn't"
617,00:43:24.38,00:43:24.38,"come at a better time, huh?You are safe at tonight's vote."
618,00:43:28.67,00:43:28.67,You're guaranteed a spot in thefinal two.
619,00:43:30.71,00:43:30.71,"And at Tribal Council tonight,you will decide whether it is"
620,00:43:33.25,00:43:33.25,Terry or Aras that sits next toyou at that final Tribal
621,00:43:37.00,00:43:37.00,Council.Big decision.
622,00:43:38.71,00:43:38.71,You have the opportunity tofigure it out.
623,00:43:40.25,00:43:40.25,Get your stuff.Bring the boat in.
624,00:44:31.25,00:44:31.25,>> God never makes it easy forme.
625,00:44:34.25,00:44:34.25,"The one immunity challenge Iwin is a last one, and it's a"
626,00:44:36.92,00:44:36.92,huge decision that I have tomake tonight-- who do I want to
627,00:44:41.08,00:44:41.08,"take with me to the final two,either Aras or Terry?"
628,00:44:44.50,00:44:44.50,"So, I mean, it was sogratifying to win the last"
629,00:44:47.12,00:44:47.12,"immunity challenge, but at thesame time, my brain started"
630,00:44:50.17,00:44:50.17,thinking right away.I knew I had a decision to make
631,00:44:53.75,00:44:53.75,tonight that could cost me orearn me a million dollars.
632,00:45:05.71,00:45:05.71,It's difficult because I toldTerry when I was on Exile
633,00:45:08.75,00:45:08.75,"Island with him that if eitherof us won, we would take each"
634,00:45:11.92,00:45:11.92,"other, but then it's like,during the challenge, Aras,"
635,00:45:16.25,00:45:16.25,"you know, I gave him, like, ahead nod, and so he jumped off,"
636,00:45:20.17,00:45:20.17,thinking that I would take himto the finals.
637,00:45:23.33,00:45:23.33,"And that doesn't mean anythingright now, because, at this"
638,00:45:26.58,00:45:26.58,"point, there's a milliondollars at stake, and I'm not"
639,00:45:29.12,00:45:29.12,going to take somebody because Imade a promise to them.
640,00:45:32.83,00:45:32.83,I'm going to take someone who Ithink I have a better chance of
641,00:45:35.21,00:45:35.21,beating.>> The big question.
642,00:45:54.29,00:45:54.29,>> Do you feel that it'sfair for me to take someone
643,00:46:00.12,00:46:00.12,"that I think can beat me?>> Um, I-I..."
644,00:46:05.08,00:46:05.08,">> As someone in my positionright now, because I didn't"
645,00:46:07.54,00:46:07.54,"expect to be in this position,to be honest with you."
646,00:46:10.25,00:46:10.25,">> Right, right.Um, had I won today, I would"
647,00:46:14.58,00:46:14.58,have already told you that youwere going to the finals with
648,00:46:19.75,00:46:19.75,me.You want to put this down?
649,00:46:21.25,00:46:21.25,">> Yeah.I know, I'm just trying to... I"
650,00:46:24.21,00:46:24.21,"did not expect to be in thisposition, and if you had given"
651,00:46:27.04,00:46:27.04,"me the hidden immunity idol, Iwould have 100% took you."
652,00:46:30.04,00:46:30.04,">> Right, right.>> Without any question, it"
653,00:46:31.62,00:46:31.62,wouldn't be an issue right now.I'm not saying I'm not taking
654,00:46:34.38,00:46:34.38,"you, 'cause I haven't...>> Right."
655,00:46:36.71,00:46:36.71,>> I'm just trying to go overeverything in my head and go
656,00:46:40.25,00:46:40.25,"over... you know, and if youwere in my shoes, you would do"
657,00:46:43.12,00:46:43.12,the same thing.You want to...
658,00:46:44.21,00:46:44.21,">> Right, right.>> You would want to bring"
659,00:46:45.83,00:46:45.83,someone... and it's a toss-up.>> You haven't...
660,00:46:48.04,00:46:48.04,>> It's not like one of you isbetter to bring than the other.
661,00:46:51.50,00:46:51.50,"So I'm just, like, freaking outbecause I won't... I don't..."
662,00:46:55.92,00:46:55.92,I don't know.>> Danielle is finding herself
663,00:46:58.04,00:46:58.04,"very confused right now, and,oh, God, I hope she's not"
664,00:47:04.17,00:47:04.17,confused when it comes to thepoint of choos... taking me to
665,00:47:06.62,00:47:06.62,"the finals.If I were a betting man, I would"
666,00:47:12.21,00:47:12.21,"choose me only because of theCasaya loyalty, and it would be"
667,00:47:17.58,00:47:17.58,"an easy decision.>> But by me taking you, they're"
668,00:47:19.62,00:47:19.62,gonna look at it as I'm alreadybeing disloyal to them 'cause
669,00:47:23.04,00:47:23.04,"I...>> No, no, because then it just"
670,00:47:25.46,00:47:25.46,makes the picture more black andwhite.
671,00:47:27.58,00:47:27.58,"""Oh, guys, yeah, I'm here.Thanks, you know?"
672,00:47:29.50,00:47:29.50,I kinda won a bunch ofchallenges and then was the
673,00:47:32.92,00:47:32.92,"nail in your side, you know?Can I please have your vote?"""
674,00:47:36.17,00:47:36.17,"Uh-uh, I don't think that'shappening."
675,00:47:38.17,00:47:38.17,And I know it's gonna be hard.>> I just hope you will respect
676,00:47:41.29,00:47:41.29,whatever decision I make.I honestly haven't made a
677,00:47:43.71,00:47:43.71,decision and I don't know whatI'm gonna do.
678,00:47:45.58,00:47:45.58,>> I have to. I have to.I'm not gonna sit there and
679,00:47:48.17,00:47:48.17,"throw daggers at you with myeyes from the jury, okay?"
680,00:47:51.58,00:47:51.58,>> Please.>> And it's been fun.
681,00:47:56.08,00:47:56.08,>> It has been fun.And this sucks.
682,00:47:59.08,00:47:59.08,I can't deal with this decision.I hate... I'm so indecisive as
683,00:48:03.04,00:48:03.04,"it is because I'm a Gemini.>> Okay, I think I'm gonna jump"
684,00:48:16.54,00:48:16.54,in the water.I think the tide was still going
685,00:48:18.67,00:48:18.67,"out.>> Yeah, I think so, too."
