,begin,end,subtitles_text
1019,01:12:17.04,01:12:17.04,"But I think if I had to singleout one person, Cirie would be"
1020,01:12:20.00,01:12:20.00,the person.>> Congratulations again.
1021,01:12:23.08,01:12:23.08,Thank you so much.>> PROBST: Bruce.
1022,01:12:30.25,01:12:30.25,">> Wow, I get to address youguys and congratulations."
1023,01:12:33.25,01:12:33.25,"You guys battled like realsamurai warriors to me, both"
1024,01:12:35.79,01:12:35.79,of you.Now we have the responsibility
1025,01:12:38.08,01:12:38.08,of deciding who's going to getthat million dollars.
1026,01:12:41.79,01:12:41.79,"And what I want to know is,beyond the million dollars, if"
1027,01:12:44.88,01:12:44.88,"you were given that, what areyou going to be doing with that"
1028,01:12:48.54,01:12:48.54,responsibility?That's what I'd like to know.
1029,01:12:51.83,01:12:51.83,">> PROBST: Aras.>> To be honest, Bruce, I don't"
1030,01:12:54.50,01:12:54.50,know if I can inspire anybodyelse unless I change myself.
1031,01:12:58.38,01:12:58.38,"And so for me, my focus at theage that I am is really, like,"
1032,01:13:01.54,01:13:01.54,"can I make myself a betterperson, and hopefully, through"
1033,01:13:04.17,01:13:04.17,"that, that will inspire otherpeople."
1034,01:13:08.17,01:13:08.17,I don't know if that worked.>> PROBST: Danielle.
1035,01:13:10.88,01:13:10.88,">> I would love to just sharemy experiences, maybe just give"
1036,01:13:14.08,01:13:14.08,speeches to younger childrenand let them know you can
1037,01:13:17.25,01:13:17.25,really do anything you put yourmind to.
1038,01:13:18.88,01:13:18.88,"I mean, I never in a millionyears thought I'd be sitting in"
1039,01:13:21.25,01:13:21.25,"this seat right now, and I wouldjust love to share my"
1040,01:13:24.29,01:13:24.29,experiences with other peopleand encourage them to do
1041,01:13:26.88,01:13:26.88,whatever they want.>> Okay.
1042,01:13:33.96,01:13:33.96,">> PROBST: Terry.>> Danielle, I'd first like"
1043,01:13:42.38,01:13:42.38,"to make a comment, that yourpart about deceiving somebody"
1044,01:13:44.42,01:13:44.42,and having to do it sometimeduring the game is totally
1045,01:13:46.50,01:13:46.50,"off-base.After 38 days, I never came"
1046,01:13:49.42,01:13:49.42,"close to deceiving anyone.Somewhere down the line,"
1047,01:13:52.96,01:13:52.96,"Danielle, I hope that yourfamily and friends and the"
1048,01:13:57.12,01:13:57.12,"ringing in your ears doesn'tsay ""should have taken the navy"
1049,01:14:01.38,01:14:01.38,"guy.""Okay, the out-play portion of"
1050,01:14:05.46,01:14:05.46,"Survivor, in my book, revolvesaround the competitions."
1051,01:14:09.04,01:14:09.04,"So what I want you to do israte yourself, one through ten,"
1052,01:14:13.08,01:14:13.08,and why you gave yourself a oneto ten rating.
1053,01:14:16.29,01:14:16.29,Aras.>> I give myself a nine.
1054,01:14:19.25,01:14:19.25,I busted my butt at everychallenge.
1055,01:14:21.17,01:14:21.17,"And I think everybody here did,basically."
1056,01:14:23.17,01:14:23.17,"I don't know anybody whowasn't, like, pumped up for a"
1057,01:14:25.00,01:14:25.00,"challenge, and I have noregrets about any of the"
1058,01:14:27.67,01:14:27.67,"challenges, except maybewishing I got a peg in"
1059,01:14:31.12,01:14:31.12,"somewhere quicker than somebodyelse got a peg in, or something"
1060,01:14:33.62,01:14:33.62,like that.>> Danielle.
1061,01:14:35.88,01:14:35.88,">> I would give myself an eightand a half, nine, only because"
1062,01:14:40.12,01:14:40.12,I would give myself higher if Ididn't take the cheeseburger
1063,01:14:44.04,01:14:44.04,over that challenge.I'm still kicking myself in the
1064,01:14:47.00,01:14:47.00,"ass for that.But every other challenge, I"
1065,01:14:50.46,01:14:50.46,put in 110% on that field.I just gave it my all.
1066,01:14:55.46,01:14:55.46,So I'd say closer to a nine.>> That's it.
1067,01:14:59.12,01:14:59.12,"Thank you.>> PROBST: Thank you, Terry."
1068,01:15:01.04,01:15:01.04,"Austin, you're up.>> First off, congratulations"
1069,01:15:07.92,01:15:07.92,"to the both of you.Aras, sorry to hear about your"
1070,01:15:10.04,01:15:10.04,"hand, man.What I want you guys to do, I"
1071,01:15:13.12,01:15:13.12,want you to tell me oneincident you think you made a
1072,01:15:16.71,01:15:16.71,"very positive, good move, andthen one incident that you did"
1073,01:15:20.79,01:15:20.79,something that wasn'tnecessarily completely on the
1074,01:15:22.46,01:15:22.46,"up-and-up, both of which helpedyou kind of navigate your way to"
1075,01:15:25.21,01:15:25.21,where you are right now.>> PROBST: We'll start with
1076,01:15:28.33,01:15:28.33,Danielle.>> I think the first move that I
1077,01:15:32.04,01:15:32.04,did that helped me get somecontrol in this game was to
1078,01:15:34.62,01:15:34.62,persuade people not to voteBruce off and to vote Bob Dog
1079,01:15:39.04,01:15:39.04,off.I just feel like that was the
1080,01:15:40.67,01:15:40.67,first move where I gained alittle bit of control in the
1081,01:15:43.04,01:15:43.04,"game.And the second move, obviously,"
1082,01:15:46.25,01:15:46.25,"was voting Courtney off,because Courtney was one of the"
1083,01:15:50.17,01:15:50.17,closest people that I bondedwith here.
1084,01:15:54.17,01:15:54.17,That was one of the hardestthings I had to do.
1085,01:15:57.46,01:15:57.46,">> Okay, thanks.>> PROBST: Aras."
1086,01:16:01.50,01:16:01.50,>> Probably the...the move that I'm proudest I
1087,01:16:04.67,01:16:04.67,made was telling Melinda shewas going to be home.
1088,01:16:06.83,01:16:06.83,To be the second person votedoff and to not know you're
1089,01:16:08.92,01:16:08.92,going home...Like Shane didn't know if he was
1090,01:16:11.00,01:16:11.00,"going to stay or not, andMelinda's hopes got up."
1091,01:16:14.25,01:16:14.25,"But I felt good that she atleast knew she was going home,"
1092,01:16:16.71,01:16:16.71,as opposed to coming in likesuper-stoked that she was going
1093,01:16:19.38,01:16:19.38,to make it three more days andget blindsided.
1094,01:16:22.67,01:16:22.67,"Something that I wasn't so proudof: Shane, the vote off for"
1095,01:16:26.08,01:16:26.08,Shane.I had to break the alliance with
1096,01:16:28.25,01:16:28.25,Shane and I ended up sayingthings to Shane that weren't
1097,01:16:30.96,01:16:30.96,"true, and I felt bad about that.But I do think I played this"
1098,01:16:33.88,01:16:33.88,"game with lots of integrity,and for the most part, every"
1099,01:16:36.38,01:16:36.38,"move I made, I felt really goodabout."
1100,01:16:39.38,01:16:39.38,>> Congratulations again to theboth of you guys.
1101,01:16:41.67,01:16:41.67,">> PROBST: Thanks, Austin.Courtney."
1102,01:16:44.38,01:16:44.38,">> Oh, boy!I forgot my guns."
1103,01:16:52.75,01:16:52.75,They've been dropped in the seaof forgiveness.
1104,01:16:55.79,01:16:55.79,Whew!Wow!
1105,01:16:58.67,01:16:58.67,I came in here wanting to playwith integrity and to be of
1106,01:17:02.79,01:17:02.79,"light and love and this shiningbeing, and, wow, did I struggle"
1107,01:17:07.04,01:17:07.04,with that.Because you certainly both
1108,01:17:10.12,01:17:10.12,"stabbed me in the back with aknife that was very deep, and"
1109,01:17:13.33,01:17:13.33,it took me about a week toremove it from my back it was
1110,01:17:16.75,01:17:16.75,"so deep, especially fromDanielle, who, which I had"
1111,01:17:20.46,01:17:20.46,total trust in her.I never was going to vote you
1112,01:17:22.92,01:17:22.92,out.I don't know who made up that
1113,01:17:24.58,01:17:24.58,"lie, but I'm holding no chip onmy shoulder, because chips on"
1114,01:17:27.88,01:17:27.88,your shoulder of regret andanger weigh you down.
1115,01:17:32.42,01:17:32.42,"And I'm a bird, so I gotta fly.But more so than anything, I"
1116,01:17:36.17,01:17:36.17,"learned a ton about myself, andthat points me to my question."
1117,01:17:40.54,01:17:40.54,"For you and through thisexperience, more than the game"
1118,01:17:43.42,01:17:43.42,"and the money and thela-la-la-la, what did you really"
1119,01:17:46.17,01:17:46.17,learn about yourself that you'regoing to take out of here and
1120,01:17:49.83,01:17:49.83,walk with every single day?>> PROBST: Aras.
1121,01:17:54.21,01:17:54.21,">> I hope you don't think Istabbed you in the back,"
1122,01:17:56.12,01:17:56.12,"because we both put eachother's name on the parchment,"
1123,01:17:58.17,01:17:58.17,"just...>> Well, you did, lie, but"
1124,01:18:00.08,01:18:00.08,"that's okay.>> And you know what, you know"
1125,01:18:01.88,01:18:01.88,"what, I take full responsibilityfor that, I did."
1126,01:18:03.88,01:18:03.88,And I and do not profess to saythat I was completely honest out
1127,01:18:06.88,01:18:06.88,"here.And so I guess for me, one thing"
1128,01:18:08.96,01:18:08.96,I can say is my ego has beensmashed.
1129,01:18:11.25,01:18:11.25,>> And that is going tostrengthen your spiritual way.
1130,01:18:14.75,01:18:14.75,"I mean, my ego was smashed intosmithereens, and you need it,"
1131,01:18:19.54,01:18:19.54,because it's going to be toughout there.
1132,01:18:21.12,01:18:21.12,>> That's right.>> PROBST: Danielle.
1133,01:18:24.00,01:18:24.00,>> I didn't realize howmentally strong I can be and
1134,01:18:27.12,01:18:27.12,how mentally tough this wholeadventure was for me.
1135,01:18:31.92,01:18:31.92,"Like, there were so many timeswhere I just was like, ""I can't"
1136,01:18:34.67,01:18:34.67,"do this."">> Well, in a sense, that is the"
1137,01:18:36.42,01:18:36.42,"beautiful gift, then, that thisgave you, is that, in a sense,"
1138,01:18:40.00,01:18:40.00,"you've learned to be able to bestill within yourself, just"
1139,01:18:43.21,01:18:43.21,"you, not having Dad take careof you or your boyfriend take"
1140,01:18:46.33,01:18:46.33,care of you or anyone.>> Thank you for pointing that
1141,01:18:48.46,01:18:48.46,"out for me.>> Well, you know, we're all"
1142,01:18:50.50,01:18:50.50,"here for each other in one wayor another, and my life is to"
1143,01:18:53.71,01:18:53.71,learn.And I'm glad we've all learned
1144,01:18:56.38,01:18:56.38,"something, and we're all goingto walk on a higher road."
1145,01:19:00.62,01:19:00.62,">> PROBST: Thanks, Courtney.Cirie."
1146,01:19:08.17,01:19:08.17,">> Well, um, hard to followCourtney."
1147,01:19:14.21,01:19:14.21,I would imagine that you bothhave realized each other's
1148,01:19:18.54,01:19:18.54,strengths and attributes.I would like both of you to
1149,01:19:22.46,01:19:22.46,tell me why my vote should befor the person sitting next to
1150,01:19:25.54,01:19:25.54,you.>> PROBST: Danielle.
1151,01:19:29.21,01:19:29.21,">> Aras is unbelievable.Honorable, respectful, strong-"
1152,01:19:36.04,01:19:36.04,"minded, and a great morale forthe team."
1153,01:19:39.88,01:19:39.88,Just a great person.>> PROBST: Aras.
1154,01:19:45.25,01:19:45.25,">> When I hurt my hand today,Danielle was there, and she"
1155,01:19:49.33,01:19:49.33,walked me up to the beach andjust held a towel over my hand
1156,01:19:52.79,01:19:52.79,"to put pressure on it, and justbasically helped save my ass."
1157,01:19:56.54,01:19:56.54,On a night where she could justbe worrying about what she's
1158,01:19:59.08,01:19:59.08,"going to say to Tribal Council,she put all that aside."
1159,01:20:02.08,01:20:02.08,"That for me was reallytouching, and to be in that"
1160,01:20:04.21,01:20:04.21,"situation, I felt like, wow,Danielle is a really"
1161,01:20:07.38,01:20:07.38,spectacular person.>> I did tell the doctor
1162,01:20:09.21,01:20:09.21,"to drug you, though.>> She did tell the doctor to"
1163,01:20:11.08,01:20:11.08,"drug me up, which hopefullythey'll do later."
1164,01:20:13.38,01:20:13.38,">> I was kidding.>> Good luck, guys."
1165,01:20:17.08,01:20:17.08,">> PROBST: Thanks, Cirie.Shane."
1166,01:20:25.42,01:20:25.42,">> Fun.First of all, congratulations."
1167,01:20:31.33,01:20:31.33,"The last two, I'm disappointedthat it's the both of you."
1168,01:20:36.88,01:20:36.88,I wish that Terry would havebeen there.
1169,01:20:39.17,01:20:39.17,I believe that Terry is themost deserving person of the 16
1170,01:20:42.79,01:20:42.79,to win the million dollars.I'm going to tell you why I
1171,01:20:46.04,01:20:46.04,think you guys are bothundeserving.
1172,01:20:48.50,01:20:48.50,"Danielle, you were useless atcamp."
1173,01:20:51.29,01:20:51.29,The only time you were evermotivated to do anything was
1174,01:20:54.12,01:20:54.12,"when it was time to eat.And the outwit part, I don't"
1175,01:20:58.21,01:20:58.21,"know, because at the end of theday, I was with you for 33"
1176,01:21:00.75,01:21:00.75,"days, and I don't know anythingabout you."
1177,01:21:03.33,01:21:03.33,"I know you can't complete acoherent sentence, and you"
1178,01:21:05.71,01:21:05.71,contradict yourself all thetime.
1179,01:21:07.79,01:21:07.79,"And that's a drag.Aras, we had an agreement on"
1180,01:21:13.96,01:21:13.96,"what was most important to bothof us, my son and your yoga,"
1181,01:21:18.54,01:21:18.54,"which, at this point, is sortof laughable and contradictory."
1182,01:21:22.46,01:21:22.46,"But we had an agreement, abond, and when it came time to"
1183,01:21:28.33,01:21:28.33,"make the hard decision, Isigned Danielle's name, and you"
1184,01:21:31.50,01:21:31.50,"signed mine.Danielle, you didn't lie to me."
1185,01:21:34.71,01:21:34.71,You played the game straight up.>> I didn't lie to you.
1186,01:21:36.46,01:21:36.46,>> You didn't lie to me at all.I have no beef with the way you
1187,01:21:39.17,01:21:39.17,"played that part of the game.Aras, you lied, you cheated,"
1188,01:21:43.62,01:21:43.62,"and you wrecked me, personally.You know, you're young, you're"
1189,01:21:47.12,01:21:47.12,a good kid.You're striving to do the right
1190,01:21:51.08,01:21:51.08,"thing, but we cannot judgepeople based on their"
1191,01:21:55.04,01:21:55.04,"intentions.If I'm judged on my intentions,"
1192,01:21:58.00,01:21:58.00,I'd be president of the planet.I have to be judged on my
1193,01:22:01.58,01:22:01.58,"actions, and I've learned thatthrough experience."
1194,01:22:04.50,01:22:04.50,"You are broke, you are homelessand you freeload off your dad."
1195,01:22:08.54,01:22:08.54,So you don't know what it'slike to be judged.
1196,01:22:12.29,01:22:12.29,And that is why I cannot votefor you.
1197,01:22:15.21,01:22:15.21,And I don't know who to votefor.
1198,01:22:17.29,01:22:17.29,And I can't abstain.So this is what we're going to
1199,01:22:20.21,01:22:20.21,do.We're going to have a little
1200,01:22:22.12,01:22:22.12,"challenge.Number between one and, very"
1201,01:22:25.54,01:22:25.54,"fittingly, a million.I want you guys both to pick"
1202,01:22:29.25,01:22:29.25,one.>> PROBST: Aras.
1203,01:22:36.17,01:22:36.17,>> Four.>> PROBST: Danielle.
1204,01:22:41.08,01:22:41.08,>> Ten.>> Thank you.
1205,01:22:48.38,01:22:48.38,">> PROBST: Okay, the jury hashad their say."
1206,01:22:51.25,01:22:51.25,"Some good questions, someinteresting comments, and a"
1207,01:22:54.17,01:22:54.17,challenge.You'll have one last chance to
1208,01:22:57.83,01:22:57.83,make your case about why youdeserve the million dollars and
1209,01:23:01.62,01:23:01.62,the title of sole survivor.I'm going to give you a minute
1210,01:23:05.75,01:23:05.75,to think about what you want tosay.
1211,01:23:23.08,01:23:23.08,">> PROBST: All right, Danielleand Aras, a lot's been said"
1212,01:23:25.46,01:23:25.46,tonight.This is your last chance to
1213,01:23:28.42,01:23:28.42,"make your case with the jury.Danielle, final comments."
1214,01:23:34.04,01:23:34.04,">> Um, like I said, I wanted tocome into this game and be"
1215,01:23:38.21,01:23:38.21,"strong, be myself, form theright alliances, be observant"
1216,01:23:43.17,01:23:43.17,"of what was going on, neverfeel comfortable, and I feel"
1217,01:23:46.54,01:23:46.54,like I did play this game withhonesty and integrity and there
1218,01:23:50.17,01:23:50.17,did come a point when I didhave to make a decision to
1219,01:23:53.58,01:23:53.58,deceive somebody that I didalign with.
1220,01:23:57.21,01:23:57.21,"Shane, I know you said that Iwas useless around camp."
1221,01:24:00.08,01:24:00.08,"I feel like I grew a lot,skill-wise."
1222,01:24:04.50,01:24:04.50,"Maybe you didn't see it, butpersonally, I felt like I grew."
1223,01:24:10.04,01:24:10.04,"And the outwit part of this, Ijust feel like I aligned with"
1224,01:24:13.50,01:24:13.50,the right people.I found a couple people that
1225,01:24:16.58,01:24:16.58,"I really trusted, and I stuckwith them."
1226,01:24:20.04,01:24:20.04,And I'm asking you guys to justlook at the three components of
1227,01:24:24.04,01:24:24.04,"this game-- the outwit, theoutplay, and outlast-- and I"
1228,01:24:26.92,01:24:26.92,think I did all three of themfairly well.
1229,01:24:29.96,01:24:29.96,I hope you guys vote for me.I have so much going on right
1230,01:24:32.83,01:24:32.83,"now in my life, and this couldreally help me."
1231,01:24:36.71,01:24:36.71,So there you have it.>> PROBST: Aras.
1232,01:24:46.50,01:24:46.50,">> Guys, again, I know this isa tough choice for all of you,"
1233,01:24:50.79,01:24:50.79,every single one of you.I played this game the best way
1234,01:24:54.04,01:24:54.04,that I knew how.I worked my butt off at camp.
1235,01:24:56.58,01:24:56.58,I worked hard in the challenges.I worked hard at establishing
1236,01:24:59.38,01:24:59.38,"real relationships with eachand every one of you, and I"
1237,01:25:02.04,01:25:02.04,"mean that.Shane, I'm really sorry that"
1238,01:25:05.04,01:25:05.04,you think that I was going totry to screw you first.
1239,01:25:09.25,01:25:09.25,I was under the assumption thatyou were trying to screw me.
1240,01:25:11.17,01:25:11.17,Those hugs that you and I wouldhave at the fireside at night
1241,01:25:13.17,01:25:13.17,"were real, and that was real.So if you're thinking about"
1242,01:25:16.54,01:25:16.54,"voting for someone who needsthe money, I'm homeless and"
1243,01:25:18.75,01:25:18.75,I freeload off my dad.Help me get out of that
1244,01:25:20.83,01:25:20.83,"situation, brother.But honestly, guys, we all"
1245,01:25:23.42,01:25:23.42,played it the best way we knowhow.
1246,01:25:25.50,01:25:25.50,"I hope you guys can look at thesituation and say, ""Wow, Aras"
1247,01:25:28.08,01:25:28.08,"played it really well.""if you guys say D played it"
1248,01:25:30.33,01:25:30.33,"better, that's cool, too.It was a real challenging"
1249,01:25:33.04,01:25:33.04,"experience, and my closingwords are just thank you guys"
1250,01:25:36.75,01:25:36.75,for being a part of thatexperience.
1251,01:25:43.54,01:25:43.54,">> PROBST: Okay, tonight, jury,you are voting for a winner."
1252,01:25:48.38,01:25:48.38,You're writing down the nameof the person you think most
1253,01:25:51.29,01:25:51.29,deserving of the milliondollars.
1254,01:25:53.96,01:25:53.96,"Aras, Danielle, you want to seeyour name on the parchment"
1255,01:25:56.33,01:25:56.33,tonight.It is time to vote.
1256,01:26:00.33,01:26:00.33,"Austin, you're up.>> Danielle, what a great"
1257,01:26:25.38,01:26:25.38,pleasure to have shared thisexperience with you.
1258,01:26:28.54,01:26:28.54,I know you're going to holdthis position with due honor and
1259,01:26:31.58,01:26:31.58,you'll touch a lot of people'slives.
1260,01:26:33.62,01:26:33.62,The best years of your lifehave yet to come.
1261,01:27:05.83,01:27:05.83,">> I am just so used to writingthis name down, of the two of"
1262,01:27:09.79,01:27:09.79,"you, you are head and shouldersthe winner."
1263,01:27:12.79,01:27:12.79,Congratulations.>> PROBST: I'll go get the
1264,01:27:32.25,01:27:32.25,"votes.Aras, Danielle, jury, thank you"
1265,01:27:48.54,01:27:48.54,for a great 39 days.I know you two are especially
1266,01:27:52.75,01:27:52.75,excited to have these votesread.
1267,01:27:55.04,01:27:55.04,You're going to have to waituntil we get back to the States.
1268,01:27:57.29,01:27:57.29,I'll see you there.(applause)
1269,01:28:41.67,01:28:41.67,(cheering and applause)>> PROBST: All right.
1270,01:29:06.33,01:29:06.33,Let's get to it.You guys ready for this?
1271,01:29:19.21,01:29:19.21,"All right, have a seat.Everybody have a seat."
1272,01:29:23.29,01:29:23.29,Nice warm welcome.Jury.
1273,01:29:28.83,01:29:28.83,">> Jeff.>> PROBST: Aras, Danielle, I"
1274,01:29:32.17,01:29:32.17,"gotta say, this is a tough gameto play."
1275,01:29:35.83,01:29:35.83,"And I think until you play itor witness it firsthand, which"
1276,01:29:39.21,01:29:39.21,"is as close as I'm ever goingto get, you really can't"
1277,01:29:42.42,01:29:42.42,appreciate it.So I congratulate you guys on
1278,01:29:45.08,01:29:45.08,coming out and taking thisendeavor on.
1279,01:29:48.08,01:29:48.08,"And especially Aras andDanielle, to you two for making"
1280,01:29:50.08,01:29:50.08,it this far.Let's get to it.
1281,01:29:53.92,01:29:53.92,Seven votes in here.Four votes to win.
1282,01:29:58.08,01:29:58.08,"At stake, title of solesurvivor and a check for a"
1283,01:30:02.08,01:30:02.08,million bucks.Ready?
1284,01:30:05.62,01:30:05.62,I'll read the votes.(laughter)
1285,01:30:11.71,01:30:11.71,First vote... Aras.(cheering and applause)
1286,01:30:25.58,01:30:25.58,">> PROBST: Danielle.One vote Aras, one vote"
1287,01:30:29.08,01:30:29.08,Danielle.Danielle.
1288,01:30:39.25,01:30:39.25,"Obviously, this is Shane's vote.And the answer to his question"
1289,01:30:43.62,01:30:43.62,of what was the number betweenone and a million.
1290,01:30:46.71,01:30:46.71,"That's two votes, Danielle, onevote Aras."
1291,01:30:52.38,01:30:52.38,"Aras.We're tied, two votes to two."
1292,01:31:01.62,01:31:01.62,"Aras.Three votes Aras, two votes"
1293,01:31:05.62,01:31:05.62,Danielle.It takes four votes to win.
1294,01:31:12.12,01:31:12.12,"The winner of Survivor: ExileIsland, Aras."
1295,01:31:16.21,01:31:16.21,(cheers and applause) Captioned by 
1296,01:32:08.92,01:32:08.92, Media Access Group at WGBH  access.wgbh.org
