,begin,end,subtitles_text
1,00:00:00.00,00:00:00.00, >> JEFF PROBST: Previously on
2,00:00:02.12,00:00:02.12,Survivor: >> That was brilliant.
3,00:00:04.96,00:00:04.96,">> PROBST: With the four horsemen's alliance broken,"
4,00:00:07.25,00:00:07.25,Alex and Mookie were on the outs.
5,00:00:09.38,00:00:09.38,">> We are six strong, and there's two people just waiting"
6,00:00:13.12,00:00:13.12,on death row. >> PROBST: In a desperate
7,00:00:16.58,00:00:16.58,"attempt to save their necks, Alex and Mookie searched"
8,00:00:20.12,00:00:20.12,"through Yau-Man's bag. >> Yeah, he got it."
9,00:00:22.04,00:00:22.04,>> PROBST: And discovered his hidden immunity idol.
10,00:00:24.29,00:00:24.29,">> Just cause some hell, man. If I'm going down, I'm bringing"
11,00:00:27.12,00:00:27.12,hell with me. >> PROBST: When Alex and Mookie
12,00:00:29.21,00:00:29.21,"confronted Yau-Man... >> What do you want to do, Yau?"
13,00:00:31.25,00:00:31.25,>> You guys do what you need to do.
14,00:00:33.04,00:00:33.04,>> PROBST: ...he decided to tell everyone about the idol.
15,00:00:35.04,00:00:35.04,">> I thought that was a little dirty, but I will have to tell"
16,00:00:37.88,00:00:37.88,all my voting bloc straight out. They went through my bag.
17,00:00:40.92,00:00:40.92,">> They went through your bag, Yau-Man?"
18,00:00:42.12,00:00:42.12,">> Yeah, they went through my bag."
19,00:00:43.50,00:00:43.50,>> Alex went through Yau-Man's things and threatened him.
20,00:00:45.62,00:00:45.62,"They said, ""I know you have the immunity idol."""
21,00:00:48.25,00:00:48.25,>> Finding out that Yau-Man had the immunity idol changed a
22,00:00:50.54,00:00:50.54,whole bunch of stuff because everybody with the immunity
23,00:00:52.75,00:00:52.75,idol is considered dangerous. >> PROBST: At the reward
24,00:00:57.25,00:00:57.25,challenge... Mookie connects!
25,00:00:59.17,00:00:59.17,...The tribe was split into two teams.
26,00:01:00.96,00:01:00.96,Dreamz has it! Green wins reward!
27,00:01:04.46,00:01:04.46,"Dreamz secured victory for himself, Stacy, Earl and Alex."
28,00:01:08.21,00:01:08.21,"Boo, head on out. And they sent Boo to Exile"
29,00:01:11.21,00:01:11.21,"Island... >> ""The idol is back at your"
30,00:01:14.25,00:01:14.25,"very own beach."" >> PROBST: ...Where he"
31,00:01:16.00,00:01:16.00,discovered the first clue to a newly hidden immunity idol.
32,00:01:18.88,00:01:18.88,>> It's not here. It's not my beach.
33,00:01:21.12,00:01:21.12,>> PROBST: At the immunity challenge...
34,00:01:23.08,00:01:23.08,>> D-4. >> PROBST: D-4 is a hit.
35,00:01:25.21,00:01:25.21,Alex out. Stacy wins individual immunity.
36,00:01:29.04,00:01:29.04,"...Stacy came out on top. Stacy, safe from tonight's"
37,00:01:32.12,00:01:32.12,Tribal Council. You are not.
38,00:01:34.04,00:01:34.04,There's somebody going home. Back at camp:
39,00:01:40.42,00:01:40.42,Fearing that Alex or Mookie could easily stumble upon the
40,00:01:42.71,00:01:42.71,"newly hidden immunity idol, Boo convinced his alliance to split"
41,00:01:44.79,00:01:44.79,"their vote. Earl and Yau-Man, however, were"
42,00:01:53.04,00:01:53.04,uneasy with the plan. >> Going into tonight's Tribal
43,00:02:01.04,00:02:01.04,Council split vote worries me very much.
44,00:02:03.50,00:02:03.50,I really... rather not see it. >> PROBST: At Tribal Council...
45,00:02:07.71,00:02:07.71,You cannot vote for Stacy. Everybody else is fair game.
46,00:02:11.25,00:02:11.25,"It's time to vote. Alex, you're up."
47,00:02:13.21,00:02:13.21,"...in a last-ditch effort to save himself, Alex turned on"
48,00:02:17.08,00:02:17.08,Mookie and helped vote him out. The 11th person voted out and
49,00:02:20.29,00:02:20.29,the fifth member of our jury: Mookie.
50,00:02:23.42,00:02:23.42,"Mookie, the tribe has spoken. Well, based on what I heard"
51,00:02:29.58,00:02:29.58,"tonight, Alex is either odd man out or suddenly very valuable."
52,00:02:33.75,00:02:33.75,Seven are left. Who will be voted out tonight?
53,00:02:56.04,00:02:56.04,>> Tonight's vote was pretty important for me.
54,00:02:58.62,00:02:58.62,I know Mookie voted for Boo. I voted for Mookie.
55,00:03:04.79,00:03:04.79,">> My vote for Mookie is what saved my ass, basically."
56,00:03:08.62,00:03:08.62,"I was like, I'm gonna write down his name, go with my gut."
57,00:03:11.46,00:03:11.46,So I'm still here. (laughs)
58,00:03:15.46,00:03:15.46,"Yup, still here. >> I would have preferred Alex"
59,00:03:33.04,00:03:33.04,"would go. Alex is more of a threat, but"
60,00:03:35.79,00:03:35.79,"for some strange reason, they wanted to split the vote"
61,00:03:38.92,00:03:38.92,"between Mookie and Alex, and no one considered the fact that,"
62,00:03:41.83,00:03:41.83,"hey, did you ever think that Mookie and Alex have a vote?"
63,00:03:44.33,00:03:44.33,That they might vote for each other? Duh.
64,00:03:47.62,00:03:47.62,">> I don't want there to be, like, some kinda rift between"
65,00:03:49.96,00:03:49.96,"you and I. I'm willing to say if I'm wrong,"
66,00:03:52.04,00:03:52.04,I'm wrong. >> Whatever. You know.
67,00:03:54.04,00:03:54.04,"It's not that big a deal. After Tribal Council, Stacy"
68,00:03:57.42,00:03:57.42,"approached me, you know, trying to clear things up, telling me"
69,00:03:59.75,00:03:59.75,how she wants to be friends with me after this. Like I care.
70,00:04:09.96,00:04:09.96,">> So I understand... >> Who's ""everybody?"""
71,00:04:16.88,00:04:16.88,>> Everybody besides you and Alex.
72,00:04:22.04,00:04:22.04,">> At this point, they're all stressing out."
73,00:04:24.83,00:04:24.83,"Obviously, they're not all in agreement."
74,00:04:27.25,00:04:27.25,That always creates room and opportunity.
75,00:04:30.17,00:04:30.17,>> Why am I... Why are y... What's going on?
76,00:04:32.54,00:04:32.54,>> We're asking you a question. >> I don't know.
77,00:04:34.62,00:04:34.62,">> No, because Boo came over and he's like, ""Everybody wants to"
78,00:04:37.21,00:04:37.21,"talk to you."" >> He just wants to know."
79,00:04:38.83,00:04:38.83,">> My best bet was to just lay low, observe, let them get at"
80,00:04:42.62,00:04:42.62,"each other a little bit. From this point forward, I"
81,00:04:44.71,00:04:44.71,"think I'm gonna have to play this game with a smile, you"
82,00:04:47.88,00:04:47.88,"know, velvet gloves and a dagger in my pocket."
83,00:04:57.21,00:04:57.21,(theme song playing) \xe2\x99\xaa \xe2\x99\xaa
84,00:05:31.62,00:05:31.62,>> I definitely feel like I'm on the chopping block still.
85,00:05:34.12,00:05:34.12,"So after last night, I decided I'm going into ninja mode and"
86,00:05:38.17,00:05:38.17,"it started this morning, right? I woke up."
87,00:05:40.00,00:05:40.00,"I could have gone up, you know, gone around, done my business as"
88,00:05:42.58,00:05:42.58,"I normally do, but instead I just kinda laid there and just"
89,00:05:45.17,00:05:45.17,"kinda listened, tried to see, okay, who's still here?"
90,00:05:47.29,00:05:47.29,"Who's still at the campfire? Like, it's all about observation"
91,00:05:49.88,00:05:49.88,"for me, and I'm trying to make sure I'm not seen or heard,"
92,00:05:53.71,00:05:53.71,kinda like a ninja right now. >> Yau I trust 100%.
93,00:06:05.12,00:06:05.12,>> Mm-hmm. >> I only trust Yau and you
94,00:06:07.25,00:06:07.25,"100%. >> Oh, okay. Good."
95,00:06:27.17,00:06:27.17,>> Dreamz has been proving himself.
96,00:06:28.33,00:06:28.33,">> Mm-hmm. >> You know, he can be a little"
97,00:06:30.08,00:06:30.08,rogue at times with his strategy.
98,00:06:32.29,00:06:32.29,>> I'd look into that. I always felt that I could rely
99,00:06:35.54,00:06:35.54,"on Dreamz. >> The core alliance is myself,"
100,00:06:39.42,00:06:39.42,"Cassandra and Yau, but me and Cassandra talked about taking"
101,00:06:43.04,00:06:43.04,"Dreamz to the top four. Then we can just have the, the"
102,00:06:47.04,00:06:47.04,"core four. That's what they're called,"
103,00:06:49.08,00:06:49.08,"the core four. >> I mean, honestly, my concern"
104,00:06:55.75,00:06:55.75,"is you and Dreamz are tight. I mean, I don't see you voting"
105,00:06:58.33,00:06:58.33,"him out... So I'm, just saying,"
106,00:07:03.25,00:07:03.25,"mathematically, I'm off to my thing, you know."
107,00:07:09.71,00:07:09.71,Earl and I have a major disagreement as to who the top
108,00:07:13.71,00:07:13.71,four should be. His idea of the top four is
109,00:07:17.71,00:07:17.71,"myself, Earl, Cassandra and Dreamz."
110,00:07:22.12,00:07:22.12,That is a very bad top four for me to get to the next stage
111,00:07:27.46,00:07:27.46,"because Cassandra and, and Dreamz are very close."
112,00:07:31.71,00:07:31.71,"I would like a very weak candidate up there, but the"
113,00:07:35.71,00:07:35.71,"very weakest is Stacy, I know. I hate the idea; I really do."
114,00:07:39.33,00:07:39.33,I wish it was Michelle. I would like to see the top
115,00:07:42.71,00:07:42.71,"four as myself, Earl, Cassandra and Stacy because then I have"
116,00:07:46.75,00:07:46.75,a chance of getting to the top three.
117,00:08:22.12,00:08:22.12,">> I trust Yau-Man, but Yau-Man is definitely playing the game"
118,00:08:24.46,00:08:24.46,"for himself. Yau has immunity idol, and so"
119,00:08:27.08,00:08:27.08,I think Yau-Man is a real big threat.
120,00:08:29.17,00:08:29.17,I know he's playing the game and he's playing the game hard.
121,00:08:31.75,00:08:31.75,He's playing it like street ball: he's playing it to win it.
122,00:08:51.29,00:08:51.29,">> PROBST: Come on in, guys! How's everybody doing on day 31?"
123,00:09:04.71,00:09:04.71,>> We all are tired out here. >> Hungry.
124,00:09:07.38,00:09:07.38,>> PROBST: Hungry? Hungry plays in nicely to
125,00:09:09.67,00:09:09.67,today's challenge. Shall we get to it?
126,00:09:11.75,00:09:11.75,>> Yes. >> Do it!
127,00:09:12.71,00:09:12.71,">> PROBST: For today's challenge, you are going to rip"
128,00:09:16.21,00:09:16.21,pieces of meat off a large piece of pork using only your
129,00:09:21.21,00:09:21.21,"teeth. Each time you get a mouthful,"
130,00:09:23.75,00:09:23.75,you'll drop it in your plate.
131,00:09:25.33,00:09:25.33,Whoever has the most meat on their plate at the end of five
132,00:09:28.67,00:09:28.67,minutes wins reward. Want to know what you're
133,00:09:30.54,00:09:30.54,playing for? >> Yeah.
134,00:09:31.50,00:09:31.50,>> Yeah. >> PROBST: Tomorrow the winner
135,00:09:33.42,00:09:33.42,"and the first two runners-up will be picked up by helicopter,"
136,00:09:37.42,00:09:37.42,flown to one of the most beautiful places in Fiji.
137,00:09:40.25,00:09:40.25,Then you will river-raft the rain forest.
138,00:09:42.54,00:09:42.54,>> Oh... wow! >> PROBST: It is truly
139,00:09:44.25,00:09:44.25,"spectacular. You'll then have a nice lunch,"
140,00:09:46.62,00:09:46.62,"come back to camp. In addition, the winner of this"
141,00:09:50.25,00:09:50.25,challenge will send one person to Exile Island.
142,00:09:53.17,00:09:53.17,"Finally, the winner of this challenge will also receive an"
143,00:09:56.21,00:09:56.21,advantage in the next immunity challenge.
144,00:10:00.12,00:10:00.12,Take your spot. We'll get your hands tied
145,00:10:01.71,00:10:01.71,behind your back and we'll get started.
146,00:10:06.96,00:10:06.96,Here we go. For reward and an advantage in
147,00:10:09.71,00:10:09.71,the next immunity challenge. Survivors ready?
148,00:10:14.96,00:10:14.96,Go! You got five minutes to tear
149,00:10:18.58,00:10:18.58,off as much pork as you can and get it on your plate.
150,00:10:22.29,00:10:22.29,There are no lanes. This is a free-for-all.
151,00:10:29.29,00:10:29.29,"Dreamz and Earl getting a good, quick start."
152,00:10:32.12,00:10:32.12,"Alex with a nice big piece. Yau-Man, Boo, Cassandra working"
153,00:10:44.96,00:10:44.96,together. Nobody working with Alex.
154,00:10:47.42,00:10:47.42,Boo with a huge piece. Yau-Man with a nice big chunk.
155,00:10:52.71,00:10:52.71,>> Cassandra. >> PROBST: Yau-Man looking for
156,00:10:54.54,00:10:54.54,some help from Cassandra. You need two people.
157,00:10:57.04,00:10:57.04,One to hold it steady. One to tear it off.
158,00:10:59.29,00:10:59.29,Dreamz with another big piece. Alex in it.
159,00:11:02.42,00:11:02.42,Cassandra still in it. Alex staying in it.
160,00:11:08.46,00:11:08.46,Yau-Man with a huge chunk! Earl picking it up off the dirt.
161,00:11:17.12,00:11:17.12,"Yau-Man and Boo working together using their shoulder,"
162,00:11:20.04,00:11:20.04,using their chins. Yau-Man with another huge chunk
163,00:11:22.50,00:11:22.50,of pork. Boo gets a big chunk.
164,00:11:31.96,00:11:31.96,Boo is in it. Cassandra is in it.
165,00:11:33.96,00:11:33.96,Yau-Man is in it. Alex with another big piece.
166,00:11:36.67,00:11:36.67,It's going to be very close. One and a half minutes left in
167,00:11:39.67,00:11:39.67,this challenge. Dreamz is in it.
168,00:11:53.21,00:11:53.21,Alex not giving up. 15 seconds.
169,00:12:01.21,00:12:01.21,Whatever is in your mouth when I call time also counts.
170,00:12:05.75,00:12:05.75,"Five, four, three, two, one, stop!"
171,00:12:13.08,00:12:13.08,That's it! Whatever you have in your
172,00:12:15.25,00:12:15.25,"mouth, put on your plate. Start with Boo."
173,00:12:34.38,00:12:34.38,"Boo weighs in at 8.9 pounds. Boo, take a spot right up here."
174,00:12:40.54,00:12:40.54,"For now, you are in first place. Yau-Man weighs in at six pounds."
175,00:12:48.08,00:12:48.08,"Yau-Man, currently in second place."
176,00:12:54.96,00:12:54.96,Cassandra comes in at 5.8 pounds.
177,00:12:58.17,00:12:58.17,"Take a spot up here, Cassandra. Stacy in at 4.3 pounds."
178,00:13:05.17,00:13:05.17,"You can stay there. Earl, not enough."
179,00:13:10.08,00:13:10.08,Five pounds. Dreamz at six pounds also.
180,00:13:15.54,00:13:15.54,"Dreamz, you replace Cassandra. One plate left."
181,00:13:22.46,00:13:22.46,"If this is under six pounds, you're out of the reward, Alex."
182,00:13:30.17,00:13:30.17,It is not going to be enough. Boo wins the challenge.
183,00:13:35.21,00:13:35.21,">> Finally! >> PROBST: Yau-Man and Dreamz,"
184,00:13:37.17,00:13:37.17,first runners-up. You're going along with him on
185,00:13:39.75,00:13:39.75,"the reward. All right, Boo, first order of"
186,00:13:41.67,00:13:41.67,"business. Since you won the challenge,"
187,00:13:43.83,00:13:43.83,you earn the right to send one person to Exile Island.
188,00:13:51.12,00:13:51.12,">> Earl, I know you don't take hard feelings to this."
189,00:13:55.17,00:13:55.17,I'm going to send you back. >> PROBST: Head on out.
190,00:13:57.58,00:13:57.58,Boat will pick you up. You'll be back in time for the
191,00:13:59.42,00:13:59.42,"next immunity challenge. Boo, this is your advantage for"
192,00:14:05.67,00:14:05.67,the next immunity challenge. You can ponder how that might
193,00:14:08.75,00:14:08.75,come into play. It will all make sense at the
194,00:14:11.08,00:14:11.08,"next challenge. All right, guys, head back to"
195,00:14:13.25,00:14:13.25,camp. >> Here it comes.
196,00:14:28.17,00:14:28.17,>> That's the one right there. Get a helicopter ride!
197,00:14:32.75,00:14:32.75,"All right, ladies and gentlemen, keep the camp safe."
198,00:14:35.83,00:14:35.83,We'll do what we can do. >> You guys have fun.
199,00:14:38.83,00:14:38.83,">> I won the reward challenge yesterday, along with Boo and"
200,00:14:43.62,00:14:43.62,"Dreamz, and we start out the day with a helicopter ride."
201,00:14:48.12,00:14:48.12,I've never been on a helicopter. Very excited.
202,00:14:52.04,00:14:52.04,>> Fly like the birds. >> I know. Right?
203,00:14:57.08,00:14:57.08,>> Wow! This is so cool!
204,00:15:00.04,00:15:00.04,>> For real. >> I'll be back!
205,00:15:03.38,00:15:03.38,>> Being in a helicopter flying was truly amazing flight for 
206,00:15:06.58,00:15:06.58,"somebody like me who grew up on islands like this, and to see it"
207,00:15:10.33,00:15:10.33,from the air was just an amazing experience.
208,00:15:13.29,00:15:13.29,>> Now we're going through the rain forest.
209,00:15:16.21,00:15:16.21,>> Wow! We're living la vida large!
210,00:15:19.62,00:15:19.62,>> How much you think it cost to rent one of these?
211,00:15:21.58,00:15:21.58,"I wouldn't mind spending, like, $600 or $700 on a really nice"
212,00:15:24.79,00:15:24.79,"date. I'd do it big like that, Dreamz."
213,00:15:28.08,00:15:28.08,>> There's Exile Island right there.
214,00:15:31.96,00:15:31.96,">> What's up, Earl? What's up, Earl?"
215,00:15:33.71,00:15:33.71,Holy moley! I still can't believe it.
216,00:15:39.12,00:15:39.12,"We rolling up in here, folks! Oh, this is comfortable."
217,00:15:51.42,00:15:51.42,">> During the reward, Boo was talking a lot, just trying to"
218,00:15:54.58,00:15:54.58,be... I don't know. He was just talking too much.
219,00:15:57.38,00:15:57.38,">> Hello. Can you hear me, Dreamz?"
220,00:16:00.29,00:16:00.29,"Hello. >> It's relaxing time, you know?"
221,00:16:03.88,00:16:03.88,It's time to chill. We won this.
222,00:16:06.21,00:16:06.21,Let's relax. Let's live it up.
223,00:16:07.79,00:16:07.79,It's just annoying. >> I'm hungry.
224,00:16:11.29,00:16:11.29,"We're going whitewater rafting, the most beautiful place in"
225,00:16:14.62,00:16:14.62,"Fiji. >> Oh, wow!"
226,00:16:17.25,00:16:17.25,What a ride! It was just unbelievable.
227,00:16:19.67,00:16:19.67,"And about an hour and a half into the trip, the helicopter"
228,00:16:22.88,00:16:22.88,"landed, and we had to hike for about ten minutes to get to the"
229,00:16:26.17,00:16:26.17,"river. >> So, personally, you guys, I "
230,00:16:28.50,00:16:28.50,want to welcome you guys. The name of this river is the 
231,00:16:30.21,00:16:30.21,"Apananuli. Secondly, it's really fast and"
232,00:16:32.42,00:16:32.42,so strong. >> So we were given a little
233,00:16:35.04,00:16:35.04,"safety briefing, and we got into a raft with the river"
234,00:16:39.29,00:16:39.29,"guide, and then we went down this rapids."
235,00:16:57.58,00:16:57.58,>> Then we went whitewater rafting.
236,00:16:59.71,00:16:59.71,"Probably never do it again, but it was so fun."
237,00:17:02.25,00:17:02.25,And I wish I could take my family or somebody on a trip
238,00:17:04.79,00:17:04.79,like that so they can experience what I experienced.
239,00:17:07.75,00:17:07.75,>> Look at that! Waterfall.
240,00:17:09.42,00:17:09.42,"Now, that's a waterfall. >> It's like a field trip for"
241,00:17:11.04,00:17:11.04,grown people. >> We're floating around in a
242,00:17:13.12,00:17:13.12,postcard here. You cannot get better than this.
243,00:17:16.04,00:17:16.04,"I told myself ten times, ""Look at this."
244,00:17:18.21,00:17:18.21,"Take it in. Look where you're at."""
245,00:17:20.50,00:17:20.50,"I am absolutely dumbfounded. I mean, I'm tickled pink."
246,00:17:25.08,00:17:25.08,I feel like a little girl. >> This is great.
247,00:17:43.00,00:17:43.00,">> This is what I came here for. ""Clue number two: Your normal"
248,00:17:49.88,00:17:49.88,winding paths you'll walk. It's inside a tree near a
249,00:17:54.71,00:17:54.71,"lonely tower of rock."" I'll figure it out."
250,00:17:58.88,00:17:58.88,I think two clues will be enough for me.
251,00:18:01.67,00:18:01.67,Can't wait to get back to camp to go looking for that idol.
252,00:18:04.83,00:18:04.83,"It would be all worth it. >> Oh, is that caviar?"
253,00:18:20.17,00:18:20.17,"Oh, this is good beef. >> That is awesome!"
254,00:18:22.62,00:18:22.62,">> Look at that! >> That's impressive, Dreamz."
255,00:18:26.54,00:18:26.54,">> We finally got to lunch, it was just so much stuff."
256,00:18:28.58,00:18:28.58,And I just kept eating it. We were back at camp living
257,00:18:31.08,00:18:31.08,"like cavemen in the dirt, having nothing, and living like"
258,00:18:34.96,00:18:34.96,"a broke, homeless guy, to living like you're rich."
259,00:18:40.50,00:18:40.50,">> The best, best part is, at the end of the lunch, our river"
260,00:18:44.96,00:18:44.96,guide came over and gave each of us an envelope.
261,00:18:51.54,00:18:51.54,And in the envelope are letters from home.
262,00:18:54.67,00:18:54.67,">> ""Dear Daddy, Miss you so much."
263,00:18:58.00,00:18:58.00,"I got six ""A""s and one ""B"" in algebra on my report card."""
264,00:19:01.42,00:19:01.42,"Why can't you get a ""B"" in Spanish or something? Man!"
265,00:19:05.42,00:19:05.42,Yeah! >> I'm going to read mine.
266,00:19:08.58,00:19:08.58,"""Hey, Boo, your dad and sister are doing really well."
267,00:19:11.12,00:19:11.12,Your dad's horses are eating well.
268,00:19:13.25,00:19:13.25,"Dad's kids are eating well  also."""
269,00:19:15.67,00:19:15.67,"Everybody is eating well. See, my family thinks..."
270,00:19:19.62,00:19:19.62,"Thanks, Mom. Oh, what a bonus, huh?"
271,00:19:23.46,00:19:23.46,"Am I crying yet? How you doing, Dreamz?"
272,00:19:27.38,00:19:27.38,You all right? >> When I read my sister's
273,00:19:31.21,00:19:31.21,"letter, you know, she said a lot of deep stuff."
274,00:19:33.96,00:19:33.96,She was saying that she never thought that one of us would
275,00:19:36.04,00:19:36.04,"have a chance, a opportunity. She thought it was over for the"
276,00:19:38.58,00:19:38.58,"family. You know, she thought that our"
277,00:19:40.25,00:19:40.25,"opportunity was up until, you know, I had the opportunity to"
278,00:19:43.08,00:19:43.08,"come here, and it really touched me that it was me that had the"
279,00:19:47.88,00:19:47.88,"opportunity to come, you know? >> Dreamz!"
280,00:19:52.04,00:19:52.04,>> It lets me know that she still believes in me even if I
281,00:19:56.12,00:19:56.12,"don't believe in myself, so it really brought a lot out of me."
282,00:19:59.58,00:19:59.58,It lets me know that my fight is just beginning.
283,00:20:02.42,00:20:02.42,I know what I got to do now. I remember my purpose here.
284,00:20:06.33,00:20:06.33,">> This is the best reward yet, you guys."
285,00:20:08.38,00:20:08.38,>> It's the best yet. >> Awesome!
286,00:20:31.17,00:20:31.17,">> My mom said, ""I know you can make a good situation out of"
287,00:20:34.25,00:20:34.25,"anything. You can't get tired of people."""
288,00:20:36.33,00:20:36.33,">> But, with Boo, you get tired of him."
289,00:20:38.21,00:20:38.21,He talks more than the girls talk.
290,00:20:40.12,00:20:40.12,>> I'm not really tired of him. It's just the talking.
291,00:20:49.29,00:20:49.29,">> During the helicopter ride, Boo just almost spoiled the"
292,00:20:52.88,00:20:52.88,trip for us. He definitely just talks too
293,00:20:54.92,00:20:54.92,much. Why don't you stop saying
294,00:20:58.96,00:20:58.96,stupid stuff? >> He's been like that since
295,00:21:01.29,00:21:01.29,day one. >> I cannot handle any more.
296,00:21:03.29,00:21:03.29,I'm not going to lie to you people.
297,00:21:04.83,00:21:04.83,I cannot handle any more. I'm losing it.
298,00:21:07.33,00:21:07.33,Boo has been irritating enough to where I don't think these
299,00:21:10.25,00:21:10.25,people want Boo to get the $1 million.
300,00:21:12.50,00:21:12.50,"So, if somebody starts Boo bashing, I'm going to feed the"
301,00:21:14.04,00:21:14.04,fire. I cannot deal anymore.
302,00:21:17.62,00:21:17.62,"Sorry, guys. If I hear something stupid, I"
303,00:21:21.88,00:21:21.88,"may call it out, and it may cause friction."
304,00:21:24.42,00:21:24.42,"People are not going to want to see certain people win and, "
305,00:21:27.25,00:21:27.25,"right now, I don't see Boo winning a popularity contest,"
306,00:21:30.04,00:21:30.04,"so if I can help steer things in an anti-Boo campaign, I am"
307,00:21:34.08,00:21:34.08,"all for it. >> I never liked Boo, and I"
308,00:21:54.92,00:21:54.92,"want Boo gone before Alex. Alex is still fighting strong,"
309,00:21:57.92,00:21:57.92,so I'm still making plans with Alex.
310,00:21:59.75,00:21:59.75,"So, point-blank, I'm just not going to let Boo win."
311,00:22:08.79,00:22:08.79,">> I'm going to try my damnedest, you know that."
312,00:22:10.58,00:22:10.58,"You do the same. If Boo wins immunity today, I"
313,00:22:15.46,00:22:15.46,think I'm pretty much screwed. Boo has a full belly and an
314,00:22:19.25,00:22:19.25,advantage in the next immunity challenge.
315,00:22:22.08,00:22:22.08,"But I need to keep myself alive in this thing, so I am focusing"
316,00:22:24.96,00:22:24.96,"all of my energy, all of my willpower on the challenge."
317,00:22:35.08,00:22:35.08,">> PROBST: Come on in, guys! We'll now bring in Earl,"
318,00:22:48.54,00:22:48.54,returning from Exile Island. >> Bula.
319,00:22:52.79,00:22:52.79,>> Bula Bula. >> Great to see you.
320,00:22:56.08,00:22:56.08,">> Welcome back, Earl. >> PROBST: Are you guys ready"
321,00:22:59.67,00:22:59.67,to get to today's challenge? >> Let's do it.
322,00:23:01.96,00:23:01.96,">> PROBST: First things first, Stacy, take back immunity."
323,00:23:05.79,00:23:05.79,"Thank you. Once again, immunity is back up"
324,00:23:12.38,00:23:12.38,"for grabs. All right, at the last reward"
325,00:23:15.12,00:23:15.12,"challenge, Boo, you won an advantage in today's immunity"
326,00:23:18.17,00:23:18.17,challenge. Did you bring it with you?
327,00:23:19.88,00:23:19.88,">> Yes, I did. >> PROBST: Those are climbing"
328,00:23:27.21,00:23:27.21,"steps, and they are a big part of today's challenge."
329,00:23:30.50,00:23:30.50,"Boo, because you already have your steps, you do not have to"
330,00:23:33.17,00:23:33.17,participate in the first round of this challenge.
331,00:23:35.17,00:23:35.17,"You move on to the final. For the rest of you, on my"
332,00:23:40.08,00:23:40.08,"""go,"" you will race to dig up your three climbing steps that"
333,00:23:44.08,00:23:44.08,"are buried in the sand. When you have all three, you"
334,00:23:46.79,00:23:46.79,race to the finish. The first two people to get
335,00:23:50.25,00:23:50.25,their climbing steps join Boo in the final.
336,00:23:53.83,00:23:53.83,"For the final round, you will use those climbing steps to help"
337,00:23:57.17,00:23:57.17,you get to the top of a 12-foot pole.
338,00:24:00.58,00:24:00.58,"First person to get to the top, grab their flag, wins immunity,"
339,00:24:05.50,00:24:05.50,"stays alive in this game. For the rest of you, after 33"
