,begin,end,subtitles_text
360,00:20:59.08,00:20:59.08,here.>> I know.
361,00:21:02.12,00:21:02.12,>> JEFF: Let me come over... letme just come over here.
362,00:21:06.88,00:21:06.88,">> I kind of sat on the boat fora while today, and I couldn't"
363,00:21:12.25,00:21:12.25,"feel my family, you know?And I'm never leaving my baby"
364,00:21:17.96,00:21:17.96,"girl or husband again ever forthis amount of time, ever again."
365,00:21:22.83,00:21:22.83,>> JEFF: So what is it that...you've had a tough time out
366,00:21:25.38,00:21:25.38,here.You've had as tough... you've
367,00:21:27.54,00:21:27.54,had it as tough as anybody withall the time on Exile.
368,00:21:31.92,00:21:31.92,"But you've weathered all that.So you want to leave, you're"
369,00:21:35.83,00:21:35.83,leaving.There's no... I'm not here to
370,00:21:38.08,00:21:38.08,talk you into staying.That's for sure.
371,00:21:40.00,00:21:40.00,>> Right.>> JEFF: I just want to
372,00:21:41.62,00:21:41.62,understand it.>> I was doing it for everybody
373,00:21:44.21,00:21:44.21,else.Doing it for my husband.
374,00:21:46.42,00:21:46.42,Doing it for my sister who wantsto live vicariously through me.
375,00:21:49.21,00:21:49.21,I don't want to hurt thesepeople.
376,00:21:51.96,00:21:51.96,"So I want to stay to help them.This is, like, the first"
377,00:21:54.58,00:21:54.58,"decision I've made that's, like,for me, you know, because I"
378,00:21:59.08,00:21:59.08,don't want to let anybody down.I don't want anybody to hate me.
379,00:22:01.67,00:22:01.67,I don't want anybody to thinkthat I'm quitting.
380,00:22:09.21,00:22:09.21,>> JEFF: This adventure meansdifferent things to different
381,00:22:12.75,00:22:12.75,people.It represents different things
382,00:22:14.71,00:22:14.71,to different people.You've certainly given it your
383,00:22:16.96,00:22:16.96,best.>> Yeah.
384,00:22:19.29,00:22:19.29,"Oh, god.>> JEFF: And all's going to be"
385,00:22:22.29,00:22:22.29,okay.Ready to get out of here?
386,00:22:25.25,00:22:25.25,>> I am.>> JEFF: Let's get your stuff.
387,00:22:40.46,00:22:40.46,">> I'm sorry, guys.>> Don't apologize."
388,00:22:42.96,00:22:42.96,">> I'm sorry.>> You know, Kathy's been"
389,00:22:48.67,00:22:48.67,"through a lot, and most of it isshe lost most of her motivation."
390,00:22:50.62,00:22:50.62,So what's the point of goingthrough the suffering?
391,00:22:52.67,00:22:52.67,>> It was nice to get to knowyou these last couple of days.
392,00:22:54.88,00:22:54.88,">> She just said she's hadenough, and she's quitting."
393,00:22:57.21,00:22:57.21,"Which is sad, but still and all,I mean, it's up to her."
394,00:23:00.46,00:23:00.46,You can't fault her.You can't be upset with her.
395,00:23:04.96,00:23:04.96,"Hope she has a good trip, andI'm sure I'll see her again."
396,00:23:07.88,00:23:07.88,>> JEFF: So the Airai tribe isdown to six in spite of winning
397,00:23:14.17,00:23:14.17,challenges.Game continues.
398,00:23:17.92,00:23:17.92,See you soon.>> Bye.
399,00:23:27.71,00:23:27.71,">> Bye.>> Kathy leaving, it's sad, but"
400,00:23:49.54,00:23:49.54,"at the same time, life goes onhere, and there's a reality to"
401,00:23:52.62,00:23:52.62,"the fact that the sun is goingdown, and we haven't had water"
402,00:23:55.04,00:23:55.04,"in three days, and we haven'thad a cooked meal because we"
403,00:23:57.46,00:23:57.46,"haven't had fire.You know, so Survivor continues"
404,00:24:00.54,00:24:00.54,for the rest of us.>> I think you got a dose of who
405,00:24:19.12,00:24:19.12,Oscar really is with the boatride yesterday.
406,00:24:24.21,00:24:24.21,And...>> I'm starting to see that.
407,00:24:27.04,00:24:27.04,>> Mm-hmm.>> He's kind of arrogant.
408,00:24:28.88,00:24:28.88,>> You think?>> Kind of bothering me.
409,00:24:31.29,00:24:31.29,>> Hmm.Amanda got to see how there's a
410,00:24:35.25,00:24:35.25,"selfish, arrogant part to Ozzy.>> It's so sad."
411,00:24:39.79,00:24:39.79,Very sad.>> And if I got that out of the
412,00:24:45.62,00:24:45.62,"trip, then, okay, I can suck itup, because there was a benefit"
413,00:24:49.00,00:24:49.00,"to it-- letting her see, youknow, Ozzy is about Ozzy."
414,00:24:53.08,00:24:53.08,">> I don't know.Like, I've been trying to figure"
415,00:24:54.96,00:24:54.96,"out if people really think Ozzyis, like, the best thing in the"
416,00:24:56.96,00:24:56.96,world or if they're justplaying.
417,00:24:58.88,00:24:58.88,">> Did you hear Erik?""Oh, my god, if he wasn't here"
418,00:25:01.04,00:25:01.04,"we'd die.""It's like, ""Shut up, Erik."""
419,00:25:04.54,00:25:04.54,"How can we vote Erik, though?How many of us is it?"
420,00:25:08.58,00:25:08.58,Because Ozzy is not going tovote Erik.
421,00:25:11.92,00:25:11.92,He's kind of in love with Erikright now.
422,00:25:14.21,00:25:14.21,They climbed that coconut tree.And because he just worships the
423,00:25:18.42,00:25:18.42,"ground that he walks on, he'llnever get rid of Erik."
424,00:25:21.83,00:25:21.83,>> I think it's the best move tomake.
425,00:25:23.83,00:25:23.83,>> To get rid of Erik?>> Maybe.
426,00:25:27.21,00:25:27.21,>> Ozzy's not going to do it.>> We just have to let him think
427,00:25:31.25,00:25:31.25,he's in complete control.>> Mm-hmm.
428,00:25:33.54,00:25:33.54,>> You know what I'm saying?>> Mm-hmm.
429,00:25:40.04,00:25:40.04,">> JEFF: Come on in, guys.Malakal, getting your first look"
430,00:25:49.75,00:25:49.75,at the new Airai tribe.Kathy has left the game.
431,00:25:53.38,00:25:53.38,>> Kathy?>> What?
432,00:25:57.04,00:25:57.04,>> JEFF: We'll bring Jason andTracy in from Exile.
433,00:25:59.25,00:25:59.25,"I'll explain what happened.>> Well, hello!"
434,00:26:04.17,00:26:04.17,>> Hi.>> Hey.
435,00:26:07.04,00:26:07.04,>> JEFF: Let me kitcheneverybody up on what's going on.
436,00:26:09.50,00:26:09.50,"Yesterday, Kathy sent word thatshe wanted out of the game."
437,00:26:13.04,00:26:13.04,"I went over to Airai's camp.She said, ""I've had enough."
438,00:26:15.42,00:26:15.42,"I need to go.""We packed up her belongings."
439,00:26:18.21,00:26:18.21,She quit.Both tribes at six.
440,00:26:20.79,00:26:20.79,"All right, you guys ready to getto today's immunity challenge?"
441,00:26:23.38,00:26:23.38,>> Yeah.>> JEFF: First things first.
442,00:26:25.08,00:26:25.08,"Give it up, Eliza.Once again, immunity is back up"
443,00:26:33.75,00:26:33.75,"for grabs.On my go, one member of each"
444,00:26:36.00,00:26:36.00,tribe will race across afloating bridge carrying one end
445,00:26:39.54,00:26:39.54,"of a piece of rope.When you reach the platform,"
446,00:26:42.83,00:26:42.83,"you'll clip the rope into alarge puzzle piece, and then"
447,00:26:45.46,00:26:45.46,"hang on as the rest of the tribewill crank a giant winch,"
448,00:26:49.17,00:26:49.17,pulling you and the puzzle pieceback to shore.
449,00:26:52.29,00:26:52.29,"Once you've collected all fivepuzzle pieces, two tribe members"
450,00:26:55.62,00:26:55.62,will unfold those bundles anduse the pieces to solve a puzzle
451,00:26:59.04,00:26:59.04,in the form of a perfect square.Make sense?
452,00:27:02.62,00:27:02.62,>> Yeah.>> Yeah.
453,00:27:04.08,00:27:04.08,">> JEFF: I'll give you a minuteto strategize, we'll get"
454,00:27:06.12,00:27:06.12,started.Eliza and Ozzy first off.
455,00:27:09.38,00:27:09.38,"Here we go, for immunity,Survivors ready?"
456,00:27:12.21,00:27:12.21,"Go!>> Go, baby, go!"
457,00:27:14.96,00:27:14.96,">> Come on, Ozzy!>> You got it Eliza!"
458,00:27:17.79,00:27:17.79,">> Go, Eliza!>> You got it, girl!"
459,00:27:21.54,00:27:21.54,">> Come on, Ozzy!Go, go, go!"
460,00:27:23.58,00:27:23.58,>> JEFF: Ozzy first to thepuzzle piece.
461,00:27:28.25,00:27:28.25,Eliza right there.>> Go!
462,00:27:39.17,00:27:39.17,>> JEFF: Airai taking a longtime to get going.
463,00:27:48.08,00:27:48.08,Ozzy's back with the puzzlepiece.
464,00:27:49.88,00:27:49.88,Next person going!Ozzy's going to go again.
465,00:27:55.17,00:27:55.17,Airai lost a lot of time rightoff the bat.
466,00:27:58.29,00:27:58.29,Next person.Jason now for Airai.
467,00:28:05.71,00:28:05.71,">> Come on, Ozzy!>> Come on, Ozzy!"
468,00:28:08.12,00:28:08.12,>> JEFF: Ozzy at the secondbundle of puzzle pieces.
469,00:28:11.17,00:28:11.17,Ozzy with a big lead forMalakal.
470,00:28:14.25,00:28:14.25,Jason struggling.>> Erik!
471,00:28:19.42,00:28:19.42,"Go, Erik.It's you next."
472,00:28:21.42,00:28:21.42,"Push.Come on, push."
473,00:28:23.67,00:28:23.67,>> JEFF: Erik on the course.Malakal has three bundles left.
474,00:28:26.21,00:28:26.21,>> Go!>> JEFF: Jason now getting a
475,00:28:29.21,00:28:29.21,ride back with Airai's secondbundle.
476,00:28:31.62,00:28:31.62,Erik struggling on the bridge.Airai now making up some time.
477,00:28:34.75,00:28:34.75,Erik reaches the platform.Parvati on the course.
478,00:28:47.33,00:28:47.33,">> Come on, Parv!You got it, girl!"
479,00:28:49.42,00:28:49.42,">> JEFF: We are tied, twobundles each."
480,00:28:54.75,00:28:54.75,>> Yeah!>> JEFF: Parvati struggling on
481,00:28:56.58,00:28:56.58,"the bridge.>> Good job, Parv!"
482,00:28:59.67,00:28:59.67,"Keep it up, girl!>> JEFF: Erik back with the"
483,00:29:02.17,00:29:02.17,third puzzle piece for Malakal.Only two puzzle pieces left.
484,00:29:06.12,00:29:06.12,">> You got it, girl.>> Almost there!"
485,00:29:08.21,00:29:08.21,>> JEFF: Ozzy having no troubleon this bridge.
486,00:29:11.08,00:29:11.08,Parvati reaches the end.She's clipped in.
487,00:29:14.04,00:29:14.04,Parvati now being dragged in.Ozzy reaches the end of the
488,00:29:17.29,00:29:17.29,platform quickly.>> There you go!
489,00:29:28.67,00:29:28.67,>> JEFF: Ozzy like he's on aboogie board.
490,00:29:32.58,00:29:32.58,Ozzy's going to go again.Malakal with their fourth puzzle
491,00:29:35.62,00:29:35.62,piece.Parvati back with the third
492,00:29:37.75,00:29:37.75,puzzle piece for Airai.Natalie heading out on the
493,00:29:40.08,00:29:40.08,course.Malakal leads 4-3.
494,00:29:42.62,00:29:42.62,">> You got it, Nat!>> Come on, Ozzy!"
495,00:29:44.88,00:29:44.88,>> JEFF: Ozzy heads out for thatfifth and final puzzle piece for
496,00:29:47.83,00:29:47.83,Malakal.Natalie losing a lot of time for
497,00:29:55.25,00:29:55.25,Airai.Ozzy's coming back with that
498,00:29:57.17,00:29:57.17,fifth and final piece.Natalie's at the platform and
499,00:30:00.17,00:30:00.17,clipped in.>> Hold on!
500,00:30:02.21,00:30:02.21,>> JEFF: Malakal pulling himback.
501,00:30:05.71,00:30:05.71,Ozzy really working it like it'sa board.
502,00:30:07.88,00:30:07.88,Malakal has all five pieces.Go!
503,00:30:11.25,00:30:11.25,"Two puzzle makers.>> Go, go, go!"
504,00:30:14.00,00:30:14.00,>> JEFF: Amanda and Cirie startworking on the puzzle for
505,00:30:16.08,00:30:16.08,Malakal.Eliza heads out for that fifth
506,00:30:19.00,00:30:19.00,and final puzzle piece perAirai.
507,00:30:21.92,00:30:21.92,Malakal already working on thatpuzzle with a big lead.
508,00:30:25.54,00:30:25.54,This puzzle will form a perfectsquare.
509,00:30:29.12,00:30:29.12,">> Go, go, go!>> JEFF: Eliza clips in to the"
510,00:30:31.83,00:30:31.83,"fifth puzzle piece for Airai.The quicker you get started, the"
511,00:30:34.88,00:30:34.88,faster you will finish.Eliza back with the final piece!
512,00:30:39.21,00:30:39.21,Go!Jason and Eliza going to work on
513,00:30:43.17,00:30:43.17,the puzzle.Amanda and Cirie working on the
514,00:30:45.33,00:30:45.33,puzzle for Malakal.Immunity on the line.
515,00:30:48.75,00:30:48.75,">> You guys are doing great!>> JEFF: These pieces are heavy,"
516,00:30:51.38,00:30:51.38,going to be hard to move.Jason and Eliza still untying.
517,00:30:54.46,00:30:54.46,">> It's okay, guys, get themuntied."
518,00:30:56.54,00:30:56.54,>> We've got them untied.We just need to get them out.
519,00:30:58.75,00:30:58.75,Help me get them out.>> JEFF: Malakal with a big lead
520,00:31:01.83,00:31:01.83,already starting to work on thispuzzle.
521,00:31:03.96,00:31:03.96,Eliza and Jason have all five oftheir pieces untied.
522,00:31:07.04,00:31:07.04,They're starting to work onforming the puzzle.
523,00:31:09.79,00:31:09.79,>> Use that one.>> This one?
524,00:31:11.83,00:31:11.83,">> Right here, yeah.Push that one over, Amanda!"
525,00:31:14.08,00:31:14.08,>> JEFF: Amanda and Cirie nowstarting to struggle a bit.
526,00:31:17.92,00:31:17.92,"Jason and Eliza have a differentstrategy, spreading all the piss"
527,00:31:21.54,00:31:21.54,"out, looking for patterns.>> Help her pull this one!"
528,00:31:25.21,00:31:25.21,Help her pull this one!>> JEFF: Cirie and Amanda really
529,00:31:27.12,00:31:27.12,slowing down.Eliza and Jason starting to make
530,00:31:29.58,00:31:29.58,a little progress.>> This one at the bottom?
531,00:31:32.00,00:31:32.00,">> Yeah, yeah.Flip it around."
532,00:31:33.62,00:31:33.62,There you go.There you go.
533,00:31:35.12,00:31:35.12,">> Turn it, turn it!Right here, right here."
534,00:31:38.25,00:31:38.25,>> That one might be the center.>> JEFF: Cirie and Amanda taking
535,00:31:40.50,00:31:40.50,"their time.>> That one right there, that"
536,00:31:44.71,00:31:44.71,one right there.Right in the middle.
537,00:31:47.71,00:31:47.71,>> JEFF: Eliza and Jason tryingto shove one last piece in.
538,00:31:50.88,00:31:50.88,Will it fit?Is it right?
539,00:31:54.17,00:31:54.17,"Airai wins immunity!Airai, congratulations."
540,00:32:03.17,00:32:03.17,"Immunity is yours once again.For the third straight time,"
541,00:32:08.83,00:32:08.83,"Airai wins immunity, safe fromtribal council."
542,00:32:11.54,00:32:11.54,"Malakal, tribal council tonight,where one of you is going home."
543,00:32:14.67,00:32:14.67,Grab your stuff.See you there.
544,00:32:17.62,00:32:17.62,"Airai, head out.Nice job."
545,00:32:42.54,00:32:42.54,">> Hey, Oz, I'm so sorry aboutthe puzzle."
546,00:32:45.17,00:32:45.17,I feel like crap about it.>> Yeah.
547,00:32:47.58,00:32:47.58,It was so easy.>> So then who do we choose?
548,00:33:03.75,00:33:03.75,>> I think it just makes moresense if Tracy...
549,00:33:06.08,00:33:06.08,>> Ozzy is wanting Erik to staybecause he's got a good
550,00:33:09.42,00:33:09.42,"relationship going with Erik,but I just feel like I can work"
551,00:33:13.50,00:33:13.50,"more with Tracy.She's more into the game, and"
552,00:33:16.12,00:33:16.12,"being third or fourth amongCirie, Ozzy, and Amanda is"
553,00:33:19.38,00:33:19.38,something that's definitelyalways on my mind.
554,00:33:21.83,00:33:21.83,Could I betray him if it comesdown to that?
555,00:33:24.25,00:33:24.25,Sometimes you have to pull thedirty cards to stay in the game.
556,00:33:27.79,00:33:27.79,Let me tell you what'shappening.
557,00:33:29.46,00:33:29.46,The girls want to get rid ofErik.
558,00:33:31.71,00:33:31.71,Ozzy wants to get rid of you.It was his idea to send you to
559,00:33:34.54,00:33:34.54,Exile.>> I know.
560,00:33:36.50,00:33:36.50,>> And so if we can get Ozzy tovote for you and us three girls
561,00:33:41.42,00:33:41.42,"to vote for, Erik, then you, me,and Erik can vote for Ozzy and"
562,00:33:47.12,00:33:47.12,get Ozzy out of here.>> The plan that Tracy and I
563,00:33:50.75,00:33:50.75,"talked about is talk Amanda andCirie into voting for Erik,"
564,00:33:54.75,00:33:54.75,which they want to do anyway.Tell them that I'll vote with
565,00:33:57.08,00:33:57.08,them.Go for that.
566,00:33:58.96,00:33:58.96,We all three say we're votingfor Erik.
567,00:34:01.33,00:34:01.33,"Ozzy doesn't know, and doesn'twant to vote for Erik, so he'll"
568,00:34:03.79,00:34:03.79,"vote for Tracy, thinking we'reall going to vote for Tracy."
569,00:34:06.54,00:34:06.54,"Well, underneath all of that,Tracy, Erik, and I are going to"
570,00:34:10.92,00:34:10.92,"vote for Ozzy, and just takeOzzy out at the knees."
571,00:34:25.62,00:34:25.62,>> Mm-hmm.You're next after me.
572,00:34:27.29,00:34:27.29,If you think you are.>> In order to pull off voting
573,00:34:30.62,00:34:30.62,"out Ozzy at this point, we haveto either pull in Cirie and"
574,00:34:33.54,00:34:33.54,"Amanda.If this doesn't work out, I have"
575,00:34:36.04,00:34:36.04,"to vote Tracy.If I voted Ozzy with Tracy, they"
576,00:34:38.62,00:34:38.62,"would flip out, and I would beso done, whatever came next."
577,00:34:47.50,00:34:47.50,">> Well, I know Ozzy wants me.But I'd like to stay."
578,00:34:51.83,00:34:51.83,And you got to think right nowwhat you're going to do.
579,00:34:54.25,00:34:54.25,Would you rather go up againstme or would you rather go up
580,00:34:56.12,00:34:56.12,against Ozzy?Would you rather go up against
581,00:34:57.62,00:34:57.62,Erik or would you rather go upagainst me?
582,00:35:04.42,00:35:04.42,As long as you two say thatthat's good.
583,00:35:10.21,00:35:10.21,">> So you feel like Erik, right,because of..."
584,00:35:16.38,00:35:16.38,">> Well, yeah.Are you?"
585,00:35:19.21,00:35:19.21,Do you think that's the bestdecision?
586,00:35:21.29,00:35:21.29,>> I'm just nervous about whatOzzy might have planned on the
587,00:35:24.12,00:35:24.12,other side with Erik and thosegirls.
588,00:35:26.92,00:35:26.92,">> If I was definitely set onwanting Erik out tonight, he'd"
589,00:35:29.25,00:35:29.25,be gone tonight.I guarantee you.
590,00:35:31.62,00:35:31.62,But I don't know at this pointif I will be able to turn on
591,00:35:34.21,00:35:34.21,"Ozzy or not.If I go against Ozzy, then I can"
592,00:35:37.21,00:35:37.21,pretty much kiss thatrelationship good-bye.
593,00:35:39.96,00:35:39.96,"I mean, there are so many peoplethat you have to vote out."
594,00:35:42.54,00:35:42.54,You're going to hurt someone'sfeelings in this game.
595,00:35:45.88,00:35:45.88,It's inevitable.>> Don't look at me!
596,00:35:55.12,00:35:55.12,">> If Cirie and Amanda don'tvote with me, there's a whole"
597,00:35:58.17,00:35:58.17,other path that could be taken.I'm kind of going both ways in
598,00:36:01.08,00:36:01.08,"my head still.Am I going to take Ozzy out, or"
599,00:36:04.17,00:36:04.17,am I going to stick with thesepeople that I've known from the
600,00:36:06.33,00:36:06.33,beginning and vote out one ofthe fans?
601,00:36:08.67,00:36:08.67,Tonight's decision is a very bigdecision.
602,00:36:11.29,00:36:11.29,It could change the game in aserious way.
603,00:36:31.88,00:36:31.88,>> JEFF: Let's get straight toit.
604,00:36:33.54,00:36:33.54,This tribe is obviously introuble.
605,00:36:35.42,00:36:35.42,You've lost three straightimmunity challenges.
606,00:36:37.88,00:36:37.88,The only reason you're evenhalfway in it is because of odd
607,00:36:40.29,00:36:40.29,circumstances-- Penner having tobe medically pulled out of the
608,00:36:44.29,00:36:44.29,"game, and Kathy deciding toquit."
609,00:36:47.21,00:36:47.21,"Tracy, who is leading thistribe?"
610,00:36:49.25,00:36:49.25,>> Ozzy.Ozzy is leading this tribe.
611,00:36:52.25,00:36:52.25,"I mean, Ozzy was the first onethat looked at me and said, ""You"
612,00:36:54.71,00:36:54.71,"need to go to Exile Island forthe tribe."""
613,00:36:57.21,00:36:57.21,"Ozzy tells us who is going tocompete, when you're going to"
614,00:37:00.21,00:37:00.21,"eat, and what you're going toeat."
615,00:37:02.29,00:37:02.29,">> JEFF: Ozzy, you had a bigreaction when Tracy said you're"
616,00:37:04.25,00:37:04.25,"the leader.>> Oh, yeah, just... it's"
617,00:37:06.12,00:37:06.12,"ridiculous.If I'm the leader of this tribe,"
618,00:37:08.38,00:37:08.38,I haven't known about it.I do what needs to get done at
619,00:37:10.88,00:37:10.88,"certain times, but I reallydon't feel like I'm the leader"
620,00:37:14.12,00:37:14.12,of the tribe.And I definitely don't feel like
621,00:37:16.71,00:37:16.71,"I'm deciding who eats what when.That doesn't make any sense, and"
622,00:37:20.04,00:37:20.04,"doesn't jibe with me at all.>> JEFF: Cirie, somebody's got"
623,00:37:24.88,00:37:24.88,to be leading the tribe to onedegree or another.
624,00:37:27.62,00:37:27.62,>> In a way I kind of see whereTracy's coming from.
625,00:37:29.92,00:37:29.92,"I'm not saying that Ozzy is theleader of the tribe, but just"
626,00:37:33.79,00:37:33.79,"about 90% of everything that wedo, everyone checks with Ozzy"
627,00:37:36.62,00:37:36.62,"first.>> JEFF: Erik, do you see what"
628,00:37:40.17,00:37:40.17,"everybody's talking about, thedynamics right now?"
629,00:37:42.79,00:37:42.79,>> There's a conflict going on.There's a conflict in this
630,00:37:46.21,00:37:46.21,"tribe.And, I mean, I understand Ozzy's"
631,00:37:49.12,00:37:49.12,"point.Nobody wants to be the leader,"
632,00:37:52.62,00:37:52.62,"but things need to get done.Things need to happen, and he's"
633,00:37:55.88,00:37:55.88,"doing so much for this tribe.If he was gone, we would fall"
634,00:37:57.67,00:37:57.67,apart faster than we are rightnow.
635,00:38:00.29,00:38:00.29,">> JEFF: Ami, there are twodifferent approaches this tribe"
636,00:38:03.08,00:38:03.08,"could take right now-- short-term thinking, which is, ""We"
637,00:38:05.92,00:38:05.92,"need to win challenges.""Long-term thinking is, ""I need"
638,00:38:09.12,00:38:09.12,"to start getting rid of peoplewho could beat me in this game."""
639,00:38:12.08,00:38:12.08,"Take me down that line.>> Well, you always have to be"
640,00:38:15.08,00:38:15.08,"looking out for, ""Which one ofthese people is going to be the"
641,00:38:18.42,00:38:18.42,"biggest threat to me, and when'sthe best time to get rid of"
642,00:38:22.17,00:38:22.17,"them?""And you've got to play your"
643,00:38:23.96,00:38:23.96,cards when it makes the mostsense.
644,00:38:25.67,00:38:25.67,">> JEFF: Ozzy, when you hear Amitalking about getting rid of the"
645,00:38:28.00,00:38:28.00,"people more threatening, makeyou a little concerned?"
646,00:38:31.79,00:38:31.79,">> Oh, yeah, it does.I'm not that naive to think that"
647,00:38:35.04,00:38:35.04,people don't want me gone evenif they need me to win
648,00:38:37.12,00:38:37.12,challenges.I'm still going to give it my
649,00:38:39.67,00:38:39.67,"all, and I'm still going to beloyal to the people that I've"
650,00:38:43.17,00:38:43.17,said I'm going to be loyal to.Nothing's going to change that.
651,00:38:45.67,00:38:45.67,"So if I'm a threat and peoplewant to get rid of me, you know,"
652,00:38:49.21,00:38:49.21,that's one strategy.But the other strategy is they
653,00:38:51.75,00:38:51.75,can be with me and we can tryand go to the end together.
654,00:38:54.79,00:38:54.79,">> JEFF: Tracy, why keep youtonight?"
655,00:38:58.21,00:38:58.21,>> I think I'd be a better tribemember than somebody's that's
656,00:39:01.12,00:39:01.12,going to demolish you if you dogo to the merge.
657,00:39:04.33,00:39:04.33,And I think that's that needs tobe a thought that all these
658,00:39:06.29,00:39:06.29,people need to think about.I would be less of a threat than
659,00:39:08.67,00:39:08.67,"Ozzy to Ami, to Amanda, toCirie, than Ozzy."
660,00:39:10.92,00:39:10.92,It's just as simple as that.It's black and white.
661,00:39:16.08,00:39:16.08,"There's no gray.>> JEFF: All right, let's get to"
662,00:39:18.54,00:39:18.54,it.It is time to vote.
663,00:39:20.71,00:39:20.71,"Amanda, you're up.>> You said you were honest, and"
664,00:39:37.12,00:39:37.12,that's bull.>> This is because you wanted me
665,00:39:51.38,00:39:51.38,out.Good player.
666,00:39:53.17,00:39:53.17,No hard feelings.>> JEFF: I'll go tally the
667,00:40:11.83,00:40:11.83,votes.If anybody has the hidden
668,00:40:23.08,00:40:23.08,"immunity idol and you want toplay it, now wouldn't time to do"
669,00:40:25.12,00:40:25.12,so.Okay.
670,00:40:33.42,00:40:33.42,"Once the votes are read, thedecision is final."
671,00:40:35.29,00:40:35.29,The person voted out will beasked to leave the tribal
672,00:40:37.08,00:40:37.08,council area immediately.I'll read the votes.
673,00:40:42.17,00:40:42.17,"First vote, Tracy.Ozzy."
674,00:40:48.33,00:40:48.33,"One vote Tracy, one vote Ozzy.Tracy."
675,00:40:57.38,00:40:57.38,"Two votes Tracy, one vote Ozzy.Tracy."
676,00:41:04.96,00:41:04.96,"That's three votes Tracy, onevote Ozzy."
677,00:41:11.71,00:41:11.71,Seventh person voted out ofSurvivor: Fans Versus
678,00:41:14.04,00:41:14.04,"Favorites, Tracy.That's four, that's enough."
679,00:41:17.12,00:41:17.12,"You need to bring me your torch.Tracy, the tribe has spoken."
680,00:41:33.29,00:41:33.29,"Time for you to go.Well, tonight's vote was big for"
681,00:41:45.67,00:41:45.67,one simple reason-- you've gotto start winning some
682,00:41:48.25,00:41:48.25,challenges.Hopefully you made the right
683,00:41:50.17,00:41:50.17,choice.Grab your torches.
684,00:41:52.00,00:41:52.00,Head back to camp.Good night.
685,00:41:54.83,00:41:54.83, Captioning sponsored by CBS PARAMOUNT NETWORK
686,00:41:56.83,00:41:56.83, TELEVISIONCaptioned by
687,00:42:01.92,00:42:01.92, Media Access Group at WGBHaccess.wgbh.org
688,00:42:07.88,00:42:07.88,>> JEFF: Stay tuned for scenesfrom our next episode.
689,00:42:13.42,00:42:13.42,>> JEFF: Next time on Survivor:Ami and Cirie go on the warpath.
690,00:42:19.50,00:42:19.50,"On Airai, Parvati makes newfriends."
691,00:42:22.04,00:42:22.04,">> You and Alexis, me andAmanda, final four."
692,00:42:24.79,00:42:24.79,>> JEFF: And the injuriescontinue to pile up.
693,00:42:28.17,00:42:28.17,Erik takes a hard hit.He's out!
694,00:42:37.54,00:42:37.54,>> Going up against thefavorites was quite difficult.
695,00:42:39.96,00:42:39.96,Ozzy's a wonderful player inthis game.
696,00:42:42.08,00:42:42.08,He is manipulative and he isstrategic.
697,00:42:45.71,00:42:45.71,He will definitely take the restof the tribe down.
698,00:42:48.08,00:42:48.08,They need to get rid of him ASAPor else they don't stand a
699,00:42:50.42,00:42:50.42,chance.I wish I could have stayed in
700,00:42:52.21,00:42:52.21,longer.I went out kicking.
701,00:42:54.25,00:42:54.25,"I did everything I could, andI'm just grateful to be here."
