,begin,end,subtitles_text
0,00:00:00.00,00:00:00.00,>> JEFF PROBST: Previously on
1,00:00:02.54,00:00:02.54,"Survivor:ROBST: Previously onDrop your buffs, we are"
2,00:00:04.17,00:00:04.17,switching tribes.The fans and favorites were
3,00:00:07.12,00:00:07.12,"mixed, putting an even number offans and favorites on both"
4,00:00:10.12,00:00:10.12,"sides.>> Oh, don't look so pissed off."
5,00:00:13.08,00:00:13.08,">> JEFF: After the switch, itbecame obvious how much the fans"
6,00:00:16.12,00:00:16.12,suffered.>> I'm amazed they're still
7,00:00:18.67,00:00:18.67,"alive, poor things.They should be dead."
8,00:00:20.92,00:00:20.92,>> JEFF: And how much thefavorites thrived.
9,00:00:23.00,00:00:23.00,>> Those guys are tough asnails.
10,00:00:25.21,00:00:25.21,>> JEFF: The new Airai gelledimmediately...
11,00:00:27.38,00:00:27.38,Airai wins!...and went on a winning streak.
12,00:00:29.92,00:00:29.92,But they lost Jonathan due it aninjury.
13,00:00:31.96,00:00:31.96,>> I couldn't have done anythingelse.
14,00:00:33.71,00:00:33.71,They did everything they coulddo.
15,00:00:41.46,00:00:41.46,">> JEFF: On Exile Island, Ozzyfound the hidden immunity idol"
16,00:00:45.17,00:00:45.17,"and replaced it with a fake oneas a decoy, which was discovered"
17,00:00:49.75,00:00:49.75,by Jason.>> I guess this is the hidden
18,00:00:55.29,00:00:55.29,"immunity idol.>> Help me, help me, somebody."
19,00:00:57.71,00:00:57.71,">> JEFF: Cirie is losing it.>> Help me, help me!"
20,00:00:59.71,00:00:59.71,>> JEFF: Airai has it!When the new Malakal lost their
21,00:01:02.04,00:01:02.04,"third challenge in a row, Chetvolunteered to be voted out."
22,00:01:06.00,00:01:06.00,And at tribal council Erikreceived two throwaway votes...
23,00:01:10.08,00:01:10.08,>> I vowed never to vote forChet.
24,00:01:12.17,00:01:12.17,>> JEFF: ...and Chet got therest...
25,00:01:14.00,00:01:14.00,Sixth person voted outof Survivor: Fans Versus
26,00:01:15.79,00:01:15.79,"Favorites, Chet....leaving two fans, Tracy and"
27,00:01:18.12,00:01:18.12,"Erik, on Ozzy's tribe.13 are left."
28,00:01:21.00,00:01:21.00,Who will be voted out tonight?>> A lot of crab.
29,00:01:32.21,00:01:32.21,>> Wow.>> I think we should have the
30,00:01:39.83,00:01:39.83,damn thing cut open right now.It's only laying two eggs
31,00:01:41.92,00:01:41.92,"anyway.>> Well, let's kill them right"
32,00:01:44.04,00:01:44.04,"now, all three of them.Oh, the chicken issue."
33,00:01:46.42,00:01:46.42,"Come on, girls.I think Tracy started it for"
34,00:01:49.04,00:01:49.04,some reason.I'm going to blame it on Tracy.
35,00:01:51.12,00:01:51.12,We've got three chickens thatlay three eggs almost every
36,00:01:53.62,00:01:53.62,"single day.Hey, it's a renewable resource."
37,00:01:56.38,00:01:56.38,You want to take out a renewableresource?
38,00:01:58.71,00:01:58.71,"That makes no sense.>> Like, you're not going to"
39,00:02:01.17,00:02:01.17,kill them as soon as some morepeople get off so you can have
40,00:02:03.62,00:02:03.62,more meat for yourself?>> No.
41,00:02:06.92,00:02:06.92,No.Not going to happen.
42,00:02:09.25,00:02:09.25,>> Yeah.>> It doesn't matter.
43,00:02:10.96,00:02:10.96,It doesn't matter the way thisgame works.
44,00:02:12.58,00:02:12.58,">> It's three weeks, threechickens."
45,00:02:14.38,00:02:14.38,>> Tracy is breeding a lot ofinsecurity around camp.
46,00:02:17.12,00:02:17.12,"Of course, she's trying to playthe game."
47,00:02:19.21,00:02:19.21,"She's trying to scramble to saveher own ass, but we don't need"
48,00:02:21.25,00:02:21.25,that.Look at this-- crabs.
49,00:02:25.00,00:02:25.00,We've got massive crabs.There's plenty of other food.
50,00:02:27.92,00:02:27.92,"We just have to, like, get it.>> Ozzy is in control of this"
51,00:02:31.21,00:02:31.21,tribe.He's like the kingpin.
52,00:02:33.33,00:02:33.33,He tells you what you can andcan't do.
53,00:02:35.46,00:02:35.46,He tells you when you're goingto eat.
54,00:02:37.33,00:02:37.33,He cooks the food and then wehave to wait until Ozzy says eat
55,00:02:39.25,00:02:39.25,it.It's crazy.
56,00:02:40.92,00:02:40.92,"I mean, it's just crazy.Ozzy is going to win this thing"
57,00:02:42.83,00:02:42.83,if we don't get him out of thisgame.
58,00:02:46.21,00:02:46.21, Captioning sponsored by CBS PARAMOUNT NETWORK
59,00:02:47.92,00:02:47.92, TELEVISION( theme song playing )
60,00:03:51.21,00:03:51.21,>> We're definitely on a rainstreak.
61,00:03:56.71,00:03:56.71,"I just want to get clean.Oh, yeah."
62,00:04:01.42,00:04:01.42,Another day in the lap ofluxury.
63,00:04:05.33,00:04:05.33,"How do we do it, ladies?>> They complain about the rain."
64,00:04:11.17,00:04:11.17,But they didn't get wet becausewe were in the cave.
65,00:04:14.17,00:04:14.17,"I mean, you could be like it wasbefore-- outside, under a bush,"
66,00:04:17.54,00:04:17.54,getting pummeled by this rain.>> I bet nothing can capture the
67,00:04:21.54,00:04:21.54,true essence of the stenchand this funk.
68,00:04:26.17,00:04:26.17,>> And how filthy we are rightnow.
69,00:04:29.29,00:04:29.29,>> Deal with the funk.It couldn't have smelled any
70,00:04:31.17,00:04:31.17,better than what they were inbefore.
71,00:04:32.58,00:04:32.58,Just relax.We're not going to be here
72,00:04:34.04,00:04:34.04,forever.This is a game called
73,00:04:35.79,00:04:35.79,called Survivor.>> I don't even see where
74,00:04:38.17,00:04:38.17,there's...>> A sign of hope?
75,00:04:40.46,00:04:40.46,>> No.>> Is my face just dirty?
76,00:04:44.62,00:04:44.62,>> This is just the stupidestthing I ever did in my life.
77,00:04:46.67,00:04:46.67,Probably because I'm just... I'mcrabby.
78,00:04:49.46,00:04:49.46,"I'm not a morning person.>> Oh, baby."
79,00:04:52.42,00:04:52.42,">> The moods out here are you'reon one day and feeling good, and"
80,00:04:57.21,00:04:57.21,"the next day it's just all crap.Today, this morning is a crap"
81,00:05:00.29,00:05:00.29,day.>> Could we just get a day of
82,00:05:03.17,00:05:03.17,"sunshine, please?Wash and dry our clothes."
83,00:05:07.25,00:05:07.25,">> Oh, my god.Thinking of home and my washer"
84,00:05:11.21,00:05:11.21,"and dryer and my food and mydaughter and my husband, and..."
85,00:05:15.17,00:05:15.17,"Well, it's going to make me cry.It's going to make me want to be"
86,00:05:18.92,00:05:18.92,"there.Nope, still here."
87,00:05:22.58,00:05:22.58,Damn!>> Ozzy is amazing.
88,00:05:39.29,00:05:39.29,"I honestly like Ozzy.He's an awesome guy, and I want"
89,00:05:41.67,00:05:41.67,to learn.I want to grow.
90,00:05:43.83,00:05:43.83,I want to go outside the smallscope that I've lived in and
91,00:05:46.71,00:05:46.71,just see a lot more of theworld.
92,00:05:49.04,00:05:49.04,"And everybody thinks Ozzy is,look, the wonderkid, or"
93,00:05:51.21,00:05:51.21,"whatever.And I'm just like, ""I can do"
94,00:05:52.92,00:05:52.92,"that.I can climb a coconut tree,"
95,00:05:54.62,00:05:54.62,"too."">> Some of them look like"
96,00:05:56.50,00:05:56.50,"they're stable, but then you'llpull it, and they'll just pull"
97,00:05:58.62,00:05:58.62,right off.When you grab the green palm
98,00:06:00.83,00:06:00.83,"frond, give it a little test.>> Erik and Ozzy are like The"
99,00:06:05.00,00:06:05.00,"Lion King, the father, when hewas teaching the cub."
100,00:06:09.12,00:06:09.12,"And you can just see, like,stars."
101,00:06:12.17,00:06:12.17,"Whenever he says Ozzy's name,like, stardust comes out of his"
102,00:06:14.25,00:06:14.25,"mouth.Erik just is like, ""Ozzy..."""
103,00:06:17.67,00:06:17.67,>> A couple of more steps andyou're there.
104,00:06:20.17,00:06:20.17,">> Wow.>> Cool, huh?"
105,00:06:23.58,00:06:23.58,"Good job, dude.>> They're bonding right now."
106,00:06:27.04,00:06:27.04,">> Oh, my god.>> Yes!"
107,00:06:32.21,00:06:32.21,>> You've got good nuts now.>> I think if Ozzy were to
108,00:06:37.17,00:06:37.17,"propose marriage to Erik rightnow, done deal."
109,00:06:42.83,00:06:42.83,>> I want to move the boat.>> Okay.
110,00:06:45.67,00:06:45.67,">> To the back beach.>> Oh, wow."
111,00:06:48.17,00:06:48.17,>> It makes way more sense tohave it on that side.
112,00:06:50.83,00:06:50.83,It will be fast.>> They asked me to help move
113,00:06:53.79,00:06:53.79,"the boat to the back beach.We'd better be able to get back,"
114,00:06:57.04,00:06:57.04,"I know that, before it'ssundown."
115,00:07:01.42,00:07:01.42,"Everybody knows, it's no secret,I'm not a strong swimmer, but"
116,00:07:06.21,00:07:06.21,"being a team player, you thinkyou can get more fish on the"
117,00:07:08.79,00:07:08.79,"back beach, I'll help you row tothe back beach."
118,00:07:16.67,00:07:16.67,"When we get way out in themiddle of nowhere, and Ozzy"
119,00:07:19.83,00:07:19.83,"decides, ""well, the reef isright there, come on, we can get"
120,00:07:22.00,00:07:22.00,"really big fish at the reef,""I'm nervous as hell."
121,00:07:24.79,00:07:24.79,I've never been out that far inthe ocean in a little wooden
122,00:07:30.54,00:07:30.54,boat.>> I can see!
123,00:07:38.42,00:07:38.42,"I can see what you can see!Yeah, you."
124,00:07:46.17,00:07:46.17,>> Just trust me for a littlebit.
125,00:07:48.71,00:07:48.71,There could be a giant clam outthere that will feed us for the
126,00:07:50.71,00:07:50.71,rest of the time.Maybe there will be a pearl in
127,00:07:53.21,00:07:53.21,there I can give Cirie forpaddling out here.
128,00:07:56.04,00:07:56.04,">> Ozzy is about numero uno, andthat's Oscar."
129,00:08:05.04,00:08:05.04,"Yay, reef, reef.>> Cirie!"
130,00:08:10.21,00:08:10.21,"Oh, you're unhappy!>> So they'll have this little"
131,00:08:14.92,00:08:14.92,"reef adventure at my expensetoday, but it won't happen"
132,00:08:16.67,00:08:16.67,"again.>> JEFF: Come on in, guys!"
133,00:08:29.83,00:08:29.83,Airai getting your first look atthe new Malakal tribe.
134,00:08:32.58,00:08:32.58,Chet voted out at the lasttribal council.
135,00:08:38.12,00:08:38.12,You guys ready to get to today'schallenge?
136,00:08:39.92,00:08:39.92,>> Yeah.>> Yeah.
137,00:08:41.38,00:08:41.38,>> JEFF: This is a traditionalMicronesian money stone.
138,00:08:43.96,00:08:43.96,"For years, these stones were thecurrency in Micronesia."
139,00:08:46.96,00:08:46.96,"The larger the stone, the morevalue."
140,00:08:49.21,00:08:49.21,Today they're a part of yourchallenge.
141,00:08:51.04,00:08:51.04,"For today's challenge, four ofyou will be blindfolded."
142,00:08:53.50,00:08:53.50,The other two tribe members willuse verbal direction to guide
143,00:08:57.12,00:08:57.12,you as you push a giant moneystone through the jungle course.
144,00:09:01.04,00:09:01.04,"Along the way, you will crushthe tiles at four stations"
145,00:09:05.25,00:09:05.25,revealing a pair of smallermoney stones.
146,00:09:09.00,00:09:09.00,You'll then use those eightstones to solve a rotating cog
147,00:09:12.58,00:09:12.58,puzzle.First tribe to get it right wins
148,00:09:16.08,00:09:16.08,reward.Want to know what you're playing
149,00:09:18.12,00:09:18.12,for?>> Yeah.
150,00:09:19.92,00:09:19.92,>> JEFF: Close your eyes andimagine you're under a beautiful
151,00:09:21.96,00:09:21.96,refreshing waterfall.>> Oh!
152,00:09:25.17,00:09:25.17,">> Oh, god!>> JEFF: And you're cleaning"
153,00:09:27.21,00:09:27.21,"your body, and you're washingyour hair."
154,00:09:29.17,00:09:29.17,">> Oh, you got to...>> That's your reward."
155,00:09:31.25,00:09:31.25,It is the herbal essence greatescape spa.
156,00:09:34.79,00:09:34.79,The winning tribe will be takento an island.
157,00:09:37.58,00:09:37.58,"You'll have plenty of products.You can wash up, get clean."
158,00:09:40.12,00:09:40.12,"When you're finished, a nicelittle snack to round out the"
159,00:09:43.54,00:09:43.54,day.Worth playing for?
160,00:09:45.71,00:09:45.71,>> Yes.>> Absolutely.
161,00:09:47.58,00:09:47.58,">> JEFF: In addition, thewinning tribe will send one"
162,00:09:49.71,00:09:49.71,member from the losing tribe toExile Island.
163,00:09:51.92,00:09:51.92,"You will also choose somebody,again, from your own tribe to"
164,00:09:54.71,00:09:54.71,"join them.Airai, you have one extra"
165,00:09:57.17,00:09:57.17,member.Who is going to sit this one
166,00:09:58.88,00:09:58.88,out?>> I am.
167,00:10:00.54,00:10:00.54,">> JEFF: All right, Natalie,take a spot over here."
168,00:10:02.46,00:10:02.46,Give the rest of you a minute tostrategize.
169,00:10:04.92,00:10:04.92,"We'll get started.All right, here we go."
170,00:10:09.50,00:10:09.50,For reward.Survivors ready?
171,00:10:13.79,00:10:13.79,"Go!>> Come on, guys."
172,00:10:15.79,00:10:15.79,"Come on, come on, come on, comeon, come on, come on, come on."
173,00:10:17.38,00:10:17.38,"Keep coming.>> Okay, follow my voice, follow"
174,00:10:19.12,00:10:19.12,my voice.Keep coming straight.
175,00:10:20.54,00:10:20.54,"Keep coming, keep coming, keepcoming."
176,00:10:22.08,00:10:22.08,">> Come on, straight, straight.Pivot to your left, to your"
177,00:10:24.67,00:10:24.67,left.The other way!
178,00:10:27.29,00:10:27.29,">> That's right.>> Cirie, you're backwards."
179,00:10:30.12,00:10:30.12,"Right, right, right.>> Okay, stop!"
180,00:10:33.08,00:10:33.08,Come across!>> JEFF: Malakal is through
181,00:10:35.92,00:10:35.92,their first tile.>> Keep going.
182,00:10:38.17,00:10:38.17,"Okay, you're at the thing.You feel it?"
183,00:10:39.83,00:10:39.83,You've got to pivot left alittle.
184,00:10:41.50,00:10:41.50,"Okay, straight.Keep going!"
185,00:10:43.12,00:10:43.12,Keep going.Straight.
186,00:10:44.38,00:10:44.38,There you go.You broke the stone.
187,00:10:45.96,00:10:45.96,>> JEFF: Airai is through thefirst tile.
188,00:10:47.33,00:10:47.33,They have their first two moneystones.
189,00:10:48.96,00:10:48.96,">> To your left.No, no, I'm sorry."
190,00:10:50.33,00:10:50.33,To your right.To your right.
191,00:10:52.04,00:10:52.04,">> Okay, now toward the left,toward the left, toward the"
192,00:10:53.38,00:10:53.38,"left, toward the left.>> Now back up."
193,00:10:55.08,00:10:55.08,"Just back straight up.>> A little right, a little"
194,00:10:56.50,00:10:56.50,right.Right.
195,00:10:58.00,00:10:58.00,"Keep going, keep going, keepgoing, keep going."
196,00:10:59.38,00:10:59.38,">> Okay, now straight over itthis way!"
197,00:11:01.08,00:11:01.08,"Got it, got it!>> JEFF: Malakal smashes their"
198,00:11:02.58,00:11:02.58,"second tile.>> Perfect, perfect!"
199,00:11:04.62,00:11:04.62,"Straight.Okay, you broke it."
200,00:11:06.88,00:11:06.88,>> JEFF: Airai smashes theirsecond tile.
201,00:11:09.50,00:11:09.50,">> Over here.Come on, come on!"
202,00:11:11.25,00:11:11.25,">> Haul ass!Go, go, go!"
203,00:11:13.17,00:11:13.17,>> Stop!Now come forward.
204,00:11:15.33,00:11:15.33,"Slow, slow.>> JEFF: Malakal lined up for"
205,00:11:17.29,00:11:17.29,"their third tile, and they haveit."
206,00:11:19.75,00:11:19.75,>> Over here!>> JEFF: One tile left to break
207,00:11:21.58,00:11:21.58,before you start working on thatpuzzle.
208,00:11:24.00,00:11:24.00,">> Come straight towards me,straight toward me."
209,00:11:26.08,00:11:26.08,It didn't break.It didn't break.
210,00:11:27.79,00:11:27.79,"Back it up.Back it up, back it up."
211,00:11:29.67,00:11:29.67,>> Which way do we move it now?>> Shut up and listen!
212,00:11:31.42,00:11:31.42,">> Pivot right, pivot right.Now come straight through, come"
213,00:11:33.54,00:11:33.54,straight through.Yes.
214,00:11:35.29,00:11:35.29,>> JEFF: Airai smashes theirthird tile.
215,00:11:37.17,00:11:37.17,>> Turn to your right a littlemore.
216,00:11:39.17,00:11:39.17,"Straight across, right now!>> JEFF: Cirie not messing"
217,00:11:41.25,00:11:41.25,around.They're straight through.
218,00:11:43.17,00:11:43.17,Malakal has all eight.Start working on the puzzle.
219,00:11:46.21,00:11:46.21,"Three people.>> Okay, you're almost at the"
220,00:11:49.54,00:11:49.54,last one guys.Keep coming straight.
221,00:11:51.50,00:11:51.50,"Okay, now, perfect.You should be able to come"
222,00:11:53.17,00:11:53.17,"straight through.Yes, good job, good job, good"
223,00:11:54.62,00:11:54.62,job.>> JEFF: Airai has their eighth
224,00:11:56.25,00:11:56.25,and final money stone.Start working on the puzzle.
225,00:11:58.83,00:11:58.83,"It's Erik, Cirie, and Ozzyworking for Malakal."
226,00:12:02.54,00:12:02.54,"Eliza, Kathy, and James workingthe puzzle for Airai."
227,00:12:05.71,00:12:05.71,This puzzle will only gotogether one way.
228,00:12:10.83,00:12:10.83,That does not mean certainpieces won't fit in and appear
229,00:12:14.25,00:12:14.25,to be right and still be wrong.>> Okay.
230,00:12:17.79,00:12:17.79,>> JEFF: It is trial and error.>> There we go.
231,00:12:21.25,00:12:21.25,>> I don't think you have toforce it that much.
232,00:12:24.17,00:12:24.17,>> JEFF: James hoping it's inthe right spot.
233,00:12:26.08,00:12:26.08,>> This one right here.This one right here.
234,00:12:28.21,00:12:28.21,"This is right.>> JEFF: Eliza, James, Kathy,"
235,00:12:33.17,00:12:33.17,"not making much progress.>> That's it, that's it, Ozzy."
236,00:12:38.62,00:12:38.62,>> JEFF: Malakal thinks they'regetting closer.
237,00:12:41.58,00:12:41.58,>> We need one more.Do we got it?
238,00:12:44.46,00:12:44.46,>> We got it!Jeff!
239,00:12:46.25,00:12:46.25,>> JEFF: Malakal thinks theyhave it.
240,00:12:48.46,00:12:48.46,Malakal wins reward!>> Yes!
241,00:13:01.17,00:13:01.17,">> JEFF: Malakal,congratulations."
242,00:13:03.12,00:13:03.12,>> Thank you.>> JEFF: Nice big reward coming
243,00:13:04.83,00:13:04.83,your way.First things first-- choosing
244,00:13:06.83,00:13:06.83,somebody from Airai to go toExile Island.
245,00:13:10.17,00:13:10.17,">> Jason.>> JEFF: Jason, you're going"
246,00:13:12.33,00:13:12.33,"back to Exile Island.Now, Malakal, you have to choose"
247,00:13:15.42,00:13:15.42,"somebody from your own tribe togo to Exile Island, which means"
248,00:13:18.79,00:13:18.79,they will not go on the spareward.
249,00:13:21.17,00:13:21.17,>> Oh!>> Wow!
250,00:13:24.00,00:13:24.00,>> Can you take one for theteam?
251,00:13:27.75,00:13:27.75,">> Me?Oh, god."
252,00:13:30.29,00:13:30.29,"I'm going to Exile.>> JEFF: All right, Tracy,"
253,00:13:33.21,00:13:33.21,"Jason, get your stuff.The boat's waiting on you."
254,00:13:39.67,00:13:39.67,"Airai, got nothing for you.Grab your stuff."
255,00:13:42.38,00:13:42.38,"Head back to camp.Malakal, come get your stuff."
256,00:13:49.21,00:13:49.21,The boat is waiting for you.>> Yeah!
257,00:14:10.00,00:14:10.00,"Oh, damn!( cheering )"
258,00:14:16.12,00:14:16.12,>> Muffins.>> Cookies!
259,00:14:19.96,00:14:19.96,">> It was so funny to see Erik.For one, he was experiencing a"
260,00:14:23.67,00:14:23.67,reward for the first time sincehe's been here.
261,00:14:26.62,00:14:26.62,>> I am so happy right now.>> It was really cool.
262,00:14:31.08,00:14:31.08,"I mean, he's like a wide-eyedkid in a candy store."
263,00:14:34.50,00:14:34.50,It made me feel proud that wewere able to win and bring him
264,00:14:38.58,00:14:38.58,in and let him experience this.>> That was nice.
265,00:14:42.21,00:14:42.21,>> Yeah.>> What is that?
266,00:14:45.25,00:14:45.25,I think that's our shower rightthere.
267,00:14:47.71,00:14:47.71,>> Yeah.>> You want to go shower?
268,00:14:49.62,00:14:49.62,>> I'll come scrub your backwhen you're halfway through.
269,00:14:53.58,00:14:53.58,">> Oh, yeah!>> Oh, my gosh."
270,00:14:56.25,00:14:56.25,">> Oh, yeah!>> Ami, come on!"
271,00:14:58.33,00:14:58.33,>> I'm getting naked.I don't care.
272,00:15:01.71,00:15:01.71,">> Oh, my god!>> Everyone, get naked."
273,00:15:12.00,00:15:12.00,>> My goodness.Ooh-wee.
274,00:15:16.25,00:15:16.25,"I don't know.I just looked over and there's,"
275,00:15:18.62,00:15:18.62,"like, a couple of pair of boobs,and Ozzy's head smack dab in the"
276,00:15:20.88,00:15:20.88,"middle.I'm like, ""Okay."""
277,00:15:23.62,00:15:23.62,The only thing funnier was Erikdrooling from the sight.
278,00:15:28.08,00:15:28.08,"( laughs )Hey, to each his own."
279,00:15:33.42,00:15:33.42,"If you feel free like that, thenby all means, get free."
280,00:15:39.46,00:15:39.46,"I just wouldn't do it.>> Oh, oh, man."
281,00:15:45.33,00:15:45.33,This is as perfect as I couldhave ever hoped for.
282,00:15:56.25,00:15:56.25,>> This came on so fast.>> It's a freaking mon-freaking-
283,00:15:59.17,00:15:59.17,soon.>> It just came out of nowhere.
284,00:16:05.54,00:16:05.54,">> It's completely different.You watch this show at home, and"
285,00:16:08.92,00:16:08.92,"when they show the rain, theyshow it for, like, 30 seconds."
286,00:16:13.33,00:16:13.33,They're not showing that you'restanding in the rain or trying
287,00:16:16.71,00:16:16.71,"to sleep while you're beingrained on for five, six hours"
288,00:16:20.04,00:16:20.04,"straight, non-stop.We had to stand out there, and"
289,00:16:38.38,00:16:38.38,"James went out in the rain andcaught a clam, and we had to sit"
290,00:16:41.17,00:16:41.17,"around and eat a raw clam,because there's no fire, and"
291,00:16:43.67,00:16:43.67,you're all just digging in itwith your hands like you're
292,00:16:45.50,00:16:45.50,animals.>> You guys okay if I put a
293,00:16:48.12,00:16:48.12,little on my lemon?>> You people are disgusting.
294,00:16:51.17,00:16:51.17,I was just talking about how Ithink...
295,00:16:53.38,00:16:53.38,">> And it's full of sand, andit's full of dirt."
296,00:16:56.00,00:16:56.00,"And the coconut you're cleaningfalls on the ground, but you"
297,00:16:58.42,00:16:58.42,"don't care.You just put it back in, because"
298,00:17:00.25,00:17:00.25,it's food.And it's just savagery.
299,00:17:03.46,00:17:03.46,"It's like you're cavemen, youknow?"
300,00:17:06.83,00:17:06.83,Never in a million years would Iever do this twice.
301,00:17:17.12,00:17:17.12,">> Is it scary in there?>> It just rained, and it"
302,00:17:22.04,00:17:22.04,"rained, and we crawled way downinto the cave."
303,00:17:25.21,00:17:25.21,And it's miserable.And it's awful.
304,00:17:27.62,00:17:27.62,And it's dirty.And you don't even know what's
305,00:17:31.79,00:17:31.79,dead and crawling.Son of a bitch!
306,00:17:34.54,00:17:34.54,We sleep in the caves with batsand rats and crawly things.
307,00:17:38.75,00:17:38.75,>> Ow!>> It's hard to explain that
308,00:17:42.96,00:17:42.96,"experience, that it's just...it's just so uncomfortable."
309,00:17:46.21,00:17:46.21,It's so unpleasant.And I said it myself the other
310,00:17:48.71,00:17:48.71,"day, ""This is the stupidestthing I've ever done in my life."
311,00:17:50.67,00:17:50.67,"This is the dumbest thing I'veever done."""
312,00:18:11.08,00:18:11.08,"Well, when I woke up thismorning, I hadn't gotten any"
313,00:18:14.21,00:18:14.21,"sleep.Again, we were in the cave."
314,00:18:16.04,00:18:16.04,It rained all night.And I was looking for some kind
315,00:18:19.17,00:18:19.17,"of strength, and I couldn't findit."
316,00:18:23.71,00:18:23.71,"I was thinking of putting somewood on the beach, but I don't"
317,00:18:25.83,00:18:25.83,know how high the tide will comein.
318,00:18:27.88,00:18:27.88,"Can I have one more hug, onemore?"
319,00:18:29.54,00:18:29.54,I need one more hug to get methrough the day.
320,00:18:33.21,00:18:33.21,"I'm just so out of it, James.>> It's okay."
321,00:18:35.62,00:18:35.62,"Everybody has their days.>> You know, I was trying to"
322,00:18:43.54,00:18:43.54,"send... it sounds so stupid.I was trying to send, like,"
323,00:18:47.04,00:18:47.04,"vibes to my daughter, Maddie.You know, ""Can you hear me?"
324,00:18:50.25,00:18:50.25,You can feel me?I need your help.
325,00:18:53.00,00:18:53.00,I need your help to help methrough this because I can't do
326,00:18:57.96,00:18:57.96,"this.""And I couldn't... I couldn't"
327,00:19:00.25,00:19:00.25,feel her.I can't feel my family.
328,00:19:13.04,00:19:13.04,"I don't know what it is, but I'mjust downward spiraling, and I"
329,00:19:15.12,00:19:15.12,"can't take another minute, Ican't."
330,00:19:18.88,00:19:18.88,"I can't.I know it's sunny, it's"
331,00:19:21.67,00:19:21.67,"beautiful, it's like, ""Ooh,""But I can't."
332,00:19:24.12,00:19:24.12,I can't be here one more minute.I can't take it.
333,00:19:26.62,00:19:26.62,And I just want you guys to beokay and not hate me for it.
334,00:19:28.75,00:19:28.75,"I just can't take it one moreminute, I can't."
335,00:19:36.12,00:19:36.12,>> You have to be 100% sure.>> I'm 100% sure.
336,00:19:38.75,00:19:38.75,I can't.I can't do it anymore.
337,00:19:41.12,00:19:41.12,">> Not to make light of howyou're feeling, but we all feel"
338,00:19:44.33,00:19:44.33,like that today.We're all going bananas.
339,00:19:47.17,00:19:47.17,And I'm not trying to make lightof what's going on in your head.
340,00:19:50.33,00:19:50.33,>> It's a tough day.>> It's just a hard day.
341,00:19:54.00,00:19:54.00,>> Let's walk in the sun alittle bit.
342,00:19:56.21,00:19:56.21,">> Come here, come here.>> I want to go now."
343,00:19:59.04,00:19:59.04,>> It's okay.I want them to come and get a
344,00:20:02.00,00:20:02.00,"boat and pick me up and take meaway, because I can't do this"
345,00:20:04.50,00:20:04.50,anymore.I can't.
346,00:20:06.71,00:20:06.71,"I tried so hard.>> I know, sweetie, I know."
347,00:20:08.71,00:20:08.71,>> I tried so hard.>> I know.
348,00:20:11.21,00:20:11.21,">> I think it was a horriblenight, and I think it just took"
349,00:20:14.46,00:20:14.46,its toll on Kathy.Kathy just really got in her
350,00:20:16.83,00:20:16.83,"head today.Like, everything just compiled"
351,00:20:19.42,00:20:19.42,"and built up one upon another,and she's just severely"
352,00:20:22.04,00:20:22.04,depressed.>> I just want to go.
353,00:20:25.33,00:20:25.33,">> She just came up to us on thebeach, bawling, crying, and told"
354,00:20:28.38,00:20:28.38,us that she can't take anotherday out here and she has to go.
355,00:20:31.25,00:20:31.25,"Like, she's done.She's quitting the game."
356,00:20:48.12,00:20:48.12,">> JEFF: Hello, guys.>> Hi."
357,00:20:50.08,00:20:50.08,">> Hi.>> JEFF: So, well, I got word"
358,00:20:52.96,00:20:52.96,that you wanted to see me.You've had enough?
359,00:20:56.04,00:20:56.04,What's going on?It's 19 days you've been out
