,begin,end,subtitles_text
349,00:24:37.97,00:24:37.97,"what's going to happen tonight,but I can't be certain."
350,00:24:41.67,00:24:41.67,">> JEFF: Parvati, it seems to meonly a fool would say anything"
351,00:24:45.13,00:24:45.13,with confidence at tribalcouncil.
352,00:24:48.50,00:24:48.50,"All you have to do is lookacross at Ozzy, and Jason, and"
353,00:24:51.50,00:24:51.50,"Alexis, and Erik.They were all certain they"
354,00:24:56.93,00:24:56.93,"weren't going home.>> Yeah, I think this has been"
355,00:24:59.20,00:24:59.20,"the craziest, messiest, moststrategic game in the history of"
356,00:25:04.57,00:25:04.57,"Survivor.So for anyone to feel confident,"
357,00:25:07.63,00:25:07.63,"it's ludicrous.But I can't read anyone's mind,"
358,00:25:10.33,00:25:10.33,and I don't know what anyoneelse is thinking but myself.
359,00:25:13.20,00:25:13.20,">> JEFF: Amanda, have you guystalked about, ""What do we do"
360,00:25:17.00,00:25:17.00,"when there are only three peopleleft?"""
361,00:25:19.60,00:25:19.60,"Or have you been assuming,""That's all I've got to do is"
362,00:25:21.97,00:25:21.97,"just get to final three and I'mgood to go""?"
363,00:25:24.93,00:25:24.93,">> No one here, I think I canhonestly say that, is expecting"
364,00:25:29.17,00:25:29.17,"a final two.At this point in the game, it"
365,00:25:31.23,00:25:31.23,would take us for anotherwhirlwind.
366,00:25:33.07,00:25:33.07,">> JEFF: Cirie, how would itchange the game if you knew it"
367,00:25:35.33,00:25:35.33,"was a final two?>> I mean, it is nerve-wracking"
368,00:25:38.60,00:25:38.60,"to think it could be a finaltwo, because that makes me feel"
369,00:25:42.27,00:25:42.27,"like, once again, I'm on thebottom of the alliance, which is"
370,00:25:47.03,00:25:47.03,"not a good place to be, Jeff.>> I just have a question-- when"
371,00:25:50.17,00:25:50.17,did you ever think you were onthe bottom of the alliance?
372,00:25:53.33,00:25:53.33,">> No, no, no, from the five,when I started with you, Ozzy,"
373,00:25:56.37,00:25:56.37,"James, and Parvati, basically,it's unspoken that I'm on the"
374,00:25:59.00,00:25:59.00,bottom.Ozzy wanted you four to be in
375,00:26:02.23,00:26:02.23,the final four.So where does that place me when
376,00:26:04.77,00:26:04.77,we're going to the five?That makes me fifth.
377,00:26:07.40,00:26:07.40,>> I'm talking about after themerge.
378,00:26:09.10,00:26:09.10,"Like, when have you felt on thebottom?"
379,00:26:11.07,00:26:11.07,>> Always.>> Always?
380,00:26:13.10,00:26:13.10,">> Between us three?It's obvious, because not one"
381,00:26:16.43,00:26:16.43,"person in any alliance has eversaid, ""I won't vote for Cirie."""
382,00:26:21.23,00:26:21.23,"You have said, ""I won't votefor"" certain people."
383,00:26:23.67,00:26:23.67,"She has said, ""I won't vote foryou."""
384,00:26:25.87,00:26:25.87,So that clearly places me at thebottom of the alliance.
385,00:26:28.63,00:26:28.63,>> I'm just wondering.>> And I'm explaining how I feel
386,00:26:31.00,00:26:31.00,that way.I would be foolish not to think
387,00:26:33.80,00:26:33.80,"that.>> JEFF: Natalie, you're holding"
388,00:26:40.20,00:26:40.20,"back a big grin.>> I think at this point,"
389,00:26:43.03,00:26:43.03,"anything's an opportunity.You know, I'm just letting them"
390,00:26:45.33,00:26:45.33,"duke it out, and may the bestwoman win."
391,00:26:51.37,00:26:51.37,">> JEFF: All right, let's get tothe vote."
392,00:26:53.60,00:26:53.60,"Amanda, you have the immunitynecklace, you're not planning on"
393,00:26:55.63,00:26:55.63,"giving it to anyone else, areyou?"
394,00:26:57.47,00:26:57.47,>> No.>> JEFF: You cannot vote for
395,00:26:59.73,00:26:59.73,Amanda.Everybody else is fair game.
396,00:27:01.43,00:27:01.43,"It is time to vote.Amanda, you're up."
397,00:27:42.93,00:27:42.93,>> JEFF: I'll go tally thevotes.
398,00:27:59.07,00:27:59.07,"Once the votes are read, thedecision is final."
399,00:28:01.03,00:28:01.03,The person voted out will beasked to leave the tribal
400,00:28:03.00,00:28:03.00,council area immediately.I'll read the votes.
401,00:28:07.83,00:28:07.83,"First vote, Cirie.Natalie."
402,00:28:17.30,00:28:17.30,"One vote Natalie, one voteCirie."
403,00:28:23.30,00:28:23.30,"Natalie.Two votes Natalie, one vote"
404,00:28:26.43,00:28:26.43,Cirie.14th person voted out and the
405,00:28:32.07,00:28:32.07,"seventh member of our jury,Natalie."
406,00:28:34.37,00:28:34.37,That's three.That's enough.
407,00:28:35.97,00:28:35.97,"You need to bring me your torch.Natalie, the tribe has spoken."
408,00:28:57.13,00:28:57.13,"Time for you to go.Well, once again you have"
409,00:29:11.20,00:29:11.20,survived the vote and made it tothe final three.
410,00:29:14.17,00:29:14.17,"Congratulations.Grab your torches, head back to"
411,00:29:16.20,00:29:16.20,camp.Good night.
412,00:29:24.67,00:29:24.67,>> I have to say that I ampretty happy with the way that I
413,00:29:26.90,00:29:26.90,played the game.I was the last fan standing.
414,00:29:29.47,00:29:29.47,And I feel proud of the group ofgirls they finished with.
415,00:29:33.80,00:29:33.80,I respect the way that you guysplayed the game with me.
416,00:29:36.10,00:29:36.10,So thank you.>> That was a weird tribal
417,00:29:53.07,00:29:53.07,"tonight, wasn't it?>> I don't think I've ever been"
418,00:29:55.70,00:29:55.70,so exhausted in my entire life.>> You and me both.
419,00:30:01.07,00:30:01.07,>> What am I doing?>> You were trying to make us
420,00:30:02.93,00:30:02.93,look so awful at tribal.>> How?
421,00:30:05.10,00:30:05.10,"You asked me how I think I'm onthe bottom of an alliance, and I"
422,00:30:08.83,00:30:08.83,explained to you every singlealliance that I've been in how
423,00:30:12.13,00:30:12.13,I'm on the bottom.>> That's bull( no audio )
424,00:30:15.40,00:30:15.40,Just be real.>> How is it bull ( no audio )?
425,00:30:18.80,00:30:18.80,That's not game.That's real facts.
426,00:30:21.40,00:30:21.40,That's exactly what this is.I should be...
427,00:30:24.20,00:30:24.20,">> Because in the five, how areyou on the outs?"
428,00:30:26.80,00:30:26.80,">> Because you're snuggled upover there with James, she's"
429,00:30:29.70,00:30:29.70,snuggled up over there withOzzy.
430,00:30:31.77,00:30:31.77,Most of the time y'all four aretogether.
431,00:30:33.60,00:30:33.60,"If you were me, what would youfeel?"
432,00:30:35.73,00:30:35.73,"I mean, be me for a minute.And because I said it out loud,"
433,00:30:38.57,00:30:38.57,you're upset?With this alliance with y'all
434,00:30:41.20,00:30:41.20,"two, she told me she couldn'tvote you."
435,00:30:43.80,00:30:43.80,So that makes me at the bottomof this alliance.
436,00:30:46.13,00:30:46.13,"Have any one of you ever said,""I can't vote Cirie out?"""
437,00:30:49.43,00:30:49.43,>> How do you know?>> Yes or no?
438,00:30:51.60,00:30:51.60,I'm asking you.>> How do you know?
439,00:30:53.13,00:30:53.13,>> Have I talked to you aboutfinal two?
440,00:30:55.37,00:30:55.37,I feel that I've been at thebottom of every single alliance.
441,00:30:58.50,00:30:58.50,">> I just don't see that, and Ihaven't seen that."
442,00:31:00.70,00:31:00.70,I haven't seen that the wholegame.
443,00:31:02.33,00:31:02.33,>> You're not me.You're not me.
444,00:31:03.87,00:31:03.87,That's why you can't see it.>> I can't understand you when
445,00:31:06.63,00:31:06.63,"you're screaming at me.>> Okay, I'm not screaming."
446,00:31:09.20,00:31:09.20,>> Thank you.>> I can't explain it any more.
447,00:31:11.40,00:31:11.40,"I don't know how else to say it.>> Yeah, I know."
448,00:31:14.13,00:31:14.13,"I mean, it makes sense.>> I know."
449,00:31:18.07,00:31:18.07,"I'm sorry.>> I'm sorry for yelling at you,"
450,00:31:20.17,00:31:20.17,"but don't...>> No, I know."
451,00:31:22.07,00:31:22.07,I'm just...>> ...accuse me of stuff that
452,00:31:23.80,00:31:23.80,I'm...>> I wasn't trying to accuse
453,00:31:25.67,00:31:25.67,"you.It came out very badly, and I'm"
454,00:31:27.47,00:31:27.47,sorry.I'm just on my breaking point
455,00:31:29.67,00:31:29.67,right now.>> I know.
456,00:31:37.13,00:31:37.13,>> You have two more days.>> I know.
457,00:31:39.40,00:31:39.40,">> Let me give you a hug,because this is pitiful for us"
458,00:31:42.23,00:31:42.23,to make it this far and then yoube...
459,00:31:44.73,00:31:44.73,">> I know, I'm sorry.>> No, it's all right."
460,00:31:46.67,00:31:46.67,It's all right.>> I didn't mean it like that.
461,00:31:49.73,00:31:49.73,I just kind of broke down and Istarted yelling at Cirie about
462,00:31:53.00,00:31:53.00,stupid things that I don't evenknow why I yelled.
463,00:31:56.83,00:31:56.83,"And it's...I feel like I've beendoing this forever, you know?"
464,00:32:01.37,00:32:01.37,"Straight from China, I comehere, and it just... I just"
465,00:32:04.00,00:32:04.00,can't take it.I almost lost it when Jeff
466,00:32:07.50,00:32:07.50,"mentioned that there might be afinal two, and I lost it."
467,00:32:11.13,00:32:11.13,>> Oh!>> There's no way it would be a
468,00:32:14.47,00:32:14.47,final two.There's no way.
469,00:32:17.27,00:32:17.27,">> Yeah, don't say that again,Parv, because you've been wrong"
470,00:32:19.67,00:32:19.67,every time.You don't comfort me by saying
471,00:32:21.83,00:32:21.83,that.It's been the plan from day one
472,00:32:24.93,00:32:24.93,"for Parvati, Amanda, myself tobe final three, and it would"
473,00:32:27.87,00:32:27.87,just break my heart to find outit's going to be a final two.
474,00:32:32.30,00:32:32.30,"So I want to celebrate, butthere's, like, that hint in the"
475,00:32:37.53,00:32:37.53,back of my mind-- don't getfalsely happy and then find out
476,00:32:40.77,00:32:40.77,this is not the end of it.>> It's the final three.
477,00:32:44.00,00:32:44.00,Everybody just needs to chillout.
478,00:32:46.33,00:32:46.33,>> Did you find a machete?Because all that yelling makes
479,00:32:48.60,00:32:48.60,me thirsty.>> 38 days.
480,00:33:04.67,00:33:04.67,I really don't think I will evertouch a coconut again.
481,00:33:07.20,00:33:07.20,>> We need a tree mail here.>> Relax.
482,00:33:12.33,00:33:12.33,>> I am ecstatic to be here inthe final three with these two
483,00:33:17.00,00:33:17.00,girls.At least we assume it's a final
484,00:33:19.10,00:33:19.10,"three.It's been a long road, and we"
485,00:33:23.80,00:33:23.80,feel very blessed to be herewith each other.
486,00:33:26.43,00:33:26.43,"Come on out.>> Come on, Gloria."
487,00:33:28.80,00:33:28.80,">> We're celebrating by settingour mascot free, Gloria."
488,00:33:32.73,00:33:32.73,She's our last chicken standing.>> Get out of there!
489,00:33:36.43,00:33:36.43,>> Yay!>> Uh-oh!
490,00:33:40.63,00:33:40.63,Rather than try to kill Gloriaand have her flopping around
491,00:33:44.27,00:33:44.27,"in misery, we decided we can noteat."
492,00:33:49.30,00:33:49.30,We only have a couple of daysleft.
493,00:33:51.20,00:33:51.20,Let Gloria go.She might not leave here.
494,00:33:53.20,00:33:53.20,This is her home.She's making a nest to lay the
495,00:33:57.73,00:33:57.73,"damn egg.>> Unfortunately, Gloria doesn't"
496,00:34:01.90,00:34:01.90,"want to leave camp.She's, like, hanging around."
497,00:34:04.90,00:34:04.90,She's like a pet dog now.I guess she doesn't realize that
498,00:34:08.53,00:34:08.53,this is over.It's a done deal.
499,00:34:21.40,00:34:21.40,">> We're the craftiest survivorsof all time, to be modest."
500,00:34:24.23,00:34:24.23,>> Nice.Nice.
501,00:34:27.13,00:34:27.13,>> What is it?It doesn't look like food.
502,00:34:30.70,00:34:30.70,>> No.>> What?
503,00:34:32.83,00:34:32.83,"Oh, my...>> It looks like a challenge."
504,00:34:36.20,00:34:36.20,Freaking paddle.All right.
505,00:34:40.30,00:34:40.30,"""Congratulations, final three.You have done what 17 of your"
506,00:34:45.97,00:34:45.97,fellow tribesmen and women couldnot.
507,00:34:49.23,00:34:49.23,Today you will honor theirmemories before proceeding to
508,00:34:52.33,00:34:52.33,your final immunity challenge.Get into your boat and head out
509,00:34:56.53,00:34:56.53,to Exile Island.There you will find the torches
510,00:34:59.90,00:34:59.90,of your fallen comrades.Reflect upon them as they each
511,00:35:02.90,00:35:02.90,had a part in getting you tothis point.
512,00:35:05.97,00:35:05.97,"You'll then proceed to yourfinal immunity challenge."""
513,00:35:08.43,00:35:08.43,">> Oh, my god.>> Wow."
514,00:35:12.90,00:35:12.90,">> My heart just dropped.>> All right, let's go, ladies."
515,00:35:20.97,00:35:20.97,">> We got tree mail today, andwe thought there was going to be"
516,00:35:26.33,00:35:26.33,"like, food, you know, for thefinal three."
517,00:35:29.57,00:35:29.57,And it's another immunitychallenge.
518,00:35:33.80,00:35:33.80,"It's like, when is it going toend, you know?"
519,00:35:35.80,00:35:35.80,"Like, there's only so much youcan take, and then someone has"
520,00:35:37.57,00:35:37.57,"to leave now, like, aftereverything."
521,00:35:40.23,00:35:40.23,"I am so tight with these girls.Like, this just sucks"
522,00:35:42.60,00:35:42.60,completely.>> It's never ending.
523,00:35:54.77,00:35:54.77,">> I feel sick.>> Me, too."
524,00:36:00.30,00:36:00.30,The fact that it's a final twoand not a final three was almost
525,00:36:05.37,00:36:05.37,"poetic.I mean, we've been blindsiding"
526,00:36:08.37,00:36:08.37,"people left and right, andessentially we got blindsided."
527,00:36:11.77,00:36:11.77,"We thought we had it made.I guess, you know, what goes"
528,00:36:15.30,00:36:15.30,around comes around.>> Okay.
529,00:36:20.10,00:36:20.10,"...regroup, get it together.>> One more time."
530,00:36:23.67,00:36:23.67,>> I need to regroup.Now we have to kick it back into
531,00:36:26.87,00:36:26.87,gear and get ready for thisimmunity challenge today.
532,00:36:29.00,00:36:29.00,"And for me, it's taken me down apeg."
533,00:36:32.57,00:36:32.57,"Like, I feel a little bithumbled."
534,00:36:34.57,00:36:34.57,But I think the rites of passagewill give me a little
535,00:36:36.53,00:36:36.53,"perspective, because it's achance for us to honor everyone"
536,00:36:39.67,00:36:39.67,"that we fought so hard to beat,and I think we all want to give"
537,00:36:43.10,00:36:43.10,those people credit for beingsuch strong competitors and for
538,00:36:45.87,00:36:45.87,not making it easy on us.>> I can't feel bad.
539,00:36:55.63,00:36:55.63,"Look how far I made it.I mean, we started out with 20"
540,00:36:57.50,00:36:57.50,people.And they were all hard-core
541,00:36:59.93,00:36:59.93,"players, and would love to behere right now."
542,00:37:04.17,00:37:04.17,"So I want to tip my hat to themand say, you know, ""Good job."
543,00:37:08.60,00:37:08.60,"I beat you, but good job."">> Oh, thank god."
544,00:37:31.00,00:37:31.00,He was actually kind of a decentguy while he lasted.
545,00:37:34.37,00:37:34.37,Let's do it.>> I consider myself the
546,00:37:39.17,00:37:39.17,"cerebral assassin of Survivor.And I'm not going at 100%, I'm"
547,00:37:43.67,00:37:43.67,"not playing.So, you know, to go out on my"
548,00:37:46.20,00:37:46.20,"own terms, I kind of protectedthe legacy of Jonny Fairplay."
549,00:37:48.30,00:37:48.30,"So I'm very happy with that.>> Oh, Mary."
550,00:37:55.17,00:37:55.17,Didn't really know Mary.>> That's probably the worst
551,00:38:00.80,00:38:00.80,"thing that could ever happen tosomebody on Survivor, is being"
552,00:38:03.13,00:38:03.13,one of the first people votedout of your tribe.
553,00:38:05.47,00:38:05.47,"Maybe I was a strong player andthey saw me as a threat, but I"
554,00:38:08.40,00:38:08.40,"really felt like just a ton ofbricks hit me, and game over."
555,00:38:13.57,00:38:13.57,>> Yau-Man.Cirie's fiercest competitor.
556,00:38:18.07,00:38:18.07,>> That's only reason he had togo so early is because he was
557,00:38:20.53,00:38:20.53,such a great player.>> When I first walked in and
558,00:38:23.87,00:38:23.87,"someone said that I'm one of themost likable players, I think"
559,00:38:26.77,00:38:26.77,that pretty much sets me apartas a big target.
560,00:38:31.30,00:38:31.30,"Also, my problem, I know, isthat I don't have that, you know"
561,00:38:35.10,00:38:35.10,killer instinct to go up againstsome of these other people.
562,00:38:38.23,00:38:38.23,"But even though I got voted outso early, it's still quite a fun"
563,00:38:42.93,00:38:42.93,"experience.>> Oh, Mikey."
564,00:38:47.93,00:38:47.93,>> Good old Mikey B.He was a fierce competitor.
565,00:38:51.73,00:38:51.73,>> It hurts.It hurts to get sent home that
566,00:38:55.77,00:38:55.77,"early in the game.I was having fun out there, and"
567,00:38:58.43,00:38:58.43,I just wanted to continue tofight.
568,00:39:00.60,00:39:00.60,But it is a life-changingexperience.
569,00:39:03.07,00:39:03.07,And it reminds you that life isgood.
570,00:39:08.43,00:39:08.43,>> Joel.The big guy.
571,00:39:12.30,00:39:12.30,>> Truck was pretty intense.>> That's exactly the words
572,00:39:15.67,00:39:15.67,I was going to use.He was intense.
573,00:39:21.37,00:39:21.37,">> I went in with the goal toplay the game hard, and I feel"
574,00:39:23.90,00:39:23.90,like I did that.But my Survivor experience
575,00:39:27.10,00:39:27.10,should be summed up as failure.My goal was to be there at the
576,00:39:30.67,00:39:30.67,end.And I didn't reach the goal.
577,00:39:33.50,00:39:33.50,"I failed.>> Jonathan, Jonathan, Jonathan."
578,00:39:38.27,00:39:38.27,">> Jonathan is a smooth talker.He was tough, though, in this"
579,00:39:41.40,00:39:41.40,"game, man.I give him props."
580,00:39:43.37,00:39:43.37,">> Yeah, he wouldn't have quitfor anything."
581,00:39:45.33,00:39:45.33,>> Nothing.>> If he hadn't been taken out
582,00:39:47.10,00:39:47.10,"on medical, he never would havequit."
583,00:39:48.83,00:39:48.83,>> That's so sad.>> Leaving the game for medical
584,00:39:52.97,00:39:52.97,"reasons, I was able to leavewith my head held high, no"
585,00:39:57.47,00:39:57.47,"animosity towards anyone, andthere's nothing that I could"
586,00:40:01.27,00:40:01.27,have done about it.It is something extremely
587,00:40:04.03,00:40:04.03,"special, and I'll always holdthis near and dear, and this is"
588,00:40:06.60,00:40:06.60,a once-in-a-lifetime experienceI got to do twice.
589,00:40:12.27,00:40:12.27,">> Oh, Chet!>> My buddy."
590,00:40:16.07,00:40:16.07,">> You know, I have to say thechickens have not been the same"
591,00:40:19.27,00:40:19.27,since Chet left.>> My Survivor experience was
592,00:40:24.30,00:40:24.30,something I only dreamt ofhappening.
593,00:40:27.10,00:40:27.10,Even though I was told I wasgoing out first I went out
594,00:40:29.77,00:40:29.77,"seventh in a beautiful way, asfar as I'm concerned."
595,00:40:32.60,00:40:32.60,"Everybody who was praised fortheir strength, praised for"
596,00:40:35.77,00:40:35.77,"their agility, praised for theirathletic ability, I outlasted"
597,00:40:40.33,00:40:40.33,them.>> I loved Kathy.
598,00:40:44.23,00:40:44.23,>> She was...>> She was a colorful character.
599,00:40:47.70,00:40:47.70,">> Yeah, to say the least.>> I am in awe of every person"
600,00:40:54.70,00:40:54.70,who's ever played the game ofSurvivor.
601,00:40:58.10,00:40:58.10,It's the most difficult thingI've ever done.
602,00:41:01.47,00:41:01.47,"Childbirth, I thought that wastough."
603,00:41:03.80,00:41:03.80,Nah.I'd rather whip out eight more
604,00:41:06.03,00:41:06.03,kids in ten minutes than ever dothis again.
605,00:41:08.10,00:41:08.10,That's how much harderSurvivor is.
606,00:41:11.80,00:41:11.80,">> Oh, Tracy.>> She was... you know, I think"
607,00:41:17.30,00:41:17.30,she was underestimated in thisgame as a physical competitor.
608,00:41:19.90,00:41:19.90,">> Even if it's 20 days, 20 daysmay seem like not a lot of time"
609,00:41:24.63,00:41:24.63,"to a lot of people, but when therain is hitting you for nine and"
610,00:41:27.23,00:41:27.23,"a half hours, you just can't bethat same person any longer"
611,00:41:29.60,00:41:29.60,because you have just you andthe elements.
612,00:41:32.47,00:41:32.47,I am not the same person anylonger.
613,00:41:35.70,00:41:35.70,And I don't think I ever want tobe again.
614,00:41:47.40,00:41:47.40,">> Ami, Ami, Ami.>> You know, I loved Ami."
615,00:41:51.33,00:41:51.33,">> I did, too.Ami loved everyone."
616,00:41:54.80,00:41:54.80,">> This game, I was so much moresensitive than I was the first"
617,00:41:58.40,00:41:58.40,game.I've learned the balance for me
618,00:42:02.13,00:42:02.13,of vulnerability and strength.Of walking into a situation and
619,00:42:06.27,00:42:06.27,"being strong with who I am, andknowing that I don't need the"
620,00:42:08.93,00:42:08.93,feedback of other people to knowI'm okay with who I am.
621,00:42:15.37,00:42:15.37,">> Oh, Eliza.My arch rival that I had to"
622,00:42:19.43,00:42:19.43,compete with for 22 days.>> Wow.
623,00:42:23.00,00:42:23.00,>> Wow.>> Eliza put up a good fight in
624,00:42:24.73,00:42:24.73,"this game.>> Oh, yeah."
625,00:42:26.30,00:42:26.30,The last tribal council...>> She went down...
626,00:42:27.93,00:42:27.93,>> She went down swinging.>> ...in a blaze of glory.
627,00:42:29.70,00:42:29.70,">> Yes, she did.>> I was the underdog."
628,00:42:32.80,00:42:32.80,"I was on the outs almost fromthe start, because I didn't"
629,00:42:37.23,00:42:37.23,really have an alliance withanyone.
630,00:42:39.87,00:42:39.87,"And so I knew that I was on thebottom, and trying to work every"
631,00:42:43.17,00:42:43.17,"angle, which is my game, whichis the only game I know how to"
632,00:42:45.43,00:42:45.43,play.And I think I did a good job.
633,00:42:50.93,00:42:50.93,>> Ozzy!>> Ozzy!
634,00:42:52.87,00:42:52.87,">> Oh, Oz!>> I think he's the most well-"
635,00:42:55.03,00:42:55.03,rounded player ever in Survivor.>> And you like him.
636,00:42:59.87,00:42:59.87,>> That's why he had to go.>> You can carry his torch.
637,00:43:02.87,00:43:02.87,"I'll let you carry it.>> To a certain point, your time"
638,00:43:07.53,00:43:07.53,out in Survivor does define youto a large degree.
639,00:43:11.07,00:43:11.07,It's like a chance to reallysearch your soul and get to know
640,00:43:14.30,00:43:14.30,"who you are, and what you'remade of."
641,00:43:16.57,00:43:16.57,I knew that I had to trustpeople this time around to make
642,00:43:18.77,00:43:18.77,"it anywhere, and that was whatended up being my downfall."
643,00:43:23.50,00:43:23.50,But my relationship with Amandawas worth more to me than any
644,00:43:26.73,00:43:26.73,amount of money.>> Good old Jason.
645,00:43:32.87,00:43:32.87,">> He gave Ozzy a ride for hismoney, too."
646,00:43:36.20,00:43:36.20,>> He beat Ozzy twice.>> I came out here as a strong
647,00:43:42.17,00:43:42.17,"competitor and a good provider,and nobody really saw that"
648,00:43:46.97,00:43:46.97,because I think everybody wasjust focused on Ozzy.
649,00:43:49.57,00:43:49.57,So it's a bit comforting knowingthat Ozzy and I both went out in
650,00:43:53.03,00:43:53.03,the same way.It shows that I'm just as good
651,00:43:55.87,00:43:55.87,of a competitor and provider asOzzy.
652,00:44:04.17,00:44:04.17,">> Oh, James, my little cuddlebug."
653,00:44:06.63,00:44:06.63,">> He was honest.>> Yeah, he was a straight"
654,00:44:09.10,00:44:09.10,shooter.>> I'd much rather have been
655,00:44:11.30,00:44:11.30,"voted out, because it's like,closure."
656,00:44:14.60,00:44:14.60,"With a finger injury, it killsme."
657,00:44:18.30,00:44:18.30,But the trials I had to gothrough with them girls really
658,00:44:20.80,00:44:20.80,"was quite a test.I mean, I'm not a bully, but I"
659,00:44:23.07,00:44:23.07,surely don't like anybodytelling me what to do.
660,00:44:25.33,00:44:25.33,"So, I mean, I really had to letgo and go within myself to calm"
661,00:44:29.07,00:44:29.07,down.>> Alexis.
662,00:44:33.80,00:44:33.80,">> Alexis.>> You know, if, Alexis made it"
663,00:44:36.87,00:44:36.87,"this far, she would definitelybe hard to beat."
664,00:44:39.93,00:44:39.93,">> Yeah, Alexis was a charmer.>> Yes, definitely."
665,00:44:44.83,00:44:44.83,">> I felt like I always had thiskind of split between, like, the"
666,00:44:47.97,00:44:47.97,"super-competitive tomboy, butthen the super-nice southern"
667,00:44:50.43,00:44:50.43,"hospitality girl.So in a weird way, I feel like I"
668,00:44:53.63,00:44:53.63,came into this game a littlegirl and I got to grow up and
669,00:44:57.03,00:44:57.03,left a woman.>> Poor Erik.
670,00:45:01.73,00:45:01.73,I'm sorry he had to be thevictim of the women's wrath.
671,00:45:07.03,00:45:07.03,"But play with fire, you'll getburned."
672,00:45:10.40,00:45:10.40,>> I don't think you can playthis game without changing as a
673,00:45:14.50,00:45:14.50,"person.I mean, I've seen so much in so"
674,00:45:17.73,00:45:17.73,"few days that I've never, everseen in my life."
675,00:45:20.47,00:45:20.47,"I've seen these women here, andthey are vicious."
676,00:45:22.73,00:45:22.73,"I mean, they are cutthroat.They are very tough, and there's"
677,00:45:25.23,00:45:25.23,a lot of strength in them.And it's opened my eyes a little
678,00:45:27.80,00:45:27.80,bit about the way that women areand the way that they operate.
679,00:45:33.87,00:45:33.87,>> Natalie.>> Aww.
680,00:45:36.77,00:45:36.77,"The last fan in Survivor.>> Good on you, girl."
681,00:45:38.90,00:45:38.90,">> Good on you, baby.>> If the woman has the"
682,00:45:43.20,00:45:43.20,"opportunity to think, she willoutwit a man."
683,00:45:46.50,00:45:46.50,"They may outbrawn a woman, but awoman will definitely outwit a"
684,00:45:51.27,00:45:51.27,"man, hands down, every time.I think I learned a lot about"
685,00:45:54.30,00:45:54.30,"myself, and right now, I'm kindof my biggest fan."
686,00:47:10.20,00:47:10.20,>> JEFF: Welcome to your finalimmunity challenge.
687,00:47:12.77,00:47:12.77,You ready to get to it?>> Yes.
688,00:47:14.73,00:47:14.73,">> JEFF: All right, Amanda, I'mtake back the necklace."
689,00:47:25.27,00:47:25.27,"For the last time, immunity isback up for grabs."
690,00:47:28.50,00:47:28.50,"For today's immunity challenge,you each have a long wooden"
691,00:47:31.90,00:47:31.90,cylinder that has been cut intoseveral pieces.
