,begin,end,subtitles_text
692,00:47:35.10,00:47:35.10,In the center is a slot on whichrests a metal ball.
693,00:47:38.73,00:47:38.73,"On go, you'll pick up the firstpiece using two handles,"
694,00:47:43.03,00:47:43.03,"balancing the ball.Every five minutes, as the"
695,00:47:46.00,00:47:46.00,"challenge continues, you willadd more pieces, making it more"
696,00:47:49.07,00:47:49.07,"difficult to hold on to.If at any point the ball drops,"
697,00:47:54.37,00:47:54.37,you're out of the challenge.Last person left standing wins
698,00:47:57.90,00:47:57.90,"immunity, is guaranteed a spotat the final tribal council,"
699,00:48:03.70,00:48:03.70,where you will get a chance toconvince the jury you're worthy
700,00:48:07.03,00:48:07.03,of a million dollars.Also at tonight's tribal council
701,00:48:10.30,00:48:10.30,"you will, in effect, be decidingwho you want to sit next to you"
702,00:48:14.67,00:48:14.67,at that final tribal.A very big decision.
703,00:48:18.23,00:48:18.23,This is potentially a million-dollar challenge.
704,00:48:22.33,00:48:22.33,"Shall we get to it?All right, everybody pick up"
705,00:48:24.80,00:48:24.80,your handles.Five seconds that I count you
706,00:48:28.63,00:48:28.63,"down, that is your grace period.Use these five seconds as free"
707,00:48:33.30,00:48:33.30,time to get your bearings.When we get to one is when we
708,00:48:36.03,00:48:36.03,go.Everybody's picked up their
709,00:48:40.13,00:48:40.13,"handles, got your first piece inplace."
710,00:48:43.03,00:48:43.03,"Five, four, three, two, one.This challenge is officially on."
711,00:48:52.03,00:48:52.03,"We'll go five minutes before westart adding more pieces, and"
712,00:48:56.80,00:48:56.80,"when we do, it will become muchmore difficult."
713,00:49:08.87,00:49:08.87,"The slightest lapse inconcentration, and you will be"
714,00:49:11.67,00:49:11.67,out of this challenge.You have to constantly check in
715,00:49:16.13,00:49:16.13,with yourself and make sure youare staying focused.
716,00:49:22.63,00:49:22.63,"All right, this round is over.You can set them down."
717,00:49:26.87,00:49:26.87,"You are safe.All right, let's add two more"
718,00:49:32.30,00:49:32.30,"pieces, making this cylinder alittle longer, a little more"
719,00:49:38.33,00:49:38.33,difficult to hold.Everybody grab your handles.
720,00:49:41.53,00:49:41.53,Here we go.Everybody lift.
721,00:49:45.43,00:49:45.43,"Five, four, three, two, one.We are on."
722,00:49:54.10,00:49:54.10,Everybody now holding threepieces.
723,00:49:57.83,00:49:57.83,Concentrate.All of your energy should be
724,00:50:00.80,00:50:00.80,focused on keeping that ballstable.
725,00:50:05.27,00:50:05.27,"You drop this ball, it couldcost you a million dollars."
726,00:50:14.57,00:50:14.57,One more minute left in thisround.
727,00:50:16.67,00:50:16.67,You can do it.Hang in there.
728,00:50:18.80,00:50:18.80,Don't blow it now.Last 15 seconds in this round.
729,00:50:24.93,00:50:24.93,"Five, four, three, two, one.This round is over."
730,00:50:32.70,00:50:32.70,You're safe.Set it down.
731,00:50:34.80,00:50:34.80,"Nice work.All right, let's add two more"
732,00:50:37.70,00:50:37.70,pieces.Now it's going to get
733,00:50:42.60,00:50:42.60,interesting.Everybody pick up your handles.
734,00:50:45.53,00:50:45.53,"Five, four, three, two, one.This round is on."
735,00:50:53.20,00:50:53.20,"After 38 days of playing thisgame together as a team, nowhere"
736,00:50:57.80,00:50:57.80,"left to hide.Now, instead of working"
737,00:51:00.73,00:51:00.73,"together, you have to battleagainst each other with only one"
738,00:51:04.20,00:51:04.20,goal-- beat the other two.Parvati drops her ball.
739,00:51:16.80,00:51:16.80,Parvati is the first person outof this challenge.
740,00:51:19.60,00:51:19.60,Parvati's fate is no longer inher own hands.
741,00:51:25.63,00:51:25.63,We are now down to Cirie andAmanda.
742,00:51:30.03,00:51:30.03,"15 seconds left in this round.Five, four, three, two, one."
743,00:51:39.07,00:51:39.07,This round is over.Set it down.
744,00:51:41.30,00:51:41.30,"You are safe.>> Oh, my god."
745,00:51:46.50,00:51:46.50,">> JEFF: All right, next round.Let's add two more pieces."
746,00:51:52.00,00:51:52.00,"Every time you add pieces, itgets more difficult."
747,00:51:55.60,00:51:55.60,Let's put your handles up.This could be the round that
748,00:51:58.93,00:51:58.93,decides it all.Here we go.
749,00:52:04.47,00:52:04.47,"Five, four, three, two... Ciriedrops."
750,00:52:08.77,00:52:08.77,"If it falls off while I'm stillcounting, we reset."
751,00:52:11.77,00:52:11.77,Take your time when you'relifting it up.
752,00:52:13.70,00:52:13.70,"It's not a race.Here we go, five, four, three,"
753,00:52:18.47,00:52:18.47,"two, one.Challenge is back on."
754,00:52:23.43,00:52:23.43,Amanda going underhand thistime.
755,00:52:27.77,00:52:27.77,Cirie sticking with the samegrip.
756,00:52:30.23,00:52:30.23,"Wherever you're holding it, donot move it."
757,00:52:33.07,00:52:33.07,Hold that ball steady if youwant a shot at a million bucks.
758,00:52:36.07,00:52:36.07,You have very little wiggleroom.
759,00:52:42.97,00:52:42.97,"30 more seconds, and you move onto the last round."
760,00:52:46.93,00:52:46.93,"Five, four, three, two, one.This round is over."
761,00:52:54.37,00:52:54.37,You're safe.Set it down.
762,00:52:56.87,00:52:56.87,All right.Last and final round.
763,00:53:02.37,00:53:02.37,Add the last two pieces.Pick up your handles.
764,00:53:08.63,00:53:08.63,This round will go untilsomebody drops their ball.
765,00:53:15.20,00:53:15.20,"Here we go.Five, four, three, two, one."
766,00:53:22.20,00:53:22.20,We are back on.This is the final round of this
767,00:53:25.80,00:53:25.80,challenge.Everything you have inside you
768,00:53:36.17,00:53:36.17,should be focused on keepingthat ball stable.
769,00:53:40.53,00:53:40.53,"The person left standing afterthis, immunity."
770,00:53:45.53,00:53:45.53,"Shot at a million bucks.You lose this challenge, your"
771,00:53:48.70,00:53:48.70,fate is not in your hands.Cirie loses her concentration.
772,00:54:02.13,00:54:02.13,Amanda wins final immunity andis guaranteed a spot at the
773,00:54:06.83,00:54:06.83,"final tribal council.>> Good job, babies."
774,00:54:12.43,00:54:12.43,You're awesome.>> Thank you.
775,00:54:14.87,00:54:14.87,>> Good job.You're awesome.
776,00:54:17.17,00:54:17.17,">> I love you guys.>> JEFF: Amanda, come on over."
777,00:54:22.63,00:54:22.63,No better time to have this thanright now.
778,00:54:28.23,00:54:28.23,">> Yep.>> JEFF: With this, you are"
779,00:54:31.40,00:54:31.40,guaranteed a spot at the finaltribal council.
780,00:54:34.00,00:54:34.00,You will get a chance toconvince the jury you are worthy
781,00:54:36.10,00:54:36.10,"of a million bucks.At tonight's tribal council, you"
782,00:54:38.57,00:54:38.57,"will cast a vote, and in doingso, you will vote either Parvati"
783,00:54:41.57,00:54:41.57,or Cirie out of the game.The other person you're going to
784,00:54:44.43,00:54:44.43,take with you to the finaltribal.
785,00:54:46.53,00:54:46.53,"Big, big decision.Have a fun afternoon."
786,00:54:49.07,00:54:49.07,Head back to camp.I will see you guys at tribal.
787,00:55:10.87,00:55:10.87,">> Oh, Gloria.>> She likes it here."
788,00:55:16.40,00:55:16.40,She likes the coop.>> Yeah.
789,00:55:23.47,00:55:23.47,"We just got back from the lastimmunity challenge, and I won"
790,00:55:26.70,00:55:26.70,immunity.So I'm going to the final two.
791,00:55:29.47,00:55:29.47,And it's either Parvati or Ciriegoing home tonight.
792,00:55:33.63,00:55:33.63,"Honestly, this is the hardestdecision I've had to make this"
793,00:55:36.63,00:55:36.63,"whole game, because, you know,we're each close."
794,00:55:39.57,00:55:39.57,All of us are close.So who do you send home?
795,00:55:42.40,00:55:42.40,>> I don't know what happened.I must have blinked.
796,00:55:46.33,00:55:46.33,>> And it just fell?>> Mm-hmm.
797,00:55:53.10,00:55:53.10,">> She's a closer, that one, youknow?"
798,00:55:55.80,00:55:55.80,>> I thought for sure that Icould win this one.
799,00:56:00.60,00:56:00.60,"Because during surgeries, youhave to hold, like, retractors"
800,00:56:05.37,00:56:05.37,"or instrumentation, and youcan't really move."
801,00:56:09.03,00:56:09.03,"If you move, somebody might gethurt."
802,00:56:11.77,00:56:11.77,"Unfortunately, Amanda won.And since Parv and Amanda are so"
803,00:56:15.50,00:56:15.50,"buddy-buddy, unless somethinghappens, I'm probably going home"
804,00:56:18.77,00:56:18.77,"tonight.>> This is my decision, pretty"
805,00:56:32.10,00:56:32.10,much.>> I know.
806,00:56:34.13,00:56:34.13,"We're not even voting, I don'tthink."
807,00:56:35.93,00:56:35.93,">> No, I am.Me."
808,00:56:37.63,00:56:37.63,>> Yeah.>> That sucks.
809,00:56:39.40,00:56:39.40,">> I know.I mean, she understands."
810,00:56:46.70,00:56:46.70,My fate is pretty much inAmanda's hands right now.
811,00:56:49.53,00:56:49.53,But I'm fairly confident thatshe's going to take me to the
812,00:56:52.73,00:56:52.73,final two with her.We've had an alliance since day
813,00:56:55.23,00:56:55.23,one out here.And we also have a really tight
814,00:56:58.47,00:56:58.47,"relationship, Amanda and I,that's developed over the course"
815,00:57:00.73,00:57:00.73,"of this game.So I'm not worried about it,"
816,00:57:03.23,00:57:03.23,"really.This is good, because then"
817,00:57:05.63,00:57:05.63,"tomorrow we can just help eachother with our opening speeches,"
818,00:57:07.73,00:57:07.73,just question each other andhang out.
819,00:57:09.67,00:57:09.67,"Oh, today was awful, though.>> Well, you've been handling"
820,00:57:17.70,00:57:17.70,"all these situations reallygracefully, you know."
821,00:57:19.80,00:57:19.80,">> Well, I already knew, like,if I didn't win that she'd take"
822,00:57:23.30,00:57:23.30,"you, so it's not like...>> She pissed way more people"
823,00:57:28.17,00:57:28.17,"off than I did.>> Yeah, actually, huh?"
824,00:57:31.47,00:57:31.47,>> Yeah.>> This is such a nightmare that
825,00:57:45.90,00:57:45.90,this happened today.I can't even believe that... how
826,00:57:49.70,00:57:49.70,do I make the decision?What do I go by?
827,00:57:53.10,00:57:53.10,">> I don't know.>> It's, like, the hardest thing"
828,00:57:56.00,00:57:56.00,I've ever had to do.>> Yeah.
829,00:57:59.20,00:57:59.20,>> Parvati and Cirie bothdeserve to be here.
830,00:58:01.50,00:58:01.50,They both want to be here.So I honestly don't know what to
831,00:58:04.23,00:58:04.23,do.I have a really good personal
832,00:58:06.83,00:58:06.83,"relationship with Parvati, so Ifeel more loyal to Parvati."
833,00:58:10.70,00:58:10.70,>> I feel like your best shotwith the jury is taking me over
834,00:58:15.60,00:58:15.60,"Parv.Every person she screwed over, I"
835,00:58:18.53,00:58:18.53,screwed over.We did everything together.
836,00:58:21.17,00:58:21.17,Every blindside we orchestratedtogether.
837,00:58:24.83,00:58:24.83,Most of them I did most of thetalking for.
838,00:58:29.93,00:58:29.93,">> So how is...>> Yeah, but that's only if the"
839,00:58:38.03,00:58:38.03,people are willing to listen.These are the people I screwed
840,00:58:41.60,00:58:41.60,over I would have to talk to.>> Cirie has pissed a lot of
841,00:58:45.23,00:58:45.23,people off on the jury.Probably more than Parvati.
842,00:58:48.90,00:58:48.90,But Cirie is a hell of aspeaker.
843,00:58:51.90,00:58:51.90,She can convince anyone to doanything.
844,00:58:55.07,00:58:55.07,"And in the final tribal council,she could convince the jury to"
845,00:58:57.87,00:58:57.87,"give her the million dollars.So, I mean, it's kind of a"
846,00:59:00.87,00:59:00.87,catch-22.>> It should be interesting.
847,00:59:09.60,00:59:09.60,>> Making this decision tonightis killing me.
848,00:59:12.03,00:59:12.03,"You kind of have to just go withhow you feel, and a gut feeling."
849,00:59:14.50,00:59:14.50,"And I've been going with my gutthis whole game, and it's gotten"
850,00:59:16.87,00:59:16.87,"me this far, but I know thatthis decision could cost me the"
851,00:59:19.33,00:59:19.33,million dollars.>> JEFF: We'll now bring in the
852,00:59:41.60,00:59:41.60,"members of our jury.Eliza, Ozzy, Jason, James,"
853,00:59:48.17,00:59:48.17,"Alexis, Erik, and Natalie, votedout at the last tribal council."
854,00:59:56.00,00:59:56.00,"Well, after 38 days, we'vereached a point where there is"
855,01:00:00.73,01:00:00.73,only one decision left to bemade before we turn this game
856,01:00:04.37,01:00:04.37,"over to the jury.And that is, who's going to that"
857,01:00:07.80,01:00:07.80,"final tribal council?Amanda, after winning today's"
858,01:00:10.70,01:00:10.70,"immunity challenge, you are intotal control."
859,01:00:13.90,01:00:13.90,">> I know.>> JEFF: Tough decision, in a"
860,01:00:16.37,01:00:16.37,way.You guys have been together
861,01:00:18.50,01:00:18.50,almost from the beginning.>> Yeah.
862,01:00:21.23,01:00:21.23,"I mean, winning immunity todaywas a blessing and a curse at"
863,01:00:24.20,01:00:24.20,"the same time.You know, it's a blessing"
864,01:00:27.43,01:00:27.43,"because I'm guaranteed the finaltwo, and it's a curse because I"
865,01:00:31.33,01:00:31.33,"have to choose who goes with me.And we're so close, it's..."
866,01:00:36.67,01:00:36.67,"It's just a hard, hard decision.>> JEFF: Cirie, do you buy that"
867,01:00:43.00,01:00:43.00,it's difficult for Amanda?>> Yeah.
868,01:00:46.63,01:00:46.63,"I believe it's difficult forAmanda, because we have been"
869,01:00:49.97,01:00:49.97,"together since day one.Amanda, Parvati, and myself, we"
870,01:00:53.23,01:00:53.23,"kind of decided, you know, itshould be us three 'til the end."
871,01:00:56.90,01:00:56.90,And it pretty much has beenthat.
872,01:01:00.80,01:01:00.80,">> JEFF: Parvati, difficult tonot have any say at this point?"
873,01:01:04.27,01:01:04.27,>> I honestly don't envyAmanda's position at all right
874,01:01:08.40,01:01:08.40,"now.I mean, she has a hard decision"
875,01:01:10.97,01:01:10.97,to make.We have all been protecting each
876,01:01:13.80,01:01:13.80,"other through blindside afterblindside, weathering storms"
877,01:01:16.30,01:01:16.30,"together, and I don't think itis going to be an easy decision,"
878,01:01:19.70,01:01:19.70,and I wouldn't want to be makingit.
879,01:01:21.97,01:01:21.97,">> JEFF: So Amanda, take methrough both sides of this."
880,01:01:24.27,01:01:24.27,What about bringing Parvati orCirie to the end is risky?
881,01:01:28.43,01:01:28.43,">> You know, with these girlsit's a tossup at this point."
882,01:01:32.40,01:01:32.40,"Strategy-wise, Cirie is a greattalker."
883,01:01:36.07,01:01:36.07,She can convince pretty muchanyone to do anything.
884,01:01:39.30,01:01:39.30,"And, you know, that's a threatat the end of the game."
885,01:01:43.47,01:01:43.47,And Parvati has played a verysocial game.
886,01:01:46.80,01:01:46.80,She has made personalrelationships on the jury that I
887,01:01:49.33,01:01:49.33,think will definitely come intoplay at the final tribal
888,01:01:51.97,01:01:51.97,"council.So it was a hard decision, but I"
889,01:01:55.00,01:01:55.00,ultimately made a decision on mygut feeling.
890,01:01:58.50,01:01:58.50,>> JEFF: Take me through themixed emotions that have to be
891,01:02:01.80,01:02:01.80,"going through your head-- thejoy of knowing ""I succeeded,"
892,01:02:06.60,01:02:06.60,I am going to be at the finaltribal after 39 days of
893,01:02:10.00,01:02:10.00,"working,"" and the pain of havingto vote somebody out that you've"
894,01:02:14.53,01:02:14.53,been with from the beginning.>> Yeah.
895,01:02:18.10,01:02:18.10,">> That's okay.>> It's just really hard for me,"
896,01:02:24.63,01:02:24.63,"because I feel like either way,it's a lose-lose situation for"
897,01:02:28.93,01:02:28.93,"me at this point.I mean, if I go with Cirie, I'm"
898,01:02:31.33,01:02:31.33,"hurts Parvati.If I go with Parvati, I'm"
899,01:02:33.70,01:02:33.70,hurting Cirie.I know that this vote tonight is
900,01:02:36.80,01:02:36.80,going to hurt someone'sfeelings.
901,01:02:38.97,01:02:38.97,And I'm just having a hard timewith that.
902,01:02:43.20,01:02:43.20,">> JEFF: All right, let's get tothe vote."
903,01:02:47.53,01:02:47.53,"Amanda, since you have immunity,nobody can vote for you."
904,01:02:50.80,01:02:50.80,That means Cirie can only votefor Parvati.
905,01:02:54.00,01:02:54.00,"Parvati can only vote for Cirie.Parvati and Cirie, you won't"
906,01:02:57.77,01:02:57.77,vote tonight.The only person voting tonight
907,01:03:00.23,01:03:00.23,is Amanda.You'll be voting out the 15th
908,01:03:02.20,01:03:02.20,"person from this game, and youwill be deciding who you are"
909,01:03:04.60,01:03:04.60,bringing with you to the finaltribal council.
910,01:03:07.23,01:03:07.23,"If you're wrong, it is amillion-dollar mistake."
911,01:03:09.97,01:03:09.97,"If you're right, this timetomorrow night, you're a"
912,01:03:12.47,01:03:12.47,millionaire.>> I know.
913,01:03:14.70,01:03:14.70,">> JEFF: It's time to vote.Amanda, you're up."
914,01:03:52.63,01:03:52.63,"I'll go get the vote.Once the votes are read, the"
915,01:04:05.60,01:04:05.60,decision is final.The person voted out will be
916,01:04:07.67,01:04:07.67,asked to leave the tribalcouncil area immediately.
917,01:04:09.77,01:04:09.77,"I'll read the vote.15th person voted out, and the"
918,01:04:19.63,01:04:19.63,"eighth and final member of ourjury, Cirie."
919,01:04:23.93,01:04:23.93,You need to bring me your torch.>> I'm sorry.
920,01:04:27.50,01:04:27.50,>> It's okay.It's all right.
921,01:04:42.60,01:04:42.60,"Cirie, the tribe has spoken.Time for you to go."
922,01:05:01.57,01:05:01.57,">> JEFF: Parvati, Amanda, youhave gone as far as you can go"
923,01:05:05.17,01:05:05.17,in this game.The power now shifts to the
924,01:05:08.20,01:05:08.20,jury.Eight people-- including Cirie--
925,01:05:12.10,01:05:12.10,that you had a hand in votingout now hold your fate in their
926,01:05:15.20,01:05:15.20,hands.You've got one more night.
927,01:05:18.97,01:05:18.97,I hope you can enjoy it.I'll see you both tomorrow night
928,01:05:21.43,01:05:21.43,"for your final tribal council.Grab your torches, head back to"
929,01:05:24.13,01:05:24.13,camp.Good night.
930,01:05:33.30,01:05:33.30,">> Here I am again, coming upjust short."
931,01:05:36.53,01:05:36.53,"HB, John, Jamil, Jared, Mom,Dad, sorry."
932,01:05:41.97,01:05:41.97,I tried my hardest.It just wasn't meant to be.
933,01:06:08.47,01:06:08.47,>> We're going home tonight.>> I was so happy when I woke up
934,01:06:15.00,01:06:15.00,today.To finally know that I made it
935,01:06:18.00,01:06:18.00,"to the end, you know, I justkind of, like, breathed and..."
936,01:06:21.67,01:06:21.67,I can't believe we did this.>> I can't believe we're the
937,01:06:25.90,01:06:25.90,last two.>> I know.
938,01:06:27.87,01:06:27.87,Everyone's gone but me and you.>> I know.
939,01:06:30.57,01:06:30.57,>> We bamboozled everyone out ofthe game.
940,01:06:33.73,01:06:33.73,">> This morning when I woke up,I think the happiness, like,"
941,01:06:36.50,01:06:36.50,"started in my stomach, and itbubbled up, and I couldn't wipe"
942,01:06:38.93,01:06:38.93,the smile off my face.All the hard work has paid off.
943,01:06:41.43,01:06:41.43,"We're here, and it's done, andwe're final two."
944,01:06:51.67,01:06:51.67,">> Oh, my god!>> BOTH: Oh..."
945,01:06:54.53,01:06:54.53,my...God.
946,01:06:57.13,01:06:57.13,>> Amanda and I pretty much ownthis game.
947,01:06:59.30,01:06:59.30,She made it all the way to theend in China.
948,01:07:01.57,01:07:01.57,I made it almost all the way tothe end in the Cooks.
949,01:07:05.30,01:07:05.30,"To be in the final two in thisseason, it's a serious"
950,01:07:07.63,01:07:07.63,"accomplishment, and I feel likeI can stand up tall and be like,"
951,01:07:11.13,01:07:11.13,"""I am a survivor.""Oh, my god."
952,01:07:14.20,01:07:14.20,"I am so glad I'm with you.>> I know, me, too!"
953,01:07:16.97,01:07:16.97,There's no other person here I'drather be here with right now.
954,01:07:19.57,01:07:19.57,">> Me, either.This is, like, the prettiest"
955,01:07:22.37,01:07:22.37,"picnic ever.>> This is, like, a huge"
956,01:07:24.57,01:07:24.57,"accomplishment.Like, this is the biggest"
957,01:07:26.80,01:07:26.80,"accomplishment of my life.>> Mine, too."
958,01:07:28.83,01:07:28.83,>> I feel like we battled everyelement to get where we are
959,01:07:31.27,01:07:31.27,"right now-- like, every possiblething that we could go through,"
960,01:07:35.57,01:07:35.57,"we've gone through, and we've,like, mastered it, and we've"
961,01:07:38.47,01:07:38.47,"gotten ourselves here.In the past six months, I've"
962,01:07:41.70,01:07:41.70,"been living in the jungle for 78days, you know, so I don't think"
963,01:07:45.83,01:07:45.83,there's much in real life that Ican't handle after
964,01:07:49.07,01:07:49.07,two Survivors in a row.>> We're going to be so good
965,01:07:51.80,01:07:51.80,"tonight at that tribal thing.>> Oh, yeah, we're going to be,"
966,01:07:54.03,01:07:54.03,"like, happy and full and belike, ""Yeah, ask us your"
967,01:07:56.43,01:07:56.43,"questions.Bring it on."""
968,01:07:59.87,01:07:59.87,">> ""Bring it on, bitches."">> I think it's interesting that"
969,01:08:03.40,01:08:03.40,"me and Parvati are in the end ofthis game together, because we"
970,01:08:05.73,01:08:05.73,have played completely differentgames.
971,01:08:08.03,01:08:08.03,"I think I have played this gameloyal to my alliances, and"
972,01:08:10.67,01:08:10.67,Parvati pretty much did anythingshe needed to do to take
973,01:08:13.57,01:08:13.57,"control.And because of that, a lot of"
974,01:08:17.83,01:08:17.83,"people on the jury don't likeher, so that could be a benefit"
975,01:08:20.63,01:08:20.63,for me.>> We have had this game in the
976,01:08:23.73,01:08:23.73,palm of our hands since we met.And then the switch-up.
977,01:08:27.60,01:08:27.60,"And then the craziness.And then, still, it's still you"
978,01:08:31.13,01:08:31.13,"and me.I really, honestly, feel so"
979,01:08:35.73,01:08:35.73,relaxed going into the finaltribal council.
980,01:08:42.37,01:08:42.37,I feel like I've played a gamethat's been very true to myself.
981,01:08:45.00,01:08:45.00,I don't feel like I could haveplayed this game better.
982,01:08:47.57,01:08:47.57,>> You want to do the honors?>> Sure.
983,01:08:53.03,01:08:53.03,>> Ah-hah!My game was a lot more
984,01:09:00.47,01:09:00.47,"aggressive than Amanda's game.It was a lot more cutthroat,"
985,01:09:02.73,01:09:02.73,more cold-blooded.I was playing this to win.
986,01:09:08.87,01:09:08.87,>> We're pyromaniacs.>> That's awesome.
987,01:09:13.23,01:09:13.23,I think my strongest point I canmake tonight is standing up and
988,01:09:16.50,01:09:16.50,"owning that I have been apowerful, controlling player"
989,01:09:19.67,01:09:19.67,throughout the duration of thisgame.
990,01:09:36.27,01:09:36.27,">> Parvati has played acutthroat, aggressive game, and"
991,01:09:39.50,01:09:39.50,"I know that she's going tofinish with a cutthroat,"
992,01:09:42.40,01:09:42.40,"aggressive game, and that couldbe by her throwing me under the"
993,01:09:45.07,01:09:45.07,"bus tonight at tribal.And if that is the case, then I"
994,01:09:48.03,01:09:48.03,am ready to fight for this.I think people will give me
995,01:09:57.70,01:09:57.70,"their votes, because I was loyalto every alliance that I've"
996,01:10:00.00,01:10:00.00,"made.Yeah, the jury makes the"
997,01:10:02.30,01:10:02.30,"decision, but ultimately, it'sme and Parvati convincing the"
998,01:10:04.73,01:10:04.73,"jury what to do.Tonight we're going toe to toe,"
999,01:10:08.20,01:10:08.20,"and one person is going to win amillion dollars, and the other"
1000,01:10:10.10,01:10:10.10,"person is going to walk awaywith nothing, and may the best"
1001,01:10:11.87,01:10:11.87,woman win.>> JEFF: We'll now bring in the
1002,01:10:35.07,01:10:35.07,"members of our jury.Eliza, Ozzy, Jason, James,"
1003,01:10:42.77,01:10:42.77,"Alexis, Erik, Natalie, andCirie, voted out at the last"
1004,01:10:49.63,01:10:49.63,tribal council.Welcome to your final tribal
1005,01:10:52.63,01:10:52.63,council.Congratulations on outlasting 18
1006,01:10:57.10,01:10:57.10,"other people in this game.Tonight, the power shifts from"
1007,01:11:02.00,01:11:02.00,this side of the tribal councilover to the jury.
1008,01:11:06.27,01:11:06.27,Based on what they've seen overthe last 39 days and what they
1009,01:11:09.90,01:11:09.90,"hear tonight, the jury will makea million-dollar decision."
1010,01:11:14.67,01:11:14.67,Here's how it's going to work.You will each get a chance to
1011,01:11:17.53,01:11:17.53,make an opening statement.This is your first chance to
1012,01:11:19.93,01:11:19.93,convince this jury why you aredeserving of the title of sole
1013,01:11:22.67,01:11:22.67,survivor.The jury will then get their
1014,01:11:25.70,01:11:25.70,first chance to address you.We will then vote.
1015,01:11:32.57,01:11:32.57,"Opening statements.Amanda, you're up."
1016,01:11:40.07,01:11:40.07,">> I came into this game, youknow, wanting to do two things."
1017,01:11:42.77,01:11:42.77,"I wanted to play a loyal game,and I wanted to fight"
1018,01:11:46.03,01:11:46.03,"physically, strategically, andmentally to the end."
1019,01:11:48.80,01:11:48.80,"And, you know, I'm really proudof how I played."
1020,01:11:52.03,01:11:52.03,"And I know I wouldn't be sittinghere without, you know, help"
1021,01:11:55.00,01:11:55.00,from all of you.So thanks.
1022,01:11:58.43,01:11:58.43,I wanted to say thanks.>> JEFF: Parvati.
1023,01:12:03.53,01:12:03.53,>> I came into this game with aprevious reputation from the
1024,01:12:08.60,01:12:08.60,Cook Islands as the flirt.I knew that I had to play so
1025,01:12:13.53,01:12:13.53,much differently than I playedin the Cook Islands.
1026,01:12:15.70,01:12:15.70,"Like, I had to playaggressively."
1027,01:12:17.83,01:12:17.83,I had to beat my competitionbefore my competition had a
1028,01:12:20.37,01:12:20.37,chance to beat me.And you gave me a serious run
