,begin,end,subtitles_text
1029,01:12:23.40,01:12:23.40,"for my money, all of you.So the only thing I could do was"
1030,01:12:31.30,01:12:31.30,"make bold power plays, and withthe help of a powerful group of"
1031,01:12:35.37,01:12:35.37,"women, pull off some of thehugest heists in Survivor"
1032,01:12:38.97,01:12:38.97,"history.So ask me anything you want, and"
1033,01:12:43.13,01:12:43.13,"you'll get an honest answer.>> JEFF: All right, jury, in a"
1034,01:12:45.47,01:12:45.47,moment you're going to get yourfirst chance to address Amanda
1035,01:12:47.80,01:12:47.80,and Parvati.I'll give you a moment to think
1036,01:12:50.07,01:12:50.07,"about what you want to say.>> JEFF: All right, jury, it is"
1037,01:13:08.73,01:13:08.73,"now your first opportunity toaddress Amanda and Parvati,"
1038,01:13:13.53,01:13:13.53,trying to gain the informationyou need to make a million-
1039,01:13:15.77,01:13:15.77,"dollar decision.Eliza, get us started."
1040,01:13:24.57,01:13:24.57,>> Both of you played a greatstrategic game.
1041,01:13:26.60,01:13:26.60,"You made moves, and I canrespect that."
1042,01:13:29.03,01:13:29.03,But I honestly have no idea whoI'm going to vote for tonight.
1043,01:13:32.23,01:13:32.23,"Parvati, all 24 days I spent inthis game I spent on the island"
1044,01:13:37.37,01:13:37.37,with you.I think taking out Ozzy was a
1045,01:13:40.30,01:13:40.30,brilliant strategic move.I respect that move that you
1046,01:13:44.17,01:13:44.17,"made.What I can't respect, however,"
1047,01:13:47.90,01:13:47.90,is everything you did that wasnot necessary for strategic
1048,01:13:51.23,01:13:51.23,advancement in this game.You talked about me behind my
1049,01:13:53.73,01:13:53.73,back.You made fun of me.
1050,01:13:55.77,01:13:55.77,And that is not what got you tothe final two.
1051,01:13:58.13,01:13:58.13,It leads me to believe that youmight just be a mean person.
1052,01:14:00.53,01:14:00.53,So I'm going to have a lot ofdifficulty giving you my vote
1053,01:14:02.67,01:14:02.67,"tonight.Amanda, you played a great"
1054,01:14:05.50,01:14:05.50,"strategic game, and it was veryimpressive."
1055,01:14:09.27,01:14:09.27,"However, listening to you talkliterally made me want to kill"
1056,01:14:13.00,01:14:13.00,myself sometimes.I don't know that I can vote for
1057,01:14:15.67,01:14:15.67,someone who I think is sosuperficial.
1058,01:14:18.73,01:14:18.73,And I'm going to be sittingright there tonight listening to
1059,01:14:21.30,01:14:21.30,"every single thing you both say,because my vote is absolutely"
1060,01:14:24.43,01:14:24.43,not determined.So I hope that I can see some
1061,01:14:26.70,01:14:26.70,genuineness and honesty from youtwo tonight.
1062,01:14:29.60,01:14:29.60,">> JEFF: Thanks, Eliza.Jason, you're up."
1063,01:14:39.07,01:14:39.07,">> Amanda, when Ozzy was votedout, if you were let in on that"
1064,01:14:43.33,01:14:43.33,"plan, would you have told Ozzy?>> Yes."
1065,01:14:48.57,01:14:48.57,">> And Parv, I've had thesemisconceptions of you as a"
1066,01:14:55.23,01:14:55.23,"devious, manipulative player.And I just want to know what"
1067,01:14:58.27,01:14:58.27,some of your redeeming qualitieshave been in the game.
1068,01:15:02.47,01:15:02.47,">> Okay.Well, I think for one, I was"
1069,01:15:06.67,01:15:06.67,"very protective of my alliancewith Cirie and Amanda, gave them"
1070,01:15:12.03,01:15:12.03,"my loyalty, and was loyal tothem all the way to the end."
1071,01:15:15.50,01:15:15.50,So protectiveness and loyalty tothe ladies that I gave my
1072,01:15:21.37,01:15:21.37,loyalty to.We didn't kill Gloria the
1073,01:15:25.03,01:15:25.03,chicken.We saved her life.
1074,01:15:27.80,01:15:27.80,So I'm an animal lover.Is that good enough?
1075,01:15:30.53,01:15:30.53,>> Okay.>> JEFF: Satisfied?
1076,01:15:32.53,01:15:32.53,>> Yeah.Good luck to the both of you.
1077,01:15:34.63,01:15:34.63,">> JEFF: Alexis, you're up.>> My first question is for"
1078,01:15:41.50,01:15:41.50,"Parv.And, obviously, one of the"
1079,01:15:44.77,01:15:44.77,"biggest, most important thingsto me is how passionate I am"
1080,01:15:47.40,01:15:47.40,about working with young girls.I guess I'm just really curious
1081,01:15:51.07,01:15:51.07,what makes you a better rolemodel than Amanda for young
1082,01:15:54.40,01:15:54.40,girls.>> I don't know if it's better
1083,01:15:57.27,01:15:57.27,or worse.I'm more outspoken than Amanda.
1084,01:15:59.63,01:15:59.63,So I think I'm more independent.I don't like things to be done
1085,01:16:02.60,01:16:02.60,for me.Amanda would go along with the
1086,01:16:05.27,01:16:05.27,"flow, and for me, I think I'mmore willing to put myself out"
1087,01:16:08.97,01:16:08.97,there and make bold moves.And I didn't see much of that
1088,01:16:13.03,01:16:13.03,from Amanda.So I guess that's why I feel
1089,01:16:16.30,01:16:16.30,like I would make a better rolemodel.
1090,01:16:18.53,01:16:18.53,">> Thank you.Amanda, I have seen a bunch of"
1091,01:16:21.30,01:16:21.30,Oscar award-winning performancesand we couldn't help but be
1092,01:16:27.07,01:16:27.07,laughing when you were cryingabout sending Cirie home.
1093,01:16:30.50,01:16:30.50,It's not that I'm notsympathetic to it.
1094,01:16:32.53,01:16:32.53,"It's just I think, you know, youcry wolf so many times that,"
1095,01:16:34.43,01:16:34.43,"like, what about, if any, partof your game has been genuine?"
1096,01:16:38.83,01:16:38.83,>> I haven't been fakinganything that I've done at
1097,01:16:41.03,01:16:41.03,"tribal.The tears... like, I've only"
1098,01:16:43.50,01:16:43.50,"cried the last tribal council,and that was genuine."
1099,01:16:46.33,01:16:46.33,"Like, that was the hardestdecision I've ever had to make."
1100,01:16:48.97,01:16:48.97,I didn't come here trying to getsympathy votes.
1101,01:16:51.57,01:16:51.57,I don't want sympathy votes.>> JEFF: Do you have what you
1102,01:16:54.43,01:16:54.43,need?>> Mm-hmm.
1103,01:16:56.43,01:16:56.43,">> JEFF: Okay.Natalie, you're up."
1104,01:17:06.50,01:17:06.50,">> Ladies.First of all, you have my"
1105,01:17:09.30,01:17:09.30,"respect tonight, woman to woman.I'll start with you, Parv."
1106,01:17:14.57,01:17:14.57,You have labeled yourself as aflirt.
1107,01:17:17.80,01:17:17.80,You're probably the mostmasterful person in the history
1108,01:17:21.30,01:17:21.30,"of Survivor to play the flirtcard, which is great."
1109,01:17:23.83,01:17:23.83,My question to you is how doesthat resonate for you in the
1110,01:17:28.43,01:17:28.43,bedroom?How do you take that to the next
1111,01:17:32.10,01:17:32.10,level as far as strategy in thegame?
1112,01:17:34.97,01:17:34.97,How does that translate yourlayers of being?
1113,01:17:40.23,01:17:40.23,">> JEFF: Come on, guys.Parvati, do you know what she's"
1114,01:17:42.20,01:17:42.20,asking?>> You're a flirt.
1115,01:17:45.90,01:17:45.90,You flirted with me on severaloccasions.
1116,01:17:48.23,01:17:48.23,I'm not complaining.>> You're sexy.
1117,01:17:50.43,01:17:50.43,>> Thanks.So how does being the flirt
1118,01:17:54.03,01:17:54.03,parallel to your intimate life?>> I think my strategy in this
1119,01:17:59.80,01:17:59.80,"game has been infused with mypersonality, and being"
1120,01:18:04.03,01:18:04.03,flirtatious is a big part of mypersonality.
1121,01:18:06.70,01:18:06.70,"At home, it gets me what I want.I'll flirt with girls to get my"
1122,01:18:14.43,01:18:14.43,"way, or I'll flirt with guys toget my way."
1123,01:18:17.13,01:18:17.13,And I think I honestly candevelop genuine relationships
1124,01:18:20.80,01:18:20.80,with people without flirtingwith them.
1125,01:18:23.07,01:18:23.07,"But it is an old standby, I'mnot going to lie."
1126,01:18:25.67,01:18:25.67,">> Okay.Amanda, clearly, you're a"
1127,01:18:29.10,01:18:29.10,beautiful woman.You appear to be a very strong
1128,01:18:32.10,01:18:32.10,"woman.Unfortunately, you always had,"
1129,01:18:36.20,01:18:36.20,"like, a glazed-over look on yourface."
1130,01:18:38.60,01:18:38.60,I did notice that.My question to you is was that
1131,01:18:41.40,01:18:41.40,"your strategy to kind of playthe zombied pretty girl, not"
1132,01:18:46.33,01:18:46.33,"really knowing what's going on,pageant queen cliche, or is this"
1133,01:18:51.13,01:18:51.13,"who you are as a person?>> No, it's neither."
1134,01:18:55.57,01:18:55.57,"It was neither my strategy, nordo I think that's who I am as a"
1135,01:18:58.37,01:18:58.37,person.I'm a strong woman.
1136,01:19:01.10,01:19:01.10,"I definitely have substance.Sometimes I'm a little reserved,"
1137,01:19:04.03,01:19:04.03,but I definitely think I've madeintellectual strategic
1138,01:19:06.87,01:19:06.87,"decisions.And, you know, I want to compete"
1139,01:19:09.43,01:19:09.43,"with the men.Like, I came in this game to"
1140,01:19:11.80,01:19:11.80,compete with the guys.And I don't want anything given
1141,01:19:14.00,01:19:14.00,to me.I came in here to earn
1142,01:19:15.87,01:19:15.87,"everything.>> Okay, thank you both for your"
1143,01:19:17.73,01:19:17.73,"answers.>> JEFF: Thanks, Natalie."
1144,01:19:19.77,01:19:19.77,"Erik, you're up.>> Hi, girls."
1145,01:19:30.87,01:19:30.87,"Let me just start by saying fiveto six days ago, I would have"
1146,01:19:34.33,01:19:34.33,been 100% voting for Amanda inthis situation.
1147,01:19:37.40,01:19:37.40,"I mean, I really respected you,Amanda."
1148,01:19:40.97,01:19:40.97,"And I really thought of you kindof as a big sister, or a cousin."
1149,01:19:45.03,01:19:45.03,"As of late, after seeing certainthings, I mean, I'm looking at"
1150,01:19:47.93,01:19:47.93,you right now with a lot ofquestions.
1151,01:19:51.23,01:19:51.23,"I felt totally burned, totallythrown under the bus at the past"
1152,01:19:54.90,01:19:54.90,two tribal councils that I wasthere.
1153,01:19:57.77,01:19:57.77,"You pretty much ripped me apart.I mean, on what basis did you"
1154,01:20:01.40,01:20:01.40,"have to just judge me in frontof everybody, in front of this"
1155,01:20:03.57,01:20:03.57,jury?>> Okay.
1156,01:20:05.20,01:20:05.20,>> I just want to know that.I really want to know that.
1157,01:20:07.03,01:20:07.03,">> You know, everything I saidin tribal council was honest."
1158,01:20:09.40,01:20:09.40,"You were unloyal to me, and youtried to get me voted out, and I"
1159,01:20:11.70,01:20:11.70,was hurt.I wasn't going to sit there and
1160,01:20:14.47,01:20:14.47,let you try to vote me out andjust keep my mouth shut.
1161,01:20:17.90,01:20:17.90,"I'm sorry, if I hurt yourfeelings, but..."
1162,01:20:20.40,01:20:20.40,">> Too late for ""I'm sorries.""I've heard you say that... you"
1163,01:20:23.47,01:20:23.47,said that directly to me at oneof the tribal councils.
1164,01:20:25.70,01:20:25.70,"Too little, too late.You said that directly to me."
1165,01:20:28.37,01:20:28.37,"And now you're going to say ""I'msorry"" to me."
1166,01:20:30.90,01:20:30.90,I really don't buy that at all.>> Okay.
1167,01:20:34.23,01:20:34.23,>> I think I'm good.>> JEFF: Okay.
1168,01:20:39.87,01:20:39.87,James.How's the finger?
1169,01:20:45.17,01:20:45.17,>> The finger's all right.It's good.
1170,01:20:48.10,01:20:48.10,"I mean, I'm not even going to bedifficult."
1171,01:20:51.40,01:20:51.40,Amanda pretty much knows she'sgot it in the bag.
1172,01:20:54.50,01:20:54.50,"The only thing is, Parvati, youfluffed me."
1173,01:20:57.80,01:20:57.80,"You did the great move withOzzy, and the next day you came"
1174,01:21:00.13,01:21:00.13,up to me with a bunch of fluff.So we're just going to pretend
1175,01:21:03.23,01:21:03.23,"like you didn't say that, have ago again, we reenact it, you"
1176,01:21:06.07,01:21:06.07,"give me a different version.Go on, give it to me, and make"
1177,01:21:09.03,01:21:09.03,"it believable.>> Ha, ha, got you, sucker."
1178,01:21:11.47,01:21:11.47,What?>> That's not it.
1179,01:21:14.30,01:21:14.30,Try a little bit harder.>> That is what you wanted me to
1180,01:21:16.03,01:21:16.03,"say.>> No, that's not what I wanted."
1181,01:21:17.60,01:21:17.60,>> That's exactly what you saidyou wanted me to say.
1182,01:21:19.33,01:21:19.33,">> You're over-exaggerating it.What I wanted, you to just be"
1183,01:21:21.17,01:21:21.17,"honest.""Hey, I'm playing the game."
1184,01:21:22.87,01:21:22.87,"It's a game.""I mean, when I play the game..."
1185,01:21:24.60,01:21:24.60,>> It is a game.And the game... the motto is
1186,01:21:27.10,01:21:27.10,"""Outplay, outwit, outlast."">> Exactly."
1187,01:21:29.47,01:21:29.47,>> There was no chance for me towin this game if I stuck with
1188,01:21:32.03,01:21:32.03,"you, and if I stuck with Oz.There was no chance of me"
1189,01:21:35.43,01:21:35.43,sitting here if I stuck with youguys.
1190,01:21:37.67,01:21:37.67,And that's what I felt.I felt like I had to make that
1191,01:21:39.90,01:21:39.90,"move when I made it.It also, you know, gave me a lot"
1192,01:21:42.57,01:21:42.57,of control.And that's what I wanted.
1193,01:21:46.23,01:21:46.23,>> Are you finished?>> Yes.
1194,01:21:49.40,01:21:49.40,">> All right.>> JEFF: Cirie, you're up."
1195,01:21:54.10,01:21:54.10,>> All righty.Congratulations to both of you.
1196,01:22:00.90,01:22:00.90,"I'm going to start with you,Amanda."
1197,01:22:03.93,01:22:03.93,"Being that you had the decisionto make, tell me and the jury"
1198,01:22:07.70,01:22:07.70,why Parvati deserves a milliondollars more than I do.
1199,01:22:12.87,01:22:12.87,">> Parvati played a veryaggressive, bold game."
1200,01:22:17.87,01:22:17.87,"I think she's stood by her gamethe whole time, and I respect"
1201,01:22:22.17,01:22:22.17,"that about her.>> So in saying that, are you"
1202,01:22:24.83,01:22:24.83,saying you don't respect mygame?
1203,01:22:26.87,01:22:26.87,">> No, I respect your game aswell."
1204,01:22:28.83,01:22:28.83,I think Parvati made bolderdecisions in this game.
1205,01:22:32.13,01:22:32.13,>> Than I did?>> Yes.
1206,01:22:34.37,01:22:34.37,And I think she was kind of thepowerhouse in making those
1207,01:22:38.30,01:22:38.30,decisions happen.>> Okay.
1208,01:22:41.00,01:22:41.00,"Parvati, I would like you totell the jury why I should be"
1209,01:22:48.43,01:22:48.43,"sitting in your seat, and you beover here on the jury."
1210,01:22:51.53,01:22:51.53,>> I think you played a prettybrilliant game.
1211,01:22:54.60,01:22:54.60,"Yours was a little more, youknow, under the radar than mine"
1212,01:22:58.63,01:22:58.63,"was, which I think is a greatstrategy, you know, to get up"
1213,01:23:00.83,01:23:00.83,"here, too.But I can't compete with a"
1214,01:23:03.17,01:23:03.17,mother of three.You have kids.
1215,01:23:05.47,01:23:05.47,You have a family.I don't have that.
1216,01:23:07.97,01:23:07.97,"So based on those two factors, Iwould say it should have been"
1217,01:23:12.67,01:23:12.67,you right here.Is that good?
1218,01:23:14.73,01:23:14.73,Is that good enough?No?
1219,01:23:16.87,01:23:16.87,>> I'll ponder over here.>> Okay.
1220,01:23:19.47,01:23:19.47,">> Thanks, ladies.Good luck."
1221,01:23:21.47,01:23:21.47,">> Thanks.>> JEFF: Thanks, Cirie."
1222,01:23:24.97,01:23:24.97,"Ozzy, you're up.>> I think I might be the"
1223,01:23:35.83,01:23:35.83,biggest idiot up here.I am truly to the bottom of my
1224,01:23:40.83,01:23:40.83,heart hurt by what you did tome.
1225,01:23:43.77,01:23:43.77,It was a great move.It really was.
1226,01:23:46.77,01:23:46.77,But I never in a million yearsthought that you could do that
1227,01:23:51.03,01:23:51.03,to me.You put a price on our
1228,01:23:53.73,01:23:53.73,friendship.You threw us away like garbage.
1229,01:23:58.83,01:23:58.83,"You basically said, ""You knowwhat?"
1230,01:24:01.57,01:24:01.57,"You're not quite worth this muchmoney."""
1231,01:24:04.07,01:24:04.07,"And it hurts, you know?It really does hurt."
1232,01:24:07.17,01:24:07.17,And how can you say that you'rea role model when you're willing
1233,01:24:10.17,01:24:10.17,to discard a valuable friendshiplike that?
1234,01:24:13.97,01:24:13.97,A human being.But I don't want words.
1235,01:24:17.80,01:24:17.80,No words at all.I don't want to talk to you.
1236,01:24:25.97,01:24:25.97,"Honestly, the hardest part forme was the fact that you took"
1237,01:24:29.17,01:24:29.17,away 14 days that I could havespent with Amanda.
1238,01:24:44.53,01:24:44.53,"Amanda, when I told you on thebeach at one point when you"
1239,01:24:49.70,01:24:49.70,"asked me if I was playing you ornot, I told you honestly that"
1240,01:24:52.90,01:24:52.90,I'm not faking it.I'm not faking my feelings for
1241,01:24:56.53,01:24:56.53,"you or anything, no.I really am having feelings that"
1242,01:25:01.40,01:25:01.40,I've never really felt beforeand have never...
1243,01:25:08.03,01:25:08.03,I honestly feel like I startedto fall in love with you.
1244,01:25:13.37,01:25:13.37,And... I don't know.You're just an amazing girl.
1245,01:25:19.57,01:25:19.57,And I really want everybody toknow that.
1246,01:25:22.10,01:25:22.10,And I'm glad I didn't win CookIsland so that I could be here
1247,01:25:25.57,01:25:25.57,and have met you.>> Thank you.
1248,01:25:29.43,01:25:29.43,">> And that's it.>> JEFF: All right, jury."
1249,01:25:36.00,01:25:36.00,You've now had your opportunityto address Amanda and Parvati.
1250,01:25:39.97,01:25:39.97,"Certainly, an interesting finaltribal council, very emotional"
1251,01:25:45.30,01:25:45.30,at times.Now you have to make a
1252,01:25:49.50,01:25:49.50,million-dollar decision.Who do you vote for to win this
1253,01:25:52.53,01:25:52.53,game?I'm going to give you a moment
1254,01:25:55.20,01:25:55.20,"to think about your vote.>> JEFF: All right, jury, Amanda"
1255,01:26:16.27,01:26:16.27,and Parvati have had theirchance to address you.
1256,01:26:19.50,01:26:19.50,You've had your chance toaddress them.
1257,01:26:21.80,01:26:21.80,Now we get to the vote.Tonight you are voting for a
1258,01:26:24.93,01:26:24.93,winner-- the name of the personyou feel most deserving of the
1259,01:26:30.50,01:26:30.50,"title of sole survivor, and themillion-dollar check that goes"
1260,01:26:33.73,01:26:33.73,"with it.For the last time, it is time to"
1261,01:26:36.67,01:26:36.67,"vote.Cirie, you're up."
1262,01:26:55.40,01:26:55.40,>> I'm willing to forgive andforget if you're willing to
1263,01:26:58.30,01:26:58.30,forgive and forget.You played a good game.
1264,01:27:13.77,01:27:13.77,">> I love you so much, girl.You absolutely deserve this."
1265,01:27:16.67,01:27:16.67,And I know you're going to doamazing things with this money.
1266,01:27:34.97,01:27:34.97,>> I hope to god that you win.You deserve it a million times
1267,01:27:39.03,01:27:39.03,more than Parvati.And... love you.
1268,01:28:08.63,01:28:08.63,">> Oh, my god.>> JEFF: I'll go get the votes."
1269,01:28:33.17,01:28:33.17,"Amanda, Parvati, jury, thank youfor a great season of Survivor."
1270,01:28:39.07,01:28:39.07,I will see you back in the USFor the reading of the votes.
1271,01:28:48.73,01:28:48.73,>> Yes!>> JEFF: Thank you!
1272,01:29:39.50,01:29:39.50,Let's get to it!( cheers and applause )
1273,01:29:44.50,01:29:44.50,All right.Have a seat.
1274,01:29:47.37,01:29:47.37,( cheers and applause )Hello.
1275,01:29:55.03,01:29:55.03,"All right, let's get to this.Amanda, Parvati, jury, I've got"
1276,01:30:01.60,01:30:01.60,"to say, word on the street fromSurvivor fans is that aside"
1277,01:30:06.07,01:30:06.07,"from our first season, this isperhaps the best season we've"
1278,01:30:08.93,01:30:08.93,ever had.( cheers and applause )
1279,01:30:13.97,01:30:13.97,So kudos to you guys.Now it's time to put it to bed.
1280,01:30:19.70,01:30:19.70,There are eight votes tonight.It takes five to win.
1281,01:30:25.17,01:30:25.17,I will read the votes.>> Parvati.
1282,01:30:37.63,01:30:37.63,>> I know who wrote that.>> JEFF: One vote Parvati.
1283,01:30:44.13,01:30:44.13,"Amanda.One vote Amanda, one vote"
1284,01:30:49.07,01:30:49.07,Parvati.Parvati.
1285,01:30:57.17,01:30:57.17,"Two votes Parvati, one voteAmanda."
1286,01:31:05.87,01:31:05.87,Amanda.We're tied.
1287,01:31:08.67,01:31:08.67,"Two votes Amanda, two votesParvati."
1288,01:31:17.13,01:31:17.13,Parvati.>> I like that.
1289,01:31:20.70,01:31:20.70,">> JEFF: Three votes Parvati,two votes Amanda."
1290,01:31:28.00,01:31:28.00,"We're tied again.That's three votes Amanda, three"
1291,01:31:31.77,01:31:31.77,"votes Parvati, two votes left.Parvati."
1292,01:31:43.43,01:31:43.43,"Here's where we stand.Four votes Parvati, three votes"
1293,01:31:46.53,01:31:46.53,"Amanda, one vote left.If this vote is for Amanda, we"
1294,01:31:50.83,01:31:50.83,"have a tie.If this vote is for Parvati, we"
1295,01:31:53.53,01:31:53.53,have a winner.The winner of Survivor: Fans
1296,01:32:00.37,01:32:00.37,"Versus Favorites, Parvati.( cheers and applause )"
1297,01:32:06.67,01:32:06.67,>> You just won a milliondollars!
1298,01:32:11.07,01:32:11.07,">> JEFF: Head on down to thefamily, Parv."
1299,01:32:16.30,01:32:16.30,>> I love youI voted for you.
1300,01:32:27.33,01:32:27.33,>> Congratulations.>> Thank you.
1301,01:32:49.70,01:32:49.70,Captioned by Media Access Group at WGBH
1302,01:32:51.30,01:32:51.30,access.wgbh.org
