,begin,end,subtitles_text
0,00:00:00.00,00:00:00.00,">> JEFF PROBST: 36 days ago, ten"
1,00:00:04.00,00:00:04.00,fans of Survivor were pittedagainst ten of their favorite
2,00:00:08.07,00:00:08.07,players from seasons past.>> You could be a fan of the
3,00:00:11.57,00:00:11.57,"Boston Red Sox, man, but youdon't want to play against the"
4,00:00:13.43,00:00:13.43,Boston Red Sox.You're going to get your ass
5,00:00:15.33,00:00:15.33,handed to you.>> JEFF: Let's get it on.
6,00:00:32.37,00:00:32.37,The tropical paradise ofMicronesia...
7,00:00:34.57,00:00:34.57,>> Got a big old four-footshark.
8,00:00:36.50,00:00:36.50,>> JEFF: ...proved to be bothbountiful and brutal.
9,00:00:42.73,00:00:42.73,The castaways were unexpectedlybattered by storms on a daily
10,00:00:45.43,00:00:45.43,"basis.>> You watch this show at home,"
11,00:00:49.83,00:00:49.83,"and when they show the rain,they show it for, like, 30"
12,00:00:52.07,00:00:52.07,seconds.They're not showing that you're
13,00:00:54.07,00:00:54.07,"standing in the rain for five,six hours straight."
14,00:00:57.17,00:00:57.17,>> JEFF: The conditions were soharsh that one castaway quit.
15,00:01:01.27,00:01:01.27,>> I can't be here one moreminute.
16,00:01:03.57,00:01:03.57,I can't take it.>> Bye.
17,00:01:07.33,00:01:07.33,">> Bye.>> JEFF: Throughout the game,"
18,00:01:13.13,00:01:13.13,injuries piled up like neverbefore...
19,00:01:15.80,00:01:15.80,"Our injury tally so far, Pennerhas a busted-up knee, Parvati"
20,00:01:19.60,00:01:19.60,"has a busted-up lip, Ami has atweaked knee."
21,00:01:23.53,00:01:23.53,...forcing out two of the game'sstrongest players.
22,00:01:28.47,00:01:28.47,">> I can only recommend, for thesake of his leg and his life,"
23,00:01:32.30,00:01:32.30,that he leaves the game now.It's not going to get better.
24,00:01:35.50,00:01:35.50,">> Oh, god bless it.>> JEFF: Let's get you out of"
25,00:01:40.53,00:01:40.53,here and get you to a hospital.It was the first time ever that
26,00:01:43.83,00:01:43.83,three players left without beingvoted out.
27,00:01:47.20,00:01:47.20,But the game continued.An early alliance was formed
28,00:01:50.40,00:01:50.40,"between Amanda, Parvati, andCirie."
29,00:01:53.40,00:01:53.40,">> All right, ladies, I haveboth of you guys' words that"
30,00:01:55.83,00:01:55.83,it's us three to the end.>> Yes.
31,00:01:58.50,00:01:58.50,>> Yeah.>> JEFF: The three women stayed
32,00:02:00.27,00:02:00.27,"true to each other throughoutthe entire game, but Parvati"
33,00:02:02.77,00:02:02.77,made some side deals on her own.>> I might just go ahead and
34,00:02:06.03,00:02:06.03,pull in Natalie and Alexis andtake them with me and Amanda and
35,00:02:08.77,00:02:08.77,"Cirie.Everyone else, they're dead to"
36,00:02:11.37,00:02:11.37,me.>> JEFF: All the women banded
37,00:02:14.20,00:02:14.20,together to form a super-alliance which took control of
38,00:02:16.53,00:02:16.53,the game.>> What is the plan?
39,00:02:19.10,00:02:19.10,>> Final five girls.>> JEFF: The first thing on
40,00:02:21.20,00:02:21.20,their agenda was to blindsidethe biggest threat.
41,00:02:23.40,00:02:23.40,">> This is, like, the perfectopportunity to get rid of Ozzy,"
42,00:02:26.10,00:02:26.10,because he'll never see itcoming.
43,00:02:28.73,00:02:28.73,">> JEFF: He had the hiddenimmunity idol, but he didn't"
44,00:02:31.30,00:02:31.30,"play it.Ozzy, the tribe has spoken."
45,00:02:36.93,00:02:36.93,But Ozzy's exit was just thebeginning.
46,00:02:44.97,00:02:44.97,>> It's like the black widowbrigade-- all the girls spinning
47,00:02:48.17,00:02:48.17,the guys around as much as wecan until they don't know which
48,00:02:50.70,00:02:50.70,"way is up, and then we'redevouring them one at a time."
49,00:02:56.53,00:02:56.53,>> JEFF: What happened next wasan unprecedented series of
50,00:02:58.90,00:02:58.90,"blindsides.Jason had the idol, but the"
51,00:03:02.20,00:03:02.20,women convinced him that he wassafe.
52,00:03:04.40,00:03:04.40,Jason.So he didn't play it.
53,00:03:06.87,00:03:06.87,"At the following tribal council,because Erik had immunity, the"
54,00:03:09.67,00:03:09.67,women were forced to vote outone of their own.
55,00:03:13.13,00:03:13.13,They picked Amanda.>> Pretty much everyone here has
56,00:03:15.47,00:03:15.47,told me they're voting for metonight.
57,00:03:17.43,00:03:17.43,>> JEFF: But when she producedthe hidden immunity idol...
58,00:03:19.70,00:03:19.70,>> I got it!>> JEFF: ...the vote bounced
59,00:03:21.87,00:03:21.87,"back to Alexis.Alexis, you need to bring me"
60,00:03:23.67,00:03:23.67,your torch.And when Erik won immunity
61,00:03:27.83,00:03:27.83,"again...>> Nat, tell him if he were to"
62,00:03:29.90,00:03:29.90,"give you the necklace that wouldredeem him, and we would vote"
63,00:03:33.53,00:03:33.53,for Amanda.>> Who would fall for that?
64,00:03:36.03,00:03:36.03,>> I want to give individualimmunity to Natalie.
65,00:03:39.60,00:03:39.60,>> JEFF: ...they pulled off thebiggest blindside in Survivor
66,00:03:41.93,00:03:41.93,history.>> You officially go down as the
67,00:03:46.60,00:03:46.60,"dumbest survivor ever.>> JEFF: Erik, the tribe has"
68,00:03:51.17,00:03:51.17,spoken.Three days left in this game.
69,00:03:56.00,00:03:56.00,Who knows what is going tohappen?
70,00:03:59.53,00:03:59.53,Now four are left.Cirie...
71,00:04:02.20,00:04:02.20,">> In this game for me, it's allabout who I think I can trust."
72,00:04:05.57,00:04:05.57,"And if I feel that I can trustyou, then I'm willing to go all"
73,00:04:09.30,00:04:09.30,"the way with you.But if I don't trust you, then"
74,00:04:12.00,00:04:12.00,you can't believe a word I tellyou.
75,00:04:15.07,00:04:15.07,">> JEFF: ...Natalie...>> I'm in game mode, and now I'm"
76,00:04:20.40,00:04:20.40,actually having a lot more fun.I'm getting to be more of
77,00:04:23.80,00:04:23.80,"myself, which is proving to bepretty ruthless and pretty"
78,00:04:27.07,00:04:27.07,"stone-cold bitch, and prettycutthroat."
79,00:04:30.67,00:04:30.67,>> JEFF: ...Amanda...>> This is where the game gets
80,00:04:33.43,00:04:33.43,interesting.This season I have developed
81,00:04:35.63,00:04:35.63,"more personal relationships thanI did in China, and this game, I"
82,00:04:38.03,00:04:38.03,played completely loyal and justfought my way to the end.
83,00:04:41.77,00:04:41.77,>> JEFF: ...Parvati.>> Coming back and playing
84,00:04:44.10,00:04:44.10,"really aggressively, and prettymuch no holds barred for me."
85,00:04:46.63,00:04:46.63,So I haven't been here miserablegoing through all this crap to
86,00:04:50.23,00:04:50.23,not win this game.>> JEFF: Find out tonight who
87,00:04:53.47,00:04:53.47,will outlast all the rest tobecome the sole survivor.
88,00:05:19.97,00:05:19.97,">> ♪ Final four, final fourfinal four, final four. ♪"
89,00:05:25.30,00:05:25.30,">> When Erik paused, I waslike..."
90,00:05:28.00,00:05:28.00,I know.And I was like...
91,00:05:30.03,00:05:30.03,"And he goes, ""Well, this isrisky."""
92,00:05:33.17,00:05:33.17,"And I was like, ""It's in thebag."
93,00:05:35.27,00:05:35.27,"It is in the bag!""Everyone has fallen into our"
94,00:05:39.43,00:05:39.43,trap.Everyone.
95,00:05:42.47,00:05:42.47,And it's the same trap over andover and over again.
96,00:05:45.30,00:05:45.30,And every single person keepsfalling into it.
97,00:05:47.90,00:05:47.90,">> When I wrote his name down, Isaid, ""My mama always told me"
98,00:05:51.63,00:05:51.63,you might not be able to beatthem with these but you can
99,00:05:54.77,00:05:54.77,"always beat them with this.""We couldn't beat Erik at"
100,00:05:57.60,00:05:57.60,anything.But now that's all taken care
101,00:06:00.27,00:06:00.27,of.Erik's somewhere having a
102,00:06:02.90,00:06:02.90,"sandwich, and we're going tocontinue with the game."
103,00:06:05.40,00:06:05.40,>> That's four back-to-backblindsides which you girls have
104,00:06:07.73,00:06:07.73,managed to evade every singleone of them.
105,00:06:09.87,00:06:09.87,">> Wow.>> Like, let's see what happens"
106,00:06:11.53,00:06:11.53,next. Captioning sponsored by
107,00:06:20.83,00:06:20.83, CBS PARAMOUNT NETWORK TELEVISION
108,00:06:28.63,00:06:28.63,( theme song playing )>> There she is.
109,00:07:19.63,00:07:19.63,How long have you been up for?>> I don't know.
110,00:07:21.80,00:07:21.80,Probably an hour.>> Did you sleep good?
111,00:07:24.13,00:07:24.13,>> Mm-hmm.>> We were talking about Erik.
112,00:07:27.60,00:07:27.60,">> Oh, it's just tearing myheart out that there aren't any"
113,00:07:33.97,00:07:33.97,guys around here.Can't you see the tears in my
114,00:07:36.63,00:07:36.63,eyes?>> These guys just walk right
115,00:07:40.47,00:07:40.47,"into the Venus flytrap, and theyget eaten alive."
116,00:07:44.17,00:07:44.17,>> Yeah.>> Heist number four...
117,00:07:46.70,00:07:46.70,>> In a row.>> ...goes off without a hitch.
118,00:07:50.60,00:07:50.60,>> I'm going to check and see ifmy money is still in my pocket
119,00:07:53.00,00:07:53.00,around y'all.I can't trust you.
120,00:07:55.53,00:07:55.53,I'm nervous around y'all.>> I'm nervous around you.
121,00:08:26.97,00:08:26.97,">> Oh, my god!That's so many!"
122,00:08:29.37,00:08:29.37,"Nice job, Parv.>> I haven't missed the guys"
123,00:08:32.37,00:08:32.37,here for one second.I love having this group of
124,00:08:34.80,00:08:34.80,"girls here, Just chilling,hanging out, without the big"
125,00:08:37.53,00:08:37.53,"egos running around and the guystrying to, you know, provide and"
126,00:08:41.10,00:08:41.10,look cool in front of theladies.
127,00:08:43.93,00:08:43.93,I love just me and the girls.>> This has been a really hard
128,00:08:46.77,00:08:46.77,season.>> It's been so hard.
129,00:08:49.00,00:08:49.00,>> Because all the freakinggirls are smart girls in this
130,00:08:51.03,00:08:51.03,season.>> I'm not kidding.
131,00:08:53.57,00:08:53.57,And we beat them out with ourbrains.
132,00:08:55.77,00:08:55.77,I can't believe we beat thoseguys.
133,00:08:59.83,00:08:59.83,">> Oh, my god.I'm just so thankful to be here."
134,00:09:05.13,00:09:05.13,>> I'm so thankful that you'rehere.
135,00:09:07.70,00:09:07.70,"I feel like you have a way of,like, convincing people, and"
136,00:09:10.93,00:09:10.93,"they're like, ""You're so right.""You really should... you really"
137,00:09:13.67,00:09:13.67,should swallow your pride andask for whatever you want all
138,00:09:16.47,00:09:16.47,the time.>> I know.
139,00:09:18.33,00:09:18.33,I feel I live out of fear in mynormal life a lot.
140,00:09:20.97,00:09:20.97,"I'm so scared of people sayingno, so I don't ask."
141,00:09:24.10,00:09:24.10,>> Yeah.But your life could be so much
142,00:09:26.67,00:09:26.67,better if you just ask forthings that you want.
143,00:09:29.43,00:09:29.43,>> I know.>> You know?
144,00:09:31.23,00:09:31.23,">> I know.My position at this point, I'm"
145,00:09:33.13,00:09:33.13,the only fan left.They're all favorites.
146,00:09:35.47,00:09:35.47,They all started on a tribetogether.
147,00:09:38.10,00:09:38.10,But I've definitely made apersonal bond and connection
148,00:09:40.43,00:09:40.43,with Parvati.We get each other.
149,00:09:42.87,00:09:42.87,We have great conversation.So I think we complement each
150,00:09:46.90,00:09:46.90,"other well.>> Honestly, I think the people"
151,00:09:49.27,00:09:49.27,"that you encounter when you dothings like this, like, the"
152,00:09:55.07,00:09:55.07,"people that you're with, youhave to know that they are there"
153,00:09:59.07,00:09:59.07,for a reason.>> Yeah.
154,00:10:01.77,00:10:01.77,>> You know?And there's a reason that you
155,00:10:03.83,00:10:03.83,and I are here together.We have a one-in-four shot of
156,00:10:05.60,00:10:05.60,winning a million dollars rightnow.
157,00:10:07.27,00:10:07.27,>> Yeah.>> Unbelievable.
158,00:10:12.40,00:10:12.40,">> But everyone here has earnedtheir spot in the final three,"
159,00:10:14.30,00:10:14.30,you know?>> Absolutely.
160,00:10:16.47,00:10:16.47,>> Everyone here has played adamn good game.
161,00:10:18.33,00:10:18.33,>> Yeah.I think Parvati is an ally for
162,00:10:20.50,00:10:20.50,me in this game.My conversations and my heart-
163,00:10:22.97,00:10:22.97,to-hearts with Parvati and ourgreat connection-- does it
164,00:10:26.20,00:10:26.20,benefit me at all if we'recloser than not?
165,00:10:31.10,00:10:31.10,Of course.>> Tree mail!
166,00:10:37.43,00:10:37.43,">> What does it say?>> Yeah, I was hoping for food."
167,00:10:40.07,00:10:40.07,">> Me, too.>> Reward or immunity?"
168,00:10:43.10,00:10:43.10,"Does it say?>> ""Indeed you've accomplished a"
169,00:10:45.40,00:10:45.40,noble task.You've made it the final four.
170,00:10:47.93,00:10:47.93,"To climb the heights of victory,you need to scramble once more."""
171,00:10:51.50,00:10:51.50,>> What?>> It's immunity.
172,00:10:54.03,00:10:54.03,Today?>> Wow.
173,00:10:56.43,00:10:56.43,>> I am not happy.>> We're thinking that winning
174,00:10:59.80,00:10:59.80,this challenge is pretty muchguaranteed final three.
175,00:11:03.83,00:11:03.83,"So we have to beat Natalie.I mean, we love the fact that"
176,00:11:07.23,00:11:07.23,"it's all women, but being thatit's all women, one of us has to"
177,00:11:10.50,00:11:10.50,go.>> JEFF: Four ladies feeling oh
178,00:11:39.63,00:11:39.63,so good about themselves.You guys ready to get to today's
179,00:11:44.83,00:11:44.83,immunity challenge?>> Yep.
180,00:11:47.03,00:11:47.03,">> JEFF: First things first.Natalie, I'll take back that"
181,00:11:48.87,00:11:48.87,"necklace.Once again, immunity is back up"
182,00:11:58.20,00:11:58.20,"for grabs.For today's challenge, you will"
183,00:12:01.13,00:12:01.13,start on a very small perch atthe top of a 20-foot pole in the
184,00:12:06.20,00:12:06.20,"water.On my go, you will use a bucket"
185,00:12:08.43,00:12:08.43,to gather water that you willthen pour into a bamboo chute.
186,00:12:12.50,00:12:12.50,"As the water fills up the chute,it will raise a set of keys."
187,00:12:15.80,00:12:15.80,"You'll take those keys, you'llswim back to shore and use them"
188,00:12:18.60,00:12:18.60,to unlock a chest containing 16individually shaped ladder
189,00:12:24.03,00:12:24.03,rungs.The first person to correctly
190,00:12:27.43,00:12:27.43,"assemble their ladder, climb tothe top, and raise their flag,"
191,00:12:30.50,00:12:30.50,"wins immunity, guaranteed a one-in-three shot at winning this"
192,00:12:34.00,00:12:34.00,game.Make sense?
193,00:12:36.57,00:12:36.57,>> Yep.>> Yep.
194,00:12:38.50,00:12:38.50,>> JEFF: We'll draw forposition.
195,00:12:40.10,00:12:40.10,"We'll get started.Here we go, for immunity and a"
196,00:12:55.70,00:12:55.70,guaranteed spot in the finalthree.
197,00:12:58.20,00:12:58.20,Survivors ready?Go.
198,00:13:04.37,00:13:04.37,"Going to pull up that bucketfull of water, and then pour it"
199,00:13:07.63,00:13:07.63,"down that bamboo chute.The more water you get in, the"
200,00:13:13.33,00:13:13.33,faster you will raise those keysup to where you can grab them.
201,00:13:26.97,00:13:26.97,Natalie having a lot of success.Parvati got most of it in the
202,00:13:31.93,00:13:31.93,chute.Doesn't matter how fast you pull
203,00:13:35.00,00:13:35.00,up the water if you don't pourit in the chute.
204,00:13:41.33,00:13:41.33,Natalie doing a great job.Can't quite reach her keys.
205,00:13:46.57,00:13:46.57,Parvati and Natalie neck andneck right now.
206,00:13:56.87,00:13:56.87,Natalie has her keys.She's in the water.
207,00:14:03.67,00:14:03.67,Parvati very close.Parvati reaching for her keys.
208,00:14:09.53,00:14:09.53,Parvati unclips.She's in the water.
209,00:14:14.10,00:14:14.10,Got to get to shore and openthat chest.
210,00:14:17.83,00:14:17.83,Amanda reaching for those keys.Can't do it.
211,00:14:21.20,00:14:21.20,Going to take another bucket ofwater.
212,00:14:24.00,00:14:24.00,Natalie and Parvati with a biglead at this point.
213,00:14:26.50,00:14:26.50,Both opening their chests up.Amanda has her set of keys.
214,00:14:39.87,00:14:39.87,Got to unclip.She's in the water.
215,00:14:46.00,00:14:46.00,"Cirie, is it close enough?Cirie reaches for the keys."
216,00:14:50.97,00:14:50.97,Cirie has her keys!Get in that water.
217,00:14:56.70,00:14:56.70,Everybody is in this.Natalie continues to extend her
218,00:15:01.03,00:15:01.03,lead.This ladder will take some time
219,00:15:04.40,00:15:04.40,to assemble.Only one person going to walk
220,00:15:08.63,00:15:08.63,away from here with immunity.The other three vulnerable at
221,00:15:11.43,00:15:11.43,tonight's tribal council.You have 16 ladder rungs.
222,00:15:17.70,00:15:17.70,Each ladder rung is individuallyshaped and will only go into one
223,00:15:22.40,00:15:22.40,"slot on that ladder.If you have to force it, it's"
224,00:15:26.70,00:15:26.70,"not right.If you have a lot of play, it's"
225,00:15:29.10,00:15:29.10,"not right.16 different options, but it"
226,00:15:34.33,00:15:34.33,only goes together one way.Amanda appears to be making some
227,00:15:44.83,00:15:44.83,progress.Parvati's got some rungs in her
228,00:15:48.07,00:15:48.07,ladder.Natalie and Cirie trying to make
229,00:15:50.33,00:15:50.33,sure they're right.Merely getting to the top is not
230,00:15:53.43,00:15:53.43,enough.Amanda making a lot of progress.
231,00:15:57.73,00:15:57.73,"If she's right, that's a biglead."
232,00:16:02.43,00:16:02.43,Parvati skipping up ahead.Putting some of the higher
233,00:16:05.77,00:16:05.77,ladder rungs in first.Cirie is working her way up
234,00:16:09.23,00:16:09.23,methodically from the bottom.Natalie having a little trouble
235,00:16:14.37,00:16:14.37,with this puzzle.Amanda pulling away from the
236,00:16:17.83,00:16:17.83,"pack.At this point, it is Amanda's"
237,00:16:22.13,00:16:22.13,challenge to lose.She has a huge lead.
238,00:16:30.17,00:16:30.17,Amanda can't get that last rungin.
239,00:16:33.07,00:16:33.07,Something's not right.Amanda going now rung by rung
240,00:16:36.20,00:16:36.20,trying to figure out where she'soff.
241,00:16:39.43,00:16:39.43,Natalie getting closer.Amanda swapping pieces out.
242,00:16:46.10,00:16:46.10,"Immunity so close.Amanda thinks she has it, and"
243,00:16:54.13,00:16:54.13,she does.Amanda wins immunity!
244,00:16:59.27,00:16:59.27,">> Good job, girl.>> Good job."
245,00:17:04.17,00:17:04.17,">> Oh, my god!>> Good job, girl."
246,00:17:06.83,00:17:06.83,"That was tough.>> JEFF: Amanda, come on over."
247,00:17:11.90,00:17:11.90,Congratulations.>> Thank you.
248,00:17:17.50,00:17:17.50,>> JEFF: Guaranteed a one-in-three shot at winning this game
249,00:17:20.37,00:17:20.37,and the million bucks that goeswith it.
250,00:17:22.63,00:17:22.63,"Natalie, Cirie, Parvati, after37 hard-fought days, one of you"
251,00:17:25.60,00:17:25.60,will not make it to the final.Figure out who that's going to
252,00:17:28.97,00:17:28.97,"be tonight at tribal council.Grab your stuff, head out."
253,00:17:31.13,00:17:31.13,See you at tribal.>> The only reason you beat me
254,00:17:48.13,00:17:48.13,is because your legs are longerthan mine.
255,00:17:50.17,00:17:50.17,">> Right.>> Me, too."
256,00:17:52.10,00:17:52.10,>> I was right hot on yourtrail.
257,00:17:53.73,00:17:53.73,">> Oh, I know, girl.>> We all were."
258,00:17:58.23,00:17:58.23,>> I'm in the final three.I can't believe it.
259,00:18:01.27,00:18:01.27,"I'm really, like... I'mecstatic."
260,00:18:03.87,00:18:03.87,"And that's, like, twice in arow."
261,00:18:06.60,00:18:06.60,"And this time I have played mygame so different, and I feel so"
262,00:18:09.33,00:18:09.33,much better about it.>> We could set Gloria free.
263,00:18:22.50,00:18:22.50,">> You know, they always talkabout the lowest man on the"
264,00:18:24.93,00:18:24.93,totem pole.I do indeed feel like the low
265,00:18:27.00,00:18:27.00,woman on the totem pole.But am I just going to tuck my
266,00:18:31.17,00:18:31.17,"tail between my legs and scurryout of here and say, ""Bye, guys,"
267,00:18:33.60,00:18:33.60,"well, it was great, I'm goinghome""?"
268,00:18:37.03,00:18:37.03,"No, I'm going to explore all myoptions."
269,00:18:40.10,00:18:40.10,"If Gloria is anything like thewomen on this camp, she'll mate"
270,00:18:43.70,00:18:43.70,with that dude and then rip hisneck off.
271,00:18:48.57,00:18:48.57,">> Oh, that's funny.>> I'm dealing women who are as"
272,00:18:52.33,00:18:52.33,smart as I am.So if I go in and I'm hustling
273,00:18:54.73,00:18:54.73,"and I'm shaking and I'm movingand I'm stressing, they're going"
274,00:18:58.03,00:18:58.03,"to see right through it.So I think if I'm calm, cool,"
275,00:19:00.77,00:19:00.77,and collected there's a way toweasel in and communicate with
276,00:19:03.60,00:19:03.60,them in a way that may seemreasonable.
277,00:19:20.57,00:19:20.57,>> This sucks.I hate when it gets to this
278,00:19:23.97,00:19:23.97,point.Why can't we all just stay?
279,00:19:27.13,00:19:27.13,Why can't they have a finalfour?
280,00:19:29.13,00:19:29.13,">> That would be cool.>> I don't know, Natty, girl."
281,00:19:34.73,00:19:34.73,I don't know.Have you promised anybody your
282,00:19:37.83,00:19:37.83,"vote?Oh, good."
283,00:19:41.73,00:19:41.73,>> No.>> Good.
284,00:19:48.00,00:19:48.00,>> I believe Cirie is quitenervous as far as jury votes are
285,00:19:50.20,00:19:50.20,concerned.I could use this to address
286,00:19:53.40,00:19:53.40,Parvati to help me out.It's kind of a little glimmer at
287,00:19:56.83,00:19:56.83,"the end of the tunnel, a littlelight, because I do firmly"
288,00:19:59.23,00:19:59.23,believe that Parvati would goout on a limb for me.
289,00:20:06.10,00:20:06.10,>> Huh?>> How good of a shot do we have
290,00:20:09.47,00:20:09.47,"to win this, do you think?>> Huge."
291,00:20:11.23,00:20:11.23,>> Yeah?>> You and I?
292,00:20:12.93,00:20:12.93,I think it's between you and I.>> Really?
293,00:20:14.57,00:20:14.57,>> Mm-hmm.>> Definitely.
294,00:20:22.50,00:20:22.50,>> It's been kind of our planfrom pretty much the beginning
295,00:20:26.03,00:20:26.03,"to have me, Parv and Cirie inthe final three."
296,00:20:28.93,00:20:28.93,But I think Cirie is definitelya threat as far as swaying
297,00:20:32.00,00:20:32.00,votes from the jury one way orthe other.
298,00:20:34.63,00:20:34.63,"And I don't want Natalie to go.I think, you know, she"
299,00:20:36.93,00:20:36.93,definitely deserves to be here.I think she's played a good
300,00:20:38.87,00:20:38.87,"game.Cirie, she knows that if Natalie"
301,00:20:44.03,00:20:44.03,"would have won, Nat would havevoted with me and you and Cirie"
302,00:20:46.83,00:20:46.83,would have been gone.>> True.
303,00:20:49.97,00:20:49.97,>> I don't know who I'm votingfor tonight.
304,00:20:51.80,00:20:51.80,"I mean, it's hard.It's far in the game."
305,00:20:53.80,00:20:53.80,"You know, it's not easy.You know everyone is still"
306,00:20:56.47,00:20:56.47,playing the game at this point.It would be stupid not to still
307,00:20:59.13,00:20:59.13,be playing the game.>> I give Natalie so much
308,00:21:01.70,00:21:01.70,"credit.>> Me, too."
309,00:21:03.73,00:21:03.73,>> Cirie got lucky to be withus.
310,00:21:11.87,00:21:11.87,>> Yeah.>> You okay?
311,00:21:25.87,00:21:25.87,>> Mm-hmm.>> I was like...
312,00:21:31.90,00:21:31.90,"""No.You're asking me this right now"
313,00:21:34.93,00:21:34.93,"because..."">> I love Natalie to death, and"
314,00:21:45.43,00:21:45.43,I think she's a lesser threat asfar as jury votes than Cirie.
315,00:21:49.30,00:21:49.30,"And now the time has come whereit's, like, I could switch it up"
316,00:21:54.47,00:21:54.47,"now, and then we have ourbiggest jury threat out of the"
317,00:21:57.63,00:21:57.63,"game.But, seriously, in this game,"
318,00:22:00.63,00:22:00.63,"and how this game's been playedall these women are so crafty, I"
319,00:22:04.70,00:22:04.70,wouldn't put it past any singleone of us to work some kind of
320,00:22:07.87,00:22:07.87,deal out and make it to thethree.
321,00:22:14.63,00:22:14.63,>> Yeah.>> Yeah.
322,00:22:25.77,00:22:25.77,>> I could be going hometonight.
323,00:22:28.07,00:22:28.07,"They could have made a deal withNatalie and decided, ""You know"
324,00:22:29.93,00:22:29.93,what?We like you better.
325,00:22:32.17,00:22:32.17,"Cirie's out.""And smiling in my face."
326,00:22:34.50,00:22:34.50,I saw their work already.We duped so many people....
327,00:22:42.27,00:22:42.27,>> ...with straight faces.>> JEFF: We'll now bring in the
328,00:23:05.73,00:23:05.73,"members of our jury.Eliza, Ozzy, Jason, James,"
329,00:23:13.00,00:23:13.00,"Alexis, and Erik, voted out atthe last tribal council."
330,00:23:28.37,00:23:28.37,So we have a final fourconsisting of only women.
331,00:23:33.73,00:23:33.73,And all of you women have beeninvolved in another first-- four
332,00:23:37.00,00:23:37.00,"straight blindsides.Natalie, after the performance"
333,00:23:41.03,00:23:41.03,"from the four of you at the lasttribal council, you all should"
334,00:23:44.27,00:23:44.27,be nominated for a SurvivorAcademy Award.
335,00:23:47.93,00:23:47.93,"It was masterful to watch.>> No disrespect to anyone, but"
336,00:23:53.90,00:23:53.90,it went down seamlessly.We achieved an impossible task.
337,00:23:57.97,00:23:57.97,So it was a great feeling.>> JEFF: So after four straight
338,00:24:01.97,00:24:01.97,"blindsides, what's the feelinggoing into tonight's vote?"
339,00:24:06.50,00:24:06.50,">> I think at this point, thefour of us respect each other"
340,00:24:09.63,00:24:09.63,enough that I don't think therewould be a blindside.
341,00:24:12.07,00:24:12.07,I would pray for a blindside onsome level.
342,00:24:16.07,00:24:16.07,Like now it would actuallybenefit me better than all the
343,00:24:18.10,00:24:18.10,"other four.>> JEFF: Amanda, how concerned"
344,00:24:21.17,00:24:21.17,are you tonight that you knowexactly what's happening?
345,00:24:24.67,00:24:24.67,">> At this point, Jeff, I haveno idea what's going on."
346,00:24:28.53,00:24:28.53,"I mean, how many times does ablindside have to happen before"
347,00:24:31.80,00:24:31.80,you figure out that you knownothing about what's going on at
348,00:24:35.10,00:24:35.10,all?I'm fairly confident that I know
