,begin,end,subtitles_text
359,00:22:12.83,00:22:12.83,I can't believe I found it andthe lawyer didn't.
360,00:22:15.42,00:22:15.42,How funny is that?That's funny.
361,00:22:18.25,00:22:18.25,"But my dad's been with me thiswhole time, so I feel like he's"
362,00:22:21.92,00:22:21.92,"been helping me.Um, he's here."
363,00:22:26.04,00:22:26.04,"Thank you, my friend.You were awesome."
364,00:22:30.00,00:22:30.00,(laughs)Thank you very much.
365,00:22:36.58,00:22:36.58,♪ ♪>> Uh-huh.
366,00:22:58.12,00:22:58.12,>> And those are the two thatI'm flip-flopping with.
367,00:23:02.00,00:23:02.00,And I know you like Sugar.>> I like Sugar as a person.
368,00:23:05.88,00:23:05.88,"You know, she's loyal.And loyalty stands a lot for"
369,00:23:08.92,00:23:08.92,this game.You know that.
370,00:23:10.12,00:23:10.12,>> Yeah.>> I think we can trust Sugar
371,00:23:13.08,00:23:13.08,longer than we can Paloma.>> Ace is putting himself at
372,00:23:16.92,00:23:16.92,at risk by doing thismanipulation.
373,00:23:19.21,00:23:19.21,"By calling out Paloma, he'sprotecting Sugar big-time."
374,00:23:22.50,00:23:22.50,He wants to keep Sugar.I can see why.
375,00:23:25.46,00:23:25.46,"If she makes it to the jury,she will vote for him, but that"
376,00:23:28.83,00:23:28.83,can irritate people and itworries people.
377,00:23:30.83,00:23:30.83,And that's what worries me.>> It'll definitely be Paloma
378,00:23:41.21,00:23:41.21,and then Sugar.>> Yeah.
379,00:23:43.00,00:23:43.00,">> Or Sugar, then Paloma.I mean, they're going."
380,00:23:44.29,00:23:44.29,Ace is doing something verystupid.
381,00:23:46.12,00:23:46.12,He's bringing Sugar to the endbecause she's weak.
382,00:23:47.92,00:23:47.92,She needs him.I'll tell you this much.
383,00:23:49.79,00:23:49.79,"I have, you know, Jacquie,Marcus, Charlie."
384,00:23:52.33,00:23:52.33,"You know, we're all in yourbook."
385,00:23:54.29,00:23:54.29,"As long as, you know, you feelthe same way we do, we're all"
386,00:23:57.08,00:23:57.08,in it together.>> Yeah.
387,00:23:58.58,00:23:58.58,>> And there's five of us.So it's... we can pick whoever
388,00:24:00.83,00:24:00.83,we want.We are in the majority.
389,00:24:02.67,00:24:02.67,"I think Bob responds reallywell to bold, confident moves."
390,00:24:05.79,00:24:05.79,"When I was speaking to him,I had to speak to him like,"
391,00:24:08.25,00:24:08.25,"""Here's the deal.These are the four."
392,00:24:09.79,00:24:09.79,You're the fifth.That's all you need to know.
393,00:24:11.12,00:24:11.12,"It's the majority.We're getting rid of this one."""
394,00:24:12.92,00:24:12.92,That's it.And it doesn't really matter
395,00:24:14.79,00:24:14.79,'cause we're five.So lock it down.
396,00:24:17.58,00:24:17.58,That's it.>> Good point.
397,00:24:18.79,00:24:18.79,>> None of us are lookingto take Bob to the end.
398,00:24:21.00,00:24:21.00,"However, we need him fornumbers, and I think that we can"
399,00:24:23.58,00:24:23.58,trust him.>> Tree mail.
400,00:24:25.62,00:24:25.62,">> ""Slip, slide, splash and run.The stakes are high, but you'll"
401,00:24:28.92,00:24:28.92,have some fun.Who is bright and who is slow?
402,00:24:32.29,00:24:32.29,"Know the difference or be thenext to go."""
403,00:24:34.67,00:24:34.67,">> Oh, no!>> (gasps): Yay!"
404,00:24:36.08,00:24:36.08,>> Yay!I knew our swimsuits were
405,00:24:37.83,00:24:37.83,in there!>> Yay!
406,00:24:40.62,00:24:40.62,>> I think the next immunitychallenge is the most crucial
407,00:24:43.83,00:24:43.83,one that we've had at thispoint.
408,00:24:45.71,00:24:45.71,Their one victory has giventhem some hope.
409,00:24:47.92,00:24:47.92,Crushing that hope is going tosend them to another level of
410,00:24:50.62,00:24:50.62,"despair.>> PROBST: Come on in, guys!"
411,00:25:04.62,00:25:04.62,"We'll now bring in Sugar,returning from Exile Island."
412,00:25:07.21,00:25:07.21,">> Sugar.>> Hey, babe."
413,00:25:09.25,00:25:09.25,>> Oh!That was really wrong.
414,00:25:12.71,00:25:12.71,>> I know.>> PROBST: Don't look at me.
415,00:25:16.88,00:25:16.88,I didn't send you.It's the game.
416,00:25:19.38,00:25:19.38,"All right, you guys readyto get to today's immunity"
417,00:25:21.46,00:25:21.46,challenge?>> Yeah.
418,00:25:22.88,00:25:22.88,>> PROBST: First things first.I will take it back again.
419,00:25:28.79,00:25:28.79,"Once again, immunity is back upfor grabs."
420,00:25:32.25,00:25:32.25,"For today's challenge, one at atime, you will launch yourself"
421,00:25:35.25,00:25:35.25,down a slippery slide and intothe water.
422,00:25:39.25,00:25:39.25,You'll then swim out toretrieve a covered number tile
423,00:25:42.25,00:25:42.25,and race back.Once you've collected all six
424,00:25:45.21,00:25:45.21,"tiles, the remaining tribemember will use those numbered"
425,00:25:49.00,00:25:49.00,tiles to solve a math puzzle.The answer will reveal the
426,00:25:53.29,00:25:53.29,combination to a chest.First tribe to open their
427,00:25:57.29,00:25:57.29,chest and raise their tribeflag... wins immunity.
428,00:26:02.88,00:26:02.88,"Losers, Tribal Council, wheresomebody will be going home."
429,00:26:05.92,00:26:05.92,"Kota, you have two extramembers."
430,00:26:07.71,00:26:07.71,Who's going to sit out this one?Paloma and Sugar.
431,00:26:10.79,00:26:10.79,I'll also give you a minuteto strategize.
432,00:26:12.62,00:26:12.62,"We'll get started.All right, Bob and Ken are"
433,00:26:19.21,00:26:19.21,waiting to solve puzzle.Everybody else is going down
434,00:26:21.83,00:26:21.83,"the slide.For immunity, survivors ready?"
435,00:26:26.00,00:26:26.00,Go!It's Crystal and Kelly first
436,00:26:28.04,00:26:28.04,down.Kelly does it perfectly.
437,00:26:30.88,00:26:30.88,Crystal takes a hard hit.Both are in the water at the
438,00:26:35.92,00:26:35.92,same time.Crystal's tall enough she can
439,00:26:38.83,00:26:38.83,actually run to get her firstpuzzle piece.
440,00:26:41.83,00:26:41.83,">> Come on, Kelly!>> PROBST: Kelly coming back."
441,00:26:44.04,00:26:44.04,">> Come on, Crystal!>> Run!"
442,00:26:46.58,00:26:46.58,>> PROBST: Crystal out of thewater first for Fang.
443,00:26:49.17,00:26:49.17,">> Run, Crystal, run!>> PROBST: Susie on the course."
444,00:26:53.58,00:26:53.58,">> Come on, Kel.>> PROBST: Fang with a"
445,00:26:56.42,00:26:56.42,good-sized lead right off thebat.
446,00:27:01.25,00:27:01.25,Corinne hits the course.>> That was awesome!
447,00:27:05.79,00:27:05.79,">> Come on, Susie!>> PROBST: Susie has the second"
448,00:27:09.21,00:27:09.21,piece to this puzzle.Corinne quickly gets her number.
449,00:27:13.29,00:27:13.29,She's heading back.Making up a lot of time on
450,00:27:16.50,00:27:16.50,"Susie.>> Come on, Sue, faster!"
451,00:27:18.79,00:27:18.79,>> You got it!You got it!
452,00:27:20.38,00:27:20.38,>> PROBST: Fang has lost all oftheir lead now.
453,00:27:23.83,00:27:23.83,"Charlie on the course for Kota.>> Yeah, Charlie!"
454,00:27:28.17,00:27:28.17,>> PROBST: Kota now has thelead.
455,00:27:30.04,00:27:30.04,">> Yeah, Charlie!>> PROBST: GC on the course"
456,00:27:33.21,00:27:33.21,for Fang.That's how you do it.
457,00:27:38.04,00:27:38.04,"Charlie out of the water,heading back for Kota."
458,00:27:41.04,00:27:41.04,"Kota has three tiles back.Fang, still with two."
459,00:27:45.83,00:27:45.83,Kota still with a good-sizedlead.
460,00:27:50.71,00:27:50.71,"Randy on the course for Fang.>> Come on, Randy!"
461,00:27:56.75,00:27:56.75,>> PROBST: Jacquie out of thewater for Kota.
462,00:27:59.29,00:27:59.29,Two numbers left.Ace flips over twice.
463,00:28:07.21,00:28:07.21,Randy needs to pick it up.Fang has lost more time.
464,00:28:12.25,00:28:12.25,Dan on the course for Fang.Still looking to win that first
465,00:28:15.08,00:28:15.08,immunity challenge.Ace holding on to Kota's lead.
466,00:28:19.08,00:28:19.08,>> Ace!>> PROBST: Kota has one number
467,00:28:21.25,00:28:21.25,left in the water.Fang has two more left.
468,00:28:25.88,00:28:25.88,A big launch.Marcus heading out for that
469,00:28:29.25,00:28:29.25,sixth and final number for Kota.Dan finally out of the water
470,00:28:33.92,00:28:33.92,for Fang.Matty's going to have to make
471,00:28:36.88,00:28:36.88,up a lot of time.Marcus out of the water with
472,00:28:42.21,00:28:42.21,the sixth and final number forKota.
473,00:28:45.79,00:28:45.79,It's now up to Bob to solve thepuzzle.
474,00:28:49.25,00:28:49.25,">> Okay, Bob!You can do it!"
475,00:28:52.08,00:28:52.08,>> PROBST: Matty out of thewater with that sixth and final
476,00:28:54.75,00:28:54.75,"number.>> Go, Ken!"
477,00:28:57.79,00:28:57.79,">> PROBST: Ken racing now,trying to catch up."
478,00:28:59.83,00:28:59.83,Got a physics teacher goinghead-to-head with a video game
479,00:29:02.25,00:29:02.25,expert.You don't need to be a math
480,00:29:05.00,00:29:05.00,major to figure this out.You just need to be able to
481,00:29:07.21,00:29:07.21,concentrate.Read it carefully.
482,00:29:10.08,00:29:10.08,"Rearrange the numbers.""The sum of both end values will"
483,00:29:14.12,00:29:14.12,equal the sum of the middle two.The last number is equal to the
484,00:29:18.25,00:29:18.25,"second, minus the third, and isone less than the one before"
485,00:29:21.92,00:29:21.92,"it."">> Do it! Do it, then!"
486,00:29:25.71,00:29:25.71,Try it!>> PROBST: Bob thinks he might
487,00:29:27.25,00:29:27.25,have it.Make those numbers into a
488,00:29:28.88,00:29:28.88,"combination.If you're right, the chest will"
489,00:29:30.83,00:29:30.83,"open.No, he doesn't have it."
490,00:29:36.21,00:29:36.21,>> I think I got it.>> PROBST: Ken thinks he has it.
491,00:29:42.25,00:29:42.25,Ken tries it.He's not right.
492,00:29:44.04,00:29:44.04,Try to look at this puzzleagain.
493,00:29:46.29,00:29:46.29,Maybe you're putting a commawhere it doesn't belong or
494,00:29:48.88,00:29:48.88,"reading a word wrong.>> Oh, are these the end values?"
495,00:29:55.50,00:29:55.50,>> PROBST: Bob thinks he mighthave figured it out suddenly.
496,00:29:59.92,00:29:59.92,">> I think I got it, Jeff.>> PROBST: Ken thinks he has it"
497,00:30:02.42,00:30:02.42,"again.>> I do, too."
498,00:30:04.58,00:30:04.58,>> PROBST: Bob thinks he has it.Both tribes trying it.
499,00:30:08.62,00:30:08.62,"Either one of these guys areright, immunity for their tribe."
500,00:30:12.67,00:30:12.67,">> Pull the damn handle, Bob!>> PROBST: Bob tries it."
501,00:30:16.12,00:30:16.12,"He's wrong, once again.Ken has it right for Fang."
502,00:30:28.79,00:30:28.79,Fang wins immunity!(cheers)
503,00:30:32.04,00:30:32.04,">> We did it!>> Oh, my God!"
504,00:30:37.21,00:30:37.21,>> That's simple math.>> Fang!
505,00:30:41.79,00:30:41.79,">> PROBST: Fang,congratulations."
506,00:30:43.21,00:30:43.21,Back-to-back wins.This time for immunity.
507,00:30:46.42,00:30:46.42,This game is changing.(applause)
508,00:30:49.42,00:30:49.42,"Kota, date with me tonight atTribal Council where the third"
509,00:30:52.79,00:30:52.79,person will be voted out ofthis game.
510,00:30:54.83,00:30:54.83,Grab your stuff.Head back to camp.
511,00:30:56.71,00:30:56.71,"I will see you at Tribal.Fang, you guys going to miss me"
512,00:31:00.46,00:31:00.46,at Tribal Council?>> You need to get to know them
513,00:31:02.62,00:31:02.62,a little bit better.>> PROBST: Grab your stuff.
514,00:31:04.08,00:31:04.08,Head back to camp.>> But the clues are not
515,00:31:33.29,00:31:33.29,"freaking easy.I had to find my way through,"
516,00:31:35.71,00:31:35.71,"like, a big desert.Saw a spot with this map"
517,00:31:39.12,00:31:39.12,and I kind of read it wrongor something.
518,00:31:41.92,00:31:41.92,I think I played off the factthat I won the idol pretty
519,00:31:45.17,00:31:45.17,well.I don't think anybody has
520,00:31:46.88,00:31:46.88,a clue that I got it.I'm not too bad at this.
521,00:31:50.71,00:31:50.71,"I'm a lot better than Ithought, for sure."
522,00:31:59.83,00:31:59.83,">> So I can hang on to thisthing for a while, maybe."
523,00:32:02.08,00:32:02.08,">> Yeah, hang on to it.I mean, I'd obviously, not"
524,00:32:04.12,00:32:04.12,"bring it to Tribal tonight,but I mean, I'd bring it to"
525,00:32:06.54,00:32:06.54,Tribal generally.>> I just had a very nice
526,00:32:17.08,00:32:17.08,"conversation in the canoe,being told that Sugar has the"
527,00:32:20.25,00:32:20.25,immunity idol.And we're going to hopefully
528,00:32:23.46,00:32:23.46,dominate this game.>> Paloma tonight.
529,00:32:27.12,00:32:27.12,">> Paloma's dead.>> Yeah, okay."
530,00:32:29.04,00:32:29.04,">> Um, Kelly's pretty dead afterthat."
531,00:32:31.00,00:32:31.00,>> Awesome.I'm pretty excited.
532,00:32:33.04,00:32:33.04,">> Now, we're all prepping forthe coupe de grace, being"
533,00:32:37.67,00:32:37.67,"Tribal Council, and thedismissal of little Miss Paloma."
534,00:32:56.67,00:32:56.67,">> Strategically, I'm, like,the animals out in the wilds."
535,00:32:59.88,00:32:59.88,"I just watch.Just watch, and then I'm going"
536,00:33:03.71,00:33:03.71,to pounce on someone and eatthem up.
537,00:33:08.75,00:33:08.75,Has Ace made an alliance withyou yet?
538,00:33:10.79,00:33:10.79,He's made an alliance witheverybody else.
539,00:33:12.17,00:33:12.17,>> He has?>> Mm-hmm.
540,00:33:13.46,00:33:13.46,>> He's not said one word to me.>> Mm-hmm.
541,00:33:15.29,00:33:15.29,He's not said one to me 'causehe doesn't like me.
542,00:33:17.08,00:33:17.08,"I mean, he's trying everythinghe can to get rid of me, like"
543,00:33:20.04,00:33:20.04,putting me on the pole insteadof Sugar.
544,00:33:21.71,00:33:21.71,"Anyway, think about it.He doesn't want to get rid of"
545,00:33:23.79,00:33:23.79,"Sugar.Ace doesn't want to, and Ace"
546,00:33:26.21,00:33:26.21,is pretty much running the game.>> Hmm.
547,00:33:28.12,00:33:28.12,>> It's really crazy.Just keep your eyes out because
548,00:33:30.00,00:33:30.00,"he's really, really sneaky.Like, I'll just say what I need"
549,00:33:32.88,00:33:32.88,to say really fast till I getpeople to think and get their
550,00:33:35.71,00:33:35.71,"brains going and make them,like, all crazy and, like,"
551,00:33:38.54,00:33:38.54,"thinking.Ace might be, you know, strong"
552,00:33:41.17,00:33:41.17,"as an ox and I might be as weakas a mouse, but we're both"
553,00:33:44.79,00:33:44.79,50/50.People want him out because
554,00:33:46.46,00:33:46.46,he's strong.People might want me out because
555,00:33:48.46,00:33:48.46,"we're weak.>> He's not running the show,"
556,00:33:50.04,00:33:50.04,"Paloma.>> Well, I mean, not..."
557,00:33:51.83,00:33:51.83,"I mean, personally, I don'treally care."
558,00:33:53.50,00:33:53.50,"I can't stand the guy.>> Well, let me see what I can"
559,00:33:54.88,00:33:54.88,think up.That's not happening.
560,00:33:56.79,00:33:56.79,I really can't stand Ace.I'm not sure that that accent is
561,00:34:00.33,00:34:00.33,real.I think he's a con artist. 
562,00:34:02.17,00:34:02.17,I would like it see him go homesooner rather than later.
563,00:34:04.71,00:34:04.71,I am afraid if Ace goes with usto the merge he will be the
564,00:34:07.75,00:34:07.75,first one to flip because he'son the outskirts of our
565,00:34:09.75,00:34:09.75,alliance.So I went on a walk with
566,00:34:11.38,00:34:11.38,Paloma.>> Yeah?
567,00:34:12.46,00:34:12.46,She tried me to be in analliance with her.
568,00:34:15.67,00:34:15.67,"And she was like, ""Ace is reallydangerous."""
569,00:34:17.92,00:34:17.92,"She goes ""The only reason whyAce made a point to force me to"
570,00:34:21.12,00:34:21.12,go on the post is so thateveryone could see how bad I
571,00:34:22.75,00:34:22.75,"was.""She's like, ""Everyone knew"
572,00:34:23.96,00:34:23.96,"who's..."">> I think that could be partly"
573,00:34:26.12,00:34:26.12,true.>> It's 100% true. 
574,00:34:27.33,00:34:27.33,Afterwards...I know this because afterwards
575,00:34:28.96,00:34:28.96,"Ace was like, ""Did you see howgood a job..."""
576,00:34:30.79,00:34:30.79,">> Sugar wants him.>> What, are you..."
577,00:34:32.04,00:34:32.04,">> And she can do it for twoseconds, like this."
578,00:34:33.50,00:34:33.50,>> Not even.It's a problem.
579,00:34:35.38,00:34:35.38,Ace needs to get out of herebefore the merge because we
580,00:34:37.25,00:34:37.25,can't have that.>> You're smart at this game.
581,00:34:40.08,00:34:40.08,There definitely is a short-termbenefit to getting rid of our
582,00:34:43.08,00:34:43.08,"weakest players because then wecan trounce, you know, the other"
583,00:34:46.71,00:34:46.71,team and not have to vote offother people.
584,00:34:48.62,00:34:48.62,But Ace is the biggest concernbecause Ace has been playing
585,00:34:51.79,00:34:51.79,"Sugar like a pawn.>> ""I'm taking her to the end"
586,00:35:02.92,00:35:02.92,"because she's easy.She follows what I say, like..."""
587,00:35:05.08,00:35:05.08,>> They're going to pull outall the stops at the end.
588,00:35:07.71,00:35:07.71,">> Getting rid of Paloma,whatever, that can be done"
589,00:35:10.46,00:35:10.46,later.You want to get rid of Ace
590,00:35:12.12,00:35:12.12,earlier before he gainsmomentum before we merge.
591,00:35:14.25,00:35:14.25,That's more important.I don't know. It's hard to say.
592,00:35:17.04,00:35:17.04,"I dislike so many people onthis damn tribe that it's like,"
593,00:35:19.75,00:35:19.75,it's a toss-up.>> PROBST: Behind each of you
594,00:35:38.25,00:35:38.25,"is a torch.Grab a torch, approach a flame,"
595,00:35:40.38,00:35:40.38,dip it in and get fire.This is part of the ritual of
596,00:35:43.17,00:35:43.17,"Tribal Council because in thisgame, fire represents your life."
597,00:35:50.54,00:35:50.54,"As long as you have fire, youare still in the game."
598,00:35:53.50,00:35:53.50,"When your fire is gone, so areyou."
599,00:36:01.21,00:36:01.21,"So, finally, we get a chance totalk."
600,00:36:03.50,00:36:03.50,"So, Corinne, first TribalCouncil, what do you base the"
601,00:36:06.12,00:36:06.12,vote on?>> Everybody has their own
602,00:36:07.96,00:36:07.96,"opinion of who should be votedout, but the idea is that you"
603,00:36:11.25,00:36:11.25,"want one opinion together, sothat you have as little"
604,00:36:13.96,00:36:13.96,dissension among the group aspossible.
605,00:36:16.29,00:36:16.29,">> PROBST: Ace, that seemsincredibly pie-in-the-sky."
606,00:36:20.21,00:36:20.21,"""Let's come to one groupconsensus on who we're going to"
607,00:36:23.33,00:36:23.33,"vote out?"">> I think this early in the"
608,00:36:25.58,00:36:25.58,"game, the most important thingis what strengthens the tribe"
609,00:36:28.29,00:36:28.29,and makes us stronger forchallenges.
610,00:36:33.21,00:36:33.21,">> PROBST: Sugar, let's talkabout Exile Island."
611,00:36:35.42,00:36:35.42,That's a long time to be alonethis early in the game.
612,00:36:38.38,00:36:38.38,"What do you draw on?>> Well, um..."
613,00:36:41.58,00:36:41.58,I thought about my dad.Damn it.
614,00:36:45.38,00:36:45.38,"Just because I lost my dadrecently, and..."
615,00:36:49.29,00:36:49.29,And....>> PROBST: It's got to be tough.
616,00:36:54.25,00:36:54.25,">> I missed everyone.>> Marcus, there are two ways"
617,00:36:58.88,00:36:58.88,"to play in regards to the idol.One is ""Don't try to flush it"
618,00:37:02.50,00:37:02.50,"out 'cause I don't have it.""The other is, ""I got it."""
619,00:37:05.12,00:37:05.12,">> You're absolutely right.I mean, I think Sugar's"
620,00:37:07.33,00:37:07.33,"choosing, if she does have it,to let her outside reflect"
621,00:37:10.75,00:37:10.75,"something completely differentthan the insides, and, you"
622,00:37:13.21,00:37:13.21,"know, if that's the case, morepower to her."
623,00:37:15.21,00:37:15.21,It's probably the way I wouldplay it myself.
624,00:37:17.17,00:37:17.17,">> PROBST: When you got withthis group, who jumped out at"
625,00:37:19.17,00:37:19.17,"you you as, wow, interesting.>> Um, I think our tribe"
626,00:37:23.38,00:37:23.38,"actually has a lot of thosepeople, but, I mean, Ace was a"
627,00:37:26.21,00:37:26.21,"really interesting guy from thestart, and he and I seem to work"
628,00:37:29.29,00:37:29.29,well together and have a lot ofsimilar ideas.
629,00:37:31.83,00:37:31.83,">> PROBST: Paloma, did Ace standout to you as having a big"
630,00:37:34.21,00:37:34.21,"personality?>> Yeah, definitely."
631,00:37:36.25,00:37:36.25,"Ace is, like, the head honcho atour campsite."
632,00:37:38.92,00:37:38.92,">> PROBST: How do you feel aboutthat, him being the big guy?"
633,00:37:41.38,00:37:41.38,">> I mean, like, he can be thebig guy all he wants."
634,00:37:43.71,00:37:43.71,"I really could care less.But, I mean, as far as I'm"
635,00:37:47.08,00:37:47.08,"concerned, I'm not even going togo there."
636,00:37:49.08,00:37:49.08,>> PROBST: You're not even goingto go where?
637,00:37:50.50,00:37:50.50,">> Like, do the whole, like,""Ace is my hero"" type thing,"
638,00:37:54.21,00:37:54.21,"like...>> PROBST: So, Ace is clearly"
639,00:37:56.21,00:37:56.21,"not your hero.>> No, not at all."
640,00:37:59.08,00:37:59.08,">> PROBST: Ace, does thatsurprise you to hear that?"
641,00:38:02.12,00:38:02.12,>> Not particularly.I think we have the capacity to
642,00:38:05.17,00:38:05.17,"rub each other the wrong way.>> PROBST: Kelly, do you think"
643,00:38:07.33,00:38:07.33,"Ace is an asset to your tribe?>> Um, in some cases, because"
644,00:38:11.50,00:38:11.50,he's almost condescending in away.
645,00:38:14.25,00:38:14.25,>> PROBST: How is condescendinga good thing?
646,00:38:15.96,00:38:15.96,>> It's not a good thing at allsometimes.
647,00:38:18.08,00:38:18.08,"Um, say, we're cooking rice orsomething, he'll be like, ""Oh,"
648,00:38:21.21,00:38:21.21,"I thought we were going to makewater."""
649,00:38:22.42,00:38:22.42,"Like, if somebody wants to makerice, let us make rice."
650,00:38:25.00,00:38:25.00,We don't necessarily need waterright now.
651,00:38:27.29,00:38:27.29,">> PROBST: Ace, concerned at allthat you have two people that"
652,00:38:30.54,00:38:30.54,"are coming up saying, ""By theway, I got two votes and..."""
653,00:38:33.29,00:38:33.29,">> Of course, you know.You can never walk into Tribal"
654,00:38:35.71,00:38:35.71,Council without being scared.>> He doesn't have his bag with
655,00:38:38.42,00:38:38.42,"him, so he can't be thatworried."
656,00:38:40.50,00:38:40.50,>> There's nothing I reallywanted to take from camp.
657,00:38:44.00,00:38:44.00,>> Think you guys would havebeen maybe brother-sister in
658,00:38:45.75,00:38:45.75,"another life?>> Maybe, in another world,"
659,00:38:48.92,00:38:48.92,"1,000 years from now, when I'mdead."
660,00:38:53.25,00:38:53.25,">> PROBST: Wow.All right, Marcus, you have an"
661,00:38:57.50,00:38:57.50,immunity idol around your neck.It is only good at tonight's
662,00:39:01.42,00:39:01.42,"Tribal Council.You can, obviously, assign it"
663,00:39:03.29,00:39:03.29,to somebody if you want or makesure are you safe and keep it.
664,00:39:06.04,00:39:06.04,>> I think I'm going to hang onto it this time.
665,00:39:07.33,00:39:07.33,">> PROBST: All right.Tonight, Marcus is safe."
666,00:39:09.42,00:39:09.42,Everybody else is fair game.It is time to vote.
667,00:39:12.17,00:39:12.17,"Kelly, you're up.>> This is pretty much"
668,00:39:33.96,00:39:33.96,"self-explanatory.>> Unfortunately, you know"
669,00:39:48.79,00:39:48.79,exactly why you're leaving.It's for the strength of the
670,00:39:51.50,00:39:51.50,tribe.Best of luck.
671,00:40:08.33,00:40:08.33,>> PROBST: I'll go tally thevotes.
672,00:40:21.00,00:40:21.00,>> If anybody has the hiddenimmunity idol and you want to
673,00:40:23.54,00:40:23.54,"play it, now would be the timeto do so."
674,00:40:28.21,00:40:28.21,"Okay.Once the votes are read, the"
675,00:40:29.92,00:40:29.92,decision is final.The person voted out will be
676,00:40:31.54,00:40:31.54,asked to leave the TribalCouncil area immediately.
677,00:40:33.79,00:40:33.79,I'll read the votes.First vote: Paloma.
678,00:40:43.29,00:40:43.29,Ace.One vote Paloma; one vote Ace.
679,00:40:48.33,00:40:48.33,Ace.Two votes Ace; one vote Paloma.
680,00:40:54.46,00:40:54.46,Paloma.We're tied: two votes Paloma;
681,00:40:57.92,00:40:57.92,two votes Ace.Paloma.
682,00:41:03.21,00:41:03.21,Three votes Paloma;two votes Ace.
683,00:41:10.00,00:41:10.00,Paloma.That's four votes Paloma;
684,00:41:12.12,00:41:12.12,two votes Ace.Third person voted out of
685,00:41:17.50,00:41:17.50,Survivor: Gabon: Paloma.That's five.
686,00:41:19.62,00:41:19.62,That's enough.You need to bring me your torch.
687,00:41:31.17,00:41:31.17,">> Paloma, the tribe has spoken.Well, the truth is, you've lost"
688,00:41:48.75,00:41:48.75,"back-to-back challenges,and now your first tribe member."
689,00:41:52.04,00:41:52.04,"Fang clearly has the momentum.Question is, can you get it"
690,00:41:55.50,00:41:55.50,back?Grab your torches.
691,00:41:57.08,00:41:57.08,Head back to camp.Good night.
692,00:41:59.88,00:41:59.88, Captioning sponsored by CBS PARAMOUNT
693,00:42:01.96,00:42:01.96, NETWORK TELEVISIONCaptioned by 
694,00:42:06.96,00:42:06.96, Media Access Group at WGBH access.wgbh.org
695,00:42:10.75,00:42:10.75,>> PROBST: Stay tuned for scenesfrom our next episode.
696,00:42:17.42,00:42:17.42,>> PROBST: Next time onSurvivor:
697,00:42:20.04,00:42:20.04,">> Crystal, Kenny, and GCare not with me."
698,00:42:23.42,00:42:23.42,>> PROBST: A tribe divided...>> The tightest three is right
699,00:42:25.92,00:42:25.92,here.>> PROBST: Divides again.
700,00:42:28.17,00:42:28.17,"Today, you're going on to rankyour tribe from top to bottom."
701,00:42:32.25,00:42:32.25,And the game is turned upsidedown.
702,00:42:35.04,00:42:35.04,>> This is not looking too goodfor a pimp.
703,00:42:42.33,00:42:42.33,">> So, I got voted off.Um, first person on my tribe to"
704,00:42:45.54,00:42:45.54,go.These past nine days in Gabon
705,00:42:47.58,00:42:47.58,"have been amazing.Definitely been an experience,"
706,00:42:51.21,00:42:51.21,something I've never ever donebefore.
707,00:42:53.21,00:42:53.21,Good luck to the whole Kotatribe.
708,00:42:54.67,00:42:54.67,"I hope you guys do awesome.But definitely, let's just put"
709,00:42:57.12,00:42:57.12,"it this way:If Ace wins a million dollars,"
