,begin,end,subtitles_text
700,00:41:49.58,00:41:49.58,>> I'm tired.I'm hungry.
701,00:41:52.58,00:41:52.58,>> PROBST: Russell gets fed upwith Jaison.
702,00:41:55.29,00:41:55.29,>> What kind of man is that?>> PROBST: And at Galu...
703,00:41:58.29,00:41:58.29,>> Wherever the immunity idolis on their beach is probably
704,00:42:00.46,00:42:00.46,on our beach.>> PROBST: It's not so easy to
705,00:42:02.58,00:42:02.58,"find a hidden immunity idol.>> Well, I think it's pretty"
706,00:42:11.83,00:42:11.83,funny that I'm going homebecause I think everybody's
707,00:42:14.46,00:42:14.46,going to starve.I think it's even funnier that
708,00:42:16.71,00:42:16.71,it's raining.'Cause you guys are going to be
709,00:42:18.67,00:42:18.67,wet.I'm really not worried about it.
710,00:42:20.42,00:42:20.42,"I'm glad I'm getting a nice,dry sleep tonight."
711,00:42:23.08,00:42:23.08,"The tribe is a bunch ofsissies, everybody except"
712,00:42:25.29,00:42:25.29,Russell.I was the hardest working guy
713,00:42:27.17,00:42:27.17,"in camp, everybody knew that.They'll miss me when I'm gone."
