,begin,end,subtitles_text
0,00:00:00.00,00:00:00.00,">> JEFF PROBST: Previously, on"
1,00:00:02.21,00:00:02.21,"Survivor...Here in Samoa, there are two"
2,00:00:05.92,00:00:05.92,tribes going in two differentdirections.
3,00:00:08.33,00:00:08.33,"For the purple tribe, Galu, it'ssunshine and rainbows."
4,00:00:12.21,00:00:12.21,>> ♪ Coco ricoIn my belly... ♪
5,00:00:14.83,00:00:14.83,">> PROBST: They've won bothimmunity challenges, and"
6,00:00:17.08,00:00:17.08,everyone is happy.(laughter)
7,00:00:19.71,00:00:19.71,Everyone except Shambo.>> The way that the rest of
8,00:00:22.00,00:00:22.00,the tribe does things is waydifferent than the way that I do
9,00:00:24.33,00:00:24.33,"things, and it's veryfrustrating."
10,00:00:26.42,00:00:26.42,>> PROBST: Losing has frustratedeveryone on Foa Foa...
11,00:00:30.04,00:00:30.04,everyone except Russell.>> I didn't come here to work.
12,00:00:33.17,00:00:33.17,I came here to play.>> PROBST: Russell is the first
13,00:00:35.21,00:00:35.21,person in Survivor history tofind a hidden immunity idol
14,00:00:38.25,00:00:38.25,without any clues.>> Boo-yah.
15,00:00:40.21,00:00:40.21,>> PROBST: He's figured out howto manipulate the others into
16,00:00:42.42,00:00:42.42,doing his bidding.>> They can be my little
17,00:00:44.33,00:00:44.33,puppets.They'll run when I tell 'em to
18,00:00:46.25,00:00:46.25,"run, they'll walk when I tell'em to walk."
19,00:00:48.38,00:00:48.38,"And when I'm finished with them,I'll just throw 'em in the"
20,00:00:50.38,00:00:50.38,"trash.>> PROBST: Meanwhile, Ben put"
21,00:00:52.42,00:00:52.42,people on edge without eventrying.
22,00:00:54.42,00:00:54.42,(Ben babbling gibberish)He got kicked out of a
23,00:00:57.25,00:00:57.25,challenge...>> PROBST: Stop!
24,00:00:59.38,00:00:59.38,First time in the history ofSurvivor.
25,00:01:01.42,00:01:01.42,Take a spot here-- you're done....kept everyone up all night...
26,00:01:07.12,00:01:07.12,...and lashed out at a visitorfrom the other tribe.
27,00:01:09.83,00:01:09.83,">> If I was a girl, I would slapyou, is what I would do."
28,00:01:12.88,00:01:12.88,"Ghetto trash, plain and simple.>> PROBST: Ben's actions put a"
29,00:01:17.21,00:01:17.21,target on his back.>> We got a loss because he got
30,00:01:19.83,00:01:19.83,thrown out of the challengeyesterday.
31,00:01:21.67,00:01:21.67,Ben would be the right choice tokick out-- he's crazy.
32,00:01:24.21,00:01:24.21,">> PROBST: But Russell wantedBetsy out, because Betsy didn't"
33,00:01:26.38,00:01:26.38,trust him.>> Why didn't you trust me from
34,00:01:28.75,00:01:28.75,the beginning?You're gonna look back on this
35,00:01:30.42,00:01:30.42,"and regret it.>> PROBST: At Tribal Council,"
36,00:01:33.21,00:01:33.21,"Russell got his way.Ben was spared, and Betsy was"
37,00:01:37.12,00:01:37.12,voted out.17 are left.
38,00:01:41.42,00:01:41.42,Who will be voted out tonight?>> I did a lot of thinking last
39,00:01:55.04,00:01:55.04,night.What have you been thinking?
40,00:01:57.17,00:01:57.17,>> I've been thinking Ben's gotto be the next to go.
41,00:01:59.88,00:01:59.88,">> Tell me why, is that forpersonal reasons?"
42,00:02:02.33,00:02:02.33,>> The guy's mean.>> I agree with you.
43,00:02:04.62,00:02:04.62,>> I want him out.>> You see how he laid into her?
44,00:02:07.50,00:02:07.50,"I mean, it wasn't just anargument."
45,00:02:09.50,00:02:09.50,"It got really personal and, Ithink, inappropriate."
46,00:02:11.42,00:02:11.42,">> ""Ghetto trash.""That's not necessary."
47,00:02:13.21,00:02:13.21,">> Totally. Like, that'sterrible."
48,00:02:20.29,00:02:20.29,"At the last Tribal Council, Benwas this close from saying"
49,00:02:25.33,00:02:25.33,something to Yasmin thatwould've made me fly over a
50,00:02:27.50,00:02:27.50,"stool and say... and not evensay but, you know, put him down."
51,00:02:33.21,00:02:33.21,"We voted off Betsy, but at thispoint, Ben is a mental plague on"
52,00:02:38.04,00:02:38.04,our tribe.>> Ashley.
53,00:02:50.08,00:02:50.08,How you feel?>> I feel good.
54,00:02:53.25,00:02:53.25,>> How you feel about lastnight?
55,00:02:55.25,00:02:55.25,">> It's always brutal, but itwas the... I mean, it was the"
56,00:02:59.62,00:02:59.62,"majority, it was the plan, so...>> Do you have any in mind who"
57,00:03:03.62,00:03:03.62,you would want to...?>> Gosh.
58,00:03:12.62,00:03:12.62,>> Nobody here's playing thegame.
59,00:03:14.58,00:03:14.58,"Nobody is playing the game butme, on my tribe."
60,00:03:18.00,00:03:18.00,Not one person-- it's crazy.>> I think we should definitely
61,00:03:21.71,00:03:21.71,see how today goes before westart discussing...
62,00:03:23.92,00:03:23.92,">> Well, today's just a reward,I hope."
63,00:03:26.71,00:03:26.71,">> Yeah, I don't know what todayis."
64,00:03:29.12,00:03:29.12,">> I don't know, this might bethe worst group in history, and"
65,00:03:31.83,00:03:31.83,I might be the best.I'm gonna have them all under
66,00:03:34.42,00:03:34.42,control like zombies walkingaround. Mmm...
67,00:04:45.04,00:04:45.04,♪ ♪(birds chirping)
68,00:05:02.04,00:05:02.04,>> Did you put a ton in or justenough to cover the top a little
69,00:05:05.58,00:05:05.58,bit?>> If that doesn't get it
70,00:05:07.67,00:05:07.67,"started, I don't know what thehell will."
71,00:05:09.67,00:05:09.67,>> Just... let me just show youone time.
72,00:05:11.67,00:05:11.67,"Hold it really, really tight...>> Mm-hmm."
73,00:05:14.25,00:05:14.25,>> ...and try to push that sparkinto there.
74,00:05:16.42,00:05:16.42,You want to try?>> Yeah.
75,00:05:20.12,00:05:20.12,">> Just doing that, though,you're gonna destroy the flint."
76,00:05:22.92,00:05:22.92,>> Yeah?>> Yeah.
77,00:05:24.67,00:05:24.67,"We're almost out of flint,'cause these people don't know"
78,00:05:26.83,00:05:26.83,what they're doing.I'm the only one that knows how
79,00:05:28.75,00:05:28.75,to start the fire.I think a lot of these people
80,00:05:31.79,00:05:31.79,"out here, they're not used tobeing out in the woods."
81,00:05:34.92,00:05:34.92,Kind of pansies and...Mick's not an outdoorsy guy like
82,00:05:39.08,00:05:39.08,myself.I wasn't surprised he didn't
83,00:05:40.96,00:05:40.96,know how to do it.I tried to show him and give him
84,00:05:42.33,00:05:42.33,a few tips.Didn't really help.
85,00:05:45.79,00:05:45.79,">> It's usually a little biteasier than this, yeah?"
86,00:05:48.88,00:05:48.88,>> Not with a flint like that.>> Really?
87,00:05:51.21,00:05:51.21,>> Want me to try for a sec?>> Yeah.
88,00:05:54.54,00:05:54.54,">> Without my help, these peoplewill die."
89,00:06:02.79,00:06:02.79,"I save the day once again.>> Oh, you got it going?"
90,00:06:05.46,00:06:05.46,>> Yeah.>> Nice.
91,00:06:11.12,00:06:11.12,>> I started the fire thismorning.
92,00:06:13.17,00:06:13.17,Mick was trying to.He was having a lot of
93,00:06:15.25,00:06:15.25,"trouble with it.It's a lot of technique, it's"
94,00:06:17.04,00:06:17.04,"a lot of strength.Like, not to be chauvinistic,"
95,00:06:20.25,00:06:20.25,not to put you girls down-- youwon't be able to start the fire
96,00:06:22.83,00:06:22.83,"with the flint.The way it's worn down, it's,"
97,00:06:25.08,00:06:25.08,"like, flat?>> Yeah."
98,00:06:27.17,00:06:27.17,">> If you just try, like, it'sgonna be, like, you're just"
99,00:06:29.21,00:06:29.21,gonna waste it.So I wouldn't even... I wouldn't
100,00:06:31.21,00:06:31.21,even attempt to.I'm not just saying that.
101,00:06:33.21,00:06:33.21,You're hands aren't big enough--you can't grip the machete and
102,00:06:35.21,00:06:35.21,get down and do it.>> Ben is trying to tell
103,00:06:37.21,00:06:37.21,everybody they can't survivewithout Ben.
104,00:06:40.21,00:06:40.21,"Which, hey, I applaud it.You're trying to save yourself."
105,00:06:42.00,00:06:42.00,"But that's not how you do it.>> Ben, did you sleep last"
106,00:06:44.54,00:06:44.54,night?>> First time in seven days.
107,00:06:46.17,00:06:46.17,Did you poop yet?>> No.
108,00:06:48.17,00:06:48.17,">> I pooped this morning, and itwas, like, the biggest poop, I"
109,00:06:50.83,00:06:50.83,"think, in my life.>> Ew."
110,00:06:54.12,00:06:54.12,">> You see, as long as Ben keepshis crazy rantics going on, his"
111,00:06:58.67,00:06:58.67,ass is gonna be on the line.>> You want to bite me?
112,00:07:02.12,00:07:02.12,"You want something to bite on?I got something for you, buddy."
113,00:07:06.50,00:07:06.50,">> I got to keep Ben here alittle bit longer, 'cause he's"
114,00:07:09.04,00:07:09.04,"good for the challenges, andhe's the strongest guy around"
115,00:07:11.75,00:07:11.75,the camp.So I'm gonna have to debate
116,00:07:14.00,00:07:14.00,which baby I'm gonna have tosend home next.
117,00:07:17.17,00:07:17.17,">> Lizard, anybody?♪ ♪"
118,00:07:31.38,00:07:31.38,>> Exhale out slowly through thenose.
119,00:07:36.25,00:07:36.25,">> You got it.>> Again. Nice strident back,"
120,00:07:38.62,00:07:38.62,all the way up.Breath in through the nose.
121,00:07:42.08,00:07:42.08,Hold it in.Right now we're winning.
122,00:07:45.12,00:07:45.12,We're feeling good.There's great morale.
123,00:07:47.08,00:07:47.08,We're working hard.We're all pitching in at camp.
124,00:07:49.25,00:07:49.25,We're all doing stuff.Exhale out.
125,00:07:52.21,00:07:52.21,"So we don't have to always bein game mode, and that's a huge,"
126,00:07:56.50,00:07:56.50,huge advantage that we have overFoa Foa.
127,00:07:59.58,00:07:59.58,And relax.>> Are you frickin' kidding me?
128,00:08:10.75,00:08:10.75,We got four people doing yogathis morning?
129,00:08:15.08,00:08:15.08,"I'm kind of alienated from mytribe, 'cause I'm not in the"
130,00:08:18.21,00:08:18.21,90210 clique.>> We're gonna do this slow two
131,00:08:21.50,00:08:21.50,"more times, then we're gonna putit in rhythm."
132,00:08:24.75,00:08:24.75,">> I'm not doing the warm andfuzzy, I'm doing the Rambo"
133,00:08:27.42,00:08:27.42,Shambo provider role out here.>> Feet up at an angle.
134,00:08:32.33,00:08:32.33,>> Do we have water? No.Do we have food? No.
135,00:08:36.62,00:08:36.62,"Do we have firewood? No.Screw yoga, man."
136,00:08:57.88,00:08:57.88,">> So what I'm figuring is,she's becoming a threat to us."
137,00:09:01.25,00:09:01.25,"So, uh, one thing I do know fora fact is she was trying to get"
138,00:09:05.33,00:09:05.33,"rid of you.>> Oh, man."
139,00:09:08.08,00:09:08.08,">> ""Got to get rid of Ben.Got to get rid of Ben."""
140,00:09:10.75,00:09:10.75,So just don't tell her nothin'.We're gonna sneak her.
141,00:09:14.00,00:09:14.00,"We're gonna tell her whoever,and then we're gonna all vote"
142,00:09:16.54,00:09:16.54,for her.The reason I told Ben about
143,00:09:19.54,00:09:19.54,Ashley gunning for him is 'causeright now I think I need Ben.
144,00:09:22.04,00:09:22.04,"So every person that tries toget rid of him, I'm gonna get"
145,00:09:24.75,00:09:24.75,rid of them.I don't want her to start
146,00:09:26.88,00:09:26.88,"talking, ""Ben, Ben, Ben, Ben,Ben."""
147,00:09:28.58,00:09:28.58,">> Nobody listens to her anyway.>> Yeah. So, you know, just keep"
148,00:09:31.12,00:09:31.12,it to where we can blindsideher.
149,00:09:35.54,00:09:35.54,">> Cool.>> All right, man."
150,00:09:37.50,00:09:37.50,"I'm telling you, you plant thatlittle seed in their head, in"
151,00:09:40.25,00:09:40.25,"their little brain, and then itgrows, and it's called a"
152,00:09:43.12,00:09:43.12,"""Russell seed.""It takes over their whole mind."
153,00:09:47.42,00:09:47.42,So that makes it easy for me tomanipulate every single one of
154,00:09:50.96,00:09:50.96,them.>> You know what?
155,00:09:56.29,00:09:56.29,Last night you stabbed me in theback.
156,00:09:58.54,00:09:58.54,>> I did nothing wrong.I was playing the game.
157,00:10:01.00,00:10:01.00,">> You didn't come to me whenyou heard something about me, at"
158,00:10:03.00,00:10:03.00,all.>> Because I didn't think I
159,00:10:05.00,00:10:05.00,needed to at that exact moment.>> You know what?
160,00:10:07.00,00:10:07.00,"That's the easiest thing, tocome and say, ""Hey, you know"
161,00:10:09.00,00:10:09.00,"what, everybody's talking aboutyou."""
162,00:10:10.54,00:10:10.54,I had to find out from somebodyelse.
163,00:10:12.46,00:10:12.46,">> Who'd you find out from?>> It wasn't Russell, that's all"
164,00:10:14.25,00:10:14.25,"I'm saying.And I don't trust you, so I'm"
165,00:10:16.12,00:10:16.12,not gonna say anything else.That's not surprising.
166,00:10:25.04,00:10:25.04,">> When people fight, I lovethat."
167,00:10:27.17,00:10:27.17,"How can they not even think itwas me, you know?"
168,00:10:30.04,00:10:30.04,These people are just idiots.It is shocking that these people
169,00:10:34.88,00:10:34.88,"trust me so much.I mean, they really do."
170,00:10:38.12,00:10:38.12,"Everybody here trusts me.>> No, that's not true."
171,00:10:52.21,00:10:52.21,>> I know.>> I can promise you that's not
172,00:10:54.25,00:10:54.25,"true.>> No, I know."
173,00:10:55.83,00:10:55.83,You gonna say something to him?I did not say that. I didn't.
174,00:10:58.71,00:10:58.71,">> You know what I told him, Iwas, like, you know what, I'm"
175,00:11:01.42,00:11:01.42,not gonna fight with you.>> I've never been so confused
176,00:11:07.21,00:11:07.21,in my entire life.Yesterday Ben's name got thrown
177,00:11:10.83,00:11:10.83,"around by everyone, andapparently, someone said that I"
178,00:11:14.58,00:11:14.58,"was the one that brought it up,so I do not feel safe."
179,00:11:18.17,00:11:18.17,"I want to know who told him.>> Brett's back, Monica's back."
180,00:11:39.12,00:11:39.12,>> Tree mail!>> I love presents.
181,00:11:41.75,00:11:41.75,">> Is everyone here?>> Oh, there's a... like, a bag."
182,00:11:43.75,00:11:43.75,">> I know.>> I like the feel, though."
183,00:11:45.75,00:11:45.75,>> You see over here?I just want to go over here.
184,00:11:47.79,00:11:47.79,>> Like the feel.That's a pillowcase right there.
185,00:11:49.79,00:11:49.79,>> Oh!(indistinct chatter)
186,00:11:51.71,00:11:51.71,">> You ready?>> All right, go ahead."
187,00:11:53.50,00:11:53.50,">> Yeah, go ahead.>> ""If you can't run or swim or"
188,00:11:55.33,00:11:55.33,"lift or carry, then you'dbetter be damn smart."
189,00:11:57.12,00:11:57.12,Only one tribe stays home safeand comfy while the loser shall
190,00:12:01.00,00:12:01.00,"depart."">> Wow."
191,00:12:03.00,00:12:03.00,">> Bathing suits!>> Yeah, dude."
192,00:12:06.00,00:12:06.00,>> Yay!(cheering)
193,00:12:08.00,00:12:08.00,">> All right, so...>> Oh."
194,00:12:10.00,00:12:10.00,>> Yay!>> Yes.
195,00:12:12.00,00:12:12.00,>> So we got tree mail today.It came with this nice comfy
196,00:12:16.12,00:12:16.12,little dry sack of clothingwhich most of us guessed would
197,00:12:19.38,00:12:19.38,be swimsuits.I'm putting this right on right
198,00:12:21.75,00:12:21.75,"now!So now, here it is."
199,00:12:24.75,00:12:24.75,And it feels awesome and dryand soft and fabulous.
200,00:12:27.92,00:12:27.92,"Oh, yay!I can't even tell you how"
201,00:12:31.17,00:12:31.17,"amazing this feels.>> Shambo, how you feeling?"
202,00:12:34.08,00:12:34.08,">> Ready to rock 'n' roll, man.I got my jogger bra on."
203,00:12:40.00,00:12:40.00,(laughs)>> I just did it the wrong way.
204,00:12:43.17,00:12:43.17,>> 'Cause you're the blonde.>> Of course.
205,00:12:46.71,00:12:46.71,(laughter)Of course.
206,00:12:53.04,00:12:53.04,">> PROBST: Come on in, guys!Galu getting your first look at"
207,00:13:03.62,00:13:03.62,the new Foa Foa tribe.Betsy voted out at the last
208,00:13:07.46,00:13:07.46,Tribal Council.You'll also notice that Mike
209,00:13:11.58,00:13:11.58,"Borassi is gone from the game.Medical's decision, not his."
210,00:13:15.92,00:13:15.92,"Nonetheless, he is gone.Foa Foa is now down to seven."
211,00:13:20.12,00:13:20.12,Guys ready to get to today'schallenge?
212,00:13:22.67,00:13:22.67,>> Yup.>> Yeah.
213,00:13:24.67,00:13:24.67,>> PROBST: First things first.I will take back the immunity
214,00:13:27.00,00:13:27.00,idol.Thank you.
215,00:13:32.62,00:13:32.62,"Once again, immunity is back upfor grabs."
216,00:13:37.25,00:13:37.25,"For today's challenge, twomembers of each tribe will swim"
217,00:13:40.42,00:13:40.42,out to retrieve a crate.The section between the four
218,00:13:43.75,00:13:43.75,flags is a battle zone where adefender from the other tribe
219,00:13:47.21,00:13:47.21,will be waiting to try to slowyou down.
220,00:13:49.62,00:13:49.62,It will get physical.Once both swimmers get through
221,00:13:52.17,00:13:52.17,"the zone, you're free toretrieve your crate."
222,00:13:54.67,00:13:54.67,"Once you have your crate backto the mat, the next two go."
223,00:13:58.12,00:13:58.12,"Once you've collected all fourcrates, you must stack them so"
224,00:14:01.21,00:14:01.21,that there are no repeatingcolors on any side.
225,00:14:05.79,00:14:05.79,First tribe to get it rightwins a lot.
226,00:14:09.58,00:14:09.58,"Immunity.If you have immunity, you do"
227,00:14:13.12,00:14:13.12,not go to Tribal Council.You cannot be voted out of this
228,00:14:16.62,00:14:16.62,"game.In addition, the winning tribe"
229,00:14:19.25,00:14:19.25,wins reward.A lot of comfort.
230,00:14:23.83,00:14:23.83,>> Oh!>> Yay!
231,00:14:25.83,00:14:25.83,>> Oh!>> It's a hammock!
232,00:14:28.21,00:14:28.21,">> PROBST: Because thischallenge runs six on six, both"
233,00:14:31.08,00:14:31.08,"tribes are sitting people out.Foa Foa, you're sitting out one"
234,00:14:34.21,00:14:34.21,man.>> Russell.
235,00:14:36.96,00:14:36.96,>> PROBST: All right.Russell's going to sit out for
236,00:14:39.00,00:14:39.00,"Foa Foa.Galu, you're sitting out four"
237,00:14:41.04,00:14:41.04,"people-- two men, two women.>> Shambo, Yasmin for the two"
238,00:14:45.38,00:14:45.38,girls.Erik and Brett for the two guys.
239,00:14:49.71,00:14:49.71,">> PROBST: All right, sit-outstake your spot."
240,00:14:51.71,00:14:51.71,"I'll give you a minute tostrategize, we'll get started."
241,00:14:56.46,00:14:56.46,"First round, Liz and Nataliefor Foa Foa."
242,00:15:00.00,00:15:00.00,"Monica and Laura for Galu.Defenders-- Kelly for Galu,"
243,00:15:03.88,00:15:03.88,Ashley for Foa Foa.For immunity and reward.
244,00:15:08.08,00:15:08.08,Survivors ready?Go!
245,00:15:13.21,00:15:13.21,>> Yeah!>> Yeah.
246,00:15:19.21,00:15:19.21,>> PROBST: Ashley takes downMonica.
247,00:15:21.38,00:15:21.38,Laura getting in on it.(overlapping shouting)
248,00:15:24.08,00:15:24.08,">> Come on, Laura!>> PROBST: Liz and Natalie"
249,00:15:28.21,00:15:28.21,getting tied up from Kelly.She's got both of them.
250,00:15:31.17,00:15:31.17,"Yeah, Kelly!Laura is dragging Ashley."
251,00:15:35.79,00:15:35.79,Literally dragging her out ofthe battle zone.
252,00:15:39.00,00:15:39.00,You're both free! Go!Both of you have to be at the
253,00:15:42.29,00:15:42.29,crate!>> Ashley!
254,00:15:44.29,00:15:44.29,>> PROBST: Liz is now draggingher tribe mate out of the
255,00:15:47.08,00:15:47.08,battle zone.You're free. Go!
256,00:15:50.17,00:15:50.17,">> Go! Go! Go! Go!>> Come on, ladies!"
257,00:15:54.46,00:15:54.46,>> PROBST: Monica and Lauraheading back with that first
258,00:15:56.46,00:15:56.46,crate for Galu.Natalie and Liz need to make up
259,00:16:00.17,00:16:00.17,some time.Liz and Natalie at that first
260,00:16:03.88,00:16:03.88,crate.Monica and Laura are back.
261,00:16:07.88,00:16:07.88,"John and Dave heading out onthe course, Ben defending"
262,00:16:11.42,00:16:11.42,against John and Dave.(indistinct shouting)
263,00:16:15.21,00:16:15.21,Both guys elude Ben!You're clear!
264,00:16:18.46,00:16:18.46,(cheering)Natalie and Liz back with that
265,00:16:20.46,00:16:20.46,first crate.Mick and Jaison taking on
266,00:16:23.38,00:16:23.38,Russell.Russell takes down Mick.
267,00:16:28.50,00:16:28.50,Ben is now on Russell.Jaison getting in on it.
268,00:16:31.71,00:16:31.71,(grunting)(indistinct chatter & shouting)
269,00:16:37.46,00:16:37.46,Mick gets free!Jaison is free.
270,00:16:41.21,00:16:41.21,John and Dave heading back withthat second crate for Galu and
271,00:16:44.92,00:16:44.92,"a big, big lead.>> Come on in there."
272,00:16:50.00,00:16:50.00,">> Nice job, nice job!(indistinct chatter)"
273,00:16:55.04,00:16:55.04,>> PROBST: Monica and Laura nowback out.
274,00:16:57.12,00:16:57.12,Ashley trying to defend again.Ashley takes down Monica hard
275,00:17:01.75,00:17:01.75,in the water.(cheering)
276,00:17:03.83,00:17:03.83,Ashley has Laura's leg.Mick and Jaison back with the
277,00:17:11.21,00:17:11.21,second crate for Foa Foa.Liz and Natalie back out on the
278,00:17:14.25,00:17:14.25,course.(indistinct shouting)
279,00:17:19.96,00:17:19.96,Kelly unstoppable.Liz once again pulling her
280,00:17:23.67,00:17:23.67,tribe mates across.You're free.
281,00:17:26.08,00:17:26.08,Monica and Laura heading backwith that third crate for Galu.
282,00:17:29.17,00:17:29.17,(indistinct shouting)Natalie and Liz at that third
283,00:17:33.12,00:17:33.12,crate for Foa Foa.They're heading back.
284,00:17:35.54,00:17:35.54,(overlapping chatter)Go!
285,00:17:38.21,00:17:38.21,Galu heading out for theirfourth and final crate.
286,00:17:42.17,00:17:42.17,Russell now deflecting againstBen.
287,00:17:44.25,00:17:44.25,">> Whoa.>> PROBST: John taunts Ben, and"
288,00:17:47.04,00:17:47.04,he's free.They're both free of Ben.
289,00:17:49.58,00:17:49.58,>> Yeah!>> PROBST: Natalie and Liz now
290,00:17:53.12,00:17:53.12,back with that third crate.Jaison and Mick now heading
291,00:17:57.33,00:17:57.33,"out, looking for their fourthand final crate."
292,00:18:00.25,00:18:00.25,"Ben has Russell, takes himdown, and that's it."
293,00:18:03.12,00:18:03.12,Mick and Jaison are free.John and Dave at that fourth
294,00:18:06.08,00:18:06.08,crate heading back for Galu.Mick and Jaison have their
295,00:18:10.21,00:18:10.21,fourth and final crate.They're heading back.
296,00:18:13.00,00:18:13.00,"John and Dave turning on theafterburners now, and they're"
297,00:18:15.71,00:18:15.71,running it in.Start untying the crates.
298,00:18:19.12,00:18:19.12,Come on with the knots.Mick and Jaison now running it
299,00:18:25.00,00:18:25.00,"up.>> All right, guys."
300,00:18:27.71,00:18:27.71,">> PROBST: Start untying.>> Let's go, Galu!"
301,00:18:31.00,00:18:31.00,>> PROBST: Galu already startingto work on their puzzle.
302,00:18:34.75,00:18:34.75,They have a big lead after theswim.
303,00:18:37.75,00:18:37.75,Foa Foa trying to catch up.Each side of this puzzle must
304,00:18:41.67,00:18:41.67,have four different colors.>> Rotate this one.
305,00:18:45.25,00:18:45.25,">> PROBST: If you have two ofthe same color on any side, it"
306,00:18:47.25,00:18:47.25,is wrong.(overlapping chatter)
307,00:18:50.54,00:18:50.54,Foa Foa thinks they have it.Rotate it.
308,00:18:53.54,00:18:53.54,"Green, red, blue, green. No!>> Keep going!"
309,00:18:55.54,00:18:55.54,>> PROBST: You've got arepeating color.
310,00:18:57.54,00:18:57.54,Keep working.>> Bring up the bottom of this
311,00:18:59.54,00:18:59.54,one.>> Right here.
312,00:19:02.04,00:19:02.04,>> Green!>> This is the one.
313,00:19:04.25,00:19:04.25,>> Green over here!Red...
314,00:19:06.29,00:19:06.29,>> PROBST: Galu thinks they haveit.
315,00:19:08.25,00:19:08.25,"Rotate it.Green, blue, purple, red."
316,00:19:10.71,00:19:10.71,"Green, blue, purple, red.Purple, red, green, blue."
317,00:19:14.29,00:19:14.29,"Last side-- blue, green, purple,red."
318,00:19:17.21,00:19:17.21,Galu wins immunity and reward!(cheering)
319,00:19:21.54,00:19:21.54,>> Yes! Yes! Yes! Yes!(whooping)
320,00:19:29.04,00:19:29.04,">> PROBST: Galu, for the thirdstraight time, immunity is"
321,00:19:32.46,00:19:32.46,yours.(applause)
322,00:19:36.46,00:19:36.46,"Once again, Galu, safe fromTribal Council."
323,00:19:39.88,00:19:39.88,"Nobody going home on this tribe.In addition, huge reward."
324,00:19:43.75,00:19:43.75,"Along with that, a decision foryour leader."
325,00:19:46.62,00:19:46.62,"Russell, come on up here.So here's the deal."
326,00:19:51.12,00:19:51.12,"This is what you won-- comfort.If you want, as leader, you can"
327,00:19:55.04,00:19:55.04,"trade it for this.>> Oh, there's a tarp."
328,00:20:01.08,00:20:01.08,">> Oh!>> PROBST: You have comfort, or"
329,00:20:03.12,00:20:03.12,you have function.Five seconds to decide.
330,00:20:06.88,00:20:06.88,">> Comfort.>> PROBST: All right, right over"
331,00:20:08.92,00:20:08.92,"here.(applause, cheers and whooping)"
332,00:20:12.92,00:20:12.92,">> PROBST: Galu, any debate foryou about which would have made"
333,00:20:14.92,00:20:14.92,more sense for the tribe?>> We've been fine in food.
334,00:20:16.92,00:20:16.92,We're fine.We need comfort.
335,00:20:18.92,00:20:18.92,We want to lay our heads down.That's it.
336,00:20:20.92,00:20:20.92,That's the way to go.>> And that's why I made the
337,00:20:22.92,00:20:22.92,"decision, Jeff.I am a function guy, but they"
338,00:20:26.12,00:20:26.12,"are a comfort group right now,so I got to go with the group."
339,00:20:28.12,00:20:28.12,>> PROBST: Okay.>> But there was that split
340,00:20:32.83,00:20:32.83,"second, I was like, ""Towels?What the hell do we need towels"
341,00:20:35.46,00:20:35.46,"for?There's no showers out here."""
342,00:20:38.17,00:20:38.17,"I know the guys are going to beall over me, but at the end of"
343,00:20:42.17,00:20:42.17,"the day, if I make the womenhappy, we're going to be happy."
344,00:20:47.08,00:20:47.08,(laughing)(whooping)
345,00:20:49.25,00:20:49.25,>> Russell took the comfort.Danger Dave here would have
346,00:20:52.04,00:20:52.04,"said, ""Geez, let me think aboutthis for zero seconds."
347,00:20:55.42,00:20:55.42,"I'll take the function.""But it was the chief's choice."
348,00:20:59.54,00:20:59.54,We were not allowed to make thedecision.
349,00:21:02.17,00:21:02.17,">> PROBST: All right, Russell,you have one other decision to"
350,00:21:05.50,00:21:05.50,make now.You're sending one person from
351,00:21:07.92,00:21:07.92,"your tribe over to Foa Foa.Once again, a chance for"
352,00:21:11.42,00:21:11.42,"somebody to observe, sit in onTribal Council."
353,00:21:14.08,00:21:14.08,Who are you going to send?>> Shambo.
