,begin,end,subtitles_text
353,00:20:53.96,00:20:53.96,">> That's the spirit!(laughter, indistinct chatter)"
354,00:21:00.17,00:21:00.17,">> Ahoy, matey!>> Ahoy, matey!"
355,00:21:06.04,00:21:06.04,>> Come on!(whooping)
356,00:21:08.04,00:21:08.04,>> You have to turn the wheelto the right.
357,00:21:10.04,00:21:10.04,>> Okay.>> Yeah.
358,00:21:12.04,00:21:12.04,>> Wait!(screams and whoops)
359,00:21:14.83,00:21:14.83,(whooping)>> I'm a sailor!
360,00:21:16.83,00:21:16.83,">> A pirate ship!>> You're, like, the captain of"
361,00:21:21.46,00:21:21.46,a pirate ship ready to go robsome booty.
362,00:21:24.12,00:21:24.12,"(laughter)A little gold, a little"
363,00:21:27.79,00:21:27.79,"wenchin', a little groggin'.A little more wenchin'."
364,00:21:33.83,00:21:33.83,"Uh-oh, look what's coming out.Oh, baby."
365,00:21:35.88,00:21:35.88,>> Oh!>> Mm-hmm.
366,00:21:37.88,00:21:37.88,>> Yay!>> Yes!
367,00:21:45.04,00:21:45.04,They fed us this beef stew thatwas delicious.
368,00:21:47.58,00:21:47.58,It was almost all meat and a bigchunk of handmade bread and
369,00:21:53.96,00:21:53.96,these amazing scones.They were delicious.
370,00:21:57.54,00:21:57.54,"I was having a good time, man.>> This is so beautiful."
371,00:22:07.17,00:22:07.17,What a nice change after 16days of hell.
372,00:22:10.71,00:22:10.71,"My God! Thank you, Lord.>> And I appreciate you"
373,00:22:16.88,00:22:16.88,not sending me.Shambo ended up sending Laura
374,00:22:20.04,00:22:20.04,to the other camp.I think it just was her own
375,00:22:23.58,00:22:23.58,"little way of saying, ""I'mn""leader now, and what"
376,00:22:26.00,00:22:26.00,"I say goes.""I mean, she'd never admit that."
377,00:22:28.71,00:22:28.71,">> I didn't relish the thoughtof sending anybody over there,"
378,00:22:32.25,00:22:32.25,but I'm also not gonna feelbad about it because I think
379,00:22:34.88,00:22:34.88,"that I did the right thing bythe tribe, I really do."
380,00:22:45.58,00:22:45.58,♪ ♪>> I would've never guessed
381,00:23:03.12,00:23:03.12,that in a million years.That's cool.
382,00:23:13.12,00:23:13.12,>> As long as we havea flame...
383,00:23:27.17,00:23:27.17,"And I was just, like, ""Yeah."">> You know, I understand we"
384,00:23:30.62,00:23:30.62,"have a guest.You know, Laura's come here to"
385,00:23:32.92,00:23:32.92,"hang out with us until the nextimmunity challenge, but I don't"
386,00:23:35.75,00:23:35.75,really need to hear her andNatalie talking about the
387,00:23:38.00,00:23:38.00,"spiritual book of, you know,spiritual book of the month,"
388,00:23:40.17,00:23:40.17,"like, behind my back, when I'mtrying to get a fire started so"
389,00:23:42.83,00:23:42.83,that we can eat and drink.>> Whoo! I'm going get my hands
390,00:23:46.25,00:23:46.25,washed.Do you need to do any kind of
391,00:23:48.71,00:23:48.71,"laundry or anything?>> Oh, gosh."
392,00:23:50.58,00:23:50.58,>> It's just really infuriatingbecause they're not helping.
393,00:23:53.83,00:23:53.83,It's time to start a fire.All they're doing is sitting
394,00:23:56.17,00:23:56.17,"there picking their toes and,like, catching up on good times."
395,00:23:58.88,00:23:58.88,"So it was really, reallyfrustrating, disappointing, and"
396,00:24:03.17,00:24:03.17,"at times, rather infuriating.This is like a crisis, and"
397,00:24:08.00,00:24:08.00,they're talking about theirfaith and books.
398,00:24:09.96,00:24:09.96,"Russell, I understand we have aguest, but they're talking about"
399,00:24:12.58,00:24:12.58,book-of-the-month club.>> Yeah.
400,00:24:14.38,00:24:14.38,>> Damn!>> Liz is so stupid.
401,00:24:18.17,00:24:18.17,I don't even see how she canwalk without falling down.
402,00:24:21.04,00:24:21.04,"It's just ridiculous.If we merge, we need somebody"
403,00:24:24.33,00:24:24.33,"on the inside, and Natalie'sdoing a good job talking to"
404,00:24:27.38,00:24:27.38,Laura around the camp.So I have to keep Natalie for
405,00:24:30.67,00:24:30.67,"my little toy.You know, she has to be there"
406,00:24:33.50,00:24:33.50,for me so I can manipulate herlittle mind and do what I want
407,00:24:37.17,00:24:37.17,"her to do.When it comes to this game, you"
408,00:24:39.62,00:24:39.62,"better be street smart, and Lizhas a mouth on her, and I don't"
409,00:24:42.71,00:24:42.71,think she knows when to shut upso I'm going to keep my eye
410,00:24:46.00,00:24:46.00,"on her.>> PROBST: Come on in, guys!"
411,00:25:19.96,00:25:19.96,"All right, Laura,you can now rejoin Galu."
412,00:25:24.29,00:25:24.29,Galu is back intact.You guys ready to get to
413,00:25:28.21,00:25:28.21,today's challenge?>> Yep.
414,00:25:29.96,00:25:29.96,">> PROBST: First things first,Brett, take back immunity."
415,00:25:33.33,00:25:33.33,Thank you.>> Mm-hmm.
416,00:25:41.08,00:25:41.08,">> PROBST: Once again, immunityis back up for grabs."
417,00:25:46.00,00:25:46.00,"For today's challenge, bothtribes will paddle out to"
418,00:25:49.58,00:25:49.58,retrieve fish-shapedpuzzle pieces.
419,00:25:52.42,00:25:52.42,"Once you've collected all sixsets, you'll then paddle back"
420,00:25:55.79,00:25:55.79,where three tribe members willuse those pieces to solve
421,00:25:59.46,00:25:59.46,a puzzle.First tribe to get it right
422,00:26:02.04,00:26:02.04,wins immunity;safe from the vote.
423,00:26:06.83,00:26:06.83,Losers... Tribal Council;somebody going home.
424,00:26:10.38,00:26:10.38,"Galu, last challenge it wasShambo, Kelly, and Dave Ball"
425,00:26:15.04,00:26:15.04,"who sat out, so you three haveto participate."
426,00:26:18.12,00:26:18.12,"Who are going to be thesit-outs, Shambo?"
427,00:26:20.21,00:26:20.21,">> It's gonna be, uh, John,Monica, and Laura."
428,00:26:25.62,00:26:25.62,">> PROBST: All right, beforeyou go, though, Mick, where's"
429,00:26:28.29,00:26:28.29,"the leadership necklace?>> Uh, well, we left it back,"
430,00:26:32.04,00:26:32.04,"actually.We were, uh, halfway wondering"
431,00:26:35.42,00:26:35.42,if maybe it was bad luck.>> PROBST: But you still have
432,00:26:38.00,00:26:38.00,"a leader?>> Yes, absolutely."
433,00:26:39.25,00:26:39.25,">> PROBST: All right.As long as you have a leader,"
434,00:26:41.67,00:26:41.67,the necklace is merely symbolic.we will see if that is the
435,00:26:45.00,00:26:45.00,"difference.Laura, Monica, John, take a"
436,00:26:46.96,00:26:46.96,"spot on the bench.Everybody else, give you a"
437,00:26:49.08,00:26:49.08,"minute to strategize,we'll get started."
438,00:26:52.50,00:26:52.50,Here we go.Galu hoping to continue
439,00:26:56.67,00:26:56.67,their dominance.Foa Foa hoping that necklace
440,00:26:59.46,00:26:59.46,"was, indeed, bad luck.Survivors ready?"
441,00:27:04.83,00:27:04.83,"Go!Three people paddling,"
442,00:27:13.08,00:27:13.08,"two people fishing.>> Hop in, Erik."
443,00:27:19.33,00:27:19.33,>> PROBST: Foa Foa usingthe height of Jaison to
444,00:27:22.25,00:27:22.25,still push their boat.Foa Foa starting to pull
445,00:27:25.04,00:27:25.04,"away now.>> Dave, hop out!"
446,00:27:28.08,00:27:28.08,"Guide us, guide us!>> I'm up an out!"
447,00:27:30.21,00:27:30.21,>> PROBST: Galu now getting inthe water trying to push
448,00:27:32.58,00:27:32.58,their boat as well.Natalie has one for Foa Foa.
449,00:27:39.50,00:27:39.50,">> Here you go, here you go.>> Right there!"
450,00:27:43.21,00:27:43.21,Bring it to you.>> PROBST: Dave Ball has the
451,00:27:46.21,00:27:46.21,first one for Galu.>> Right here.
452,00:27:49.25,00:27:49.25,">> Come on, Liz.There you go."
453,00:27:52.04,00:27:52.04,Pull it up.>> PROBST: Liz has one for
454,00:27:53.96,00:27:53.96,Foa Foa.Foa Foa moving on to the second
455,00:27:56.25,00:27:56.25,"station.>> Come on, you bitch!"
456,00:27:59.17,00:27:59.17,"Come on! Oh!>> Nice job, Liz!"
457,00:28:04.62,00:28:04.62,>> PROBST: Liz hooks the thirdset of puzzle pieces for
458,00:28:08.17,00:28:08.17,Foa Foa.>> There you go. There you go.
459,00:28:09.58,00:28:09.58,">> All right, Natalie.>> PROBST: Natalie has the"
460,00:28:11.21,00:28:11.21,fourth set!Foa Foa off to an early lead!
461,00:28:13.38,00:28:13.38,">> Come on, Dave, you can do it.>> Yeah, yeah."
462,00:28:17.67,00:28:17.67,">> You got it right here, Dave.>> PROBST: Dave has the second"
463,00:28:20.83,00:28:20.83,set for Galu.>> I got it! I got it!
464,00:28:23.12,00:28:23.12,You just push! You just push!>> PROBST: Liz snags the fifth
465,00:28:27.83,00:28:27.83,fifth set.Foa Foa has one set left!
466,00:28:31.21,00:28:31.21,>> All right.I need to concentrate.
467,00:28:33.04,00:28:33.04,"I need silence, please.>> You can do it, Dave."
468,00:28:35.46,00:28:35.46,">> Be quiet!>> Come on, baby."
469,00:28:37.58,00:28:37.58,">> Yeah, I got it.>> I gotcha. I gotcha."
470,00:28:39.88,00:28:39.88,">> PROBST: Dave has the thirdset, Kelly has the fourth set"
471,00:28:42.75,00:28:42.75,"for Galu.>> All right, we're going."
472,00:28:45.42,00:28:45.42,Move it!>> PROBST: Liz and Natalie
473,00:28:47.17,00:28:47.17,circling that last set ofpuzzle pieces.
474,00:28:49.29,00:28:49.29,That last string of puzzlepieces.
475,00:28:52.33,00:28:52.33,>> Get it! Get it!>> PROBST: Liz has the last
476,00:28:54.46,00:28:54.46,string of puzzle pieces forFoa Foa!
477,00:28:56.21,00:28:56.21,>> Push! Y'all push!>> PROBST: Better start
478,00:28:58.17,00:28:58.17,heading back!>> Push!
479,00:28:59.96,00:28:59.96,">> Get on it, both of you!>> Quiet!"
480,00:29:04.12,00:29:04.12,>> Got it.>> PROBST: Kelly has the fifth
481,00:29:06.25,00:29:06.25,set for Galu.>> Good job. You got it.
482,00:29:08.08,00:29:08.08,">> Right here, babe.>> PROBST: Dave has the sixth"
483,00:29:10.08,00:29:10.08,set for Galu!Galu now heading back.
484,00:29:12.96,00:29:12.96,">> All right, Galu!>> PROBST: Foa Foa has one"
485,00:29:17.25,00:29:17.25,"paddler and two swimmers.>> Good job, good job."
486,00:29:21.17,00:29:21.17,>> PROBST: Galu trying to pushtheir boat as well.
487,00:29:23.67,00:29:23.67,A lot more work to swim it thanit is to paddle it.
488,00:29:27.38,00:29:27.38,">> Brett, get in the boat now!>> PROBST: Galu now getting"
489,00:29:31.00,00:29:31.00,the boat.Everybody paddling.
490,00:29:32.79,00:29:32.79,>> Full paddle forward!>> Paddle!
491,00:29:35.92,00:29:35.92,Paddle!>> PROBST: Galu now using all
492,00:29:38.42,00:29:38.42,their paddlers and they aregaining on Foa Foa.
493,00:29:41.04,00:29:41.04,>> Stroke! Stroke!>> PROBST: Foa Foa getting it
494,00:29:48.12,00:29:48.12,done without Jaison!Foa Foa's hooked in.
495,00:29:50.79,00:29:50.79,Get back to your mat.Galu's hooked in.
496,00:29:53.62,00:29:53.62,Get back to your mat!(groaning)
497,00:29:57.79,00:29:57.79,">> Set up time!>> Come on. Come on, push, push."
498,00:30:05.12,00:30:05.12,>> PROBST: You can startworking on the puzzle any time
499,00:30:07.58,00:30:07.58,you like while otherpeople untie.
500,00:30:09.83,00:30:09.83,Liz working on the puzzle forFoa Foa.
501,00:30:12.71,00:30:12.71,"Dave, Kelly, Brett, working thepuzzle for Galu."
502,00:30:16.04,00:30:16.04,"Jaison, Mick, and Liz workingit for Foa Foa."
503,00:30:19.62,00:30:19.62,>> Here's the last one.They're going to make a
504,00:30:22.25,00:30:22.25,"line, yeah?>> Shh!"
505,00:30:26.88,00:30:26.88,">> Liz, I gotta talk tosomebody, all right?"
506,00:30:29.21,00:30:29.21,Stop shushing me.>> PROBST: Look for
507,00:30:30.88,00:30:30.88,the patterns.Something to help make
508,00:30:33.21,00:30:33.21,sense of it.>> Look at the colors.
509,00:30:34.96,00:30:34.96,"Match the colors.>> We are, we have! Look. See?"
510,00:30:39.75,00:30:39.75,">> Yeah, that's...>> PROBST: Jaison frustrated."
511,00:30:42.67,00:30:42.67,You can't give up.>> Can they fit like this?
512,00:30:45.29,00:30:45.29,>> Like this?>> Yeah.
513,00:30:47.42,00:30:47.42,>> PROBST: Every single inch ofthis may not be filled
514,00:30:50.04,00:30:50.04,with fish.There may be gaps in
515,00:30:53.08,00:30:53.08,this puzzle.That may be part of the pattern.
516,00:30:59.17,00:30:59.17,>> PROBST: Foa Foa thinksthey're on to it.
517,00:31:04.71,00:31:04.71,Galu starting to get a patternpattern going.
518,00:31:07.75,00:31:07.75,"Follow that pattern.If you've got it, follow it."
519,00:31:13.71,00:31:13.71,">> Here you go, good job.>> PROBST: Galu starting to"
520,00:31:17.21,00:31:17.21,"pull away now.Jaison, Liz, and Mick"
521,00:31:20.58,00:31:20.58,struggling to keep in this.>> Goes like this.
522,00:31:23.71,00:31:23.71,"Yeah, like that.>> PROBST: Galu thinks they have"
523,00:31:26.00,00:31:26.00,have it.Galu wins immunity!
524,00:31:28.12,00:31:28.12,"(all cheering)>> Yeah, baby!"
525,00:31:31.50,00:31:31.50,Right on!>> Whoo!
526,00:31:38.67,00:31:38.67,">> PROBST: Galu, once againimmunity is yours."
527,00:31:45.88,00:31:45.88,"Well, Mick, it lookslooks like it wasn't"
528,00:31:48.96,00:31:48.96,"the necklace.>> We had the pattern, I think,"
529,00:31:51.33,00:31:51.33,before they did.We just couldn't get the pieces
530,00:31:53.46,00:31:53.46,"together quick enough.You know, again, it's"
531,00:31:56.04,00:31:56.04,"frustrating.>> PROBST: All right, Foa Foa,"
532,00:31:58.54,00:31:58.54,once again Tribal Counciltonight where one of the five
533,00:32:01.42,00:32:01.42,of you are going home.Grab your stuff.
534,00:32:03.62,00:32:03.62,Head back to camp.>> These idiots are probably
535,00:32:06.79,00:32:06.79,gonna cost mea million dollars.
536,00:32:09.04,00:32:09.04,"I planned on having a lot offun with the money,"
537,00:32:11.83,00:32:11.83,a lot of fun.Maybe we need to get rid of
538,00:32:14.21,00:32:14.21,Jaison because he gave upout there.
539,00:32:16.21,00:32:16.21,He's just standing therelooking at the puzzle like it's
540,00:32:18.92,00:32:18.92,"gonna move itself.We gotta mix something up, so"
541,00:32:21.71,00:32:21.71,"what happens, happens.♪ ♪"
542,00:33:03.12,00:33:03.12,">> This whole time I wanted toget rid of Liz, get rid of Liz."
543,00:33:06.25,00:33:06.25,But you know what?Jaison gave up when we were
544,00:33:08.71,00:33:08.71,"pushing the boat, and then hewas so tired, he couldn't even"
545,00:33:11.62,00:33:11.62,get up there and do a puzzle.It's amazing to me that he
546,00:33:15.12,00:33:15.12,"can't, you know, get thesepuzzles down."
547,00:33:18.25,00:33:18.25,I don't know.He's sure not going to be my
548,00:33:20.75,00:33:20.75,attorney.How in the world are they
549,00:33:25.12,00:33:25.12,"beating us in puzzles, Mick?>> I don't know."
550,00:33:27.75,00:33:27.75,">> Jaison went...You went to medical school,"
551,00:33:29.79,00:33:29.79,"Jaison when to freakin' Oxford,Stanford."
552,00:33:31.83,00:33:31.83,>> I know. I know. I know.I know.
553,00:33:33.83,00:33:33.83,">> Gee!>> I can't explain it, my"
554,00:33:35.83,00:33:35.83,friend.I cannot explain it.
555,00:33:51.83,00:33:51.83,">> Agreed.>> You know, like, when you lose"
556,00:33:54.12,00:33:54.12,"so much, all you want to do is,like, go into, like... crawl"
557,00:33:57.12,00:33:57.12,"into a hole, fetal position?That's how I feel."
558,00:34:05.12,00:34:05.12,>> Quite embarrassed.>> I don't get it.
559,00:34:08.17,00:34:08.17,"We were ahead, too.I just don't know what... how"
560,00:34:10.25,00:34:10.25,we... why we always lose ourlead.
561,00:34:21.04,00:34:21.04,>> I have no idea what's goingto happen in this vote tonight.
562,00:34:23.46,00:34:23.46,"I did not perform well in thepuzzle, I don't think."
563,00:34:26.25,00:34:26.25,"You know, I couldn't get withthe program."
564,00:34:28.58,00:34:28.58,I kind of felt like dead weightto the team.
565,00:34:31.12,00:34:31.12,"So, for all I know, they couldbe voting me out."
566,00:34:34.62,00:34:34.62,"Well, sorry about my performanceon the puzzle."
567,00:34:37.17,00:34:37.17,I couldn't figure that thing outto save my life today.
568,00:34:40.38,00:34:40.38,>> Yeah.>> I'm trying to concentrate on
569,00:34:42.38,00:34:42.38,putting it behind me.Hope tomorrow's a brighter day.
570,00:34:51.08,00:34:51.08,">> Okay.>> Okay, these are the two"
571,00:34:56.62,00:34:56.62,"options.Now, I've been thinking about"
572,00:34:58.67,00:34:58.67,"this.Natalie, for sure... or..."
573,00:35:01.04,00:35:01.04,>> Yeah?>> ...Jaison.
574,00:35:04.04,00:35:04.04,>> I know.>> Now listen why.
575,00:35:06.54,00:35:06.54,>> He's been dragging his feetlately.
576,00:35:09.25,00:35:09.25,"Yeah.Yeah, go back."
577,00:35:20.21,00:35:20.21,">> With tonight's TribalCouncil, my survivor stock has"
578,00:35:23.08,00:35:23.08,gone up because I certainlythought the vote would be
579,00:35:26.04,00:35:26.04,"between me and Natalie, justbecause we're physically, you"
580,00:35:29.33,00:35:29.33,"know, smaller, weaker, than thethree guys, but I guess,"
581,00:35:33.04,00:35:33.04,"strategically, you know, it maymake more sense for Jaison to"
582,00:35:35.54,00:35:35.54,"go, and I'm actually quitethrilled because I never would"
583,00:35:39.12,00:35:39.12,"have anticipated that.>> You know, I got a decision"
584,00:35:47.04,00:35:47.04,to make.It's going to have to be either
585,00:35:50.25,00:35:50.25,"Liz or Jaison.The thing is, with Liz, I don't"
586,00:35:53.58,00:35:53.58,know if we can trust her oncethe merge happens.
587,00:35:56.17,00:35:56.17,"But the thing is with Jaison, Istill think I can trust the"
588,00:35:59.12,00:35:59.12,"guy, but, you know, we stillgot to think about winning in"
589,00:36:01.83,00:36:01.83,challenges.We're losing with the team we
590,00:36:05.08,00:36:05.08,have.We've got to find some way to
591,00:36:06.83,00:36:06.83,win.Something has to give.
592,00:36:36.04,00:36:36.04,">> PROBST: Well, there's no usegoing over the dismal facts."
593,00:36:39.25,00:36:39.25,"Losing eight out of tenchallenges, or the fact that"
594,00:36:41.88,00:36:41.88,"after tonight, you'll be down tofour members, while Galu holds"
595,00:36:45.12,00:36:45.12,strong at eight.One of the worst overall
596,00:36:47.58,00:36:47.58,performances of any tribe inthe history of the game.
597,00:36:51.42,00:36:51.42,"Natalie, what I want to know is,where is the attitude on this"
598,00:36:55.62,00:36:55.62,tribe?Still hanging in there?
599,00:36:57.75,00:36:57.75,">> Absolutely.It doesn't do any good, uh, to"
600,00:37:00.71,00:37:00.71,"get negative, so we have to goin to any challenge with our"
601,00:37:05.12,00:37:05.12,"heads up, because if we don't,then we're done, so..."
602,00:37:08.92,00:37:08.92,">> PROBST: Russell, do you stillwake up every morning and think,"
603,00:37:11.79,00:37:11.79,"today's the day?>> Yup, every morning."
604,00:37:14.83,00:37:14.83,All we really can do is hope forthe merge 'cause they outplayed
605,00:37:18.67,00:37:18.67,us.They're outlasting us.
606,00:37:21.00,00:37:21.00,But one thing I promise you--them kids over there-- there's
607,00:37:23.54,00:37:23.54,no way in hell that they canoutwit me.
608,00:37:27.00,00:37:27.00,">> PROBST: Liz, if you get to amerge, do you trust these guys?"
609,00:37:30.62,00:37:30.62,>> Absolutely.There is no doubt.
610,00:37:33.88,00:37:33.88,"After all these TribalCouncils, I absolutely trust"
611,00:37:37.17,00:37:37.17,each and every one of thesepeople up here with me 100%.
612,00:37:41.17,00:37:41.17,">> PROBST: Mick, any doubt inyour mind about the"
613,00:37:43.62,00:37:43.62,trustworthiness of this groupof people?
614,00:37:46.33,00:37:46.33,">> Honestly, Jeff, none.The performance aspect-- we"
615,00:37:49.71,00:37:49.71,"haven't done great, obviously.But there's still a social game"
616,00:37:52.50,00:37:52.50,"to be played, and that trust isat the absolute core of our"
617,00:37:56.25,00:37:56.25,"survival, and we all know that.>> PROBST: So, Russell, being"
618,00:37:59.08,00:37:59.08,"this tight, got to be hard tovote somebody out again tonight."
619,00:38:04.17,00:38:04.17,">> It is very hard.You know, five people down to"
620,00:38:07.83,00:38:07.83,"four people.You know, it almost seems"
621,00:38:09.96,00:38:09.96,"hopeless, but if we can justkeep that four together, then"
622,00:38:12.75,00:38:12.75,you'll see.You'll see exactly...
623,00:38:16.42,00:38:16.42,"The whole thing's gonna change.>> PROBST: Jaison, since we got"
624,00:38:20.17,00:38:20.17,"here, you've been like this allnight."
625,00:38:22.50,00:38:22.50,Occasionally popping your headup.
626,00:38:25.17,00:38:25.17,What's the hardest part aboutthis for you?
627,00:38:27.42,00:38:27.42,">> I am frustrated with losing,is really what I'm frustrated"
628,00:38:30.12,00:38:30.12,about.And I actually do feel like I
629,00:38:32.50,00:38:32.50,have some large responsibilityin these losses.
630,00:38:36.04,00:38:36.04,"You know, today in the puzzle.You know, I feel like Mick did"
631,00:38:39.38,00:38:39.38,a really good job figuring outwhat the pattern was.
632,00:38:41.42,00:38:41.42,"I think Liz had the patterngoing, but I just couldn't"
633,00:38:44.04,00:38:44.04,"figure out how to see thepattern at my end, and so, I"
634,00:38:48.71,00:38:48.71,don't feel like I performed ata level at which I should have.
635,00:38:52.33,00:38:52.33,>> PROBST: So if you're votedout tonight based on today's
636,00:38:55.58,00:38:55.58,"performance, would it be fair?>> If they decide that, you"
637,00:39:01.58,00:39:01.58,"know, my performance todaywarrants me to walk away, I hope"
638,00:39:05.25,00:39:05.25,that that is what is necessaryfor them to win tomorrow.
639,00:39:10.17,00:39:10.17,">> PROBST: All right, it istime to vote."
640,00:39:12.75,00:39:12.75,"Mick, you're up.>> This is totally strategic"
641,00:39:26.75,00:39:26.75,and not at all personal.Sorry.
642,00:39:50.00,00:39:50.00,>> PROBST: I'll go tally thevotes.
643,00:40:03.21,00:40:03.21,"Once the votes are read, thedecision is final."
644,00:40:06.12,00:40:06.12,Person voted out will be askedto leave the Tribal Council area
645,00:40:09.00,00:40:09.00,immediately.I'll read the votes.
646,00:40:13.21,00:40:13.21,First vote-- Jaison.Liz.
647,00:40:20.54,00:40:20.54,"One vote-- Jaison, one vote--Liz."
648,00:40:25.58,00:40:25.58,"Liz.That's two votes Liz, one vote"
649,00:40:28.50,00:40:28.50,Jaison.Sixth person voted out of
650,00:40:33.17,00:40:33.17,Survivor: Samoa-- Liz.That's three. That's enough.
651,00:40:36.17,00:40:36.17,You need to bring me yourtorch.
652,00:40:38.29,00:40:38.29,">> Good luck, guys.>> PROBST: Liz, the tribe has"
653,00:40:47.88,00:40:47.88,spoken.Time for you to go.
654,00:41:00.54,00:41:00.54,"Well, you haven't been verysuccessful at challenges, but"
655,00:41:02.58,00:41:02.58,you're getting really good atblindsides.
656,00:41:04.62,00:41:04.62,"Grab your torches, head back tocamp."
657,00:41:07.08,00:41:07.08,Good night.>> PROBST: Stay tuned for scenes
658,00:41:26.17,00:41:26.17,from our next episode.>> PROBST: Next time on
659,00:41:33.75,00:41:33.75,"Survivor.(indistinct chatter, cheering)"
660,00:41:36.79,00:41:36.79,>> To our new tribe.>> New tribe.
661,00:41:38.79,00:41:38.79,"(whooping)>> All of a sudden, all hell"
662,00:41:40.79,00:41:40.79,breaks loose.>> Monica needs to go home
663,00:41:42.79,00:41:42.79,tonight.>> It's Erik 100%.
664,00:41:48.00,00:41:48.00,>> I got to do what I got to do.Things are going to get crazy
665,00:41:50.00,00:41:50.00,tomorrow out here.>> This experience was...
666,00:41:57.71,00:41:57.71,It was nothing but intense.My tribe mates outwitted me.
667,00:42:01.71,00:42:01.71,"It was a very strategic move,and the tables turned so quickly"
668,00:42:05.42,00:42:05.42,"that, you know, it's a littlebit surprising, but kudos to"
669,00:42:08.25,00:42:08.25,"them.I really, really hope that they"
670,00:42:10.29,00:42:10.29,"make it to the end.And this is one hell of a game,"
671,00:42:13.12,00:42:13.12,so I'm glad I made it as far asI did.
