,begin,end,subtitles_text
1002,00:31:02.83,00:31:02.83,"BE IN, WHICH PEOPLE I CAN TRUST."
1003,00:31:06.57,00:31:06.57,WHO ARE YOU GUYS WRITING DOWN?
1004,00:31:08.60,00:31:08.60,SOPHIE.
1005,00:31:09.67,00:31:09.67,I JUST HONESTLY BELIEVE THIS IS
1006,00:31:11.40,00:31:11.40,WHAT GOD WANTS US TO DO.
1007,00:31:12.97,00:31:12.97,"REMEMBER NOW, THIS IS WHAT"
1008,00:31:14.17,00:31:14.17,GOD WANTS YOU TO DO.
1009,00:31:15.13,00:31:15.13,I'LL TELL YOU WHAT--
1010,00:31:16.23,00:31:16.23,WHAT I NEED TO DO RIGHT NOW
1011,00:31:17.80,00:31:17.80,IS I NEED TO PRAY AND I PROMISE
1012,00:31:19.60,00:31:19.60,YOU THIS-- I WILL DO WHENEVER
1013,00:31:21.40,00:31:21.40,GOD TELLS ME TO DO.
1014,00:31:23.27,00:31:23.27,I UNDERSTAND YOU GOT TO DO
1015,00:31:25.10,00:31:25.10,WHAT GOD WANTS YOU TO DO BUT I
1016,00:31:26.73,00:31:26.73,KNOW HE DOESN'T WANT YOU TO
1017,00:31:28.07,00:31:28.07,"WRITE MY NAME DOWN, MAN."
1018,00:31:29.53,00:31:29.53,"OKAY, I'M GOING TO PRAY."
1019,00:31:31.40,00:31:31.40,"I BOWED DOWN, AND HUMBLY SOUGHT"
1020,00:31:34.53,00:31:34.53,GOD TO GIVE ME AN ANSWER OF WHAT
1021,00:31:36.37,00:31:36.37,I SHOULD DO TONIGHT IF BRANDON
1022,00:31:38.83,00:31:38.83,GIVES HIS NECKLACE TO ALBERT.
1023,00:31:41.07,00:31:41.07,I BEGGED GOD TO SPEAK TO ME LIKE
1024,00:31:43.17,00:31:43.17,HE'S NEVER SPOKEN TO ME BEFORE.
1025,00:31:44.87,00:31:44.87,I ASKED GOD TO GIVE ME THE HOLE
1026,00:31:46.97,00:31:46.97,SPIRIT OF DIVINE INTERPRETATION
1027,00:31:48.17,00:31:48.17,AND WISDOM.
1028,00:31:51.73,00:31:51.73,"I PRAYED, AND THERE WAS A NAME"
1029,00:31:55.47,00:31:55.47,IN MY HEAD OVER AND OVER AND
1030,00:31:57.07,00:31:57.07,"OVER AGAIN, AND I CLEANED THE"
1031,00:31:59.03,00:31:59.03,"SLATE, AND I ASKED FOR IT AGAIN."
1032,00:32:00.80,00:32:00.80,AND IT CAME OVER AND OVER AND
1033,00:32:02.50,00:32:02.50,OVER AND OVER AGAIN.
1034,00:32:06.17,00:32:06.17,MY SOUL HAS NEVER GROOEFED LIKE
1035,00:32:07.27,00:32:07.27,IT DOES IN THIS MOMENT.
1036,00:32:34.40,00:32:34.40,Jeff: WE'LL NOW BRING IN
1037,00:32:35.63,00:32:35.63,THE MEMBERS OF OUR JURY.
1038,00:32:39.33,00:32:39.33,JIM.
1039,00:32:40.77,00:32:40.77,KEITH.
1040,00:32:42.20,00:32:42.20,DAWN.
1041,00:32:43.57,00:32:43.57,WHITNEY.
1042,00:32:44.57,00:32:44.57,COCHRAN.
1043,00:32:44.73,00:32:44.73,AND EDNA.
1044,00:32:49.20,00:32:49.20,SO THE LONG-AWAITED TRIBAL
1045,00:32:51.20,00:32:51.20,COUNCIL WHERE THERE ARE ONLY
1046,00:32:52.73,00:32:52.73,"FIVE LEFT, AND LOOK AT YOU,"
1047,00:32:54.50,00:32:54.50,"BRANDON, SITTING WITH IMMUNITY."
1048,00:32:56.93,00:32:56.93,VERY POWERFUL SPOT RIGHT NOW FOR
1049,00:32:58.83,00:32:58.83,YOU.
1050,00:32:59.20,00:32:59.20,I WANT TO GIVE MY IMMUNITY
1051,00:33:01.60,00:33:01.60,NECKLACE UP.
1052,00:33:08.47,00:33:08.47,Jeff: OKAY.
1053,00:33:24.10,00:33:24.10,WHAT IS GOING ON?
1054,00:33:28.43,00:33:28.43,"Jeff: SO, BRANDON, I WAS"
1055,00:33:30.00,00:33:30.00,GOING TO ASK HOW IT FEELS TO
1056,00:33:31.37,00:33:31.37,"KNOW YOU ARE SAFE, BUT, CLEARLY,"
1057,00:33:33.63,00:33:33.63,YOU ARE NO LONGER SAFE.
1058,00:33:35.33,00:33:35.33,"WELL, I MADE A STATEMENT HERE"
1059,00:33:36.87,00:33:36.87,EVERY TRIBAL COUNCIL THAT I
1060,00:33:37.90,00:33:37.90,WOULD STAY TRUE TO THE
1061,00:33:38.63,00:33:38.63,COMMITMENTS THAT I MAKE AND THAT
1062,00:33:40.77,00:33:40.77,I WOULD GIVE MY OWN PLACE IN
1063,00:33:43.07,00:33:43.07,THIS GAME UP FOR THEM.
1064,00:33:44.37,00:33:44.37,"I STARTED SOMETHING, AND I'M"
1065,00:33:45.37,00:33:45.37,GOING TO FINISH IT.
1066,00:33:46.20,00:33:46.20,"Jeff: SO, BRANDON, I'M"
1067,00:33:47.47,00:33:47.47,GUESSING THE PERSON YOU MADE
1068,00:33:48.43,00:33:48.43,THAT AGREEMENT WITH WAS ALBERT.
1069,00:33:49.77,00:33:49.77,"YES, SIR."
1070,00:33:50.60,00:33:50.60,Jeff: AND AM I TO
1071,00:33:51.70,00:33:51.70,UNDERSTAND THAT YOU WENT TO
1072,00:33:52.83,00:33:52.83,ALBERT AND SAID LET'S FORM AN
1073,00:33:55.37,00:33:55.37,"ALLIANCE, AND AS A SIGN OF MY"
1074,00:33:57.33,00:33:57.33,"WORD, IF YOU ARE EVER IN"
1075,00:33:59.20,00:33:59.20,"TROUBLE, I WILL LAY DOWN ON THE"
1076,00:34:00.80,00:34:00.80,SWORD FOR YOU?
1077,00:34:01.63,00:34:01.63,"YES, SIR."
1078,00:34:02.93,00:34:02.93,"Jeff: COACH, YOU'RE SHAKE"
1079,00:34:04.00,00:34:04.00,YOUR HEAD NO.
1080,00:34:04.33,00:34:04.33,I JUST WANT TO SET THE ROARED
1081,00:34:06.20,00:34:06.20,STRAIGHT.
1082,00:34:06.33,00:34:06.33,"A COUPLE OF HOURS AGO, BRANDON"
1083,00:34:07.77,00:34:07.77,"WAS GOING TO VOTE FOR ALBERT,"
1084,00:34:09.63,00:34:09.63,"BUT THEN HE PRAYED ABOUT IT, AND"
1085,00:34:11.20,00:34:11.20,HE FELT LIKE HE SHOULD GIVE THE
1086,00:34:13.10,00:34:13.10,NECKLACE TO ALBERT.
1087,00:34:15.97,00:34:15.97,"Jeff: BRANDON, YOU SEEM"
1088,00:34:17.20,00:34:17.20,LIKE YOU HAVE THE WEIGHT OF THE
1089,00:34:18.60,00:34:18.60,ENTIRE PLANET ON YOUR SHOULDERS.
1090,00:34:20.97,00:34:20.97,I JUST-- I'VE HAD A LOT OF
1091,00:34:22.60,00:34:22.60,TIME TO PRAY WITH ALBERT.
1092,00:34:24.10,00:34:24.10,AND I KNEW THAT IF I DIDN'T GIVE
1093,00:34:25.57,00:34:25.57,HIM THE IMMUNITY TONIGHT THAT HE
1094,00:34:27.33,00:34:27.33,WAS GOING TO REDEMPTION.
1095,00:34:29.20,00:34:29.20,IT'S REALLY HARD TO EXPLAIN
1096,00:34:30.40,00:34:30.40,BECAUSE MY LOYALTY'S A LITTLE
1097,00:34:32.50,00:34:32.50,BIT DIFFERENT.
1098,00:34:33.33,00:34:33.33,"BACK HOME, WHEN I WAS IN, YOU"
1099,00:34:35.30,00:34:35.30,"KNOW, THE WHOLE-- I GUESS YOU"
1100,00:34:36.90,00:34:36.90,"WOULD SAY GANG SCENE, WHATEVER."
1101,00:34:38.20,00:34:38.20,"A LOT OF MY FRIENDS WOULD BE,"
1102,00:34:40.90,00:34:40.90,"""BRO, I GOT YOUR BACK."
1103,00:34:42.00,00:34:42.00,"I GOT YOUR BACK."""
1104,00:34:43.47,00:34:43.47,AND I WAS REALLY WILLING TO GIVE
1105,00:34:44.87,00:34:44.87,MY LIFE FOR THESE GUYS.
1106,00:34:46.07,00:34:46.07,Jeff: SO THIS IS WHEN YOU
1107,00:34:47.27,00:34:47.27,WERE A YOUNGER KID.
1108,00:34:48.27,00:34:48.27,YEAH.
1109,00:34:49.03,00:34:49.03,Jeff: AND YOU WERE HANGING
1110,00:34:49.83,00:34:49.83,OUT WITH THE WRONG KIDS.
1111,00:34:50.63,00:34:50.63,"YEAH, AND I WAS ALWAYS THE"
1112,00:34:53.03,00:34:53.03,KID TO BE EXTREMELY LOYAL TO
1113,00:34:54.73,00:34:54.73,PEOPLE AND PEOPLE FREAKED OUT
1114,00:34:56.43,00:34:56.43,"ABOUT, LIKE, HE WOULD STEP IN"
1115,00:34:59.83,00:34:59.83,"FRONT OF A BULLET FOR ME, STEP"
1116,00:35:02.10,00:35:02.10,IN FRONT OF A KNIFE FOR ME.
1117,00:35:03.43,00:35:03.43,Jeff: IS THAT WHERE THE
1118,00:35:04.23,00:35:04.23,"WORD ""LOCO"" ON YOUR NEXT COMES"
1119,00:35:07.43,00:35:07.43,"FROM, THAT BRANDON IS CRAZY"
1120,00:35:08.87,00:35:08.87,ENOUGH TO DO IT?
1121,00:35:09.33,00:35:09.33,YEAH.
1122,00:35:09.90,00:35:09.90,IT'S NOT IN A NEGATIVE WAY.
1123,00:35:11.77,00:35:11.77,MY FRIENDS KNEW THAT THEY COULD
1124,00:35:13.10,00:35:13.10,TRUST ME.
1125,00:35:13.57,00:35:13.57,"BUT THE FUNNY PART IT IS,"
1126,00:35:16.53,00:35:16.53,SOMETIMES WE'D GET INTO A HUGE
1127,00:35:17.77,00:35:17.77,BRAWL WITH ANOTHER RIVAL--
1128,00:35:19.47,00:35:19.47,WHATEVER YOU WANT TO CALL IT--
1129,00:35:20.60,00:35:20.60,AND I'D BE THE ONLY ONE STANDING
1130,00:35:22.70,00:35:22.70,THERE.
1131,00:35:22.87,00:35:22.87,Jeff: NONE OF YOUR FRIENDS
1132,00:35:23.70,00:35:23.70,WOULD SHOW UP.
1133,00:35:24.30,00:35:24.30,NONE OF THEM WOULD SHOW UP.
1134,00:35:25.87,00:35:25.87,Jeff: SO IT WASN'T REALLY A
1135,00:35:27.37,00:35:27.37,GANG.
1136,00:35:27.93,00:35:27.93,IT WAS PEOPLE TAKING MY
1137,00:35:29.40,00:35:29.40,"LOYALTY FOR, YOU KNOW, WHAT THEY"
1138,00:35:32.30,00:35:32.30,WANTED TO USE IT FOR AND THEN
1139,00:35:35.20,00:35:35.20,LEAVING ME.
1140,00:35:38.40,00:35:38.40,Jeff: IS THERE ANY CHANCE
1141,00:35:39.90,00:35:39.90,THAT'S HAPPENING TONIGHT?
1142,00:35:42.10,00:35:42.10,I'D LIKE TO THINK IT WASN'T.
1143,00:35:44.07,00:35:44.07,"Jeff: BUT, BRANDON, THIS IS"
1144,00:35:45.37,00:35:45.37,YOUR COMPETITOR IN A
1145,00:35:46.80,00:35:46.80,MILLION-DOLLAR GAME.
1146,00:35:47.80,00:35:47.80,AND THE FUNNY PART ABOUT IT
1147,00:35:49.50,00:35:49.50,"IS, I CONSIDER THESE TWO GUYS MY"
1148,00:35:51.87,00:35:51.87,BEST FRIENDS.
1149,00:35:52.40,00:35:52.40,WE HAVE A VERY SOLID CONNECTION
1150,00:35:53.83,00:35:53.83,WITH EACH OTHER BECAUSE OF
1151,00:35:55.53,00:35:55.53,CHRIST INSIDE OF THEM.
1152,00:35:56.70,00:35:56.70,"I WAS DRAWN TO THEM, MAN."
1153,00:35:57.83,00:35:57.83,IT WASN'T BY COINCIDENCE.
1154,00:35:59.23,00:35:59.23,"Jeff: ALBERT, WHAT'S YOUR"
1155,00:36:00.63,00:36:00.63,TAKE ON THIS?
1156,00:36:01.43,00:36:01.43,IT BLOWS MY MIND BECAUSE WHEN
1157,00:36:02.90,00:36:02.90,"I GOT TO THIS GAME, SOMETHING"
1158,00:36:04.87,00:36:04.87,TOLD ME THAT THERE'S A BIGGER
1159,00:36:06.47,00:36:06.47,REASON WHY I WAS HERE.
1160,00:36:08.23,00:36:08.23,AND WHAT MAKES BRANDON'S
1161,00:36:09.93,00:36:09.93,DECISION NOT LOOK CRAZY IS
1162,00:36:11.30,00:36:11.30,BECAUSE WE FEEL LIKE OUR BOND IS
1163,00:36:12.97,00:36:12.97,REAL.
1164,00:36:13.20,00:36:13.20,THAT'S THE REASON WHY I STRAYED
1165,00:36:15.63,00:36:15.63,AWAY FROM SOME OF THE EARLIER
1166,00:36:16.53,00:36:16.53,BONDS I HAD WITH A RICK OR WITH
1167,00:36:18.27,00:36:18.27,A SOPHIE BECAUSE IT WAS AT A
1168,00:36:20.27,00:36:20.27,DIFFERENT LEVEL SPIRITUALLY WHEN
1169,00:36:22.20,00:36:22.20,I BONDED WITH BRANDON AND WHEN I
1170,00:36:23.83,00:36:23.83,BONDED WITH COACH.
1171,00:36:24.83,00:36:24.83,Jeff: SO IS THERE A PART OF
1172,00:36:25.80,00:36:25.80,YOU AS A CHRISTIAN MAN WHO NOW
1173,00:36:28.20,00:36:28.20,WANTS TO TAKE THE NECKLACE OFF
1174,00:36:29.70,00:36:29.70,AND DO THE SAME THING THAT
1175,00:36:31.20,00:36:31.20,BRANDON JUST DID FOR YOU?
1176,00:36:33.20,00:36:33.20,FIREALISTICALLY BELIEVED THAT
1177,00:36:34.63,00:36:34.63,"HE'S IN TROUBLE, YES."
1178,00:36:38.10,00:36:38.10,"Jeff: SOPHIE, DO YOU"
1179,00:36:39.10,00:36:39.10,BELIEVE THAT?
1180,00:36:40.03,00:36:40.03,"UH, I DON'T KNOW WHAT TO"
1181,00:36:42.20,00:36:42.20,BELIEVE FROM ALBERT ANYMORE.
1182,00:36:43.60,00:36:43.60,"HE'S BEEN SNEAKY, SO I'M NOT"
1183,00:36:46.07,00:36:46.07,SITTING HERE RELYING ON BLIND
1184,00:36:48.87,00:36:48.87,FAITH FROM ALBERT THEY MADE ON
1185,00:36:50.23,00:36:50.23,DAY ONE.
1186,00:36:51.23,00:36:51.23,I HAVE CONNECTIONS WITH A LOT OF
1187,00:36:52.60,00:36:52.60,PEOPLE OUT HERE AS WELL.
1188,00:36:55.20,00:36:55.20,"Jeff: RICK, EVERYTHING WAS"
1189,00:36:56.73,00:36:56.73,GOING FINE.
1190,00:36:57.73,00:36:57.73,"PIZZA'S GOING DOWN, A LITTLE"
1191,00:36:59.20,00:36:59.20,SOFT DRINK.
1192,00:36:59.60,00:36:59.60,IT WAS A GREAT LIFE.
1193,00:37:00.97,00:37:00.97,"AND THEN THE BOMB HIT, LIKE A"
1194,00:37:03.27,00:37:03.27,PACK OF WOLVES TURNING ON EACH
1195,00:37:05.57,00:37:05.57,OTHER.
1196,00:37:05.73,00:37:05.73,I'M WORRIED TO DEATH BECAUSE I'M
1197,00:37:06.83,00:37:06.83,IN TROUBLE.
1198,00:37:07.60,00:37:07.60,EATS EITHER GOING TO BE ONE OF
1199,00:37:08.70,00:37:08.70,"US, AND ONE OF US HAS A HIDDEN"
1200,00:37:10.80,00:37:10.80,"IMMUNITY, AND WE KNOW WHO IT IS,"
1201,00:37:12.20,00:37:12.20,SO WE'VE ONLY GOT THREE TO PICK
1202,00:37:14.37,00:37:14.37,FROM.
1203,00:37:14.53,00:37:14.53,IT'S OUT!
1204,00:37:15.80,00:37:15.80,Jeff:
1205,00:37:16.00,00:37:16.00,"YEAH, I BELIEVE THAT."
1206,00:37:17.23,00:37:17.23,"Jeff: WAIT, DID EVERYBODY--"
1207,00:37:19.20,00:37:19.20,WE ALL KNOW.
1208,00:37:20.07,00:37:20.07,Jeff: EVERYBODY KNEW.
1209,00:37:21.43,00:37:21.43,WHO HAS THE IDOL?
1210,00:37:22.87,00:37:22.87,COACH.
1211,00:37:23.27,00:37:23.27,WE KNEW.
1212,00:37:24.03,00:37:24.03,Jeff: SO IN A SENSE YOU'RE
1213,00:37:25.47,00:37:25.47,SAYING GAUZE BEAUS IF HE SMELLS
1214,00:37:27.43,00:37:27.43,ANYTHING HE MAY JUST PLAY IT
1215,00:37:28.70,00:37:28.70,TONIGHT OUT OF SECURITY.
1216,00:37:29.47,00:37:29.47,AND I REALLY BLEW THAT FOR
1217,00:37:32.00,00:37:32.00,HIM.
1218,00:37:32.20,00:37:32.20,THAT'S OKAY.
1219,00:37:33.70,00:37:33.70,IT'S BETTER SAFE THAN SORRY AT
1220,00:37:35.30,00:37:35.30,"THIS POINT, YOU KNOW WHAT I"
1221,00:37:37.33,00:37:37.33,MEAN.
1222,00:37:37.50,00:37:37.50,Jeff: AND YOU KNOW ALBERT
1223,00:37:39.47,00:37:39.47,IS SAFE.
1224,00:37:40.07,00:37:40.07,"SO IT'S YOU, BRANDON OR SOPHIE."
1225,00:37:42.77,00:37:42.77,SO I WAS CURIOUS TO SEE IF HE
1226,00:37:45.43,00:37:45.43,WOULD GIVE BRANDON BACK THE
1227,00:37:47.43,00:37:47.43,NECKLACE IF HE WAS IN TROUBLE.
1228,00:37:48.80,00:37:48.80,"Jeff: BRANDON, I'M SENSING"
1229,00:37:50.60,00:37:50.60,THAT YOU WERE ARE NOT AS SECURE
1230,00:37:52.10,00:37:52.10,AS YOU THOUGHT.
1231,00:37:52.87,00:37:52.87,I HONESTLY BELIEVE TONIGHT
1232,00:37:54.03,00:37:54.03,MIGHT BE MY NIGHT.
1233,00:37:55.07,00:37:55.07,Jeff: IS THERE ANY PART OF
1234,00:37:57.20,00:37:57.20,YOU THAT WOULD EXPECT ALBERT TO
1235,00:37:58.73,00:37:58.73,GIVE THAT BACK NOW?
1236,00:38:00.20,00:38:00.20,IT'S UP TO HIM.
1237,00:38:02.80,00:38:02.80,"Jeff: HOW DOES THAT FEEL,"
1238,00:38:05.33,00:38:05.33,ALBERT?
1239,00:38:05.50,00:38:05.50,THAT'S A LOT OF PRESSURE.
1240,00:38:06.33,00:38:06.33,"IT'S A TON OF PRESSURE, BUT I"
1241,00:38:08.03,00:38:08.03,HOPE BRANDON FEELS COMFORTABLE
1242,00:38:09.40,00:38:09.40,"WITH ME, HIM, AND COACH, KNOWING"
1243,00:38:11.80,00:38:11.80,THAT HE CAN MAKE A MOVE LIKE
1244,00:38:13.30,00:38:13.30,THIS AND GO UNTOUCHED.
1245,00:38:16.00,00:38:16.00,"HONESTLY, I DON'T THINK HE'S"
1246,00:38:16.77,00:38:16.77,GOING HOME TONIGHT.
1247,00:38:18.20,00:38:18.20,SO I'M NOT GOING TO GIVE HIM THE
1248,00:38:20.00,00:38:20.00,NECKLACE BACK.
1249,00:38:23.30,00:38:23.30,"Jeff: SO SOMEHOW, COACH YOU"
1250,00:38:26.27,00:38:26.27,GOT INVOLVED IN THIS.
1251,00:38:26.87,00:38:26.87,I DID.
1252,00:38:27.73,00:38:27.73,I DON'T MIND THE RESPONSIBILITY
1253,00:38:28.93,00:38:28.93,BECAUSE I GOT DOWN ON MY KNEES
1254,00:38:31.87,00:38:31.87,UNTIL SAND AND I PRAYED AND GOD
1255,00:38:34.07,00:38:34.07,GAVE ME AN ANSWER ON WHAT I
1256,00:38:35.63,00:38:35.63,SHOULD DO TONIGHT AND EVERYTHING
1257,00:38:38.57,00:38:38.57,THAT IS MEANT TO BE IS SUPPOSED
1258,00:38:40.10,00:38:40.10,TO BE SO I AM AT COMET PEACE.
1259,00:38:42.30,00:38:42.30,"Jeff: BRANDON, ARE YOU AT"
1260,00:38:43.73,00:38:43.73,PEACE?
1261,00:38:43.90,00:38:43.90,"NO, SIR."
1262,00:38:44.87,00:38:44.87,Jeff: WHAT'S STIRRING
1263,00:38:47.20,00:38:47.20,INSIDE YOU?
1264,00:38:47.80,00:38:47.80,COACH IS GOING TO DO WHAT GOD
1265,00:38:49.70,00:38:49.70,"WANTS HIM TO DO, AND IF GOD"
1266,00:38:51.37,00:38:51.37,"WANTED HIM TO VOTE ME OUT, I"
1267,00:38:52.73,00:38:52.73,BELIEVE HE WOULD.
1268,00:38:57.20,00:38:57.20,"Jeff: WITH THAT, ALBERT HAS"
1269,00:38:59.87,00:38:59.87,"THE IMMUNITY NECKLACE, YOU"
1270,00:39:01.20,00:39:01.20,CANNOT VOTE FOR ALBERT.
1271,00:39:02.57,00:39:02.57,EVERYTHING ELSE HERE FAIR GAME.
1272,00:39:04.37,00:39:04.37,IT IS TIME TO VOTE.
1273,00:39:05.87,00:39:05.87,"RICK, YOU'RE UP."
1274,00:39:14.97,00:39:14.97,DUMB MOVE.
1275,00:39:44.53,00:39:44.53,Jeff: I'LL GO TALLY THE
1276,00:39:47.50,00:39:47.50,VOTES.
1277,00:39:54.43,00:39:54.43,IF ANYBODY HAS THE HIDDEN
1278,00:39:56.50,00:39:56.50,IMMUNITY IDOL AND YOU WANT TO
1279,00:39:57.20,00:39:57.20,"PLAY IT, NOW WOULD BE THE TIME"
1280,00:39:58.87,00:39:58.87,TO DO SO.
1281,00:40:01.20,00:40:01.20,"OKAY, ONCE THE VOTES ARE READ,"
1282,00:40:03.37,00:40:03.37,"THE DECISION IS FINAL, THE"
1283,00:40:04.57,00:40:04.57,PERSON VOTED OUT WILL BE ASKED
1284,00:40:05.93,00:40:05.93,TO LEAVE THE TRIBAL COUNCIL AREA
1285,00:40:07.63,00:40:07.63,IMMEDIATELY.
1286,00:40:07.87,00:40:07.87,I'LL READ THE VOTES.
1287,00:40:09.90,00:40:09.90,"FIRST VOTE, BRANDON."
1288,00:40:16.50,00:40:16.50,SOPHIE.
1289,00:40:17.60,00:40:17.60,"ONE VOTE BRANDON, ONE VOTE"
1290,00:40:19.80,00:40:19.80,SOPHIE.
1291,00:40:23.80,00:40:23.80,BRANDON.
1292,00:40:24.07,00:40:24.07,"TWO VOTES BRANDON, ONE VOTE"
1293,00:40:25.90,00:40:25.90,SOPHIE.
1294,00:40:29.83,00:40:29.83,SOPHIE.
1295,00:40:30.23,00:40:30.23,WE'RE TIED.
1296,00:40:31.53,00:40:31.53,"TWO VOTES BRANDON, TWO VOTES"
1297,00:40:33.90,00:40:33.90,"SOY, ONE VOTE LEFT."
1298,00:40:38.07,00:40:38.07,15th PERSON VOTED OUT OF
1299,00:40:41.87,00:40:41.87,"""SURVIVOR: SOUTH PACIFIC."""
1300,00:40:44.90,00:40:44.90,BRANDON.
1301,00:41:00.33,00:41:00.33,"Jeff: BRANDON, THE TRIBE"
1302,00:41:01.70,00:41:01.70,HAS SPOKEN.
1303,00:41:03.57,00:41:03.57,YOU WILL HAVE A CHANCE TO GET
1304,00:41:04.83,00:41:04.83,BACK IN THIS GAME.
1305,00:41:06.20,00:41:06.20,"GRAB YOUR TORCH, HEAD TO"
1306,00:41:07.03,00:41:07.03,REDEMPTION ISLAND.
1307,00:41:21.20,00:41:21.20,"Jeff: ALL RIGHT, HERE'S"
1308,00:41:23.20,00:41:23.20,WHERE THINGS STAND.
1309,00:41:24.70,00:41:24.70,THE FOUR OF YOU WILL WITNESS THE
1310,00:41:26.73,00:41:26.73,FINAL DUEL BETWEEN OZZY AND
1311,00:41:30.93,00:41:30.93,BRANDON.
1312,00:41:31.70,00:41:31.70,THE WINNER OF THE DUEL WILL
1313,00:41:33.20,00:41:33.20,RE-ENTER THE GAME AND THE FIVE
1314,00:41:34.00,00:41:34.00,OF YOU WILL DUKE IT OUT UNTIL
1315,00:41:35.87,00:41:35.87,THE END.
1316,00:41:36.37,00:41:36.37,THIS IS IT.
1317,00:41:37.33,00:41:37.33,GRAB YOUR TORCHES.
1318,00:41:38.40,00:41:38.40,HEAD BACK TO CAMP.
1319,00:41:39.27,00:41:39.27,GOOD NIGHT.
1320,00:41:41.73,00:41:41.73,Captioning brought to you by
1321,00:41:42.07,00:41:42.07,"Survivor Productions, CBS,"
1322,00:41:44.00,00:41:44.00,Captioned by
1323,00:41:44.50,00:41:44.50,Media Access Group at WGBH
1324,00:41:45.03,00:41:45.03,access.wgbh.org
1325,00:41:50.20,00:41:50.20,JEFF: STAY TUNED FOR SCENES
1326,00:41:50.53,00:41:50.53,FROM OUR NEXT EPISODE.
1327,00:41:58.23,00:41:58.23,"NEXT TIME, ON SURVIVOR - OZZY'S END GAME IS CLEAR."
1328,00:42:01.33,00:42:01.33,"PLAN A., WIN."
1329,00:42:02.90,00:42:02.90,"PLAN B., WIN."
1330,00:42:03.90,00:42:03.90,"Jeff: FOR EVERYONE ELSE,"
1331,00:42:05.23,00:42:05.23,THINGS ARE MURKY.
1332,00:42:06.00,00:42:06.00,"WHEN PEOPLE ( BLEEP ) ME,"
1333,00:42:07.57,00:42:07.57,YOU'RE ( BLEEP ) CUT OFF.
1334,00:42:09.47,00:42:09.47,THERE'S NO MORE REDEMPTION.
1335,00:42:11.27,00:42:11.27,IT'S OUT THE DOOR I GO.
1336,00:42:12.63,00:42:12.63,"Jeff: JOIN US SUNDAY,"
1337,00:42:14.33,00:42:14.33,"DECEMBER 18, FOR AN"
1338,00:42:16.23,00:42:16.23,UNFORGETTABLE TWO-HOUR SEASON
1339,00:42:17.80,00:42:17.80,FINALE.
1340,00:42:22.63,00:42:22.63,"WHAT'S UP, BRO."
1341,00:42:24.23,00:42:24.23,"OH, GEEZ."
1342,00:42:25.93,00:42:25.93,I THINK THERE'S DEFINITELY
1343,00:42:27.30,00:42:27.30,GOING TO BE A LOT OF CRITICS
1344,00:42:28.30,00:42:28.30,ABOUT THE MOVE THEY MADE.
1345,00:42:30.10,00:42:30.10,"THE FUNNY PART ABOUT IT IS, I"
1346,00:42:31.97,00:42:31.97,DON'T CARE.
1347,00:42:32.53,00:42:32.53,"YOU'RE NOT OUT HERE FOR 35 DAYS,"
1348,00:42:34.43,00:42:34.43,YOU HAVEN'T BUILT A RELATIONSHIP
1349,00:42:35.60,00:42:35.60,"OUT HERE, AND IF YOU HAVEN'T"
1350,00:42:37.03,00:42:37.03,PLAYED BEFORE YOU DON'T
1351,00:42:37.90,00:42:37.90,UNDERSTAND.
1352,00:42:38.07,00:42:38.07,AND YOU GAVE THE IMMUNITY TO
1353,00:42:39.77,00:42:39.77,"WHO, ALBERT?"
1354,00:42:40.23,00:42:40.23,"YEAH, MAN."
1355,00:42:41.23,00:42:41.23,"THIS GAME IS NOT MADE FOR ME,"
