,begin,end,subtitles_text
502,00:15:44.60,00:15:44.60,HOW YOU DOING?
503,00:15:45.60,00:15:45.60,GOOD.
504,00:15:46.80,00:15:46.80,A LITTLE BIT NERVOUS WITH THE
505,00:15:49.37,00:15:49.37,CONVERSATION.
506,00:15:49.60,00:15:49.60,"I MEAN, IT'S--"
507,00:15:50.60,00:15:50.60,"COME ON, MAN."
508,00:15:51.97,00:15:51.97,DON'T SOUND LIKE RUSSELL.
509,00:15:54.20,00:15:54.20,WE JUST TOLD YOU WHAT THE
510,00:15:55.60,00:15:55.60,CONVERSATION WAS.
511,00:15:56.20,00:15:56.20,WE'RE TALKING ABOUT JURY VOTES.
512,00:15:57.57,00:15:57.57,"I'M JUST SAYING, DONT TELL ME --"
513,00:16:00.37,00:16:00.37,I DON'T WANT YOU TO COME IN HERE
514,00:16:01.57,00:16:01.57,"AND TRY TO BULLY US, MAN."
515,00:16:03.60,00:16:03.60,"SERIOUSLY, YOU HAVE TURNED INTO"
516,00:16:04.77,00:16:04.77,A BULLY.
517,00:16:05.37,00:16:05.37,WE WERE JUST TALKING ABOUT JURY
518,00:16:06.47,00:16:06.47,"VOTES AND HOW THE JURY THINKS,"
519,00:16:08.43,00:16:08.43,AND THEN YOU SAY THAT'S NOT WHAT
520,00:16:09.63,00:16:09.63,WE'RE THINKING ABOUT.
521,00:16:11.20,00:16:11.20,"DON'T PLAY LIKE THAT, MAN."
522,00:16:13.10,00:16:13.10,BRANDON REALLY PISSED ME OFF.
523,00:16:14.33,00:16:14.33,I THINK MR. HANTZ CAME DOWN AND
524,00:16:16.30,00:16:16.30,GAVE BRANDON A SHOT OF HANTZ.
525,00:16:17.90,00:16:17.90,"ALL OF A SUDDEN, BRANDON COMES"
526,00:16:20.73,00:16:20.73,"BULLYING UP TO US, WHAT ARE YOU"
527,00:16:22.23,00:16:22.23,"GUYS TALKING ABOUT?"""
528,00:16:23.10,00:16:23.10,"FIRST OF ALL, IT'S RUDE TO"
529,00:16:24.30,00:16:24.30,INTERRUPT SOMEBODY'S
530,00:16:25.20,00:16:25.20,CONVERSATION.
531,00:16:25.37,00:16:25.37,"NUMBER TWO, BULLYING PEOPLE IS"
532,00:16:27.00,00:16:27.00,NOT GOING TO HELP YOU AT THIS
533,00:16:28.50,00:16:28.50,POINT.
534,00:16:28.63,00:16:28.63,"IN FACT, IT'S GOING TO SEAL YOUR"
535,00:16:30.07,00:16:30.07,FATE.
536,00:16:30.23,00:16:30.23,"I MEAN, IT'S SO REMINISCENT OF"
537,00:16:32.53,00:16:32.53,RUSSELL.
538,00:16:32.83,00:16:32.83,I'M HAVING FLASHBACKS.
539,00:16:35.20,00:16:35.20,THAT DEFINITELY HURT MY
540,00:16:36.63,00:16:36.63,"FEELINGS WHAT YOU JUST SAID,"
541,00:16:38.53,00:16:38.53,BRO.
542,00:16:38.80,00:16:38.80,I WAS JUST TELLING YOU THE
543,00:16:40.07,00:16:40.07,"TRUTH, MAN."
544,00:16:40.67,00:16:40.67,I DON'T THINK I'VE ACTED LIKE
545,00:16:42.37,00:16:42.37,RUSSELL THE LAST COUPLE OF DAYS.
546,00:16:45.30,00:16:45.30,YOU'RE STRESSED OUT AND YOU BLEW
547,00:16:46.43,00:16:46.43,UP ON ME.
548,00:16:47.53,00:16:47.53,I APOLOGIZE FOR SAYING THE
549,00:16:49.20,00:16:49.20,RUSSELL THING.
550,00:16:49.83,00:16:49.83,IT'S ALL RIGHT.
551,00:16:50.33,00:16:50.33,HE REALLY DID A NUMBER ON ME.
552,00:16:52.00,00:16:52.00,AND SO WHEN I SEE YOU DOING THE
553,00:16:53.70,00:16:53.70,"SAME THING THAT HE DID, THEN"
554,00:16:55.63,00:16:55.63,THAT KIND OF FREAKS ME OUT.
555,00:16:56.83,00:16:56.83,"PLEASE, GIVE ME A HUG, MAN."
556,00:16:59.83,00:16:59.83,I-- I FEEL LIKE WE'VE GOT TO
557,00:17:02.53,00:17:02.53,CONNECT AGAIN BECAUSE I'M STILL
558,00:17:04.83,00:17:04.83,GET AGO STILL GETTING THE
559,00:17:06.33,00:17:06.33,JITTERS OUT OVER THAT.
560,00:17:10.50,00:17:10.50,"LOVE YOU, BROTHER."
561,00:17:12.43,00:17:12.43,IT'S ALL RIGHT.
562,00:17:13.63,00:17:13.63,I REALLY MEAN THAT.
563,00:17:14.83,00:17:14.83,THE APPLE NEVER FALLS FAR
564,00:17:16.83,00:17:16.83,FROM THE TREE AND MEETING THE
565,00:17:18.53,00:17:18.53,FATHER WAS DOUBLE CONFIRMATION
566,00:17:19.80,00:17:19.80,OF WHAT I SNEAD TO DO FOR MY
567,00:17:21.37,00:17:21.37,NEXT MOVE.
568,00:17:25.40,00:17:25.40,"CHEER UP, BROTHER."
569,00:17:28.97,00:17:28.97,I CAN'T IT'S ANY MORE
570,00:17:31.27,00:17:31.27,COCONUT.
571,00:17:31.43,00:17:31.43,ARE YOU SURE?
572,00:17:32.73,00:17:32.73,"CHEER UP, MAN."
573,00:17:33.83,00:17:33.83,GOD'S GOT EVERYTHING UNDER
574,00:17:34.93,00:17:34.93,CONTROL.
575,00:17:46.20,00:17:46.20,"Jeff: COME ON IN, GUYS!"
576,00:17:51.70,00:17:51.70,YOU GUYS READY TO GET TO TODAY'S
577,00:17:53.80,00:17:53.80,IMMUNITY CHALLENGE.
578,00:17:54.47,00:17:54.47,YUP.
579,00:17:54.80,00:17:54.80,"YES, SIR."
580,00:17:55.67,00:17:55.67,"Jeff: FIRST THINGS FIRST,"
581,00:17:57.13,00:17:57.13,COACH.
582,00:17:57.30,00:17:57.30,TAKE BACK THE NECKLACE.
583,00:18:03.63,00:18:03.63,"ONCE AGAIN, IMMUNITY IS BACK UP"
584,00:18:05.10,00:18:05.10,FOR GRABS.
585,00:18:06.93,00:18:06.93,"FOR TODAY'S CHALLENGE, YOU WILL"
586,00:18:08.30,00:18:08.30,"CLIMB A MASSIVE WALL, COLLECTING"
587,00:18:11.00,00:18:11.00,BAGS OF PUZZLE PIECES.
588,00:18:12.47,00:18:12.47,"WITH EACH BAG, YOU'LL MAKE YOUR"
589,00:18:14.17,00:18:14.17,WAY FURTHER UP THE WALL.
590,00:18:16.70,00:18:16.70,ONCE YOU HAVE COLLECTED ALL FIVE
591,00:18:18.57,00:18:18.57,"BAGS, YOU'LL SORT OF PIECES INTO"
592,00:18:20.17,00:18:20.17,PAIRS.
593,00:18:20.57,00:18:20.57,THREE OF THE PIECES WILL NOT
594,00:18:21.87,00:18:21.87,PAIR UP.
595,00:18:23.13,00:18:23.13,THEY WILL REVEAL A NUMBER CODE.
596,00:18:25.10,00:18:25.10,YOU'LL THEN RACE BACK TO THE
597,00:18:26.70,00:18:26.70,"TOP, USE THE NUMBER CODE TO"
598,00:18:29.10,00:18:29.10,UNLOCK THE BOX.
599,00:18:30.10,00:18:30.10,FIRST PERSON TO GET THEIR BOX
600,00:18:31.37,00:18:31.37,OPEN AND RAISE A FLAG WINS
601,00:18:33.57,00:18:33.57,"IMMUNITY, IS SAFE FROM THE VOTE."
602,00:18:35.43,00:18:35.43,"LOSERS, TRIBAL COUNCIL, SOMEBODY"
603,00:18:36.47,00:18:36.47,"VOTED OUT, SENT TO REDEMPTION"
604,00:18:37.57,00:18:37.57,"ISLAND, WHERE OZZY IS WAITING"
605,00:18:38.80,00:18:38.80,FOR YOU.
606,00:18:39.43,00:18:39.43,"IN ADDITION, THE WINNER OF THIS"
607,00:18:41.73,00:18:41.73,"CHALLENGE EARNS REWARD, PIZZA"
608,00:18:44.83,00:18:44.83,WILL BE DELIVERED TO YOU AT CAMP
609,00:18:48.00,00:18:48.00,WITH A SOFT DRINK AND SOME
610,00:18:50.57,00:18:50.57,GARLIC BREAD.
611,00:18:50.90,00:18:50.90,I KNOW IT'S WORTH PLAYING FOR.
612,00:18:52.67,00:18:52.67,WE'LL DRAW FOR SPOTS.
613,00:18:54.00,00:18:54.00,WE'LL GET STARTED.
614,00:18:57.80,00:18:57.80,"HERE WE GO, FOR IMMUNITY AND"
615,00:19:00.03,00:19:00.03,REWARD IN THE FORM OF PIZZA.
616,00:19:02.57,00:19:02.57,SURVIVORS READY?
617,00:19:04.60,00:19:04.60,GO!
618,00:19:11.23,00:19:11.23,BRANDON HAS HIS FIRST BAG.
619,00:19:12.93,00:19:12.93,RICK RIGHT THERE WITH HIM.
620,00:19:21.83,00:19:21.83,COACH AND SOPHIE COMING BACK
621,00:19:23.43,00:19:23.43,WITH THEIR FIRST BAGS.
622,00:19:24.97,00:19:24.97,BRANDON IN THE LEAD NOW WITH HIS
623,00:19:26.33,00:19:26.33,SECOND BAG.
624,00:19:28.60,00:19:28.60,RICK HAS HIS SECOND BAG.
625,00:19:30.97,00:19:30.97,"ALBERT FINALLY ON THE BOARD, THE"
626,00:19:32.07,00:19:32.07,LAST ONE TO GET HIS BAG IS
627,00:19:35.70,00:19:35.70,ALBERT.
628,00:19:38.03,00:19:38.03,COACH NOW HAS HIS SECOND BAG.
629,00:19:40.07,00:19:40.07,SOPHIE HAS HER SECOND BAG.
630,00:19:41.73,00:19:41.73,ALBERT STARTING TO CATCH UP NOW.
631,00:19:44.40,00:19:44.40,BRANDON WITH HIS THIRD BAG.
632,00:19:47.07,00:19:47.07,RICK SLIDING DOWN WITH HIS THIRD
633,00:19:50.07,00:19:50.07,BAG.
634,00:19:52.67,00:19:52.67,COACH GOING TO BURN SOME SKIN
635,00:19:54.13,00:19:54.13,OFF THAT BUTT COMING DOWN WITH
636,00:19:55.63,00:19:55.63,HIS THIRD BAG.
637,00:19:58.47,00:19:58.47,"ALBERT TAKES A BIG FALL, COMING"
638,00:20:00.23,00:20:00.23,DOWN WITH HIS THIRD BAG.
639,00:20:06.07,00:20:06.07,RICK DEFINITELY LOST SOME HIDE
640,00:20:07.93,00:20:07.93,ON THAT ONE.
641,00:20:09.03,00:20:09.03,SOPHIE HAS HER THIRD BAG.
642,00:20:11.43,00:20:11.43,BRANDON AND RICK BOTH RACING FOR
643,00:20:13.10,00:20:13.10,THEIR FIFTH AND FINAL BAG.
644,00:20:15.40,00:20:15.40,COACH NOW WITH HIS FOURTH BAG.
645,00:20:17.77,00:20:17.77,ALBETTER WORKING ON THAT FOURTH
646,00:20:19.30,00:20:19.30,BAG.
647,00:20:21.77,00:20:21.77,RICK GOING TO BE FIRST DOWN.
648,00:20:24.83,00:20:24.83,BRANDON RIGHT BEHIND HIM.
649,00:20:26.80,00:20:26.80,START WORKING ON YOUR PUZZLE.
650,00:20:28.90,00:20:28.90,"EMPTY ALL THE PIECES, THEN MATCH"
651,00:20:30.57,00:20:30.57,UP THE PAIRS.
652,00:20:32.43,00:20:32.43,COACH HAS HIS FIFTH AND FINAL
653,00:20:35.40,00:20:35.40,BAG.
654,00:20:35.93,00:20:35.93,"COACH, BRANDON, RICK WITH A BIG"
655,00:20:40.27,00:20:40.27,LEAD.
656,00:20:40.77,00:20:40.77,SOPHIE HAS HER FOURTH BAG.
657,00:20:44.30,00:20:44.30,"ALBERT STRUGGLING, CAN'T GET"
658,00:20:45.40,00:20:45.40,THAT FOURTH BAG FREE.
659,00:20:50.70,00:20:50.70,SOPHIE STRUGGLING TO GET BACK UP
660,00:20:53.57,00:20:53.57,FOR THAT FIFTH BAG.
661,00:20:54.77,00:20:54.77,"DIG, SOPHIE!"
662,00:20:55.70,00:20:55.70,DIG!
663,00:20:58.73,00:20:58.73,ALBERT WITH ANOTHER BIG FALL BUT
664,00:21:00.57,00:21:00.57,HE HAS THE FOURTH BAG.
665,00:21:06.00,00:21:06.00,ALBERT HAS HIS FIFTH BAG.
666,00:21:07.97,00:21:07.97,SOPHIE HAS HER FIFTH BAG.
667,00:21:11.30,00:21:11.30,EVERYBODY NOW WORKING ON THEIR
668,00:21:12.57,00:21:12.57,PUZZLE PIECES.
669,00:21:14.87,00:21:14.87,YOU'RE LOOKING FOR THE THREE
670,00:21:16.37,00:21:16.37,PIECES THAT DO NOT PAIR UP.
671,00:21:18.90,00:21:18.90,THAT WILL HOLD YOUR NUMBER CODE
672,00:21:21.03,00:21:21.03,AND THE KEY TO WINNING THIS
673,00:21:24.20,00:21:24.20,CHALLENGE.
674,00:21:24.40,00:21:24.40,HOW QUICKLY YOU CAN RECOGNIZE
675,00:21:26.87,00:21:26.87,MATCHING LINES IS GOING TO
676,00:21:27.73,00:21:27.73,REALLY HELP YOU OUT.
677,00:21:30.63,00:21:30.63,SOPHIE AND ALBERT STILL UNDOING
678,00:21:32.33,00:21:32.33,THEIR PIECES.
679,00:21:35.60,00:21:35.60,BRANDON DOING A GREAT JOB.
680,00:21:37.90,00:21:37.90,COACH IN THIS.
681,00:21:39.70,00:21:39.70,RICK FALLING OUT OF IT.
682,00:21:41.20,00:21:41.20,IT IS BRANDON AND COACH NECK AND
683,00:21:44.37,00:21:44.37,NECK.
684,00:21:49.10,00:21:49.10,WE ARE DEAD EVEN NOW.
685,00:21:55.87,00:21:55.87,BRANDON THINKS HE HAS THE THREE
686,00:21:57.73,00:21:57.73,NUMBERS HE NEEDS.
687,00:21:58.60,00:21:58.60,BRANDON HEADING BACK TO THE TOP.
688,00:22:00.37,00:22:00.37,COACH HAAS HIS THREE.
689,00:22:02.83,00:22:02.83,"LET'S GO, COACH."
690,00:22:07.90,00:22:07.90,"Jeff: COACH, YOU'VE GOT TO"
691,00:22:09.20,00:22:09.20,MOVE!
692,00:22:16.93,00:22:16.93,BRANDON HAS IT.
693,00:22:17.83,00:22:17.83,BRANDON WINS IMMUNITY AND
694,00:22:19.63,00:22:19.63,REWARD.
695,00:22:19.80,00:22:19.80,"THANK YOU, JESUS!"
696,00:22:24.63,00:22:24.63,"THANK YOU, FATHER!"
697,00:22:34.10,00:22:34.10,"Jeff: BRANDON, COME ON"
698,00:22:35.57,00:22:35.57,OVER.
699,00:22:35.73,00:22:35.73,( APPLAUSE )
700,00:22:39.37,00:22:39.37,Jeff: CONGRATULATIONS.
701,00:22:40.40,00:22:40.40,"THANK YOU, SIR."
702,00:22:43.57,00:22:43.57,"BRANDON, SAFE FROM THE VOTE"
703,00:22:44.73,00:22:44.73,TONIGHT.
704,00:22:44.90,00:22:44.90,CANNOT BE VOTED OUT OF THIS
705,00:22:46.83,00:22:46.83,GAME.
706,00:22:47.00,00:22:47.00,"IN ADDITION, BRANDON, HERE'S A"
707,00:22:50.07,00:22:50.07,PIZZA MENU.
708,00:22:51.40,00:22:51.40,"IT SAYS TWO PIZZAS, BECAUSE"
709,00:22:52.63,00:22:52.63,YOU'RE GOING TO CHOOSE ONE
710,00:22:53.63,00:22:53.63,PERSON TO COME JOIN YOU THIS
711,00:22:55.67,00:22:55.67,AFTERNOON.
712,00:22:55.90,00:22:55.90,YOU AND WHOEVER YOU CHOOSE WILL
713,00:22:58.13,00:22:58.13,SHARE PIZZA IN FRONT OF THE
714,00:22:59.83,00:22:59.83,OTHER THREE.
715,00:23:00.33,00:23:00.33,YOU WON'T BE ABLE TO SHARE EVEN
716,00:23:02.10,00:23:02.10,IF YOU WANT TO.
717,00:23:02.90,00:23:02.90,"YES, SIR."
718,00:23:04.00,00:23:04.00,Jeff: WHO DO YOU WANT TO
719,00:23:05.27,00:23:05.27,JOIN YOU?
720,00:23:06.37,00:23:06.37,MY DAD TOLD ME TO PLAY WITH
721,00:23:07.77,00:23:07.77,MY HEART.
722,00:23:12.80,00:23:12.80,THIS THIS ISN'T A STRATEGIC MOVE
723,00:23:18.80,00:23:18.80,OR ELSE I'D BE DOING SOMETHING
724,00:23:21.20,00:23:21.20,DIFFERENT.
725,00:23:21.37,00:23:21.37,I WANT TO CHOOSE COWBOY TO COME
726,00:23:24.07,00:23:24.07,WITH ME.
727,00:23:24.40,00:23:24.40,YES!
728,00:23:25.40,00:23:25.40,Jeff: CONGRATULATIONS.
729,00:23:26.60,00:23:26.60,SEE YOU TONIGHT AT TRIBAL
730,00:23:27.80,00:23:27.80,"COUNCIL WHERE COACH, ALBERT,"
731,00:23:29.73,00:23:29.73,"SOPHIE, OR RICK, ONE OF THE FOUR"
732,00:23:32.03,00:23:32.03,OF YOU WILL BE SENT TO
733,00:23:32.80,00:23:32.80,REDEMPTION ISLAND WHERE OZZY
734,00:23:34.10,00:23:34.10,AWAITS.
735,00:23:34.27,00:23:34.27,I BELIEVE IN DIVINE
736,00:23:36.00,00:23:36.00,INTERVENTION.
737,00:23:36.20,00:23:36.20,IT WAS NOT BRANDON'S TIME TO GO
738,00:23:38.17,00:23:38.17,HOME TONIGHT.
739,00:23:38.73,00:23:38.73,HE SAVED HIS OWN SKIN BY WINNING
740,00:23:42.57,00:23:42.57,IMMUNITY.
741,00:23:42.80,00:23:42.80,ANOTHER PIECE OF THAT.
742,00:23:45.57,00:23:45.57,I'M PISSED.
743,00:23:46.40,00:23:46.40,BUT I'M A PIECE OF THAT.
744,00:24:02.50,00:24:02.50,"WOW, LOOK AT THIS PIZZA"
745,00:24:04.47,00:24:04.47,DELIVERY GUY.
746,00:24:07.90,00:24:07.90,WHOOO!
747,00:24:12.10,00:24:12.10,"HOW ARE YOU, MAN?"
748,00:24:16.93,00:24:16.93,"TODAY, WORST-CASE SCENARIO"
749,00:24:20.37,00:24:20.37,HAPPENED.
750,00:24:20.63,00:24:20.63,WOO WERE HOPING TO GET BRANDON
751,00:24:22.10,00:24:22.10,OUT TONIGHT SO I THINK THE WAY
752,00:24:23.17,00:24:23.17,TO GO RIGHT NOW IS ALBERT.
753,00:24:24.53,00:24:24.53,WHAT ARE YOU THINKING?
754,00:24:26.10,00:24:26.10,ALBERT.
755,00:24:26.73,00:24:26.73,COACH AND I BOTH AGREE ALBERT
756,00:24:28.70,00:24:28.70,HAS JUST BEEN GETTING ON OUR
757,00:24:30.37,00:24:30.37,NERVES MORE AND MORE AND MORE
758,00:24:31.67,00:24:31.67,SINCE THE MERGE.
759,00:24:32.87,00:24:32.87,HE'S BEEN SNEAKY.
760,00:24:34.13,00:24:34.13,HE THINKS HE'S MORE STRATEGIC
761,00:24:36.17,00:24:36.17,THAN ANYBODY ELSE.
762,00:24:37.27,00:24:37.27,EVERYTHING HE DOES IS THE
763,00:24:39.03,00:24:39.03,"SMARTEST, MOST STRATEGIC"
764,00:24:40.93,00:24:40.93,DECISION POSSIBLE AND I AM
765,00:24:42.37,00:24:42.37,FEELING MORE AND MORE ALBERT
766,00:24:43.53,00:24:43.53,SHOULD GO HOME TONIGHT.
767,00:24:44.90,00:24:44.90,I JUST WANT TO SMELL IT.
768,00:24:51.07,00:24:51.07,DO YOU MIND IF I JUST SMELL IT I
769,00:24:55.50,00:24:55.50,"WAS JUST GOING TO LOOK AT IT,"
770,00:24:56.77,00:24:56.77,BUT I DO WANT TO SMELL IT.
771,00:24:58.73,00:24:58.73,SHE'S DEFINITELY GAME
772,00:24:59.80,00:24:59.80,PLAYING.
773,00:25:00.57,00:25:00.57,"WHEN SOMEBODY SAYS, ""HMMM,"
774,00:25:02.43,00:25:02.43,I'M GOING TO GO SMELL THE PIZZA
775,00:25:03.90,00:25:03.90,"AND SEE WHAT IT LIKES,"" AND"
776,00:25:06.27,00:25:06.27,"DISAPPEARS, ESPECIALLY A PLAYER"
777,00:25:07.00,00:25:07.00,"LIKE SOPHIE, I KNOW SOMETHING'S"
778,00:25:09.37,00:25:09.37,UP.
779,00:25:09.47,00:25:09.47,THEY'RE GOING TO TRY TO PULL A
780,00:25:11.43,00:25:11.43,CUE OVER THERE AND THEY'RE
781,00:25:14.07,00:25:14.07,COMING AFTER ME.
782,00:25:14.93,00:25:14.93,"I JUST WANT TO LET YOU KNOW,"
783,00:25:17.20,00:25:17.20,I'M VOTING ALBERT TONIGHT.
784,00:25:18.80,00:25:18.80,"HE SAYS, NOW REMEMBER, ME AND"
785,00:25:20.27,00:25:20.27,YOU TO THE END.
786,00:25:22.60,00:25:22.60,AND I JUST LOOKED AT HIM AND
787,00:25:24.17,00:25:24.17,"SAID, YEAH, YEAH."
788,00:25:25.07,00:25:25.07,IT'S LIKE YOU GOT TO BE KIDDING
789,00:25:27.13,00:25:27.13,"ME, MAN."
790,00:25:28.13,00:25:28.13,ALBERT IS THE SNEAKIEST
791,00:25:29.57,00:25:29.57,PERSON OUT HERE.
792,00:25:30.07,00:25:30.07,IT'S CRAZY AT CAMP.
793,00:25:31.43,00:25:31.43,"NUMBER ONE, BECAUSE YOU GOT A"
794,00:25:32.70,00:25:32.70,LOT OF PEOPLE WHO DON'T KNOW HOW
795,00:25:34.07,00:25:34.07,"TO TELL THE TRUTH, AND I'M"
796,00:25:36.03,00:25:36.03,SPEAKING SPECIFICALLY TOWARDS
797,00:25:37.57,00:25:37.57,ALBERT.
798,00:25:37.90,00:25:37.90,I DON'T KNOW IF I CAN BELIEVE
799,00:25:40.20,00:25:40.20,HIM ANYMORE.
800,00:25:40.67,00:25:40.67,HE THINKS HE'S A LOT SMOOTHER
801,00:25:42.37,00:25:42.37,THAN HE IS.
802,00:25:42.97,00:25:42.97,I GOT TO TALK TO ALBERT.
803,00:25:45.10,00:25:45.10,IF ALBERT PUTS HIS FOOT IN HIS
804,00:25:46.87,00:25:46.87,"MOUTH, HE'LL BE GOING TO"
805,00:25:48.57,00:25:48.57,REDEMPTION.
806,00:25:48.80,00:25:48.80,YOU WENT UP TO RICK YESTERDAY
807,00:25:50.70,00:25:50.70,"AND SAID YOU, HIM GOING TO THE"
808,00:25:52.50,00:25:52.50,FINAL THREE.
809,00:25:52.80,00:25:52.80,I KNOW THEY HAVEN'T TURNED MY
810,00:25:54.17,00:25:54.17,BACK ON YOU ONE TIME IN THIS
811,00:25:55.87,00:25:55.87,GAME.
812,00:25:56.03,00:25:56.03,YOU HAVE NEVER PROMISED
813,00:25:57.50,00:25:57.50,ANYONE BUT ME AND COACH THE
814,00:25:59.00,00:25:59.00,"FINAL THREE, FINAL TWO, ANY OF"
815,00:26:00.80,00:26:00.80,THAT.
816,00:26:00.97,00:26:00.97,I HAVE NO REASON TO LIE TO
817,00:26:02.83,00:26:02.83,"YOU, ABOUT ANYTHING."
818,00:26:03.43,00:26:03.43,THAT'S REALLY HARD TO HEAR.
819,00:26:04.70,00:26:04.70,"I THINK ALBERT'S A SWELL GUY,"
820,00:26:06.80,00:26:06.80,"BUT THE BIBLE SAYS WHEN YOU SIN,"
821,00:26:08.70,00:26:08.70,YOUR SINS ARE GOING TO BE
822,00:26:10.80,00:26:10.80,SHOUTED OUT FROM THE ROOFTOPS
823,00:26:11.90,00:26:11.90,AND RIGHT NOW I WANT TO GET TO
824,00:26:12.93,00:26:12.93,THE BOTTOM OF IT.
825,00:26:13.67,00:26:13.67,WHAT I WANT TO TELL YOU RIGHT
826,00:26:15.03,00:26:15.03,NOW AND I TOLD HIM OVER THERE
827,00:26:16.83,00:26:16.83,AND I WILL LAY OUTT OUT--
828,00:26:18.40,00:26:18.40,"HE SAID HE NEVER, EVER, SPOKE"
829,00:26:20.53,00:26:20.53,AGAINST ME IN THIS GAME.
830,00:26:22.13,00:26:22.13,YESTERDAY YOU SAID WE ARE
831,00:26:23.20,00:26:23.20,STILL GOOD FOR THE THREE.
832,00:26:24.37,00:26:24.37,THAT IS NOT TRUE.
833,00:26:25.37,00:26:25.37,YOU'RE LYING OUT YOUR ASS.
834,00:26:27.37,00:26:27.37,THAT IS NOT TRUE.
835,00:26:28.27,00:26:28.27,DON'T YOU LIE TO ME.
836,00:26:30.57,00:26:30.57,THAT IS NOT TRUE.
837,00:26:32.67,00:26:32.67,BULL ( BLEEP ).
838,00:26:34.37,00:26:34.37,I'M LAYING ON THE LINE.
839,00:26:37.70,00:26:37.70,I KNOW YOU WOULD TRYING HANGING
840,00:26:39.37,00:26:39.37,MY ASS.
841,00:26:39.87,00:26:39.87,YOU JUST TOLD ME YOU DIDN'T
842,00:26:41.37,00:26:41.37,SAY THAT.
843,00:26:41.57,00:26:41.57,I DID NOT.
844,00:26:42.83,00:26:42.83,WHY IS HIS WORD HIGHER THAN
845,00:26:45.07,00:26:45.07,MINE?
846,00:26:45.23,00:26:45.23,LET ME TELL YOU RIGHT NOW THE
847,00:26:46.67,00:26:46.67,"TRUTH, MAN."
848,00:26:47.40,00:26:47.40,"YOU'RE A LIAR, BUDDY."
849,00:26:49.47,00:26:49.47,WHEN YOU-- WHEN YOU TRIED
850,00:26:51.17,00:26:51.17,THROWING ME UNDER THE BUS WITH
851,00:26:52.27,00:26:52.27,DAWN AND WHITNEY AND EDNA AND
852,00:26:54.37,00:26:54.37,ALL OF THEM GUYS.
853,00:26:56.10,00:26:56.10,THEY TOLD US THAT.
854,00:26:57.37,00:26:57.37,I THREW YOU UNDER THE BUS I
855,00:27:00.47,00:27:00.47,DID NOT THROW YOU UNDER THE BUS
856,00:27:01.83,00:27:01.83,ONE TIME.
857,00:27:02.40,00:27:02.40,YOU WERE TRYING TO GET ME
858,00:27:03.70,00:27:03.70,OUT.
859,00:27:03.87,00:27:03.87,"RICK, YOU'RE OUT OF YOUR"
860,00:27:05.73,00:27:05.73,MIND.
861,00:27:05.90,00:27:05.90,"DUDE, I KNOW YOU HAVE BEEN A"
862,00:27:07.67,00:27:07.67,STRAIGHT-UP GUY BUT THOSE TWO
863,00:27:08.70,00:27:08.70,THINGS ARE NOT TRUE.
864,00:27:10.40,00:27:10.40,SO HE'S A LIAR.
865,00:27:11.27,00:27:11.27,LET ME TELL YOU EVERYTHING
866,00:27:13.47,00:27:13.47,THAT'S HAPPENED.
867,00:27:14.50,00:27:14.50,IT'S SO GRATIFYING SEEING
868,00:27:16.00,00:27:16.00,EVERYTHING WITH ALBERT BEING
869,00:27:17.97,00:27:17.97,EXPOSED SO NOW INSTEAD OF A
870,00:27:20.37,00:27:20.37,BLINDSIDE HE GOES OUT LOOKING
871,00:27:22.03,00:27:22.03,MORE PATHETIC THAN HE HAS THE
872,00:27:23.97,00:27:23.97,WHOLE GAME.
873,00:27:24.50,00:27:24.50,WHERE IS THE STRATEGIC VALUE--
874,00:27:26.53,00:27:26.53,"LET ME FINISH, DAMN IT."
875,00:27:28.37,00:27:28.37,"NO, BECAUSE--"
876,00:27:29.13,00:27:29.13,WHERE IS THE STRATEGIC MIND
877,00:27:30.83,00:27:30.83,NOW?
878,00:27:31.00,00:27:31.00,IT'S LIKE HE'S IN THE TOILET
879,00:27:33.23,00:27:33.23,"BOWL, AND BRANDON AND COACH AND"
880,00:27:34.50,00:27:34.50,"I AND RICK, WE ALL HAVE A LITTLE"
881,00:27:36.60,00:27:36.60,CHANCE AT FLUSHING HIM DOWN.
882,00:27:39.07,00:27:39.07,HE KEEPS KIND OF SCRAMBLING BACK
883,00:27:40.67,00:27:40.67,"UP, BUT I THINK JEFF WILL PUT"
884,00:27:42.87,00:27:42.87,THE FINAL FLUSH TONIGHT.
885,00:27:43.97,00:27:43.97,IT'S WATER UNDER THE BRIDGE.
886,00:27:45.67,00:27:45.67,ALL I'M SAYING--
887,00:27:46.53,00:27:46.53,IT'S NOT WATER UNDER THE
888,00:27:47.80,00:27:47.80,BRIDGE BECAUSE TONIGHT ONE OF US
889,00:27:48.90,00:27:48.90,IS GOING TO GO HOME.
890,00:27:49.67,00:27:49.67,THAT'S NOT NECESSARILY TRUE.
891,00:27:50.83,00:27:50.83,"YEAH, IT IS."
892,00:27:52.27,00:27:52.27,I THINK BRANDON TOOK THE LID
893,00:27:54.40,00:27:54.40,"OFF PANDORA'S BOX TODAY FOR ME,"
894,00:27:56.27,00:27:56.27,AND I JUST GOT THROWN WITH A
895,00:28:00.20,00:28:00.20,STORM OF CRAP.
896,00:28:01.63,00:28:01.63,I I GOT A HECK OF A LOT OF
897,00:28:03.80,00:28:03.80,DAMAGE CONTROL TO DO IF I WANT
898,00:28:04.50,00:28:04.50,TO HAVE A PRAYER OF ESCAPING
899,00:28:06.13,00:28:06.13,TONIGHT'S VOTE.
900,00:28:06.63,00:28:06.63,IF I DID JUST DRAW BRANDON BACK
901,00:28:09.17,00:28:09.17,"OVER WITH ME, MAN, I'M RIGHT"
902,00:28:10.80,00:28:10.80,BACK WHERE I NEED TO BE.
903,00:28:13.80,00:28:13.80,WHEN YOU TOLD ME THAT RICK
904,00:28:15.67,00:28:15.67,CALLED ME A PRINCESS YOU THINK I
905,00:28:17.90,00:28:17.90,ENJOY RICK AS A PERSON BECAUSE
906,00:28:18.90,00:28:18.90,OF THAT YOU? THINK I TOOK THAT
907,00:28:21.37,00:28:21.37,KINDLY?
908,00:28:21.53,00:28:21.53,WHY WOULD I WANT TO TAKE
909,00:28:22.47,00:28:22.47,SOMEBODY LIKE THAT TO THE END
910,00:28:23.47,00:28:23.47,WITH ME?
911,00:28:24.00,00:28:24.00,DO YOU-- DO YOU GET WHERE I'M
912,00:28:25.87,00:28:25.87,"COMING FROM WITH THAT, OR NO."
913,00:28:27.23,00:28:27.23,"YEAH, I DO."
914,00:28:29.83,00:28:29.83,I JUST DON'T WANT YOU TO
915,00:28:31.60,00:28:31.60,"QLOIRS HEART ON ME, MAN."
916,00:28:32.57,00:28:32.57,I FEEL LIKE MY HEART IS CLOSED
917,00:28:34.37,00:28:34.37,"TO YOU RIGHT NOW, MAN."
918,00:28:35.63,00:28:35.63,MY HEART IS NOT CLOSED TO
919,00:28:37.40,00:28:37.40,"YOU, BROTHER."
920,00:28:38.10,00:28:38.10,I DON'T KNOW MY DECISION ABOUT
921,00:28:40.60,00:28:40.60,VOTING ALBERT.
922,00:28:41.57,00:28:41.57,HE'S LIKE A WILD CARD.
923,00:28:43.00,00:28:43.00,BUT I LOVE ALBERT.
924,00:28:45.00,00:28:45.00,HE'S MY FRIEND.
925,00:28:46.57,00:28:46.57,WHO AM I NOT TO FORGIVE?
926,00:28:48.60,00:28:48.60,I'M AN IMPERFECT PERSON.
927,00:28:50.87,00:28:50.87,I FORGIVE HIM.
928,00:28:51.23,00:28:51.23,YOU THINK I HAVE DEALS WITH
929,00:28:52.60,00:28:52.60,PEOPLE THAT WERE CREATED AND
930,00:28:53.70,00:28:53.70,BROKEN A LONG TIME AGO THAT ARE
931,00:28:55.27,00:28:55.27,NOTHING COMPARED TO WHAT WE
932,00:28:56.37,00:28:56.37,"HAVE, MAN."
933,00:28:57.93,00:28:57.93,EVERYONE HAS LIED IN THIS
934,00:28:59.77,00:28:59.77,GAME.
935,00:29:00.27,00:29:00.27,EVERYONE.
936,00:29:00.63,00:29:00.63,EVEN MYSELF.
937,00:29:02.43,00:29:02.43,"SO I'M REALLY, REALLY, REALLY"
938,00:29:04.70,00:29:04.70,STRUGGLING TO CONSIDER TO KEEP
939,00:29:05.57,00:29:05.57,HIM IN THIS GAME.
940,00:29:06.83,00:29:06.83,YOU'RE-- YOU'RE MAKING ME
941,00:29:08.60,00:29:08.60,"LOOK LIKE A BAD DUDE, AND I'M"
942,00:29:10.40,00:29:10.40,NOT A BAD DUDE.
943,00:29:11.20,00:29:11.20,I'M NOT VOTING YOU.
944,00:29:13.00,00:29:13.00,I JUST MADE UP MY MIND.
945,00:29:14.43,00:29:14.43,THE REASON I DON'T WANT TO VOTE
946,00:29:16.13,00:29:16.13,ALBERT OUT IS BECAUSE I SEE HIM.
947,00:29:18.00,00:29:18.00,I SEE INSIDE OF HIM.
948,00:29:19.60,00:29:19.60,I SEE THAT HE MAY NOT HAVE HAD
949,00:29:21.67,00:29:21.67,THE INTENTIONS THAT I THINK HE
950,00:29:22.90,00:29:22.90,HAD.
951,00:29:23.03,00:29:23.03,"AND I STRONGLY, STRONGLY BELIEVE"
952,00:29:26.07,00:29:26.07,THAT ALBERT DESERVES TO BE HERE.
953,00:29:28.10,00:29:28.10,"IF I HAVE TO, I'LL GIVE YOU"
954,00:29:30.23,00:29:30.23,MY IMMUNITY NECKLACE.
955,00:29:32.53,00:29:32.53,"IF I HAVE TO, I'LL GIVE ALBERT"
956,00:29:35.37,00:29:35.37,"MY IMMUNITY, AND COACH WILL NOT"
957,00:29:36.90,00:29:36.90,VOTE FOR ME.
958,00:29:38.10,00:29:38.10,ALBERT WILL NOT VOTE FOR ME.
959,00:29:39.57,00:29:39.57,AND I'LL VOTE FOR SOPHIE.
960,00:29:42.50,00:29:42.50,YOU KNOW I'M YOUR BEST FRIEND
961,00:29:45.83,00:29:45.83,HERE.
962,00:29:47.53,00:29:47.53,"AND YOU KNOW THAT BY NOW, GOD"
963,00:29:49.03,00:29:49.03,SPEAKS TO ME.
964,00:29:51.77,00:29:51.77,AND YOU KNOW THAT I WOULD NEVER
965,00:29:55.23,00:29:55.23,MAKE A DECISION TO HURT ME OR
966,00:29:57.17,00:29:57.17,"YOU, MORE THAN ANYBODY IN THIS"
967,00:29:59.90,00:29:59.90,GAME.
968,00:30:00.43,00:30:00.43,( SIGHS )
969,00:30:01.93,00:30:01.93,"AND I PRAY THAT YOU ACCEPT THIS,"
970,00:30:03.70,00:30:03.70,AND WE WILL MAKE IT TO THE END
971,00:30:05.77,00:30:05.77,OF THIS GAME.
972,00:30:07.00,00:30:07.00,IF WE KEEP ALBERT HERE.
973,00:30:09.20,00:30:09.20,"IF I HAVE TO, I'LL GIVE HIM MY"
974,00:30:12.87,00:30:12.87,NECKLACE.
975,00:30:13.80,00:30:13.80,BUT I KNOW YOU'LL NEVER VOTE
976,00:30:16.00,00:30:16.00,AGAINST ME.
977,00:30:16.60,00:30:16.60,AND I KNOW YOU'D NEVER DO
978,00:30:18.20,00:30:18.20,ANYTHING OR VOTE ANY WAY THAT
979,00:30:19.90,00:30:19.90,YOU KNEW THAT I WAS GOING HOME.
980,00:30:23.47,00:30:23.47,THIS EXAMPLE WOULD BE PROBABLY
981,00:30:25.77,00:30:25.77,THE PINNACLE OF WHY WE'RE OUT
982,00:30:28.40,00:30:28.40,HERE-- FORGIVING.
983,00:30:29.40,00:30:29.40,"IF WE CAN'T FORGIVE OUR BROTHER,"
984,00:30:31.87,00:30:31.87,OUR HEAVENLY FATHER WILL NOT
985,00:30:33.37,00:30:33.37,FORGIVE US.
986,00:30:34.50,00:30:34.50,I WANT THINGS TO BE EASY AND
987,00:30:36.17,00:30:36.17,"SIMPLE, AND EARLIER TODAY, IT"
988,00:30:37.03,00:30:37.03,WAS KIND OF BLACK AND WHITE
989,00:30:38.37,00:30:38.37,"BECAUSE WE HAD ONE MAN, ALBERT,"
990,00:30:40.10,00:30:40.10,THAT HAD JUST COMPLETELY LIED TO
991,00:30:43.37,00:30:43.37,THE CAMP.
992,00:30:43.83,00:30:43.83,SO IT'S JUSTIFICATION THAT HE
993,00:30:45.53,00:30:45.53,GOES.
994,00:30:45.70,00:30:45.70,BUT THEN BRANDON BRINGS IN
995,00:30:47.47,00:30:47.47,"FORGIVENESS, AND THEN THE"
996,00:30:48.67,00:30:48.67,IMMUNITY NECKLACE.
997,00:30:49.67,00:30:49.67,AND IT MAKES IT SO HARD TO
998,00:30:52.80,00:30:52.80,DETERMINE RIGHT FROM WRONG.
999,00:30:53.93,00:30:53.93,IT MAKES IT SO HARD TO FIGURE
1000,00:30:56.87,00:30:56.87,"OUT WHO SHOULD GO, WHO DESERVES"
1001,00:31:00.77,00:31:00.77,"TO STAY, WHICH ALLIANCE I SHOULD"
