,begin,end,subtitles_text
1,00:00:00.00,00:00:00.00,
2,00:00:02.27,00:00:02.27,Jeff: PREVIOUSLY ON
3,00:00:03.57,00:00:03.57,"""SURVIVOR"": FOR THE PAST 31"
4,00:00:06.17,00:00:06.17,"DAYS, ALBERT AND BRANDON WERE"
5,00:00:07.43,00:00:07.43,PART OF AN ALLIANCE OF FIVE.
6,00:00:09.77,00:00:09.77,"IT'S COACH, SOPHIE, RICK,"
7,00:00:12.20,00:00:12.20,"BRANDON, AND MYSELF."
8,00:00:13.23,00:00:13.23,"Jeff: PLUS ONE, WITH EDNA"
9,00:00:15.00,00:00:15.00,BEING THE PLUS-ONE.
10,00:00:18.07,00:00:18.07,"BUT DURING THAT TIME, ALBERT"
11,00:00:20.37,00:00:20.37,CONSISTENTLY ATTEMPTED TO CHANGE
12,00:00:21.70,00:00:21.70,THE PECKING ORDER.
13,00:00:23.40,00:00:23.40,I'M ENTERTAINING THE IDEA OF
14,00:00:25.63,00:00:25.63,RUNNING A CUE.
15,00:00:27.13,00:00:27.13,Jeff: INCLUDING TRYING TO
16,00:00:29.13,00:00:29.13,OUST RICK.
17,00:00:29.47,00:00:29.47,I WON'T BAT AN IRISH LASH.
18,00:00:32.27,00:00:32.27,I DON'T LIKE RICK.
19,00:00:34.27,00:00:34.27,HIS.
20,00:00:36.30,00:00:36.30,HE THINKS HE HAS A GREAT
21,00:00:39.40,00:00:39.40,STRATEGIC MIND AND I DON'T THINK
22,00:00:40.37,00:00:40.37,HE'S COME UP WITH ONE GOOD IDEA
23,00:00:42.73,00:00:42.73,YET.
24,00:00:42.90,00:00:42.90,Jeff: BRANDON WAS ALSO
25,00:00:45.17,00:00:45.17,INFURIATING THE TRIBE.
26,00:00:46.13,00:00:46.13,BRANDON STICKS HIS SMELLY
27,00:00:47.87,00:00:47.87,FOOT IN HIS MOUTH AND GETS IN
28,00:00:50.33,00:00:50.33,TROUBLE.
29,00:00:50.53,00:00:50.53,"STOP, DUDE, LOOK AT ME."
30,00:00:52.13,00:00:52.13,I'M WORRIED THAT HE'S GOING TO
31,00:00:52.90,00:00:52.90,KICK OVER THE KETTLE AT THE MOST
32,00:00:58.77,00:00:58.77,INOPPORTUNE TIME.
33,00:00:59.17,00:00:59.17,Jeff: WHEN THE LOVED ONES
34,00:01:01.63,00:01:01.63,"ARRIVED, BRANDON'S FATHER DID"
35,00:01:02.63,00:01:02.63,"IT, TOO."
36,00:01:03.00,00:01:03.00,YOU HAVE TO KEEP HIM UNDER
37,00:01:04.53,00:01:04.53,CONTROL.
38,00:01:04.70,00:01:04.70,BRANDON'S DAD CAME OUT HERE
39,00:01:06.07,00:01:06.07,AND TRIES TO BULLY ME INTO MAKE
40,00:01:08.50,00:01:08.50,SURE HIS SON GOES TO THE END AND
41,00:01:11.20,00:01:11.20,WINS $1 MILLION.
42,00:01:12.23,00:01:12.23,Jeff: WITH HER HEAD ON THE
43,00:01:13.27,00:01:13.27,"CHOPPING BLOCK, EDNA PULLED OUT"
44,00:01:15.17,00:01:15.17,ALL THE STOPS TO CHANGE THE VOTE
45,00:01:17.07,00:01:17.07,TO BRANDON.
46,00:01:18.27,00:01:18.27,I ASK YOU TO DESCRIBE WHAT
47,00:01:19.87,00:01:19.87,HONOR AND INTEGRITY IS.
48,00:01:20.97,00:01:20.97,Reporter: AND.
49,00:01:22.47,00:01:22.47,Jeff: AND ALBERT CONSIDERED
50,00:01:25.20,00:01:25.20,IT.
51,00:01:25.47,00:01:25.47,EDNA MAKES SOME GOOD POINTS.
52,00:01:27.73,00:01:27.73,"Jeff: AT TRIBAL COUNCIL,"
53,00:01:29.77,00:01:29.77,THEY HUNG TOGETHER.
54,00:01:30.97,00:01:30.97,"EDNA, THE TRIBE HAS SPOKEN."
55,00:01:32.63,00:01:32.63,NOW EDNA IS OFF TO REDEMPTION
56,00:01:34.43,00:01:34.43,ISLAND WHERE OZZY LIES IN WAIT.
57,00:01:36.07,00:01:36.07,"WELL, FROM THE BEGINNING, YOU"
58,00:01:37.17,00:01:37.17,SAID IT WOULD BE THE FIVE OF
59,00:01:38.83,00:01:38.83,YOU.
60,00:01:39.17,00:01:39.17,NOW WHAT?
61,00:01:54.47,00:01:54.47,WHOOO!
62,00:01:55.83,00:01:55.83,"GOOD WORK, GUYS."
63,00:01:56.73,00:01:56.73,"WE DID IT, MAN."
64,00:01:58.63,00:01:58.63,WE'VE BEEN TALKING ABOUT IT
65,00:01:59.87,00:01:59.87,SINCE DAY ONE.
66,00:02:00.97,00:02:00.97,"FINAL FIVE, IT'S A BEAUTIFUL"
67,00:02:02.63,00:02:02.63,FEELING.
68,00:02:02.70,00:02:02.70,JUST WALKING BACK INTO THE CAMP
69,00:02:04.20,00:02:04.20,WE COULD JUST FEEL FAZE THAT
70,00:02:05.67,00:02:05.67,CLOUD HAD LIFTED OFF OF US.
71,00:02:08.37,00:02:08.37,WE'RE ALL FEELING PRETTY GOOD.
72,00:02:10.07,00:02:10.07,WE DID WHAT WE SAID WE WERE
73,00:02:11.63,00:02:11.63,GOING TO DO.
74,00:02:12.07,00:02:12.07,WE KNOW WE CAN GO AT IT WITH
75,00:02:14.53,00:02:14.53,"HONOR, LOYALTY, AND INTEGRITY."
76,00:02:15.67,00:02:15.67,GET IN HERE!
77,00:02:19.40,00:02:19.40,THE MOST IMPORTANT THING FOR
78,00:02:21.23,00:02:21.23,US TO DO IS GIVE THANKS TO THE
79,00:02:23.03,00:02:23.03,PERSON WHO DID THIS FOR US.
80,00:02:25.00,00:02:25.00,LET ME PRAY.
81,00:02:26.50,00:02:26.50,IS THAT COOL?
82,00:02:28.27,00:02:28.27,"THIS DAY, THIS NIGHT-- WE"
83,00:02:30.63,00:02:30.63,KNEW THAT THIS DAY WOULD COME.
84,00:02:32.27,00:02:32.27,MORE STUFF IS GOING TO HIT THE
85,00:02:33.70,00:02:33.70,FAN.
86,00:02:33.87,00:02:33.87,WE KNOW THERE'S NO MORE LOYALTY.
87,00:02:35.33,00:02:35.33,WE KNOW IT'S EVERY CAT FOR
88,00:02:38.07,00:02:38.07,"HIMSELF, SO THE ALLIANCES PEOPLE"
89,00:02:39.40,00:02:39.40,"HAVE BUILT UP TO THIS POINT, THE"
90,00:02:41.27,00:02:41.27,"ALLIANCES WITHIN THE ALLIANCES,"
91,00:02:42.63,00:02:42.63,"SO-CALLED ARE, GOING TO BE"
92,00:02:44.07,00:02:44.07,REVEALED.
93,00:02:44.30,00:02:44.30,THE REAL GAME BEGINS TONIGHT.
94,00:02:49.17,00:02:49.17,SAY OZZY COMES BACK FROM
95,00:02:53.07,00:02:53.07,REDEMPTION.
96,00:02:53.67,00:02:53.67,BRANDON OR RICK?
97,00:02:54.23,00:02:54.23,PRETTY MUCH A TOSS-UP.
98,00:02:57.70,00:02:57.70,YOU'RE LUCKY YOU GOT THIS
99,00:02:59.63,00:02:59.63,FAR.
100,00:02:59.83,00:02:59.83,HE'S JUST GOT TO SACK UP AND NOT
101,00:03:02.13,00:03:02.13,LET OZZY WIN IMMUNITY IF HE
102,00:03:03.40,00:03:03.40,COMES IN.
103,00:03:05.43,00:03:05.43,I FEEL LIKE I HAVE A PRET
104,00:03:07.63,00:03:07.63,GOOD IDEA WHAT I WANT TO DO
105,00:03:08.90,00:03:08.90,WITHIN THIS FIVE.
106,00:03:10.07,00:03:10.07,I'M IN A GOOD POSITION TO PULL
107,00:03:11.27,00:03:11.27,OFF WHAT I THINK WILL BE THE
108,00:03:13.30,00:03:13.30,BIGGEST BLINDSIDE OF THE GAME SO
109,00:03:14.93,00:03:14.93,FAR.
110,00:03:15.10,00:03:15.10,IF ONLY SHE KNEW SHE'S NEXT.
111,00:03:16.77,00:03:16.77,SHE'S GOT NO IDEA IT'S COMING.
112,00:03:21.63,00:03:21.63,Captioning brought to you by
113,00:03:22.13,00:03:22.13,"Survivor Productions, CBS,"
114,00:03:45.60,00:03:45.60,HOW YOU FEELING?
115,00:03:47.10,00:03:47.10,FEELING ALL RIGHT.
116,00:03:47.97,00:03:47.97,I'M JUST-- MY HEAD WAS JUST
117,00:03:49.93,00:03:49.93,SPINNING LAST NIGHT TRYING TO
118,00:03:52.07,00:03:52.07,THINK OF STUFF.
119,00:03:53.80,00:03:53.80,YOU KNOW?
120,00:03:58.40,00:03:58.40,"SINCE EARLY ON IN THE GAME,"
121,00:03:59.77,00:03:59.77,I'VE BEEN PLANNING TO GO TO THE
122,00:04:02.37,00:04:02.37,"END WITH COACH AND SOPHIE, BUT"
123,00:04:03.73,00:04:03.73,"THE MORE AND MORE I LIKE AT IT,"
124,00:04:06.03,00:04:06.03,SOPHIE IS GETTING INCREASINGLY
125,00:04:07.97,00:04:07.97,DANGEROUS.
126,00:04:08.50,00:04:08.50,"SHE'S A VERY WELL-SPOKEN GIRL,"
127,00:04:11.13,00:04:11.13,VERY INTELLIGENT.
128,00:04:11.87,00:04:11.87,SHE'S STARTING TO BUILD A LITTLE
129,00:04:13.00,00:04:13.00,BIT OF A RESUME.
130,00:04:14.60,00:04:14.60,SHE HAS TWO IMMUNITY WINS UNDER
131,00:04:17.13,00:04:17.13,HER BELT AND I FRANKLY DON'T
132,00:04:19.87,00:04:19.87,KNOW IF I WANT TO SIT NEXT TO
133,00:04:21.47,00:04:21.47,HER AT THE END.
134,00:04:22.67,00:04:22.67,MY BEST STRATEGY IS ADAPT TO THE
135,00:04:24.53,00:04:24.53,PLAYERS I'M PLAYING WITH.
136,00:04:25.70,00:04:25.70,WHO AM I PLAYING WITH?
137,00:04:27.73,00:04:27.73,"I'VE GOT COACH, I'VE GOT"
138,00:04:29.37,00:04:29.37,"BRANDON, I'VE GOT RICK."
139,00:04:30.37,00:04:30.37,"A COUPLE MORE DAYS, MAN."
140,00:04:32.37,00:04:32.37,SIX DAYS.
141,00:04:33.07,00:04:33.07,WE CAN STAND ON OUR HEAD IN THE
142,00:04:34.53,00:04:34.53,WATER AND BLOW BUBBLES FOR SIX
143,00:04:35.87,00:04:35.87,DAYS.
144,00:04:36.00,00:04:36.00,I JUST WANT TO TELL YOU RIGHT
145,00:04:37.43,00:04:37.43,"NOW, I KNOW WE HAVEN'T HAD A"
146,00:04:38.80,00:04:38.80,"CHANCE TO TALK, MAN, BUT I'M"
147,00:04:40.40,00:04:40.40,"STILL ON PACE, MAN."
148,00:04:41.90,00:04:41.90,"THE WAY I SEE IT, MAN, YOU AND I"
149,00:04:44.70,00:04:44.70,ARE STILL GOING TO THE END.
150,00:04:45.57,00:04:45.57,I HAVEN'T CHANGEANYTHING.
151,00:04:46.83,00:04:46.83,"WE JUST HAVE TO BE CAREFUL,"
152,00:04:48.20,00:04:48.20,MAKE SURE WE MAKE SMART
153,00:04:49.60,00:04:49.60,DECISIONS HERE IN THE NEXT
154,00:04:50.47,00:04:50.47,COUPLE OF VOTES.
155,00:04:51.17,00:04:51.17,IF I WERE PICKING PEOPLE OFF
156,00:04:53.53,00:04:53.53,"BASED ON HOW MUCH I LIKE THEM,"
157,00:04:54.90,00:04:54.90,RICK WOULD BE THE FIRST PERSON I
158,00:04:56.73,00:04:56.73,GET RID OF.
159,00:04:59.10,00:04:59.10,OF.
160,00:04:59.40,00:04:59.40,BUT THE THING ABOUT RICK IS I
161,00:05:00.70,00:05:00.70,THINK HE'S THE LEAST DANGEROUS
162,00:05:02.07,00:05:02.07,PERSON LEFT IN THE GAME.
163,00:05:03.00,00:05:03.00,ARE YOU READY?
164,00:05:04.73,00:05:04.73,HE HASN'T DONE ANYTHING
165,00:05:06.07,00:05:06.07,STRATEGICALLY AT ALL.
166,00:05:07.17,00:05:07.17,HE HASN'T DONE ANYTHING IN A
167,00:05:08.87,00:05:08.87,CHALLENGE.
168,00:05:09.10,00:05:09.10,HE'S GOT NO PRAYER AT ALL.
169,00:05:10.20,00:05:10.20,"SO THE MORE I THINK ABOUT IT,"
170,00:05:11.67,00:05:11.67,"MAN, IF I HAD MY CHOICE, I'D GO"
171,00:05:13.70,00:05:13.70,TO THE FINAL THREE WITH COACH
172,00:05:15.37,00:05:15.37,AND RICK.
173,00:05:16.70,00:05:16.70,BECAUSE COACH HAS BEEN THE CULT
174,00:05:19.10,00:05:19.10,"LEADER, RICK HAS BEEN THE"
175,00:05:20.40,00:05:20.40,FOLLOWER.
176,00:05:20.57,00:05:20.57,I'M KIND OF A LITTLE BIT OF A
177,00:05:21.67,00:05:21.67,ROGUE IN THE MIDDLE.
178,00:05:22.43,00:05:22.43,AND I FEEL LIKE I'VE BEEN THE
179,00:05:24.73,00:05:24.73,MOST AGGRESSIVE PLAYER TRYING TO
180,00:05:26.93,00:05:26.93,GARNER JURY VOTES AND POSITION
181,00:05:27.80,00:05:27.80,MYSELF TO WIN $1 MILLION AND GO
182,00:05:31.40,00:05:31.40,HOME THE SOLE SURVIVOR.
183,00:05:43.53,00:05:43.53,Jeff: WE'LL NOW BRING IN
184,00:05:44.83,00:05:44.83,THE COMPETITORS FOR TODAY'S
185,00:05:46.67,00:05:46.67,DUEL.
186,00:05:47.20,00:05:47.20,OZZY WILL BATTLE AGAINST EDNA.
187,00:05:55.43,00:05:55.43,WELCOME TO REDEMPTION ISLAND
188,00:05:56.87,00:05:56.87,ARENA.
189,00:05:57.03,00:05:57.03,YOU GUYS READY TO GET TO TODAY'S
190,00:05:59.07,00:05:59.07,DUEL?
191,00:05:59.23,00:05:59.23,YES.
192,00:05:59.83,00:05:59.83,"Jeff: FOR TODAY'S DUEL, YOU"
193,00:06:01.97,00:06:01.97,WILL RACE TO COMPLETE A SLIDE
194,00:06:03.80,00:06:03.80,"PUZZLE, RELEASING A HATCHET."
195,00:06:05.67,00:06:05.67,YOU'LL USE THE HATCHET TO CHOP A
196,00:06:08.67,00:06:08.67,"ROPE, RELEASING A BAG OF PUZZLE"
197,00:06:10.50,00:06:10.50,CUBES.
198,00:06:10.83,00:06:10.83,YOU MUST THEN STACK THE CUBES SO
199,00:06:12.80,00:06:12.80,THERE ARE NO REPEATING COLORS ON
200,00:06:14.23,00:06:14.23,ANY SIDE.
201,00:06:14.83,00:06:14.83,FIRST PERSON TO GET IT RIGHT
202,00:06:16.20,00:06:16.20,STAYS ALIVE IN THIS GAME IT AND AND
203,00:06:21.97,00:06:21.97,CONTINUES THEIR QUEST FOR THE
204,00:06:23.07,00:06:23.07,MONEY.
205,00:06:23.50,00:06:23.50,"LOSER, OUT FOR GOOD, BECOMES THE"
206,00:06:25.50,00:06:25.50,SIXTH MEMBER OF THE JURY.
207,00:06:26.60,00:06:26.60,STAKES HAVE NEVER BEEN HIGHER
208,00:06:27.80,00:06:27.80,FOR EITHER ONE OF YOU.
209,00:06:28.93,00:06:28.93,THIS IS IT.
210,00:06:30.17,00:06:30.17,ONE SHOT.
211,00:06:31.13,00:06:31.13,TAKE YOUR SPOTS.
212,00:06:38.07,00:06:38.07,"ALL RIGHT, HERE WE GO."
213,00:06:40.37,00:06:40.37,"WINNER STAYS ALIVE, LOSER"
214,00:06:42.97,00:06:42.97,BECOMES THE SIXTH MEMBER OF THE
215,00:06:44.27,00:06:44.27,JURY.
216,00:06:44.67,00:06:44.67,SURVIVORS READY?
217,00:06:49.43,00:06:49.43,GO.
218,00:06:51.50,00:06:51.50,FIRST PHASE IS A SLIDE PUZZLE.
219,00:06:54.53,00:06:54.53,"YOUR GOAL, SLIDE THESE PIECES"
220,00:06:56.50,00:06:56.50,AROUND SO THAT THE LARGEST PIECE
221,00:06:59.43,00:06:59.43,CONTAINING THE HATCHET WILL
222,00:07:00.73,00:07:00.73,SLIDE OUT OF THE FRONT.
223,00:07:05.87,00:07:05.87,OZZY HAS HIS HATCHET.
224,00:07:07.57,00:07:07.57,EDNA STILL WORKING ON IT.
225,00:07:08.93,00:07:08.93,OZZY CHOPS THE ROPE AND RELEASES
226,00:07:10.47,00:07:10.47,"HIS SECOND PART OF THE PUZZLE,"
227,00:07:13.17,00:07:13.17,THE PUZZLE CUBES.
228,00:07:14.97,00:07:14.97,EDNA STILL WORKING ON THE SLIDE
229,00:07:16.47,00:07:16.47,PORTION.
230,00:07:16.63,00:07:16.63,DON'T GIVE UP.
231,00:07:17.83,00:07:17.83,THAT LAST PUZZLE IS VERY
232,00:07:19.20,00:07:19.20,"COMPLICATED, TOO."
233,00:07:20.20,00:07:20.20,OZZY HAS HIS FOUR CUBES.
234,00:07:22.40,00:07:22.40,HE'S WORKING ON THE SECOND AND
235,00:07:23.43,00:07:23.43,FINAL PART OF THIS DUEL.
236,00:07:26.50,00:07:26.50,OZZY WITH A BIT OF A LEAD NOW.
237,00:07:31.37,00:07:31.37,SHOOT.
238,00:07:32.10,00:07:32.10,Jeff: EDNA STUCK.
239,00:07:34.20,00:07:34.20,CANNOT GET THROUGH THE SLIDE
240,00:07:35.63,00:07:35.63,PUZZLE.
241,00:07:35.80,00:07:35.80,YOU GOTTA GET TWO SMALL
242,00:07:37.87,00:07:37.87,SQUARES AT THE BOTTOM.
243,00:07:38.97,00:07:38.97,"TWO SMALL SQUARES AT THE BOTTOM,"
244,00:07:40.67,00:07:40.67,TWO SMALL SQUARES AT THE TOP.
245,00:07:41.57,00:07:41.57,THERE YOU GO.
246,00:07:42.37,00:07:42.37,Jeff: EDNA GETTING A LOT OF
247,00:07:43.80,00:07:43.80,HELP FROM THE SAME PEOPLE WHO
248,00:07:44.97,00:07:44.97,VOTED HER OUT OF THIS GAME.
249,00:07:49.57,00:07:49.57,MOVE THE MACHETE DOWN.
250,00:07:50.83,00:07:50.83,THERE YOU GO.
251,00:07:52.77,00:07:52.77,Jeff: EDNA RELEASES HER
252,00:07:54.37,00:07:54.37,HATCHET.
253,00:07:54.50,00:07:54.50,"GOOD JOB, EDNA."
254,00:07:56.43,00:07:56.43,"Jeff: EDNA, ONE CHOP, DROPS"
255,00:07:58.40,00:07:58.40,HER PUZZLE CUBES.
256,00:08:00.23,00:08:00.23,EDNA NOW IN THIS.
257,00:08:01.27,00:08:01.27,"GET THEM OUT, GET WORKING."
258,00:08:02.87,00:08:02.87,"GOOD WORK, EDNA."
259,00:08:04.50,00:08:04.50,YOU GOT IT.
260,00:08:06.43,00:08:06.43,CONCENTRATE.
261,00:08:06.67,00:08:06.67,"Jeff: EDNA'S BACK IN IT,"
262,00:08:08.40,00:08:08.40,NOW.
263,00:08:08.53,00:08:08.53,"START SOLVING, GIRL."
264,00:08:11.70,00:08:11.70,"OZZY TAKING HIS TIME, NOT"
265,00:08:13.37,00:08:13.37,PANICKING IN THIS DUEL.
266,00:08:14.90,00:08:14.90,KNOWS HE'S HAD A LONG HEAD
267,00:08:17.90,00:08:17.90,START.
268,00:08:18.37,00:08:18.37,EACH FEATERICAL SIDE MUST HAVE
269,00:08:20.50,00:08:20.50,"FOUR DIFFERENT COLORS, RED,"
270,00:08:23.37,00:08:23.37,"GREEN,IEL OH, BLUE."
271,00:08:24.07,00:08:24.07,IF YOU SEE A REPEATING COLOR ON
272,00:08:26.67,00:08:26.67,"ANY SIDE, YOU KNOW IT'S NOT"
273,00:08:28.23,00:08:28.23,RIGHT.
274,00:08:29.67,00:08:29.67,"THAT ONE HAS A LOT OF REDS,"
275,00:08:33.73,00:08:33.73,EDNA.
276,00:08:34.07,00:08:34.07,THERE'S A GREEN ONE.
277,00:08:35.17,00:08:35.17,GREEN.
278,00:08:35.43,00:08:35.43,Jeff: EDNA WITH A HUGE
279,00:08:36.77,00:08:36.77,ADVANTAGE BECAUSE SHE'S GOT FIVE
280,00:08:37.87,00:08:37.87,PEOPLE BEHIND HER WORKING THIS
281,00:08:39.10,00:08:39.10,PUZZLE WITH HER.
282,00:08:40.27,00:08:40.27,FLIP IT OVER.
283,00:08:41.97,00:08:41.97,"KEEP FLIPPING, KEEP FLIPPING."
284,00:08:43.23,00:08:43.23,Jeff: AN ENTIRE TRIBE
285,00:08:44.43,00:08:44.43,"WORKING ON THIS DUEL, TAKING ON"
286,00:08:47.10,00:08:47.10,OZZY ALONE.
287,00:08:47.73,00:08:47.73,SEE THAT ONE HAS MOSTLY BLUE.
288,00:08:49.93,00:08:49.93,SOME ARE MOSTLY YELLOW.
289,00:08:51.10,00:08:51.10,Jeff: THE SAME PEOPLE THAT
290,00:08:52.37,00:08:52.37,VOTED AETNA OUT SO DESPERATELY
291,00:08:54.50,00:08:54.50,DON'T WANT OZZY BACK IN THAT
292,00:08:56.37,00:08:56.37,THEY'RE NOW HELPING HER.
293,00:08:58.57,00:08:58.57,OZZY TRULY IS ALONE IN THIS
294,00:09:00.80,00:09:00.80,GAME.
295,00:09:01.63,00:09:01.63,THIS WILL BE A MAJOR UNSET IF
296,00:09:05.93,00:09:05.93,EDNA DEFEATED OZZY.
297,00:09:09.43,00:09:09.43,EDNA TRYING TO SOLVE IT OUTSIDE
298,00:09:11.57,00:09:11.57,OF THE FRAME.
299,00:09:12.90,00:09:12.90,THAT'S A GOOD IDEA.
300,00:09:14.00,00:09:14.00,DO IT THERE FIRST.
301,00:09:27.37,00:09:27.37,Jeff: EDNA OUT OF NOWHERE
302,00:09:28.93,00:09:28.93,THINKS SHE MAY HAVE IT.
303,00:09:30.03,00:09:30.03,NOW OZZY IS STEPPING IT UP.
304,00:09:37.13,00:09:37.13,JEFF?
305,00:09:40.27,00:09:40.27,Jeff: TWO REDS.
306,00:09:43.20,00:09:43.20,NO!
307,00:09:51.90,00:09:51.90,JEFF?
308,00:09:54.10,00:09:54.10,Jeff: OZZY THINKS HE HAS
309,00:09:55.83,00:09:55.83,IT.
310,00:09:55.97,00:09:55.97,LET'S CHECK.
311,00:09:57.10,00:09:57.10,THIS SIDE IS GOOD.
312,00:09:58.53,00:09:58.53,THIS SIDE'S GOOD.
313,00:09:59.90,00:09:59.90,THIS SIDE IS GOOD.
314,00:10:01.37,00:10:01.37,THIS SIDE IS GOOD.
315,00:10:02.57,00:10:02.57,OZZY WINS THE DUEL AND STAYS
316,00:10:05.37,00:10:05.37,ALIVE.
317,00:10:09.37,00:10:09.37,OH!
318,00:10:15.83,00:10:15.83,"Jeff: EDNA, 33 DAYS YOU"
319,00:10:18.43,00:10:18.43,LASTED OUT HERE.
320,00:10:19.53,00:10:19.53,WHAT WILL YOU TAKE BACK TO YOUR
321,00:10:21.77,00:10:21.77,FAMILY?
322,00:10:21.93,00:10:21.93,GOSK.
323,00:10:23.47,00:10:23.47,FOR ME HAVING JUST BEEN OUT HERE
324,00:10:25.20,00:10:25.20,SHOWED THAT I CAN DO SOMETHING
325,00:10:26.37,00:10:26.37,AND I CAN SURVIVE THE EXTREMES
326,00:10:28.80,00:10:28.80,OF ELEMENTS.
327,00:10:29.57,00:10:29.57,I THINK THAT IS SOMETHING I CAN
328,00:10:30.50,00:10:30.50,SHOW TO THEM.
329,00:10:31.23,00:10:31.23,"Jeff: EDNA, YOUR ADVENTURE"
330,00:10:32.63,00:10:32.63,HAS COME TO AN END.
331,00:10:33.63,00:10:33.63,IT IS TIME FOR YOU TO GO.
332,00:10:34.90,00:10:34.90,"ED, YOU'RE AN AMAZING WOMAN."
333,00:10:37.10,00:10:37.10,"GOOD JOB, EDNA."
334,00:10:38.80,00:10:38.80,"GOOD-BYE, EDNA."
335,00:10:40.37,00:10:40.37,I SMELL SO BAD THAT I'M GOING
336,00:10:42.53,00:10:42.53,TO BE HAPPY TO BURN IT.
337,00:10:45.17,00:10:45.17,"BYE, GUYS."
338,00:10:54.47,00:10:54.47,"Jeff: OZZY, YOU STAY ALIVE"
339,00:10:56.03,00:10:56.03,"IN THIS GAME, AND WITH EVERY WIN"
340,00:10:57.87,00:10:57.87,"OF A DUEL, YOU GET ONE STEP"
341,00:10:59.73,00:10:59.73,CLOSER TO GETTING BACK IN THE
342,00:11:01.43,00:11:01.43,GAME.
343,00:11:01.70,00:11:01.70,"GRAB YOUR STUFF, HEAD BACK TO"
344,00:11:02.87,00:11:02.87,REDEMPTION ISLAND.
345,00:11:04.40,00:11:04.40,AWAIT YOUR NEXT DUEL.
346,00:11:06.37,00:11:06.37,SEE YOU GUYS
347,00:11:07.60,00:11:07.60,( APPLAUSE )
348,00:11:24.03,00:11:24.03,"I FEEL IT, MAN."
349,00:11:26.00,00:11:26.00,I'M FEELING REALLY DRAINED.
350,00:11:29.37,00:11:29.37,"WHEN WE FIRST GOT TOGETHER,"
351,00:11:30.97,00:11:30.97,"THE FIVE OF US, WAY BACK WHEN ON"
352,00:11:35.63,00:11:35.63,"UPOLU BEACH, WE TALKED ABOUT"
353,00:11:37.23,00:11:37.23,HONOR AND INTEGRITY ALL THE WAY.
354,00:11:38.27,00:11:38.27,THE INTERESTING THING ABOUT THE
355,00:11:39.23,00:11:39.23,"HONOR AND INTEGRITY CARD IS, IN"
356,00:11:40.47,00:11:40.47,"THE GAME OF ""SURVIVOR"" I DO NOT"
357,00:11:42.83,00:11:42.83,CARE A SINGLE THING ABOUT HONOR
358,00:11:44.20,00:11:44.20,AND INTEGRITY.
359,00:11:44.57,00:11:44.57,I REALLY DON'T.
360,00:11:45.20,00:11:45.20,DO YOU REALIZE THAT NOW THAT
361,00:11:47.77,00:11:47.77,"WE HAVE FIVE PEOPLE HERE,"
362,00:11:49.53,00:11:49.53,SOMEONE'S GOING HOME TOMORROW?
363,00:11:53.73,00:11:53.73,IT'S IMPOSSIBLE FOR US NOT TO
364,00:11:55.43,00:11:55.43,MAKE THE FINAL THREE.
365,00:11:56.33,00:11:56.33,SO BETWEEN AND YOU ME AND
366,00:11:58.37,00:11:58.37,COACH.
367,00:11:58.53,00:11:58.53,"OH, YEAH."
368,00:11:59.73,00:11:59.73,BRANDON REALLY THINKS NO
369,00:12:01.33,00:12:01.33,MATTER WHAT HAPPENS I'M NEVER
370,00:12:02.20,00:12:02.20,"GOING TO WRITE HIS NAME DOWN,"
371,00:12:04.20,00:12:04.20,AND I'VE BEEN PLAYING THAT ROLE
372,00:12:06.03,00:12:06.03,STRATEGICALLY BECAUSE I HAVE TO
373,00:12:07.97,00:12:07.97,KEEP BRANDON TO MAINTAIN A
374,00:12:10.23,00:12:10.23,GUARANTEED NUMBERS LOCK IN THIS
375,00:12:11.53,00:12:11.53,GAME.
376,00:12:11.70,00:12:11.70,"THAT MEANS WE HAVE TO BEAT OZZY,"
377,00:12:13.37,00:12:13.37,"MAN, AND HE'S GOT SO MANY MORE"
378,00:12:15.20,00:12:15.20,RESOURCES THAN WE DO.
379,00:12:16.43,00:12:16.43,THAT'S THE ONLY THING THAT COULD
380,00:12:18.47,00:12:18.47,SPOIL OUR PLAN RIGHT NOW.
381,00:12:19.63,00:12:19.63,RIGHT NOW I THINK OUR PLAN IS
382,00:12:22.27,00:12:22.27,SET.
383,00:12:22.43,00:12:22.43,WE TAKE OUT SOPHIE NEXT.
384,00:12:25.07,00:12:25.07,WE'VE GOT TO WIN THE NEXT THREE
385,00:12:27.57,00:12:27.57,CHALLENGES.
386,00:12:28.20,00:12:28.20,"ONE, SO WE CAN SEND SOPHIE OVER"
387,00:12:30.27,00:12:30.27,THERE.
388,00:12:30.43,00:12:30.43,"TWO, SO WE CAN KEEP OZZY OR HER"
389,00:12:33.07,00:12:33.07,FROM MAKING IT TO THE FINAL
390,00:12:34.90,00:12:34.90,THREE.
391,00:12:35.03,00:12:35.03,"THIS IS FATE, MAN."
392,00:12:36.43,00:12:36.43,THIS IS-- WE'RE IN GOD'S HANDS.
393,00:12:38.30,00:12:38.30,"IT'S GOING TO BE OKAY, BRO."
394,00:12:40.87,00:12:40.87,THE ONLY THING THAT COULD SPOIL
395,00:12:42.37,00:12:42.37,IT RIGHT NOW IS US.
396,00:12:43.80,00:12:43.80,"BE STRONG, BROTHER."
397,00:12:45.37,00:12:45.37,"I MADE AN AGREEMENT WITH ALBERT,"
398,00:12:46.73,00:12:46.73,AND I KNOW THAT TO BE 100%.
399,00:12:49.00,00:12:49.00,"AND AS LONG AS ME, COACH, AND"
400,00:12:50.37,00:12:50.37,"ALBERT STAY THE COURSE, VOTE OFF"
401,00:12:53.07,00:12:53.07,"SOPHIE, WE'LL DEFINITELY BE IN"
402,00:12:54.83,00:12:54.83,"CONTROL THEN FOR SURE, NO MATTER"
403,00:12:56.37,00:12:56.37,WHAT.
404,00:12:56.53,00:12:56.53,"THE WAY I SEE IT, OZZY, HE'S"
405,00:12:58.63,00:12:58.63,THE MOST DANGEROUS PLAYER.
406,00:13:01.03,00:13:01.03,EVERY SINGLE PERSON THAT GOES
407,00:13:02.40,00:13:02.40,"THROUGH REDEMPTION, HE GETS THE"
408,00:13:04.23,00:13:04.23,LAST SAY WITH EVERY SINGLE JURY
409,00:13:07.73,00:13:07.73,MEMBER.
410,00:13:07.93,00:13:07.93,OZZY GETS TO FEED THEM.
411,00:13:09.03,00:13:09.03,HE COMFORTS THEM AFTER THEY'VE
412,00:13:10.20,00:13:10.20,BEEN VOTED OUT.
413,00:13:11.30,00:13:11.30,EVERY SINGLE JURY MEMBER HAS
414,00:13:12.73,00:13:12.73,"GONE THROUGH, LIKE, ""OZZY'S"
415,00:13:15.43,00:13:15.43,"PLEASURE DOME"" ON THE WAY OUT."
416,00:13:16.97,00:13:16.97,"THE WAY I SEE IT, WE HAVE TO"
417,00:13:19.03,00:13:19.03,SEND BRANDON TO REDEMPTION.
418,00:13:21.07,00:13:21.07,WE HAVE TO PUT THE TWO MOST
419,00:13:23.77,00:13:23.77,DANGEROUS PLAYERS IN THE GAME
420,00:13:25.20,00:13:25.20,TOGETHER AND GET ONE OF THEM OU
421,00:13:28.10,00:13:28.10,OUT.
422,00:13:28.27,00:13:28.27,I THINK COACH AND I ARE REALLY
423,00:13:29.93,00:13:29.93,ON THE SAME PAGE.
424,00:13:31.30,00:13:31.30,WE BOTH RECOGNIZE THAT BRANDON
425,00:13:36.20,00:13:36.20,HAS DONE THINGS IN THE PAST BUT
426,00:13:37.23,00:13:37.23,I THINK YOU HAVE SEEN A CHANGE
427,00:13:38.53,00:13:38.53,IN BRANDON SINCE THE MERGE.
428,00:13:42.67,00:13:42.67,"SUPERFICIALLY, HE IS THE MOST"
429,00:13:44.27,00:13:44.27,"TRUSTWORTHY, THE MOST GODLY MAN"
430,00:13:45.73,00:13:45.73,OUT HERE AND THAT'S NOT SOMEBODY
431,00:13:47.57,00:13:47.57,I WOULD WANT TO GO TO THE FINAL
432,00:13:48.83,00:13:48.83,THREE WITH.
433,00:13:49.80,00:13:49.80,RICK.
434,00:13:49.97,00:13:49.97,ARE YOU ON ABOARD WITH BRANDON
435,00:13:52.67,00:13:52.67,NEXT?
436,00:13:55.20,00:13:55.20,"TWO PEOPLE, OZZY AND BRANDON,"
437,00:13:56.67,00:13:56.67,AND WE THOUGHT PUT THEM
438,00:13:59.53,00:13:59.53,TOGETHER.
439,00:13:59.73,00:13:59.73,WE HAVE TO PUT THEM TOGETHER
440,00:14:01.23,00:14:01.23,TO ELIMINATE THEM.
441,00:14:01.73,00:14:01.73,ARE YOU DOWN WITH THAT?
442,00:14:02.50,00:14:02.50,I'M DOWN.
443,00:14:03.37,00:14:03.37,"WHEN I TELL YOU I WILL, I WILL."
444,00:14:05.57,00:14:05.57,"OH, ABSOLUTELY."
445,00:14:06.20,00:14:06.20,I KNOW THAT.
446,00:14:08.93,00:14:08.93,I WANT TO TALK TO YOU BECAUSE
447,00:14:11.00,00:14:11.00,I KNOW THAT YOU THINK SOPHIE'S
448,00:14:13.43,00:14:13.43,NOT A THREAT.
449,00:14:14.37,00:14:14.37,"I'M TELLING YOU RIGHT NOW, BRO,"
450,00:14:16.57,00:14:16.57,I'VE BEEN WATCHING WHAT SHE SAYS
451,00:14:18.03,00:14:18.03,AT THESE TRIBALS.
452,00:14:19.53,00:14:19.53,TO ME SHE'S A THREAT.
453,00:14:21.77,00:14:21.77,I DISAGREE WITH THAT GOOP I
454,00:14:25.07,00:14:25.07,RIDE RATHER TO GO TO THE END
455,00:14:25.93,00:14:25.93,WITH BRANDON THAN SOPHIE.
456,00:14:27.83,00:14:27.83,I'M PLEADING WITH YOU TO BELIEVE
457,00:14:29.40,00:14:29.40,ME THAT SOVIETEF IS A BIGGER
458,00:14:31.10,00:14:31.10,THREAT THAN BRANDON AT THE END
459,00:14:32.37,00:14:32.37,BECAUSE THEY'RE NOT GOING TO
460,00:14:33.37,00:14:33.37,RESPECT THE WAY YOU PLAYED THE
461,00:14:35.50,00:14:35.50,GAME.
462,00:14:35.67,00:14:35.67,AS THE GROUP FINALLY STARTS
463,00:14:37.03,00:14:37.03,"TO SCRAMBLE, THIS IS THE FIRST"
464,00:14:38.53,00:14:38.53,TIME WE'VE REALLY HAD TO TURN ON
465,00:14:39.90,00:14:39.90,EACH OTHER AND IT'S A VERY
466,00:14:41.53,00:14:41.53,UNSETTLING FEELING.
467,00:14:45.60,00:14:45.60,HE JUST BLOWS WHICHEVER WAY THE
468,00:14:48.20,00:14:48.20,WIND BLOWS.
469,00:14:49.33,00:14:49.33,IT'S DISHEARTENING.
470,00:14:50.20,00:14:50.20,I'VE BEEN IN A VERY TIGHT
471,00:14:51.37,00:14:51.37,ALLIANCE WITH SOPHIE SINCE I
472,00:14:52.80,00:14:52.80,FOUND THE IDOL.
473,00:14:53.73,00:14:53.73,I TRIED TO REASON WITH ALBERT
474,00:14:55.07,00:14:55.07,BUT HE'S NOT HAVING ANY OF IT.
475,00:14:56.60,00:14:56.60,HE'S GOT A THING ABOUT SOPHIE.
476,00:14:58.67,00:14:58.67,I THINK IT'S BECAUSE SOVIET
477,00:15:00.53,00:15:00.53,SESMARTER THAN ALBERT.
478,00:15:02.03,00:15:02.03,THAT'S THE REASON ALBERT IS
479,00:15:03.53,00:15:03.53,INTIMIDATED BY SOPHIE.
480,00:15:04.83,00:15:04.83,HE'S HEARING HER AT TRIBAL.
481,00:15:06.20,00:15:06.20,SHE'S SPEAKING UP.
482,00:15:07.47,00:15:07.47,SHE'S NOT THIS QUIET LITTLE
483,00:15:09.30,00:15:09.30,MOUSE THAT HE THOUGHT SHE WAS
484,00:15:10.77,00:15:10.77,AND NOW HE'S THINKING I HAVE TO
485,00:15:12.23,00:15:12.23,GET RID OF SOPHIE.
486,00:15:13.50,00:15:13.50,"I'M THINKING MORE CLEARLY, DUDE,"
487,00:15:15.50,00:15:15.50,THAN I HAVE THOUGHT IN THE GAME.
488,00:15:17.83,00:15:17.83,BRANDON WILL WIN.
489,00:15:18.67,00:15:18.67,WHEN IT GETS DOWN TO THE END--
490,00:15:21.37,00:15:21.37,"THAT'S A TERRIBLE ARGUMENT, MAN."
491,00:15:22.70,00:15:22.70,IT REALLY IS.
492,00:15:24.00,00:15:24.00,"YOU REALLY DON'T UNDERSTAND IT,"
493,00:15:27.03,00:15:27.03,MAN.
494,00:15:27.40,00:15:27.40,"I'M JUST TELLING YOU, MAN."
495,00:15:28.67,00:15:28.67,YOU DONT UNDERSTAND-- YOU DON'T
496,00:15:30.53,00:15:30.53,UNDERSTAND HOW THE JURY WORKS.
497,00:15:32.07,00:15:32.07,IT'S A TOTALLY DIFFERENT ANIMAL.
498,00:15:36.20,00:15:36.20,TOTALLY DIFFERENT ANIMAL.
499,00:15:38.07,00:15:38.07,WHAT'S UP?
500,00:15:39.43,00:15:39.43,WE'RE JUST TALKING ABOUT JURY
501,00:15:41.37,00:15:41.37,TRISTATE AND STUFF LIKE THAT.
