,begin,end,subtitles_text
347,00:24:17.77,00:24:17.77,"ARTIS, JEFF, AND CARTER.ONE OF YOU WILL BE WEARING IT"
348,00:24:23.13,00:24:23.13,SHORTLY.THE OTHER TWO WILL BE GOING TO
349,00:24:25.33,00:24:25.33,TRIBAL COUNCIL EMPTY-HANDED.THAT A WAY TO DIG.
350,00:24:28.80,00:24:28.80,">> YEAH!>> Jeff: ARTIS, WARRIOR."
351,00:24:34.30,00:24:34.30,">> YOU GUYS ARE DOING GREAT.>> NICE TRY, BUDDY."
352,00:24:58.17,00:24:58.17,>> Jeff: ARTIS IS OUT OF THECHALLENGE AND WE ARE DOWN TO
353,00:25:01.63,00:25:01.63,"TWO, JEFF AND CARTER, SIDE BYSIDE."
354,00:25:04.10,00:25:04.10,">> WOW, KANSAS AND TEXAS, SIDEBY SIDE."
355,00:25:08.03,00:25:08.03,>> Jeff: JEFF INCHES HIS BUCKBACK UP.
356,00:25:10.23,00:25:10.23,"ALMOST LIKE HE'S SHOWING CARTER,""LOOK WHO YOU'RE DEALING WITH,"
357,00:25:16.00,00:25:16.00,"YOUNG 'UN."">> COME ON, YOUNG BUCK."
358,00:25:19.93,00:25:19.93,>> Jeff: AND NO SOONER SAIDTHAT THAN CARTER EVENS IT OUT.
359,00:25:23.90,00:25:23.90,">> GOOD JOB, CARTER.YOU GUYS ARE AMAZING."
360,00:25:48.83,00:25:48.83,>> I SAID THAT'S FINE.>> IT'S UP TO YOU.
361,00:25:54.03,00:25:54.03,">> Jeff: HOW'S IT GOING DOWNHERE, JEFF AND CARTER."
362,00:25:57.07,00:25:57.07,>> HAVING THE NECKLACE ONTONIGHT WOULD BE SWEET.
363,00:25:59.97,00:25:59.97,"AND, YEAH, I JUST WANT TO WIN.>> Jeff: AND JUST LIKE THAT,"
364,00:26:14.10,00:26:14.10,JEFF DROPS OUT.CARTER WINS INDIVIDUAL IMMUNITY.
365,00:26:17.47,00:26:17.47,">> GO, CARTER!>> Jeff: CARTER AND DENISE"
366,00:26:20.43,00:26:20.43,BOTH WILL HAVE IMMUNITY ATTONIGHT'S TRIBAL COUNCIL.
367,00:26:22.60,00:26:22.60,">> JEFF, I KNOW YOU COULD HAVEKEPT GOING."
368,00:26:24.77,00:26:24.77,>> THAT WAS WAR.THAT'S WHAT WE'RE HERE FOR.
369,00:26:27.60,00:26:27.60,">> Jeff: DENISE, COME ON OVER.( APPLAUSE )"
370,00:26:34.17,00:26:34.17,>> THAT'S THE FIRST TIME SHE'SHAD IMMUNITY.
371,00:26:36.70,00:26:36.70,>> IT MIGHT BE HEAVIER THAN HER.>> OH!
372,00:26:39.30,00:26:39.30,">> Jeff: DENISE, SAFE ATTONIGHT'S TRIBAL COUNCIL."
373,00:26:42.30,00:26:42.30,"SLIDE RIGHT OVER HERE.CARTER, COME ON OVER."
374,00:26:46.73,00:26:46.73,"( APPLAUSE )>> GO, CARTER!"
375,00:26:50.90,00:26:50.90,">> Jeff: CARTER, SAFE ATTONIGHT'S TRIBAL COUNCIL."
376,00:26:54.30,00:26:54.30,"AS FOR THE REST OF YOU, TONIGHTYOUR SHOT AT THE MILLION DOLLARS"
377,00:26:58.37,00:26:58.37,WILL COME TO AN END.GRAB YOUR STUFF.
378,00:27:01.70,00:27:01.70,HEAD BACK TO CAMP.SEE YOU AT TRIBAL.
379,00:27:04.00,00:27:04.00,>> I'M ACSTATIC THAT PEB PENNERAND R.C. DIDN'T EVEN COME CLOSE
380,00:27:08.20,00:27:08.20,TO WINNING IMMUNITY BECAUSEWE'RE GOING TO SPLIT THE VOTE
381,00:27:11.23,00:27:11.23,"BETWEEN PENNER AND R.C., AND IFPENNER PLAYS THE IDOL, R.C. GOES"
382,00:27:14.97,00:27:14.97,"HOME.IF PENNER DOESN'T PLAY THE IDOL,"
383,00:27:16.93,00:27:16.93,HE'LL GO HOME WITH THE IDOL.SO FAR.
384,00:27:50.70,00:27:50.70,"NO, I DIDN'T WIN IMMUNITY, BUTWE SORT OF HAVE THIS VERY COOR"
385,00:27:54.40,00:27:54.40,"SIX IN PLACE RIGHT NOW.ME AND MIKE ARE SOLID, AND WE"
386,00:27:57.43,00:27:57.43,ARE DEFINITELY WITH KALABAW.WITH US SIX WE ARE IN THE
387,00:28:01.67,00:28:01.67,MAJORITY.>> I NEVER HAVE EVER FELT
388,00:28:09.67,00:28:09.67,"THREATENED BEFORE, AND TONIGHT,RETURNING PLAYERS ARE A MAJOR"
389,00:28:15.83,00:28:15.83,"THREAT.LIKE, MY REPUTATION IS PRETTY"
390,00:28:18.47,00:28:18.47,COMPETITIVE.MY REPUTATION ISN'T BEING LOYAL
391,00:28:21.07,00:28:21.07,TO A TRIBE THAT HASN'T BEENLOYAL TO ME.
392,00:28:23.87,00:28:23.87,THERE ISN'T ANYBODY THAT WOULDTHINK THAT I WOULD GO DOWN
393,00:28:25.93,00:28:25.93,WITHOUT A FIGHT.I CAN'T PLAY THE GAME WITH THEM.
394,00:28:48.80,00:28:48.80,>> YEAH.BIGGEST HANG-UP I HAVE OF ALL
395,00:28:53.43,00:28:53.43,THIS IS I DON'T WANT TO LETPENNER BEAT ME OUT IN THIS GAME.
396,00:28:58.27,00:28:58.27,"IT'S AND YOU PENNER GETTOGETHER, AND THERE ARE TWO"
397,00:29:03.17,00:29:03.17,VETERAN GUYS.LET'S TAKE IT TO THE END.
398,00:29:05.00,00:29:05.00,SO WE GET SCREWED.THAT'S THE OWNING THING I WORRY
399,00:29:08.93,00:29:08.93,ABOUT.>> I CAN TELL WITH YOU INTEGRITY
400,00:29:11.20,00:29:11.20,THAT I WOULD FOLLOW YOU GUYS.IT JUST TAKES TWO PEOPLE FROM
401,00:29:15.77,00:29:15.77,TANDANG TO REALIGN WITH THEKALABAW TRIBE.
402,00:29:19.03,00:29:19.03,THEN THEY WOULD BE SIX STRONG.UNLESS GOD HIMSELF APPEARS LIVE
403,00:29:24.77,00:29:24.77,"BEFORE ME AND SPEAKS TO ME, ICANNOT FOLLOW PETE, ARTIS, AND"
404,00:29:32.10,00:29:32.10,"ABI, AS LONG AS I HAVE SOMEASSURANCE THAT JEFF AND CARTER"
405,00:29:35.60,00:29:35.60,AREN'T GOING TO SWITCH OVER TOTHE OLD TANDANG TRIBE.
406,00:29:39.20,00:29:39.20,"BECAUSE IF R.C. AND I GO THISWAY, AND JEFF AND CARTER GO THIS"
407,00:29:42.93,00:29:42.93,"WAY, WHAT HAPPENS?NOTHING GOT GAINED."
408,00:29:50.47,00:29:50.47,">> WHAT DO YOU WANT TO DO, MAN?SO THE ONLY THING I CAN THINK OF"
409,00:29:54.67,00:29:54.67,HERE IS YOU AND I HOLD THE KEY.>> YUP.
410,00:29:58.47,00:29:58.47,>> SO I DON'T KNOW.WHAT DO YOU WANT TO DO?
411,00:30:02.10,00:30:02.10,">> WELL, IT'S JONATHAN, SKUPIN,R.C., DENISE, YOU, ME, THAT'S"
412,00:30:07.87,00:30:07.87,ALL WE NEED.>> YUP.
413,00:30:10.07,00:30:10.07,SIX.WE JUST NEED SIX.
414,00:30:14.53,00:30:14.53,>> I DON'T KNOW.DO YOU THINK WE COULD GET
415,00:30:17.73,00:30:17.73,FARTHER WITH SKUPIN AND PENNER?>> I JUST HAD A GOOD
416,00:30:20.90,00:30:20.90,"CONVERSATION WITH SKUPIN, AND IJUST SAID, ""LOOK, IF I DO THIS"
417,00:30:23.77,00:30:23.77,"WITH YOU, YOU HAVE TO PROMISE METHAT PENNER WILL NOT STAY HERE"
418,00:30:28.00,00:30:28.00,"LONGER THAN US.""AND HE GAVE ME HIS WORD HE WOULD"
419,00:30:32.17,00:30:32.17,VOTE WITH US TO GET PENNER OUT.THE ONLY THING I CAN SAY IS HOW
420,00:30:37.70,00:30:37.70,MUCH-- I MEAN WE BUILT SOME KINDOF VALUE WITH PENNER.
421,00:30:42.63,00:30:42.63,>> YEAH.>> IF YOU AND I JUMP AND GO OVER
422,00:30:46.83,00:30:46.83,"TO THE YELLOW TRIBE, YOU AND IJUST MAY BE ON THE BOTTOM."
423,00:30:50.80,00:30:50.80,">> HERE COMES PENNER BEHIND US.>> WHAT'S UP, PENNER?"
424,00:30:56.50,00:30:56.50,>> HOW WE DOING?>> GOOD.
425,00:31:00.50,00:31:00.50,>> WE'RE JUST TALKING THROUGHALL THE B.S. WE HAVE BEEN
426,00:31:03.63,00:31:03.63,"HEARING.>> WELL, LISTEN, YOU KNOW WHERE"
427,00:31:05.17,00:31:05.17,I STAND.AND I'M TOTALLY WITH YOU GUYS.
428,00:31:08.37,00:31:08.37,I HOPE THE HELL YOU'RE NOT GOINGTO VOTE WITH THEM AGAINST ME
429,00:31:11.77,00:31:11.77,TONIGHT.YOU HAVE MY LOYALTY.
430,00:31:13.47,00:31:13.47,>> IF THE PEOPLE THEY BELIEVEARE GOING TO VOTE WITH ME ARE
431,00:31:16.97,00:31:16.97,"REALLY NOT GOING TO VOTE WITHME, IF ALL OF THIS HAS BEEN"
432,00:31:19.93,00:31:19.93,"SMOKE, THEN I'M A TERRIBLE JUDGEOF CHARACTER."
433,00:31:21.97,00:31:21.97,AND THEN I DON'T REALLY DESERVETO STAY IN THE GAME.
434,00:31:24.53,00:31:24.53,BUT I DO BELIEVE THAT SKUPIN ANDR.C. AND DENISE AND CARTER AND
435,00:31:30.00,00:31:30.00,"JEFF, THEY'RE GOING TO VOTE WITHME."
436,00:31:31.53,00:31:31.53,THEY ALL MEAN IT.I REALLY BELIEVE THEY DO.
437,00:31:36.20,00:31:36.20,"LOOK, I HAVE NO IDEA WHAT'SGOING TO HAPPEN TONIGHT."
438,00:31:38.20,00:31:38.20,"BUT IF THERE'S A WAY THAT WE CANFLIP THIS VOTE, AND WE ARE THE"
439,00:31:42.87,00:31:42.87,LAST PEOPLE STANDING THE FOURTIGHT KALABAW PEOPLE AND THE TWO
440,00:31:48.70,00:31:48.70,"PEOPLE WE BROUGHT, IN WE CANTAKE CONTROL."
441,00:31:50.93,00:31:50.93,YOU KNOW?THAT'S HOW I SEE IT.
442,00:31:56.40,00:31:56.40,"WE'RE GOOD, OKAY.WE REALLY ARE GOOD."
443,00:32:08.37,00:32:08.37,>> WE'RE GOOD.WE'RE STILL HANGING.
444,00:32:10.70,00:32:10.70,>> YEAH.>> YOU DOING IT?
445,00:32:14.60,00:32:14.60,>> WE'RE STILL HANGING.YEAH.
446,00:32:16.67,00:32:16.67,WE WANT THESE VETERANS OUT OFHERE.
447,00:32:18.17,00:32:18.17,>> I'M NERVOUS HERE.>> WE'RE ALL NERVOUS HERE ON
448,00:32:21.53,00:32:21.53,"THIS THING.RIGHT NOW, I'M ON A CROSSROADS."
449,00:32:27.00,00:32:27.00,I'M EITHER GOING WITH VETERANPLAYERS THAT I DON'T WANT TO WIN
450,00:32:30.57,00:32:30.57,"THIS GAME AND RIDE THEM OUT, ORI'M GOING TO GO WITH THE TANDANG"
451,00:32:34.03,00:32:34.03,"TRIBE AND GET PEN ERP OUT OFHERE, BUT THEN I'M ON THE"
452,00:32:36.80,00:32:36.80,BOTTOM.IF YOU TREAT BASEBALL WITH
453,00:32:39.83,00:32:39.83,"DISRESPECT, YOU'LL BE BIT IN THEASS, AND I KNOW YOU TREAT THIS"
454,00:32:43.50,00:32:43.50,"GAME WITH DISRESPECT, YOU'LL GETBIT IN THE ASS TOO."
455,00:32:47.43,00:32:47.43,"WITH ALL HUMBLENESS, I SAY THEDECISION OF WHO GOES HOME"
456,00:32:50.40,00:32:50.40,TONIGHT IS GOING TO BE HEAVILYBASED ON WHICH WAY I GO AND WHO
457,00:32:55.00,00:32:55.00,I CARRY OVER TO THE OTHER SIDE.I'VE GOT TO MAKE SURE I PROTECT
458,00:32:58.43,00:32:58.43,"MYSELF BECAUSE WHATEVER MOVE IMAKE, IT'S NOT GOING TO SIT WELL"
459,00:33:01.77,00:33:01.77,WITH EITHER TRIBE.>> Jeff: FOR THOSE OF YOU WHO
460,00:33:23.67,00:33:23.67,"DON'T HAVE A TORCH.GO AHEAD AND GRAB ONE, APPROACH"
461,00:33:27.87,00:33:27.87,"THE FLAME, DIP IT IN AND GETFIRE."
462,00:33:30.63,00:33:30.63,THIS IS PART OF THE RITUAL OFTRIBAL COUNCIL BECAUSE IN THIS
463,00:33:34.07,00:33:34.07,"GAME, FIRE REPRESENTS YOUR LIFE.WHEN YOUR FIRE IS GONE, SO ARE"
464,00:33:38.63,00:33:38.63,YOU.THAT'S GOING TO HAPPEN TO
465,00:33:39.87,00:33:39.87,"SOMEBODY TONIGHT.SO, WE'RE MAKING HISTORY."
466,00:33:43.20,00:33:43.20,THE ORIGINAL TANDANG SIX NEVERLOST.
467,00:33:46.37,00:33:46.37,AND IN 25 SEASONS WE HAVE NEVERHAD A TRIBE NOT GO TO TRIBAL
468,00:33:50.53,00:33:50.53,COUNCIL UNTIL THEY REACHED THEMERGE.
469,00:33:53.27,00:33:53.27,"ON THE FLIP SIDE, DENISE, YOU'VEBEEN TO EVERY SINGLE TRIBAL"
470,00:33:57.27,00:33:57.27,COUNCIL SINCE THE GAME STARTED.>> EVERY ONE.
471,00:33:59.80,00:33:59.80,>> Jeff: AND WHAT'S AMAZING ISYOU'VE SURVIVED.
472,00:34:02.07,00:34:02.07,>> I SOMEHOW SURVIVED IT ONEMORE TIME.
473,00:34:07.93,00:34:07.93,"I'M SAFE.>> Jeff: SKUPIN, 19 DAYS IN"
474,00:34:09.97,00:34:09.97,THERE HAS TO BE SOME ANIMOSITYWITHIN TANDANG.
475,00:34:12.37,00:34:12.37,>> TRUE.LITTLE FRACT STARTED TO OCCUR
476,00:34:16.17,00:34:16.17,BUT IT'S KIND OF NATURAL TOHAPPEN WHEN SIX OR SEVEN PEOPLE
477,00:34:18.60,00:34:18.60,"GET TOGETHER.YET, WE STILL PULLED OUT"
478,00:34:21.17,00:34:21.17,"VICTORIES.>> Jeff: R.C., HOW BAD HAS IT"
479,00:34:24.20,00:34:24.20,GOTTEN AT CAMP?>> IT WAS PRETTY BAD AT TANDANG.
480,00:34:26.93,00:34:26.93,BUT WE'RE A FAMILY.FAMILIES FIGHT SOMETIMES.
481,00:34:29.67,00:34:29.67,">> Jeff: ABI, THERE'S ONLY ONEWINNER."
482,00:34:32.13,00:34:32.13,FAMILIES DON'T WIN SURVIVE.>> RIGHT.
483,00:34:34.40,00:34:34.40,AND THE GAME HAS BEEN SHIFTINGCONSTANTLY.
484,00:34:36.47,00:34:36.47,I WAS VERY CLOSE TO R.C. IN THEBEGINNING.
485,00:34:38.50,00:34:38.50,"HOWEVER, SHE BETRAYED ME.SO I HAD TO MOVE ON TO A"
486,00:34:43.00,00:34:43.00,DIFFERENT ALLIANCE.>> I AM GLAD THIS FINALLY CAME
487,00:34:45.83,00:34:45.83,UP BECAUSE I'M STILL UNAWARE OFHOW I BETRAYED HER.
488,00:34:49.10,00:34:49.10,">> Jeff: WHAT HAPPENED, ABI?>> WE FOUND THE CLUE FOR THE"
489,00:34:52.03,00:34:52.03,"IMMUNITY IDOL TOGETHER, AND HIDTHE CLUE TOGETHER."
490,00:34:56.30,00:34:56.30,"HOWEVER, SHE UNBURIED THE CLUEWITHOUT TELLING ME, SO I CAN'T"
491,00:34:59.63,00:34:59.63,TRUST HER.>> I DIDN'T UNBURY ANYTHING.
492,00:35:02.27,00:35:02.27,"I DIDN'T TOUCH ANYTHING.>> I MEAN, IT WASN'T ME."
493,00:35:06.63,00:35:06.63,>> IT WASN'T ME.>> AND THOUGHT IT WAS YOU.
494,00:35:08.57,00:35:08.57,BUT YOU BLEW UP AND WOULDN'THAVE A DISCUSSION WITH ME.
495,00:35:10.53,00:35:10.53,">> I TRUST MY ACTIONS, NOT YOURS>> Jeff: SO, LISA, WHEN YOU"
496,00:35:18.00,00:35:18.00,"HEAR TWO TRIBE MATES FROM THEORIGINAL TANDANG SIX ARGUING,"
497,00:35:22.17,00:35:22.17,CONCERN YOU AT ALL THAT SOMEBODYFROM KALABAW MIGHT COME OVER AND
498,00:35:25.90,00:35:25.90,"SAY, ""LETCH.I DON'T KNOW WHAT YOUR PROBLEM"
499,00:35:28.33,00:35:28.33,IS.COME OVER HERE AND WE HAVE FIVE
500,00:35:30.73,00:35:30.73,"AND WE CONTROL THIS GAME."">> IF YOU'RE TALKING ABOUT THE"
501,00:35:33.13,00:35:33.13,"WHOLE 11 PEOPLE, THEN THEY WERETOP DOG HERE STAYING WITH"
502,00:35:37.03,00:35:37.03,TANDANG THAN GOING TO KALABAW.AND THEN JUST GETTING VOTED OFF
503,00:35:39.87,00:35:39.87,"AT THE END THERE.>> Jeff: JEFF, WHAT'S WRONG"
504,00:35:43.07,00:35:43.07,WITH LISA'S ARGUMENT?>> THERE'S A TRIBE THAT COMES IN
505,00:35:45.53,00:35:45.53,"WITH FOUR, AND IS OFFERING AFIVE SLOT VERSUS A SIX OR A"
506,00:35:50.00,00:35:50.00,"SEVEN SLOT, THERE'S POTENTIALFOR A GAME--CHANGING SWITCH."
507,00:35:55.33,00:35:55.33,">> BUT ONCE YOU FLIP, YOU'RE NOTREALLY A STRONG NUMBER."
508,00:35:58.13,00:35:58.13,YOU'RE A WEAKER NUMBER BECAUSEYOU'VE SHOWN THAT YOU CAN'T BE
509,00:36:01.77,00:36:01.77,TRUSTED IN YOUR ALLIANCE.>> Jeff: LET'S TALK ABOUT
510,00:36:07.03,00:36:07.03,RETURNING PLAYERS.TWO OF THEM ARE STILL IN THE
511,00:36:08.97,00:36:08.97,"GAME, SKUPIN AND PENNER.PETE, IS THERE A GROUP THOUGHT"
512,00:36:11.70,00:36:11.70,IN TERMS OF YOU HAD YOUR SHOT?GET OUT?
513,00:36:15.30,00:36:15.30,">> I MEAN, EVERY SEASON WHERETHEY RETURN PLAYERS, USUALLY"
514,00:36:18.30,00:36:18.30,PEOPLE DON'T LIKE THE IDEA THATTHEY'RE HERE.
515,00:36:19.83,00:36:19.83,"I MEAN, THEY'VE GOT TO PLAY THEGAME BEFORE."
516,00:36:22.80,00:36:22.80,SO THERE'S ALWAYS A KIND OFMUTINY FEELING.
517,00:36:25.43,00:36:25.43,BUT TANDANG HAS NEVER HAD TO GOTO TRIBAL COUNCIL SO YOU NEVER
518,00:36:28.70,00:36:28.70,REALLY KNOW WHAT WOULD HAVEHAPPENED.
519,00:36:30.77,00:36:30.77,>> Jeff: IT'S ALSO ANOTHEREXAMPLE WHY KALABAW IS LICKING
520,00:36:35.30,00:36:35.30,THEIR CHOPS.R.C. COULD BE UP FOR GRAPS.
521,00:36:38.00,00:36:38.00,YOU SKUPIN COULD BE UP FORGRABS.
522,00:36:40.87,00:36:40.87,AND LISA IS THERE ANY CONCERNMALCOLM AND DENISE STARTED THE
523,00:36:44.73,00:36:44.73,GAME TOGETHER.THEY'RE BOTH STILL HERE AND NOW
524,00:36:46.97,00:36:46.97,THEY'RE BACK TOGETHER?>> ABSOLUTELY.
525,00:36:48.10,00:36:48.10,IT'S A HUGE CONCERN AND ITBRICKS UP SOMETHING YOU HAVEN'T
526,00:36:52.27,00:36:52.27,ADDRESSED.THERE'S ALSO EVERY POSSIBILITY
527,00:36:55.40,00:36:55.40,THAT SOMEONE WHO IS ON THEBOTTOM FLOOR IS THINKING IF I
528,00:36:58.27,00:36:58.27,"COME OVER TO TANDANG, MAYBE ICAN STAY A LITTLE LONGER."
529,00:37:01.40,00:37:01.40,I WON'T BE TOP DOG BUT AT LEASTI WON'T BE THE DOG KICKED TO THE
530,00:37:05.17,00:37:05.17,SIDE OF THE ROAD SO THERE ISALSO THAT POSSIBILITY THAT COULD
531,00:37:08.40,00:37:08.40,"BE HAPPENING.>> Jeff: SO, PETE, WHAT'S THE"
532,00:37:11.37,00:37:11.37,CONSENSUS ON THE IDOLS?HOW MANY MIGHT THERE BE IN PLAY
533,00:37:14.37,00:37:14.37,TONIGHT?>> I THINK THERE WERE TWO IN THE
534,00:37:15.27,00:37:15.27,GAME RIGHT NOW.I'M PRETTY SURE MASTING'S IS
535,00:37:21.07,00:37:21.07,"GONE.>> Jeff: PETE, CONCERNED IT"
536,00:37:22.03,00:37:22.03,"COULD BE YOU TONIGHT?CLEARLY, ARE YOU ONE OF THE FIT,"
537,00:37:25.27,00:37:25.27,YOUNG GUYS WHO COULD DO WELL INCHALLENGES?
538,00:37:27.93,00:37:27.93,">> RIGHT, I FEEL I HAVE A HUGETARGET ON MY BACK."
539,00:37:30.70,00:37:30.70,">> Jeff: ABI, IS THATJUSTIFIED FOR PETE TO BE"
540,00:37:32.93,00:37:32.93,"CONCERNED?>> ABSOLUTELY, YEAH."
541,00:37:33.83,00:37:33.83,">> Jeff: YEF JEFF, HOW LIKELYIS IT THAT THERE WILL BE A"
542,00:37:37.90,00:37:37.90,BLINDSIDE TONIGHT?>> VERY LIKELY.
543,00:37:39.90,00:37:39.90,YOU'VE BEEN TALKING TO US FAIRWHILE NOW.
544,00:37:41.70,00:37:41.70,YOU GET THE FACT WE'RE ALLSCRAMBLING STILL AS WE SIT HERE
545,00:37:45.00,00:37:45.00,NOT KNOWING EXACTLY WHO'S GOINGHOME.
546,00:37:50.20,00:37:50.20,">> Jeff: ALL RIGHT, WELL,CLEARLY, THERE IS A LOT OF"
547,00:37:53.20,00:37:53.20,UNCERTAINTY ABOUT WHAT IS GOINGTO HAPPEN.
548,00:37:54.83,00:37:54.83,LET'S TRY TO BRING SOME CLARITY.IT IS TIME TO VOTE.
549,00:37:58.43,00:37:58.43,"ABI, YOU'RE UP>> I NEVER LIKED YOU."
550,00:38:57.17,00:38:57.17,>> Jeff: I'LL GO TALLY THEVOTES.
551,00:39:12.90,00:39:12.90,>> Jeff: IF ANYBODY HAS THEHIDDEN IMMUNITY IDOL AND YOU
552,00:39:16.30,00:39:16.30,"WANT TO PLAY IT, NOW WOULD BETHE TIME TO DO SO"
553,00:39:24.73,00:39:24.73,>> I'LL DO IT.>> Jeff: THANK YOU.
554,00:39:34.77,00:39:34.77,>> YOU'RE WELCOME.>> Jeff: THIS IS A HIDDEN
555,00:39:41.93,00:39:41.93,IMMUNITY IDOL.ANY VOTES CAST AGAINST PENNER
556,00:39:44.17,00:39:44.17,WILL NOT COUNT.I'LL READ THE VOTES.
557,00:39:53.47,00:39:53.47,"FIRST VOTE, PENNER.DOES NOT COUNT."
558,00:39:59.47,00:39:59.47,JONATHAN PENNER.DOES NOT COUNT.
559,00:40:05.20,00:40:05.20,"PENNER.THREE VOTES PENNER, NONE OF THEM"
560,00:40:08.60,00:40:08.60,COUNT.R.C.
561,00:40:11.23,00:40:11.23,THAT'S ONE VOTE R.C.PETE.
562,00:40:17.10,00:40:17.10,ONE VOTE PETE.JOHN.
563,00:40:23.97,00:40:23.97,PENNER.DOES NOT COUNT.
564,00:40:25.30,00:40:25.30,"PENNER, DOES NOT COUNT.R.C."
565,00:40:31.03,00:40:31.03,TWO VOTES R.C.PETE.
566,00:40:34.33,00:40:34.33,TWO VOTES PETE.R.C.
567,00:40:39.07,00:40:39.07,THREE VOTES R.C.TWO VOTES PETE.
568,00:40:41.73,00:40:41.73,ONE VOTE LEFT.EIGHTH PERSON VOTED OUT AND THE
569,00:40:49.37,00:40:49.37,"FIRST MEMBER OF OUR JURY, R.C.YOU NEED TO BRING ME YOUR TORCH."
570,00:41:07.17,00:41:07.17,"R.C., THE TRIBE HAS SPOKEN.>> BYE."
571,00:41:20.70,00:41:20.70,">> Jeff: WELL, BASED ONEVERYTHING I HEARD TONIGHT, AND"
572,00:41:23.17,00:41:23.17,"WITH THREE PEOPLE GETTING VOTES,IT WOULD APPEAR IT IS ANYBODY'S"
573,00:41:26.50,00:41:26.50,GAME.GRAB YOUR STUFF.
574,00:41:27.53,00:41:27.53,HEAD BACK TO CAMP.GOOD NIGHT.
575,00:41:35.40,00:41:35.40,"Captioning brought to you bySurvivor Productions, CBS,"
576,00:41:38.17,00:41:38.17, Captioned byMedia Access Group at WGBH
577,00:41:39.17,00:41:39.17, access.wgbh.org>> JEFF: STAY TUNED FOR SCENES
578,00:41:55.93,00:41:55.93,FROM OUR NEXT EPISODE.>> Jeff: NEXT TIME ON
579,00:42:04.23,00:42:04.23,"""SURVIVOR"": AFTER BEINGBETRAYED, PENNER'S GOT NOTHING"
580,00:42:09.70,00:42:09.70,LEFT TO LOSE.>> I HAVE NO ALLIANCES.
581,00:42:12.13,00:42:12.13,THEY ARE ALL READY TO DIE.>> Jeff: HE WAGES WAR ON
582,00:42:15.97,00:42:15.97,EVERYONE.>> MAYBE HE'LL WIN IMMUNITY NO
583,00:42:18.63,00:42:18.63,"YOU WON'T, BECAUSE I'M WINNINGIMMUNITY."
584,00:42:21.10,00:42:21.10,I'LL STICK IT RIGHT IN THEIRDAMN SPACES.
585,00:42:23.17,00:42:23.17,>> Jeff: ONE MORE SPOT!>> THAT'S THE NAME OF THE GAME.
586,00:42:28.73,00:42:28.73,THE NAME OF THE GAME ISBLINDSIDE.
587,00:42:29.73,00:42:29.73,"IT WAS SUCH AN AMAZING,WONDERFUL EXPERIENCE."
588,00:42:32.20,00:42:32.20,I CAN'T BELIEVE I ACTUALLY GOTTO DO THIS.
589,00:42:34.90,00:42:34.90,I LASTED RAIN AND NO FOOD ANDALL THESE THINGS.
590,00:42:38.47,00:42:38.47,"IT WAS DEFINITELY, BUT I GOT TOPLAY ""SURVIVOR."""
591,00:42:40.47,00:42:40.47,HOW MANY PEOPLE GET TO DO THISAND I MADE IT PRETTY FAR SO I'M
592,00:42:42.83,00:42:42.83,VERY PROUD OF MYSELF.
