,begin,end,subtitles_text
1,00:00:00.00,00:00:00.00, >> Jeff: PREVIOUSLY ON
2,00:00:03.60,00:00:03.60,"""SURVIVOR""."" >> YOUR BEHAVIOR IS NOT"
3,00:00:04.97,00:00:04.97,ACCEPTABLE. >> SHUT UP!
4,00:00:07.63,00:00:07.63,">> Jeff: WHILE THE FANS CAMP WAS FILLED WITH DISORDER, THE"
5,00:00:11.10,00:00:11.10,ONLY THING COMING TOGETHER WAS THE COUPLE'S ALLIANCE.
6,00:00:13.67,00:00:13.67,">> WE HAVE THIS FOUR WITH ME, EDDIE, ALLIE AND HOPE."
7,00:00:17.43,00:00:17.43,>> Jeff: THE FAVORITES HAD A CLEAR DIVISION-- PHILLIP'S
8,00:00:22.00,00:00:22.00,"ALLIANCE, STEALTHRUS,"" WAS CALLING THE SHOTS."
9,00:00:25.90,00:00:25.90,>> HE'S TREATING PEOPLE LIKE GARBAGE AND I DON'T LIKE THAT.
10,00:00:28.77,00:00:28.77,YOU GOTTA CUT THE HEAD OFF THE SNAKE.
11,00:00:33.60,00:00:33.60,FRIGGIN' INSPECTOR IMAGEET THOUGHT HE COULD PULL HIS
12,00:00:38.83,00:00:38.83,SPECIAL AGENT TRIMCH TRICKS BUT YOU DON'T WANT TO FIGHT WITH ME.
13,00:00:41.70,00:00:41.70,">> Jeff: AT THE IMMUNITY CHALLENGE, FAVORITES WON EASILY."
14,00:00:44.87,00:00:44.87,FAVORITES WIN IMMUNITY AND REWARD!
15,00:00:47.47,00:00:47.47,"WITH THE FANS FACING TRIBAL COUNCIL, REYNOLD WAS VOCAL ABOUT"
16,00:00:51.03,00:00:51.03,WANTING SHAMAR OFF THE ISLAND. >> I'M GOING TO VOTE FOR YOU
17,00:00:53.97,00:00:53.97,"TONIGHT. >> ALL RIGHT, THEN, SO THAT'S"
18,00:00:57.40,00:00:57.40,"GOOD, VOTE. >> Jeff: BUT JERRI HAD OTHER"
19,00:00:59.83,00:00:59.83,PLANS. >> YOU WANT YOU ON OUR SIDE.
20,00:01:02.50,00:01:02.50,I WANT SHAMAR TO KEEP ANNOYING PEEMPLE BECAUSE SHAMAR IS MY
21,00:01:06.30,00:01:06.30,PHILLIP. >> Jeff: SHE RECRUITED SHAMAR
22,00:01:08.77,00:01:08.77,AND TRIED TO PERSUADE THE TRIBE TO BREAK UP THE COUPLES
23,00:01:13.00,00:01:13.00,ALLIANCE. >> I JUST NEED TO MAKE A
24,00:01:15.33,00:01:15.33,DECISION AND IT'S NOT GOING TO BE EASY ONE.
25,00:01:17.97,00:01:17.97,>> Jeff: AT TRIBAL COUNCIL REYNOLD REVEALED HIS IDOL.
26,00:01:20.83,00:01:20.83,">> JEFF, I'M HOLDING THE HIDDEN IMMUNITY IDOL THEY FOUND ON"
27,00:01:25.73,00:01:25.73,ISLAND. >> Jeff: BUT IT DIDN'T SWAY
28,00:01:27.57,00:01:27.57,THE TRIBE FROM VOTING OUT HIS CLOSEST ALLY.
29,00:01:30.97,00:01:30.97,"SECOND PERSON VOTED OUT OF ""FANS VS. FAVORITES,"" ALLIE."
30,00:01:33.40,00:01:33.40,YOU NEED TO BRING ME YOUR TORCH. THE TRIBE HAS SPOKEN.
31,00:01:36.80,00:01:36.80,">> GOOD LUCK, YOU GUYS. >> Jeff: 18 ARE LEFT."
32,00:01:39.53,00:01:39.53,"WHO WILL BE VOTED OUT TONIGHT. >> THAT WAS CRAZY, I KNOW THAT."
33,00:01:58.23,00:01:58.23,>> I WAS SWEATING IT COMING BACK TO CAMP BECAUSE I WAS THE ONE
34,00:02:01.03,00:02:01.03,THAT WAS AT THE CROSSROADS OF THE TWO ALIENLSES.
35,00:02:05.77,00:02:05.77,AND IT TOOK MAYBE LESS THAN 30 SECONDS FOR THOINGZ HIT THE FAN.
36,00:02:09.60,00:02:09.60,>> WE ARE NOT FRIEND. BUT WE NEED EACH OTHER TO WIN.
37,00:02:14.73,00:02:14.73,>> WE DO. >> YOU NEED ME TO WINL
38,00:02:17.97,00:02:17.97,CHALLENGES. >> YUP.
39,00:02:19.13,00:02:19.13,>> I HAVE AN IDOL AND I'LL ( BLEEP ) PLAY IT.
40,00:02:23.20,00:02:23.20,I WAS GOOD TO HOLD IT AND USE IT FOR THE GOOD OF THE TRIBE.
41,00:02:27.90,00:02:27.90,I DON'T TRUST ANYONE HERE NOW. SO GAME ON.
42,00:02:29.97,00:02:29.97,>> I WANTED TO SAY HOW THE GAME JUST STARTED BECAUSE I DIDN'T
43,00:02:32.97,00:02:32.97,"GET VOTED OUT BECAUSE YOUR PLAN DIDN'T WORK, NOW IT'S GAME ON."
44,00:02:36.67,00:02:36.67,">> SHAMAR, IT WASN'T OUR PLAN, DUDE."
45,00:02:38.70,00:02:38.70,>> IT WAS YOUR PLAN. YOU ALL WROTE MY NAME DOWN.
46,00:02:41.67,00:02:41.67,"SO IT WAS YOUR PLAN. >> DON'T SAY, OH, NOW IT'S A"
47,00:02:44.63,00:02:44.63,"GAME."" I THOUGHT WE WERE ONE HAPPY"
48,00:02:45.97,00:02:45.97,FAMILY BECAUSE I DIDN'T GET VOTED OUT.
49,00:02:47.63,00:02:47.63,"NOW IT'S LIKE WE CAN'T BE A FAMILY NOW, RIGHT."
50,00:02:50.00,00:02:50.00,>> IT WASN'T MY PLAN. YOU KNOW WHO ASKED ME?
51,00:02:51.90,00:02:51.90,>> I DON'T WANT KNOW. >> IT WASN'T ONE OF MY
52,00:02:56.37,00:02:56.37,"ALLIANCE. >> HE SAID, I'M VOTING FOR"
53,00:02:59.77,00:02:59.77,SHAMAR. AND AND HE THOUGHT YOU WEREN'T
54,00:03:02.57,00:03:02.57,GOING TO VOTE FOR HIM. >> TRIBE RIGHT NOW IS SO
55,00:03:06.97,00:03:06.97,DRAMATIC. I HATE IT.
56,00:03:07.50,00:03:07.50,>> THE CAMP IS TOTALLY IN CHAOS. YOU WOULD THINK BECAUSE I SAVED
57,00:03:16.30,00:03:16.30,"SHAMAR'S AS, HE WOULD SHUT UP. >> I DID NOT COME AT-- DID I SAY"
58,00:03:20.30,00:03:20.30,IT TO YOU? DID I SAY IT TO YOU?
59,00:03:22.17,00:03:22.17,DID I SAY IT TO YOU? >> I'M NOT HERE TO ARGUE WITH
60,00:03:24.63,00:03:24.63,"YOU, SHAMAR. >> YOU KNOW YOU'RE NOT ARGUING"
61,00:03:28.23,00:03:28.23,BECAUSE YOU'RE ( BLEEP ) RIGHT NOW.
62,00:03:29.37,00:03:29.37,">> SHAMAR GOT MORE AND MORE AMPED UP, ALL THE STUFF THAT"
63,00:03:34.23,00:03:34.23,HAPPENED AT TRIBAL AND THE DAYS BEFORE AND HE WAS YELL AT
64,00:03:37.73,00:03:37.73,EVERYBODY. >> YOU'RE SAYING SORRY NOW.
65,00:03:39.20,00:03:39.20,THAT'S HOW YOU FEEL. THAT'S EXACTLY WHAT IT IS.
66,00:03:41.80,00:03:41.80,"THAT'S HOW YOU FEEL ABOUT YOURSELF, AND I'M STRONG AND YOU"
67,00:03:44.23,00:03:44.23,KNOW IT. >> KNOW THAT HE HAS BEEN THROUGH
68,00:03:46.83,00:03:46.83,A HELL OF A LOT MORE THAN THE REST OF US HAVE BEEN.
69,00:03:50.30,00:03:50.30,"YOU KNOW, HE'S HAD TWO TIEWRTZ IN IRAQ."
70,00:03:55.47,00:03:55.47,>> I'M THE ONLY ONE WHO SAID THAT.
71,00:03:58.70,00:03:58.70,WHY DIDN'T YOU SAY SOMETHING TO ME!
72,00:04:00.93,00:04:00.93,IF I'M NOT THE ONLY ONE! YOU JUST SAID I WASN'T THE ONLY
73,00:04:05.73,00:04:05.73,ONE WHO SAID IT. WHY ARE YOU GETTING ON ME THEN?
74,00:04:08.43,00:04:08.43,">> AT THE SAME TIME, THE PART OF SHAMAR THAT WAS FUN HAS"
75,00:04:11.03,00:04:11.03,COMPLETELY GONE. >> YOU WERE WRONG!
76,00:04:13.10,00:04:13.10,"I WASN'T TALKED TO YOU! WE'RE IN A TIGHT SPOT NOW,"
77,00:04:51.63,00:04:51.63,FRIENDO. >> WE GOT OUR HEADS CHOPPED OFF.
78,00:04:53.80,00:04:53.80,>> I KNOW. REVENGE OF THE NERDS.
79,00:04:56.47,00:04:56.47,WE WEE JUST HAD TRIBAL COUNCIL LAST NIGHT AND WE PRETTY MUCH
80,00:04:59.53,00:04:59.53,GOT BLIND SIDED. I THOUGHT WE WERE ALL ON THE
81,00:05:02.33,00:05:02.33,SAME PAGE ABOUT VOTING SHAMAR OFF FOR NOT CONTRIBUTING TO
82,00:05:06.47,00:05:06.47,"CAMP. CONGRATULATIONS TO THEM, THEY"
83,00:05:07.50,00:05:07.50,GOT US. >> I'M ON THE CHOPPING BLOCK
84,00:05:09.10,00:05:09.10,BEFORE YOU. >> HOW ARE YOU BEFORE ME?
85,00:05:15.13,00:05:15.13,>> IT'S PROBABLY A MASS MINORITY NOW.
86,00:05:17.83,00:05:17.83,>> UNTIL SHAMAR PISSES OFF SOMEBODY ELSE TODAY.
87,00:05:22.67,00:05:22.67,">> SHAMAR, YOU WANT A COCONUT? >> NO."
88,00:05:27.60,00:05:27.60,>> EVERYBODY KNOWS THAT SHAMAR IS FREELOADING AND BEING LAZY.
89,00:05:34.00,00:05:34.00,AND I THINK SHAMAR IS GOING TO STEP ON TOO MANY PEOPLE'S TOES
90,00:05:37.77,00:05:37.77,ON HIS OWN AND THEY'RE GOING TO BE LIKE NOW IS THE TIME FOR HIM
91,00:05:41.87,00:05:41.87,TO GO. I WANT HIM GONE.
92,00:05:43.77,00:05:43.77,">> TODAY, DO YOUR BEST, ABSOLUTE BEST, EVEN IF THEY GET ON YOUR"
93,00:05:48.30,00:05:48.30,"NERVES,EVEN IF YOU WANT TO WRING THEIR NECKS, JUST KEEP YOUR"
94,00:05:54.53,00:05:54.53,MOUTH SHOT. >> THEY KNOW THEY'RE ON THE
95,00:05:59.40,00:05:59.40,CHOPPING BLOCK. THE NEXT EASY TARGET IS GOING TO
96,00:06:01.60,00:06:01.60,BE YOU BECAUSE YOU'RE VOCAL. >> I WAS THE EASY TARGET BEFORE.
97,00:06:04.37,00:06:04.37,>> BECAUSE YOU'RE VOCAL. >> I'M ALWAYS GOING TO BE THE
98,00:06:07.37,00:06:07.37,EASY TARGET. >> EXACTLY.
99,00:06:08.53,00:06:08.53,">> I'M NOT A QUITTER BUT THESE ARE CHILDISH, IMMATURE GAMES--"
100,00:06:11.67,00:06:11.67,>> THAT'S PART OF THIS WHOLE CRAZY GAME.
101,00:06:13.77,00:06:13.77,">> NO, IT'S NOT. >> IT MAY NOT BE YOUR GAME BUT"
102,00:06:17.87,00:06:17.87,THAT'S PART OF THE GAME. YOU DON'T RUN ACROSS SHAMARS
103,00:06:21.03,00:06:21.03,EVERY DAY BUT IN MY LIFE I HAVE COME ACROSS PEOPLE WITH THAT
104,00:06:24.70,00:06:24.70,KIND OF ATTITUDE. I OWN SEVERAL FRANCHISES WHO
105,00:06:28.30,00:06:28.30,"EVERYBODY WHO WORKS FOR ME IS UNDER THE AGE OF, SAY, 24, SO"
106,00:06:31.83,00:06:31.83,"THAT'S ALL I DO IS DEAL WITH SNOTTY, TEENAGED BRATS ALL DAY"
107,00:06:36.43,00:06:36.43,SO I THINK I'M THE CLOSEST ONE WHO UNDERSTANDS HOW HE THINKS
108,00:06:39.57,00:06:39.57,OUT HERE BUT HE NEEDS TO SHUT UP.
109,00:06:40.97,00:06:40.97,>> I UNDERSTAND IT WAS A GAME BUT I'M GOING TO KEEP SITTING
110,00:06:44.60,00:06:44.60,HERE AND LYING. >> BUT THEY WILL.
111,00:06:46.17,00:06:46.17,>> BUT I CAN'T DO THAT. >> BUT THEY WILL.
112,00:06:48.73,00:06:48.73,>> I'M OVER IT. I DON'T REALLY CARE.
113,00:06:51.37,00:06:51.37,"I CAN'T DO ( BLEEP ). THIS AIN'T MY KIND OF LIFESTYLE,"
114,00:06:55.07,00:06:55.07,MAN. I'M JUST KIND OF FEEL LIKE IN
115,00:06:56.87,00:06:56.87,"THIS GAME, I'M LIKE THE BLACK SHEEP."
116,00:06:59.27,00:06:59.27,I HONESTLY CAME INTO THIS GAME REALLY WANTING THE MILLION
117,00:07:02.13,00:07:02.13,"DOLLARS BUT WHEN I ACTUALLY SEEN HOW PEOPLE ACT, IT'S KIND OF"
118,00:07:05.83,00:07:05.83,LIKE-- IT'S NOT REALLY WORTH IT TO ME.
119,00:07:07.83,00:07:07.83,THAT'S WHERE IT'S KIND OF DISHEARTENING.
120,00:07:11.43,00:07:11.43,"THAT'S WHERE I QUESTION, YOU KNOW, HOW MUCH I SHOULD BE IN"
121,00:07:14.53,00:07:14.53,THIS GAME >> I'M 54 YEARS OLD.
122,00:07:37.67,00:07:37.67,"TO BE PLAYING ""SURVIVOR"" AGAIN, I'M ACTUALLY HAVING THE TIME OF"
123,00:07:41.33,00:07:41.33,MY LIFE RIGHT NOW. 54 IS JUST A NUMBER.
124,00:07:43.43,00:07:43.43,"AND TO BE HONEST WITH YOU, IN MY DAILY LIFE, I REALLY KNOW HOW TO"
125,00:07:47.10,00:07:47.10,TAKE CARE OF MYSELF. I REALLY KNOW WHAT I'M DOING.
126,00:07:52.50,00:07:52.50,"I WORK OUT. FOR MY AGE, TO DO WHAT I DO,"
127,00:07:55.63,00:07:55.63,IT'S PHENOMENAL. WHEN I GO TO THE GYM NOW AND I
128,00:07:58.37,00:07:58.37,"PLAY FOUR-COURT BALL, I'M PLAYING WITH MEN HALF MY AGE."
129,00:08:01.77,00:08:01.77,"AND I HAVE A LITTLE THING. I GET A LITTLE REBOUND, SPRINT"
130,00:08:05.00,00:08:05.00,TO THE CORNER WITH IT. DOUBLE DRIBBLE.
131,00:08:08.07,00:08:08.07,"GO FOR IT, ONE STEP BACK, ALL AIR, BABY."
132,00:08:11.47,00:08:11.47,PLAYING WITH GUYS TWICE MY HEIGHT.
133,00:08:13.50,00:08:13.50,LIKE THEY DON'T KNOW WHAT I'M GOING TO DO OUT THERE.
134,00:08:15.73,00:08:15.73,AND THEY CAN'T BELIEVE WHAT I'M DOING.
135,00:08:18.13,00:08:18.13,"""HEY, MAN, YOU'RE PLAYING PRO NBA BALL."""
136,00:08:22.73,00:08:22.73,"NOT, YOU'RE JUST NOT USED TO THE LARRY BIRD."
137,00:08:30.27,00:08:30.27,I'M OLD SCHOOL. >> WHAT WILL WE DO WHEN THERE'S
138,00:08:32.73,00:08:32.73,A SWITCH AND SOME PEOPLE ARE LEFT HERE DO WE GIVE THEM BEANS.
139,00:08:37.67,00:08:37.67,>> ANDREA AND PHILLIP HAVE PLAYED TOGETHER AND HAVE A
140,00:08:40.10,00:08:40.10,"CONNECTION, AND COCHRAN AND DAWN HAVE PLAYED TOGETHER AND HAVE A"
141,00:08:43.17,00:08:43.17,CONNECTION SO THAT REALLY LEFT MALCOLM AND I AND WE GRAVITATED
142,00:08:48.37,00:08:48.37,TOWARDS EACH OTHER. >> THERE ARE A MILLION PLACES IT
143,00:08:50.60,00:08:50.60,COULD BE. IT'S IMPOSSIBLE.
144,00:08:52.37,00:08:52.37,>> IT HAS TO BE NEAR SOMETHING. IT HAS TO BE CATFISH.
145,00:08:58.60,00:08:58.60,HE'S SUPER SMART. HE WENT TO AN IVY LEAGUE SCHOOL.
146,00:09:01.93,00:09:01.93,AND IT DOESN'T HURT TO HAVE SOMEBODY GOOD LOOKING AROUND.
147,00:09:05.00,00:09:05.00,>> THAT'S GROSS. >> REACH AROUND-- NO WAY.
148,00:09:10.33,00:09:10.33,>> NO! >> DO YOU THINK IT'S A CLUE OR
149,00:09:16.13,00:09:16.13,DO YOU THINK IT'S AN IDOL? I'M SO EXCITED.
150,00:09:19.50,00:09:19.50,">> CONGRATULATIONS, YOU FOUND THE HIDDEN IMMUNITY IDOL."
151,00:09:22.73,00:09:22.73,FINALLY I GOT SOME POWER IN MYBACK POCKET.
152,00:09:25.53,00:09:25.53,\xe2\x99\xaa I GOT THE IDOL NAH-NAH-NAH \xe2\x99\xaa \xe2\x99\xaa >> WE'LL BURY IT.
153,00:09:31.77,00:09:31.77,>> I'M NOT THRILLED CORINNE KNOWS I HAVE THE IDOL.
154,00:09:34.67,00:09:34.67,OF COURSE IN A PERFECT WORLD I WOULD HAVE IT ALL TO MYSELF BUT
155,00:09:37.90,00:09:37.90,CORINNE DOES KNOW ABOUT IT AND SHE'S SOMEONE WHO LUCKILY I DID
156,00:09:41.33,00:09:41.33,HAVE A GOOD RELATIONSHIP WITH EARLY ON THIS GAME.
157,00:09:45.73,00:09:45.73,OUR WAGONS KIND OF HITCHED TOGETHER BECAUSE OF THIS IDOL
158,00:09:48.70,00:09:48.70,NOW. IT'S GOING TO WORK OUT VERY WELL
159,00:09:50.33,00:09:50.33,OR WE'RE GOING TO BURN DOWN QUICKLY BECAUSE SHE WILL NOT GO
160,00:09:54.57,00:09:54.57,DOWN WITHOUT A FIGHT. >> NOBODY JOONS NOBODY KNOWS.
161,00:09:57.23,00:09:57.23,">> DONE. GAME, SET, MATCH."
162,00:10:19.10,00:10:19.10,">> WHAT IT DOES IS, WHEN THE WIND BLOWS, IT TRAPS THE AIR AND"
163,00:10:22.57,00:10:22.57,MAKES LIKE A CIRCULAR AND IT COOLS YOU.
164,00:10:24.37,00:10:24.37,">> BACK AT HOME, I'M WAITING THE WHOLE WEEK LONG FOR WEDNESDAY"
165,00:10:27.57,00:10:27.57,NIGHT TO ARRIVE SO I CAN TURN ON CBS AND SEE WHAT'S IN STORE.
166,00:10:30.97,00:10:30.97,"CAN I SIT IN THE MAGICAL SEAT, PHIL?"
167,00:10:33.77,00:10:33.77,">> YES, YOU CAN SIT IN THE SEAT. I CROWN YOU."
168,00:10:36.33,00:10:36.33,>> BUT WHEN YOU'RE PLAYING THIS GAME EVERY SINGLE DAY IS LIKE
169,00:10:39.87,00:10:39.87,WEDNESDAY NIGHT AT EIGHT. IT'S WILD.
170,00:10:42.17,00:10:42.17,"I GET TO WATCH ""SURVIVOR"" WHILE I'M PLAYING ""OF ""SURVIVOR."""
171,00:10:48.43,00:10:48.43,"AND FOR A ""SURVIVOR"" NUT LIKE ME, IT'S GREAT."
172,00:10:52.20,00:10:52.20,I DON'T KNOW WHY PEOPLE IN THIS WORLD DON'T DO THIS.
173,00:10:54.43,00:10:54.43,>> BECAUSE THEY'RE NOT A SPECIALIST.
174,00:10:56.50,00:10:56.50,>> IT'S NOT NORMAL FOR ME TO BE SURROUNDED BY THESE BEAUTIFUL
175,00:10:59.70,00:10:59.70,WOMEN WHO ARE HALF THE TIME JUST WEARING THEIR UNDERWEAR.
176,00:11:03.17,00:11:03.17,"THAT'S SOME SORT OF FREUDIAN PICNIC, I THINK, BUT IT'S REAL"
177,00:11:08.87,00:11:08.87,HERE. >> IT'S A GOOD THING THAT
178,00:11:10.53,00:11:10.53,THERE'S AN IDOL BETWEEN US BECAUSE I DON'T KNOW HOW MANY
179,00:11:13.60,00:11:13.60,PEOPLE REALLY WANT YOU TO GO TO THE VERY END.
180,00:11:15.33,00:11:15.33,">> WHY ARE THEY, LIKE, INTENSELY TALKING?"
181,00:11:18.07,00:11:18.07,>> I JUST DON'T GET WHAT THEIR LOYALTIES ARE.
182,00:11:20.67,00:11:20.67,>> I'VE LEARNED FROM THE LAST TIME I PLAYED THAT YOU HAVE TO
183,00:11:23.00,00:11:23.00,ALWAYS BE THINKING. EVEN IF YOU THINK YOU HAVE A
184,00:11:27.17,00:11:27.17,"GROUP, IT'S SOLILD, THERE COULD BE BETTER OPTIONS AND I REALLY"
185,00:11:30.07,00:11:30.07,WANT CORINNE OUT. I DON'T KNOW WHERE MALCOLM IS
186,00:11:35.00,00:11:35.00,"AT, BUT DOESN'T CORINNE WORRY YOU?"
187,00:11:36.40,00:11:36.40,>> YES. >> WE HAVE A SIX AND LET'S JUST
188,00:11:38.37,00:11:38.37,HANG OUT AND SHE'S HAVING SO MANY ONE-ON-ONE INTENSE
189,00:11:41.80,00:11:41.80,CONVERSATIONS WITH EVERYBODY. >> HER AND MALCOLM ARE
190,00:11:45.67,00:11:45.67,REMARKABLY CLOSE. >> YOU SAW THEM TALKING.
191,00:11:47.47,00:11:47.47,WHAT IF WE COULD GET A UNANIMOUS VOTE.
192,00:11:56.10,00:11:56.10,"US FIVE ARE CLOSE. YOU'RE CLOSE TO BRANDON, RIGHT."
193,00:11:59.10,00:11:59.10,>> YES. >> I DON'T THINK SHE'D MAKE A
194,00:12:01.73,00:12:01.73,MOVE RIGHT NOW BUT I WANT TO GET HER OUT OF HERE BEFORE SHEIK GET
195,00:12:05.90,00:12:05.90,RID OF ME. I THINK CORINNE AND MALCOLM ARE
196,00:12:08.10,00:12:08.10,REALLY CLOSE. YOU'RE THINKING ABOUT THE--
197,00:12:09.53,00:12:09.53,>> I DEFINITELY WANT WANT TO DO THAT.
198,00:12:12.90,00:12:12.90,>> I'M SO GLAD YOU'RE ON THE SAME PAGE AS ME.
199,00:12:15.43,00:12:15.43,IT'S HARD BECAUSE I DON'T WANT TO TALK TO THE WRONG PERSON TOO
200,00:12:18.33,00:12:18.33,EARLY AND IT GETS BACK TO CORINNE THAT I'M THINKING ABOUT
201,00:12:21.40,00:12:21.40,"SOMETHING, AND THEN ITS TARGET'S ON ME."
202,00:12:22.73,00:12:22.73,">> WE DON'T WANT YOU TO BE NEXT TO GO, AND IF YOU STAY WITH US,"
203,00:12:27.03,00:12:27.03,IT COULD BE SOMETHING. >> I FEEL LIKE THIS IS A CHANCE
204,00:12:30.03,00:12:30.03,"TO ACTUALLY, YOU KNOW, BE A PART OF SOMETHING ACTUAL LEGIT NOW."
205,00:12:34.27,00:12:34.27,>> WOULD YOU DO ANYTHING? >> ANYTHING.
206,00:12:37.53,00:12:37.53,I'M NOT PLAYING THE SAME GAME I USED TO.
207,00:12:40.23,00:12:40.23,>> CORINNE. >> ANY QUESTIONS?
208,00:12:44.20,00:12:44.20,>> NO. I'M GOOD.
209,00:12:46.27,00:12:46.27,"I'VE BEEN TOLD THAT I'M SAFE. ""YOU'RE SAFE, YOU'RE SAFE,"
210,00:12:51.33,00:12:51.33,"YOU'RE SAFE."" BUT IT'S REALLY SKETCHY BECAUSE"
211,00:12:54.33,00:12:54.33,"THERE'S A VOICE IN THE BACK OF MY HEAD THAT SAYS, ""YOU'VE BEEN"
212,00:12:57.97,00:12:57.97,DONE LIKE THIS BEFORE. YOU'VE BEEN COAXED ALONG TO
213,00:13:01.33,00:13:01.33,"BELIEVE SOMETHING THAT IS NOT TRUE."""
214,00:13:02.83,00:13:02.83,>> DON'T SAY ANYTHING. IT'S HUSH-HUSH.
215,00:13:05.20,00:13:05.20,>> I THINK THERE'S A LOT OF LYING GOING ON.
216,00:13:07.07,00:13:07.07,"THEY TELL ME, ""HEY, BRANDON, YOU'RE GOING OUT NEXT."""
217,00:13:11.40,00:13:11.40,I'LL PEE IN THE RICE. I'LL PEE IN THE BEANS.
218,00:13:13.57,00:13:13.57,I'LL BURN THE SHELTER TO THE GROUND.
219,00:13:15.33,00:13:15.33,"I THINK I CAN HANDLE IT. >> GOOD TALK, THOUGH."
220,00:13:18.33,00:13:18.33,">> GOOD TALK. THANK YOU, GUYS."
221,00:13:20.30,00:13:20.30,REALLY APPRECIATE YOUR TIME. I'M GOING TO TRY 150% EACH AND
222,00:13:23.67,00:13:23.67,"EVERY CHALLENGE, BUT IF WE LOSE AND MY EFFORTS AREN'T GOOD"
223,00:13:26.57,00:13:26.57,"ENOUGH FOR THEM TO KEEP MEAN AROUND, BY GOD, I'M GOING TO"
224,00:13:30.43,00:13:30.43,BE-- THERE'S GOING TO BE HELL TO PAY IN CAMP.
225,00:13:54.00,00:13:54.00,>> MY HAPPINESS IS NOT WORTH A MILLION.
226,00:13:57.70,00:13:57.70,"I'M NOT GOING TO BE THE ANGRY BLACK MAN ON ""SURVIVOR."""
227,00:14:02.13,00:14:02.13,IT'S NOT GOING TO HAPPEN. IT'S JUST NOT.
228,00:14:04.47,00:14:04.47,THERE'S NOT A LOT OF HAPPY THOUGHTS HERE.
229,00:14:06.60,00:14:06.60,"AND IT REALLY SUCKS IF I HAVE TO QUIT THIS GAME, BUT IT'S, LIKE,"
230,00:14:14.53,00:14:14.53,IS NOT QUITTING NOT WORTH NOT BEING HAPPY?
231,00:14:17.03,00:14:17.03,"AND THAT'S WHERE, YOU KNOW, IT'S A NO-BRAINER TO ME."
232,00:14:20.30,00:14:20.30,">> I MEAN, I KNOW YOUR DECISION IS PROBABLY MADE UP AT THIS"
233,00:14:24.47,00:14:24.47,"POINT. ( LAUGHS."""
234,00:14:26.67,00:14:26.67,>> BUT I JUST WANT YOU KNOW THAT I'D LOVE FOR YOU TO STAY.
235,00:14:31.57,00:14:31.57,">> STOP IT, LAURA! >> REALLY, SHAMAR."
236,00:14:33.80,00:14:33.80,I THINK BECAUSE WE'RE ALL SUCH BIG FANS OF THE SHOW WE WERE ALL
237,00:14:36.47,00:14:36.47,A LITTLE BIT THROWN BACK BY THE FACT THAT SHAMAR WOULD TAKE IT
238,00:14:41.47,00:14:41.47,"SO FAR AS TO QUIT. >> AFTER I CAME HOME FROM IRAQ,"
239,00:14:44.27,00:14:44.27,I HAD A VERY TOUGH TIME ADJUSTING TO LIFE OUTSIDE OF THE
240,00:14:48.97,00:14:48.97,MILITARY. I WAS AN ALCOHOLIC.
241,00:14:50.67,00:14:50.67,"AND I HAD A LOT OF ANGER ISSUES. WHEN I FIRST CAME HOME, PEOPLE"
242,00:14:54.73,00:14:54.73,WERE LIKE EVEN SCARED TO BE AROUND ME.
243,00:14:57.80,00:14:57.80,"BECAUSE I WAS IN THAT DARK PLACE, LIKE PEOPLE DIDN'T KNOW"
244,00:15:00.50,00:15:00.50,HOW I WAS GOING TO REACT TO THINGS.
245,00:15:02.27,00:15:02.27,THEY DIDN'T KNOW WHAT I WAS GOING TO DO.
246,00:15:04.10,00:15:04.10,"THERE WAS SITUATIONS THAT HAPPENED IN IRAQ THAT, YOU KNOW,"
247,00:15:06.70,00:15:06.70,IT WAS HARD FOR ME TO LIVE WITH YOU KNOW.
248,00:15:10.07,00:15:10.07,I WATCHED SUICIDE BOMBINGS IN FRONT OF ME.
249,00:15:13.07,00:15:13.07,"I SEEN MY FRIENDS IN BODY BAGS, AND I'VE JUST BEEN IN A LOT OF"
250,00:15:16.97,00:15:16.97,TIGHT SITUATIONS THAT I JUST CAN'T FORGET ABOUT.
251,00:15:19.57,00:15:19.57,"AFTER SOME TIME, I LEARNED TO LOVE MYSELF, AND I GOT OUT OF"
252,00:15:26.37,00:15:26.37,THAT DARK PLACE. I COME HERE.
253,00:15:29.23,00:15:29.23,I TRY TO BE A HAPPY PERSON. I TRY TO UPLIFT EVERYBODY.
254,00:15:34.43,00:15:34.43,AND EVERYTHING IS SHAMAR'S DOING THIS.
255,00:15:37.27,00:15:37.27,SHAMAR'S DOING THAT. CERTAIN PEOPLE TALKING TO ME
256,00:15:41.63,00:15:41.63,CONDESCENDINGLY AND IT'S JUST PUTTING ME IN THE ANGER ROOM.
257,00:15:43.73,00:15:43.73,SO THAT'S WHY I'M REALLY LEAVING.
258,00:15:45.73,00:15:45.73,IT'S JUST-- I WANT TO GET THAT HAPPINESS BACK IN MY LIFE.
259,00:15:48.97,00:15:48.97,>> I'M JUST SCARED SHAMAR YOU'RE GOING TO LOOK BACK AND REGRET
260,00:15:51.87,00:15:51.87,IT. >> REGRET WHAT?
261,00:15:53.43,00:15:53.43,I KNOW THAT IT'S NOT GOING TO GET REQUEST BETTER.
262,00:15:55.87,00:15:55.87,>> I DON'T KNOW WHAT IT'S LIKE OVER IN IRAQ.
263,00:15:58.13,00:15:58.13,I DON'T KNOW HOW MANY PEOPLE HE KILLED.
264,00:15:59.83,00:15:59.83,I DON'T KNOW WHY HE'S GOING TO THIS DARK PLACE BUT I REALLY
265,00:16:03.93,00:16:03.93,BELIEVE HE'S GOING TO LOOK BACK IF HE QUITS AND-- HE'S NOT
266,00:16:08.97,00:16:08.97,REALIZING WHAT HE'S DOING TO HIMSELF IF HE QUITS.
267,00:16:10.73,00:16:10.73,"I MEAN, THE THING THAT SUCKS IS IF YOU DECIDE TO LEAVE AND THEN"
268,00:16:15.10,00:16:15.10,"WE END UP LOSING AND HAVE TO GO TO TRIBAL COUNCIL, THAT WE HAVE"
269,00:16:18.10,00:16:18.10,TO THEN VOTE OUT SOMEBODY ELSE. >> THAT'S THE THING IS THAT
270,00:16:22.47,00:16:22.47,WE'LL BE DOWN TWO IF YOU QUIT. >> YOU'RE MY LADIES.
271,00:16:31.03,00:16:31.03,"I FEEL LIKE IN TALKING TO YOU GUYS, AND ME SAYING, WELL, I"
272,00:16:35.53,00:16:35.53,RESPECT LOYALTY AND LOYALTY MEANS EVERYTHING TO ME.
273,00:16:37.73,00:16:37.73,AND YOU GUYS HAVE BEEN LOYAL TO ME.
274,00:16:40.80,00:16:40.80,SO I FEEL LIKE I'D BE DOING YOU A DISSERVICE TO JUST LEAVE YOU
275,00:16:44.47,00:16:44.47,RIGHT NOW. JUST WHEN I KNOW HOW LOYAL YOU
276,00:16:46.97,00:16:46.97,"HAVE BEEN ON, AND YOU GUYS ACTUALLY STUCK UP FOR ME, SO, I"
277,00:16:52.93,00:16:52.93,REALLY RESPECT THAT. AND BECAUSE OF THAT I'LL STAY
278,00:16:54.93,00:16:54.93,AND FIGHT FOR YOU GUYS A FEW MORE DAYS.
279,00:16:57.90,00:16:57.90,>> THANK YOU. >> I HAD MY HOPES UP A LITTLE
280,00:17:01.77,00:17:01.77,"BIT THAT SHAMAR WOULD QUIT, BUT DEEP DOWN I KNEW HE WOULDN'T"
281,00:17:05.33,00:17:05.33,"FOLLOW THROUGH ITW IT AND HE'D TURN IT INTO THIS, LIKE, SHAMAR"
282,00:17:09.93,00:17:09.93,IS ALL ABOUT LOYALTY AND MADE HIMSELF A HERO FOR UNQUITTING
283,00:17:14.70,00:17:14.70,"THE GAME OF ""SURVIVOR"" THAT 50,000 PEOPLE WOULD LINE UP FOR"
284,00:17:19.20,00:17:19.20,DAYS JUST TO GET A CHANCE TO PLAY.
285,00:17:21.13,00:17:21.13,I DON'T KNOW. THAT'S NO HER OAK MOVE IN MY
286,00:17:23.87,00:17:23.87,"BOOK, BUT I'M JUST GOING TO PLAY MY GAME, AND SHAMAR IS JUST"
287,00:17:28.43,00:17:28.43,GOING TO BE ONE OF THE FACTORS IN MY GAME AND I'M GOING TO HAVE
288,00:17:31.00,00:17:31.00,TO DEAL WITH IT. >> WHOOO!
289,00:17:57.03,00:17:57.03,>> Jeff: FAVORITES GETTING YOUR FIRST LOOK AT THE NEW TRIBE
290,00:18:00.17,00:18:00.17,OF FANS. ALLIE VOTED OUT AT THE LAST
291,00:18:03.33,00:18:03.33,TRIBAL COUNCIL. YOU GUYS READY TO GET TO TODAY'S
292,00:18:06.50,00:18:06.50,IMMUNITY CHALLENGE? >> YES!
293,00:18:07.73,00:18:07.73,>> YES! >> LET'S DO IT.
294,00:18:09.80,00:18:09.80,">> Jeff: ALL RIGHT, BRANDON, WAR CRY OR NOT, TAKE IT BACK."
295,00:18:17.63,00:18:17.63,"ONCE AGAIN, IMMUNITY IS BACK UP FOR GRABS."
296,00:18:21.07,00:18:21.07,"FOR TODAY'S CHALLENGE, BOTH TRIBES WILL RACE OUT INTO THE"
297,00:18:26.37,00:18:26.37,WATER TO A LARGE BAMBOO CAGE. YOU'LL CLIMB OVER THE CAGE AND
298,00:18:30.73,00:18:30.73,INTO THE WATER WHERE YOU WILL FIND A VERY HEAVY CHEST.
299,00:18:35.13,00:18:35.13,YOU MUST THEN UNTIE THE CAGE DOOR AND DRAG THE CHEST THROUGH
300,00:18:39.47,00:18:39.47,THE CAGE AND ALL THE WAY BACK TO SHORE.
301,00:18:42.47,00:18:42.47,YOU'LL THEN PLACE THE CHEST ON A TRACK AND USE A GRAPPLING RING
302,00:18:46.50,00:18:46.50,TO RETRIEVE THREE MISSING SECTIONS OF TRACK.
303,00:18:49.07,00:18:49.07,YOU WILL THEN PUSH YOUR CHEST TO THE FINISH.
304,00:18:52.20,00:18:52.20,FIRST TRIBE TO GET THEIR CHEST ON THE FINISH PLATFORM WINS
305,00:18:57.00,00:18:57.00,"IMMUNITY, IS SAFE FROM THE VOTE. LOSERS GO TO TRIBAL COUNCIL,"
306,00:19:01.23,00:19:01.23,WHERE SOMEBODY WILL BE VOTED OUT.
307,00:19:02.90,00:19:02.90,"IN ADDITION, YOU ARE PLAYING FOR REWARD."
308,00:19:05.20,00:19:05.20,WANT TO KNOW WHAT YOU'RE PLAYING FOR.
309,00:19:07.23,00:19:07.23,">> YES! >> YES, SIR."
310,00:19:09.77,00:19:09.77,>> Jeff: COMFORT. >> YES!
311,00:19:11.53,00:19:11.53,>> CHAIRS! ( APPLAUSE )
312,00:19:13.37,00:19:13.37,">> HELLO! >> Jeff: YOU HAVE CHAIRS,"
313,00:19:17.40,00:19:17.40,PILLOW AND A BLANKET AND YOU ALSO HAVE A TARP.
314,00:19:19.77,00:19:19.77,">> YES! >> OH, MAN!"
315,00:19:21.70,00:19:21.70,">> Jeff: ALL RIGHT, WE ARE EVEN UP, 9-9."
316,00:19:25.00,00:19:25.00,"GIVE YOU A MINUTE TO STRATEGIZE, WE'LL GET STARTED."
317,00:19:37.90,00:19:37.90,"HERE WE GO, FOR IMMUNITY AND REWARD."
318,00:19:40.70,00:19:40.70,SURVIVORS READY? GO!
319,00:19:49.63,00:19:49.63,"EVERYBODY IN THE WATER. SOME STRONG SWIMS, OR BOTH"
320,00:19:55.30,00:19:55.30,TRIBES. AND SOME NOT-SO-STRONG SWIMMERS
321,00:19:58.50,00:19:58.50,ON BOTH TRIBES. YOU CAN MAKE YOUR WAY UP AND
322,00:20:02.17,00:20:02.17,OVER THIS CAGE BUT YOU CAN'T START WORKING ON THE KNOTS OR
323,00:20:06.83,00:20:06.83,START DRAGGING THE CHEST UNTIL EVERYBODY'S OVER
324,00:20:11.37,00:20:11.37,LAURA WAY BACK. SHE IS ON HER OWN.
325,00:20:13.60,00:20:13.60,">> COME ON, LAURA! >> OPENING THE DOOR FOR THE"
326,00:20:17.07,00:20:17.07,FAVORITES AND A BIG LEAD. REYNOLD GOING BACK TO GIVE HER A
327,00:20:22.83,00:20:22.83,HAND. >>> Jeff: A LOT OF
328,00:20:30.37,00:20:30.37,TENTATIVENESS ON BOTH TRIBES RIGHT NOW.
329,00:20:34.33,00:20:34.33,FAVORITES ARE ALL IN. START WORKING!
330,00:20:37.47,00:20:37.47,FANS ARE ALL IN. START WORKING!
331,00:20:41.73,00:20:41.73,YOU HAVE TO UNTIE THE FRONT DISPERSANT OF THE CAGE.
332,00:20:46.90,00:20:46.90,>> SOMEBODY TOOK THE GOGGLES. I WEAR CONTACTS.
333,00:20:50.93,00:20:50.93,"I CAN'T SEE. >> COME ON, GUYS!"
334,00:20:57.90,00:20:57.90,>> WHERE'S THE GOGGLES? >> Jeff: FANS ARE THROUGH!
335,00:21:09.30,00:21:09.30,START DRAGGING THAT CHEST! FAVORITES ARE FALLING BEHIND.
336,00:21:27.73,00:21:27.73,FAVORITES NOW HAVE RELEASED THEIR CAGE.
337,00:21:30.03,00:21:30.03,BOTH TRIBES ARE NOW DRAGGING THEIR CHEST
338,00:21:41.60,00:21:41.60,GREAT WORK BY THE FANS. THEY ARE MOVING EN MASS TOWARD
339,00:21:46.23,00:21:46.23,THAT BEACH. FAVORITES STILL TRYING TO GET A
340,00:21:52.97,00:21:52.97,SYSTEM GOING FAVORITES FALLING FURTHER BEHIND
