,begin,end,subtitles_text
341,00:22:05.50,00:22:05.50,NOW. >> COME ON!
342,00:22:07.90,00:22:07.90,>> Jeff: IT IS VERY HEAVY. IT TAKES ALL NINE TRIBE MEMBERS
343,00:22:10.80,00:22:10.80,"TO LIFT THIS CHEST. AND JUST LIKE THAT, THE"
344,00:22:13.17,00:22:13.17,FAVORITES HAVE NOW CAUGHT UP BOTH TRIBES GOING WITH THE
345,00:22:18.33,00:22:18.33,ROLLING METHOD. IT IS TOO HEAVY TO PICK UP.
346,00:22:22.20,00:22:22.20,>> ONE MORE ROLL. >> Jeff: BOTH TRIBES HAVE TO
347,00:22:28.70,00:22:28.70,GET IT ON THE TRACK. FAVORITE GOES FIRST.
348,00:22:30.90,00:22:30.90,FANS NOW GETTING THEIR ON THEIR TRACK
349,00:22:35.43,00:22:35.43,MALCOLM IS GOING TO START TOSSING TRYING TO GRAB THAT
350,00:22:39.37,00:22:39.37,PIECE OF MISSING TRACK. JUST MISSES.
351,00:22:42.37,00:22:42.37,REYNOLD TRYING TO SECURE THAT FIRST PIECE OF TRACK FOR FANS.
352,00:22:45.80,00:22:45.80,REYNOLD HAS IT. EVERYBODY GOT TO PULL.
353,00:22:49.30,00:22:49.30,FANS HAVE THEIR FIRST SECTION TO TRACK.
354,00:22:53.47,00:22:53.47,FAVORITES STILL LOOKING FOR THAT FIRST SEC TO TRAP.
355,00:22:57.43,00:22:57.43,PHILLIP NOW TOSSING FOR THE FAVORITES.
356,00:23:00.97,00:23:00.97,YOU GOT IT. >> Jeff: PHILLIP HAS THE FIRST
357,00:23:05.43,00:23:05.43,SECTION FOR THE FAVORITES! PULL!
358,00:23:08.03,00:23:08.03,FAVORITES HAVE THEIR FIRST SECTION.
359,00:23:10.20,00:23:10.20,"EDDIE NOW TOSSING FOR THE FANS. EDDIE RIGHT THERE, JUST CAN'T DO"
360,00:23:13.57,00:23:13.57,IT. BOTH TRIBES NOW LOOKING FOR THAT
361,00:23:18.17,00:23:18.17,"SECOND SECTION. QUICKLY, MALCOLM HAS THE SECOND"
362,00:23:24.00,00:23:24.00,SECTION FOR THE FAVORITES. FAVORITES NOW IN THE LEAD.
363,00:23:27.23,00:23:27.23,">> ONE TWO, THREE! >> Jeff: GO!"
364,00:23:32.37,00:23:32.37,FANS NOW TRYING TO CATCH UP. SHAMAR IS NOW TOSSING.
365,00:23:40.57,00:23:40.57,SHAMAR HAS THE SECOND SECTION FOR THE FANS.
366,00:23:44.80,00:23:44.80,"GO, FANS! GO!"
367,00:23:49.23,00:23:49.23,BOTH TRIBES NOW LOOKING FOR THAT THIRD AND FINAL SECTION OF
368,00:23:52.43,00:23:52.43,TRACK. IT'S BRANDON AND EDDIE NOW IN A
369,00:23:56.40,00:23:56.40,SHOWDOWN. THIS IS IT RIGHT HERE.
370,00:23:57.87,00:23:57.87,BRANDON VERY CLOSE. JUST MISSING FOR THE FAVORITE.
371,00:24:02.00,00:24:02.00,"EDDIE VERY CLOSE, CAN'T DO IT. >> YOU'RE TOO EXCITED, MAN!"
372,00:24:05.80,00:24:05.80,CALM DOWN! >> Jeff: IT HAS BEEN BACK AND
373,00:24:07.67,00:24:07.67,FORTH IN THIS CHALLENGE. AND IT'S COMING DOWN TO ONE LAST
374,00:24:13.47,00:24:13.47,TOSS. >> FLIP IT.
375,00:24:16.17,00:24:16.17,>> Jeff: BRANDON VERY CLOSE. TRIES TO FLIP IT AND JUST MISSES
376,00:24:22.87,00:24:22.87,AGAIN. THIS CAN DO IT FOR THE FANS IF
377,00:24:24.67,00:24:24.67,HE CAN WORK IT. JUST MISSES AGAIN
378,00:24:30.30,00:24:30.30,">> EASY, EASY. >> Jeff: BRANDON IS RIGHT ON"
379,00:24:35.67,00:24:35.67,IT. THIS COULD DO IT FOR THE
380,00:24:37.20,00:24:37.20,FAVORITES RIGHT HERE. BOTH GUYS VERY CLOSE.
381,00:24:39.27,00:24:39.27,>> EASY >> PULL!
382,00:24:43.00,00:24:43.00,>> Jeff: BRANDON HAS IT FOR THE FAVORITES!
383,00:24:49.33,00:24:49.33,EDDIE'S GOT TO PICK UP THE PACE RIGHT NOW!
384,00:24:50.33,00:24:50.33,>> OH! >> Jeff: JUST MISSES.
385,00:24:55.97,00:24:55.97,FANS NEED TO HOOK IT RIGHT HERE TO HAVE ANY SHOT.
386,00:25:03.27,00:25:03.27,THAT'S IT. FAVORITES WIN IMMUNITY AND
387,00:25:05.50,00:25:05.50,REWARD!  ( CHEERS )
388,00:25:17.70,00:25:17.70,"WELL, THIS CHALLENGE WAS NECK AND NECK FROM THE START BUT ONTO"
389,00:25:22.23,00:25:22.23,"ONE TRIBE CAN WIN. FAVORITES, CONGRATULATIONS."
390,00:25:24.80,00:25:24.80,COME GET YOUR REWARD. HEAD BACK TO CAMP.
391,00:25:27.63,00:25:27.63,"ENJOY THE NIGHT OFF. ALL RIGHT, FANS."
392,00:25:33.33,00:25:33.33,GOT NOTHING FOR YOU EXCEPT A DATE WITH ME TONIGHT AT TRIBAL
393,00:25:36.90,00:25:36.90,COUNCIL WHERE SOMEBODY WILL BE THE THIRD PERSON VOTED OUT OF
394,00:25:39.53,00:25:39.53,"THIS GAME. GRAB YOUR STUFF, HEAD BACK TO"
395,00:25:41.63,00:25:41.63,CAMP. SEE YOU AT TRIBAL.
396,00:25:56.70,00:25:56.70,TRYING TO PAT OURSELVES ON THE BACK IN ANY WAY BECAUSE WE LOST
397,00:26:00.70,00:26:00.70,AND WE HAVE TO GO TO TRIBAL COUNCIL NOW.
398,00:26:05.63,00:26:05.63,">> YEAH, AND SHAMAR, I'M NOT DISCREDITING--"
399,00:26:09.90,00:26:09.90,>> DON'T TALK TO ME. I SAID I HAVE CONTACT I NEED
400,00:26:16.93,00:26:16.93,THE GOGGLES. YOU LOOK AT ME AND KEPT GOING.
401,00:26:19.17,00:26:19.17,THAT WAS DISRESPECTFUL. I THINK THAT WAS DISGUSTING.
402,00:26:21.63,00:26:21.63,>> IF YOU NEEDED GOGGLES-- >> I SAID I NEEDED GOGGLES AND
403,00:26:24.67,00:26:24.67,YOU BROUGHT THEM DOWN AND YOU TOOK THEM.
404,00:26:27.13,00:26:27.13,>> THIS ISN'T WHY WE LOST. YOU DISGUST ME.
405,00:26:29.67,00:26:29.67,YOU DISGUST ME. >> SHAMAR GOES OFF IN HIS
406,00:26:37.00,00:26:37.00,STUBBORN SHAMAR WAY AND CURSES ME AND CALLS ME NAMES.
407,00:26:41.13,00:26:41.13,HE IS LESS MATURE THAN MY NEPHEW GRAYSON AND MY NEPHEW IS THREE.
408,00:26:45.83,00:26:45.83,THIS GUY IS RIDICULOUS. >> I KNOW.
409,00:26:47.30,00:26:47.30,>> JUST WHEN I THINK HE CAN'T GET ANY MORE CHILDISH AND HE
410,00:26:50.80,00:26:50.80,DOES. >> HOW MUCH DOES SHE HAVE TO DO
411,00:26:52.50,00:26:52.50,FOR THEM TO SAY ENOUGH IS ENOUGH LET'S JUST VOTE HIM OUT.
412,00:26:57.13,00:26:57.13,>> I'M HERE BECAUSE PEOPLE ARE GOING TO START THROWING MY NAME
413,00:27:02.70,00:27:02.70,OUT. I SUCKED AT TODAY'S CHALLENGE.
414,00:27:04.30,00:27:04.30,I STARTED DOING BACKSTROKE IN THE WRONG DIRECTION.
415,00:27:07.00,00:27:07.00,IT WAS AWFUL. THE SWIMMING PART I JUST
416,00:27:09.00,00:27:09.00,"COULDN'T-- >> IN THIS CHALLENGE, I BLEW IT."
417,00:27:11.67,00:27:11.67,I COULDN'T SWIM AS FAST AS EVERYBODY ELSE.
418,00:27:14.47,00:27:14.47,"FRANKLY, IT WAS PATHETIC, AND I KNOW IT WAS, BUT THAT ALSO MEANS"
419,00:27:17.07,00:27:17.07,"OF THE THREE THAT ARE ON THE OUTS RIGHT NOW, WE NEED TO KEEP"
420,00:27:20.97,00:27:20.97,REYNOLD AND EDDIE AS LONG AS POSSIBLE TO WIN SOME OF THESE
421,00:27:23.77,00:27:23.77,CHALANGES THAT'S WHY TONIGHT IT SHOULD BE HOPE.
422,00:27:26.43,00:27:26.43,"IF THIS GAME WERE ABOUT PHYSICAL STRENGTH, THEY'D BE LOOKING AT"
423,00:27:29.30,00:27:29.30,"ME. >> HOPE IS A SWEETHEART,"
424,00:27:31.43,00:27:31.43,"OBVIOUSLY, BUT IT'S NOT ABOUT THAT."
425,00:27:35.23,00:27:35.23,REYNOLD IS HARD CORE GOOD IN THE CHALLENGES.
426,00:27:37.63,00:27:37.63,>> WE NEED THEM. >> YOU KNOW WHAT I'M SAYING?
427,00:27:39.53,00:27:39.53,WE NEED EDDIE AND REYNOLD. >> THEN THEY CAN GIVE THE IDOL
428,00:27:42.63,00:27:42.63,TO HOPE. >> I DON'T TRUST HER.
429,00:27:46.00,00:27:46.00,LET'S SAY WE SPLIT VOTES BETWEEN HOPE AND EDDIE AND THE FINAL
430,00:27:51.70,00:27:51.70,"VOTE, WHEN WE REVOTE WILL BE FOR HOPE DO WE WANT TO SAY GIRLS"
431,00:27:57.40,00:27:57.40,"VOTE FOR HOPE, BOYS VOTE FOR EDDIE AND MAKE IT SIMPLE?"
432,00:28:00.80,00:28:00.80,"WE HAVE THREE GIRLS, THREE BOYS. >> BOYS ARE VOTING FOR EDDIE."
433,00:28:04.67,00:28:04.67,GIRLS ARE VOTING FOR HOPE. THEY'RE TRYING TO FLUSH OUT THE
434,00:28:08.33,00:28:08.33,"IDOL. SO WE NEED THREE EDDIE, THREE"
435,00:28:11.17,00:28:11.17,"HOPE. IF THEY PLAY THE IDOL, THEN THE"
436,00:28:15.37,00:28:15.37,IDOL COMES OUT. AND WE KNOW WHERE IT IS.
437,00:28:17.70,00:28:17.70,">> BUT THEN THERE ARE GOING TO BE THREE EDDIE, THREE HOPE, AND"
438,00:28:20.83,00:28:20.83,THREE ME. >> I AM THE ONE WHO IS
439,00:28:23.30,00:28:23.30,CONTROLLING SHAMAR. I'M KEEPING HIM CALM.
440,00:28:26.23,00:28:26.23,">> ALL RIGHT, SO I JUST VOTE FOR WHO?"
441,00:28:28.67,00:28:28.67,>> EDDIE. >> I JUST NEED SHAMAR TO KEEP
442,00:28:31.27,00:28:31.27,HIS MOUTH SHUT UNTIL WE ONE BY ONE KNOCK THEM OUT.
443,00:28:34.87,00:28:34.87,"REYNOLD, EDDIE AND HOPE. HOPEFULLY IT'S HOPE TONIGHT."
444,00:28:42.40,00:28:42.40,">> IT'S NOT A GOOD FEELING ROORK RIGHT, WHEN YOU KNOW YOU DIDN'T"
445,00:28:46.60,00:28:46.60,"DO ANYTHING WRONG BUT EVERYBODY WANTS TO GET YOU, RIGHT?"
446,00:28:49.17,00:28:49.17,I'VE BEEN THERE. ( LAUGHS )
447,00:28:51.90,00:28:51.90,>> YEAH-- >> IT'S NOT THE BEST FEELING.
448,00:28:56.27,00:28:56.27,I'M JUST TRYING TO ENJOY MY LAST LITTLE MOMENT.
449,00:28:59.43,00:28:59.43,"YOU KNOW, I'M CONCERNED I'M ON THE CHOPPING BLOCK TONIGHT."
450,00:29:03.57,00:29:03.57,REYNOLD IS SAFE BECAUSE HE HAS THE IDOL.
451,00:29:05.63,00:29:05.63,I CAN'T SEE HIM GIVING UP HIS IDOL BECAUSE IT'S SUCH A RISKY
452,00:29:09.03,00:29:09.03,"MOVE. >> IF IT I WAS UP TO ME, IT"
453,00:29:12.43,00:29:12.43,"WOULD BE DIFFERENT, I WOULD TAKE HIM OUT."
454,00:29:14.27,00:29:14.27,"BUT HE HAS THAT NECKLACE. TRUST ME, I WOULD MUCH RATHER"
455,00:29:19.60,00:29:19.60,YOU STAY. YOU'RE NOT 99% IN THE HOLE.
456,00:29:22.23,00:29:22.23,"I'LL BE HONEST, I'M NOT VOTING FOR YOU TONIGHT."
457,00:29:24.87,00:29:24.87,">> WELL, I APPRECIATE THAT. I FEEL LIKE IT'S OUT OF MY"
458,00:29:32.17,00:29:32.17,CONTROL NOW. >> YOU CAN ALWAYS THROW THE
459,00:29:35.23,00:29:35.23,VOTE. A DIFFERENT WAY.
460,00:29:39.20,00:29:39.20,"YOU COULD ALWAYS VOTE FOR ONE OF THOSE GUYS, YOU KNOW?"
461,00:29:42.23,00:29:42.23,THAT'S ALL I'M GOING TO TELL YOU.
462,00:29:44.07,00:29:44.07,"IT DEPENDS ON WHAT YOU WANT TO DO, WHICH WAY YOU WANT TO GO."
463,00:29:46.67,00:29:46.67,"WHEN HOPE CAME DOWN TO THE WATER, I KIND OF-- YOU KNOW, I"
464,00:29:49.27,00:29:49.27,GET ALONG WITH HER BETTER THAN I GET ALONG WITH EDDIE AND
465,00:29:52.17,00:29:52.17,"REYNOLD, SO I NATURALLY WANT HER TO STAY, AND SO-- LIKE I TRIED"
466,00:29:57.27,00:29:57.27,TO GIVE HER A HINT ON WHAT WOULD SAVE HER FATE.
467,00:30:00.63,00:30:00.63,AFTER YOU SEE WHAT HAPPENS YOU'LL UNDERSTAND WHAT I'M
468,00:30:03.27,00:30:03.27,SAYING. WE'RE GOING TO SPLIT THE VOTE
469,00:30:04.80,00:30:04.80,"TONIGHT BETWEEN HER AND EDDIE, SO I BASICALLY KIND OF SAID,"
470,00:30:07.63,00:30:07.63,"LIKE, ALL SHE HAS TO DO IS VOTE UNDER EDDIE TO SAVE HERSELF."
471,00:30:11.07,00:30:11.07,BUT I DON'T KNOW IF SHE'S REALLY GOING TO TAKE HEED.
472,00:30:15.00,00:30:15.00,>> I TALKED TO SHAMAR. >> UH-HUH.
473,00:30:18.53,00:30:18.53,>> AND HE JUST MADE IT SOUND LIKE IT WAS FOR SURE THE GROUP
474,00:30:22.13,00:30:22.13,HAD DECIDE IT WAS ME OR EDDIE GOING HOME.
475,00:30:25.30,00:30:25.30,>> SHAMAR TOLD HOPE THE PLAN THAT WE'RE DOING.
476,00:30:28.83,00:30:28.83,AND THEE JUST CAME TO ME. >> THE ENTIRE PLAN.
477,00:30:31.50,00:30:31.50,>> YEP. >> NOW HE IS NO LONGER IN THIS
478,00:30:34.03,00:30:34.03,GAME. HE'S JUST ( BLEEP ).
479,00:30:36.13,00:30:36.13,SHAMAR DRIVES ME CRAZY IN EVERY SENSE POSSIBLE.
480,00:30:38.33,00:30:38.33,>> AND COULDN'T BELIEVE THAT HE BLURBED WHAT OUR PLAN WAS
481,00:30:41.00,00:30:41.00,BECAUSE I THINK HE DOESN'T CARE ABOUT THE GAME.
482,00:30:43.60,00:30:43.60,SHAMAR JUST TOLD HOPE THAT-- OUR PLAN.
483,00:30:48.20,00:30:48.20,YUP. >> I CAN'T BELIEVE IT BUT I CAN
484,00:30:50.73,00:30:50.73,BELIEVE IT THAT SHAMAR JUST OPENED HIS MOUTH.
485,00:30:53.23,00:30:53.23,>> IF HE JUST TOLD HOPE THE PLAN HE'S NOT PLANNING ON VOTING WITH
486,00:30:57.87,00:30:57.87,"US, IS HE. SHAMAR AT THIS POINT I BELIEVE"
487,00:31:01.63,00:31:01.63,IS A COMPLETE WILD CARD. >> ARE YOU WORRIED ABOUT SHAMAR
488,00:31:04.47,00:31:04.47,NOT VOTING WITH US? >> YUP.
489,00:31:06.13,00:31:06.13,">> OH, MY GOD, I'M SCARED. I'M IN A PRETTY ROUGH SPOT"
490,00:31:09.70,00:31:09.70,"BECAUSE IF THOSE THREE DO HAVE THE IDOL, I'M WORRIED IF"
491,00:31:13.07,00:31:13.07,"SOMETHING WERE TO GO WRONG, IT'S PROBABLY MY NAME THAT'S ON THE"
492,00:31:16.40,00:31:16.40,CHOPPING BLOCK. >> I CAN GET JULIA TO VOTE
493,00:31:22.97,00:31:22.97,SHAMAR TONIGHT. >> RIGHT.
494,00:31:23.67,00:31:23.67,>> I CAN. >> I'M REALLY CLOSE TO JULIA.
495,00:31:24.53,00:31:24.53,>> UH-HUH. >> THERE'S THREE OF YOU AND
496,00:31:25.37,00:31:25.37,THERE'S TWO OF US. THAT MAKES FIVE.
497,00:31:26.43,00:31:26.43,>> UH-HUH. >> AND WE JUST NEED FIVE TO GET
498,00:31:28.77,00:31:28.77,THE VOTE. I'M ABSOLUTELY IN.
499,00:31:32.23,00:31:32.23,TO GET SHAMAR TONIGHT. >> YUP.
500,00:31:33.63,00:31:33.63,"IF YOU CAN GAWRNLT-- IF YOU CAN GET JULIA, I'M ON TEAM SHAMAR."
501,00:31:37.70,00:31:37.70,I'M GOING TO VOTE SHAMAR EVERY DAY.
502,00:31:39.77,00:31:39.77,YEAH. YOU KNOW I WANT HIM OUT.
503,00:31:41.60,00:31:41.60,THIS GAME HAS CHANGE FLAFTD HOUR.
504,00:31:43.67,00:31:43.67,THE LATEST DEVELOPMENT WHICH I HAVE A REALLY GOOD FEELING ABOUT
505,00:31:45.93,00:31:45.93,IS THAT SHAMAR IS GOING HOME. I CAN GUARANTEE YOU THREE FOR
506,00:31:51.43,00:31:51.43,SHAMAR. YOU HAVE TO GET THE OTHER TWO.
507,00:31:53.47,00:31:53.47,>> I'LL TALK TO THEM. >> DO IT.
508,00:31:55.97,00:31:55.97,"IT'S GOING TO BE GREAT. THIS COULD BE EPIC, EPIC TRIBAL"
509,00:32:00.30,00:32:00.30,COUNCIL. EVERY GOES AWRY TONIGHT I MIGHT
510,00:32:02.90,00:32:02.90,HAVE TO PULL SOME CRAZY MOVES WITH THE IDOL BUT HOPEFULLY WE
511,00:32:07.17,00:32:07.17,SEND SHAMAR PACKING TONIGHT. IT WOULD BE LIKE CHRISTMAS.
512,00:32:32.50,00:32:32.50,">> Jeff: SO, REYNOLD, A LOT WAS SAID AT THE LAST TRIBAL"
513,00:32:35.57,00:32:35.57,COUNCIL. WAS THERE ANY FALLOUT WHEN YOU
514,00:32:37.20,00:32:37.20,GUYS GOT BACK TO CAMP? >> YEAH.
515,00:32:38.67,00:32:38.67,I DON'T RECALL ME DOING SO MUCH YELLING BECAUSE I WAS CONFUSED.
516,00:32:42.50,00:32:42.50,I WAS SHOCKED. I DIDN'T KNOW WHAT HAPPENED.
517,00:32:44.37,00:32:44.37,"BUT I HEARD SHAMAR SCREAMING FROM, LIKE,  A KILOMETER AWAY AT"
518,00:32:48.43,00:32:48.43,EVERYBODY. I DIDN'T KNOW WHAT TFS ABOUT BUT
519,00:32:50.30,00:32:50.30,ON I WAS NOT SURPRISED. IT'S PAR FOR THE COURSE FOR HIM.
520,00:32:53.10,00:32:53.10,">> Jeff: SHAMAR, ONCE AGAIN ON THE HOT SEAT, AND ALL IT"
521,00:32:57.63,00:32:57.63,SURROUNDING YOUR TEMPER OR YOUR ATTITUDE.
522,00:32:59.53,00:32:59.53,">> WELL, IT WASN'T A KILOMETER AWAY."
523,00:33:02.10,00:33:02.10,I WAS YELLING AT HIM ABOUT HIM BEING UPSET ABOUT HIS PLAN NOT
524,00:33:05.03,00:33:05.03,"WORKING. I DON'T KNOW, MY NAME COMES UP"
525,00:33:08.47,00:33:08.47,WITH EVERYTHING. I'M LIKE THE SCAP SCAPEGOAT FOR
526,00:33:12.33,00:33:12.33,EVERYBODY JUNK. >> Jeff: ARE YOU OFTEN
527,00:33:13.97,00:33:13.97,MISUNDERSTOOD? >> NOT THIS MUCH.
528,00:33:16.57,00:33:16.57,THESE PEOPLE PUT OUT CERTAIN PERCEPTIONS.
529,00:33:18.67,00:33:18.67,WHEN YOU ARE DEALING WITH PEOPLE WHO ARE LYING --
530,00:33:20.57,00:33:20.57,>> WHO HERE HAS LIED? >> REYNOLD HAS LIED.
531,00:33:23.40,00:33:23.40,">> JEFF, I DON'T KNOW WHEN I LIED TO SHAMAR BECAUSE HE HAS A"
532,00:33:29.07,00:33:29.07,POLICY WHERE I'M NOT ATHROWD TALK TO HIM.
533,00:33:30.70,00:33:30.70,">> BUT YOU STILL DO IT. >> Jeff: SHAMAR, YOU TOLD HIM,"
534,00:33:33.90,00:33:33.90,JUST DON'T TALK TO ME. >> BUT HE STILL DOES IT.
535,00:33:36.57,00:33:36.57,>> Jeff: IT IS A SOCIAL GAME. >> EIGHT SOCIAL GAME AND HE'S
536,00:33:39.93,00:33:39.93,"TRYING TO PLAY THAT ASPECT OF THE GAME OH, I'M FRIENDLY TO"
537,00:33:42.37,00:33:42.37,EVERYBODY AND HE DOESN'T WANT TO TALK TO ME.
538,00:33:43.97,00:33:43.97,YOU KNOW WHAT I MEAN? DON'T PLAY THAT GAME WITH ME.
539,00:33:46.40,00:33:46.40,I THINK YOU'RE AN EVIL PERSON. JUST LEAVE ME ALONE.
540,00:33:49.67,00:33:49.67,">> Jeff: HOPE, WHAT'S YOUR TAKE ON SHAMAR?"
541,00:33:51.60,00:33:51.60,">> I SPOKE WITH SHAMAR TODAY IN THE WATER, AND HE SAID IT'S 99%"
542,00:33:55.97,00:33:55.97,SURE YOU'RE GOING HOME TONIGHT. >> THAT IS NOT TRUE.
543,00:34:01.37,00:34:01.37,">> HE SAID IF I WERE YOU, I WOULD TURN ON YOUR FRIEND"
544,00:34:06.63,00:34:06.63,BECAUSE REYNOLD IS NOT GOING TO GIVE YOU THE IDOL.
545,00:34:11.43,00:34:11.43,>> YOU SAID YOU WERE GOING HOME AND I SAID THAT'S NOT 99% TRUE.
546,00:34:17.47,00:34:17.47,EVERYBODY HERE IS LET'S THROW SHAMAR UNDER THE BUS.
547,00:34:20.70,00:34:20.70,I DON'T KNOW WHY I COME IN SMILING AND MAKING JOKES IT'S
548,00:34:25.03,00:34:25.03,"LIKE TO KEEP THE HEAT OFF OF ME, JUST BLAME IT ON HIM."
549,00:34:28.30,00:34:28.30,"I DON'T KNOW, IT IS WHAT IT IS. >> Jeff: MATT WHAT, IS IT"
550,00:34:30.53,00:34:30.53,ABOUT SHAMAR THAT HE FEELS VERY PICKED ON.
551,00:34:33.37,00:34:33.37,"HE FEELS LIKE, ""WHY ME?"" >> I THINK SHAMAR GETS A LITTLE"
552,00:34:37.37,00:34:37.37,"CARRIED AWAY WITH HIS ATTITUDE, AND SEEMS TO GET AGGRAVATED REAL"
553,00:34:41.70,00:34:41.70,EASILY. AND I THINK HIS PERSONALITY IS
554,00:34:44.10,00:34:44.10,JUST KIND OF RUBBING PEOPLE IN THE TRIBE THE WRONG WAY.
555,00:34:46.87,00:34:46.87,">> Jeff: JULIA, THE ENTIRE TIME MATT WAS TALKING YOU WERE"
556,00:34:50.73,00:34:50.73,RELIVING A TRAUMA JUST SHAKING YOUR HEAD?
557,00:34:53.20,00:34:53.20,">> YES, AFTER THE TRIBAL COUNCIL HE FELT ATTACKED AND WANTED TO"
558,00:34:57.13,00:34:57.13,JUSTIFY WHAT WE HAD SAID AT TRIBAL AND HE SCREAMED AT ME
559,00:35:01.20,00:35:01.20,"AGAIN, AGAIN AND AGAIN. ""YOU'RE WEAK."
560,00:35:04.03,00:35:04.03,"YOU'RE A WEAK PERSONALITY AND PROJECTING IT ON TO ME."""
561,00:35:07.90,00:35:07.90,">> Jeff: SHAMAR, THAT DID NOT HAPPEN, EITHER?"
562,00:35:09.73,00:35:09.73,>> NO. >> AND THAT'S THE ESSENCE OF THE
563,00:35:12.13,00:35:12.13,PROBLEM. PEOPLE TAKE WHAT I SAY AND
564,00:35:13.87,00:35:13.87,EMBELLISH THEM BECAUSE THEY FEEL A CERTAIN WAY.
565,00:35:15.43,00:35:15.43,AND I CAN'T DO ANYTHING ABOUT THAT.
566,00:35:17.07,00:35:17.07,YOU KNOW WHAT I'M SAYING? >> Jeff: SO FAR JUST IN A FEW
567,00:35:20.43,00:35:20.43,"MINUTE, SHAMAR, YOU'VE HAD A BEEF WITH JULIA, MATT, HOPE, AND"
568,00:35:24.07,00:35:24.07,REYNOLD. >> AND HAVEN'T TALKED TO SHERRI
569,00:35:27.53,00:35:27.53,OR MICHAEL. >> ASK THEM.
570,00:35:28.80,00:35:28.80,">> Jeff: SHERRI, WHY IS IT THIS ONE GUY IS TAKING ALL THE"
571,00:35:32.57,00:35:32.57,"HEAT WHEN HE SAYS, ""I'M NOT DOING ANYTHING?"""
572,00:35:35.00,00:35:35.00,">> OKAY, SHAMAR-- I'VE MET LOTS OF SHAMARS."
573,00:35:38.70,00:35:38.70,"I GET SHAMAR. HE JUST RUBS THEM THE WRONG WAY,"
574,00:35:41.33,00:35:41.33,"AND ONCE YOU CROSS HIM, YOU JUST CAN'T GO BACK."
575,00:35:45.40,00:35:45.40,"AND THEY CROSSED HIM. IN HIS MIND, THAT'S IT."
576,00:35:48.33,00:35:48.33,">> THAT'S EXACTLY RIGHT. >> Jeff: OKAY, SO, THE OTHER"
577,00:35:51.37,00:35:51.37,BIG THING GOING ON IN THIS TRIBE IS WHAT CAME OUT AT THE LAST
578,00:35:54.90,00:35:54.90,"TRIBAL COUNCIL, AND THAT'S REYNOLD AND HOPE AND EDDIE AND"
579,00:35:58.23,00:35:58.23,"ALLIE, WHO WAS VOTED OUT, BEING THIS SORT OF FOURSOME."
580,00:36:01.70,00:36:01.70,"SO, HOPE, ARE YOU CONCERNED ABOUT TONIGHT'S VOTE?"
581,00:36:03.70,00:36:03.70,">> ABSOLUTE. I MEAN, AFTER LAST TRIBAL I"
582,00:36:08.30,00:36:08.30,WOULD SAY I WOULD BE NEXT ON THE CHOPPING BLOCK.
583,00:36:10.57,00:36:10.57,">> Jeff: SO IF IT'S NOT YOU, WHO WOULD YOU PUT THE VOTE ON"
584,00:36:14.17,00:36:14.17,"HONESTLY, I HATE TO GO BACK TO SHAMAR BUT I JUST FEEL"
585,00:36:17.50,00:36:17.50,LIKE HE BRINGS A LOT OF NEGATIVE ENERGY TO THE TRIBE AND I JUST
586,00:36:20.43,00:36:20.43,DON'T REALLY SEE IT CHANGE THRAG MUCH.
587,00:36:23.70,00:36:23.70,"SO... >> Jeff: AND, EDDIE, CONCERNED"
588,00:36:26.20,00:36:26.20,AFTER THE LAST TRIBAL COUNCIL THAT THEY LOOK AT AND YOU THINK
589,00:36:28.87,00:36:28.87,HE'S FLIRTING WITH HOPE. HE'S ALIGNED WITH REYNOLD.
590,00:36:31.83,00:36:31.83,"HE'S TOO CHARMING, AND HE'S TOO FIT."
591,00:36:33.83,00:36:33.83,"WE CAN'T LET HIM LAST. >> YEAH, I MEAN, I ABSOLUTELY"
592,00:36:36.33,00:36:36.33,FEEL LIKE I HAVE BEEN WEARING A TARGET ON MY BACK FOR QUITE SOME
593,00:36:39.97,00:36:39.97,TIME NOW. >> Jeff: DID YOU GET VOTES
594,00:36:42.67,00:36:42.67,LAST NAME TIME? >> I DID NOT GET VOTES LAST TIME
595,00:36:46.00,00:36:46.00,BUT SHAMAR HAS BEEN TRYING TO GET ME OUT SINCE DAY ONE WHICH I
596,00:36:49.63,00:36:49.63,HAVE BEEN DOING TO HIM. SHAMAR HATE ME AS MUCH AS
597,00:36:53.37,00:36:53.37,REYNOLD. I'M NOT ALLOWEDDED TO TALK TO
598,00:36:55.50,00:36:55.50,HIM AT CAMP. >> Jeff: YOU'RE ON THE
599,00:36:57.93,00:36:57.93,NO-TALKING LIST. >> THE REASON I PUT YOU ON THE
600,00:37:00.63,00:37:00.63,NO-TALKING LIST IS YOU'RE A FOLLOWER TO THE REAL PERSON I
601,00:37:02.83,00:37:02.83,DON'T LIKE. SO THAT'S IT.
602,00:37:04.43,00:37:04.43,">> Jeff: REYNOLD, HOW BIG A FACTOR IS THE IDOL."
603,00:37:07.70,00:37:07.70,"LAST TRIBAL YOU WERE VERY OPEN-- ""HERE IT IS, I'M GOING TO PLAY"
604,00:37:10.63,00:37:10.63,"IT TONIGHT, AND ""AND PSYCHE YOU DIDN'T PLAY IT."
605,00:37:13.90,00:37:13.90,">> YEAH, IT'S GOING TO BE A POKER GAME FROM HERE UNTIL IT'S"
606,00:37:18.83,00:37:18.83,EVENTUALLY PLAYED POUR I GET VOTED OUT OR WHAT HAVE YOU.
607,00:37:23.43,00:37:23.43,"IT'S A POKER GAME. >> Jeff: WITH THAT, IT IS TIME"
608,00:37:28.40,00:37:28.40,"TO VOTE. MICHAEL, YOU'RE UP."
609,00:37:46.20,00:37:46.20,>> THANKS FOR SERVING OUR COUNTRY.
610,00:37:48.30,00:37:48.30,GOOD LUCK 
611,00:38:12.17,00:38:12.17,>> Jeff: I'LL GO TALLY THEVOTES. IF ANYBODY HAS THE HIDDEN
612,00:38:20.53,00:38:20.53,"IMMUNITY IDOL AND YOU WANT TO PLAY IT, NOW WOULD BE THE TIME"
613,00:38:23.23,00:38:23.23,"TO DO SO. OKAY, ONCE THE VOTES ARE READ,"
614,00:38:36.13,00:38:36.13,THE DECISION IS FINAL. THE PERSON VOTED OUT WILL BE
615,00:38:38.83,00:38:38.83,ASKED TO LEAVE THE TRIBAL COUNCIL AREA IMMEDIATELY.
616,00:38:41.00,00:38:41.00,"I'LL READ THE VOTES. FIRST VOTE, SHAMAR."
617,00:38:50.17,00:38:50.17,HOPE. SHAMAR.
618,00:38:53.97,00:38:53.97,"HOPE. WE'RE TIED, TWO VOTES SHAM ATWO"
619,00:38:56.93,00:38:56.93,VOTES HOPE. SHAMAR.
620,00:39:01.23,00:39:01.23,THREE VOTES SHAMAR. HOPE.
621,00:39:05.27,00:39:05.27,"TIED AGAIN. THREE VOTES SHAMAR, THREE VOTES"
622,00:39:07.80,00:39:07.80,HOPE. EDDIE.
623,00:39:12.37,00:39:12.37,"THAT'S THREE VOTES SHAMAR, THREE VOTES HOPE, ONE VOTE EDDIE."
624,00:39:18.30,00:39:18.30,EDDIE. THAT'S THREE VOTES SHAM THREE
625,00:39:20.60,00:39:20.60,"VOTES HOPE, TWO VOTES EDDIE, ONE VOTE LEFT."
626,00:39:28.47,00:39:28.47,EDDIE. WE HAVE A THREE-WAY TIE.
627,00:39:35.33,00:39:35.33,"ALL RIGHT, THIS IS WHAT'S GOING TO HAPPEN."
628,00:39:37.77,00:39:37.77,"WE'RE GOING TO REVOTE. YOU CAN ONLY VOTE FOR HOPE,"
629,00:39:41.10,00:39:41.10,"EDDIE, OR SHAMAR, AND HOPE, EDDIE, AND SHAMAR, YOU WILL NOT"
630,00:39:45.33,00:39:45.33,"VOTE. MICHAEL, IF YOU'RE TAKE THIS"
631,00:40:22.50,00:40:22.50,>> Jeff: I'LL GO TALLY THE VOTES.
632,00:40:25.27,00:40:25.27,">> OH, MAN. >> Jeff: ONCE THE VOTES ARE"
633,00:40:30.30,00:40:30.30,"READ, THE DECISION IS FINAL. PERSON VOTED OUT WILL BE ASKED"
634,00:40:33.60,00:40:33.60,TO LEAVE THE TRIBAL COUNCIL AREA IMMEDIATELY.
635,00:40:35.93,00:40:35.93,I'LL READ THE VOTES. FIRST VOTE.
636,00:40:41.20,00:40:41.20,SHAMAR. HOPE.
637,00:40:44.33,00:40:44.33,"HOPE. THAT'S TWO VOTES HOPE, ONE VOTE"
638,00:40:48.03,00:40:48.03,SHAMAR. HOPE.
639,00:40:50.07,00:40:50.07,"THAT'S THREE VOTES HOPE, ONE VOTE SHAMAR."
640,00:40:53.20,00:40:53.20,"THIRD PERSON VOTED OUT OF ""SURVIVOR:  FANS VERSUS"
641,00:40:59.83,00:40:59.83,"FAVORITE,"" HOPE, THAT'S FOUR, THAT'S ENOUGH."
642,00:41:02.07,00:41:02.07,"YOU NEED TO BRING ME YOUR TORCH. HOPE, THE TRIBE HAS SPOKEN."
643,00:41:17.43,00:41:17.43,"TIME FOR YOU TO GO. WELL, THERE ARE TWO WAYS TO LOOK"
644,00:41:27.03,00:41:27.03,"AT TONIGHT'S TRIBAL COUNCIL. ONE AS A SIGN OF WHAT'S TO COME,"
645,00:41:33.83,00:41:33.83,"MORE DYSFUNCTION. OR, TWO, AS AN OPPORTUNITY TO"
646,00:41:36.37,00:41:36.37,CHANGE YOUR STORY. GRAB YOUR TORCHES.
647,00:41:38.90,00:41:38.90,HEAD BACK TO CAMP. GOODNIGHT
648,00:41:46.10,00:41:46.10," Captioning brought to you by  Survivor Productions, CBS,"
649,00:41:48.47,00:41:48.47, Captioned by  Media Access Group at WGBH
650,00:41:49.53,00:41:49.53, access.wgbh.org >> JEFF: STAY TUNED FOR SCENES
651,00:41:51.60,00:41:51.60,FROM OUR NEXT EPISODE. >> Jeff: NEXT TIME ON
652,00:42:00.80,00:42:00.80,"""SURVIVOR""."" >> WHERE DO YOU THINK WE'RE"
653,00:42:04.33,00:42:04.33,GOING TO GO FROM HERE NOW? >> Jeff: THE FANS THINK
654,00:42:06.90,00:42:06.90,THEY'VE HIT ROCK BOTTOM. >> DIDN'T YOU SAY I WANT THE
655,00:42:10.60,00:42:10.60,"STRONGEST TEAM POSSIBLE. >> YES, I SAID THAT!"
656,00:42:12.87,00:42:12.87,"YES, I SAID THAT! >> Jeff: BUT NATURE PROVES"
657,00:42:16.47,00:42:16.47,THEM WRONG. >> HURRICANE.
658,00:42:18.30,00:42:18.30,"NOW THE RATS. >> YOU KNOW, I'M REALLY, REALLY"
659,00:42:26.23,00:42:26.23,"DISAPPOINTED. I DEFINITELY THINK THAT, YOU"
660,00:42:28.47,00:42:28.47,"KNOW, I SHOULD HAVE STAYED OUT HERE LONGER."
661,00:42:30.13,00:42:30.13,I THOUGHT I WAS A STRONG PLAYER. AND I FEEL LIKE I'M LEAVING
662,00:42:33.40,00:42:33.40,"BEFORE MY TIME, BUT I WILL SAY THAT THIS HAS BEEN AN"
663,00:42:38.10,00:42:38.10,"INCREDIBLE, ONCE-IN-A-LIFETIME EXPERIENCE."
664,00:42:39.57,00:42:39.57,">> AND FEEL REALLY GRATEFUL, YOU KNOW, FOR HAVING THE"
665,00:42:42.00,00:42:42.00,OPPORTUNITY.
