,begin,end,subtitles_text
349,00:21:31.60,00:21:31.60,TRIBE AND WE'RE GOING TO DO VERYWELL TOGETHER AND PLEASE LOOK
350,00:21:35.03,00:21:35.03,"AFTER OUR LOVED ONES WHO ARE ONTHE OTHER SIDE IN YOUR NAME,"
351,00:21:38.33,00:21:38.33,AMEN.>> IT IS ME AND FIVE WOMEN ON
352,00:21:40.00,00:21:40.00,"THE NEW GALANG TRIBE, ANDTHERE'S NOT A LOT OF PLAY FOR ME"
353,00:21:43.03,00:21:43.03,"COMING IN HERE.BASICALLY, THESE WOMEN HAVE"
354,00:21:46.17,00:21:46.17,BONDED SO I'M AT THE MERCY OFTHEM.
355,00:21:48.20,00:21:48.20,>> I WAS TRYING TO SAYMISUNFORTUNATE-- BUT--
356,00:21:51.90,00:21:51.90,>> LESS FORTUNATE.>> LESS FORTUNATE.
357,00:21:54.63,00:21:54.63,YOU KNEW WHAT I MEANT.>> PINT OF LANGUAGE IS TO GET
358,00:21:57.30,00:21:57.30,THE IDEA ACROSS.I GOT THE IDEA.
359,00:21:59.60,00:21:59.60,I DON'T KNOW THAT MUCH ABOUTWOMEN.
360,00:22:01.53,00:22:01.53,BUT I DO KNOW THAT WHEN I'M ALITTLE BIT VULNERABLE WITH
361,00:22:06.30,00:22:06.30,"WOMEN, IT GOES A LONG WAY.ME OPENING UP AND LETTING THEM"
362,00:22:09.23,00:22:09.23,KNOW A LITTLE BIT ABOUT MY PASTCOULD KEEP ME AROUND.
363,00:22:12.17,00:22:12.17,>> HOW LONG WERE YOU IN JAIL?>> I DID EIGHT MONTHS MY YEAR.
364,00:22:15.57,00:22:15.57,>> HOW SCARED WERE YOU?>> SO SCARED.
365,00:22:17.83,00:22:17.83,"OH, MY GOD.I'M THIS LITTLE 19-YEAR-OLD KID"
366,00:22:20.87,00:22:20.87,"ON THE WEST SIDE.EAST L.A., I KILLED THREE"
367,00:22:23.87,00:22:23.87,PEOPLE.I ROBBED FOUR BAEKS.
368,00:22:25.93,00:22:25.93,AND I'M LIKE I TRIED TO GETMONEY FROM A LAELD FOR DRUGS.
369,00:22:29.83,00:22:29.83,>> HEARING VYTAS ADMIT HE HAD AREALLY HARD TIME WITH A HEROINE
370,00:22:34.37,00:22:34.37,ADDICTION IS REALLY POWERFUL.THAT'S A NEAT PART OF A MAN THAT
371,00:22:38.20,00:22:38.20,CAN SHARE HIS EMOTIONS ANDFEELINGS.
372,00:22:40.93,00:22:40.93,IT REMINDS ME OF RUPERT.>> ARAS HAD SO MUCH RESENTMENT.
373,00:22:46.83,00:22:46.83,I ABANDON HIMAISE TEENAGER.I WASN'T THERE.
374,00:22:48.43,00:22:48.43,>> RIGHT.>> FOR THE LAST 13 YEARS NOW
375,00:22:50.67,00:22:50.67,IT'S BEEN US TRYING TO GET OURRELATIONSHIP BACK BECAUSE I LOVE
376,00:22:54.13,00:22:54.13,"HIM.MORE THAN ANYTHING, THAT'S WHO I"
377,00:22:55.13,00:22:55.13,WANT TO HAVE A RELATIONSHIPWITH.
378,00:22:56.60,00:22:56.60,ARAS IS SMATTER THAN ME.ARAS IS MORE PHYSICALLY GIFTED
379,00:22:59.93,00:22:59.93,THAN ME.ARAS IS AMAZING.
380,00:23:03.03,00:23:03.03,>> DON'T SELL YOURSELF SHORT.>> I'M NOT SELLING MYSELF SHORT.
381,00:23:06.33,00:23:06.33,>> I AM SO ENJOYING GETTING TOKNOW YOU.
382,00:23:09.77,00:23:09.77,DON'T SELL YOURSELF SHORT.>> I LOVE VYTAS.
383,00:23:12.60,00:23:12.60,I FEEL CONNECTED ALREADY.I HAVE TO KEEP MY HEART OUT OF
384,00:23:15.10,00:23:15.10,"IT.I LIKE HIM A LOT, BUT VYTAS AND"
385,00:23:19.13,00:23:19.13,"ARAS COULD TAKE THIS WHOLE GAME.>> Jeff: COME ON IN, GUYS."
386,00:23:48.83,00:23:48.83,"ALL RIGHT, YOU GUYS READY TO GETTO YOUR FIRST IMMUNITY CHALLENGE"
387,00:23:52.27,00:23:52.27,AS NEW TRIBES?>> YES.
388,00:23:53.93,00:23:53.93,">> YEAH!>> Jeff: FIRST THINGS FIRST,"
389,00:23:58.90,00:23:58.90,"TAKE BACK THE IMMUNITY EYEOL.ONCE AGAIN, IMMUNITY IS BACK UP"
390,00:24:03.60,00:24:03.60,"FOR GRABS.FOR TODAY'S CHALLENGE, ONE PAIR"
391,00:24:07.13,00:24:07.13,FROM EACH TRIBE WILL RACE OUT TOA CAGE AT THE BOTTOM OF THE
392,00:24:11.97,00:24:11.97,"OCEAN.YOU'LL DIVE DOWN, RELEASE A"
393,00:24:13.70,00:24:13.70,"GATE, RETRIEVE A FISH TRAP, SWIMIT BACK TO SHORE, THEN THE NEXT"
394,00:24:18.03,00:24:18.03,PAIR GOES.ONCE YOU'VE COLLECTED ALL THREE
395,00:24:20.37,00:24:20.37,"FISH TRAPS, YOU'LL USE THEPIECES INSIDE TO SOLVE A"
396,00:24:24.17,00:24:24.17,VERTICAL PUZZLE.FIRST TRIBE TO FINISH WINS
397,00:24:27.17,00:24:27.17,"IMMUNITY, IS SAFE FROM THE VOTE.LOSERS GO TO TRIBAL COUNCIL,"
398,00:24:30.37,00:24:30.37,WHERE SOMEBODY WILL BE VOTED OUTAND SENT TO REDEMPTION ISLAND.
399,00:24:32.73,00:24:32.73,"IN ADDITION, YOU'RE PLAYING FORREWARD."
400,00:24:37.60,00:24:37.60,YOU WANT TON WHAT YOU'RE PLAYINGFOR?
401,00:24:39.00,00:24:39.00,>>>> YES!
402,00:24:39.90,00:24:39.90,>> Jeff: IT'S PICNIC DAY ONSURVIVOR.
403,00:24:42.33,00:24:42.33,">> WOW!>> Jeff: TURKEY, ROAST BEEF,"
404,00:24:45.40,00:24:45.40,"HAM.YOU'VE GOT CHEESE, BREAD, ALL"
405,00:24:47.53,00:24:47.53,"THE TOPPINGS, BROWNIES.SHOULD MAKE FOR A VERY NICE"
406,00:24:56.70,00:24:56.70,"AFTERNOON, ESPECIALLY KNOWINGYOU WON'T HAVE TO GO TO TRIBAL"
407,00:24:59.77,00:24:59.77,COUNCIL.I'LL GIVE YOU A MINUTE TO
408,00:25:01.87,00:25:01.87,STRATEGIZE AND WE'LL GETSTARTED.
409,00:25:03.50,00:25:03.50,"HERE WE GO.FOR IMMUNITY AND REWARD,"
410,00:25:06.20,00:25:06.20,SURVIVORS READY?GO!
411,00:25:10.30,00:25:10.30,IT IS GERVASE AND ARAS FIRST FORTADHANA.
412,00:25:13.43,00:25:13.43,"LAURA B, AND TINA FOR GALANG.YOU'VE GOT TO SWIM OUT TO YOUR"
413,00:25:18.63,00:25:18.63,"CAGE, RELEASE THE GATE, ANDRETRIEVE THE FISH TRAP."
414,00:25:23.97,00:25:23.97,GERVASE WITH A GREAT EFFORT.HIS SWIMMING HAS IMPROVED QUITE
415,00:25:26.57,00:25:26.57,A BIT FROM DAY ONE.GERVASE UP WITH THE GATE!
416,00:25:37.27,00:25:37.27,ARAS HAS THE TRAP.SWIMMING IT BACK WITH GERVASE.
417,00:25:43.67,00:25:43.67,GALANG IS UP WITH THEIR FIRSTGATE.
418,00:25:51.63,00:25:51.63,LADIES!TINA AND LAURA B SWIMMING BACK
419,00:25:54.80,00:25:54.80,WITHOUT THEIR FISH TRAP.THAT'S GOING TO BE A PAINFUL
420,00:25:58.80,00:25:58.80,REALIZATION.>> THEY FORGOT IT.
421,00:26:01.10,00:26:01.10,>> Jeff: WHEN THEY REALIZETHEY FORGOT THE MOST IMPORTANT
422,00:26:04.23,00:26:04.23,PART OF THIS CHALLENGE.>> YOU FORGOT THE TRAP!
423,00:26:06.87,00:26:06.87,>> Jeff: TINA AND LAURA STILLHAVE NO IDEA WHAT THEIR TRIBE IS
424,00:26:10.47,00:26:10.47,TALKING ABOUT.JARVIS AND ARAS ARE BACK WITH
425,00:26:13.93,00:26:13.93,THEIR FIRST FISH TRAP.>> YOU FORGOT THE TRAP.
426,00:26:17.10,00:26:17.10,>> Jeff: SOMEBODY HAS TO GETTHE FIRST TRAP.
427,00:26:18.80,00:26:18.80,A HUGE CATASTROPHE FOR THE NEWGALANG.
428,00:26:21.67,00:26:21.67,"TYSON AND CALEB IN THE WATERNOW, AND A HUGE LEAD FOR"
429,00:26:27.20,00:26:27.20,TADHANA.>> Jeff: LAURA B AND TINA
430,00:26:34.50,00:26:34.50,FINALLY MAKING THEIR WAY BACK.A GIGANTIC LEAD FOR TYSON AND
431,00:26:41.20,00:26:41.20,CALEB.LAURA B AND TINA NOW BACK WITH
432,00:26:43.50,00:26:43.50,THEIR FIRST FISH TRAP.CALEB AND TYSON RACING BACK WITH
433,00:26:48.07,00:26:48.07,THEIR SECOND FISH TRAP.IT'S MONICA AND VYTAS NOW IN THE
434,00:26:52.43,00:26:52.43,"WATER FOR GALANG.>> GO, GO, GO."
435,00:27:04.80,00:27:04.80,VYTAS UNDERWATER QUICKLY UNTYINGKNOTS.
436,00:27:07.50,00:27:07.50,HE KNOWS HE HAS A LOT OF TIME TOMAKE UP.
437,00:27:09.47,00:27:09.47,>> COME OHAYDEN!>> Jeff: GALANG HAS RELEASED
438,00:27:14.73,00:27:14.73,THEIR SECOND GATE.MONICA AND VYTAS NOW SWIMMING
439,00:27:22.67,00:27:22.67,"THAT TRAP BACK.>> COME ON, GUYS!"
440,00:27:24.73,00:27:24.73,>> HAYDEN AND CIERA HEADING BACKWITH THEIR THIRD AND FINAL FISH
441,00:27:29.17,00:27:29.17,TRAP.GALANG HEADING BACK WITH THEIR
442,00:27:30.50,00:27:30.50,"SECOND, VYTAS AND MONICA, TRYINGTO MAKE UP SOME TIME."
443,00:27:33.33,00:27:33.33,">> WAY TO GO, GUYS, WAY TO GO.NOW KAT AND KATIE IN THE WATER"
444,00:27:37.60,00:27:37.60,FOR GALANG.CIERA COMPLETELY SPENT.
445,00:27:42.13,00:27:42.13,... HER TRIBE CAN'T STARTUNTYING UNTIL SHE IS BACK.
446,00:27:45.50,00:27:45.50,"ALL RIGHT, PUZZLE MAKERS, STARTUNTYING!"
447,00:27:49.00,00:27:49.00,IT IS ARAS AND TYSON WORKING ONTHE PUZZLE FOR TADHANA.
448,00:27:53.97,00:27:53.97,>> THEY'RE NOT EVEN OUT TO THETRAP YET TADHANA WITH A HUGE
449,00:28:01.17,00:28:01.17,TIME ADVANTAGE.ALREADY UNTYING ALL OF THEIR
450,00:28:04.53,00:28:04.53,PUZZLE PIECES.LADIES NEED TO KEEP MOVING!
451,00:28:10.27,00:28:10.27,THEY'RE TRYING TO CLOSE THATGAP.
452,00:28:14.93,00:28:14.93,KAT AND KATIE HAVE THE THIRDFISH TRAP.
453,00:28:17.33,00:28:17.33,THEY HAVE TO SWIM IT BACK NOW.BUT THEY'RE GOING TO HAVE TO
454,00:28:20.20,00:28:20.20,REALLY JAM TO CATCH UP TOTADHANA.
455,00:28:22.87,00:28:22.87,">> GOOD JOB, GIRLS!>> KAT AND KATIE BACK WITH THAT"
456,00:28:26.80,00:28:26.80,THIRD FISH TRAP.START UNTYING.
457,00:28:28.40,00:28:28.40,IT IS TINA AND MONICA WORKINGFOR GALANG.
458,00:28:31.37,00:28:31.37,"ARAS AND TYSON WITH A HUGE TIMEADVANTAGE, WORKING FOR TADHANA."
459,00:28:35.87,00:28:35.87,TINA WOULD LOVE TO BE ABLE TOMAKE UP FOR THE COSTLY MISTAKE
460,00:28:38.47,00:28:38.47,SHE MADE AT THE BEGINNING.>> THAT'S TMONICA.
461,00:28:41.50,00:28:41.50,>> Jeff: BY BRINGING HER TRIBEBACK DURING THE PUZZLE
462,00:28:45.17,00:28:45.17,CHALLENGE.>> SHOULD I MOVE IT OVER.
463,00:28:47.57,00:28:47.57,">> Jeff: SUDDENLY, TYSON ANDARsAS ARE HAVING TROUBLES."
464,00:28:50.97,00:28:50.97,TINA AND MONICA NOW GAINING.IT WOULD BE ONE OF THE BIGGEST
465,00:28:54.57,00:28:54.57,COMEBACKS IN THIS GAME.WHICH IS WHY YOU NEVER GIVE UP.
466,00:28:59.17,00:28:59.17,">> RIGHT THERE, RIGHT THERE!>> STEP BACK AND LOOK AT IT."
467,00:29:02.33,00:29:02.33,THE TAIL IS WRONG.TADHANA HAD A HUGE LEAD AND THEY
468,00:29:05.87,00:29:05.87,HAVE TBLOAN IT.WE ARE NOW NECK AND NECK.
469,00:29:08.27,00:29:08.27,"YOU NEVER 99 ""SURVIVOR.""MONICA AND TINA STILL WORKING."
470,00:29:13.20,00:29:13.20,IT WOULD BE A GIGANTIC COMEBACKIF THEY COULD WIN THIS CHALLENGE
471,00:29:16.27,00:29:16.27,AFTER THE WAY IT STARTED.GALANG THINKS THEY HAVE IT.
472,00:29:22.37,00:29:22.37,>> WE GOT IF!>> Jeff: THEY DO NOT HAVE IT.
473,00:29:25.40,00:29:25.40,SOMETHING'S JUST NOT QUITERIGHT.
474,00:29:29.73,00:29:29.73,THAT OPENS THE DOOR FOR ARAS ANDTYSON.
475,00:29:33.50,00:29:33.50,ONE OF THE MOST BACK.AND-FORTH CHALLENGE.
476,00:29:39.63,00:29:39.63,IT IS ANYBODY'S CHALLENGE TO WINRIGHT NOW.
477,00:29:42.33,00:29:42.33,MONICA AND TINA REARRANGINGAGAIN.
478,00:29:44.23,00:29:44.23,DO THEY HAVE IT NOW.THEY DO NOT.
479,00:29:47.17,00:29:47.17,GALANG IT IS NOT RIGHT.BACK TO WORK.
480,00:29:50.50,00:29:50.50,TYSON AND ARAS THINK THEY HAVEIT.
481,00:29:55.00,00:29:55.00,"AND THEY DO!WINNING IMMUNITY, AND REWARD!"
482,00:30:02.57,00:30:02.57,>> WOW!>> GOOD EFFORT.
483,00:30:10.13,00:30:10.13,">> Jeff: TADHANA,CONGRATULATIONS."
484,00:30:12.60,00:30:12.60,IMMUNITY IS YOURS.NOTRIBAL COUNCIL TONIGHT.
485,00:30:17.77,00:30:17.77,"IN ADDITION, NICE PICNICAFTERNOON."
486,00:30:19.97,00:30:19.97,EVERYTHING YOU NEED TO HAVE AGREAT DAY.
487,00:30:22.07,00:30:22.07,GRAB YOUR STUFF.HEAD BACK TO CAMP.
488,00:30:23.97,00:30:23.97,"ENJOY THE NIGHT OFF.>> THANKS, JEFF."
489,00:30:26.17,00:30:26.17,">> Jeff: GALANG, GOING TO BEAN INTERESTING AFTERNOON."
490,00:30:28.63,00:30:28.63,GRAB YOUR STUFF.HEAD BACK TO CAMP.
491,00:30:30.97,00:30:30.97,WE'LL SEE YOU AT TRIBAL TONIGHTWHERE SOMEBODY WILL BE VOTED OUT
492,00:30:33.97,00:30:33.97,OF THIS TRIBE AND SENT TOREDEMPTION ISLAND.
493,00:31:04.43,00:31:04.43,">> ON THE INSIDE, I'M SOFRUSTRATED WITH TINA AND LAURA"
494,00:31:08.40,00:31:08.40,B.I WOULD HAVE NEVER MADE A
495,00:31:09.53,00:31:09.53,MISTAKE LIKE THAT.I SHOULD HAVE GONE FIRST.
496,00:31:12.07,00:31:12.07,"SOMETHING SHOULD HAVE HAPPENEDDIFFERENT, BUT I CAN'T ACT OUT"
497,00:31:14.93,00:31:14.93,ON THAT.>> I JUST WANT TO SAY I'M SO
498,00:31:19.43,00:31:19.43,"SORRY.IF IT'S ME TONIGHT, I DON'T"
499,00:31:21.17,00:31:21.17,"BLAME YOU.IF IT'S SOMEBODY ELSE, I FEEL"
500,00:31:24.63,00:31:24.63,HORRIBLE GUILT.BECAUSE I FEEL PARTLY
501,00:31:29.47,00:31:29.47,RESPONSIBLE FOR WHOEVER IS GOINGHOME.
502,00:31:31.50,00:31:31.50,AND I'M SORRY.THAT'S ALL I KNOW TO SAY.
503,00:31:33.60,00:31:33.60,>> YOU WERE SO CLOSE.>> YOU NEVER GAVE UP.
504,00:31:36.20,00:31:36.20,>> IT TOOK EVERYTHING IN ME TONOT LET THEM KNOW HOW I ACTUALLY
505,00:31:40.47,00:31:40.47,FELT ABOUT THE MISTAKE THEYMADE.
506,00:31:42.07,00:31:42.07,>> THANK YOU FOR YOUR MERCY.FOR YOUR MERCY AND YOUR GRACE.
507,00:31:44.73,00:31:44.73,">> BECAUSE BEING A MAN IN THEMIDST OF ONLY WOMEN, WHATEVER"
508,00:31:48.20,00:31:48.20,THEY CHOOSE TO DO IS GOING TO GODOWN.
509,00:31:50.70,00:31:50.70,"IF GIHOME BECAUSE THEY WANT METO GO HOME, THERE'S NOTHING I"
510,00:31:52.87,00:31:52.87,CAN DO.>> WE'RE GOING TO ELIMINATE
511,00:32:00.50,00:32:00.50,"VYTAS TONIGHT.BUT THE MORE I THINK ABOUT IT,"
512,00:32:02.87,00:32:02.87,WHAT WE NEED TO DO IS TAKE OUTTHE PERSON THAT WON'T STOP
513,00:32:06.70,00:32:06.70,TALKING.>> GOING TO TRIBAL COUNCIL
514,00:32:08.03,00:32:08.03,SUCTION.>> MONICA CAN'T STOP TALKING.
515,00:32:10.53,00:32:10.53,"EVERY SINGLE TIME CATCH HER,SHE'S ALWAYS STRATEGIZING."
516,00:32:15.27,00:32:15.27,WHEN YOU LOOK LIKE YOU'REOVER-STRATEGIZING IN FRONT OF
517,00:32:18.10,00:32:18.10,"YOUR ALLIANCE, THAT'S WHEN YOUGET IN TROUBLE, AND I'M ABOUT TO"
518,00:32:21.47,00:32:21.47,KICK YOU OUT OF THIS GAME IF YOUDON'T STOP TALKING.
519,00:32:24.30,00:32:24.30,>> WHAT ARE YOU THINKING?>> I'D STILL LIKE TO KEEP GIRL
520,00:32:27.97,00:32:27.97,STRONG.>> UH-HUH.
521,00:32:28.67,00:32:28.67,>> I THINK THE GIRL THING ISGREAT.
522,00:32:31.27,00:32:31.27,">> I JUST, LIKE-- SOMETIMESMONICA MAKES ME REALLY WORRIED"
523,00:32:34.93,00:32:34.93,AND I FEEL LIKE I SHOULD VOTEOUT MONICA INSTEAD OF VYTAS.
524,00:32:37.97,00:32:37.97,>> HERE'S MY ONLY THING THATSCARES ME ABOUT GETTING RILD OF
525,00:32:41.93,00:32:41.93,HER IS THAT WHAT IF WE GET OVERTHERE AND IT'S ALL GUYS.
526,00:32:45.93,00:32:45.93,GUYS.WE ALL KNOW WHY IT'S A GOOD IDEA
527,00:32:48.50,00:32:48.50,TO STAY WITH THE PLAN.LET ALL THE GIRLS STICK TOGETHER
528,00:32:51.13,00:32:51.13,AND GET RID OF THE GUY.KAT'S ALREADY WANTING TO SWITCH
529,00:32:53.97,00:32:53.97,"THAT UP AND SEND MONICA HOME.KAT'S LOYALTY, I DON'T FEEL"
530,00:32:57.47,00:32:57.47,"LIKE, IS AS STRONG, AND THAT'SJUST INFORMATION THAT NEEDS TO"
531,00:33:00.30,00:33:00.30,BE THROUGHOUT FOR EVERYBODY TOKNOW.
532,00:33:09.37,00:33:09.37,>> REALLY?>> YES.
533,00:33:11.10,00:33:11.10,>> WHY?>> BECAUSE THE STRA STRATEGY.
534,00:33:13.73,00:33:13.73,SHE SAYS SHE WORRIES ABOUT YOUSTRATEGIZING TOO MUCH.
535,00:33:16.27,00:33:16.27,">> THAT IS A LITTLE WORRISOME,ESPECIALLY IF WE MADE A PACT"
536,00:33:20.47,00:33:20.47,WE'RE GOING TO VOTE OUT VYTAS--SORRY ABOUT THAT.
537,00:33:23.10,00:33:23.10,IF WE HAD A GIRLS' ALLIANCE ANDSHE'S ALREADY SAYING I WANT
538,00:33:26.57,00:33:26.57,"MONICA GONE, HOW DO YOU KNOWWE'RE NOT GOING TO GET TO THE"
539,00:33:29.23,00:33:29.23,OTHER SIDE AND SHE SAYS I WANTTINA GONE.
540,00:33:31.27,00:33:31.27,>> I KNOW.>> I WAS TOTALLY ON BOARD THAT
541,00:33:33.70,00:33:33.70,"IT WOULD BE VYTAS, BUT IF I'MHEARING THAT KAT'S GUNNING FOR"
542,00:33:36.53,00:33:36.53,"ME, I NEED TO DO WHAT'S BEST FORMONICA."
543,00:33:45.93,00:33:45.93,>> JUST NOW?>> UH-HUH.
544,00:33:47.20,00:33:47.20,>> WE WERE JUST TALKING ABOUT IFWE SHOULD TELL VYTAS THAT HE'S
545,00:33:50.90,00:33:50.90,GETTING ELIMINATED OR NOT.>> RIGHT.
546,00:33:53.23,00:33:53.23,THERE WASN'T ANYTHING THAT YOUSAID ABOUT ME?
547,00:33:55.70,00:33:55.70,">> NO, NOT TO TEEN ANNO.>> NO."
548,00:34:01.20,00:34:01.20,>> I HAVE BEEN TOLD YOU BROUGHTMY NAME UP.
549,00:34:03.63,00:34:03.63,>> FROM WHO?>> PEOPLE HAVE SAID YOU HAVE
550,00:34:05.87,00:34:05.87,SAID MY NAME.>> I DON'T KNOW WHAT YOU'RE
551,00:34:07.67,00:34:07.67,TALKING ABOUT.>> I KNOW MY NAME'S BEEN THROWN
552,00:34:10.50,00:34:10.50,OUT THERE.I'VE ASKED HER TO TELL ME THE
553,00:34:12.73,00:34:12.73,"TRUTH, AND SHE WON'T.IF SOMEBODY IS GUNNING FOR ME,"
554,00:34:15.77,00:34:15.77,WHICH I CAN FEEL IT.I CAN SENSE IT IN KAT THAT SHE
555,00:34:20.43,00:34:20.43,"IS, IT DOESN'T MAKE SENSE TOKEEP THEM AROUND."
556,00:34:22.27,00:34:22.27,>> I WANT TO GO ALL GIRL STRONG.I DON'T NEED TO CONTINUE TO
557,00:34:25.87,00:34:25.87,COMMUNICATE ABOUT ALLT ALL THETIME.
558,00:34:28.10,00:34:28.10,"LIKE-- MONICA'S VERY DANGEROUS,BECAUSE WHEN SHE STRATEGIZES"
559,00:34:31.43,00:34:31.43,PEOPLE ACTUALLY MIGHT LISTEN TOHER.
560,00:34:33.40,00:34:33.40,SO MY BACK'S UP AGAINST THEWALL.
561,00:34:35.17,00:34:35.17,I'M GOING TO DO EVERYTHING I CANTO STAY HERE AND THAT'S IT.
562,00:34:37.57,00:34:37.57,>> I'M SORRY.>> SO IF VYTAS HAS TO GO HOME
563,00:34:40.83,00:34:40.83,"TONIGHT, HE'S GOING TO HAVE TOGO HOME."
564,00:34:42.27,00:34:42.27,THAT'S HOW THE NATURE OF THEGAME GOES.
565,00:34:44.37,00:34:44.37,">> YOU KNOW WHO, RIGHT?>> NOT FOR SURE."
566,00:34:47.67,00:34:47.67,STILLV?>> YEAH.
567,00:34:48.13,00:34:48.13,>> OKAY.>> AS LONG AS IT'S NOT ME.
568,00:34:52.43,00:34:52.43,>> OR NOT ME.>> I TEACH MY KIDS DO UNTO
569,00:34:57.10,00:34:57.10,OTHERS AS YOU WOULD WANT THIM TODO UNTO YOU.
570,00:34:59.43,00:34:59.43,"BUT YOU KNOW WHAT IN ""SURVIVOR""I FIGURED IT OUT."
571,00:35:04.53,00:35:04.53,IT'S DO UNTO OTHERS BEFORE THEYDO UNTO YOU.
572,00:35:08.10,00:35:08.10,>> HOW DO YOU FEEL ABOUT KAT?IF SOMEBODY IS IT GUNNING FOR ME
573,00:35:11.23,00:35:11.23,I'M WRITING HER NAME DOWN.I'M TRYING TO CORAL AND PERSUADE
574,00:35:14.80,00:35:14.80,EVERYBODY IN THIS TRIBE TO DOTHE SAME THING.
575,00:35:17.43,00:35:17.43,>> I THINK THE BEST THING IS FORKAT TO GO.
576,00:35:19.33,00:35:19.33,>> WE HAVE TO MAKE A DECISIONTONIGHT WHO DOES IT MAKE SENSE
577,00:35:25.87,00:35:25.87,"TO SEND, CAPT OR VYTAS?I THINK IT'S A GOOD IDEA TO STAY"
578,00:35:28.80,00:35:28.80,"WITH THE PLAN, WHICH IS TO VOTEFOR VYTAS."
579,00:35:31.37,00:35:31.37,"BUT KAT'S LOYALTY, I'M NOT SOSURE ABOUT THAT."
580,00:35:34.37,00:35:34.37,"WHO SHOULD GO?HONESTLY, IT IS A COIN TOSS."
581,00:35:37.23,00:35:37.23,IT IS 50-50.>> Jeff: SO LET'S TALK ABOUT
582,00:36:05.70,00:36:05.70,"THE TRIBE SWITCH.KAT, NEW GROUP OF PEOPLE."
583,00:36:07.97,00:36:07.97,WHO'S NOT GETTING ALONG?>> I GUESS IT'S JUST BETWEEN
584,00:36:11.97,00:36:11.97,"MONICA AND I.I SAW MONICA WAS KIND OF DOWN,"
585,00:36:14.43,00:36:14.43,SO I JUST WENT OVER TO ASK HERHOW SHE'S DOING.
586,00:36:17.07,00:36:17.07,AND THE CONVERSATION DIDN'T ENDUP AS WELL AS I THOUGHT IT
587,00:36:20.10,00:36:20.10,WOULD.>> Jeff: MONICA WHAT WAS THE
588,00:36:21.50,00:36:21.50,"CONVERSATION ABOUT, FROM YOURSIDE?"
589,00:36:22.90,00:36:22.90,>> JUST ABOUT THE GAME.AND TRUST ISSUES.
590,00:36:25.43,00:36:25.43,"I MEAN, ALL I'M LOOKING FOR IS ALITTLE BIT OF TRUST."
591,00:36:29.83,00:36:29.83,AND YOU WANT IT SO MUCH FROMTHIS YOUNG LADY BECAUSE I
592,00:36:33.63,00:36:33.63,GENUINELY AM CHEERING FOR HER.AND IT'S REALLY DIFFICULT.
593,00:36:37.10,00:36:37.10,">> MONICA, THIS SHOULDN'T BE ANYYOU AND I RIGHT NOW."
594,00:36:39.67,00:36:39.67,">> I UNDERSTAND.>> LIKE, I GENUINELY LOVE"
595,00:36:42.17,00:36:42.17,"MONICA, AND I LOVE THESE GIRLS.LIKE I ALWAYS HAVE THEIR BACK."
596,00:36:45.80,00:36:45.80,"AND IF WE ALL MAKE IT TO THEMERGE, I FEEL LIKE THAT WE"
597,00:36:48.67,00:36:48.67,SHOULD ALWAYS STICK TOGETHER.NO OFFENSE.
598,00:36:51.70,00:36:51.70,NO OFFENSE.>> Jeff: THAT WILL ONLY HAPPEN
599,00:36:53.60,00:36:53.60,IF TONIGHT VYTAS IS VOTED OUT.>> JEFF KAT'S GOING TO WRITE MY
600,00:36:57.27,00:36:57.27,NAME DOWN TONIGHT PROBABLY.AND I FEEL FOR THEIR
601,00:36:59.30,00:36:59.30,"RELATIONSHIP, BUT TRUST IN THISGAME IS STICKING WITH YOUR"
602,00:37:01.53,00:37:01.53,ALLIANCE NO MATTER WHAT.SO IT'S DIFFICULT TO BE THE ONE
603,00:37:03.87,00:37:03.87,ON THE CHOPPING BLOCK WHEN IFEEL LIKE I HAVE ESTABLISHED
604,00:37:06.40,00:37:06.40,SOME PRETTY GOOD RELATIONSHIPSAROUND HERE.
605,00:37:07.87,00:37:07.87,">> JEFF, I'VE ESTABLISHEDRELATIONSHIPS HERE."
606,00:37:10.30,00:37:10.30,I HAVE ALL OF THEIR BACKS ANDTHEY KNOW IT.
607,00:37:12.97,00:37:12.97,"MONICA, YOU KNOW I ALWAYS HAVEYOUR BACK."
608,00:37:15.57,00:37:15.57,">> OH, KAT.YOU KNOW, THERE'S NOTHING MORE"
609,00:37:19.80,00:37:19.80,THAN I WANT TO DO THAN TRUST YOUAND I SERVED IT UP ON A SILVER
610,00:37:25.97,00:37:25.97,"PLATTER A FEW TIMES TRUSTING.AND IN THE END, I EVEN HEARD"
611,00:37:29.40,00:37:29.40,"YOU'VE THROWN MY NAME AROUND.>> Jeff: KAT, DO YOU THINK"
612,00:37:32.03,00:37:32.03,YOU'RE GOING HOME TONIGHT?>> I HOPE I DON'T.
613,00:37:33.77,00:37:33.77,I WANT TO STAY.AND YOU GUYS KNOW HOW MUCH I
614,00:37:36.90,00:37:36.90,"WANT TO STAY.PLEASE, BECAUSE I WILL DO"
615,00:37:40.93,00:37:40.93,ANYTHING.>> Jeff: WHO SHOULD BE GOING
616,00:37:42.37,00:37:42.37,HOME?>> I FEEL LIKE THE WOMEN SHOULD
617,00:37:43.97,00:37:43.97,"STICK TOGETHER LIKE OUR PLAN WASFROM THE GET-GO, AND VOTE OUT"
618,00:37:48.73,00:37:48.73,"VYTAS.>> JEFF, I HEAR A LOT OF ""I'M"
619,00:37:51.43,00:37:51.43,"SORPRY.""SHE'S OBVIOUSLY MADE SOME"
620,00:37:52.77,00:37:52.77,"MISTAKES IN BUILDING TRUST WITHHER PARTNERS, BUT I HAVEN'T MADE"
621,00:37:56.03,00:37:56.03,ANYONE TO ANYONE HERE-->> WE WON'T KNOW THAT.
622,00:37:58.50,00:37:58.50,>> IT DOESN'T MATTER IF YOU HAVEFIVE STRONG GOING INTO THE MERGE
623,00:38:02.07,00:38:02.07,IF ONE PERSON HAS DEMONSTRATEDALREADY THAT THEY CAN'T BE
624,00:38:05.50,00:38:05.50,TRUSTED.>> THAT'S NOT TRUE.
625,00:38:06.93,00:38:06.93,AND JUST BECAUSE VYTAS COMES INAND HE'S GENUINE TO EVERYBODY
626,00:38:09.87,00:38:09.87,"FOR 24 HOURS, WE DON'T KNOWANYTHING."
627,00:38:12.77,00:38:12.77,"BUT YOU DO KNOW I WILL STAYHERE, AND I LOVE THESE PEOPLE,"
628,00:38:15.37,00:38:15.37,"AND THEY KNOW THAT.>> Jeff: TINA, ONE SIDE SAYS"
629,00:38:19.00,00:38:19.00,"STICK WITH YOUR ALLIANCE, DON'TLET THE OUTSIDERS IN."
630,00:38:22.07,00:38:22.07,THE OTHER SAYS TWO NEW PEOPLE?CHANCE TO BREAK THINGS UP.
631,00:38:24.93,00:38:24.93,">> YEAH, WELL FOR ME IT'S ALITTLE BIT DIFFICULT BECAUSE I"
632,00:38:27.57,00:38:27.57,HAVE A LOVED ONE OVER HERE NOW.THAT PUTS A WHOLE NEW DYNAMIC ON
633,00:38:31.77,00:38:31.77,"THINGS.AND SO, I HAVE TO MAKE MY"
634,00:38:34.23,00:38:34.23,DECISION BASED ON WHAT I THINKIS GOING TO GET ME FURTHER
635,00:38:38.90,00:38:38.90,TONIGHT AND POSSIBLY IN THEFUTURE.
636,00:38:41.17,00:38:41.17,">> Jeff: SO, VYTAS, HOW DO YOUMAKE SURE IT ISN'T YOU TONIGHT?"
637,00:38:44.40,00:38:44.40,">> ALL I CAN REALLY DO IS COMEIN HERE AND JUST BE OPEN, BE A"
638,00:38:49.67,00:38:49.67,"LITTLE BIT VULNERABLE,UN, SHOWTHE PERSON THEY REALLY AM."
639,00:38:52.30,00:38:52.30,AND THAT'S IT.THE REST IS LEFT FOR THEM TO
640,00:38:55.13,00:38:55.13,"JUDGE AND SAY OKAY, DO WE BUYTHIS GUY?"
641,00:38:58.17,00:38:58.17,CAN WE TRUST HIM?OR DO WE JUST STICK WITH WHAT WE
642,00:39:02.80,00:39:02.80,"HAVE?>> Jeff: KAT, WE'RE JUST GO"
643,00:39:04.90,00:39:04.90,BTO VOTE.IS THERE ANYTHING ELSE ON YOUR
644,00:39:06.57,00:39:06.57,MIND JAI LOVE YOU GUYS.FROM DAY ONE I HAVE HAD ALL YOUR
645,00:39:11.00,00:39:11.00,BACKS EXPWI ALWAYS WILL.>> Jeff: VYTAS YOU'RE SHAKE
646,00:39:13.90,00:39:13.90,YOUR HEAD.>> I'VE HEARD STORIES ABOUT HER
647,00:39:15.93,00:39:15.93,NOT HAVING PEOPLE'S BACK.>> THAT'S NOT TRUE.
648,00:39:18.67,00:39:18.67,>> SHE SOUNDS LIKE SOMEBODY WITHHER BACK UP AGAINST THE WALL I
649,00:39:22.67,00:39:22.67,GOT CAUGHT THROWING PEOPLE'SNAMES OUT.
650,00:39:24.50,00:39:24.50,"PLEASE, I WILL NEVER DO THATAGAIN."
651,00:39:27.13,00:39:27.13,">> THAT'S NOT TRUE.MONICA, THAT'S NOT TRUE."
652,00:39:29.27,00:39:29.27,>> I HAVE BEEN THERE.CAN I PLEASE FINISH.
653,00:39:32.07,00:39:32.07,"IT SUCKS TO MAKE MISTAKES.>> PLEASE STAY TOGETHER, GUYS."
654,00:39:35.70,00:39:35.70,>> AND WE WILL STAY TOGETHER.AND WE WILL STAY STRONG.
655,00:39:39.63,00:39:39.63,">> Jeff: ALL RIGHT, IT IS TIMETO VOTE."
656,00:39:41.10,00:39:41.10,"LAURA B, YOU'RE UP.>> I HOPE YOU ENJOY THE AMBIANCE"
657,00:40:09.30,00:40:09.30,AT REDEMPTION ISLAND.>> Jeff: I'LL GO TALLY THE
658,00:40:24.03,00:40:24.03,VOTE.IF ANYBODY HAS A HIDDEN IMMUNITY
659,00:40:34.53,00:40:34.53,"IDOL AND YOU WANT TO PLAY IT,NOW WOULD BE THE TIME TO DO SO."
660,00:40:39.80,00:40:39.80,"OKAY, ONCE THE VOTES ARE READTHE DECISION IS FINAL."
661,00:40:42.70,00:40:42.70,THE PERSON VOTED OUT WILL BEASKED TO LEAVE THE TRIBAL
662,00:40:45.70,00:40:45.70,COUNCIL AREA IMMEDIATELY.I'LL READ THE VOTES.
663,00:40:48.83,00:40:48.83,"FIRST VOTE, VYTAS.KAT."
664,00:40:54.20,00:40:54.20,"ONE VOTE VYTAS, ONE VOTE KAT.KAT."
665,00:40:57.83,00:40:57.83,"TWO VOTES KAT, ONE VOTE VYTAS.KAT."
666,00:41:04.33,00:41:04.33,"THAT'S THREE VOTES KAT, ONE VOTEVYTAS."
667,00:41:10.90,00:41:10.90,"SIXTH PERSON VOTED OUT OF""SURVIVOR"" VIEFER, KAT, YOU NEED"
668,00:41:21.73,00:41:21.73,"TO BRING ME YOUR TORCH.KAT, THE TRIBE HAS SPOKEN."
669,00:41:29.00,00:41:29.00,YOU WILL HAVE A CHANCE TO GETBACK IN THIS GAME.
670,00:41:31.37,00:41:31.37,GRAB YOUR TORCH.HEAD TO REDEMPTION ISLAND.
671,00:41:33.50,00:41:33.50,GOOD LUCK.>> THANK YOU.
672,00:41:43.53,00:41:43.53,">> Jeff: WELL, ONE THING ISCLEAR-- YOU DON'T GET TRUST BY"
673,00:41:46.23,00:41:46.23,ASKING FOR IT.YOU GOTTA EARN IT.
674,00:41:48.20,00:41:48.20,YOU WANT TO WIN THIS GAME ANDYOU HAVEN'T STARTED EARNING
675,00:41:50.93,00:41:50.93,"TRUST, YOU BETTER GET TO ITRIGHT NOW."
676,00:41:52.57,00:41:52.57,GRAB YOUR TORCHES.HEAD BACK TO CAMP.
677,00:41:54.27,00:41:54.27,GOOD NIGHT. Captioning brought to you by
678,00:41:58.70,00:41:58.70," Survivor Productions, CBS, and Ford."
679,00:41:59.53,00:41:59.53, Drive one. Captioned by
680,00:42:00.77,00:42:00.77, Media Access Group at WGBH access.wgbh.org
681,00:42:06.20,00:42:06.20,>> Jeff: STAY TUNED FOR SCENESFROM OUR NEXT EPISODE.
682,00:42:14.63,00:42:14.63,">> Jeff: NEXT TIME ON""SURVIVOR."""
683,00:42:16.67,00:42:16.67,>> MORNING BOO.>> Jeff: IN A TALE OF TWO
684,00:42:18.67,00:42:18.67,"BROTHERS, VYTAS IS QUICKLYMAKING FRIEND."
685,00:42:20.17,00:42:20.17,>> I WOULD BE HONORED IF HE TOOKAN INTEREST IN KATIE.
686,00:42:22.43,00:42:22.43,I'M READY FOR GRAND BABIES.>> Jeff: WHILE ARAS' ARE
687,00:42:26.20,00:42:26.20,ALMOST GONE.>> WE HAVE TO TAKE OUT ARAS
688,00:42:28.77,00:42:28.77,SOONER THAN LATER.HAPPY.
689,00:42:30.70,00:42:30.70,>> SOLID.>> HEY.
690,00:42:42.17,00:42:42.17,>> I'M WORRIED ABOUT HAYDEN.I'M WORRIED HE'S GOING TO BE
691,00:42:45.17,00:42:45.17,DISAPPOINTED IN ME AND GODFORBID THIS DOES ANYTHING TO OUR
692,00:42:47.93,00:42:47.93,RELATIONSHIP.OUR RELATIONSHIP IS JUST
693,00:42:48.77,00:42:48.77,STARTING AND NOW I'M LIKE WHATIF I EMBARRASS ALL HIS FRIENDS.
694,00:42:53.90,00:42:53.90,WHO WANTS TO DATE SOMEONE WHODOESN'T MAKE THE MERGE?
