,begin,end,subtitles_text
682,00:41:28.90,00:41:28.90,YOU WILL HAVE A CHANCE TO GET BACK IN THIS GAME.
683,00:41:31.13,00:41:31.13,"GRAB YOUR TORCH, HEAD TO REDEMPTION ISLAND."
684,00:41:33.43,00:41:33.43,"GOOD LUCK. >> BYE, GUYS."
685,00:41:44.67,00:41:44.67,">> Jeff: WELL, TONIGHT'S TRIBAL ILLUSTRATES ONE OF THE"
686,00:41:47.27,00:41:47.27,TRICKIEST PARTS OF THIS GAME: EVERY TIME YOU OPEN YOUR MOUTH
687,00:41:49.93,00:41:49.93,YOU RISK SAYING SOMETHING THAT CAN GET YOU VOTED OUT.
688,00:41:54.23,00:41:54.23,"GRAB YOUR TORCHES, HEAD BACK TO CAMP."
689,00:41:56.43,00:41:56.43,GOOD NIGHT.  Captioning brought to you by
690,00:42:00.30,00:42:00.30," Survivor Productions, CBS,  Media Access Group at WGBH"
691,00:42:03.97,00:42:03.97," access.wgbh.org ""SURVIVOR"" -- THE WINNER OF"
692,00:42:18.27,00:42:18.27,TODAY'S DUEL WILL REENTER THIS GAME.
693,00:42:19.40,00:42:19.40,SOMEONE'S COMING BACK FROM REDEMPTION ISLAND.
694,00:42:22.27,00:42:22.27,WHO'S GOING TO HOLD OUT THE LONGEST?
695,00:42:24.53,00:42:24.53,>> I AM NOT LETTING GO! >> Jeff: AND WHAT WILL HAPPEN?
696,00:42:28.73,00:42:28.73,"DROP YOUR BUFFS, WE MERGED. BLOOD FINALLY MIXES WITH WATER."
697,00:42:36.50,00:42:36.50,">>> HEY, GUYS. I JUST CAN'T BELIEVE THAT"
698,00:42:41.57,00:42:41.57,THEY'RE KEEPING VYTAS. AND THEY VOTED ME OUT.
699,00:42:45.00,00:42:45.00,THEY DIDN'T GO WITH THE PLAN THAT I THOUGHT WE WERE DOING SO
700,00:42:46.87,00:42:46.87,HERE I AM. >> I WAS PRETTY SURE IT WAS
701,00:42:49.50,00:42:49.50,"GOING TO BE VYTAS, TOO. >> I KNOW."
702,00:42:51.80,00:42:51.80,IF I GO BACK IN THE GAME I'M CERTAINLY NOT SIDING WITH THE
703,00:42:54.73,00:42:54.73,GIRLS AND THAT IS FOR DAMN SURE.
