,begin,end,subtitles_text
343,00:20:56.70,00:20:56.70,SLOWLY COMING OUT OF MICHELLE. AND I'M BECOMING MORE AT PEACE
344,00:20:59.77,00:20:59.77,WITH WHERE I AM IN THE GAME. I AM SO GRATEFUL.
345,00:21:04.67,00:21:04.67,I'VE HAD A GREAT TIME. I'M REALLY TRYING TO ENJOY EVERY
346,00:21:08.30,00:21:08.30,MOMENT. SO THAT'S WHY I LOVE VYTAS.
347,00:21:10.97,00:21:10.97,BUT I HAVE TO KEEP MY HEART OUT OF IT BECAUSE HE IS A THREAT AND
348,00:21:14.20,00:21:14.20,I'M WILLING TO STICK WITH THE GIRLS IF THAT IS WHAT THE
349,00:21:17.50,00:21:17.50,CONSENSUS IS. I WILL DO WHAT NEEDS TO BE DONE
350,00:21:19.90,00:21:19.90,TO FURTHER MY GAME. >> YAY!
351,00:21:36.50,00:21:36.50,>> LET'S READ IT. >> CHAINED TO A FAMILY NOT OF
352,00:21:40.30,00:21:40.30,YOUR CHOOSING MAY MAKE YOU A VICTIM OF FATE.
353,00:21:43.97,00:21:43.97,APATHY OR FATIGUE MAY LEAD TO YOUR LOSING AND TRIBAL COUNCIL
354,00:21:47.00,00:21:47.00,IS WHERE YOUR CHANGES ABATE. >> WE'RE ALL CHAINED TOGETHER
355,00:21:50.67,00:21:50.67,DOING SOMETHING. >> WOW!
356,00:21:52.23,00:21:52.23,>> GOING INTO A PHYSICAL CHALLENGE WITH TWO WOMEN IN
357,00:21:54.80,00:21:54.80,"THEIR 40s, ONE WOMAN IN HER 50s AGAINST A TRIBE OF FIVE"
358,00:21:59.50,00:21:59.50,STRONG DUDES AND A GIRL IS TOUGH.
359,00:22:01.10,00:22:01.10,WE'RE GOING TO BE UNDERDOGS NO MATTER HOW THE COOKIE CRUMBLES
360,00:22:04.03,00:22:04.03,IN THIS CASE. I'M NOT GETTING MY HOPES TOO
361,00:22:08.30,00:22:08.30,HIGH. >> WHAT DO YOU THINK IF WE LOSE?
362,00:22:11.10,00:22:11.10,>> THEN IT'S GOING TO BE VYTAS. WE'VE BEEN TOGETHER SINCE THE
363,00:22:16.43,00:22:16.43,BEGINNING. ARE YOU OKAY WITH THAT?
364,00:22:18.17,00:22:18.17,>> NO. BUT YES.
365,00:22:19.40,00:22:19.40,"I MEAN, WE HAVE TO BE. >> I KNOW, THIS IS THE PART YOU"
366,00:22:23.97,00:22:23.97,HATE. POOR VYTAS.
367,00:22:25.10,00:22:25.10,">> I KNOW, POOR THING. >> I'M GONNA CRY."
368,00:22:28.67,00:22:28.67,WE JUST HAVE TO WIN. WE HAVE TO WIN.
369,00:22:30.17,00:22:30.17,>> YES. >> I DON'T WANT HIM TO GO.
370,00:22:32.03,00:22:32.03,">> I GOT EMOTIONAL THIS MORNING BECAUSE, YOU KNOW, IF WE DO LOSE"
371,00:22:35.60,00:22:35.60,"VYTAS IS THE ONE GOING HOME. OUR GIRL ALLIANCE, WE'VE HAD THE"
372,00:22:39.87,00:22:39.87,"LOYALTY, WE'VE LOOKED EACH OTHER IN THE EYE, OUR ALLIANCE IS"
373,00:22:42.60,00:22:42.60,STILL STRONG. WE'RE STICKING WITH THAT.
374,00:22:44.27,00:22:44.27,">> WHAT CAN YOU DO? >> I'M SORRY, GUYS."
375,00:22:46.60,00:22:46.60,>> I DON'T WANT ANYBODY TO GO. >> LET'S JUST WIN.
376,00:22:49.60,00:22:49.60,>> AND WE DON'T EVEN HAVE TO WORRY ABOUT IT.
377,00:23:03.17,00:23:03.17,">> Jeff: COME ON IN, GUYS! EVERYBODY READY TO GET TO"
378,00:23:17.60,00:23:17.60,"TODAY'S IMMUNITY CHALLENGE? FIRST THINGS FIRST, CIERA, TAKE"
379,00:23:21.43,00:23:21.43,IT BACK. ONCE AGAIN IMMUNITY IS BACK UP
380,00:23:26.93,00:23:26.93,"FOR GRABS. FOR TODAY'S CHALLENGE, FOUR"
381,00:23:29.70,00:23:29.70,MEMBERS OF EACH TRIBE WILL BE CHAINED TOGETHER AT THE ANKLES.
382,00:23:33.10,00:23:33.10,TWO OF THOSE PEOPLE WILL HAVE THEIR WRISTS ATTACHED TO A COIL.
383,00:23:37.53,00:23:37.53,ON GO YOU'LL RELEASE FROM THE COIL AND MOVING TOGETHER
384,00:23:41.03,00:23:41.03,NAVIGATE THROUGH A SERIES OF OBSTACLES COLLECTING BAGS ALONG
385,00:23:44.40,00:23:44.40,THE WAY. ONCE YOU'VE COLLECTED THE BAGS
386,00:23:46.57,00:23:46.57,THE REMAINING TRIBE MEMBER WILL USE THE CHAINS AND BALLS INSIDE
387,00:23:50.20,00:23:50.20,TO CREATE BOLOS. FIRST TRIBE TO LAND THREE BOLOS
388,00:23:53.57,00:23:53.57,"ON THEIR TARGET WINS IMMUNITY, SAFE FROM THE VOTE."
389,00:23:58.87,00:23:58.87,LOSERS GO TO TRIBAL COUNCIL WHERE SOMEBODY WILL BE VOTED OUT
390,00:24:01.83,00:24:01.83,"AND SENT TO REDEMPTION ISLAND. IN ADDITION, YOU ARE PLAYING FOR"
391,00:24:06.10,00:24:06.10,REWARD. WANT TO KNOW WHAT YOU'RE PLAYING
392,00:24:08.87,00:24:08.87,PLAYING? >> YEAH!
393,00:24:09.90,00:24:09.90,>> Jeff: ALL THE FRIED CHICKEN --
394,00:24:11.90,00:24:11.90,>> WOW! >> Jeff: -- YOU CAN EAT.
395,00:24:18.07,00:24:18.07,"AN AFTERNOON OF DEEP FRIED CHICKEN, CORN ON THE COB, MAC"
396,00:24:20.83,00:24:20.83,AND CHEESE. >> A SOUTHERN FEAST.
397,00:24:23.00,00:24:23.00,">> Jeff: ICED TEA, LEMONADE! WORTH PLAYING?"
398,00:24:26.70,00:24:26.70,">> OH, YES. >> Jeff: TADHANA, YOU HAVE ONE"
399,00:24:29.17,00:24:29.17,"EXTRA MEMBER, SITTING SOMEBODY OUT."
400,00:24:30.97,00:24:30.97,YOU CAN SIT OUT WHOEVER YOU WANT.
401,00:24:32.20,00:24:32.20,"WHO ARE YOU GOING TO SIT OUT? CIERA, TAKE A SPOT ON THE BENCH,"
402,00:24:37.30,00:24:37.30,EVERYBODY ELSE WE'LL GIVE YOU A MINUTE TO STRATEGIZE AND WE'LL
403,00:24:39.90,00:24:39.90,"GET STARTED. ALL RIGHT, HERE WE GO."
404,00:24:44.20,00:24:44.20,FOR IMMUNITY AND REWARD SURVIVORS READY?
405,00:24:49.80,00:24:49.80,GO! GOT TO WHIP THOSE THROUGH THOSE
406,00:24:55.33,00:24:55.33,COILS. >> I'M GOOD!
407,00:24:56.63,00:24:56.63,">> READY? OUTSIDE, INSIDE."
408,00:25:00.63,00:25:00.63,>> Jeff: BOTH TRIBES HAVE IT. NOW YOU'RE MOVING TOGETHER.
409,00:25:04.40,00:25:04.40,TADHANA GOING VERY QUICKLY. GALANG TAKING THEIR TIME.
410,00:25:09.33,00:25:09.33,THIS IS WHERE IT WILL GET INTERESTING.
411,00:25:11.10,00:25:11.10,EIGHT PEOPLE CONNECTED AT THE ANKLES ALL WORKING ON BAGS OF
412,00:25:14.23,00:25:14.23,PUZZLE PIECES TRYING TO STAY OUT OF EACH OTHER'S WAY AND GET IN
413,00:25:17.47,00:25:17.47,THE OTHER TRIBE'S WAY. >> I'M GOOD!
414,00:25:21.13,00:25:21.13,"LET'S GO! >> Jeff: ONCE YOU HAVE IT, THE"
415,00:25:22.80,00:25:22.80,TRICK IS HOW DO YOU GET OUT BECAUSE YOU HAVE FOUR OTHER
416,00:25:25.30,00:25:25.30,"PEOPLE IN THERE, TOO. >> LET'S GO!"
417,00:25:27.90,00:25:27.90,>> Jeff: GALANG HAS ALL FOUR. THEY'RE TRYING TO HEAD OUT.
418,00:25:30.90,00:25:30.90,TADHANA STILL WORKING ON THEIR FOURTH.
419,00:25:32.57,00:25:32.57,HAYDEN FINALLY HAS HIS FOURTH. THEY'RE OUT.
420,00:25:34.83,00:25:34.83,">> STEP, STEP. OUT."
421,00:25:36.17,00:25:36.17,>> OUTSIDE! INSIDE!
422,00:25:38.63,00:25:38.63,"OUTSIDE! >> COME ON, GET YOUR OTHER HAND"
423,00:25:40.80,00:25:40.80,"UP. >> STEP, STEP, STEP."
424,00:25:42.83,00:25:42.83,>> Jeff: TADHANA ONCE AGAIN IN FIRST.
425,00:25:44.93,00:25:44.93,GALANG ONCE AGAIN IN LAST! EIGHT PEOPLE ALL WORKING ON
426,00:25:50.90,00:25:50.90,THEIR BAGS. >> I'M GOOD!
427,00:25:54.20,00:25:54.20,">> I'M GOOD! >> Jeff: ONCE YOU HAVE THEM,"
428,00:25:59.43,00:25:59.43,"YOU CAN HEAD OUT, YOU JUST GOT TO GET PAST THE OTHER PEOPLE."
429,00:26:02.73,00:26:02.73,"CALEB TRYING TO GET OUT, HE'S TIED UP BEHIND MONICA."
430,00:26:05.93,00:26:05.93,VYTAS HAS GOT HIS BROTHER ARAS TIED UP.
431,00:26:09.13,00:26:09.13,"MONICA IS BLOCKING ARAS, SHE'S NOT LETTING HIM THROUGH."
432,00:26:12.40,00:26:12.40,ARAS CANNOT GET THROUGH. VYTAS HAS HIM TIED UP.
433,00:26:15.33,00:26:15.33,IT'S A MELEE! ALL KINDS OF ANKLES GETTING TIED
434,00:26:20.23,00:26:20.23,UP IN EACH OTHER. PEOPLE GOING DOWN.
435,00:26:25.30,00:26:25.30,BUFFS COMING OFF! BOTH TRIBES HAVE THEIR BAGS.
436,00:26:27.90,00:26:27.90,"KNEE HAS THEM, TYSON HAS THEM! TINA UNTYING FOR GALANG."
437,00:26:34.97,00:26:34.97,TYSON UNTYING FOR TADHANA. VERY CLOSE.
438,00:26:36.03,00:26:36.03,NOBODY WANTS TO GO TO TRIBAL COUNCIL AND EVERYBODY WANTS
439,00:26:39.30,00:26:39.30,"REWARD! TINA EMPTIES HER LAST BAG, TYSON"
440,00:26:41.80,00:26:41.80,STILL WORKING ON HIS LAST BAG. START ASSEMBLING THOSE BOLOS.
441,00:26:45.77,00:26:45.77,YOU NOW TAKE THE CHAINS AND CONNECT THEM.
442,00:26:47.60,00:26:47.60,ONE BALL ON EACH SIDE. ONCE YOU FINISH YOU CAN START
443,00:26:50.87,00:26:50.87,TOSSING THEM. TYSON AND TINA BOTH WORKING VERY
444,00:26:56.60,00:26:56.60,QUICKLY. WE ARE NECK IN NECK.
445,00:26:57.70,00:26:57.70,">> COME ON, TY, JUST TWO MORE. >> Jeff: TYSON HAS ALL THE"
446,00:27:02.43,00:27:02.43,BOLOS. HE'S GOING TO START TOSSING NOW.
447,00:27:04.17,00:27:04.17,YOU HAVE TO LAND THREE. KNEE CAN START TOSSING.
448,00:27:07.90,00:27:07.90,">> COME ON, TYSON. >> Jeff: TYSON LANDS HIS FIRST"
449,00:27:11.73,00:27:11.73,ONE FOR TADHANA! TYSON NEEDS TWO MORE.
450,00:27:16.00,00:27:16.00,JUST MISS. TINA SCORES FOR GALANG!
451,00:27:21.27,00:27:21.27,>> KEEP GOING! >> Jeff: THIS CHALLENGE COULD
452,00:27:23.50,00:27:23.50,"COME DOWN TO SECONDS. >> COME ON, TYSON, MAKE IT"
453,00:27:26.57,00:27:26.57,"TIGHT, BABY. >> Jeff: ALL RIGHT, TINA."
454,00:27:29.50,00:27:29.50,ATTA BABY! KEEP GOING!
455,00:27:32.30,00:27:32.30,>> Jeff: TYSON SCORES FOR TADHANA.
456,00:27:35.00,00:27:35.00,HE NEEDS JUST ONE MORE. TINA'S GOT TO PICK IT UP.
457,00:27:38.53,00:27:38.53,SHE FALLS SHORT AGAIN IN THE DIRT.
458,00:27:40.53,00:27:40.53,TYSON CAN DO IT RIGHT HERE! JUST MISSES.
459,00:27:43.90,00:27:43.90,">> GOT TO GO FAST, MOM. >> NICE!"
460,00:27:47.73,00:27:47.73,ALL RIGHT! ALL RIGHT.
461,00:27:48.93,00:27:48.93,>> Jeff: TINA LANDS HER SECOND FOR GALANG.
462,00:27:52.40,00:27:52.40,IMMUNITY. FRIED CHICKEN ON THE LINE.
463,00:27:54.17,00:27:54.17,TYSON CAN WIN IT FOR TADHANA RIGHT HERE.
464,00:27:57.23,00:27:57.23,"OH, JUST MISSES! TINA CAN WIN IT RIGHT HERE FOR"
465,00:28:02.63,00:28:02.63,GALANG. TINA GOES HIGH AND MISSES.
466,00:28:07.43,00:28:07.43,TYSON DOES IT. TADHANA WINS IMMUNITY AND
467,00:28:13.10,00:28:13.10,"REWARD! >> WHERE YOU AT, GIRL?"
468,00:28:17.07,00:28:17.07,">> SWEETIE, IT'S OKAY. IT'S ALL RIGHT!"
469,00:28:21.07,00:28:21.07,"IT'S ALL RIGHT. >> Jeff: TADHANA, STARTED OFF"
470,00:28:23.97,00:28:23.97,"THIS GAME, COULDN'T WIN, NOW YOU CAN'T LOSE."
471,00:28:27.47,00:28:27.47,IMMUNITY IS YOURS ONCE AGAIN. (APPLAUSE)
472,00:28:30.43,00:28:30.43,"ALONG WITH A NICE AFTERNOON. FRIED CHICKEN, BISCUITS, CORN ON"
473,00:28:35.07,00:28:35.07,THE COB SET UP FOR YOU JUST AROUND THE CORNER.
474,00:28:38.47,00:28:38.47,ENJOY YOUR NIGHT FREE OF TRIBAL COUNCIL AND ENJOY YOUR FOOD.
475,00:28:41.53,00:28:41.53,">> THANK YOU, JEFF. LOVE YOU GUYS, GOOD LUCK."
476,00:28:44.13,00:28:44.13,">> THANKS, GUYS. >> Jeff: GALANG, TRIBAL"
477,00:28:47.53,00:28:47.53,"COUNCIL ONCE AGAIN, SOMEBODY GOING HOME TONIGHT, GRAB YOUR"
478,00:28:50.30,00:28:50.30,"STUFF, HEAD BACK TO CAMP. SEE YOU AT TRIBAL WHERE SOMEBODY"
479,00:28:52.50,00:28:52.50,WILL BE VOTED OUT AND SENT TO REDEMPTION ISLAND.
480,00:29:20.13,00:29:20.13,>> DELICIOUS! AWESOME!
481,00:29:22.07,00:29:22.07,">> PRAYER, BRO. >> I DON'T HAVE TIME RIGHT NOW."
482,00:29:23.87,00:29:23.87,">> GOD IS GOOD, GOD IS GOOD, THANK YOU FOR THIS FOOD, AMEN."
483,00:29:28.93,00:29:28.93,>> MACARONI! >> IT'S A MIRACLE.
484,00:29:31.10,00:29:31.10,>> WE GOT SO LUCKY WITH THE TRIBE SWAP.
485,00:29:33.10,00:29:33.10,>> WE DID. >> YOU GUYS DID!
486,00:29:34.73,00:29:34.73,>> YOU GUYS DID SO GOOD. >> I STARTED OFF THE GAME WITH A
487,00:29:37.77,00:29:37.77,FOUR GAME LOSING STREAK IN CHALLENGES AND THAT SUCKED AND
488,00:29:41.90,00:29:41.90,NOW WE'RE ON A ROLL. TADHANA CAN'T BE STOPPED RIGHT
489,00:29:45.37,00:29:45.37,NOW. I FEEL GREAT AND I'M LOOKING
490,00:29:47.37,00:29:47.37,FORWARD. THE FUTURE IS BRIGHT.
491,00:29:48.50,00:29:48.50,>> I'M GETTING FULL. >> I'M NOT.
492,00:29:50.67,00:29:50.67,I WAS BUT I PUSHED PAST IT. >> WOULD ANYONE BE OFFENDED IF I
493,00:29:54.67,00:29:54.67,TOOK ICE OUT OF THIS LE LEMONADE? >> DO IT.
494,00:29:59.10,00:29:59.10,WE'RE EQUAL PARTNERS SO YOU CAN DO IT WHATEVER YOU WANT.
495,00:30:03.87,00:30:03.87,>> CAME TO YOUR BEACH AND ATE YOUR FOOD.
496,00:30:06.63,00:30:06.63,>> I'M A ONE MAN WRECKING BALL. >IDIDN'T NEED THIS REWARD.
497,00:30:10.33,00:30:10.33,I DON'T THINK I'VE BEEN HUNGRY ONE NIGHT SINCE WE'VE BEEN HERE.
498,00:30:13.40,00:30:13.40,I'VE CONVINCED EVERYONE EATING MAXIMUM AMOUNT AMOUNTS OF RICE IS THE
499,00:30:16.83,00:30:16.83,PROPER STRATEGY AND EVERYONE SEEMS TO JUST AGREE.
500,00:30:19.43,00:30:19.43,I'M A THREE TIME VETERAN OF THIS GAME SO OF COURSE WHAT I SAY IS
501,00:30:23.23,00:30:23.23,GOING TO BE RIGHT. WHAT DO YOU THINK IS GOING ON
502,00:30:25.40,00:30:25.40,WITH THE OTHER TRIBE? >> I DON'T KNOW WHO'S IN CONTROL
503,00:30:29.70,00:30:29.70,OVER THERE. THE KAT VOTE BAFFLED ME.
504,00:30:31.70,00:30:31.70,">> I FEEL LIKE VYTAS IS SAFE. I NEVER KNOW, I THOUGHT KAT WAS"
505,00:30:35.37,00:30:35.37,"SAFE, TOO. >> I KNOW WE'RE ALL SAFE."
506,00:30:37.57,00:30:37.57,"(LAUGHTER) >> WELL, HELL."
507,00:30:50.90,00:30:50.90,>> WE ALL TRIED OUR BEST. WE ALL GAVE IT OUR ALL IN THE
508,00:30:54.93,00:30:54.93,CHALLENGE. >> THAT'S RIGHT.
509,00:30:57.27,00:30:57.27,">> VYTAS, I RESPECT YOU SO MUCH AND I'VE ALREADY CRIED ABOUT"
510,00:31:02.43,00:31:02.43,THIS. WE'VE DECIDED AS FOUR GIRLS THAT
511,00:31:04.80,00:31:04.80,YOU'RE THE NEXT ONE TO GO. >> WHY?
512,00:31:08.60,00:31:08.60,>> BECAUSE I'M -- YOU'RE SUCH A HUGE THREAT IN THIS GAME.
513,00:31:12.47,00:31:12.47,"I MEAN, YOUR BROTHER'S WON BEFORE."
514,00:31:15.23,00:31:15.23,YOU'RE THE MOST AMAZING MAN. YOU'RE ONE OF THE MOST AMAZING
515,00:31:17.97,00:31:17.97,MEN I'VE MET. YOU'VE BROUGHT CALM TO OUR TRIBE
516,00:31:20.90,00:31:20.90,AND I DON'T THINK A BLIND SIDE IS FAIR AND I DON'T WANT TO --
517,00:31:24.40,00:31:24.40,WE DON'T WANT TO SURPRISE EACH OTHER AND I THINK IT'S JUST --
518,00:31:29.27,00:31:29.27,LET'S HAVE A GOOD AFTERNOON TOGETHER.
519,00:31:30.73,00:31:30.73,>> YOU THINK THAT MAKES ME WANT TO HAVE A GOOD AFTERNOON?
520,00:31:33.90,00:31:33.90,">> NO, I DON'T MEAN THAT. I GUESS BE AT PEACE KNOWING?"
521,00:31:37.30,00:31:37.30,I DON'T KNOW HOW ELSE -- I'M SORRY.
522,00:31:38.93,00:31:38.93,>> I APPRECIATE YOU TELLING ME. >> UNFORTUNATELY SOMEBODY HAS TO
523,00:31:42.80,00:31:42.80,GO HOME. VYTAS IS THE ODD MAN OUT.
524,00:31:46.97,00:31:46.97,I DON'T THINK BACK STABBING AND SENDING SOMEONE TO TRIBAL
525,00:31:51.03,00:31:51.03,COUNCIL NOT KNOWING WHAT'S HAPPENING IS A NICE THING AND IT
526,00:31:55.03,00:31:55.03,WAS JUST EATING ME ALIVE SO IT JUST CAME OUT.
527,00:31:59.67,00:31:59.67,">> WE FOUR GIRLS, IT'S SOMETHING WE DECIDED THIS MORNING AND WE"
528,00:32:02.07,00:32:02.07,WERE HOPING TO WIN AND NOT HAVE TO DO THIS.
529,00:32:03.97,00:32:03.97,>> YOU'VE GOT TO WRITE SOMEBODY'S NAME DOWN ON THAT
530,00:32:08.10,00:32:08.10,PARCHMENT. >> IT WAS REALLY HARD FOR ME.
531,00:32:09.80,00:32:09.80,BUT I FEEL LIKE I DID TAKE THE BULL BY THE HORNS BY TAKING MORE
532,00:32:12.67,00:32:12.67,OF A LEADERSHIP POSITION IN THE TRIBE.
533,00:32:14.93,00:32:14.93,IT MAY PUT A TARGET ON MY BACK BUT HOPEFULLY I'LL GET RESPECT
534,00:32:17.53,00:32:17.53,OUT OF IT AND THE WOMEN WILL LOOK UP TO ME A LITTLE.
535,00:32:19.97,00:32:19.97,I FEEL LIKE WE HAVE THE LOYALTY HERE.
536,00:32:24.10,00:32:24.10,">> I HOPE IT STICKS. >> OH, MY HEAVENS!"
537,00:32:37.87,00:32:37.87,"SERIOUSLY! THAT IS THE ""SURVIVOR"" MOMENT OF"
538,00:32:41.43,00:32:41.43,ALL -- TIME! >> I'M FLABBE FLABBERGASTED!
539,00:32:47.27,00:32:47.27,"I MEAN ""SURVIVOR"" 101, DON'T YOU MEET WITH YOUR ALLIANCE BEFORE"
540,00:32:50.93,00:32:50.93,YOU MAKE AN EXECUTIVE DECISION TO JUST TELL SOMEONE THEY'RE
541,00:32:56.20,00:32:56.20,"GOING HOME? THE GOLDEN RULE OF ""SURVIVOR"" IS"
542,00:33:01.53,00:33:01.53,TRUST. IS IT OR IS IT NOT?
543,00:33:03.30,00:33:03.30,I FELT BLINDSIDED! >> I KNOW!
544,00:33:05.20,00:33:05.20,>> Jeff. >> THIS MORNING I FELT LIKE I
545,00:33:08.90,00:33:08.90,COULD TRUST LAURA B. BUT NOW I DON'T KNOW.
546,00:33:11.73,00:33:11.73,"BLIND SIDES ARE TERRIBLE AND I'VE BEEN A VICTIM OF ONE, TOO,"
547,00:33:14.47,00:33:14.47,BUT THIS GAME IS BUILT ON TRUST. >> WE GOT RID OF KAT BECAUSE SHE
548,00:33:19.83,00:33:19.83,WAS DOING THAT. >> THE PLAN WAS TO VOTE OUT
549,00:33:24.43,00:33:24.43,VYTAS. WE'RE GETTING DOWN TO THE NUT
550,00:33:26.20,00:33:26.20,"CRACKING, SO TO SPEAK, WHAT WE SAY IN THE HILLS."
551,00:33:28.60,00:33:28.60,AND HE'S THE THREAT. JUST BECAUSE EVERYBODY SEEMS TO
552,00:33:33.27,00:33:33.27,LIKE HIM. HOWEVER LAURA B. IS
553,00:33:37.13,00:33:37.13,UNPREDICTABLE AND THAT MAKES ME NERVOUS.
554,00:33:41.37,00:33:41.37,>> IS IT MY TIME TO GO TONIGHT? >> I DON'T THINK SO.
555,00:33:45.13,00:33:45.13,I THINK IT COULD BE LAURA B. >> THANK YOU.
556,00:33:48.60,00:33:48.60,I APPRECIATE THAT. I TRUST YOU GIRLS 100%.
557,00:33:53.07,00:33:53.07,WHEN LAURA B. TOLD ME IT WAS MY TIME TO GO TONIGHT FOR A MOMENT
558,00:33:56.23,00:33:56.23,"I WAS LIKE ""I'M SCREWED."" BUT TINA, SHE WAS TELLING ME"
559,00:33:59.70,00:33:59.70,THAT LAURA'S GOING HOME. IT'S GONNA BE A LITTLE
560,00:34:04.20,00:34:04.20,EMBARRASSING FOR HER. >> IT WOULD BE SUPER EASY FOR
561,00:34:06.33,00:34:06.33,THEM TO WRITE MY NAME DOWN ON THE PARCHMENT BUT I FEEL LIKE
562,00:34:09.43,00:34:09.43,I'VE DONE MY DUE DILIGENCE WHEN IT COMES TO BUILDING TRUST WITH
563,00:34:12.17,00:34:12.17,THESE WOMEN SO IT'S NOT GONNA BE ME TONIGHT.
564,00:34:14.97,00:34:14.97,>> I SHOULD TKPWOPBLT OFF WITH ANY OF YOU BECAUSE THEN SHE'LL
565,00:34:17.73,00:34:17.73,"BE LIKE ""WHY ARE YOU TALKING TO VYTAS?"""
566,00:34:20.40,00:34:20.40,AND IF SHE DOES ASK YOU JUST LIKE SAY HE WAS SAYING HIS
567,00:34:24.93,00:34:24.93,GOOD-BYE. IT'S LIKE A PRIDE ALLIANCE
568,00:34:27.20,00:34:27.20,FEMALES IN CONTROL BUT THEY ALWAYS NEED ONE ALPHA MALE TO
569,00:34:30.87,00:34:30.87,KEEP AROUND OTHERWISE THERE'S NO FUTURE FOR THE PRIDE.
570,00:34:33.03,00:34:33.03,>> I DON'T KNOW WHAT TO DO. THAT'S MY BIG DILEMMA.
571,00:34:39.13,00:34:39.13,THERE'S PREPAR CUSHIONS BOTH WAYS.
572,00:34:42.63,00:34:42.63,TONIGHT. >> TONIGHT WE HAVE TO MAKE A
573,00:34:43.87,00:34:43.87,TOUGH DECISION. IN MY HEAD I THINK IT'S SMART IF
574,00:34:45.87,00:34:45.87,WE GET RID OF VYTAS BECAUSE AT SOME POINT YOU HAVE TO THINK
575,00:34:48.67,00:34:48.67,LONG TERM AND IF HE MAKES IT TO THE FINAL TRIBAL COUNCIL IT
576,00:34:51.60,00:34:51.60,WOULD BE DIFFICULT TO BEAT HIM. >> OF COURSE THERE'S A LITTLE
577,00:34:57.33,00:34:57.33,FEAR BUT I TRUST YOU GUYS. >> YEAH.
578,00:34:59.63,00:34:59.63,"AT THE SAME TIME, LAURA B. IS THE WILD CARD."
579,00:35:02.03,00:35:02.03,SHE MAKES THESE DECISIONS WITHOUT CONSULTING ANYONE AND TO
580,00:35:05.67,00:35:05.67,"KEEP SOMEONE LIKE THAT, THAT COULD HIT THE FAN AND EXPLODE"
581,00:35:08.30,00:35:08.30,BACK IN MY FACE. >> THANK YOU FOR LAURA B. AND
582,00:35:11.93,00:35:11.93,HER STRENGTH AS A NEW PERSON AND HAVING SO MANY LESSONS TO LEARN
583,00:35:15.30,00:35:15.30,AND THANK YOU FOR VYTAS' WONDERFUL SPIRIT WHO BRINGS SO
584,00:35:20.40,00:35:20.40,MUCH TO THIS CAMP AS WELL. >> SO I DON'T KNOW WHAT'S GONNA
585,00:35:23.40,00:35:23.40,HAPPEN BUT WHATEVER GOES DOWN IT'S NOT GOING TO BE PRETTY.
586,00:35:49.27,00:35:49.27,">> Jeff: ALL RIGHT, SO  LAURA"
587,00:35:51.07,00:35:51.07,B. AFTER THE CHALLENGE WHAT HAPPENED WHEN YOU GOT BACK TO
588,00:35:55.67,00:35:55.67,"CAMP? >> WELL, IT IS OBVIOUS THAT WE"
589,00:35:57.27,00:35:57.27,ARE FOUR GIRLS AND VYTAS ONE MAN SO I TOOK IT UPON MYSELF TO LET
590,00:36:01.90,00:36:01.90,HIM KNOW THAT HE WAS THE ONE THAT WAS GOING HOME.
591,00:36:05.67,00:36:05.67,">> Jeff: WOW. VYTAS, SO WHAT IS YOUR REACTION?"
592,00:36:09.07,00:36:09.07,"SOMEBODY TELLS YOU ""IT'S YOU""? >> IT WAS DISCOURAGING TO SAY"
593,00:36:12.43,00:36:12.43,THE LEAST. I'VE COME INTO THIS TRIBE AND
594,00:36:15.07,00:36:15.07,I'VE BEEN NOTHING BUT TRUSTWORTHY AND I'VE BEEN
595,00:36:17.67,00:36:17.67,"GENUINE WITH THESE PEOPLE. TO GET THAT KIND OF NEWS, IT"
596,00:36:20.17,00:36:20.17,"DIDN'T FEEL GOOD. >> Jeff: MONICA, TELLING"
597,00:36:22.17,00:36:22.17,PEOPLE THEY'RE GOING HOME AS PLEASANT AS IT SOUNDS IS REALLY
598,00:36:25.97,00:36:25.97,RISKY. >> I THINK IT'S EXTREMELY RISKY.
599,00:36:30.00,00:36:30.00,SO IF YOU'RE IN AN ALLIANCE WITH PEOPLE BEFORE YOU BLOW THE COVER
600,00:36:34.80,00:36:34.80,WE MIGHT WANT TO TALK ABOUT IT FIRST.
601,00:36:36.63,00:36:36.63,">> Jeff: KATIE, WHERE DO YOU WEIGH IN ON THAT?"
602,00:36:38.80,00:36:38.80,BECAUSE LAURA B. IS SPEAKING FOR THE GROUP WHICH COULD
603,00:36:42.00,00:36:42.00,POTENTIALLY IMPACT YOU. >> I AGREE WITH MONICA.
604,00:36:44.50,00:36:44.50,IF YOU'RE IN AN ALLIANCE YOU SHOULD DISCUSS THESE THINGS SO
605,00:36:47.90,00:36:47.90,WE WERE TAKEN AWACK. I WISH WE COULD HAVE TALKED
606,00:36:50.37,00:36:50.37,"ABOUT IT BEFORE. >> Jeff: VYTAS, IT SEEMS LIKE"
607,00:36:55.10,00:36:55.10,WE'VE NARROWED IT DOWN TO YOU'RE GOING UNLESS YOU CAN CONVINCE
608,00:36:57.57,00:36:57.57,THESE WOMEN THAT SOMEONE ELSE SHOULD GO AND IT SOUNDS LIKE
609,00:37:00.70,00:37:00.70,THAT COULD BE LAURA B. BECAUSE SHE SPOKE UP TRYING TO DO THE
610,00:37:04.20,00:37:04.20,HONORABLE THING IN A GAME THAT IS ANYTHING BUT HONORABLE.
611,00:37:06.40,00:37:06.40,">> YOU KNOW, THE LAST TRIBAL COUNCIL KAT WENT HOME BECAUSE"
612,00:37:09.40,00:37:09.40,"SHE WASN'T TRUSTWORTHY. I MEAN, I DIDN'T PITCH ANYBODY"
613,00:37:13.63,00:37:13.63,SPECIFICALLY. I'VE BEEN A GREAT MEMBER OF
614,00:37:15.70,00:37:15.70,"GALANG AND IT DOESN'T MATTER HOW MANY GIRLS YOU HAVE, IT MATTERS"
615,00:37:18.53,00:37:18.53,HOW MANY TRUSTWORTHY PEOPLE YOU HAVE.
616,00:37:20.13,00:37:20.13,">> Jeff: TINA, IT'S A DECENT ARGUMENT FROM A GUY WHO HAS"
617,00:37:23.07,00:37:23.07,NOTHING TO LOSE BECAUSE HE'S ON THE CHOPPING BLOCK TONIGHT.
618,00:37:26.73,00:37:26.73,>> IT'S TRUE AND VYTAS IS SO MUCH LIKE HIS BROTHER.
619,00:37:31.70,00:37:31.70,"THEIR HONESTY AND SINCERITY, THEY REEK OF IT."
620,00:37:34.50,00:37:34.50,"NOW, COULD THEY BE FOOLING YOU? ABSOLUTELY."
621,00:37:36.90,00:37:36.90,"THIS IS ""SURVIVOR."" BUT IF YOU WERE GOING ON"
622,00:37:40.50,00:37:40.50,"INSTINCT, THAT'S WHAT YOU WOULD FEEL."
623,00:37:44.40,00:37:44.40,">> Jeff: VYTAS, IF IT'S YOU TONIGHT, WHAT'S YOUR STORY?"
624,00:37:47.37,00:37:47.37,">> I MEAN, I WAS IN A POSITION WHERE I THOUGHT I WAS GOING TO"
625,00:37:49.83,00:37:49.83,"MOVE FORWARD REALLY WELL, THEN THERE WAS A TRIBE SWAP, I WAS"
626,00:37:52.90,00:37:52.90,THE ONE GUY WITH FIVE GIRLS AND IF I GO TONIGHT IT'S UNFORTUNATE
627,00:37:56.57,00:37:56.57,BECAUSE I THINK WE CAN MOVE FORWARD TOGETHER PRETTY WELL.
628,00:37:58.87,00:37:58.87,THAT WOULD BE MY STORY. >> Jeff: WHAT DO YOU THINK
629,00:38:00.93,00:38:00.93,YOUR BROTHER WILL THINK? WILL HE BE PROUD OF YOU OR HAPPY
630,00:38:04.83,00:38:04.83,YOU'RE GONE? >> I THINK ARAS WOULD BE PROUD
631,00:38:07.10,00:38:07.10,OF ME AND I THINK ARAS WOULD BE PRETTY BUMMED I'M GONE.
632,00:38:10.67,00:38:10.67,OUR RELATIONSHIP HAS SUFFERED OVER THE YEARS AND THERE'S A FEW
633,00:38:14.07,00:38:14.07,MORE STEPS THAT WE NEED TO GROW THAT MUCH CLOSER TOGETHER.
634,00:38:17.73,00:38:17.73,">> Jeff: LAURA B. IS, THAT PART OF VYTAS' APPEAL THAT HE"
635,00:38:21.27,00:38:21.27,AND HIS BROTHER HAVE THEIR OWN UNIQUE STORY?
636,00:38:23.53,00:38:23.53,">> YES, THAT'S PART OF THE REASON THAT I WANTED TO VOTE FOR"
637,00:38:26.60,00:38:26.60,VYTAS BECAUSE THEY DO HAVE SUCH A BOND.
638,00:38:29.23,00:38:29.23,ARAS HAS WON BEFORE. THEY'RE A HUGE THREAT IN THIS
639,00:38:32.03,00:38:32.03,"GAME. >> Jeff: WHAT ABOUT YOU,"
640,00:38:33.27,00:38:33.27,"LAURA? IF IT'S YOU TONIGHT, WHAT'S YOUR"
641,00:38:36.20,00:38:36.20,STORY? >> I TRIED TO BE MYSELF AND PUT
642,00:38:39.00,00:38:39.00,"MYSELF OUT THERE, LET MY GUARD DOWN."
643,00:38:41.10,00:38:41.10,>> Jeff: SO THAT SOMETHING YOU'RE LEARNING OUT HERE?
644,00:38:42.97,00:38:42.97,>> YES. I WAS RAISED IN A QUIET FAMILY
645,00:38:45.13,00:38:45.13,AND KEEP TO YOURSELF SO I STRUGGLE WITH LETTING PEOPLE
646,00:38:49.23,00:38:49.23,KNOW WHO I AM AND IT'S BEEN HARD FOR ME.
647,00:38:51.50,00:38:51.50,>> Jeff: WHAT DO YOU THINK YOUR HUSBAND RUPERT WILL MAKE OF
648,00:38:54.27,00:38:54.27,THE WAY YOU PLAYED THE GAME? >> I THINK NO MATTER WHAT RUPERT
649,00:38:58.03,00:38:58.03,WOULD BE PROUD OF ME. I'VE BEEN IN RUPERT'S SHADOW FOR
650,00:39:00.90,00:39:00.90,A WHILE AND IT FEELS GOOD JUST TO BE OUT HERE FOR MYSELF AND I
651,00:39:03.83,00:39:03.83,FEEL LIKE I'M COMING INTO MY OWN AND IT FEELS GOOD.
652,00:39:08.23,00:39:08.23,">> Jeff: TINA, TOUGH DECISION. YOU HAVE VYTAS WHO'S TELLING YOU"
653,00:39:12.40,00:39:12.40,"""LOOK, I'M TRYING TO BOND WITH MY BROTHER."""
654,00:39:15.80,00:39:15.80,"YOU HAVE LAURA B. SAYING ""I HAVE BROKEN OUT OF MICHELLE AND PUT"
655,00:39:19.73,00:39:19.73,"MYSELF IN A VULNERABLE SPOT WITH YOU PEOPLE."""
656,00:39:21.80,00:39:21.80,>> IT'S HORRIBLE. SOME PEOPLE DON'T COME HERE TO
657,00:39:24.20,00:39:24.20,MAKE FRIENDS. BUT THAT'S MY GOAL.
658,00:39:25.73,00:39:25.73,I DO LIKE HEARING THE STORIES. THAT'S PART OF THE JOY THAT I
659,00:39:29.27,00:39:29.27,"TAKE AWAY FROM THE HARD, HARD GAME."
660,00:39:31.37,00:39:31.37,">> I'VE GOT TO SAY, JEFF, EVERYBODY HERE HAS AN AMAZING"
661,00:39:34.87,00:39:34.87,STORY. THESE ARE AMAZING UNIQUE PEOPLE
662,00:39:36.43,00:39:36.43,WITH GREAT STORIES BUT WHEN I MAKE MY VOTE IT'S WHO DO I THINK
663,00:39:39.67,00:39:39.67,IS THE LEAST TRUSTWORTHY. WE SHOULD BE JUDGED ON OUR
664,00:39:42.23,00:39:42.23,"MERITS OF THE PRESENT, NOT OF OUR PAST AND HOW WE'VE PLAYED"
665,00:39:45.10,00:39:45.10,THESE LAST 18 DAYS SO FAR. THAT'S IT.
666,00:39:48.83,00:39:48.83,"JUST THAT SIMPLE. >> Jeff: ALL RIGHT, IT IS TIME"
667,00:39:53.17,00:39:53.17,"TO VOTE. LAURA B., YOU'RE UP."
668,00:40:09.33,00:40:09.33,>> THAT WAS A SWEET SPEECH YOU GAVE TO ME AT CAMP TODAY.
669,00:40:12.33,00:40:12.33,"IT SHOULD HAVE BEEN SWITCHED AROUND THE OTHER WAY, THOUGH."
670,00:40:27.90,00:40:27.90,>> Jeff: I'LL GO TALLY THE VOTES.
671,00:40:37.87,00:40:37.87,"IF ANYBODY HAS A HIDDEN IMMUNITY IDOL AND YOU WANT TO PLAY IT,"
672,00:40:40.97,00:40:40.97,"NOW WOULD BE THE TIME TO DO SO. OKAY, ONCE THE VOTES ARE READ,"
673,00:40:47.27,00:40:47.27,THE DECISION IS FINAL. PERSON VOTED OUT WILL BE ASKED
674,00:40:49.43,00:40:49.43,TO LEAVE THE TRIBAL COUNCIL AREA IMMEDIATELY.
675,00:40:52.03,00:40:52.03,I'LL READ THE VOTES. FIRST VOTE: VYTAS.
676,00:40:58.77,00:40:58.77,LAURA B. ONE VOTE VYTAS; ONE VOTE LAURA
677,00:41:02.77,00:41:02.77,B. LAURA.
678,00:41:06.20,00:41:06.20,THAT'S TWO VOTES LAURA; ONE VOTE VYTAS.
679,00:41:12.47,00:41:12.47,"SEVENTH PERSON VOTED OUT OF ""SURVIVOR: BLOOD VS. WATER,"""
680,00:41:15.57,00:41:15.57,"LAURA, THAT'S THREE, THAT'S ENOUGH."
681,00:41:17.27,00:41:17.27,"YOU NEED TO BRING ME YOUR TORCH. LAURA, THE TRIBE HAS SPOKEN."
