,begin,end,subtitles_text
1,00:00:00.00,00:00:00.00, >> Jeff: LAST TIME ON
2,00:00:07.93,00:00:07.93,"""SURVIVOR,"" THE RETURNING PLAYERS WERE IN CO THE"
3,00:00:09.77,00:00:09.77,GAME. >> WE ARE DRAW FOR NEW
4,00:00:11.97,00:00:11.97,TRIBES. SHOOK THINGS UPSURPRISE SWITCH
5,00:00:14.90,00:00:14.90,HAS AS WOMAN ON TADHANA AND VYTAS AS THE ONLY MAN ON
6,00:00:19.50,00:00:19.50,GALANG. >> ME AND FIVE GIRLS.
7,00:00:21.77,00:00:21.77,I'M THE ONLY MAN. >> Jeff: .
8,00:00:24.37,00:00:24.37,>> WAY CUT AWAY THE ARS ARE A.
9,00:00:26.43,00:00:26.43,>> YOU'RE DEEPER.
10,00:00:27.57,00:00:27.57,>> HOPEFULLY THE THIS WILL BE SMALLER ON ME AND LARGER ON
11,00:00:32.17,00:00:32.17,"ARAS. >> AT THE NEWALANG, THE PLAN"
12,00:00:33.60,00:00:33.60,WAS OBVIOUS. >> IT WOULD BE MAYBE VYTAS
13,00:00:36.50,00:00:36.50,BECAUSE HE'S NOT A GIRL. >> Jeff: TYSON AND ARAS THINK
14,00:00:42.27,00:00:42.27,THEY HAVE IT. TADHANA WINS IMMUNITY!
15,00:00:45.27,00:00:45.27,"BUT PAF GALANG LOST IMMUNITY CHALLENGE, CAT TURNING ON"
16,00:00:49.67,00:00:49.67,"HER ALLIANCE. >> IAT IS GUNNING FOR ME, I"
17,00:00:52.27,00:00:52.27,NEED TO DO WHAT IS BEST FOR MONICA.
18,00:00:55.03,00:00:55.03,>> Jeff: AT TRIBAL COUNCIL SHE MADE ONE FINAL PLEA.
19,00:00:57.20,00:00:57.20,">> MONICA, YOU KNOW I ALWAYS HAVE YOUR BACK."
20,00:00:59.30,00:00:59.30,">> OH, KAT, THERE'S NOTHING MORE THAT I WANT TO DO THAN TO TRUST"
21,00:01:09.70,00:01:09.70,"YOU. >> Jeff: IN THE END, HER"
22,00:01:11.40,00:01:11.40,BETRAYAL WAS TOO MUCH TO OVERLOOK.
23,00:01:14.70,00:01:14.70,"KAT, THE TRIBE HAS SPOKEN. 11 ARE LEFT."
24,00:01:18.60,00:01:18.60,"WHO WILL BE VOTED OUT TONIGHT. >> WELL, AT LEAST I DIDN'T CRY."
25,00:01:28.73,00:01:28.73,THAT'S A GOOD CHANGE. AT TRIBAL I GOT ELIMINATED.
26,00:01:31.70,00:01:31.70,APPARENTLY WE HAD AN ISSUE WITH TRUST.
27,00:01:33.53,00:01:33.53,"MONICA WAS FEELING ON THE OUTS, SO WAS LAURA AND THAT WAS THE"
28,00:01:37.37,00:01:37.37,PLACE FOR VYTAS TO SWOOP IN FOR THE KILL AND HERE I AM.
29,00:01:41.93,00:01:41.93,HEY! SORRY.
30,00:01:43.50,00:01:43.50,">> COME OVER HERE, KAT. TELL US WHAT HAPPENED."
31,00:01:46.33,00:01:46.33,">> WELL, I HAVE AN OVERSTRATEGIZER, WHICH IS"
32,00:01:49.67,00:01:49.67,"MONICA, A SOCIAL (BLEEP) WHICH WAS LAURA, I HAD A WOMAN WHO HAD"
33,00:01:53.07,00:01:53.07,A TARGET ON HER BACK FOR BEING A MILLION DOLLAR PLAYER AND THEN
34,00:01:56.27,00:01:56.27,HER DAUGHTER WHO'S A TAG ALONG THEN I GOT THE ONE GUY ON AN
35,00:01:59.93,00:01:59.93,ALL-WOMEN'S TRIBE AND THEY ALL FLIPPED ON ME.
36,00:02:05.93,00:02:05.93,THERE ARE THINGS I WISH I COULD TAKE BACK BUT I'M NOT OUT YET.
37,00:02:09.50,00:02:09.50,I STILL HAVE A LOT LEFT IN ME AND I'M GOING TO DO EVERYTHING I
38,00:02:12.73,00:02:12.73,CAN TO MAKE SURE THAT I WIN HOWEVER MANY DUELS I HAVE THAT
39,00:02:16.70,00:02:16.70,TO TO STAY HERE. I FEEL LIKE HAYDEN IS GOING TO
40,00:02:20.80,00:02:20.80,BE SO DISAPPOINTED. NO ONE WANTS TO DATE SOMEONE WHO
41,00:02:23.87,00:02:23.87,DOESN'T MAKE THE MERGE. HE'S GONNA DUMP ME.
42,00:02:26.03,00:02:26.03,">> OH, COME ON! >> I DON'T THINK I PLAYED THE"
43,00:02:48.57,00:02:48.57,RIGHT WAY. I WOULDN'T BE HERE IF I DID.
44,00:02:51.00,00:02:51.00,I KNOW I'M NOT OUT OF THE GAME YET BUT I FEEL LIKE HAYDEN WILL
45,00:02:54.70,00:02:54.70,BE EMBARRASSED THAT I'M HERE AND I DIDN'T PLAY BETTER OR TRY
46,00:03:01.03,00:03:01.03,HARDER. HE'S GONNA BE SO UPSET.
47,00:03:04.90,00:03:04.90,I DON'T WANT HIM TO BE ASHAPED OF ME BECAUSE I REALLY CARE
48,00:03:07.63,00:03:07.63,ABOUT HIM. AND IT'S JUST BEEN REALLY HARD
49,00:03:11.53,00:03:11.53,WITHOUT HIM. BECAUSE WE'RE LIKE A TEAM.
50,00:03:13.97,00:03:13.97,HE'S MY BEST FRIEND. AND I JUST HOPE THAT I CAN GO
51,00:03:17.63,00:03:17.63,INTO THE DUEL AND I HOPE THAT I CAN WIN AND HAYDEN WILL BE BY MY
52,00:03:23.47,00:03:23.47,THE SIDE STILL. A.
53,00:03:37.83,00:03:37.83,">> Jeff: COME ON IN, GUYS! TADHANA GETTING YOUR FIRST LOOK"
54,00:03:46.33,00:03:46.33,AT THE NEW GALANG TRIBE. KAT VOTED OUT AT THE LAST TRIBAL
55,00:03:55.13,00:03:55.13,COUNCIL. WE'LL NOW BRING IN THE
56,00:03:58.90,00:03:58.90,"COMPETITORS FOR TODAY'S DUEL: JOHN, LAURA M. AND KAT."
57,00:04:09.03,00:04:09.03,>> CAN YOU HUG ME? COME HUG HE?
58,00:04:16.57,00:04:16.57,(SOBBING) I'M SO SORRY!
59,00:04:20.17,00:04:20.17,">> IT'S OKAY. BABE, IT'S OKAY."
60,00:04:23.83,00:04:23.83,">> I'M SO -- >> IT'S ALL RIGHT, IT'S OKAY."
61,00:04:33.53,00:04:33.53,>> Jeff: SO KAT YOU COME IN AND IMMEDIATELY GRAB HAYDEN AND
62,00:04:36.57,00:04:36.57,"SAY ""I'M SORRY."" YOU'RE SORRY ABOUT GETTING VOTED"
63,00:04:40.50,00:04:40.50,"OUT? >> YEAH, I'M SORRY THAT I GOT"
64,00:04:42.57,00:04:42.57,"VOTED OUT. LIKE, OUR PLAN WAS TO PLAY"
65,00:04:45.60,00:04:45.60,TOGETHER AND I FEEL LIKE THAT HE WAS GOING TO BE DISAPPOINTED IN
66,00:04:49.30,00:04:49.30,ME IF I WAS IN THIS ARENA AND I STILL KIND OF FEEL LIKE I'M KIND
67,00:04:53.10,00:04:53.10,"OF LETTING HIM DOWN. >> Jeff: HAYDEN, HOW'S THAT"
68,00:04:56.07,00:04:56.07,SIT WITH YOU? SHE'S WORRIED ABOUT YOUR
69,00:04:59.13,00:04:59.13,RELATIONSHIP AND THAT YOU MIGHT SEE HER DIFFERENTLY BECAUSE SHE
70,00:05:01.33,00:05:01.33,GOT VOTED OUT. >> THAT'S NOT THE CASE.
71,00:05:05.97,00:05:05.97,OUR RELATIONSHIP IS GOING TO BE FINE.
72,00:05:08.27,00:05:08.27,"I MEAN, I'M NOT GOING TO VIEW YOU ANY DIFFERENTLY, YOU KNOW"
73,00:05:12.00,00:05:12.00,THAT. OBVIOUSLY MY RELATIONSHIP WITH
74,00:05:13.73,00:05:13.73,KAT IS MORE IMPORTANT THAN EVEN THIS GAME.
75,00:05:17.57,00:05:17.57,>> Jeff: REALLY? >> IT IS.
76,00:05:19.33,00:05:19.33,YEAH. IT IS.
77,00:05:19.97,00:05:19.97,>> Jeff: I WANT TO CHALLENGE YOU ON THAT.
78,00:05:22.77,00:05:22.77,ONE OF THE OPPORTUNITIES AT REDEMPTION ISLAND ARENA IS AT
79,00:05:26.60,00:05:26.60,ANY POINT A LOVED ONE CAN TAKE THE SPOT FOR THE PERSON IN THAT
80,00:05:30.27,00:05:30.27,ARENA WHICH MEANS YOU WOULD BE TAKING YOURSELF OUT OF THIS GAME
81,00:05:33.47,00:05:33.47,"AND SWAPPING SPOTS WITH KAT, PUT HER BACK IN THE GAME, YOU'D BE"
82,00:05:36.87,00:05:36.87,THE ONE FIGHTING FOR YOUR LIFE.  Captioning brought to you by
83,00:05:44.10,00:05:44.10," Survivor Productions, CBS, >> Jeff: HAYDEN, AT ANY POINT"
84,00:06:07.47,00:06:07.47,A LOVED ONE CAN TAKE THE SPOT FOR THE AMERICAN THE ARENA.
85,00:06:11.53,00:06:11.53,YOU GUYS WANT TO TALK THROUGH THAT OPTION?
86,00:06:13.53,00:06:13.53,>> YEAH. WHAT DO YOU THINK?
87,00:06:16.60,00:06:16.60,">> I DON'T KNOW. I MEAN, ARE YOU OKAY OVER THERE?"
88,00:06:20.10,00:06:20.10,">> I FEEL LIKE -- I MEAN, I'M IN A GOOD SPOT."
89,00:06:23.13,00:06:23.13,I FEEL LIKE I'M IN A GOOD SPOT. >> I DON'T THINK -- I DON'T
90,00:06:26.20,00:06:26.20,"KNOW. LIKE, YOU KNOW --"
91,00:06:29.43,00:06:29.43,>> Jeff: KAT WHAT DO YOU WANT TO HAVE HAPPEN?
92,00:06:31.17,00:06:31.17,>> I WOULD SWITCH BECAUSE I'M AFRAID THAT I WON'T DO WELL IN
93,00:06:35.93,00:06:35.93,THIS DUEL. BECAUSE IT'S A PUZZLE AND I
94,00:06:38.37,00:06:38.37,CAN'T EVEN SPELL. BUT I WOULD SWITCH.
95,00:06:41.13,00:06:41.13,">> HEY, WHAT DO YOU THINK IS BETTER FOR US LONG TERM?"
96,00:06:46.93,00:06:46.93,"LIKE, THINK ABOUT US BEING TOGETHER LONG TERM."
97,00:06:51.50,00:06:51.50,WHO HAS THE BETTER SHOT TO WIN THE GAME?
98,00:06:54.40,00:06:54.40,>> YOU KNOW YOU DO. YOU KNOW I'VE ALWAYS THOUGHT
99,00:06:58.67,00:06:58.67,THAT. HE'S SUCH A GOOD PLAYER.
100,00:07:00.93,00:07:00.93,"HE'S SUCH A GENUINE, HONORABLE, AND HE'S -- EVERY TIME SOMEONE"
101,00:07:05.10,00:07:05.10,SAYS SOMETHING ABOUT HAYDEN THERE'S NOT ONE BAD THING
102,00:07:07.70,00:07:07.70,ANYBODY HAS EVER SAID ABOUT HIM. AND I KNOW THAT HE WOULD DO SO
103,00:07:11.10,00:07:11.10,WELL IN THIS GAME. >> Jeff: SO WHEN HAYDEN ASKS
104,00:07:13.53,00:07:13.53,YOU LONG TERM WHAT'S BEST FOR YOU GUYS IT SOUNDS LIKE WHAT
105,00:07:16.77,00:07:16.77,"HE'S SAYING IS ""WHO HAS A BETTER SHOT AT WINNING THIS GAME?"""
106,00:07:20.60,00:07:20.60,>> IT IS. YOU KNOW YOU'D DO BETTER THAN
107,00:07:23.03,00:07:23.03,ME. >> SO WHAT DO YOU THINK?
108,00:07:27.73,00:07:27.73,>> Jeff: SO WHAT'S THE DEAL? >> I'M GONNA -- I'LL PLAY.
109,00:07:33.77,00:07:33.77,I'LL PLAY HERE AND I WANT YOU TO STAY.
110,00:07:36.83,00:07:36.83,YOU KNOW THAT MEANS SO MUCH TO ME THAT HE WOULD.
111,00:07:38.93,00:07:38.93,>> Jeff: THAT HE WOULD COME DOWN.
112,00:07:40.33,00:07:40.33,>> THAT HE WOULD. BUT I THINK IT MEANS MORE TO HIM
113,00:07:42.87,00:07:42.87,TO STAY. >> Jeff: ALL RIGHT.
114,00:07:45.47,00:07:45.47,SHALL WE GET TO TODAY'S DUEL? >> YUP.
115,00:07:48.33,00:07:48.33,>> Jeff: FOR TODAY'S DUEL YOU'LL RELEASE A MACHETE.
116,00:07:51.47,00:07:51.47,YOU'LL USE IT TO CHOP A ROPE DROPPING THE BAG OF PUZZLE
117,00:07:55.57,00:07:55.57,PIECES. YOU WILL THEN USE THOSE PIECES
118,00:07:56.87,00:07:56.87,"TO BUILD A FIRE PUZZLE. VERY SIMPLE IN CONCEPT, MUCH"
119,00:08:03.23,00:08:03.23,MORE DIFFICULT TO EXECUTE. FIRST TWO TO FINISH LIVE TO SEE
120,00:08:07.07,00:08:07.07,ANOTHER DAY ON REDEMPTION AND A SHOT AT GETTING BACK IN THIS
121,00:08:10.77,00:08:10.77,GAME AND A SHOT AT THE MILLION DOLLARS.
122,00:08:12.77,00:08:12.77,"LOSER IS OUT OF THIS GAME FOR GOOD, THEIR SHOT AT THE MONEY IS"
123,00:08:18.53,00:08:18.53,OVER. IN ADDITION THE WINNER OF THIS
124,00:08:20.77,00:08:20.77,DUEL WILL DECIDE WHO GETS THE CLUE TO THE LOCATION OF A HIDDEN
125,00:08:24.47,00:08:24.47,"IMMUNITY IDOL. TAKE YOUR SPOTS, WE'LL GET"
126,00:08:29.10,00:08:29.10,"STARTED. ALL RIGHT, HERE WE GO."
127,00:08:30.83,00:08:30.83,TWO WILL SURVIVE. ONE WILL BE OUT FOR GOOD.
128,00:08:37.33,00:08:37.33,SURVIVORS READY? GO.
129,00:08:38.43,00:08:38.43,"FIRST ORDER OF BUSINESS, WHIP THROUGH THOSE KNOTS."
130,00:08:40.57,00:08:40.57,YOU WANT TO RELEASE THAT MACHETE AND USE IT TO CHOP A ROPE.
131,00:08:44.43,00:08:44.43,THAT WILL DROP YOUR PUZZLE PIECES.
132,00:08:47.53,00:08:47.53,"KAT FLYING THROUGH HERS. >> COME ON, KAT."
133,00:08:50.10,00:08:50.10,">> GOOD JOB, KAT. >> Jeff: JOHN HAS HIS."
134,00:08:55.97,00:08:55.97,HE STARTS WORKING ON HIS ROPE. JOHN HAS RELEASED HIS PUZZLE
135,00:09:00.90,00:09:00.90,PIECES. KAT HAS HER HAS HERMA SHETTY.
136,00:09:07.13,00:09:07.13,LAURA HAS HERS. LAURA CHOPS HER ROPE.
137,00:09:09.90,00:09:09.90,">> COME ON, KAT! >> JOHN WITH AN EARLY LEAD."
138,00:09:15.03,00:09:15.03,KAT HAS HER PUZZLE PIECES. >> STAY CALM.
139,00:09:17.23,00:09:17.23,>> LAURA HAS HER PUZZLE PIECES. JOHN HAS HIS BAG EMPTIED HE CAN
140,00:09:22.70,00:09:22.70,START WORKING ON WHAT IS GOING TO BE A VERY DIFFICULT PUZZLE.
141,00:09:25.63,00:09:25.63,"LAURA HAS ALL HER PIECES. >> COME ON, KAT!"
142,00:09:29.63,00:09:29.63,"MAKE YOUR BAG BIGGER, KAT, SPREAD IT OUT."
143,00:09:32.90,00:09:32.90,>> Jeff: KAT STRUGGLING JUST TO GET THE PIECES OUT OF THE
144,00:09:35.90,00:09:35.90,BAG! LET'S GO!
145,00:09:36.97,00:09:36.97,">> IT'S OKAY, KAT, YOU GOT IT. >> THERE YOU GO."
146,00:09:41.40,00:09:41.40,>> Jeff: THIS IS THE SAME PUZZLE COCHRAN WON IN THE FINAL
147,00:09:45.80,00:09:45.80,IMMUNITY CHALLENGE. ONCE YOU GET THE CONCEPT THE
148,00:09:48.27,00:09:48.27,"PUZZLE WILL BECOME EASIER, YOU CAN MAKE UP A LOT OF TIME."
149,00:09:51.67,00:09:51.67,">> GOOD JOB, MOM. >> Jeff: JOHN STARTING TO GET"
150,00:09:55.07,00:09:55.07,THE HANG OF IT. LAURA GETTING THE HANG OF IT.
151,00:09:57.67,00:09:57.67,KAT STILL HAS YET TO PLACE ONE PIECE.
152,00:10:00.57,00:10:00.57,">> IT'S A BIG PIECE OVER THERE, KAT, THE LEFT SIDE."
153,00:10:02.77,00:10:02.77,>> THIS ONE? >> I'M TELLING YOU IT'S A LONG
154,00:10:05.43,00:10:05.43,"BIG PIECE, I CAN SEE IT. >> Jeff: HAYDEN WORKING HARD"
155,00:10:08.80,00:10:08.80,TO HELP KAT GET BACK IN THIS. JOHN MAKING A LOT OF PROGRESS.
156,00:10:12.70,00:10:12.70,HE'S IN THE LEAD. LAURA JUST LOOKING RIGHT NEXT
157,00:10:15.77,00:10:15.77,DOOR AT JOHN'S PUZZLE. >> CHEATER.
158,00:10:19.67,00:10:19.67,>> THERE YOU GO. >> Jeff: CATHYS SHE HAS HER
159,00:10:24.07,00:10:24.07,FIRST PIECE. JOHN CLEARLY UNDERSTANDS HOW
160,00:10:25.90,00:10:25.90,THIS PUZZLE WORKS. NOW IT'S JUST A MATTER OF
161,00:10:28.50,00:10:28.50,PUTTING IT TOGETHER. >> THERE YOU GO!
162,00:10:33.47,00:10:33.47,>> Jeff: KAT PLACES ANOTHER PIECE.
163,00:10:34.93,00:10:34.93,">> THERE YOU GO, KAT! >> GOOD JOB."
164,00:10:38.33,00:10:38.33,>> Jeff: EVEN WITH LAURA LOOKING AT JOHN'S PUZZLE SHE'S
165,00:10:41.40,00:10:41.40,HAVING TROUBLE. KAT WITH ANOTHER PIECE.
166,00:10:43.23,00:10:43.23,">> COME ON, MOM! >> Jeff: ."
167,00:10:45.37,00:10:45.37,>>> Jeff: JOHN MAKING A LOT OF PROGRESS.
168,00:10:47.93,00:10:47.93,JOHN IS WHIPPING THROUGH THIS PUZZLE!
169,00:10:51.13,00:10:51.13,THERE YOU GO! >> Jeff: CAT KAT NOW STARTING
170,00:10:53.87,00:10:53.87,TO GET THE HANG OF IT. LOOK AT THAT!
171,00:10:56.63,00:10:56.63,KAT COULD QUICKLY BE RIGHT BACK IN THIS.
172,00:10:58.47,00:10:58.47,">> COME ON, KAT! >> Jeff: THE ONLY WAY TO"
173,00:11:02.67,00:11:02.67,ENSURING YOU STILL HAVE A SHOT TO GET BACK IN THIS GAME SO TO
174,00:11:05.73,00:11:05.73,FINISH FIRST OR SECOND. THAT'S IT.
175,00:11:08.20,00:11:08.20,JON STEADIES HIS PUZZLE. HE'S GOT A LOT OF PIECES IN.
176,00:11:11.70,00:11:11.70,JOHN VERY CLOSE TO FINISHING THIS PUZZLE.
177,00:11:15.10,00:11:15.10,JOHN PLACES HIS LAST TWO PIECES IN.
178,00:11:18.10,00:11:18.10,(APPLAUSE) JOHN HAS SURVIVED.
179,00:11:19.57,00:11:19.57,JOHN WILL LIVE TO SEE ANOTHER DAY ON REDEMPTION ISLAND.
180,00:11:23.53,00:11:23.53,">> KEEP WORKING, KAT, KEEP WORKING."
181,00:11:25.70,00:11:25.70,>> Jeff: LAURA IMMEDIATELY STARTS LOOKING AT JOHN'S PUZZLE.
182,00:11:28.13,00:11:28.13,>> YOU HAVE TO BE KIDDING ME! >> Jeff: IT'S LAURA AND KAT
183,00:11:31.50,00:11:31.50,AND THE LEAD IS NOT VERY BIG. KAT HAS WORKED HER WAY INTO
184,00:11:34.83,00:11:34.83,THIS. >> LOOK AT LAURA'S.
185,00:11:36.13,00:11:36.13,>> IT'S CHEATING! >> IT'S NOT CHEATING.
186,00:11:38.60,00:11:38.60,"SHE'S DOING IT. >> COME ON, KAT."
187,00:11:40.53,00:11:40.53,>> Jeff: KAT STRUGGLING WITH THE ETHICS OF IT.
188,00:11:43.30,00:11:43.30,THERE'S NOTHING WRONG WITH LOOKING NEXT DOOR.
189,00:11:45.07,00:11:45.07,YOUR GAME; YOUR RULES. >> THAT PIECE YOU'RE TRYING TO
190,00:11:49.00,00:11:49.00,"FIT, KAT, IS SMOOTH. SMOOTH ON THE OUTSIDE AND IT"
191,00:11:51.93,00:11:51.93,CURVES ON THE INSIDE. >> YES!
192,00:11:55.23,00:11:55.23,>> Jeff: LAURA STILL WITH A BIT OF A LEAD BUT KAT IS IN
193,00:11:58.37,00:11:58.37,THIS. >> IT'S A PIECE LIKE THAT WITH A
194,00:12:00.57,00:12:00.57,POINT ON IT. I'M LOOKING AT LAURA'S.
195,00:12:03.17,00:12:03.17,IT'S SMOOTH. >> SMOOTH WITH A POINT.
196,00:12:05.53,00:12:05.53,>> Jeff: LAURA STARTING TO PULL AWAY NOW.
197,00:12:10.40,00:12:10.40,LAURA WITH ANOTHER PIECE. KAT STARTING TO FALL OUT OF THIS
198,00:12:13.57,00:12:13.57,"NOW. >> COME ON, KAT."
199,00:12:15.47,00:12:15.47,>> Jeff: LAURA WITH ANOTHER PIECE.
200,00:12:17.13,00:12:17.13,">> SMOOTH PIECE WITH A POINT, CAT."
201,00:12:19.40,00:12:19.40,>> LAURA DOWN TO THREE PIECES LEFT.
202,00:12:21.43,00:12:21.43,ONCE SHE PLACES THEM SHE STAYS ALIVE ANOTHER DAY ON REDEMPTION
203,00:12:25.13,00:12:25.13,ISLAND. LAURA DOWN TO HER LAST PIECE AND
204,00:12:27.43,00:12:27.43,SHE HAS IT. LAURA STAYS ALIVE TO JOIN JOHN
205,00:12:30.97,00:12:30.97,ON REDEMPTION ISLAND. KAT IS OUT OF THIS GAME.
206,00:12:34.57,00:12:34.57,">> GOOD JOB. JON, CONGRATULATIONS."
207,00:12:47.37,00:12:47.37,">> THANKS, JEFF. >> Jeff: THAT'S FOUR DUELS YOU"
208,00:12:50.17,00:12:50.17,"ARE SURVIVED. LAURA, YOU STAY ALIVE."
209,00:12:52.30,00:12:52.30,"TWO DUELS IN. KAT, FOR YOU AFTER 17 DAYS YOUR"
210,00:12:57.67,00:12:57.67,TIME OUT HERE IS DONE. IF YOU WANT TO SAY GOOD-BYE TO
211,00:13:00.50,00:13:00.50,"HAYDEN, TAKE A MOMENT. >> DON'T LEAVE ME, I LOVE YOU."
212,00:13:08.30,00:13:08.30,"YOU'RE NOT GOING TO BREAK UP WITH ME, ARE YOU?"
213,00:13:11.97,00:13:11.97,">> Jeff: KAT, YOU CAN GRAB YOUR STUFF."
214,00:13:14.73,00:13:14.73,TOSS YOUR BUFF IN THE URN ON THE WAY OUT.
215,00:13:16.53,00:13:16.53,">> LOVE YOU, KAT. >> GOOD JOB."
216,00:13:19.03,00:13:19.03,">> GOOD JOB, KAT. >> LOVE YOU!"
217,00:13:22.13,00:13:22.13,">> HAYDEN, TAKE CARE OF IT. >> Jeff: JOHN, AS WINNER OF"
218,00:13:31.00,00:13:31.00,"THE DUEL, YOU GET TO DECIDE, WHO GETS THE CLUE TO THE IDOL?"
219,00:13:35.60,00:13:35.60,">> I'M A CREATURE OF HABIT, JEFF."
220,00:13:37.93,00:13:37.93,I'LL GIVE IT TO MONICA. >> Jeff: ALL RIGHT.
221,00:13:40.13,00:13:40.13,"ONCE AGAIN MONICA. >> NO DISRESPECT, JOHN, I AM SO"
222,00:13:44.73,00:13:44.73,FLATTERED AND HONORED THAT YOU WOULD GIVE IT TO ME BUT I JUST
223,00:13:47.47,00:13:47.47,FEEL LIKE IT'S POISON IN THIS GAME.
224,00:13:49.30,00:13:49.30,">> IT'S A GIFT, YOU CAN DO WHATEVER YOU WANT WITH IT."
225,00:13:52.27,00:13:52.27,">> WELL, THANK YOU FOR THE KIND GESTURE."
226,00:13:55.03,00:13:55.03,">> Jeff: JOHN, LAURA, CONGRATULATIONS, YOU LIVE TO SEE"
227,00:13:57.97,00:13:57.97,"ANOTHER DAY. GRAB YOUR STUFF, HEAD BACK TO"
228,00:14:00.77,00:14:00.77,REDEMPTION ISLAND AND AWAIT YOUR NEXT KPUTOR AND NEXT DUEL.
229,00:14:04.13,00:14:04.13,">> GOOD JOB, GOOD JOB, GUYS. AWESOME."
230,00:14:06.80,00:14:06.80,"(APPLAUSE) >> Jeff: ALL RIGHT, GUYS, HEAD"
231,00:14:11.80,00:14:11.80,"OUT. >> YEAH, THAT'S TOUGH, DUDE."
232,00:14:32.47,00:14:32.47,>> I'VE BEEN THERE BEFORE. >> I KNOW YOU HAVE.
233,00:14:38.03,00:14:38.03,I FEEL RESPONSIBLE. IN REDEMPTION I COULD TRADE
234,00:14:40.93,00:14:40.93,PLACES WITH KAT. AND I DIDN'T.
235,00:14:45.87,00:14:45.87,"BUT AT THE TIME YOU THINK, YEAH, IT'S THE BEST DECISION."
236,00:14:48.80,00:14:48.80,BUT AS SOON AS I MADE IT I REGRETTED IT.
237,00:14:51.70,00:14:51.70,"YOU FEEL GUILTY OR RESPONSIBLE BECAUSE, LIKE, KAT IS A LITTLE"
238,00:14:55.40,00:14:55.40,NAIVE SOMETIMES AND DOESN'T ALWAYS KNOW WHICH WAY IS UP.
239,00:15:03.90,00:15:03.90,"AND I'M THE ONE THAT, LIKE, HELPS HER."
240,00:15:07.60,00:15:07.60,I WAS IN A POSITION TO HELP HER AND I DIDN'T DO IT WHEN I COULD
241,00:15:12.40,00:15:12.40,"HAVE. IT'S NOT SOMETHING I'M PROUD OF,"
242,00:15:15.07,00:15:15.07,"YOU KNOW? IT'S WEIRD, BECAUSE, YOU KNOW --"
243,00:15:18.33,00:15:18.33,WE ALL KNOW IT'S JUST A GAME BUT IT'S NOT LIKE -- JUST NOT THAT
244,00:15:22.43,00:15:22.43,EASY. >> I THINK IT'S WAY HARDER THAN
245,00:15:24.47,00:15:24.47,EVERYBODY THOUGHT IT WAS GOING TO BE.
246,00:15:25.53,00:15:25.53,">> ABSOLUTELY. >> GUYS, WE GOT EACH OTHER."
247,00:15:28.07,00:15:28.07,">> SERIOUSLY, LET'S WIN, GO IN WITH HUGE NUMBERS."
248,00:15:31.27,00:15:31.27,>> I KNOW VYTAS WILL COME WITH US AND LET'S BALL.
249,00:15:36.83,00:15:36.83,>> WE PULL VYTAS BACK OVER HERE AND THEN JUST LOCK THEM OUT.
250,00:15:40.47,00:15:40.47,">> LET'S RUN. >> WITH KAT BEING GONE, YOU FEEL"
251,00:15:43.67,00:15:43.67,A LITTLE RELIEF BECAUSE I CAN PLAY MY GAME.
252,00:15:45.67,00:15:45.67,I DON'T HAVE TO WORRY ABOUT SOMEBODY ELSE.
253,00:15:47.50,00:15:47.50,I'M ONLY LOOKING OUT FOR ME NOW. SO I CAN PLAY A LITTLE BIT MORE
254,00:15:51.80,00:15:51.80,"CUTTHROAT IF I HAVE TO. IN FACT, I THINK IT COULD"
255,00:15:55.13,00:15:55.13,STRENGTHEN MY RELATIONSHIP WITH THIS TRIBE BECAUSE THE MAJORITY
256,00:15:57.40,00:15:57.40,"OF THE TRIBE OVER HERE, THEY DON'T HAVE LOVED ONES AND IT'S"
257,00:16:00.37,00:16:00.37,"KIND OF ONE MORE THING WE ALL HAVE IN COMMON, EXCEPT ARAS."
258,00:16:05.30,00:16:05.30,>> ANYBODY WANT TO GO OUT FOR A PEACEFUL WALK AND MEDITATION?
259,00:16:08.83,00:16:08.83,>> I'M GOING TO TRY AND TAKE A NAP HERE.
260,00:16:11.20,00:16:11.20,">> ALL RIGHT, I'LL BE BACK. >> GOOD LUCK, THOUGH."
261,00:16:19.60,00:16:19.60,>> I COULD HAVEN'T ASKED FOR A BETTER SITUATION WHEN I CAME
262,00:16:22.60,00:16:22.60,"HERE TO HAVE TWO OF THE PEOPLE THAT I WAS REALLY, REALLY TIGHT"
263,00:16:26.27,00:16:26.27,WITH-- SKWRER VAS AND TYSON-- COME ON OVER TO THIS SIDE AND
264,00:16:29.63,00:16:29.63,OBVIOUSLY VYTAS IS MY CORE PARTNER AT THE END OF THE DAY SO
265,00:16:32.40,00:16:32.40,WHEN WE GET BACK TOGETHER I FEEL LIKE WE HAVE A DOMINANT POSITION
266,00:16:34.97,00:16:34.97,"IN THE GAME. I JUST NEED TO LET GO, LISTEN,"
267,00:16:38.17,00:16:38.17,BE INTUITIVE AND I'LL BE GUIDED TO THE RIGHT PLACES.
268,00:16:41.10,00:16:41.10,SO EVERYDAY WHEN I MEDITATE I VISUALIZE JEFF'S VOICE SAYING
269,00:16:45.40,00:16:45.40,"""AND THE WINNER OF ""SURVIVOR: BLOOD VS. WATER,"" ARAS."
270,00:16:49.97,00:16:49.97,AND I DO MY BEST TO TRUST THAT I'M TAKEN CARE OF.
271,00:16:54.73,00:16:54.73,>> YOU GUYS READY FOR THIS? >> WE'RE GOING TO GO TO THE
272,00:16:58.03,00:16:58.03,MERGE PROBABLY TOMORROW AND I DON'T KNOW WHOSE NAME YOU HEAR
273,00:17:02.23,00:17:02.23,"MOST OUT OF ARAS' MOUTH, MAYBE YOU CAN GUESS?"
274,00:17:05.17,00:17:05.17,>> HIS BROTHER. >> ALL HE WANTS TO DO IS GET TO
275,00:17:08.37,00:17:08.37,"VYTAS, THAT'S A PROBLEM FOR ME. THEY'VE BEEN THE MOST DANGEROUS"
276,00:17:11.37,00:17:11.37,COUPLE IN THE GAME SINCE DAY ONE AND THEY'RE ONE OF THE ONLY
277,00:17:14.23,00:17:14.23,COUPLES STILL LEFT IN THE GAME. WE HAVE TO TAKE OUT ARAS OR
278,00:17:18.20,00:17:18.20,VYTAS SOONER THAN LATER. >> HIS FINAL FOUR HAS TWO SPOTS
279,00:17:22.03,00:17:22.03,"TAKEN, HIM AND VYTAS. >> MERGE IS GOING TO HAPPEN."
280,00:17:24.83,00:17:24.83,IT'S GOING TO HAPPEN SOON. IF WE STICK TOGETHER WE CAN GET
281,00:17:26.97,00:17:26.97,TO THE END NO PROBLEM. AND I'M TELLING YOU RIGHT NOW I
282,00:17:30.23,00:17:30.23,WILL STICK WITH ALL YOU GUYS TO FINAL FIVE 100% MY WORD.
283,00:17:33.43,00:17:33.43,>> I WAS SHOCKED IT WAS TYSON THAT PROPOSED THE PLAN.
284,00:17:36.20,00:17:36.20,"HE SEEMED VERY CLOSE WITH ARAS BUT ON THE SAME HAND, TYSON'S"
285,00:17:41.70,00:17:41.70,SMART. RIGHT NOW SOMETHING WE HAVE IN
286,00:17:44.23,00:17:44.23,COMMON IS WE KNOW WE CAN TRUST EACH OTHER IS BECAUSE WE DON'T
287,00:17:46.67,00:17:46.67,HAVE ANYONE OVER THERE WE TRUST MORE.
288,00:17:49.23,00:17:49.23,">> IS EVERYBODY COOL WITH THAT, US FIVE AND SMOOTH SAILING?"
289,00:17:51.87,00:17:51.87,>> US FIVE. >> I'M GOOD WITH IT.
290,00:17:53.53,00:17:53.53,>> HAPPY? >> SOLID.
291,00:17:55.20,00:17:55.20,>> HAPPY? >> I'M IN.
292,00:17:56.60,00:17:56.60,>> HAPPY? WE HAVE TO HAVE EACH OTHER'S
293,00:17:58.70,00:17:58.70,BACKS. >> ARE YOU HAPPY?
294,00:17:59.67,00:17:59.67,>> I'M VERY HAPPY. I THOUGHT ARAS WAS PLAYING A
295,00:18:02.80,00:18:02.80,GOOD GAME AT FIRST BUT EVERYONE ELSE IS RECOGNIZING HIS MAIN
296,00:18:06.30,00:18:06.30,MOTIVATION RIGHT NOW WHICH IS GET TO VYTAS AND THEN TAKE
297,00:18:08.90,00:18:08.90,CONTROL OF THE GAME. MEDITATE ALL DAY LONG IF THAT'S
298,00:18:13.20,00:18:13.20,WHAT YOU NEED. I THINK HE'S GETTING COMFORTABLE
299,00:18:15.63,00:18:15.63,AND THAT PLAYS RIGHT INTO MY GAME PLAN.
300,00:18:32.93,00:18:32.93,"MORNING, BOO. >> GOOD MORNING, PRINCESS."
301,00:18:36.03,00:18:36.03,">> GOOD MORNING TO YOU, TOO. >> JUST LITTLE LATE"
302,00:18:44.67,00:18:44.67,SLEEPER-INNERS. HOW DID YOU SLEEP?
303,00:18:45.63,00:18:45.63,">> I SLEPT GREAT. OH, MY GOD, I WAS SO -- JUST"
304,00:18:48.80,00:18:48.80,"TIRED, YOU KNOW? >> EVEN THOUGH HE'S NOT PART OF"
305,00:18:52.03,00:18:52.03,OUR ALLIANCE I'VE REALLY COME TO LIKE VYTAS.
306,00:18:54.97,00:18:54.97,HE'S BEEN THROUGH THE SCHOOL OF HARD KNOCKS AND LOTS OF TIMES
307,00:18:58.17,00:18:58.17,WHEN PEOPLE GET KNOCKED DOWN AND THEY PICK THEMSELVES BACK UP
308,00:19:01.30,00:19:01.30,THEY'RE A WHOLE NEW PERSON. >> YOU GUYS LOOK LIKE A LITTLE
309,00:19:06.03,00:19:06.03,HAPPY COUPLE CAMPING ON THE BEACH.
310,00:19:07.23,00:19:07.23,>> I WOULD BE HONORED IF HE TOOK AN INTEREST IN KATIE JUST
311,00:19:10.50,00:19:10.50,BECAUSE HE SEEMS LIKE SUCH A STRAIGHT-UP GUY.
312,00:19:12.93,00:19:12.93,"HOWEVER, THE GUY WHO GETS KATIE IS GONNA HAVE TO HIT HER OVER"
313,00:19:15.70,00:19:15.70,THE HEAD WITH A CLUB AND DRAG HER INTO HIS CAVE BECAUSE KATIE
314,00:19:18.77,00:19:18.77,IS NOT A VERY FLIRTATIOUS GIRL. BUT ONE CAN DREAM.
315,00:19:24.27,00:19:24.27,I'M READY FOR GRANDBABIES. (LAUGHS)
316,00:19:27.17,00:19:27.17,WHAT IS THE HARDEST ASPECT OF THIS GAME FOR YOU?
317,00:19:30.53,00:19:30.53,">> OH, THAT'S EASY. THE DISHONESTY."
318,00:19:34.53,00:19:34.53,THE TRIBE SWAP WAS TOUGH. LIKE BEING THE ONE GUY WITH A
319,00:19:37.17,00:19:37.17,BUNCH OF GIRLS. BUT YOGA HAS TAUGHT ME A LOT
320,00:19:39.77,00:19:39.77,ABOUT DEALING WITH THE FEMININE ENERGY AND GIRLS AND WOMEN.
321,00:19:42.53,00:19:42.53,SO I KIND OF FEEL LIKE I HAVE AN IDEA OF WHAT'S GONNA HELP
322,00:19:46.77,00:19:46.77,INGRATIATE ME THE TRIBE MORE. I'M SUCH A TRUSTING PERSON.
323,00:19:49.70,00:19:49.70,"I HAD THIS WOMAN WALK INTO MY YOGA CLASS BARELY EVEN KNEW,"
324,00:19:53.33,00:19:53.33,"I'VE SEEN HER A FEW TIMES, SHE ASKED ME TO BORROW A HUNDRED"
325,00:19:56.33,00:19:56.33,BUCKS. I WAS TAKEN ABACK THAT SHE HAD
326,00:19:58.53,00:19:58.53,"THE AUDACITY BUT THEN I THOUGHT THIS MOMENT OF PRINCIPLE, LIKE I"
327,00:20:01.90,00:20:01.90,WANT TO BE T WORLD TO BE A PLACE WHERE WE CAN JUST TRUST FIRST
328,00:20:05.13,00:20:05.13,"AND THEN IF SOMEBODY BREAKS IT, THEN YOU DON'T TRUST THEM."
329,00:20:07.93,00:20:07.93,"SO I GAVE HER THE HUNDRED BUCKS. I WAS LIKE, SURE."
330,00:20:11.27,00:20:11.27,"IN MY EXPERIENCE, WOMEN LOVE A BAD BOY, BUT WHAT THEY EVEN LIKE"
331,00:20:14.80,00:20:14.80,MORE THAN A BAD BOY IS A NEWLY REFORMED BAD BOY.
332,00:20:19.40,00:20:19.40,SO I'M PUTTING FORWARD THE PARTS OF ME THAT I WANT THESE WOMEN TO
333,00:20:22.70,00:20:22.70,"SEE. I AM A LIKABLE PERSON, I'M A"
334,00:20:25.83,00:20:25.83,TRUSTWORTHY GUY. IT'S ALL VERY CALCULATED.
335,00:20:29.07,00:20:29.07,BUT IT'S WORKING. >> WE'RE SO GLAD YOU ARE HERE.
336,00:20:32.90,00:20:32.90,">> ME, TOO. >> VYTAS, HE'S A WONDERFUL MAN"
337,00:20:36.13,00:20:36.13,THAT CAN SHARE HIS EMOTIONS AND HIS FEELINGS AND I'VE LEARNED A
338,00:20:39.53,00:20:39.53,LOT FROM VYTAS. JUST BEING MORE OPEN TO PEOPLE.
339,00:20:44.13,00:20:44.13,I'M FEELING LESS GUARDED WITH THIS SMALL OF A TRIBE AND I FEEL
340,00:20:47.50,00:20:47.50,"LIKE I CAN BE MYSELF. COMING INTO THIS GAME, ONE OF MY"
341,00:20:51.00,00:20:51.00,INSECURITIES HAS BEEN MY SOCIAL GAME.
342,00:20:52.37,00:20:52.37,I WAS RAISED ON A FARM AND I'M KIND OF A QUIET GIRL THAT'S
