,begin,end,subtitles_text
348,00:22:14.00,00:22:14.00,"GOT TO DO TO GET THINGS DONE.>> WELCOME BACK, GIRL."
349,00:22:16.60,00:22:16.60,">> HI, GUYS.>> YOU GUYS READY TO GET TO YOUR"
350,00:22:20.13,00:22:20.13,NEXT IMMUNITY CHALLENGE?>> YEAH.
351,00:22:22.20,00:22:22.20,">> Jeff: FIRST THINGS FIRST,TAKE BACK THE IMMUNITY IDOL."
352,00:22:27.03,00:22:27.03,THANK YOU.ONCE AGAIN IMMUNITY IS BACK UP
353,00:22:31.47,00:22:31.47,"FOR GRABS.FOR TODAY'S CHALLENGE, ONE"
354,00:22:34.17,00:22:34.17,"PERSON FROM EACH TRIBE WILL SWIMOUT, RACE UP A PLATFORM, DIVE"
355,00:22:38.43,00:22:38.43,"INTO THE WATER TO RETRIEVE ARING, BRING IT BACK."
356,00:22:42.03,00:22:42.03,"THEN THE NEXT PERSON GOES.ONCE YOU COLLECT IT, ALL FOUR"
357,00:22:46.33,00:22:46.33,"RINGS, THE TWO REMAINING TRIBEMEMBERS WILL ATTEMPT TO LAND"
358,00:22:49.53,00:22:49.53,THOSE RINGS ON POSTS.FIRST TRIBE TO FINISH WINS
359,00:22:56.37,00:22:56.37,"IMMUNITY, IS SAFE FROM THE VOTE.LOSERS GO TO TRIBAL COUNCIL"
360,00:23:01.50,00:23:01.50,WHERE SOMEBODY WILL BE VOTEDOUT.
361,00:23:03.07,00:23:03.07,COYOPA HAS YET TO WIN ANIMMUNITY CHALLENGE.
362,00:23:05.77,00:23:05.77,"HUNAHPU HAS YET TO LOSE.HUNAHPU, YOU HAVE THREE EXTRA"
363,00:23:08.37,00:23:08.37,"PEOPLE, SITTING THREE PEOPLEOUT."
364,00:23:09.80,00:23:09.80,"WHO IS IT GOING TO BE?KELLEY GOING TO SIT OUT, JON"
365,00:23:14.13,00:23:14.13,GOING TO SIT OUT AND JEREMYGOING TO SIT OUT.
366,00:23:16.90,00:23:16.90,"INTERESTING CHOICES.THREE SITOUTS, YOU'LL JOIN ME"
367,00:23:20.77,00:23:20.77,"OVER HERE.EVERYONE ELSE, GIVE YOU A MINUTE"
368,00:23:23.10,00:23:23.10,TO STRATEGIZE AND WE'LL GETSTARTED.
369,00:23:31.47,00:23:31.47,ALL RIGHT.HERE WE GO.
370,00:23:33.83,00:23:33.83,FOR IMMUNITY.SURVIVORS READY?
371,00:23:37.23,00:23:37.23,"GO!ALL RIGHT, MISSY AND BAYLOR IN"
372,00:23:40.97,00:23:40.97,THE WATER FIRST.MOTHER AND DAUGHTER SQUARING OFF
373,00:23:44.53,00:23:44.53,AGAIN.>> GET UP THERE.
374,00:23:47.33,00:23:47.33,"GO, GO, GO!JUMP."
375,00:23:49.57,00:23:49.57,"YES.>> COME ON, MISSY."
376,00:23:55.33,00:23:55.33,>> Jeff: BOTH GOING FOR THOSEFIRST RINGS.
377,00:23:59.67,00:23:59.67,"THREE KNOTS, UNTIE THEM AND HEADBACK."
378,00:24:02.93,00:24:02.93,BAYLOR HAS HERS.SHE'S HEADING BACK.
379,00:24:05.07,00:24:05.07,MISSY HAS HERS.SHE'S HEADING BACK.
380,00:24:06.50,00:24:06.50,">> COME ON, MISSY.>> COME ON, MISS."
381,00:24:09.93,00:24:09.93,>> Jeff: NOW YOU HAVE THECLIMB BACK UP THAT LADDER AND
382,00:24:12.37,00:24:12.37,RACE BACK DOWN THE PLATFORMMENTBAYLOR RACING BACK WITH THAT
383,00:24:16.10,00:24:16.10,FIRST RING FOR COYOPA.MISSY RACING BACK WITH FIRST
384,00:24:18.83,00:24:18.83,"RING FOR HUNAHPU.>> OKAY, MISS."
385,00:24:22.10,00:24:22.10,">> HERE WE GO, HERE WE GO, HEREWE GO."
386,00:24:24.80,00:24:24.80,>> Jeff: BAYLOR'S BACK.JACLYN NOW IN THE WATER FOR
387,00:24:28.00,00:24:28.00,COYOPA.REED NOW IN THE WATER FOR
388,00:24:29.60,00:24:29.60,"HUNAHPU.COME ON, JACKIE."
389,00:24:34.63,00:24:34.63,"RUN AND JUMP.>> GO, REED."
390,00:24:36.83,00:24:36.83,">> GO, REED!>> Jeff: JACLYN AND REED BOTH"
391,00:24:40.57,00:24:40.57,HEADING FOR THOSE SECOND RINGS.IT'S A LITTLE LONGER SWIM THIS
392,00:24:44.33,00:24:44.33,TIME.REED HAS HIS RING.
393,00:24:45.97,00:24:45.97,HE'S HEADING BACK.JACLYN HAS HERS.
394,00:24:47.73,00:24:47.73,"SHE'S HEADING BACK.>> GO, JACKIE!"
395,00:24:51.07,00:24:51.07,"COME ON, JAC.MAKE UP THAT TIME."
396,00:24:56.13,00:24:56.13,>> Jeff: HUNAHPU BACK IN THELEAD.
397,00:24:59.27,00:24:59.27,JACLYN BACK IN THE WATER.REED IS BACK.
398,00:25:02.63,00:25:02.63,NATALIE NOW IN THE WATER FORHUNAHPU.
399,00:25:05.67,00:25:05.67,JACLYN BACK.ALEC IN THE WATER FOR COYOPA.
400,00:25:13.10,00:25:13.10,ALEC PICKING UP A LOT OF TIME.THAT IS HOW YOU DO IT!
401,00:25:18.97,00:25:18.97,NATALIE WORKING ON THAT THIRDRING FOR HUNAHPU.
402,00:25:20.93,00:25:20.93,SHE'S GOT IT.HEADING BACK.
403,00:25:23.30,00:25:23.30,ALEC WORKING ON THE THIRD RINGFOR COYOPA.
404,00:25:24.93,00:25:24.93,HE'S GOT IT.HE'S HEADING BACK.
405,00:25:26.20,00:25:26.20,">> COME ON, ALEC!>> Jeff: ALEC HAS MADE UP A"
406,00:25:30.20,00:25:30.20,LOT OF TIME IN THIS ROUND.THEY BOTH COME UP.
407,00:25:32.37,00:25:32.37,WE'RE DEAD EVEN AGAIN.ALEC NOW PUTS COYOPA BACK IN THE
408,00:25:34.83,00:25:34.83,LEAD.GET HIM ON THAT PLATFORM.
409,00:25:39.60,00:25:39.60,WES IN THE WATER FOR COYOPA.>> GO!
410,00:25:43.63,00:25:43.63,>> Jeff: KEITH IN THE WATERFOR HUNAHPU.
411,00:25:47.47,00:25:47.47,FATHER-SON IN THIS LAST BATTLEFOR A RING.
412,00:25:51.50,00:25:51.50,THEY'RE NOT MESSING AROUND.KEITH MOVING QUICKLY IN THE
413,00:25:57.57,00:25:57.57,WATER.WES HAS THE FOURTH RING FOR
414,00:26:00.93,00:26:00.93,COYOPA.KEITH HAS THE FOURTH RING FOR
415,00:26:03.83,00:26:03.83,HUNAHPU.NICES TOs FROM WES.
416,00:26:12.10,00:26:12.10,COYOPA HAS ALL FOUR.THEY HAVE THEIR TWO REBOUNDERS
417,00:26:14.37,00:26:14.37,IN.NOW DALE WILL START TOSSING.
418,00:26:17.33,00:26:17.33,KEITH MOVING QUICKLY IN THEWATER.
419,00:26:21.40,00:26:21.40,YOU'VE GOT TO GET THE RING BACK.KEITH BACK WITH THAT FOURTH RING
420,00:26:24.40,00:26:24.40,FOR HUNAHPU.HUNAHPU NOW PUTS THEIR
421,00:26:27.57,00:26:27.57,REBOUNDERS IN.ONE RING AT A TIME.
422,00:26:33.53,00:26:33.53,YOU GOT TO GET THE RING BACK.>> YES!
423,00:26:38.67,00:26:38.67,>> Jeff: COYOPA SCORES THEIRFIRST RING.
424,00:26:41.57,00:26:41.57,>> MY SHOT NOW.NOW IT'S MY SHOT.
425,00:26:43.63,00:26:43.63,>> JUST KEEP FIRING.>> Jeff: DREW WITH ANOTHER
426,00:26:46.03,00:26:46.03,MISS.COYOPA SCORES THEIR SECOND RING.
427,00:26:54.73,00:26:54.73,DREW SCORES FOR HUNAHPU.COYOPA SHORT.
428,00:27:01.50,00:27:01.50,">> SORRY.>> Jeff: OH, SAME RING."
429,00:27:04.20,00:27:04.20,FIGURE IT OUT.DREW MISSES AGAIN.
430,00:27:09.73,00:27:09.73,COYOPA SCORES ANOTHER.COYOPA LEADS WITH THREE.
431,00:27:12.87,00:27:12.87,THEY'RE DOWN TO ONE LEFT.DREW IS SINGLE HANDEDLY LOSING
432,00:27:18.57,00:27:18.57,THIS FOR HIS TRIBE.THIS COULD DO IT.
433,00:27:25.43,00:27:25.43,"COYOPA, THAT IS IT.COYOPA WINS THEIR FIRST IMMUNITY"
434,00:27:30.53,00:27:30.53,CHALLENGE.>> YES!
435,00:27:31.53,00:27:31.53,">> OH, MY GOSH!>> I KNEW IT!"
436,00:27:39.20,00:27:39.20,">> SORRY, GUYS.>> Jeff: COYOPA, WHO WANTS IT?"
437,00:27:43.10,00:27:43.10,">> GRAB IT.>> Jeff: COYOPA, NO TRIBAL"
438,00:27:49.40,00:27:49.40,COUNCIL FOR THE FIRST TIME INTHIS GAME.
439,00:27:52.57,00:27:52.57,ENJOY THE NIGHT OFF.GRAB YOUR STUFF.
440,00:27:56.50,00:27:56.50,HEAD BACK TO CAMP.ALL RIGHT.
441,00:28:04.90,00:28:04.90,"HUNAHPU, FOR THE FIRST TIME,TRIBAL COUNCIL."
442,00:28:06.63,00:28:06.63,SOMEBODY WILL BE VOTED OUTTONIGHT.
443,00:28:07.77,00:28:07.77,"GRAB YOUR STUFF, HEAD BACK THECAMP."
444,00:28:09.87,00:28:09.87,WE'LL SEE YOU TONIGHT AT TRIBALCOUNCIL.
445,00:28:12.23,00:28:12.23,>> I THREW THE CHALLENGE BECAUSEWE NEED TO GET SOME OF THE
446,00:28:18.60,00:28:18.60,"SNAKES OFF.IF I DON'T WANT THE WIN, WE'RE"
447,00:28:20.50,00:28:20.50,NOT GOING TO WIN.THAT'S WHAT MAKES ME THE KINGPIN
448,00:28:23.57,00:28:23.57,OF MY TRIBE.>> HAPPY TO BE HOME?
449,00:28:40.70,00:28:40.70,>> HELL YEAH.I FEEL BAD ABOUT THAT.
450,00:28:47.77,00:28:47.77,I KIND OF DECIDED IN EXILE IF IHAD THE OPPORTUNITY TO THROW
451,00:28:50.13,00:28:50.13,"THIS GAME I WOULD, AND I DID.I DON'T KNOW IF THEY KNEW I WAS"
452,00:28:55.07,00:28:55.07,"THROWING IT, BUT I COULD CARELESS BECAUSE WE NEED THE START"
453,00:28:58.37,00:28:58.37,GETTING RID OF SOME OF THESNAKES ON OUR TRIBE.
454,00:29:01.87,00:29:01.87,SO BASICALLY I'M A BAD ASS ANDTHE MANIPULATOR OF THIS GAME.
455,00:29:13.03,00:29:13.03,OKAY.HERE'S MY IDEA.
456,00:29:15.67,00:29:15.67,"I'M WORRIED THAT GOING INTO THEMERGE, INDIVIDUALS ARE GOING TO"
457,00:29:19.07,00:29:19.07,"OUTNUMBER COUPLES, SO WE TAKEPEOPLE THAT DON'T HAVE A LOVED"
458,00:29:23.40,00:29:23.40,ONE OUT.THAT'S WHY I THINK JULIE IS A
459,00:29:25.70,00:29:25.70,VERY EASY VOTE AND SHE HURTS OURTEAM.
460,00:29:27.60,00:29:27.60,>> EXACTLY.>> MY ARGUMENT TODAY IS JULIE
461,00:29:34.10,00:29:34.10,SHOULD BE THE ONE TO GO.SHE HASN'T BEEN HELPING IN
462,00:29:37.00,00:29:37.00,CHALLENGES.SHE DOESN'T HELP AROUND CAMP.
463,00:29:38.50,00:29:38.50,IT WOULD BE AN EASY ONE TO AGREEON.
464,00:29:40.70,00:29:40.70,BUT MOST IMPORTANTLY SHE DOESNOT HAVE A LOVED ONE.
465,00:29:46.07,00:29:46.07,>> OKAY.I'M GOING TO TARGET JULIE.
466,00:29:48.83,00:29:48.83,THIS IS MY REASON.RIGHT NOW THERE'S NO REASON TO
467,00:29:51.53,00:29:51.53,VOTE WITH US RIGHT NOW.>> LISTEN TO ME FIRST.
468,00:29:53.67,00:29:53.67,">> OKAY, GUYS, LISTEN.AMONGST US, SHE'S THE MOST"
469,00:29:57.40,00:29:57.40,DANGEROUS PERSON IN THIS TRIBE.WHO IS IT?
470,00:30:01.30,00:30:01.30,WHO IS GOING TO MANIPULATE THISGAME AND THROW THE STRONGER GUYS
471,00:30:05.43,00:30:05.43,OUT?IT'S KELLEY.
472,00:30:07.27,00:30:07.27,DONE DEAL.LOOK AT WHAT HAPPENS...
473,00:30:09.73,00:30:09.73,>> SHE KNOWS THE GAME.>> LOOK WHAT HAPPENS IF WE HAVE
474,00:30:14.60,00:30:14.60,KELLEY?YOU THINK JULIE'S GOING TO BEAT
475,00:30:16.40,00:30:16.40,US?MY PERSONAL BIGGEST THREAT RIGHT
476,00:30:18.10,00:30:18.10,"NOW IS KELLEY.SHE PLAYS VERY LOW KEY, BUT AT"
477,00:30:20.77,00:30:20.77,"THE SAME TIME, SHE'S VERYOBSERVANT."
478,00:30:23.07,00:30:23.07,"IF YOU TALK TO HER, YOU KNOWTHAT SHE'S NOT MISSED ONE"
479,00:30:26.47,00:30:26.47,"EPISODE OF ""SURVIVOR.""SO KELLEY IS A THREAT."
480,00:30:29.67,00:30:29.67,AND IT'S MY MISSION TO GETPEOPLE TO VOTE FOR HER TONIGHT.
481,00:30:38.30,00:30:38.30,">> LISTEN, HERE'S THE DEAL,KEITH IS TRYING TO GET ME OUT."
482,00:30:41.43,00:30:41.43,KEITH COMES BACK FROM EXILESAYING THAT I GOT THE IDOL.
483,00:30:46.83,00:30:46.83,WE NEED TO HAVE EACH OTHER'SBACKS.
484,00:30:49.00,00:30:49.00,"IF SOMEONE'S AFTER YOU, I GOAFTER THAT PERSON."
485,00:30:50.80,00:30:50.80,"IF SOMEONE'S AFTER ME, I PEKOTHE SAME THING."
486,00:30:53.50,00:30:53.50,>> HE'S NOT GOING TO GET YOU.WHO IS HE GOING TO PERSUADE?
487,00:30:57.40,00:30:57.40,>> YOU'RE OVERLOOKING THEMASTERMIND HERE.
488,00:30:59.40,00:30:59.40,">> THIS IS THE THING, I WANTKEITH GONE."
489,00:31:02.13,00:31:02.13,"KEITH IS TRYING TO GO AFTER ME,SO NOW I DON'T TRUST HIM AT ALL."
490,00:31:06.00,00:31:06.00,"BUT DREW, HE WANTS TO GET RID OFKELLEY NOW BECAUSE HE THINKS"
491,00:31:10.73,00:31:10.73,"KELLEY RUNS THE GIRL, WHICH ISRIDICULOUS."
492,00:31:13.43,00:31:13.43,"SHE'S NOT DOING ANYTHING.KEITH'S FIRST, YOUR SECOND, I'M"
493,00:31:17.33,00:31:17.33,"THIRD, YOU'RE FOURTH.IT'S NOD GOOD LOGIC."
494,00:31:22.67,00:31:22.67,">> WHEN YOU'RE SAYING, THISYOU'RE DELG ME YOU DON'T HAVE MY"
495,00:31:25.23,00:31:25.23,BACK.>> YOU'RE WAY TOO EMOTIONAL
496,00:31:27.67,00:31:27.67,"ABOUT THIS, JEREMY.>> GET YOUR BOY, DOG."
497,00:31:31.17,00:31:31.17,WITH DREW THERE'S NO THROWINGBACK AND FORTH.
498,00:31:33.30,00:31:33.30,"HE'S JUST LIKE, KELLEY'S GOINGHOME, AND THAT'S IT."
499,00:31:36.23,00:31:36.23,"AND IT PISSED ME OFF.>> I WAS JUST TALKING THE DREW,"
500,00:31:48.57,00:31:48.57,"AND HE'S LIKE, THE GIRLS ARETRYING TO GET THE GUYS OUT."
501,00:31:51.27,00:31:51.27,"DREW SAID THAT.I SAID, THAT'S MESSED UP."
502,00:31:53.83,00:31:53.83,"HE TOLD ME, ME, YOU...>> HE JUST TOLD YOU THAT?"
503,00:31:57.40,00:31:57.40,">> I SAID, THERE'S NO GUY-GIRLTHING HERE."
504,00:31:59.97,00:31:59.97,WE HAVE NO POWER.THAT'S STRAIGHT UP WHAT I TOLD
505,00:32:01.93,00:32:01.93,"HIM.>> DREW, HE'S SCARED THE GIRLS"
506,00:32:03.73,00:32:03.73,"ARE GOING TO VOTE OUT GUYS,WHICH IS STUPID."
507,00:32:05.90,00:32:05.90,"WE DON'T EVEN HAVE THE NUMBERSTO DO THAT, BUT THAT'S CONVINCED"
508,00:32:09.90,00:32:09.90,OF THIS GIRL-GIRL ALLIANCE.THE GUYS ARE A MESS.
509,00:32:13.23,00:32:13.23,"THEY'RE NOT ON THE SAME PAGE,WHICH IS GOOD."
510,00:32:15.70,00:32:15.70,"IN THE LONG RUN, WHO IS WINNINGIMMUNITY CHALLENGES?"
511,00:32:18.37,00:32:18.37,>> DREW OR JOHN.>> PROBABLY DREW MORE THAN JOHN.
512,00:32:22.00,00:32:22.00,>> MAYBE WE GET RID OF DREWFIRST.
513,00:32:24.47,00:32:24.47,>> YEAH.>> I THINK YOU'RE RIGHT.
514,00:32:27.27,00:32:27.27,">> GETTING RID OF DREW, THATWOULD BE SO SWEET IF WE CAN PULL"
515,00:32:30.17,00:32:30.17,THIS OFF.>> HE'S SO ANNOYING.
516,00:32:32.63,00:32:32.63,"WE HAVE TO DO IT NOW, WHILE THEGUYS ARE ALL OVER THE PLACE."
517,00:32:38.03,00:32:38.03,>> WE'RE SENDING KELLEY HOME.THAT'S IT.
518,00:32:43.27,00:32:43.27,"THINK ABOUT IT, GUYS.I'M TELLING YOU."
519,00:32:45.37,00:32:45.37,LET'S GET KELLEY OUT TONIGHT ANDTHEN ALL THESE BITCHES DON'T
520,00:32:49.73,00:32:49.73,KNOW WHAT TO DO OTHER THAN COMETO US.
521,00:32:52.00,00:32:52.00,"TRUST ME, GUYS.TRUST ME."
522,00:32:53.47,00:32:53.47,COUNT ON IT.LOOK ME IN THE EYES.
523,00:32:57.30,00:32:57.30,COUNT ON IT.>> I WAS STANDING BY THE SHELTER
524,00:32:59.33,00:32:59.33,"AND I HEARD DREW LEADING THISCHARGE TO GET ME OUT, AND I WAS"
525,00:33:03.43,00:33:03.43,"LYING, WHAT THE HELL.I DON'T KNOW WHAT IT IS, MAYBE"
526,00:33:05.77,00:33:05.77,HE'S JUST THREATENED BY ME AS ASTRONG FEMALE.
527,00:33:08.83,00:33:08.83,"BUT DREW GETS THIS VISION IN HISHEAD, AND HE'S LIKE THE KING OF"
528,00:33:11.97,00:33:11.97,"IT, AND HE HAS TO BE THE ONETO... HE HAS TO MAKE THE FINAL"
529,00:33:15.57,00:33:15.57,DECISION.AND I THINK PEOPLE ARE GETTING
530,00:33:17.17,00:33:17.17,"OVER THAT REALLY, RALLY QUICKLY.>> GET RID OF DREW."
531,00:33:27.70,00:33:27.70,WE CAN COME IN STRONG AND SAYDREW IS TAKING DOWN THE WRONG
532,00:33:31.13,00:33:31.13,GIRL.>> THIS IS HOW IT'S GOING RIGHT
533,00:33:32.60,00:33:32.60,NOW.THE GIRLS WANT TO GET RID OF
534,00:33:34.50,00:33:34.50,"DREW.YES, HE'S A MORON, BUT THAT'S A"
535,00:33:36.70,00:33:36.70,BIG MOVE.AND IT MAKES ME NERVOUS.
536,00:33:40.07,00:33:40.07,>> WE'RE SENDING KELLEY HOME.THAT'S WHAT'S HAPPENING.
537,00:33:44.67,00:33:44.67,YOU ON BOARD WITH IT OR NOT.>> I DON'T CARE.
538,00:33:46.77,00:33:46.77,>> I'M JUST TELLING YOU THETRUTH.
539,00:33:50.23,00:33:50.23,">> DUDE, I DON'T CARE.>> THE PROBLEM IS, THE GUYS ARE"
540,00:33:56.30,00:33:56.30,"ALL OVER THE PLACE.DREW IS SAYING, KELLEY'S THE"
541,00:33:59.80,00:33:59.80,"PLAYER.JOHN IS LIKE, WE'RE GOING AFTER"
542,00:34:03.60,00:34:03.60,"JULIE, AND I WANT TO GET RID OFKEITH."
543,00:34:05.33,00:34:05.33,">> WELL, WELL, WELL, EVERYBODYSEEMS TO HAVE THEIR OWN OPINION,"
544,00:34:09.30,00:34:09.30,DON'T THEY?>> IT'S JUST CRAZY.
545,00:34:11.40,00:34:11.40,"MAYBE WE SHOULD GET RID OF DREW.HE'S DIGGING HIS OWN GRAVE, BUT"
546,00:34:15.00,00:34:15.00,I'M JUST NOT SURE IF IT'S THERIGHT TIME.
547,00:34:34.33,00:34:34.33,>> Jeff: BEHIND EACH OF YOU ISA TORCH.
548,00:34:36.83,00:34:36.83,"GO AHEAD, GREAT BRITAIN -- GRABA TORCH, DIP IT IN AND GET FIRE."
549,00:34:43.63,00:34:43.63,THIS IS PART OF THE RITUAL OFTRIBAL COUNCIL BECAUSE IN THIS
550,00:34:47.03,00:34:47.03,"GAME FIRE REPRESENTS YOUR LIFE.WHEN THE FIRE IS GONE, SO ARE"
551,00:34:51.33,00:34:51.33,YOU.OKAY.
552,00:34:54.13,00:34:54.13,OUR FIRST CHANCE TO TALK.SO CATCH ME UP.
553,00:34:56.80,00:34:56.80,"JULIE, TELL ME ABOUTRELATIONSHIPS."
554,00:34:59.13,00:34:59.13,WHO DO YOU NOTICE IS GETTINGALONG RIGHT OUT OF THE GATE IN
555,00:35:02.60,00:35:02.60,>> I WOULD HAVE TO SAY JOHN ANDDREW.
556,00:35:05.60,00:35:05.60,THEY RUN AROUND LIKE THEY'REFIVE-YEAR-OLDS.
557,00:35:07.60,00:35:07.60,IT'S CUTE.YEAH.
558,00:35:09.37,00:35:09.37,">> MISSY, WHO DOESN'T GET ALONG?>> MY OBSERVATION IS THAT WE"
559,00:35:14.00,00:35:14.00,"HAVE A WHOLE WILL THE OF CHIEFSAND NOT VERY MANY INDIAN, AND"
560,00:35:17.80,00:35:17.80,THEY'RE SELFISH AND SELFLESSPEOPLE AROUND CAMP.
561,00:35:20.37,00:35:20.37,>> Jeff: HOW MANY SELFISHPEOPLE DO YOU HAVE ON THIS
562,00:35:24.87,00:35:24.87,TRIBE?>> HALF THIS TRIBE.
563,00:35:26.23,00:35:26.23,">> Jeff: DREW, ONE OF THE BADTHINGS ABOUT WINNING IS YOU"
564,00:35:28.70,00:35:28.70,DON'T GET TO FIGURE OUT WHERETHINGS ARE WITHIN THE TRIBE.
565,00:35:31.07,00:35:31.07,>> ABSOLUTELY.EVERYBODY HAS BEEN PLAYING NICE
566,00:35:33.37,00:35:33.37,"UNTIL WE LOST TODAY, JEFF.I FELT IT RIGHT AFTER THE"
567,00:35:36.27,00:35:36.27,"CHALLENGE, LIKE WOW WE ACTUALLYHAVE TO PLAY THIS GAME."
568,00:35:38.80,00:35:38.80,">> Jeff: DREW, LET'S TALKABOUT GAME TIME TODAY, BECAUSE I"
569,00:35:41.30,00:35:41.30,"THOUGHT IT WAS INTERESTING THATFOR A TRIBE THAT'S DOMINATED,"
570,00:35:44.77,00:35:44.77,"THAT YOU GOT DEMOLISHED TODAY,BY A GUY THAT COULD BE MAYBE"
571,00:35:48.10,00:35:48.10,YOUR GRANDDAD.>> COULD WE HAVE HAD BETTER
572,00:35:53.43,00:35:53.43,"SWIMMERS, BETTER RETRIEVERS.YOU WIN SOME, YOU LOSE SOME."
573,00:35:57.37,00:35:57.37,I DID THE BEST I COULD ANDTHAT'S IT.
574,00:35:59.50,00:35:59.50,">> Jeff: JOHN, AFTER THECHALLENGE, YOU HEAD BACK THE"
575,00:36:01.80,00:36:01.80,CAMP.WHAT HAPPENED?
576,00:36:03.53,00:36:03.53,">> WE GOT BACK AND PEOPLE JUSTSTARTED SCRAMBLING, LIKE, OKAY,"
577,00:36:07.23,00:36:07.23,"WHAT'S THE VOTE GOING TO BE?EMOTIONS GOT HIGH, TOO."
578,00:36:10.50,00:36:10.50,"IT WAS CONFUSING.>> Jeff: JEREMY, JON SAYS"
579,00:36:14.93,00:36:14.93,EMOTIONS GOT HIGH.WHAT DOES THAT MEAN?
580,00:36:16.40,00:36:16.40,">> WELL, SO, I'M JUST GOING TOSAY IT."
581,00:36:19.13,00:36:19.13,KEITH COMES BACK FROM EXILE ANDTELLS EVERYBODY THAT I HAVE AN
582,00:36:22.93,00:36:22.93,"IDOL.SO I SAY, KEITH, WHY DON'T YOU"
583,00:36:25.47,00:36:25.47,"COME TO ME AND SAY, HEY, DO YOUHAVE AN IDOL."
584,00:36:28.33,00:36:28.33,WE'RE ALIGNED.>> I WAS LOOKING FOR THE IDOL
585,00:36:31.03,00:36:31.03,"AND I DIDN'T FIND THE IDOL.I ASSUMED, MIGHT HAVE BEEN"
586,00:36:34.03,00:36:34.03,"WRONG, I ASSUMED JEREMY HAD BEATME TO THE PUNCH."
587,00:36:36.00,00:36:36.00,">> AND I'M IN YOUR ALLIANCE, SOWHY DON'T YOU COME TO ME?"
588,00:36:39.60,00:36:39.60,>> BECAUSE YOU GO TO SOMEBODYELSE...
589,00:36:42.50,00:36:42.50,>> WE COULD HAVE KEPT IT BETWEENME AND YOU.
590,00:36:44.90,00:36:44.90,">> JEREMY, COP ON NOW.IT DOESN'T HAPPEN LIKE THAT IN"
591,00:36:47.43,00:36:47.43,THIS GAME.>> WHY NOT?
592,00:36:48.50,00:36:48.50,">> IT JUST DOESN'T.IF I SAY, JEREMY, I GOT AN IDOL,"
593,00:36:51.80,00:36:51.80,"FIRST THING IN HIS HEAD, LET'SPUT HIS NAME DOWN."
594,00:36:54.00,00:36:54.00,>> NOT IF WE'RE IN AN ALLIANCE.>> NO.
595,00:36:56.47,00:36:56.47,>> BUT IT'S MORE THAN TWOPEOPLE.
596,00:36:58.07,00:36:58.07,>> WE COULD HAVE TWO PEOPLEALIGNED AND HAVE A SUBALLIANCE
597,00:37:02.20,00:37:02.20,WITH EVERYBODY ELSE.WE COULD HAVE DONE THAT.
598,00:37:03.57,00:37:03.57,>> SUBALLIANCE.OKAY.
599,00:37:04.83,00:37:04.83,">> WE COULD HAVE DONE THAT,KEITH."
600,00:37:06.30,00:37:06.30,>> THAT'S A NEW ONE ON ME.>> IT'S NOT A NEW ONE IN
601,00:37:10.80,00:37:10.80,"""SURVIVOR."">> Jeff: KEITH ONE OF THE"
602,00:37:12.83,00:37:12.83,"THINGS JEREMY SEEMS TO BESAYING, WHEN YOU'RE IN AN"
603,00:37:16.10,00:37:16.10,"ALLIANCE WITH SOMEBODY, YOUDON'T BETRAY THEM."
604,00:37:17.80,00:37:17.80,">> I DON'T RECALL THIS BETRAYAL.>> WELL, YOU STARTED PITTING"
605,00:37:21.73,00:37:21.73,"PEOPLE AGAINST JEREMY.EVERYBODY WENT, WHOA."
606,00:37:23.43,00:37:23.43,>> THAT WASN'T THE WAY IT WASMEANT TO BE.
607,00:37:25.43,00:37:25.43,">> IT WASN'T LIKE, I THINKJEREMY HAS AN IDOL, IT WAS LIKE,"
608,00:37:30.33,00:37:30.33,"""I'LL TELL YOU ONE THING, JEREMYGOT THAT IDOL."""
609,00:37:36.60,00:37:36.60,">> Jeff: SO DREW, WHAT DOESTHIS TRIBE NEED TO DO TONIGHT"
610,00:37:39.47,00:37:39.47,"WITH THE VOTE?>> WELL, EVERYBODY HAD THEIR OWN"
611,00:37:41.73,00:37:41.73,OPINION AT CAMP AND WHAT THERIGHT THING TO DO WAS.
612,00:37:44.47,00:37:44.47,I HEARD KEITH'S NAME.I HEARD JULIE'S NAME.
613,00:37:47.03,00:37:47.03,"YOU KNOW, SO IT'S JUST LIKE, IWANT TO STRENGTHEN THE TEAM."
614,00:37:49.87,00:37:49.87,I WANT TO GET ANY BAD ENERGY OUTAND ROLL FORWARD.
615,00:37:54.07,00:37:54.07,">> Jeff: KELLY, DO YOU AGREEWITH THAT, YOU NEED TO GET RID"
616,00:37:57.13,00:37:57.13,"OF BAD ENERGY?>> YEAH, BUT WHO IS THE BAD SEED"
617,00:37:59.87,00:37:59.87,IN THIS BUNCH.MAYBE WE DON'T ALL AGREE ON
618,00:38:01.77,00:38:01.77,"THAT.>> Jeff: NATALIE, WHAT DO YOU"
619,00:38:04.60,00:38:04.60,THINK THE TRIBE NEEDS TO DOTONIGHT?
620,00:38:06.33,00:38:06.33,>> I THINK THIS IS GOING TO BE AREALLY CRITICAL VOTE.
621,00:38:09.60,00:38:09.60,AT ONE POINT TODAY DREW WASACCUSING THE GIRLS WANTING TO
622,00:38:12.87,00:38:12.87,GET THE GUYS OUT.I WAS LIKE WHAT?
623,00:38:15.40,00:38:15.40,>> Jeff: HOW WOULD THE GIRLSTAKE OUT THE GUYS?
624,00:38:17.97,00:38:17.97,"THERE'S ONLY FOUR.>> THAT'S THE THING, JEFF, NONE"
625,00:38:19.87,00:38:19.87,OF THE GIRLS APPROACHED ME ANDASKED ME WHAT I THOUGHT WAS A
626,00:38:23.43,00:38:23.43,GOOD VOTE.>> BECAUSE YOU FREAKED OUT THE
627,00:38:26.00,00:38:26.00,"SECOND WE GOT BACK THE CAMP.YOU CAN'T WANT TO TALK TO ME,"
628,00:38:29.37,00:38:29.37,"AND THEN I HEARD MY NAME GOINGAROUND, SO OBVIOUSLY YOU MAYBE"
629,00:38:32.20,00:38:32.20,"HAVE SOMETHING AGAINST ME.>> JEFF, I THOUGHT WE WERE ALL"
630,00:38:35.07,00:38:35.07,"ON ONE PAGE, AND EVERYBODY SEEMSTO BE SCATTERBRAINED BECAUSE"
631,00:38:38.90,00:38:38.90,IT'S SCARY BECAUSE A FEW STRAYVOTES CAN CHANGE EVERYTHING.
632,00:38:41.43,00:38:41.43,">> Jeff: JON, WHAT DO YOUTHINK THE TRIBE NEEDS TO DO?"
633,00:38:44.30,00:38:44.30,">> THERE WERE SO MANY DIFFERENTSTRATEGIES THAT WERE GOING ON, I"
634,00:38:48.13,00:38:48.13,NEVER REALLY GOT A FULL GRASP OFANY OF THEM.
635,00:38:51.27,00:38:51.27,>> Jeff: THAT CANNOT BECOMFORTING.
636,00:38:53.33,00:38:53.33,">> IT'S NOT AT ALL, ABSOLUTELYNOT, BECAUSE I HONESTLY AM SO"
637,00:38:58.87,00:38:58.87,CONFUSED WHAT NAME I'M SUPPOSEDTO BE WRITING DOWN RIGHT NOW.
638,00:39:06.00,00:39:06.00,">> JEFF, WE'RE A HOT MESS.>> Jeff: AND IT'S ABOUT TO GET"
639,00:39:09.37,00:39:09.37,A WHOLE LOT MESSIER BECAUSE IT'STIME TO VOTE.
640,00:39:12.10,00:39:12.10,"DREW, YOU'RE UP.>> Jeff: I'LL GO TALLY THE"
641,00:39:56.23,00:39:56.23,VOTES.IF ANYBODY HAS A HIDDEN IMMUNITY
642,00:40:07.23,00:40:07.23,"IDOL AND YOU WANT THE PLAY IT,NOW WOULD BE THE TIME TO DO SO."
643,00:40:16.60,00:40:16.60,"OKAY.ONCE THE VOTES ARE READ, THE"
644,00:40:18.23,00:40:18.23,DECISION IS FINAL.PERSON VOTED OUT WILL BE ASKED
645,00:40:20.23,00:40:20.23,TO LEAVE THE TRIBAL COUNCIL AREAIMMEDIATELY.
646,00:40:22.67,00:40:22.67,I'LL READ THE VOTES.FIRST VOTE JULIE.
647,00:40:30.60,00:40:30.60,KELLEY.DREW.
648,00:40:36.37,00:40:36.37,KEITH.THAT'S ONE VOTE JULIE.
649,00:40:38.80,00:40:38.80,"ONE VOTE KELLY, ONE VOTE DREW.ONE VOTE KEITH."
650,00:40:44.23,00:40:44.23,JULIE.TWO VETS JULIE.
651,00:40:49.43,00:40:49.43,"DREW.TWO VOTES JULIE, TWO VOTES DREW,"
652,00:40:53.43,00:40:53.43,"ONE VOTE KELLEY, ONE VOTE KEITH.DREW."
653,00:40:59.50,00:40:59.50,"THAT'S THREE VOTES DREW, TWOVOTES JULIE, ONE VOTE KELLEY,"
654,00:41:03.37,00:41:03.37,ONE VOTE KEITH.FOURTH PERSON VOTED OUT OR
655,00:41:09.27,00:41:09.27,"""SURVIVOR"" BLOOD VERSUS WATER,DREW."
656,00:41:12.10,00:41:12.10,"THAT'S FOUR, THAT'S ENOUGH, YOUNEED TO BRING ME YOUR TORCH."
657,00:41:17.47,00:41:17.47,">> GOOD JOB, GUYS.GOOD PLAY."
658,00:41:24.63,00:41:24.63,"GOOD PLAY.>> Jeff: DREW, THE TRIBE HAS"
659,00:41:30.33,00:41:30.33,SPOKEN.>> BUT.
660,00:41:41.47,00:41:41.47,">> Jeff: WELL, FOR A FIRSTTRIBAL COUNCIL, THERE WAS A LOT"
661,00:41:44.30,00:41:44.30,OF INFORMATION REVEALED.FOUR PEOPLE GOT VOTES AND A
662,00:41:48.13,00:41:48.13,BLINDSIDE.THE ONLY QUESTION: WAS IT A
663,00:41:51.47,00:41:51.47,BRILLIANT TRIBAL OR ABSOLUTECHAOS?
664,00:41:53.20,00:41:53.20,TIME WILL TELL.GRAB YOUR STUFF.
665,00:41:55.23,00:41:55.23,HEAD BACK THE CAMP.GOOD NIGHT.
666,00:42:07.93,00:42:07.93,STAY TUNED FOR SCENES FROM OURNEXT EPISODE.
667,00:42:15.27,00:42:15.27,">> Jeff: NEXT TIME ON""SURVIVOR""..."
668,00:42:16.10,00:42:16.10,">> IF YOU OR THE GUYS SAID IT TOME, I WOULD HAVE BEEN ON BOARD"
669,00:42:18.37,00:42:18.37,WITH IT.>> IT'S JON VERSUS HUNAHPU.
670,00:42:20.37,00:42:20.37,">> YOU'RE EITHER WITH ME ORAGAINST ME, AND IF YOU'RE NOT,"
671,00:42:23.83,00:42:23.83,YOU DON'T KNOW WHAT'S GOING ON.>> Jeff: BUT NOT FOR LONG.
672,00:42:28.73,00:42:28.73,EVERYBODY DROP YOUR BUFFS.>> I KNEW IT.
673,00:42:30.80,00:42:30.80,>> SON OF A...>> I KNEW ALL ALONG THOSE GIRLS
674,00:42:39.83,00:42:39.83,WANTED ME OUT OF.THERE I'M OBVIOUSLY A PHYSICAL
675,00:42:42.40,00:42:42.40,AND SOCIAL THREAT TO THEM.CONGRATS TO THEM.
676,00:42:44.60,00:42:44.60,THEY DID A GREAT JOB BY GETTINGME OUT.
677,00:42:47.10,00:42:47.10,IN THE LONG RUN I WOULD HAVEBEAT THEM.
678,00:42:49.67,00:42:49.67,I WISH I HAD BEEN MORE CHILL ANDROLLED WITH THE GIRLS RATHER
679,00:42:53.30,00:42:53.30,THAN GONE AGAINST THEM RIGHTAWAY BECAUSE IT TURNED OUT TO
680,00:42:56.13,00:42:56.13,BITE ME IN MY BUTT.
