,begin,end,subtitles_text
687,00:41:23.03,00:41:23.03,"Once the votes are read, the decision is final."
688,00:41:25.60,00:41:25.60,The person will be asked to leave the Tribal Council area
689,00:41:27.93,00:41:27.93,immediately. I'll read the votes.
690,00:41:32.50,00:41:32.50,"First vote, Sarah. Kathy."
691,00:41:47.00,00:41:47.00,Sarah. Sarah.
692,00:41:53.53,00:41:53.53,"That's a majority vote, no need to read the last vote."
693,00:41:55.90,00:41:55.90,"Sarah, you need to bring me your torch."
694,00:42:08.60,00:42:08.60,"Sarah, the tribe has spoken. It's time for you to go."
695,00:42:17.97,00:42:17.97,>> Thanks. >> This game is unpredictable.
696,00:42:26.70,00:42:26.70,To stay in it you have to adapt. I give you guys credit for doing
697,00:42:29.83,00:42:29.83,"that. You may be a new tribe, but you"
698,00:42:32.23,00:42:32.23,are a tribe. You guys can take your torches
699,00:42:35.07,00:42:35.07,and head back to camp. I'll see you tomorrow.
700,00:42:50.43,00:42:50.43,Stay tuned for scenes from our next episode.
701,00:42:56.73,00:42:56.73,">> PROBST: Next time on  Survivor, Maraamu finds a new"
702,00:42:59.07,00:42:59.07,spirit. >> It's the first time I felt as
703,00:43:00.90,00:43:00.90,though I had been on a real team.
704,00:43:02.37,00:43:02.37,">> PROBST: At Rotu, suspicion and doubt cause the love tribe"
705,00:43:05.03,00:43:05.03,to fracture. >> Are we staying tight?
706,00:43:06.67,00:43:06.67,Is that the deal? Are we trying to put Rotu back
707,00:43:08.80,00:43:08.80,together? >> PROBST: And one tribe will
708,00:43:10.53,00:43:10.53,have a chance to devastate the competition.
709,00:43:12.43,00:43:12.43,The winning tribe gets to raid the losing tribe's camp.
710,00:43:14.90,00:43:14.90,>> Wow. >> I'm getting kind of emotional
711,00:43:22.53,00:43:22.53,"right now, which I didn't think I would do."
712,00:43:24.33,00:43:24.33,But I'm excited for the people that get to go back and finish
713,00:43:28.30,00:43:28.30,the game and do what they have been doing very well.
714,00:43:31.70,00:43:31.70,"And I hope that my original seven other teammates, Rob and"
715,00:43:35.47,00:43:35.47,"Sean and V and Gina, especially, do very, very, well, and I hope"
716,00:43:39.63,00:43:39.63,they're having a great time.  Captioning sponsored by CBS
717,00:43:42.50,00:43:42.50, PARAMOUNT TELEVISION NETWORKS
