,begin,end,subtitles_text
356,00:23:50.50,00:23:50.50,>> It's soft.So we're going to cut it.
357,00:23:53.03,00:23:53.03,>> Yum!>> I think Gina is part of our
358,00:23:56.10,00:23:56.10,"tribe like there's no more Rotu,and we're just one big tribe"
359,00:23:59.37,00:23:59.37,together and that's how I'm justgoing to finish playing the
360,00:24:02.17,00:24:02.17,"game.>> Oh, man."
361,00:24:04.37,00:24:04.37,>> I can smell it from here.>> Good gracious.
362,00:24:07.20,00:24:07.20,>> I love Gina to death and Ifeel closer to her now than I do
363,00:24:10.10,00:24:10.10,some of my other tribe members.Good little picker!
364,00:24:23.37,00:24:23.37,">> As soon as they got Gabekicked out, I knew there was an"
365,00:24:26.53,00:24:26.53,alliance with those four Rotupeople.
366,00:24:28.53,00:24:28.53,"I just wanted to see them lie tome to my face, when I asked them"
367,00:24:31.90,00:24:31.90,if there was or not.Can I ask you a question?
368,00:24:37.00,00:24:37.00,"You, the General, Tammy andJohn, you guys don't have an"
369,00:24:41.07,00:24:41.07,"alliance, the four of you?>> We have a friendship, not an"
370,00:24:45.17,00:24:45.17,alliance.>> That's interesting.
371,00:24:47.10,00:24:47.10,I knew she was lying the secondshe told it to me.
372,00:24:50.00,00:24:50.00,I could just tell.Don't sit there and tell me that
373,00:24:55.03,00:24:55.03,I'm 100% honest and everythingis 100% legit and then turn
374,00:24:58.50,00:24:58.50,around and lie to me and stab mein the back.
375,00:25:01.50,00:25:01.50,"Because, game or no game, Iwon't forget it."
376,00:25:04.37,00:25:04.37,You know what I'm saying?>> I understand what you're
377,00:25:08.13,00:25:08.13,saying.>> I don't trust Zoe.
378,00:25:09.87,00:25:09.87,"At this point, I don't trustanybody in the game except"
379,00:25:12.90,00:25:12.90,"myself.>> I mean, if we win tomorrow,"
380,00:25:15.00,00:25:15.00,"the game is still alive for us.What's up, man?"
381,00:25:17.63,00:25:17.63,>> Pretty much I had had it withthe quiet treatment from John
382,00:25:22.53,00:25:22.53,and the rest of the four-membercast of Rotu over here and I
383,00:25:25.93,00:25:25.93,wanted to get things out in theopen.
384,00:25:28.03,00:25:28.03,You're telling me straight upthat you four don't have an
385,00:25:30.50,00:25:30.50,alliance?You four over here?
386,00:25:32.70,00:25:32.70,">> No, how could you say that wedon't?"
387,00:25:34.47,00:25:34.47,"I mean, you'd have to be blindnot to see that."
388,00:25:36.63,00:25:36.63,>> Zoe just told me straight upin my face not even five minutes
389,00:25:40.57,00:25:40.57,"ago, John.>> Maybe she's not thinking that"
390,00:25:43.13,00:25:43.13,way.>> John.
391,00:25:43.93,00:25:43.93,">> Hey, have I ... you yet?>> Do I have ""stupid"" written on"
392,00:25:46.70,00:25:46.70,"my forehead?>> I'm saying, in my mind, yes."
393,00:25:49.97,00:25:49.97,>> There's definitely analliance.
394,00:25:51.67,00:25:51.67,">> Absolutely.>> All right, that's what I'm"
395,00:25:53.53,00:25:53.53,"saying, you're being honestright now."
396,00:25:54.97,00:25:54.97,I appreciate your honesty.>> But if we're going to talk
397,00:25:57.73,00:25:57.73,"about that, then we also have tolook at, you know, when we were"
398,00:26:01.63,00:26:01.63,going to vote out Gabe.Your behavior to me completely
399,00:26:04.40,00:26:04.40,changed and you were trying tofigure out maybe another
400,00:26:06.87,00:26:06.87,"scenario to take out me.>> Not you in particular, but"
401,00:26:09.70,00:26:09.70,somebody on that.>> Look me in the eye and tell
402,00:26:12.10,00:26:12.10,me it wasn't me.>> It wasn't you.
403,00:26:13.60,00:26:13.60,">> Uh, huh, yeah, right.Do I have ""stupid"" written on my"
404,00:26:16.53,00:26:16.53,forehead?But you guys are our team.
405,00:26:19.17,00:26:19.17,You're here.We have strength in numbers.
406,00:26:22.47,00:26:22.47,"If there's a traditional mergeand we all merge at the end,"
407,00:26:26.43,00:26:26.43,"three of them and seven of us,those three go first."
408,00:26:30.03,00:26:30.03,That is my absolute word.Only thing is that freaks me
409,00:26:33.77,00:26:33.77,"out, I don't trust you.I don't trust you."
410,00:26:36.67,00:26:36.67,>> I promise you I won't try tolike swing to the other side or
411,00:26:40.10,00:26:40.10,anything like that.I promise you I'll tell you
412,00:26:42.57,00:26:42.57,"straight up.>> I'm giving you my word 100%,"
413,00:26:44.73,00:26:44.73,we will not get over there andtry get those old Rotu people to
414,00:26:48.00,00:26:48.00,"vote you out.It will not happen, okay?"
415,00:26:50.73,00:26:50.73,And don't try to ... me.Okay.
416,00:26:53.00,00:26:53.00,I'm taking your word.>> I will.
417,00:26:55.07,00:26:55.07,>> Okay.>> Same thing buddy.
418,00:26:56.70,00:26:56.70,">> I think to a degree, I mayhave convinced him that I'm part"
419,00:26:59.50,00:26:59.50,"of the team now.I want him to trust me, but he"
420,00:27:03.03,00:27:03.03,"shouldn't.Are you gay, dude?"
421,00:27:06.00,00:27:06.00,">> Eh, don't ask me that.>> You don't want to say that?"
422,00:27:08.57,00:27:08.57,">> Yeah, I am.It was very passive aggressive,"
423,00:27:11.30,00:27:11.30,"like a throw away comment, ""Hey,are you gay?"""
424,00:27:13.40,00:27:13.40,"But, you know, hey, I'm 36 yearsold."
425,00:27:15.30,00:27:15.30,"I've been out for a long time,so I said, ""Yeah, you know, I"
426,00:27:18.37,00:27:18.37,"am.""I said, thanks for outing me,"
427,00:27:20.83,00:27:20.83,you know.But this 36-year-old gay boy
428,00:27:23.47,00:27:23.47,from Omaha is running the showand just whipping his pants.
429,00:27:41.53,00:27:41.53,>> This immunity challenge iscritical to me.
430,00:27:44.50,00:27:44.50,"If we don't win this challenge,then I'm probably gone tomorrow."
431,00:27:48.27,00:27:48.27,"Sean, V. and Tammy definitelyhave to play in today's immunity"
432,00:27:52.00,00:27:52.00,"challenge, because I sat outyesterday."
433,00:27:54.43,00:27:54.43,"I'm going to be the fourthmember, I'm not going to back"
434,00:27:57.30,00:27:57.30,"down, I want to participate.If we lose and this is my last"
435,00:28:00.43,00:28:00.43,"one, at least I want to knowthat I gave my best."
436,00:28:02.97,00:28:02.97,Don't count me out.>> Tammy and the General and I
437,00:28:13.93,00:28:13.93,have had a couple conversationsabout if we were to lose the
438,00:28:17.07,00:28:17.07,"next immunity challenge, whowould be the next person to go."
439,00:28:20.17,00:28:20.17,"I'm just saying, I mean, I'mtrying to stay two steps ahead."
440,00:28:23.73,00:28:23.73,Rob is desperate to dosomething.
441,00:28:25.97,00:28:25.97,I think we sit in a much betterplace if we don't have Rob at
442,00:28:30.07,00:28:30.07,"the merge, period.He is a little bit dangerous and"
443,00:28:32.87,00:28:32.87,we have one opportunity to getrid of him.
444,00:28:34.83,00:28:34.83,My gut is screaming to me thatit would be better if we
445,00:28:37.83,00:28:37.83,"actually lost this challenge andlost that voice, and that person"
446,00:28:42.70,00:28:42.70,that Rob represents that's sodangerous.
447,00:28:45.70,00:28:45.70,">> But the thing is, I'm notthrowing immunity."
448,00:28:47.73,00:28:47.73,I can't go in there and not try.>> Just don't do anything extra
449,00:28:50.27,00:28:50.27,"to, like, help them if they're,like, falling behind."
450,00:28:52.13,00:28:52.13,I'm serious.We're talking a million dollars
451,00:28:53.67,00:28:53.67,is at stake here.What I was trying to say to
452,00:28:55.80,00:28:55.80,Tammy is there are certainbattles that you definitely need
453,00:28:59.03,00:28:59.03,to win and there are certainbattles that you don't.
454,00:29:01.97,00:29:01.97,>> I hate the fact that I'm inthis challenge and you don't
455,00:29:04.47,00:29:04.47,want to win this.>> I don't know what to tell
456,00:29:06.47,00:29:06.47,"you, it's better if he's justgone."
457,00:29:08.07,00:29:08.07,">> To be completely honest, Imean, I don't know what I'm"
458,00:29:10.37,00:29:10.37,going to do when it's time tostep up to the plate for today's
459,00:29:13.93,00:29:13.93,challenge.I just don't know.
460,00:29:22.83,00:29:22.83,">> PROBST: Come on in, guys.Welcome."
461,00:29:25.90,00:29:25.90,First things first.Immunity is back up for grabs.
462,00:29:30.57,00:29:30.57,Today's immunity challenge is agiant maze.
463,00:29:34.47,00:29:34.47,"Hidden within the maze, fiverungs that each tribe will use"
464,00:29:38.07,00:29:38.07,to build a ladder.Each tribe will start next to
465,00:29:40.60,00:29:40.60,each other.You'll head in opposite
466,00:29:42.23,00:29:42.23,directions to find the firstrung.
467,00:29:43.87,00:29:43.87,First tribe to collect all fiverungs in order from one through
468,00:29:47.53,00:29:47.53,"five, build the ladder from topto bottom, get to the top of the"
469,00:29:51.77,00:29:51.77,"ladder, one person with yourflag, wins immunity."
470,00:29:56.07,00:29:56.07,"To make it interesting, you'llbe tied together during the"
471,00:29:58.87,00:29:58.87,"process.At stake, the vote."
472,00:30:01.13,00:30:01.13,"Win tonight, guaranteed one inten shot of being the sole"
473,00:30:04.37,00:30:04.37,"survivor.Lose, your tribe goes to Tribal"
474,00:30:06.87,00:30:06.87,"Council, another person votedout of the tribe."
475,00:30:09.87,00:30:09.87,"Rotu, because you have threeextra, you'll sit three out."
476,00:30:12.47,00:30:12.47,Pick your four.We'll get you tied up.
477,00:30:15.10,00:30:15.10,Kathy is leading MaraamuRob is leading Rotu.
478,00:30:18.13,00:30:18.13,"John, General, Zoe, you'resitting out."
479,00:30:25.53,00:30:25.53,Survivors ready!Go!
480,00:30:38.87,00:30:38.87,">> Left, left, left, left.>> More?"
481,00:30:42.70,00:30:42.70,">> Remember that.Ready, left."
482,00:30:45.13,00:30:45.13,We're going left.Go left.
483,00:30:47.00,00:30:47.00,">> Let's pick it up.>> Left, left, left."
484,00:30:49.10,00:30:49.10,">> Okay, turn around.>> Okay."
485,00:30:51.00,00:30:51.00,">> Remember that.>> Come on, we've got to move"
486,00:30:54.03,00:30:54.03,"faster.>> Right, go right."
487,00:30:55.37,00:30:55.37,">> There's something over here.>> Okay, what's this?"
488,00:30:57.70,00:30:57.70,">> Yellow.>> Yellow, but what number?"
489,00:30:59.23,00:30:59.23,>> Two.>> Two.
490,00:31:00.57,00:31:00.57,Two dots.>> Keep going.
491,00:31:04.43,00:31:04.43,">> Yes!Hurry, hurry."
492,00:31:05.77,00:31:05.77,"Hurry up, guys.Hurry up."
493,00:31:10.07,00:31:10.07,">> Come on, we got to movefaster."
494,00:31:12.77,00:31:12.77,Okay. Number 4.There's a ton of blue over here.
495,00:31:17.77,00:31:17.77,"Inside, inside.>> PROBST: Rotu takes an early"
496,00:31:23.70,00:31:23.70,lead.>> I want to get to the other
497,00:31:25.77,00:31:25.77,"side, you guys.>> Okay, we're right behind you."
498,00:31:28.00,00:31:28.00,">> I know, I just want to tellwhat you I'm doing."
499,00:31:30.07,00:31:30.07,">> Right there, go left.Go left, Rob."
500,00:31:33.93,00:31:33.93,>> Okay.>> Yes!
501,00:31:35.00,00:31:35.00,">> Hurry up, quick.>> Okay, we need three."
502,00:31:43.80,00:31:43.80,">> Way to go, Rob, way to go!>> PROBST: Big circular maze,"
503,00:31:46.97,00:31:46.97,"guys.>> Way to go, Rotu."
504,00:31:55.07,00:31:55.07,"You're doing great.>> Yes, yes, yes, yes."
505,00:31:56.80,00:31:56.80,">> Hurry up, hurry up.Hurry up, guys."
506,00:32:00.57,00:32:00.57,">> Okay, we got one.Let me go."
507,00:32:04.53,00:32:04.53,"Three is going to be over here.Here we go, back here."
508,00:32:14.73,00:32:14.73,"Wait a minute, I got to get mybearings."
509,00:32:17.13,00:32:17.13,"To get back in the center, Ithink we have to go around"
510,00:32:19.83,00:32:19.83,this way.>> PROBST: Rotu has three.
511,00:32:28.83,00:32:28.83,>> Here we go.Come on.
512,00:32:34.73,00:32:34.73,">> Back this way.>> PROBST: Maraamu, finally on"
513,00:32:38.47,00:32:38.47,"the board.>> Okay, guys, help me get back."
514,00:32:42.60,00:32:42.60,"Okay, help me get back.>> Hurry up!"
515,00:32:49.17,00:32:49.17,>> Okay.>> Go. Go.
516,00:32:50.50,00:32:50.50,">> Three is this way.>> PROBST: Rotu has three,"
517,00:32:53.63,00:32:53.63,"Maraamu, two.>> Come on, come on, come on."
518,00:32:56.23,00:32:56.23,"Left, right, left, right.>> Kathy, the other way."
519,00:32:58.90,00:32:58.90,">> What?>> Go back the other way, honey."
520,00:33:00.87,00:33:00.87,">> That was four, that wasn'tthree."
521,00:33:03.43,00:33:03.43,Why can't we get around thisthing?
522,00:33:06.13,00:33:06.13,Come on.We've got to get to the outer
523,00:33:09.47,00:33:09.47,"rim.We can't, that dead ends?"
524,00:33:11.07,00:33:11.07,">> Go this way, go to the right.>> This way, Kathy, this way."
525,00:33:14.47,00:33:14.47,>> That's not it.>> We've been that way a hundred
526,00:33:16.00,00:33:16.00,"times.>> No, we've got to get over"
527,00:33:23.17,00:33:23.17,"there.See, over there?"
528,00:33:24.13,00:33:24.13,">> Let's move, let's move.Okay."
529,00:33:26.63,00:33:26.63,"Left, right, left, right.>> PROBST: Rotu has four,"
530,00:33:34.97,00:33:34.97,"Maraamu two.>> Come on, this is it, last"
531,00:33:36.67,00:33:36.67,"one.>> Let's go, let's go."
532,00:33:44.53,00:33:44.53,">> You guys, we got to movefaster."
533,00:33:46.53,00:33:46.53,"Nothing.>> Double-time, baby."
534,00:33:49.97,00:33:49.97,>> Double-time.>> Come on.
535,00:33:52.20,00:33:52.20,>> Go.(shouting)
536,00:34:03.03,00:34:03.03,">> PROBST: Rotu wins!>> You guys, slow down."
537,00:34:15.67,00:34:15.67,>> This is it.>> This is what it's all about.
538,00:34:21.73,00:34:21.73,">> PROBST: Maraamu, I'm sorry tosay, Tribal Council tomorrow"
539,00:34:24.40,00:34:24.40,"night with me, one of the fourof you is going home."
540,00:34:57.50,00:34:57.50,>> How was your day?>> Good.
541,00:34:59.47,00:34:59.47,I got troca and cowrie.>> Are you serious?
542,00:35:02.70,00:35:02.70,Lots?>> Four troca and I think
543,00:35:05.23,00:35:05.23,five...>> Good job.
544,00:35:06.83,00:35:06.83,">> When we got back there wasn'tfire, so I was feeling pretty"
545,00:35:11.37,00:35:11.37,"bad.You know, I did not do a good"
546,00:35:13.07,00:35:13.07,"leadership role in the maze, andwe got back and I drowned out"
547,00:35:16.30,00:35:16.30,the fire.>> You got to take the sand out.
548,00:35:23.07,00:35:23.07,>> I lit it this morning withouttaking the sand out.
549,00:35:25.97,00:35:25.97,>> Gina and I sort of go backand forth about putting sand on
550,00:35:28.90,00:35:28.90,the fire.I always put sand on the fire
551,00:35:30.63,00:35:30.63,at Rotu and it worked like acharm.
552,00:35:32.17,00:35:32.17,Maybe the sand was differentover there.
553,00:35:33.70,00:35:33.70,">> We're low on firewood, so wejust... I beefed it up, got a"
554,00:35:38.43,00:35:38.43,coal bed and covered it.>> The sand just puts it out if
555,00:35:42.53,00:35:42.53,it touches it.>> What about piling as many
556,00:35:45.13,00:35:45.13,hot coals together?>> These aren't hot.
557,00:35:47.87,00:35:47.87,>> Some of them are hot to touchwhen I was digging them out.
558,00:35:49.90,00:35:49.90,>> They're not anymore.>> She said at Rotu they put
559,00:35:53.17,00:35:53.17,"sand on their fire to keep thecoals hot, and I know whenever I"
560,00:35:56.50,00:35:56.50,go camping we put sand on thefire to put it out.
561,00:35:59.57,00:35:59.57,">> As much as we were burning,we just didn't burn enough of a"
562,00:36:02.57,00:36:02.57,"bed today.>> You don't have to, I mean..."
563,00:36:07.03,00:36:07.03,I don't think that's going tolight.
564,00:36:09.47,00:36:09.47,>> We just don't have fire.>> I was hoping that we would go
565,00:36:14.63,00:36:14.63,to Tribal Council and votetonight after having a
566,00:36:17.43,00:36:17.43,conversation.But I went to talk to Gina about
567,00:36:20.20,00:36:20.20,it and she felt that weshouldn't talk about it.
568,00:36:23.20,00:36:23.20,So I'm not going to bring it up.>> These guys do not like to
569,00:36:27.97,00:36:27.97,"break through this.>> No, they don't."
570,00:36:30.77,00:36:30.77,>> I don't think they haveenough guts right now to talk
571,00:36:34.00,00:36:34.00,"about it.I totally disagree with that, I"
572,00:36:36.03,00:36:36.03,"think we should just own up toit, man, just put it on the"
573,00:36:38.80,00:36:38.80,table and figure it out andenjoy the rest of the day.
574,00:36:41.40,00:36:41.40,>> We are out of fire.>> Out of fire?
575,00:36:45.63,00:36:45.63,>> No fire.>> At all? For sure?
576,00:36:49.07,00:36:49.07,"We know that one of us is goingto have to go, and it's a hard"
577,00:36:53.87,00:36:53.87,decision.I don't think they're going to
578,00:36:56.10,00:36:56.10,vote for me just because Iwasn't with them originally.
579,00:36:58.83,00:36:58.83,"And I might be wrong, but Idon't feel that way."
580,00:37:03.17,00:37:03.17,I just don't like that sand ideashe uses.
581,00:37:05.77,00:37:05.77,"That's how you put out fires.>> That's what I thought, too."
582,00:37:09.37,00:37:09.37,">> If I work at strategizing formyself, I'd have to vote on"
583,00:37:13.50,00:37:13.50,"Kathy, because I automaticallyknow that Neleh nor Paschal are"
584,00:37:17.77,00:37:17.77,going to vote on each other.Have you eaten those raw before?
585,00:37:22.73,00:37:22.73,>> Hmm-mm.>> You need lemon.
586,00:37:26.17,00:37:26.17,>> They're hard as a rock.>> I'm not going to start
587,00:37:28.57,00:37:28.57,"tonight either.>> Honestly, I haven't decide"
588,00:37:31.10,00:37:31.10,what I'm going to do.I've been back and forth all
589,00:37:34.23,00:37:34.23,day.I definitely know I'm not going
590,00:37:36.17,00:37:36.17,"to vote Paschal, but betweenKathy and Gina, I'm having a"
591,00:37:39.20,00:37:39.20,"really tough time.>> Look, on the other side, we"
592,00:37:40.97,00:37:40.97,went to bed many a night withoutanything.
593,00:37:46.50,00:37:46.50,>> We're going to go to TribalCouncil tonight and each member
594,00:37:49.43,00:37:49.43,is going to get up and vote andit will be a secret until that
595,00:37:52.43,00:37:52.43,"very moment.>> PROBST: Okay, let's get right"
596,00:38:21.50,00:38:21.50,to it.A lot has happened.
597,00:38:22.87,00:38:22.87,"This small little tribe of four,the true underdogs, has come on"
598,00:38:27.10,00:38:27.10,"very strong.Paschal, what kind of tribe is"
599,00:38:29.70,00:38:29.70,this?How different are things now
600,00:38:31.50,00:38:31.50,from the last time you guys werehere?
601,00:38:33.53,00:38:33.53,>> If you would have told mewhen I left Rotu that we were
602,00:38:36.70,00:38:36.70,"going to duplicate what we hadat Rotu, I'd say there's no way."
603,00:38:40.20,00:38:40.20,"Not only have we duplicated it,we have surpassed it."
604,00:38:43.17,00:38:43.17,>> PROBST: Really.So let's talk about loyalties
605,00:38:45.97,00:38:45.97,"then.Kathy, where are your loyalties"
606,00:38:48.57,00:38:48.57,now?>> I think there's a spirit of
607,00:38:50.50,00:38:50.50,Rotu still lurking about over onthe other beach.
608,00:38:53.17,00:38:53.17,"But it's diminished, and we'vereally formed something here"
609,00:38:56.47,00:38:56.47,that's united.I think both tribes have
610,00:38:58.77,00:38:58.77,dissipated and we're creatingsomething new.
611,00:39:01.53,00:39:01.53,">> PROBST: If you mergedtonight, would the four of you"
612,00:39:04.03,00:39:04.03,"go in together or would it behey, Gina, really been fun,"
613,00:39:06.87,00:39:06.87,we're going to see if we caninfiltrate back into the
614,00:39:09.77,00:39:09.77,"strength of the numbers of Rotu?>> No, we would go as the four"
615,00:39:13.77,00:39:13.77,"of us, strong.>> Absolutely, four of us."
616,00:39:16.87,00:39:16.87,>> PROBST: Neleh.>> Absolutely.
617,00:39:19.17,00:39:19.17,">> PROBST: How about you, Gina?Are you still a black sheep or"
618,00:39:22.03,00:39:22.03,are you truly now a tribe offour?
619,00:39:23.60,00:39:23.60,>> We're definitely a tribe.I would definitely call it even
620,00:39:26.53,00:39:26.53,like a family.We don't want to vote anybody
621,00:39:28.73,00:39:28.73,"off tonight.>> PROBST: Kathy, let's talk"
622,00:39:30.50,00:39:30.50,about the immunity challengeyesterday.
623,00:39:32.07,00:39:32.07,You were dragging these guyslike they were school kids who
624,00:39:34.40,00:39:34.40,"didn't want to get up.At any point, did you think,"
625,00:39:36.87,00:39:36.87,"yikes, I hope we're still atribe here and I hope they're"
626,00:39:40.03,00:39:40.03,not going to make me ascapegoat?
627,00:39:41.87,00:39:41.87,>> My head hung low because Ifelt that I failed the tribe on
628,00:39:44.83,00:39:44.83,the challenge.But the other thing is that
629,00:39:46.93,00:39:46.93,"there's such a family feelingbetween the four of us, that I"
630,00:39:50.00,00:39:50.00,felt okay once we got outsidethe maze and we got back to
631,00:39:55.40,00:39:55.40,camp.>> PROBST: So if you guys are
632,00:39:57.03,00:39:57.03,"such a tight family, how are yougoing to vote tonight?"
633,00:39:59.23,00:39:59.23,How do you make that decision?Neleh?
634,00:40:01.80,00:40:01.80,">> Every ten minutes, I probablyam thinking someone different."
635,00:40:04.47,00:40:04.47,"That's how many times it's gonethrough my head today, because I"
636,00:40:07.93,00:40:07.93,do not want anybody to go.>> PROBST: Have you made your
637,00:40:10.73,00:40:10.73,decision now?>> Honestly I haven't.
638,00:40:13.53,00:40:13.53,>> PROBST: Okay.It's time to vote.
639,00:40:15.23,00:40:15.23,"Paschal, you're first.>> PROBST: I'll go tally the"
640,00:41:06.77,00:41:06.77,"votes.Once the votes are read, the"
641,00:41:23.63,00:41:23.63,"decision is final, the personwill be asked to leave the"
642,00:41:26.03,00:41:26.03,Tribal Council area immediately.I'll read the votes.
643,00:41:34.70,00:41:34.70,Gina.Kathy.
644,00:41:44.40,00:41:44.40,"Gina.Two votes Gina, one vote Kathy."
645,00:41:52.07,00:41:52.07,Deciding vote...Gina.
646,00:41:56.17,00:41:56.17,You need to bring me your torch.>> Love you.
647,00:41:59.43,00:41:59.43,">> I love you.>> PROBST: Gina, the tribe has"
648,00:42:06.50,00:42:06.50,spoken.It's time for you to go.
649,00:42:22.53,00:42:22.53,"Well, you guys kept insisting onusing the word ""family"" tonight"
650,00:42:26.30,00:42:26.30,"instead of tribe.Sometimes, families have to make"
651,00:42:29.33,00:42:29.33,hard decisions.I'm sure this has been one of
652,00:42:31.63,00:42:31.63,the hardest.You guys can head back to camp.
653,00:42:33.13,00:42:33.13,I'll see you tomorrow.Stay tuned for scenes
654,00:42:47.63,00:42:47.63,from our next episode.>> PROBST: Next time on
655,00:42:53.17,00:42:53.17, Survivor...The two tribes merge into one.
656,00:42:55.10,00:42:55.10,">> It's so good to see you.>> Our Heavenly Father, we're so"
657,00:42:57.80,00:42:57.80,grateful for each other and forthe bonds that we have together.
658,00:42:59.83,00:42:59.83,>> Amen.>> PROBST: But can they all live
659,00:43:02.13,00:43:02.13,"happily under one roof?>> Tell the truth for once, will"
660,00:43:04.37,00:43:04.37,you?>> Zoe's lying to me.
661,00:43:05.50,00:43:05.50,They're all lying to me.>> Nobody in this game knows
662,00:43:07.97,00:43:07.97,who's telling the truth.>> Don't lie to my face.
663,00:43:09.80,00:43:09.80,">> Now it's on, man.>> Miss Kathy, Paschal and"
664,00:43:18.83,00:43:18.83,"Neleh, you're awesome.I love you guys."
665,00:43:21.10,00:43:21.10,I understand the vote tonight.The tribal members that are
666,00:43:23.93,00:43:23.93,"left, the tribe mates, I hopeyou play well, play good, play"
667,00:43:27.80,00:43:27.80,hard.I just have to say that I've had
668,00:43:30.00,00:43:30.00,"the time of my life, and it'sbeen a wonderful, wonderful"
669,00:43:33.10,00:43:33.10,"time.Nothing will ever, ever replace"
670,00:43:34.47,00:43:34.47,this experience.Thanks.
