,begin,end,subtitles_text
821,00:35:01.17,00:35:01.17,You're going back to campwith immunity.
822,00:35:02.80,00:35:02.80,"Chuay Gahn, nice effort."
823,00:35:04.57,00:35:04.57,"Unfortunately,Tribal Council tonight,"
824,00:35:07.20,00:35:07.20,somebody will bethe first person voted out.
825,00:35:09.10,00:35:09.10,-I'm so sorry.-Don't worry about it.
826,00:35:17.30,00:35:17.30,(cheering)
827,00:35:31.20,00:35:31.20,-(sobbing)-Cheer up. Cheer up.
828,00:35:36.23,00:35:36.23,We have no reasonto hang our heads.
829,00:35:38.63,00:35:38.63,-Absolutely not.-No.
830,00:35:40.37,00:35:40.37,"Hey, hey, hey, hey."
831,00:35:41.93,00:35:41.93,"-Come on, you're all right.-Hey."
832,00:35:43.30,00:35:43.30,"-Everybody's gonna have a toughday... -Hey, come on."
833,00:35:44.87,00:35:44.87,-Don't worry about it.-It's not your fault.
834,00:35:46.13,00:35:46.13,"-Look, you did your best, right?-No way."
835,00:35:47.63,00:35:47.63,-Did you do your best?-Yes.
836,00:35:49.63,00:35:49.63,"All right, then, that's allyou can do, all right?"
837,00:35:51.43,00:35:51.43,GHANDIA: I'm a legal secretary. I work with facts.
838,00:35:53.80,00:35:53.80, The fact is that we had
839,00:35:55.90,00:35:55.90,"a great lead,and the lead was lessened"
840,00:35:58.30,00:35:58.30,because I took too longto figure out the puzzle.
841,00:36:01.13,00:36:01.13,-We were kicking their ass.-We were. We were.
842,00:36:02.77,00:36:02.77,Those lucky bastards!
843,00:36:04.27,00:36:04.27,GHANDIA:  So now I'm feeling like...
844,00:36:05.80,00:36:05.80,that it's timefor a sister to go.
845,00:36:07.83,00:36:07.83,You can vote how you want.
846,00:36:09.37,00:36:09.37,I don't want to influence youone way or the other.
847,00:36:11.13,00:36:11.13,You votehowever you want to vote.
848,00:36:12.83,00:36:12.83, JOHN: Who's to say who's... who's the most vulnerable?
849,00:36:15.03,00:36:15.03," Uh, but I know that, uh... you know,"
850,00:36:16.93,00:36:16.93," I think everybody's pretty much thinking,"
851,00:36:18.37,00:36:18.37," you know, we need a strong team."
852,00:36:19.90,00:36:19.90," You know, Ghandia-- physical challenges"
853,00:36:21.07,00:36:21.07, isn't going to be her thing.
854,00:36:22.57,00:36:22.57," Obviously, mental challenges aren't going to be her thing."
855,00:36:24.60,00:36:24.60,"Sorry, you know, Ghandia,but somebody's got to go."
856,00:36:26.80,00:36:26.80,Might as well be you.
857,00:36:28.13,00:36:28.13,"BRIAN: Hey, take another shot ofwater after that."
858,00:36:32.67,00:36:32.67,I'm about to throw up. Oh...
859,00:36:34.60,00:36:34.60,BRIAN:It's all right.
860,00:36:36.03,00:36:36.03,-(retches)-(splattering)
861,00:36:37.33,00:36:37.33,"HELEN: Tanya, unfortunately, has..."
862,00:36:39.07,00:36:39.07," has a shot of being voted off, and I only think that"
863,00:36:42.30,00:36:42.30, because she's had a tough time out here.
864,00:36:45.17,00:36:45.17,"If everybody voted her offtonight, it would be..."
865,00:36:48.33,00:36:48.33, because they feel sorry for her.
866,00:36:49.40,00:36:49.40,"Even though you're saying,"
867,00:36:50.57,00:36:50.57,"""Don't worry,""I mean, it is a game."
868,00:36:52.30,00:36:52.30,"It's... it's a game to me,"
869,00:36:53.83,00:36:53.83,"and I know I haven't felt well,and it's..."
870,00:36:57.13,00:36:57.13,"TANYA: I feel a little vulnerable, you know?"
871,00:36:58.97,00:36:58.97," I have been sick, but I can't control what my body does."
872,00:37:01.70,00:37:01.70, I'm still going to try.
873,00:37:03.47,00:37:03.47,My vote will probably befor John.
874,00:37:05.33,00:37:05.33," From the first day, a lot of the people"
875,00:37:07.60,00:37:07.60," were upset with John because he was saying,"
876,00:37:10.13,00:37:10.13," ""You're not rowing hard enough,"""
877,00:37:11.57,00:37:11.57," or, ""You need to do this."""
878,00:37:12.90,00:37:12.90, A lot of people started getting annoyed
879,00:37:14.57,00:37:14.57,because he was takinga leadership role.
880,00:37:19.27,00:37:19.27,"HELEN: Tonight, we're going to Tribal Council."
881,00:37:20.73,00:37:20.73, I got to vote somebody out.
882,00:37:22.37,00:37:22.37, I-I... I'm sick about it.I don't want to think about it.
883,00:37:24.90,00:37:24.90,That's like voting somebodyout of your family.
884,00:37:42.17,00:37:42.17,"PROBST: As you walk in, graba torch, approach the flame."
885,00:37:49.30,00:37:49.30,Everybody dip your torchesand get fire.
886,00:37:53.63,00:37:53.63,You do this because fire
887,00:37:55.47,00:37:55.47,represents your lifein this game.
888,00:37:57.90,00:37:57.90,"As long as you have fire,you're in the game."
889,00:38:00.10,00:38:00.10,"When your fire is gone,so are you."
890,00:38:02.10,00:38:02.10,You can put your torchesback in their slots.
891,00:38:04.43,00:38:04.43,Take a seat.
892,00:38:12.13,00:38:12.13,"Well, I'm sorry to say,"
893,00:38:13.93,00:38:13.93,welcome to your firstTribal Council.
894,00:38:16.00,00:38:16.00,Man.
895,00:38:18.23,00:38:18.23,"At Tribal Council,it's very simple."
896,00:38:19.77,00:38:19.77,You are held accountablefor your actions on the island.
897,00:38:22.27,00:38:22.27,"Sometimes, those actionswill help you;"
898,00:38:24.83,00:38:24.83,"sometimes,those actions will hurt you."
899,00:38:26.50,00:38:26.50,"Before we get to the vote, let'stalk about today's challenge."
900,00:38:29.87,00:38:29.87,Great effort.
901,00:38:31.10,00:38:31.10,You guys could have won it.
902,00:38:32.83,00:38:32.83,You were in frontfor a long time.
903,00:38:34.73,00:38:34.73,"You get to this final station,Ghandia."
904,00:38:36.93,00:38:36.93,-What happened?-Um...
905,00:38:38.67,00:38:38.67,"I was working it out,and I started"
906,00:38:40.80,00:38:40.80,to get anxiouswhen the other team's member
907,00:38:42.87,00:38:42.87,got up thereand started doing it.
908,00:38:44.50,00:38:44.50,"You know, and there was a partwhere I just got stuck, and I..."
909,00:38:47.37,00:38:47.37,"I just cried outthat I was stuck, and, uh..."
910,00:38:51.23,00:38:51.23,"a few minutes after that,I had finished it,"
911,00:38:54.27,00:38:54.27,"but then, of course,that was too late."
912,00:38:56.23,00:38:56.23,PROBST:Do you feel responsible
913,00:38:57.70,00:38:57.70,for your tribe being heretonight?
914,00:38:59.53,00:38:59.53,Yes.
915,00:39:00.87,00:39:00.87,Because it would havenever happened
916,00:39:02.47,00:39:02.47,if I would have finishedmy task on time.
917,00:39:04.60,00:39:04.60,"You know,it's hard enough, Clay,"
918,00:39:07.70,00:39:07.70,"to get along with peoplethat you know,"
919,00:39:10.40,00:39:10.40,let alone seven other strangersin a high-stress situation.
920,00:39:14.83,00:39:14.83,How has that been?
921,00:39:16.67,00:39:16.67,"Difficult at time...I mean, it's difficult"
922,00:39:18.80,00:39:18.80,anytime you walk inand you don't know anybody.
923,00:39:21.53,00:39:21.53,"First, you gotto kind of figure out"
924,00:39:23.70,00:39:23.70,who these people areand what makes them tick.
925,00:39:25.53,00:39:25.53,"And, uh, where the problem is,is when somebody steps in and..."
926,00:39:28.23,00:39:28.23,and disagreeswith what goes on.
927,00:39:30.73,00:39:30.73,"Then, there's where your problemwill... will come in."
928,00:39:33.23,00:39:33.23,Have you had that situation yet?
929,00:39:34.87,00:39:34.87,Uh... a li... somewhat.
930,00:39:36.67,00:39:36.67,How do you resolve that?
931,00:39:37.87,00:39:37.87,-That's why we're here.-(chuckling)
932,00:39:39.57,00:39:39.57,"We don't want to be here,but it's..."
933,00:39:41.93,00:39:41.93,-It's necessary.-...it's necessary.
934,00:39:43.10,00:39:43.10,That... that's the way the gameis played.
935,00:39:44.70,00:39:44.70,"John, what's beenthe toughest part for you?"
936,00:39:47.57,00:39:47.57,"It really hasn't beentough yet, you know?"
937,00:39:49.20,00:39:49.20,"I'm... I'm really pleasedwith the teamwork,"
938,00:39:51.40,00:39:51.40,"the... the positive attitude,just the spirit."
939,00:39:53.33,00:39:53.33,We have a lotof faith on the team.
940,00:39:55.10,00:39:55.10,"And, you know, I'm..."
941,00:39:56.57,00:39:56.57,I guess I'm still waitingfor it to get hard.
942,00:39:58.67,00:39:58.67,"PROBST:Brian, in your profession"
943,00:40:00.63,00:40:00.63,"as a used car salesman,"
944,00:40:02.20,00:40:02.20,"do you have an advantage,do you think,"
945,00:40:04.23,00:40:04.23,in assimilating with...with strangers?
946,00:40:06.43,00:40:06.43,"No. If you judge people, uh,by the surface"
947,00:40:09.60,00:40:09.60,"or just by on sheer looks,"
948,00:40:11.13,00:40:11.13,"then you're a very shallowperson in the first place,"
949,00:40:13.23,00:40:13.23,so you got to goa lot deeper th-than that
950,00:40:15.80,00:40:15.80,"and, uh, really get to knowpeople."
951,00:40:18.43,00:40:18.43,"And it's, uh, just...it's all about love."
952,00:40:21.50,00:40:21.50,"So it's, uh..."
953,00:40:22.87,00:40:22.87,"it's a beautiful thingonce you, uh..."
954,00:40:24.47,00:40:24.47,once you get to know everyone.
955,00:40:25.83,00:40:25.83,"And, uh, not judge the bookby its cover."
956,00:40:28.57,00:40:28.57,It's very important.Very important.
957,00:40:30.80,00:40:30.80,Someone always hasthe unfortunate distinction
958,00:40:34.27,00:40:34.27,of being the first personvoted out.
959,00:40:36.33,00:40:36.33,Now we're going to just find out
960,00:40:37.70,00:40:37.70,which one of yougets that honor.
961,00:40:39.43,00:40:39.43,"It is time to vote.John, you're first."
962,00:40:56.40,00:40:56.40,"Ghandia, sweetheart,you have a killer smile."
963,00:40:59.33,00:40:59.33,God bless you.It's a tough game.
964,00:41:01.27,00:41:01.27,Have a great vacation.
965,00:41:20.33,00:41:20.33,"The only thing I can say is,it's a financial move."
966,00:41:22.60,00:41:22.60,"I think you might be a littlebetter off than the rest of us,"
967,00:41:25.50,00:41:25.50,"so maybe you don't needthe money as much as us,"
968,00:41:27.77,00:41:27.77,but glad I got to know you.
969,00:41:46.90,00:41:46.90,"John, you're an awesome man."
970,00:41:49.33,00:41:49.33,"I just felt that therewas tension,"
971,00:41:51.17,00:41:51.17,"and I thought, in the long run,it would sap us of our energy,"
972,00:41:55.57,00:41:55.57,and we need to be strongall the way without the tension.
973,00:42:00.10,00:42:00.10,I'll go tally the votes.
974,00:42:09.00,00:42:09.00,"Once the votes are read,the decision is final."
975,00:42:10.90,00:42:10.90,The personwill be asked to leave
976,00:42:12.40,00:42:12.40,the Tribal Council areaimmediately.
977,00:42:14.07,00:42:14.07,I'll read the votes.
978,00:42:18.50,00:42:18.50,First vote.
979,00:42:21.93,00:42:21.93,Ghandia.
980,00:42:26.37,00:42:26.37,Clay.
981,00:42:31.33,00:42:31.33,John.
982,00:42:33.13,00:42:33.13,"That's one vote John,one vote Ghandia, one vote Clay."
983,00:42:39.90,00:42:39.90,Two votes John.
984,00:42:43.60,00:42:43.60,That's three votes John.
985,00:42:48.23,00:42:48.23,"That's four votes John,and that's enough."
986,00:42:50.17,00:42:50.17,You need to bring me your torch.
987,00:42:59.07,00:42:59.07,"John, the tribe has spoken."
988,00:43:05.57,00:43:05.57,It's time for you to go.
989,00:43:18.50,00:43:18.50,"Well, it's very clear to mefrom you guys' reactions"
990,00:43:21.30,00:43:21.30,that tonight's votewas not easy.
991,00:43:22.80,00:43:22.80,Only three days in
992,00:43:24.63,00:43:24.63,to what will hopefully bea very long journey.
993,00:43:27.03,00:43:27.03,Head back to camp.
994,00:43:28.40,00:43:28.40,Get some sleep.
995,00:43:44.30,00:43:44.30,PROBST: Stay tuned for scenes from our next episode.
996,00:43:50.33,00:43:50.33,PROBST: Next time on Survivor:
997,00:43:52.10,00:43:52.10,"At Chuay Gahn, the games begin."
998,00:43:55.23,00:43:55.23,"-Ooh, nice shot.-Oh!"
999,00:43:56.80,00:43:56.80,-(thunder crashing)-PROBST: Sook Jai continues
1000,00:43:58.90,00:43:58.90, to find trouble in paradise.
1001,00:44:00.43,00:44:00.43,SHII ANN: We're fighting against nature.
1002,00:44:01.87,00:44:01.87,We're fightingagainst each other.
1003,00:44:03.03,00:44:03.03,It's unfortunate.
1004,00:44:04.63,00:44:04.63,-PROBST: And Helen and Jan get lost. -HELEN: If I had
1005,00:44:06.53,00:44:06.53," a pistol in my pocket, I would have pulled it out,"
1006,00:44:08.53,00:44:08.53,"shot her first,shot me second."
1007,00:44:15.40,00:44:15.40,"Well, I get the, uh,distinguished honor"
1008,00:44:17.43,00:44:17.43,of being the first onevoted off of Survivor V.
1009,00:44:20.10,00:44:20.10," This is, uh... uh, quite a surprise for me."
1010,00:44:22.90,00:44:22.90," I didn't think there was any alliances on the team,"
1011,00:44:24.57,00:44:24.57, but I guess there wereand I just wasn't a part of it.
1012,00:44:26.83,00:44:26.83, I enjoyed all of my teammates.
1013,00:44:28.60,00:44:28.60, We had a good time out here.
1014,00:44:29.97,00:44:29.97, It's been an incredible experience.
1015,00:44:31.97,00:44:31.97,It's been wonderful.
1016,00:44:33.20,00:44:33.20,"God bless you,and, uh, see you back home."
