,begin,end,subtitles_text
811,00:35:03.73,00:35:03.73,we even really have that much ofa dysfunction going on with her.
812,00:35:06.67,00:35:06.67,ERIN:I can't believe it.
813,00:35:08.47,00:35:08.47,She doesn't use her head.She doesn't think.
814,00:35:10.47,00:35:10.47,"ROBB: The most upsetting thingabout it is, like,"
815,00:35:12.40,00:35:12.40,"at the reward we had utensils,and she was using her fingers."
816,00:35:14.87,00:35:14.87,It's just disgusting.
817,00:35:16.13,00:35:16.13,"Like, all of us have enoughmanners not to do that."
818,00:35:17.87,00:35:17.87,"ROBB:It's appalling, dude."
819,00:35:19.27,00:35:19.27,"She's a girl, too."
820,00:35:20.43,00:35:20.43,"-Give me a break, dude.-I know."
821,00:35:21.87,00:35:21.87,Who the hell wouldtake her home?
822,00:35:23.27,00:35:23.27,JAKE: I don't know what it is that
823,00:35:24.87,00:35:24.87,"Shii Ann doesthat irritates other people,"
824,00:35:27.17,00:35:27.17,but it's something.
825,00:35:28.30,00:35:28.30,"ROBB: It's funny 'cause Ken saysshe's a city girl,"
826,00:35:30.23,00:35:30.23,and they're all like her.
827,00:35:31.73,00:35:31.73,I don't ever want to meetanother New York City girl.
828,00:35:33.60,00:35:33.60,"ERIN: Oh, God, me, neither.She just bugs me so much."
829,00:35:35.33,00:35:35.33,I can't wait to get rid of her.
830,00:35:36.97,00:35:36.97,"JAKE: She doesn't irritate me, and the reason"
831,00:35:38.70,00:35:38.70," she doesn't irritate me is because she works,"
832,00:35:40.70,00:35:40.70,and Shii Ann to me is just one
833,00:35:42.23,00:35:42.23,of the all-time good onesas far as that goes.
834,00:35:44.83,00:35:44.83,"We've had one hellof an experience,"
835,00:35:46.50,00:35:46.50,and we got a lot more daysto go.
836,00:35:48.97,00:35:48.97,-This is a third of the waythrough it. -Yup.
837,00:35:51.43,00:35:51.43,So you can't letyour dauber get down.
838,00:35:53.30,00:35:53.30,You just have to keep going.
839,00:35:54.83,00:35:54.83,And when people look like
840,00:35:56.27,00:35:56.27,"they're over theretalking about it,"
841,00:35:57.70,00:35:57.70,"when you thinkthey're conniving against you,"
842,00:35:59.47,00:35:59.47,here's what you got to do.
843,00:36:01.33,00:36:01.33,"You got to say,""Man, those people like me."
844,00:36:03.83,00:36:03.83,"""Look at them, they're overthere talking about me."
845,00:36:06.37,00:36:06.37,"They're talking abouthow wonderful I am."""
846,00:36:08.03,00:36:08.03,-You do that...-Yeah?
847,00:36:09.40,00:36:09.40,...you'll never getyour dauber down.
848,00:36:10.97,00:36:10.97,Yup.
849,00:36:11.97,00:36:11.97,"Well, just don't worry aboutwhat anybody else is thinking."
850,00:36:14.03,00:36:14.03,Don't worry aboutwhat anybody else is saying.
851,00:36:17.67,00:36:17.67,I just cry...
852,00:36:19.50,00:36:19.50,Sometimes you just wantto cry?
853,00:36:21.83,00:36:21.83,"Yeah, sometimesI just want to cry."
854,00:36:23.70,00:36:23.70,"Well, that's okay."
855,00:36:25.00,00:36:25.00,Crying's good for you.
856,00:36:27.00,00:36:27.00,SHII ANN: Which one of these things is not like the other?
857,00:36:29.67,00:36:29.67, Okay? I'm the only minority on this island.
858,00:36:33.33,00:36:33.33, I'd forgotten how
859,00:36:35.83,00:36:35.83,culturally differentI am from the mass of America.
860,00:36:38.93,00:36:38.93, So I'm sticking out like a sore thumb.
861,00:37:11.53,00:37:11.53,"Hey, guys."
862,00:37:13.20,00:37:13.20,"Tonight, task at hand--"
863,00:37:15.93,00:37:15.93,vote out another memberfrom your own tribe.
864,00:37:18.23,00:37:18.23,"Before we get to the vote, Robb,"
865,00:37:20.47,00:37:20.47,straight scoop-- what's youguys' impression of Chuay Gahn?
866,00:37:23.33,00:37:23.33,"They seem like a happy bunchof people,"
867,00:37:25.43,00:37:25.43,"like they're all getting alongpretty well, and, uh,"
868,00:37:28.17,00:37:28.17,"good for them, man."
869,00:37:29.80,00:37:29.80,You guys think you're strongerthan Chuay Gahn?
870,00:37:31.43,00:37:31.43,"For sure. Without a doubt.Come on, bro."
871,00:37:33.63,00:37:33.63,"Come on, bro?Who's sitting at Tribal Council?"
872,00:37:35.77,00:37:35.77,ROBB:Hey. This is one...
873,00:37:37.27,00:37:37.27,I-I thinkwe're still up on them.
874,00:37:38.77,00:37:38.77,"I'm just saying,you're not kicking their ass."
875,00:37:41.03,00:37:41.03,Mm. We'll see what the futureholds for Chuay Gahn.
876,00:37:44.00,00:37:44.00,"All I know is, tonightsomebody's going home,"
877,00:37:45.73,00:37:45.73,"because you guys losttoday, so..."
878,00:37:47.03,00:37:47.03,-It's all right.-That is a fact.
879,00:37:48.67,00:37:48.67,"That is a fact, Jack."
880,00:37:52.30,00:37:52.30,"Stephanie, you were sickfirst couple of days, right?"
881,00:37:55.40,00:37:55.40,Are you contributingas much as anybody else?
882,00:37:56.87,00:37:56.87,"STEPHANIE:I was sick, and-and..."
883,00:37:59.07,00:37:59.07,"but I overcame it,and I think that, you know,"
884,00:38:01.30,00:38:01.30,"yeah, I'm still contributingjust as much as everyone else,"
885,00:38:03.53,00:38:03.53,"and I'm really proud of them,"
886,00:38:05.03,00:38:05.03,"'cause they-they were kind ofstruggling at first, I thought,"
887,00:38:07.33,00:38:07.33,"as far as the survivor mode.Um... because in the beginning,"
888,00:38:10.73,00:38:10.73,"they were a little more focusedon the shelter,"
889,00:38:13.07,00:38:13.07,"you know, and I didn't thinkthat that was priority, in-in"
890,00:38:15.63,00:38:15.63,"the situation that we were in,where food and water was..."
891,00:38:18.20,00:38:18.20,"was, uh, what we neededto... to survive."
892,00:38:20.83,00:38:20.83,"And, uh,they've come a long way."
893,00:38:22.37,00:38:22.37,They're doinga whole lot better.
894,00:38:23.70,00:38:23.70,"Ken, when you hearthat kind of a comment,"
895,00:38:25.47,00:38:25.47,"is that, ""That's Stephanie,we-we know that,"""
896,00:38:27.73,00:38:27.73,or does that surprise you that
897,00:38:28.93,00:38:28.93,she was sort of sitting backthere and feeling that way?
898,00:38:31.47,00:38:31.47,"KEN: No, it didn't surprise meat all."
899,00:38:33.17,00:38:33.17,"I mean, it was... it was obvious"
900,00:38:34.70,00:38:34.70,"that she had no interestin the shelter, and"
901,00:38:36.53,00:38:36.53,"from square one, their mainpriority was food and..."
902,00:38:39.57,00:38:39.57,and water.
903,00:38:40.73,00:38:40.73,PROBST:Okay.
904,00:38:42.00,00:38:42.00,"Obviously, nobody tookthe offer up"
905,00:38:44.70,00:38:44.70,"on the switch, but"
906,00:38:46.40,00:38:46.40,"strategically,will anybody admit"
907,00:38:48.67,00:38:48.67,"that you went throughthe process of thinking,"
908,00:38:50.40,00:38:50.40,"""All right, this is a game."
909,00:38:51.77,00:38:51.77,"Do I gain anythingfrom doing this?"""
910,00:38:54.13,00:38:54.13,"Shii Ann, did it gothrough your head at all?"
911,00:38:56.17,00:38:56.17,"I thought about it for, like,two seconds, but really, no,"
912,00:38:59.03,00:38:59.03,"because I really likethis tribe, and"
913,00:39:00.57,00:39:00.57,"I feel very comfortable here,and I don't..."
914,00:39:02.57,00:39:02.57,I don't thinkI want to switch at this time.
915,00:39:04.83,00:39:04.83,Time to vote.
916,00:39:06.60,00:39:06.60,"Penny, you're first."
917,00:39:22.13,00:39:22.13,"Tonight I'm votingfor Stephanie,"
918,00:39:24.27,00:39:24.27,"um, based on what happenedthe first week of camp."
919,00:39:26.90,00:39:26.90,There were a few wordsthat were exchanged
920,00:39:29.03,00:39:29.03,"that were not very nice,"
921,00:39:30.70,00:39:30.70,and some thingsthat were done at camp
922,00:39:32.90,00:39:32.90,that a few of usdidn't appreciate.
923,00:39:50.20,00:39:50.20,"Shii, I do thinkyou're a sweet girl,"
924,00:39:52.20,00:39:52.20,"but you really geton my nerves, so,"
925,00:39:54.97,00:39:54.97,have to vote for you.
926,00:40:13.70,00:40:13.70,Tonight my vote's for Steph.
927,00:40:15.70,00:40:15.70,"Steph, you're a beautiful,beautiful person,"
928,00:40:18.13,00:40:18.13,and I just wishyou hadn't alienated yourself
929,00:40:20.13,00:40:20.13,so much from the start.
930,00:40:21.83,00:40:21.83,And then we could have seen
931,00:40:23.27,00:40:23.27,just how beautiful a personyou really were.
932,00:40:36.83,00:40:36.83,"Sorry, girl."
933,00:40:38.53,00:40:38.53,"You get on my nerves, andI don't like being around you."
934,00:40:41.03,00:40:41.03,Nothing personal.
935,00:40:50.97,00:40:50.97,I'll go tally the votes.
936,00:41:06.63,00:41:06.63,"Once the votes are read,the decision is final."
937,00:41:08.73,00:41:08.73,The person voted outwill be asked
938,00:41:10.87,00:41:10.87,to leave the Tribal Council areaimmediately.
939,00:41:12.63,00:41:12.63,I'll read the votes.
940,00:41:16.13,00:41:16.13,First vote...
941,00:41:18.60,00:41:18.60,Steph.
942,00:41:23.47,00:41:23.47,Steph. That's two votes-- Steph.
943,00:41:31.37,00:41:31.37,Shii Ann.
944,00:41:38.23,00:41:38.23,"Shii Ann. It's two votes--Shii Ann, two votes-- Steph."
945,00:41:46.03,00:41:46.03,"Stephanie, that's three votes."
946,00:41:49.50,00:41:49.50,Fourth vote-- Steph.
947,00:41:54.13,00:41:54.13,That's enough.You need to bring me your torch.
948,00:42:05.97,00:42:05.97,"Stephanie, the tribe has spoken."
949,00:42:10.97,00:42:10.97,"Good luck, guys."
950,00:42:12.63,00:42:12.63,See you.
951,00:42:13.77,00:42:13.77,"Bye, babe."
952,00:42:25.07,00:42:25.07,"PROBST: Well, you guyshave been out here 15 days,"
953,00:42:27.40,00:42:27.40,"a long time for sure,"
954,00:42:28.93,00:42:28.93,but just a little over the thirdof the way into this game.
955,00:42:32.40,00:42:32.40,Think about it.Sleep on it.
956,00:42:33.73,00:42:33.73,"Take your torches,head back to camp."
957,00:42:35.30,00:42:35.30,"Good night, guys."
958,00:42:49.20,00:42:49.20,PROBST: Stay tuned for scenes from our next episode.
959,00:42:55.70,00:42:55.70, PROBST: Next time on Survivor...
960,00:42:57.77,00:42:57.77," It's sink or swim at Chuay Gahn,"
961,00:42:59.30,00:42:59.30, when the guys search for their boat.
962,00:43:00.47,00:43:00.47,HELEN:  The guys are not even
963,00:43:02.10,00:43:02.10,what I would classifyas swimmers.
964,00:43:03.33,00:43:03.33,TED: This is the most swimming I've ever done in my life.
965,00:43:05.87,00:43:05.87,"PROBST: And at Sook Jai, Ken and Robb have it out."
966,00:43:08.80,00:43:08.80,You got some set of ballsto approach me with this.
967,00:43:11.93,00:43:11.93,"Don't ... try to tell me thatI'm doing something I'm not,"
968,00:43:13.97,00:43:13.97,all right?'Cause I'm not ... stupid.
969,00:43:20.70,00:43:20.70,"I just want to say that, um,"
970,00:43:22.47,00:43:22.47,"I have loved my time herewith you guys,"
971,00:43:25.07,00:43:25.07, and I look forward to beingwith you when we get back home.
972,00:43:28.07,00:43:28.07," We really were the dream team,"
973,00:43:29.97,00:43:29.97," um, personality wise and physically."
974,00:43:32.03,00:43:32.03," I'll hold no grudges against any of you, and, uh,"
975,00:43:35.87,00:43:35.87,really look forwardto being with you
976,00:43:37.67,00:43:37.67,"on the outside, so be cool."
