,begin,end,subtitles_text
797,00:33:54.03,00:33:54.03,what he's learned by being here
798,00:33:55.47,00:33:55.47,and it-it really madeall of us think.
799,00:33:57.67,00:33:57.67,"ROBB: You know,before I left, you know"
800,00:33:58.87,00:33:58.87,what I thought wasimportant to me?
801,00:33:59.93,00:33:59.93,How much money I made a week
802,00:34:01.53,00:34:01.53,and getting wasted...
803,00:34:03.70,00:34:03.70,"and within, like, five nightsin here, I started really,"
804,00:34:07.60,00:34:07.60,"like... starting to thinkabout things, man."
805,00:34:10.33,00:34:10.33,"Life is so importantright now to me,"
806,00:34:12.87,00:34:12.87,"and family, you guys, is themost important thing in life."
807,00:34:15.63,00:34:15.63,"The people you love, the peoplewho love you just as much--"
808,00:34:18.80,00:34:18.80,that's what this is about.
809,00:34:20.57,00:34:20.57,You guys do not understand.
810,00:34:21.93,00:34:21.93,I didn't have a relationshipwith my dad for 21 years
811,00:34:24.47,00:34:24.47,"of my life, and now I miss himmore than I miss anyone."
812,00:34:27.10,00:34:27.10,I want to go home and tell him
813,00:34:28.50,00:34:28.50,"how much I love him,and that's what I'm gonna"
814,00:34:30.03,00:34:30.03,"take away from this,no matter what happens."
815,00:34:32.03,00:34:32.03,I'm already going home a winner.
816,00:34:35.60,00:34:35.60,"JAKE: I love people,"
817,00:34:37.40,00:34:37.40, and I like to see people make breakthroughs
818,00:34:40.13,00:34:40.13," in their own lives, like I know Robb had."
819,00:34:43.27,00:34:43.27,I think it'll bemeaningful for him
820,00:34:44.97,00:34:44.97,for the rest of his life.
821,00:34:46.93,00:34:46.93,ROBB: I never imaginedI'd get out here
822,00:34:49.10,00:34:49.10,and really warm upto cherishing bananas.
823,00:34:52.57,00:34:52.57,-(laughs)-You know what I mean?
824,00:34:53.67,00:34:53.67,KEN: I'll tell you one thingthat I never imagined--
825,00:34:55.93,00:34:55.93,that I'd be hanging outwith a skateboarder freak.
826,00:34:58.80,00:34:58.80,(laughter)
827,00:35:00.43,00:35:00.43,"I tell you what,you're a good man."
828,00:35:02.67,00:35:02.67,I like you.
829,00:35:03.67,00:35:03.67,"ROBB:Amen, bro."
830,00:35:04.73,00:35:04.73,SHII ANN:Can I just say something?
831,00:35:06.03,00:35:06.03,"You and I have hadour differences,"
832,00:35:07.10,00:35:07.10,"Robb, but I think you're"
833,00:35:09.20,00:35:09.20,"a really, really good guy."
834,00:35:11.00,00:35:11.00,-I appreciate that.-I just want you to know that.
835,00:35:12.87,00:35:12.87,"-Thank you, thank you very much.-Okay?"
836,00:35:21.63,00:35:21.63,(chicken clucking)
837,00:35:30.23,00:35:30.23,SHII ANN: We had a great time last night.
838,00:35:32.57,00:35:32.57,"A lot of words were saidthat were never said before,"
839,00:35:34.67,00:35:34.67,"so it's kind of,"
840,00:35:36.73,00:35:36.73,it's kind of sappy butreally sweet at the same time.
841,00:35:40.33,00:35:40.33,"It's a shame,but that's the way it is."
842,00:35:41.97,00:35:41.97,SHII ANN: But is it a love fest?
843,00:35:44.63,00:35:44.63, Is it a love tribe? I don't think so.
844,00:35:46.83,00:35:46.83,"We love you, chicken.Thanks for giving your ultimate"
845,00:35:49.03,00:35:49.03,-for us.-(snapping)
846,00:35:53.13,00:35:53.13,"SHII ANN: I think it was a little alcohol,"
847,00:35:55.17,00:35:55.17, a little bit of remorse for losing the game.
848,00:35:57.87,00:35:57.87, I don't think it changes the politics here.
849,00:35:59.80,00:35:59.80,I don't thinkthat Penny and Erin trust me
850,00:36:01.67,00:36:01.67,one bit more than I trust them.
851,00:36:03.33,00:36:03.33," This is a game, and strategically we are"
852,00:36:07.17,00:36:07.17,still divided.
853,00:36:09.87,00:36:09.87,"PENNY:Hey, y'all, we're ready to eat."
854,00:36:11.87,00:36:11.87,-(Jake grunts)-It's so freaking hot.
855,00:36:15.43,00:36:15.43,SHII ANN:It's really hot.
856,00:36:17.43,00:36:17.43,JAKE: Voting at Tribal Council is terribly painful for me.
857,00:36:20.87,00:36:20.87," Just like this morning,"
858,00:36:22.40,00:36:22.40," I didn't want to kill that chicken, but I knew that"
859,00:36:24.93,00:36:24.93, it's just one of those things that we know
860,00:36:26.80,00:36:26.80," we have to do, and as painful"
861,00:36:29.47,00:36:29.47,"as it is, somebody has to go."
862,00:36:51.77,00:36:51.77,"Hello, guys."
863,00:36:53.77,00:36:53.77,"Well, another interesting threedays in the life of Sook Jai."
864,00:36:57.47,00:36:57.47,"A great win, a tough loss,and here you are again."
865,00:37:01.33,00:37:01.33,"Erin, tell me what's your take"
866,00:37:03.37,00:37:03.37,on the last three days?
867,00:37:04.77,00:37:04.77,The last three days
868,00:37:06.23,00:37:06.23,have been the most tumultuousthat we've had
869,00:37:08.27,00:37:08.27,since we've been here.
870,00:37:09.63,00:37:09.63,We had our very best nightthat we've ever had
871,00:37:12.10,00:37:12.10,"when we won the feast,"
872,00:37:14.20,00:37:14.20,"and then the very next nightwe lost our immunity, and, uh,"
873,00:37:18.87,00:37:18.87,"it really touched all of us,I guess, in a..."
874,00:37:23.80,00:37:23.80,"in a really kindof emotional way,"
875,00:37:25.67,00:37:25.67,"so we've, we've all hada really tough time with it."
876,00:37:28.23,00:37:28.23,"PROBST:So, Penny,"
877,00:37:29.53,00:37:29.53,"you go back to camp after losingthe immunity challenge,"
878,00:37:32.43,00:37:32.43,and the tone completely changes.
879,00:37:34.83,00:37:34.83,Why was this different?
880,00:37:36.13,00:37:36.13,"Of all the games we playedthe last 18 days,"
881,00:37:38.87,00:37:38.87,"I think this one was the onewe really wanted to win,"
882,00:37:42.80,00:37:42.80,"uh, just to keepthe six of us here"
883,00:37:45.00,00:37:45.00,for three more nights together.
884,00:37:46.63,00:37:46.63,"Robb, tell me about the nightthrough your eyes."
885,00:37:49.13,00:37:49.13,"It was... it was kind of hard,"
886,00:37:50.23,00:37:50.23,'cause for me sittingon the sidelines
887,00:37:51.67,00:37:51.67,"and watching them,watching them lose"
888,00:37:53.33,00:37:53.33,"and then seeingtheir reaction afterwards,"
889,00:37:55.33,00:37:55.33,"it was tough, you know?"
890,00:37:57.30,00:37:57.30,And I started thinkinghow thankful I was
891,00:37:58.73,00:37:58.73,"to be here and, uh,"
892,00:38:00.70,00:38:00.70,"how amazing this experience hasbeen for me, absolutely amazing,"
893,00:38:03.50,00:38:03.50,so I thoughtI'd share it with them
894,00:38:04.73,00:38:04.73,"and try to uplifteveryone's spirits, and"
895,00:38:07.57,00:38:07.57,the reaction I got out of them
896,00:38:08.83,00:38:08.83,was a lot morethan I was hoping for.
897,00:38:11.00,00:38:11.00,"Some people tucked awaysome tears, and"
898,00:38:14.20,00:38:14.20,all of us just-- I thinkall of us just really felt it.
899,00:38:17.97,00:38:17.97,"Well, I have to say, Sook Jai,"
900,00:38:19.80,00:38:19.80,I am genuinely delighted
901,00:38:22.10,00:38:22.10,for the experienceyou guys have had out here.
902,00:38:24.13,00:38:24.13,"So, how in the heck are you guys"
903,00:38:26.13,00:38:26.13,going to votesomebody out tonight?
904,00:38:27.90,00:38:27.90,Shii Ann?
905,00:38:29.17,00:38:29.17,Um...
906,00:38:32.20,00:38:32.20,"I think that tonight, uh,"
907,00:38:35.90,00:38:35.90,"is going to be really,really hard, and"
908,00:38:38.43,00:38:38.43,"I can't speak for anyone else,but I think that,"
909,00:38:41.40,00:38:41.40,"you know, the last two dayshave been, um, kind of"
910,00:38:46.03,00:38:46.03,so intimatethat it's going to be
911,00:38:48.80,00:38:48.80,a very difficult vote tonight.
912,00:38:51.20,00:38:51.20,"PROBST:Erin,"
913,00:38:52.50,00:38:52.50,"is there a different wayto put a spin on it, in that"
914,00:38:55.73,00:38:55.73,they're both wins?
915,00:38:57.07,00:38:57.07,"I get to play this amazing game,"
916,00:38:58.87,00:38:58.87,"which is all strategy,and can be conniving,"
917,00:39:01.93,00:39:01.93,"and yet in the midstof all of it, I'm having"
918,00:39:04.70,00:39:04.70,a life-changing experience.
919,00:39:06.80,00:39:06.80,I think Robb helped all of usto realize
920,00:39:09.47,00:39:09.47,what we've all actually gained
921,00:39:11.23,00:39:11.23,"from the 18 daysthat we've been here,"
922,00:39:13.27,00:39:13.27,and it's a lot morethan any of us ever expected.
923,00:39:16.13,00:39:16.13,I think it really put usat peace
924,00:39:18.60,00:39:18.60,with making the decision thatwe have to vote for somebody.
925,00:39:22.37,00:39:22.37,"Jake, in all the things thathave happened out here"
926,00:39:24.97,00:39:24.97,"in 18 days,where does tonight's vote rank?"
927,00:39:28.80,00:39:28.80,It's the worst.
928,00:39:30.33,00:39:30.33,"It's a very, very difficult votefor, I-I'm sure, for every"
929,00:39:34.20,00:39:34.20,"person in this room,and I wish we didn't have to."
930,00:39:36.67,00:39:36.67,I'll never forget these lastfew days with these six.
931,00:39:40.40,00:39:40.40,It is time to vote.
932,00:39:41.70,00:39:41.70,"Penny, you're first."
933,00:40:04.90,00:40:04.90,There's an old proverb:
934,00:40:06.90,00:40:06.90,"""A wise man knows much,but says little."
935,00:40:10.07,00:40:10.07,"A fool knows little,but says far too much."""
936,00:40:12.97,00:40:12.97,"Robb, I was just beginningto like you,"
937,00:40:15.40,00:40:15.40,but unfortunatelyyou have to go.
938,00:40:18.07,00:40:18.07,"Sorry, buddy, no hard feelings."
939,00:40:38.27,00:40:38.27,(sighs)
940,00:40:39.27,00:40:39.27,"No hard feelings, baby."
941,00:40:40.30,00:40:40.30,I had to vote for somebody.
942,00:40:41.57,00:40:41.57,"We had our ups and downs,"
943,00:40:42.90,00:40:42.90,"but, uh, I'm definitely gladI got to know you."
944,00:40:54.10,00:40:54.10,I'll go tally the votes.
945,00:41:05.30,00:41:05.30,"Once the votes are read,the decision is final."
946,00:41:07.30,00:41:07.30,The person will be askedto leave
947,00:41:08.73,00:41:08.73,the Tribal Council areaimmediately.
948,00:41:10.37,00:41:10.37,I'll read the votes.
949,00:41:15.00,00:41:15.00,First vote-- Shii Ann.
950,00:41:22.97,00:41:22.97,Robb.
951,00:41:23.97,00:41:23.97,With two B's.
952,00:41:25.47,00:41:25.47,"Two B's, guys."
953,00:41:30.57,00:41:30.57,Robb.
954,00:41:33.63,00:41:33.63,Robb.
955,00:41:35.97,00:41:35.97,"That's three votes-- Robb,one vote-- Shii Ann."
956,00:41:41.93,00:41:41.93,Robb.
957,00:41:43.57,00:41:43.57,That's four votes.That's enough.
958,00:41:45.73,00:41:45.73,You need to bring me your torch.
959,00:41:55.03,00:41:55.03,"Robb, the tribe has spoken."
960,00:41:56.97,00:41:56.97,"Thanks, bro."
961,00:41:59.43,00:41:59.43,"Much love, dude."
962,00:42:01.30,00:42:01.30,You guys rule.Good luck.
963,00:42:02.80,00:42:02.80,"Play hard, dude."
964,00:42:04.80,00:42:04.80,"For real,you guys are all with me."
965,00:42:07.17,00:42:07.17,(Ken murmurs)
966,00:42:11.87,00:42:11.87,My hats are off to you.
967,00:42:13.87,00:42:13.87,Much love.
968,00:42:20.33,00:42:20.33,"PROBST:Well, clearly"
969,00:42:22.60,00:42:22.60,"you guys have experienced somereal spiritual growth, and yet"
970,00:42:26.93,00:42:26.93,it sounds like the personwho inspired that growth
971,00:42:30.23,00:42:30.23,is the same personyou just voted out.
972,00:42:33.00,00:42:33.00,"It's a great game, huh?"
973,00:42:34.43,00:42:34.43,You guys can head back to camp.
974,00:42:36.33,00:42:36.33,Good night.
975,00:42:48.60,00:42:48.60,PROBST: Stay tuned for scenes from our next episode.
976,00:42:55.03,00:42:55.03,PROBST: Next time on Survivor...
977,00:42:57.57,00:42:57.57, Brian becomes the life of the party
978,00:42:59.33,00:42:59.33, but pays a heavy price.
979,00:43:01.10,00:43:01.10,-(Brian retching)-TED: There you go.
980,00:43:03.20,00:43:03.20, Ken confronts Shii Ann and questions her loyalty.
981,00:43:05.87,00:43:05.87,"KEN: If she does turn,"
982,00:43:07.47,00:43:07.47,"the rest of her life,she'll be considered a rat."
983,00:43:09.13,00:43:09.13,PROBST: And the big question: Will the two tribes merge?
984,00:43:12.27,00:43:12.27,Today something very differentis happening.
985,00:43:20.20,00:43:20.20,I would liketo embrace this moment
986,00:43:21.60,00:43:21.60, and tell everybody how absolutely thankful I am.
987,00:43:23.93,00:43:23.93, This experience has forever broadened my horizons
988,00:43:27.87,00:43:27.87, and made me think of the importance
989,00:43:29.87,00:43:29.87, of family and life and love.
990,00:43:31.83,00:43:31.83, I never expected to come here
991,00:43:33.43,00:43:33.43, and leave this inspired and excited.
992,00:43:36.17,00:43:36.17, I leave here happy 'cause I've already won.
993,00:43:39.00,00:43:39.00,I love you guys.
