,begin,end,subtitles_text
395,00:16:57.80,00:16:57.80,"-we're going to eat tonight.-Oh, awesome."
396,00:16:59.10,00:16:59.10,"Sook Jai, clearly a good teameffort. I got to say, Robb, you"
397,00:17:02.27,00:17:02.27,"-carried this one all the way.-SHII ANN: Yeah, you did."
398,00:17:04.10,00:17:04.10,"PROBST:Four out of five balls, not bad."
399,00:17:05.90,00:17:05.90,"A feast awaits. Guys, this way."
400,00:17:07.83,00:17:07.83,(women whooping)
401,00:17:09.80,00:17:09.80,ERIN: Sook Jai!
402,00:17:32.70,00:17:32.70,(Clay mutters)
403,00:17:36.13,00:17:36.13,Zero. We do zero.
404,00:17:38.30,00:17:38.30,TED:Oh!
405,00:17:40.30,00:17:40.30,"Bro, you don't knowhow much I ... hate losing,"
406,00:17:43.63,00:17:43.63,especially when you're giving100 and million percent.
407,00:17:46.47,00:17:46.47,-You know what I mean?-BRIAN: I hear you.
408,00:17:48.47,00:17:48.47,TED: Although this isn't blamed
409,00:17:50.43,00:17:50.43, on a single person or a single event--
410,00:17:53.30,00:17:53.30,"we all gave our best--it's just in this case,"
411,00:17:55.97,00:17:55.97,our best wasn't good enough.
412,00:17:57.80,00:17:57.80,Hmm.
413,00:17:59.00,00:17:59.00,TED: What could we have donedifferent?
414,00:18:00.47,00:18:00.47,CLAY: Not what...Swimming so damn far.
415,00:18:02.80,00:18:02.80,"I mean, we got tired."
416,00:18:04.57,00:18:04.57,I was... I was tired.
417,00:18:05.90,00:18:05.90,"-CLAY: I was, too.-I was tired."
418,00:18:07.90,00:18:07.90,"(Clay mumbling, Ted sighing)"
419,00:18:09.60,00:18:09.60,"HELEN: It was hot out on the beach,"
420,00:18:11.63,00:18:11.63," there was a lot of, uh, running around."
421,00:18:13.30,00:18:13.30, I think our guys were tired
422,00:18:14.77,00:18:14.77,'cause they swamall the way over
423,00:18:16.50,00:18:16.50,"to the other island,looking for the boat."
424,00:18:18.37,00:18:18.37," You know, there were some  tempers flying, and"
425,00:18:20.63,00:18:20.63," I lost mine a little bit, too, and,"
426,00:18:22.90,00:18:22.90,"you know, the heat of the game."
427,00:18:24.50,00:18:24.50,"You guys may understand,but in the heat of battle,"
428,00:18:27.27,00:18:27.27,I'm not pointing you outas an individual.
429,00:18:30.27,00:18:30.27,"I'm just saying, ""Hey, this iswhat we need to do to win."""
430,00:18:34.17,00:18:34.17,-Right. -So pleasedon't take it personally.
431,00:18:36.10,00:18:36.10,"Yeah, it was a heartfelt loss,  especially"
432,00:18:39.17,00:18:39.17, considering what the reward was.
433,00:18:40.50,00:18:40.50, I'm assuming they're going
434,00:18:42.53,00:18:42.53, to somewhere where there's going to be a Thai
435,00:18:44.90,00:18:44.90,festival type of atmosphere.I don't know.
436,00:18:47.37,00:18:47.37," Whatever it is, it's better than"
437,00:18:50.50,00:18:50.50, coming back and pulling clams  off of rocks.
438,00:19:11.90,00:19:11.90,"-Oh, my God!-Wow."
439,00:19:14.20,00:19:14.20,"-How amazing is this?-PENNY: Oh, wow."
440,00:19:16.07,00:19:16.07,"Y'all, this tea is so good,I could drink it like milk."
441,00:19:18.73,00:19:18.73,"Oh, I'd love some."
442,00:19:19.83,00:19:19.83,ROBB: You couldn't imagine a more perfect setting
443,00:19:21.93,00:19:21.93, and a more perfect feast laid out in front of us.
444,00:19:23.90,00:19:23.90,"Wow, ice water. It's so good."
445,00:19:26.53,00:19:26.53,ROBB: There's all the little things
446,00:19:27.97,00:19:27.97," you never knew meant so much,"
447,00:19:29.63,00:19:29.63, Cold water with ice cubes
448,00:19:31.07,00:19:31.07,and clean platesand forks and napkins to wipe
449,00:19:33.90,00:19:33.90, -our faces. -What is this?
450,00:19:35.40,00:19:35.40,"SHII ANN:That's, um,"
451,00:19:36.77,00:19:36.77,shredded pork or shrimp.
452,00:19:38.37,00:19:38.37,"Wow, look at this, would you?"
453,00:19:39.80,00:19:39.80,"-Wow. -Mmm.-Oh, yeah."
454,00:19:41.57,00:19:41.57,ERIN: We are eating with goldutensils. How crazy is that?
455,00:19:43.67,00:19:43.67, I didn't expect something
456,00:19:45.57,00:19:45.57,"that ornate, that extravagant."
457,00:19:48.20,00:19:48.20," I mean, I felt like royalty sitting there."
458,00:19:50.17,00:19:50.17,"-(belching)-JAKE: Oh. -PENNY: Oh, wow. "
459,00:19:52.67,00:19:52.67,-They're about to play somemusic. -SHII ANN: They're gonna
460,00:19:54.07,00:19:54.07,-play something for us.-Look.
461,00:19:56.30,00:19:56.30,"-Oh, my God.-This is so good, y'all."
462,00:19:57.83,00:19:57.83,(grunting)
463,00:20:01.10,00:20:01.10,"You guys,today we worked so hard."
464,00:20:04.77,00:20:04.77,"After all the drama thismorning, this is honestly better"
465,00:20:07.30,00:20:07.30,than anything I could have everimagined.
466,00:20:08.73,00:20:08.73,"PENNY:We love you, Robb."
467,00:20:10.13,00:20:10.13, Robb was definitely a key factor
468,00:20:12.60,00:20:12.60,"in our reward challenge and ushaving that fabulous Thai food,"
469,00:20:15.97,00:20:15.97, and if there was
470,00:20:17.43,00:20:17.43,"an MVP award we could give,he would have won it, for sure."
471,00:20:20.83,00:20:20.83,"Y'all, we were fightingover unripe bananas."
472,00:20:24.10,00:20:24.10,ERIN: (laughing):This morning.
473,00:20:25.27,00:20:25.27,"SHII ANN:I know, that was ridiculous."
474,00:20:26.53,00:20:26.53,"PENNY: Y'all, how silly doesthis morning seem now?"
475,00:20:28.27,00:20:28.27,SHII ANN:The morning was retarded.
476,00:20:29.87,00:20:29.87,"-Oh, my God, look.-Look at this. -God!"
477,00:20:31.87,00:20:31.87,♪ ♪
478,00:20:43.23,00:20:43.23,SHII ANN: It was just
479,00:20:44.87,00:20:44.87," so wonderful to be able to see some Thai culture,"
480,00:20:48.47,00:20:48.47," to see the dancing, to hear the music."
481,00:20:56.03,00:20:56.03," I mean, I felt like just for a second that we were"
482,00:20:58.73,00:20:58.73," just maybe even friends, just there enjoying each other"
483,00:21:01.67,00:21:01.67," and enjoying the meal and put aside the game,"
484,00:21:04.13,00:21:04.13," and that very rarely happens for Sook Jai,"
485,00:21:07.47,00:21:07.47,so it was really nice.
486,00:21:22.83,00:21:22.83,(squeaking)
487,00:21:26.57,00:21:26.57,CLAY:Look at that sunrise.
488,00:21:28.40,00:21:28.40,"-Wow, look at those clouds.-BRIAN: Mm-hmm."
489,00:21:30.27,00:21:30.27,"CLAY:Man, isn't that pretty?"
490,00:21:31.90,00:21:31.90,TED: I was telling Brian I havea feeling a merger is coming on.
491,00:21:35.23,00:21:35.23,"-So...-Oh, I do, too. No doubt."
492,00:21:36.80,00:21:36.80,TED: I have been horrible in predicting so far.
493,00:21:39.23,00:21:39.23," However,"
494,00:21:40.23,00:21:40.23,I suspect that a mergeris going to happen
495,00:21:43.13,00:21:43.13,"very, very, very soon."
496,00:21:44.77,00:21:44.77,I kind of have a feeling
497,00:21:46.07,00:21:46.07,that it's going to happenin the next three days.
498,00:21:47.83,00:21:47.83,"It could,I wouldn't be surprised,"
499,00:21:49.50,00:21:49.50,but I guarantee youit will happen
500,00:21:51.07,00:21:51.07,before two more immunities.
501,00:21:52.77,00:21:52.77,TED: We need the immunity badly.
502,00:21:54.90,00:21:54.90, Right now Sook Jai is up six members; we have five members.
503,00:21:58.77,00:21:58.77," If we can win immunity one more time,"
504,00:22:00.87,00:22:00.87, then they have to come down to five
505,00:22:02.90,00:22:02.90,and then it's just goingto almost be
506,00:22:04.17,00:22:04.17,like starting all over again.
507,00:22:05.63,00:22:05.63,(sighs)
508,00:22:08.73,00:22:08.73,We still in play?
509,00:22:09.73,00:22:09.73,"Yeah, of course."
510,00:22:10.73,00:22:10.73,"Okay, cool."
511,00:22:12.13,00:22:12.13,(both laugh)
512,00:22:15.70,00:22:15.70,BRIAN: Ted and I have still a very strong relationship.
513,00:22:18.07,00:22:18.07,"We have a certain lingo that,when we talk about,"
514,00:22:19.60,00:22:19.60,we both knowexactly where our head's at.
515,00:22:21.37,00:22:21.37,"Yeah, when the merge comes, man,it's gonna be important"
516,00:22:23.83,00:22:23.83,-for all of us to kind ofstay together. -Yeah.
517,00:22:26.30,00:22:26.30,-I know exactlywhere your head's at. -Cool.
518,00:22:28.20,00:22:28.20,BRIAN: All we really want to do is just kind of be
519,00:22:31.07,00:22:31.07, very low-keyed.
520,00:22:32.43,00:22:32.43," No one needs to know of our strong friendship,"
521,00:22:33.93,00:22:33.93,and we're kind of just seeingif anybody's playing us.
522,00:22:37.90,00:22:37.90,I think Clay is tryingto figure us out.
523,00:22:40.37,00:22:40.37,I think so.
524,00:22:41.87,00:22:41.87,We'll just see what happens whenthat situation comes into play.
525,00:22:44.87,00:22:44.87,"-I'm gonna play it down, man,I'm gonna play... -Of course."
526,00:22:46.87,00:22:46.87,"-""I don't know what you'retalking about."" -Yeah."
527,00:22:48.40,00:22:48.40,Watch your back.
528,00:22:51.00,00:22:51.00,TED: Clay doesn't know about the verbal alliance
529,00:22:53.60,00:22:53.60," between Brian and myself,"
530,00:22:55.57,00:22:55.57,which we establishedfrom day one.
531,00:22:57.30,00:22:57.30," If Clay does find out, or if anyone does find out"
532,00:23:00.77,00:23:00.77," that we do have an alliance,"
533,00:23:02.87,00:23:02.87, it could bite us and it could ruin
534,00:23:04.10,00:23:04.10,our game planfor the rest of the game.
535,00:23:23.20,00:23:23.20,KEN: How big werethose prawns yesterday?
536,00:23:26.03,00:23:26.03,"ROBB:Oh, my God, dude, I..."
537,00:23:27.40,00:23:27.40,I can't wait to eatsome more Thai food like that.
538,00:23:29.77,00:23:29.77,It's never goingto be that pretty
539,00:23:30.83,00:23:30.83,"or in that same place, though."
540,00:23:33.47,00:23:33.47,"ROBB: That amazing mealyesterday, eating on the beach,"
541,00:23:36.33,00:23:36.33, and watching the Thai dancers and the guys play the music--
542,00:23:38.60,00:23:38.60,it was amazing.
543,00:23:40.33,00:23:40.33, I think it opened my mind a little bit.
544,00:23:43.13,00:23:43.13,This whole experience already-- it's not
545,00:23:45.00,00:23:45.00," that I've been taking it for granted,"
546,00:23:46.37,00:23:46.37,but I think I can appreciate it a little bit more.
547,00:23:48.30,00:23:48.30,Look at this-- snakeskin.
548,00:23:50.87,00:23:50.87,"Whatever it shed it's small,though-- look at it--"
549,00:23:53.10,00:23:53.10,unless this is the very tipof its tail.
550,00:23:57.97,00:23:57.97, Today Ken and I took a walkinto the jungle and walked back
551,00:24:01.13,00:24:01.13,further than I've beensince I've been here.
552,00:24:05.27,00:24:05.27,KEN:This is nice.
553,00:24:09.53,00:24:09.53,"ROBB:Cool, dude."
554,00:24:10.77,00:24:10.77,KEN: I didn't realizeit went back like that.
555,00:24:12.60,00:24:12.60,ROBB:Look at this.
556,00:24:13.87,00:24:13.87,"-(bat squeaks)-KEN: If you freak them out,"
557,00:24:15.77,00:24:15.77,they're all going to fly out.
558,00:24:16.87,00:24:16.87,"Dude, it's huge."
559,00:24:17.87,00:24:17.87,(bat squeaks)
560,00:24:19.23,00:24:19.23,"ROBB:  When we walked in the cave,"
561,00:24:21.20,00:24:21.20," there's bats flying all over the place inside,"
562,00:24:23.13,00:24:23.13,and I-I walked back kind of far
563,00:24:24.33,00:24:24.33,in there and looked back.
564,00:24:25.47,00:24:25.47,There are so many back in here.
565,00:24:26.63,00:24:26.63,KEN:I know there are.
566,00:24:27.63,00:24:27.63,"Holy ..., dude, look at this."
567,00:24:29.63,00:24:29.63,"Robb, be careful."
568,00:24:30.97,00:24:30.97,"-(whispers): Come on, man.-Don't start screaming."
569,00:24:32.37,00:24:32.37,"ROBB: It's just amazing, to be able to walk"
570,00:24:34.23,00:24:34.23,and find such a beautiful place
571,00:24:35.33,00:24:35.33,that we've been takingfor granted.
572,00:24:36.90,00:24:36.90,I never would have thought thatI'd be sitting here in a cave
573,00:24:39.73,00:24:39.73,"in the middleof a jungle in Thailand,"
574,00:24:41.40,00:24:41.40,savoring one bananaand a canteen full of water
575,00:24:44.73,00:24:44.73,that's warm as pissand tastes even worse.
576,00:24:46.77,00:24:46.77," I did so much thinking about,"
577,00:24:48.70,00:24:48.70," I'll never be here again in my life,"
578,00:24:51.23,00:24:51.23,and it just puts everythingin perspective that much more.
579,00:24:53.67,00:24:53.67,"Ken and I really squashedthe beef and really had, I mean,"
580,00:24:56.83,00:24:56.83, an amazing enough conversation
581,00:24:58.20,00:24:58.20," that he made me make sense to myself,"
582,00:25:00.47,00:25:00.47,and not many peoplehave done that.
583,00:25:01.93,00:25:01.93,"Listen, it's like you're always"
584,00:25:04.37,00:25:04.37,"-trying to tell me what to do.-Well, you know what?"
585,00:25:06.27,00:25:06.27,"Maybe you should listen whensomebody is trying to help you,"
586,00:25:08.40,00:25:08.40,because that's allI've been trying to do
587,00:25:10.07,00:25:10.07,since you've been here.
588,00:25:11.27,00:25:11.27,And you know what?
589,00:25:12.27,00:25:12.27,It's getting harderand harder to help you.
590,00:25:14.17,00:25:14.17, Robb and I really don't have too many differences.
591,00:25:16.73,00:25:16.73," It's just that he's a young kid, he just needs..."
592,00:25:19.03,00:25:19.03,"That's why I took him out theretoday-- to talk to him,"
593,00:25:20.87,00:25:20.87,"that's it, you know,just get his head straight"
594,00:25:22.23,00:25:22.23,because I know he's not doingtoo well out here.
595,00:25:23.73,00:25:23.73,"ROBB:Hey, for real, though,"
596,00:25:25.70,00:25:25.70,"I really appreciateyou talking to me, Ken."
597,00:25:28.00,00:25:28.00,"Now that we go back,you're feeling a lot better,"
598,00:25:29.83,00:25:29.83,and theneverybody gets along well.
599,00:25:31.77,00:25:31.77,-ROBB: Amen. -We definitely made peace.
600,00:25:33.70,00:25:33.70, It was good.
601,00:25:35.40,00:25:35.40,I guess it was like hanging outwith an older brother.
602,00:25:44.80,00:25:44.80," JAN: Helen, we have to have a funeral."
603,00:25:46.90,00:25:46.90,HELEN:Why?
604,00:25:47.90,00:25:47.90,I found a baby bat.
605,00:25:50.23,00:25:50.23,-Aw...-And it's dead.
606,00:25:52.00,00:25:52.00,"I have it hiddenso y'all can see it,"
607,00:25:55.03,00:25:55.03,and we're going to bury itwith a cross.
608,00:25:57.37,00:25:57.37,HELEN: Jan was all upset 'cause she found
609,00:25:59.00,00:25:59.00," this, uh-- really, I would"
610,00:26:01.67,00:26:01.67,not even call it a baby bat yet;it was still embryonic stage--
611,00:26:05.07,00:26:05.07,"um, slimy, littlebaby bat thing."
612,00:26:07.23,00:26:07.23,"Oh, God."
613,00:26:09.17,00:26:09.17,See?
614,00:26:10.23,00:26:10.23,"-That's its head there.-Tiny, tiny."
615,00:26:11.63,00:26:11.63,"-Yes, there'sits little bat arms. -Man."
616,00:26:15.23,00:26:15.23,"HELEN:  I feel bad if a kitten dies,"
617,00:26:17.40,00:26:17.40," but I'm looking at this slimy bat, going,"
618,00:26:19.23,00:26:19.23,"""Uh, yeah, okay, that's realsad,"" you know?"
619,00:26:21.73,00:26:21.73,"""Bury that thingbefore flies get all over it."""
620,00:26:24.03,00:26:24.03,"TED: You guys are gonna havethe funeral, right?"
621,00:26:25.90,00:26:25.90,"-JAN: Yes. -TED: Okay.-HELEN: You're invited, Ted."
622,00:26:27.97,00:26:27.97,I'll send a cardand some flowers.
623,00:26:31.80,00:26:31.80,"BRIAN: She wanted to have a funeral,"
624,00:26:33.63,00:26:33.63," and named it Oscar, and was quite sad"
625,00:26:36.40,00:26:36.40, about the little bat that I was curious
626,00:26:38.73,00:26:38.73,if we could eat it or not--
627,00:26:39.80,00:26:39.80,that was my first wordsout of my mouth.
628,00:26:41.27,00:26:41.27,"JAN:Oh, poor baby."
629,00:26:43.17,00:26:43.17,"Didn't have a chance,did you, baby?"
630,00:26:45.53,00:26:45.53,"BRIAN: But again, I don't know"
631,00:26:47.63,00:26:47.63," if that's just Jan being emotional or if, uh,"
632,00:26:50.50,00:26:50.50,she's actually losing ita little bit out here.
633,00:26:53.63,00:26:53.63,"JAN: I know it's silly, but"
634,00:26:55.70,00:26:55.70,"I feel sorry for him,so I buried him and he's happy."
635,00:26:59.20,00:26:59.20,(laughs) And I'll quit cryingin a minute.
636,00:27:02.07,00:27:02.07,"But I'm very sensitive, so--especially about little animals"
637,00:27:04.80,00:27:04.80,that are-- don't have a chance.
638,00:27:07.57,00:27:07.57,Here you go.
639,00:27:13.53,00:27:13.53,-Treemail.-It's ensconced in the mailbox.
640,00:27:15.57,00:27:15.57,Got treemail.
641,00:27:17.60,00:27:17.60,"TED:We got something, huh?"
642,00:27:18.90,00:27:18.90,HELEN:Uh-oh.
643,00:27:20.00,00:27:20.00,-A map?-We don't know that language.
644,00:27:21.53,00:27:21.53,"-TED: What the...?-BRIAN: ""21, a game of luck?"""
645,00:27:23.13,00:27:23.13,"HELEN:""Not here in this place"
646,00:27:24.63,00:27:24.63,"""If your mind'snot sharp enough,"
647,00:27:26.80,00:27:26.80,"you could be gonewithout a trace."""
648,00:27:28.17,00:27:28.17,"TED:So it's, it's for immunity."
649,00:27:29.60,00:27:29.60," I mean, today we received an interesting treemail."
650,00:27:32.47,00:27:32.47, And I think this one is going to be
651,00:27:34.30,00:27:34.30,"more of a mental challenge,no matter what it is."
652,00:27:36.63,00:27:36.63,"21, so it could be 21 blackjack."
653,00:27:39.53,00:27:39.53,"CLAY:Oh, yeah."
654,00:27:40.53,00:27:40.53,"The merge has to be happeningin the next three to four days,"
655,00:27:43.50,00:27:43.50, so it's extremely important
656,00:27:44.97,00:27:44.97," that this tribe wins, 'cause if it doesn't,"
657,00:27:47.43,00:27:47.43,they can sit thereand pick us off one by one
658,00:27:49.47,00:27:49.47,and get downto just their tribe.
659,00:27:58.50,00:27:58.50,"PROBST: Welcome, guys.First things first--"
660,00:28:00.50,00:28:00.50,"as always, give it up, Jan."
661,00:28:02.47,00:28:02.47,"Oh, I hate to."
662,00:28:03.47,00:28:03.47,-(laughs)-PROBST: Immunity--
663,00:28:05.50,00:28:05.50,the most coveted prize inthis game-- back up for grabs.
664,00:28:08.97,00:28:08.97,"To win it, you simply haveto outsmart the other tribe."
665,00:28:11.93,00:28:11.93,Today's challenge is all mental.
666,00:28:13.53,00:28:13.53,It's called Thai 21.
667,00:28:15.40,00:28:15.40,Here's how it works.
668,00:28:16.67,00:28:16.67,There are 21 flagsin this circle.
669,00:28:19.00,00:28:19.00,Your goal-- be the tribeto get the last flag.
670,00:28:23.33,00:28:23.33,"Here's the twist-- on each move,"
671,00:28:25.27,00:28:25.27,"you can only grabone, two, or three flags,"
672,00:28:29.27,00:28:29.27,so clearly the strategy liesin determining
673,00:28:32.40,00:28:32.40,how many flags to graband when to grab them.
674,00:28:36.17,00:28:36.17,"Sook Jai, because you haveone extra member,"
675,00:28:37.93,00:28:37.93,you're sitting somebody out.
676,00:28:38.93,00:28:38.93,"-Robb, plant it on the big rock.-(Robb mutters)"
677,00:28:41.73,00:28:41.73,"Guys, take a seat on yourbenches, start strategizing."
678,00:28:44.27,00:28:44.27,-Wait for my go.-ERIN: And we can take two.
679,00:28:46.37,00:28:46.37,"-We can take two and we win.-We, we want"
680,00:28:47.70,00:28:47.70,-the last flag.-You understand?
681,00:28:49.07,00:28:49.07,"At the end, we want to make surethere's four flags."
682,00:28:51.27,00:28:51.27,"-CLAY: Five or four?-Five. -No, four."
683,00:28:52.67,00:28:52.67,"PROBST:Here we go, guys."
684,00:28:54.63,00:28:54.63,"Sook Jai, you won the coin toss,you elected to go first."
685,00:28:57.70,00:28:57.70,Make your first move.
686,00:28:58.83,00:28:58.83,"You must grab one, two,or three flags."
687,00:29:01.53,00:29:01.53,Sook Jai electing to grab two.
688,00:29:10.83,00:29:10.83,"Sook Jai takes two flags ontheir first move, leaving 19."
689,00:29:14.47,00:29:14.47,"Chuay Gahn, make your move."
690,00:29:19.00,00:29:19.00,Chuay Gahn also takes two.
691,00:29:22.67,00:29:22.67,Very simple gamewith huge consequences.
692,00:29:26.93,00:29:26.93,"After one round,we're down to 17 flags."
693,00:29:29.10,00:29:29.10,"Sook Jai, make your move."
694,00:29:33.47,00:29:33.47,"Sook Jai takes two more flags,leaving 15."
695,00:29:36.00,00:29:36.00,"Chuay Gahn, make your move."
696,00:29:37.17,00:29:37.17,I hope that's right.
697,00:29:39.00,00:29:39.00,PROBST:Chuay Gahn takes one.
698,00:29:41.67,00:29:41.67,We're down to 14 flags.
699,00:29:43.67,00:29:43.67,"Sook Jai, your move."
700,00:29:45.43,00:29:45.43,Penny takes one.
701,00:29:49.83,00:29:49.83,Chuay Gahn also takes one.
702,00:29:52.10,00:29:52.10,We are down to 12 flags.
703,00:29:54.00,00:29:54.00,"I have a better feelingabout, though, staying"
704,00:29:55.23,00:29:55.23,-on odds.-She wants to take one.
705,00:29:56.60,00:29:56.60,"-TED: We have two more...-CLAY: I know, but you take"
706,00:29:58.13,00:29:58.13,"the three away, that's nine."
707,00:30:00.27,00:30:00.27,"Sook Jai, it is your move."
708,00:30:01.47,00:30:01.47,Make it.
709,00:30:08.27,00:30:08.27,We're now down to 11 flags.
710,00:30:10.73,00:30:10.73,"Chuay Gahn, your move."
711,00:30:18.60,00:30:18.60,We are now down to nine flags.
712,00:30:21.07,00:30:21.07,Immunity at stake.
713,00:30:22.73,00:30:22.73,Your moves are becomingvery critical.
714,00:30:25.60,00:30:25.60,"You guys have to help me think,you've got to help me think."
715,00:30:28.00,00:30:28.00,"Sook Jai, it is your move."
716,00:30:29.07,00:30:29.07,Make it.
717,00:30:30.07,00:30:30.07,How many?
718,00:30:31.23,00:30:31.23,"I don't know, you guys,this is... I don't know."
719,00:30:33.60,00:30:33.60,So I think we're looking good.
720,00:30:35.03,00:30:35.03,We just got to see what theytake and take the same amount.
721,00:30:36.77,00:30:36.77,"Take three, there's six."
722,00:30:38.23,00:30:38.23,And they could take one.
723,00:30:40.03,00:30:40.03,"Got to make a move, guys."
724,00:30:41.40,00:30:41.40,"One, two, or three flags."
725,00:30:43.80,00:30:43.80,Let's go.
726,00:30:45.93,00:30:45.93,"HELEN: They're going,they're going three,"
727,00:30:47.17,00:30:47.17,they're going three.
728,00:30:48.33,00:30:48.33,PROBST:Sook Jai takes three.
729,00:30:57.63,00:30:57.63,There are six flags remaining.
730,00:30:59.73,00:30:59.73,"Chuay Gahn, it's your move."
731,00:31:01.73,00:31:01.73,What y'all want to do?
732,00:31:03.07,00:31:03.07,"-If they take two,we would-- we'd lose. -We lose?"
733,00:31:05.23,00:31:05.23,"Yeah, if they take two, we lose."
734,00:31:07.07,00:31:07.07,"-Take one.-Hey, listen, we just take one."
735,00:31:09.53,00:31:09.53,That's an awful long timeto think about it.
736,00:31:10.77,00:31:10.77,We haveto go pick up two flags.
737,00:31:12.40,00:31:12.40,-We have to pick up two.-We have to pick up two.
738,00:31:14.17,00:31:14.17,-Yes.-Shh. Shh!
739,00:31:15.17,00:31:15.17,Let's go.
740,00:31:16.53,00:31:16.53,"Want to do it? Let's go, buddy."
741,00:31:20.30,00:31:20.30,"-They're taking two? -We lost.-We lost, we lost it."
742,00:31:22.77,00:31:22.77,SHII ANN:We lost.
743,00:31:26.47,00:31:26.47,JAKE:They won it.
744,00:31:29.60,00:31:29.60,That sucks.
745,00:31:31.07,00:31:31.07,That move will clinch it.
746,00:31:33.60,00:31:33.60,"Sook Jai, make your last move."
747,00:31:36.30,00:31:36.30,Play this game out.
748,00:31:37.63,00:31:37.63,Making a very classy movein grabbing three flags.
749,00:31:41.00,00:31:41.00,Good job.
750,00:31:42.47,00:31:42.47,Thanks.
751,00:31:47.03,00:31:47.03,"Chuay Gahn, nicely played."
752,00:31:48.23,00:31:48.23,Grab your last flag.
753,00:31:55.80,00:31:55.80,"Everyone, put your hand on it."
754,00:31:57.37,00:31:57.37,"Let's go,let's take it back together."
755,00:32:01.37,00:32:01.37,Chuay Gahn wins immunity.
756,00:32:08.63,00:32:08.63,"Way to go, way to go, way to go."
757,00:32:10.57,00:32:10.57,"PROBST: Back-to-back immunity,Chuay Gahn."
758,00:32:11.80,00:32:11.80,"Nicely done, well played."
759,00:32:13.83,00:32:13.83,Hey!
760,00:32:14.83,00:32:14.83,-Have a good night.-TED: Great job.
761,00:32:15.90,00:32:15.90,"-Great job, you guys.-Sook Jai,"
762,00:32:17.03,00:32:17.03,"just another reminderof how one wrong move,"
763,00:32:20.93,00:32:20.93,and you're out of the game.
764,00:32:21.93,00:32:21.93,One of you will be.
765,00:32:23.57,00:32:23.57,I'll see you tomorrow nightat Tribal Council.
766,00:32:25.97,00:32:25.97,You can head back to camp.
767,00:32:52.73,00:32:52.73,JAKE:We lost the immunity challenge.
768,00:32:54.73,00:32:54.73, Everybody is really
769,00:32:56.03,00:32:56.03,"bummed out about that, 'cause wereally wanted to win it."
770,00:32:58.67,00:32:58.67,(murmuring indistinctly)
771,00:33:00.87,00:33:00.87,"This is the first,first time I've been upset"
772,00:33:03.23,00:33:03.23,about any challenge we've lost.
773,00:33:04.73,00:33:04.73,This was important.
774,00:33:05.93,00:33:05.93,"Yeah, it was."
775,00:33:08.43,00:33:08.43,JAKE: Do we dig out the wineand talk about it?
776,00:33:10.43,00:33:10.43,ERIN: We decided to open up
777,00:33:12.50,00:33:12.50, our wine that we had from our food reward...
778,00:33:15.73,00:33:15.73,We got a lot of wine left.
779,00:33:17.17,00:33:17.17, ...and just kind of came to grips with the fact
780,00:33:19.13,00:33:19.13,that we were going to haveto get rid of someone.
781,00:33:20.80,00:33:20.80,(blows)
782,00:33:22.17,00:33:22.17,"ROBB: This is our last nighttogether as a family, guys,"
783,00:33:24.50,00:33:24.50,the six of us.
784,00:33:26.13,00:33:26.13,"-KEN: That sucks.-Yeah, it doesn't feel"
785,00:33:27.83,00:33:27.83,"good, that's for sure."
786,00:33:29.00,00:33:29.00,"This is a game of up and downs,isn't it?"
787,00:33:31.00,00:33:31.00,"I mean, up one minute,totally down the next."
788,00:33:34.63,00:33:34.63,"ROBB: You know what, man?It's all positive."
789,00:33:36.80,00:33:36.80,There's no words that candescribe this experience.
790,00:33:38.83,00:33:38.83,"When it's all said and done,"
791,00:33:40.43,00:33:40.43,you know what I'm gonnatell people about this?
792,00:33:42.13,00:33:42.13,"You know, it changed my wholeoutlook on life in two weeks."
793,00:33:46.33,00:33:46.33,ERIN: Everyone just kind of sat down
794,00:33:47.80,00:33:47.80," and poured out their feelings,"
795,00:33:49.37,00:33:49.37," which is something that we really haven't done,"
796,00:33:51.37,00:33:51.37," but Robb talked about, you know,"
