,begin,end,subtitles_text
411,00:18:45.40,00:18:45.40,I was ready to grab those boards
412,00:18:46.60,00:18:46.60,and hang on with my fingersand just roll
413,00:18:48.07,00:18:48.07,all the way around and have itcome right around again.
414,00:18:51.73,00:18:51.73,-I'm just proud of us.-CHRISTY: Yeah.
415,00:18:53.00,00:18:53.00,"I mean, it's hard as a new team,"
416,00:18:54.67,00:18:54.67,"you know, to really cometogether in what, two days?"
417,00:18:57.43,00:18:57.43,And I really feellike we pulled it off
418,00:18:59.47,00:18:59.47,"as a team,not, like, as individuals."
419,00:19:02.30,00:19:02.30,"BUTCH: You know, I-I'd liketo share something."
420,00:19:04.03,00:19:04.03,"I'd like to share somethingwith you guys,"
421,00:19:05.87,00:19:05.87,and this is coming from stuffthat I've seen through
422,00:19:08.97,00:19:08.97,almost 30 years of coaching andbeing around kids.
423,00:19:11.77,00:19:11.77,"In my lifetime,there is defining moments"
424,00:19:14.03,00:19:14.03,"when I remember certain details,"
425,00:19:15.97,00:19:15.97,and there's only about fivein my life--
426,00:19:18.10,00:19:18.10,six in my life--that I can remember.
427,00:19:19.77,00:19:19.77,"Well, yesterday and today,"
428,00:19:21.53,00:19:21.53,"I have another one,and that was last night"
429,00:19:24.40,00:19:24.40,when Christy realizedthat we kept her for her talent
430,00:19:28.13,00:19:28.13,and for her ability.
431,00:19:29.53,00:19:29.53,The smile that came acrossher face was unbelievable.
432,00:19:33.17,00:19:33.17,"And then, today, when sheclimbed out of that water,"
433,00:19:36.43,00:19:36.43,-I thought her... she was gonnajump out of her skin. -Aw...
434,00:19:38.97,00:19:38.97,And I thought she was justgoing to go... but she had...
435,00:19:41.77,00:19:41.77,and-and she knewthat-that her... your value.
436,00:19:43.70,00:19:43.70,"You knew that you're one of us,you knew your importance,"
437,00:19:45.70,00:19:45.70,and you'll never forget thatas long as you live.
438,00:19:47.50,00:19:47.50,I'll never forget it.
439,00:19:48.90,00:19:48.90,"That's... that is on my listas a defining moment,"
440,00:19:51.83,00:19:51.83,and I mean thatfrom the bottom of my heart.
441,00:19:54.17,00:19:54.17,You don't have a disability.That's how I feel about it.
442,00:19:56.07,00:19:56.07,-Thanks. Thanks.-All right?
443,00:19:57.70,00:19:57.70,CHRISTY: Hearing him say that
444,00:19:59.33,00:19:59.33,"is like, ""Yes, yes."""
445,00:20:01.00,00:20:01.00,"I mean, I strivethrough my whole life"
446,00:20:03.63,00:20:03.63,to just try to prove thatto people
447,00:20:05.87,00:20:05.87,or show people that there'snothing wrong with me.
448,00:20:09.67,00:20:09.67,"Yay, I finally..."
449,00:20:10.93,00:20:10.93,-Thank you. That's cool.-Okay. I mean it.
450,00:20:13.23,00:20:13.23,"I mean it, okay?Yeah, I'm real proud of you."
451,00:20:15.07,00:20:15.07,"-Thanks, Butch.-You're welcome."
452,00:20:30.90,00:20:30.90,"DEENA: Oh, it's nice and cool today."
453,00:20:32.50,00:20:32.50,ROB: You got it all the way in?
454,00:20:34.17,00:20:34.17,"Oh, heck, yeah."
455,00:20:35.83,00:20:35.83,Nicely soaked.Want some?
456,00:20:37.20,00:20:37.20,"Oh, sure."
457,00:20:38.73,00:20:38.73,"ROB: Coming into this new tribe, I had an alliance with Alex,"
458,00:20:42.87,00:20:42.87,but I've been noticing in Alexthat he's losing his momentum.
459,00:20:47.37,00:20:47.37, He's not as interested in playing the game
460,00:20:49.47,00:20:49.47," as he is making friends, which is stupid"
461,00:20:51.47,00:20:51.47, 'cause he could have stayed home
462,00:20:52.83,00:20:52.83, and made a bunch of friends.
463,00:20:54.10,00:20:54.10," So, as a partner in an alliance,"
464,00:20:56.63,00:20:56.63, that's not what I'm looking for.
465,00:20:58.33,00:20:58.33,And then I met Deena.
466,00:21:00.17,00:21:00.17,"DEENA: Okay, so, like,what's our plan here?"
467,00:21:02.17,00:21:02.17,-For what?-You don't know?
468,00:21:04.13,00:21:04.13,-Strategy?-Yeah.
469,00:21:05.67,00:21:05.67,I have to tell you-- 'cause I...I have Jenna and Heidi.
470,00:21:08.10,00:21:08.10,"Oh, definitely."
471,00:21:09.23,00:21:09.23,I'd hate... I'd hateto vote out Alex
472,00:21:10.63,00:21:10.63,"just like you'd hateto vote out Shawna,"
473,00:21:12.17,00:21:12.17,but we have to dowhat we have to do.
474,00:21:14.33,00:21:14.33,But your friends--you've known them for 16 days.
475,00:21:17.70,00:21:17.70,Exactly.
476,00:21:19.57,00:21:19.57,"ROB: Deena is as hungry as I am,"
477,00:21:21.93,00:21:21.93,and she's the kind of personthat nobody would suspect
478,00:21:24.50,00:21:24.50,I would have anythingin common with.
479,00:21:26.57,00:21:26.57,You mind beingwith a bunch of chicks?
480,00:21:28.30,00:21:28.30,I... could do worse.
481,00:21:29.87,00:21:29.87,'Cause my strategyfrom the beginning
482,00:21:31.43,00:21:31.43,"was, once the part with the guyswas going to... was-was over,"
483,00:21:34.53,00:21:34.53,-I was going to turn on theguys. -Yeah.
484,00:21:36.77,00:21:36.77,Because I knew I wasn't partof their final three.
485,00:21:38.93,00:21:38.93,"DEENA: Rob approached me,"
486,00:21:40.33,00:21:40.33,"and he said,""Listen, I need some help."""
487,00:21:44.67,00:21:44.67,"And I said,""Listen, I need some help."""
488,00:21:47.20,00:21:47.20,I would like to get ridof Matthew.
489,00:21:49.23,00:21:49.23,"He's... he annoys me to death,"
490,00:21:50.87,00:21:50.87,but I'm just going to haveto suck it up and get over it
491,00:21:54.13,00:21:54.13,'cause we're going to need himfor a while.
492,00:21:56.23,00:21:56.23,"ROB: After my conversation with Deeny,"
493,00:21:58.43,00:21:58.43,"I realized that, number one,Matthew does catch a lot of fish"
494,00:22:02.30,00:22:02.30," and that we were going to need his vote, so I have come"
495,00:22:07.03,00:22:07.03,to an understanding that weprobably will need Matthew.
496,00:22:11.90,00:22:11.90,"Okay, let's say we losethe immunity challenge."
497,00:22:15.07,00:22:15.07,"-Right.-Which... which, you know,"
498,00:22:16.63,00:22:16.63,"I would like to avoidat all costs,"
499,00:22:18.60,00:22:18.60,"but then, if we go to a merge..."
500,00:22:20.37,00:22:20.37,"-Right. -...then we go backto Roger, Butch and Dave"
501,00:22:24.97,00:22:24.97,and tell them that we've stayedwith them all along.
502,00:22:27.67,00:22:27.67,-Right. -And that allthe guys are sticking together.
503,00:22:29.77,00:22:29.77,"-Right. -And that we're goingto go after one of the girls,"
504,00:22:32.43,00:22:32.43,-but...-Basically divert their votes.
505,00:22:34.07,00:22:34.07,"Yes, we divert their votes,"
506,00:22:35.67,00:22:35.67,and then we goafter Dave or Roger.
507,00:22:38.37,00:22:38.37,I think that'd be great.
508,00:22:40.27,00:22:40.27,"MATTHEW: Rob and I went fishing alone for the first time,"
509,00:22:44.10,00:22:44.10, and it was really nice because I realized at Tambaqui that
510,00:22:47.77,00:22:47.77,"he chose to maintainhis distance,"
511,00:22:50.53,00:22:50.53,"uh, out of insecurity."
512,00:22:52.93,00:22:52.93, Seemed like a real genuine offer
513,00:22:55.37,00:22:55.37, to build a better relationship
514,00:22:57.23,00:22:57.23,and help one another throughoutthe remainder of the game.
515,00:23:00.93,00:23:00.93,You don't think there'sanything shifty underway.
516,00:23:02.93,00:23:02.93,-No. -There haven't been...you haven't had any...
517,00:23:04.93,00:23:04.93,had any sidebar conversationswith anyone?
518,00:23:06.57,00:23:06.57,"No, there's noth...there's nothing shifty going on."
519,00:23:08.20,00:23:08.20,-Right. -It's going to be...everybody's being
520,00:23:10.13,00:23:10.13,"-pretty genuine.-I like Shawna, though."
521,00:23:11.40,00:23:11.40,"I definitely think that there's,you know..."
522,00:23:13.40,00:23:13.40,"I mean, it's not...I'm not, like, you know,"
523,00:23:15.10,00:23:15.10,"-scoping for affection,that's for sure. -Yeah."
524,00:23:17.63,00:23:17.63,ROB: Matthew has no idea that he's being played by myself.
525,00:23:21.13,00:23:21.13,The guy is a complete idiotand has no concept
526,00:23:24.10,00:23:24.10,of what's going onin this game around him.
527,00:23:28.10,00:23:28.10,-Got it?-Yeah.
528,00:23:29.70,00:23:29.70,Nice.
529,00:23:31.17,00:23:31.17,"Dude, here they come."
530,00:23:33.53,00:23:33.53,ROB: I don't know
531,00:23:34.70,00:23:34.70,if Matthew believesthat he is a threat.
532,00:23:37.07,00:23:37.07,DEENA:Holy crapola.
533,00:23:38.63,00:23:38.63,"Oh, yeah. Ooh!"
534,00:23:42.00,00:23:42.00,I know for a fact that he'sa physical threat in this game.
535,00:23:46.90,00:23:46.90," As long as he keeps catching fish, we'll keep him around,"
536,00:23:49.93,00:23:49.93, but as soon as he stops catching fish
537,00:23:52.37,00:23:52.37," or stops doing what we tell him to,"
538,00:23:54.37,00:23:54.37,he's out.
539,00:24:14.90,00:24:14.90,"JENNA:Well, like, if you were to sweep"
540,00:24:16.00,00:24:16.00,"a girl off her feet,what would you do?"
541,00:24:17.60,00:24:17.60,-What would I do? Dependson the girl. -Let's do this.
542,00:24:20.03,00:24:20.03,"You guys both take Shawna out,sweep her off her feet."
543,00:24:22.10,00:24:22.10,-Me... I'm taking Shawna out?-And sweep me off my feet.
544,00:24:23.90,00:24:23.90,"-Al-Alex and me are both takingShawna out? -No, one at a time."
545,00:24:26.23,00:24:26.23,"I want to hear Mateoon this one, too."
546,00:24:28.13,00:24:28.13,"-JENNA: Yeah, I do... -Mateo,we're playing ""The Dating Game."""
547,00:24:29.83,00:24:29.83,"-You have to date me.-Oh, cool."
548,00:24:31.63,00:24:31.63,"SHAWNA: At nighttime, it gets dark really early,"
549,00:24:33.93,00:24:33.93,and you got to make your own fun
550,00:24:35.20,00:24:35.20,if you're goingto stay alive out here.
551,00:24:36.57,00:24:36.57,"So tonight's ""The Dating Game."""
552,00:24:38.17,00:24:38.17, And I had to decide-- I was critiquing dates
553,00:24:40.80,00:24:40.80, and figuring out what I wanted to do.
554,00:24:42.40,00:24:42.40,DEENA:Who's going first?
555,00:24:43.70,00:24:43.70,-I'll go first.-Okay.
556,00:24:45.03,00:24:45.03,Start the dateprobably late morning.
557,00:24:48.70,00:24:48.70,Shawna's already made it clearthat she likes to shop.
558,00:24:50.37,00:24:50.37,Really going out on a limb--girls like to shop.
559,00:24:52.60,00:24:52.60,Then we'd have to go climbing.
560,00:24:55.30,00:24:55.30,"Picnic lunch after climbing,and, um..."
561,00:24:58.27,00:24:58.27,(laughs)you've got to have
562,00:24:59.90,00:24:59.90,-the E.L. Fudge cookiesfor dessert. -Yeah.
563,00:25:02.70,00:25:02.70,"SHAWNA: It was funny,'cause every single one of them"
564,00:25:04.70,00:25:04.70, knows me in a different light.
565,00:25:06.47,00:25:06.47," Every person has different sides they bring out in you,"
566,00:25:07.83,00:25:07.83, so it was kind of cool to see
567,00:25:09.23,00:25:09.23,the different versionsthey came up with
568,00:25:11.47,00:25:11.47,of who they thoughtI ideally would want.
569,00:25:14.77,00:25:14.77,-Nicely done.-Bachelor number two.
570,00:25:16.30,00:25:16.30,I'd say Shawna has arrivedthe night before.
571,00:25:19.20,00:25:19.20,"She's, uh, well rested."
572,00:25:21.17,00:25:21.17,"I've rented a,uh, chauffeur-driven limo."
573,00:25:24.27,00:25:24.27,We get to the top of a...of a beautiful hill
574,00:25:28.17,00:25:28.17,"with a...like, a magnificent view."
575,00:25:30.30,00:25:30.30,An unparalleled view.
576,00:25:32.30,00:25:32.30,"MATTHEW: I was definitely at a loss, because D.C."
577,00:25:35.07,00:25:35.07," does not have, uh, as many cool places to go"
578,00:25:37.80,00:25:37.80, or things to do as New York City or L.A.
579,00:25:42.07,00:25:42.07,But I do thinkthat it's an opportunity
580,00:25:44.17,00:25:44.17,"to kind of, uh, build somethingwith Shawna because, uh,"
581,00:25:47.03,00:25:47.03, there's definitely potential there.
582,00:25:49.27,00:25:49.27,"-JENNA: Rob.-It's you, Rob."
583,00:25:51.20,00:25:51.20,"It's a Wednesday afternoon,"
584,00:25:53.60,00:25:53.60,and it's Christmastimein New York.
585,00:25:55.40,00:25:55.40,-Aw.-Very cool.
586,00:25:57.33,00:25:57.33,"-Good touch.-Yeah, very good."
587,00:25:59.93,00:25:59.93,The thingabout Wednesday afternoons
588,00:26:01.70,00:26:01.70,"is that there's alwaysa matinee on Broadway,"
589,00:26:04.50,00:26:04.50,and we've got theater tickets.
590,00:26:06.30,00:26:06.30,And we're going to go downto Rockefeller Center.
591,00:26:08.33,00:26:08.33,"-Oh, yeah. -And we're goingto go ice-skating."
592,00:26:10.17,00:26:10.17,-Mm-hmm.-Yes!
593,00:26:11.90,00:26:11.90,-Good call.-ROB: In the plaza.
594,00:26:13.07,00:26:13.07,Well done.
595,00:26:14.37,00:26:14.37,"SHAWNA: Physically, I'm still really weak,"
596,00:26:15.73,00:26:15.73, but my mind has definitely taken over my body.
597,00:26:17.57,00:26:17.57," I-I got this great, new, positive outlook with the guys"
598,00:26:21.27,00:26:21.27, that saved me from the women.
599,00:26:23.20,00:26:23.20, I just wasn't having fun.
600,00:26:25.67,00:26:25.67," I just... I need that presence in my life,"
601,00:26:27.77,00:26:27.77, and... and they're just great guys.
602,00:26:29.90,00:26:29.90, They make me laugh.
603,00:26:30.90,00:26:30.90,"SHAWNA:Rob, it's you."
604,00:26:32.00,00:26:32.00,"That was the most incredibledate, ever."
605,00:26:34.30,00:26:34.30,-What? I won?-You won!
606,00:26:51.07,00:26:51.07,Oh.
607,00:26:54.07,00:26:54.07,"MATTHEW:Oh, that feels good."
608,00:26:55.50,00:26:55.50,Will you back-scratchwhile I sleep?
609,00:26:57.63,00:26:57.63,Is that what you're getting?
610,00:26:59.50,00:26:59.50,Might as well be.
611,00:27:01.50,00:27:01.50,"ALEX: As Shawna and I have become a little closer,"
612,00:27:04.20,00:27:04.20, Matt starts trying to bring
613,00:27:05.57,00:27:05.57,the focus back aroundto his romantic situations.
614,00:27:10.33,00:27:10.33, And when Shawna and I
615,00:27:11.50,00:27:11.50, were kind of cuddled up sleeping
616,00:27:12.93,00:27:12.93," and Matt started to use her as a pillow,"
617,00:27:15.40,00:27:15.40, I think that Matt might be feeling a little left out.
618,00:27:19.57,00:27:19.57,DEENA: Shawna all of a sudden has this miraculous recovery
619,00:27:22.13,00:27:22.13," now that the boys enter the camp,"
620,00:27:23.60,00:27:23.60, but she has essentially done
621,00:27:24.93,00:27:24.93, very little since day three.
622,00:27:26.90,00:27:26.90,Shawna isn't working Mattas much as Alex.
623,00:27:31.43,00:27:31.43,Shawna's still flirtatiouswith Matt.
624,00:27:33.23,00:27:33.23, But anybody who gets together exclusively
625,00:27:35.57,00:27:35.57, against all others poses a threat to me.
626,00:27:45.23,00:27:45.23,BUTCH:Think we got anything?
627,00:27:47.63,00:27:47.63,What do you think?
628,00:27:48.87,00:27:48.87,Okay.
629,00:27:50.97,00:27:50.97,Oh.
630,00:27:56.83,00:27:56.83,I don't want to meet the dogthis goes to.
631,00:28:01.63,00:28:01.63,BUTCH:We got mail!
632,00:28:02.87,00:28:02.87,DAVE:Yeah!
633,00:28:04.80,00:28:04.80,ROGER:What does it say?
634,00:28:06.53,00:28:06.53,"""Feeding frenzy."
635,00:28:08.20,00:28:08.20,"""Are you up to the task?"
636,00:28:10.10,00:28:10.10,"-""Who's more voracious...-""Voracious..."""
637,00:28:12.40,00:28:12.40,"...three more days will last."""
638,00:28:16.17,00:28:16.17,"DAVE: ""Voracious"" sounds likethey had"
639,00:28:18.10,00:28:18.10,"-(Heidi mumbling) -a big, bigpile of something,"
640,00:28:20.53,00:28:20.53,and the first team to finishall the big pile of something.
641,00:28:22.30,00:28:22.30,"-I'm thinking that's right.-That's possible, too."
642,00:28:24.03,00:28:24.03,"I think that's right, guys."
643,00:28:25.27,00:28:25.27,"Christy, is that good for youor bad for you?"
644,00:28:27.03,00:28:27.03,"-I think I can do it.-No, no, no. No, no, no, no."
645,00:28:29.03,00:28:29.03,You're going to do it.
646,00:28:30.17,00:28:30.17,-I am going to do it.-All right. -That's right.
647,00:28:42.50,00:28:42.50,"PROBST:Welcome, guys."
648,00:28:44.03,00:28:44.03,"First things first.Rob, you know the drill."
649,00:28:45.83,00:28:45.83,-I know it.-Immunity.
650,00:28:49.00,00:28:49.00,"Once again, back up for grabs."
651,00:28:50.63,00:28:50.63,Today's immunity challenge
652,00:28:52.07,00:28:52.07,is going to bea Survivor frenzy.
653,00:28:54.33,00:28:54.33,It's not a lot differentfrom what happens
654,00:28:56.73,00:28:56.73,when you get a group
655,00:28:58.00,00:28:58.00," of piranha and they get a fresh piece of meat,"
656,00:29:00.30,00:29:00.30, and they just begin to attack that meat.
657,00:29:02.53,00:29:02.53,You're going to participateas a tribe.
658,00:29:04.10,00:29:04.10," You each have a piece of beef, weighs the same amount."
659,00:29:07.30,00:29:07.30,"With your hands tiedbehind your back,"
660,00:29:09.33,00:29:09.33,you're going to tear off
661,00:29:10.63,00:29:10.63,as much of that meat as you canin ten minutes.
662,00:29:13.37,00:29:13.37,"Whichever tribe hasthe most meat in their basket,"
663,00:29:15.93,00:29:15.93,"measured by weight,wins immunity."
664,00:29:19.47,00:29:19.47,"Jaburu, sat out Deena last time."
665,00:29:21.70,00:29:21.70,Can't sit out the same personin back-to-back challenges.
666,00:29:23.77,00:29:23.77,-Who's sitting out?-All right.
667,00:29:25.20,00:29:25.20,"-Jenna, you're sitting out?-Yeah, I'll sit."
668,00:29:26.97,00:29:26.97,"Okay, everybody else,take your spot, wait for my go."
669,00:29:29.73,00:29:29.73,Here we go.
670,00:29:31.43,00:29:31.43,For immunity.
671,00:29:33.10,00:29:33.10,Survivors ready.Go!
672,00:29:38.47,00:29:38.47,Both tribesgetting at it quickly.
673,00:29:44.97,00:29:44.97,"That a way to work, Jaburu."
674,00:29:50.13,00:29:50.13,Shawna using the sideof her face to hold it steady.
675,00:29:54.07,00:29:54.07,There you go.
676,00:29:57.60,00:29:57.60,Butch using his faceto hold it steady.
677,00:29:59.40,00:29:59.40,"-Took one in the mouth.-Come on, Dave."
678,00:30:01.20,00:30:01.20,"Come on, Dave, get in there."
679,00:30:03.17,00:30:03.17,-Get opposite me.-HEIDI: Get opposite. Right.
680,00:30:05.63,00:30:05.63,Hold it.
681,00:30:07.00,00:30:07.00,PROBST:Tambaqui with a good strategy.
682,00:30:14.63,00:30:14.63,Tambaqui has two kilograms.
683,00:30:16.17,00:30:16.17,"That a way, Butch."
684,00:30:17.27,00:30:17.27,Make sure and get itin the basket.
685,00:30:18.90,00:30:18.90,Got to be in the basketto count.
686,00:30:20.60,00:30:20.60,-Underneath. Underneath.-Good stuff underneath?
687,00:30:23.37,00:30:23.37,PROBST:Jaburu has two kilograms.
688,00:30:25.50,00:30:25.50,We're dead even.
689,00:30:26.97,00:30:26.97,"Whoa, whoa, whoa."
690,00:30:28.47,00:30:28.47,-PROBST: Two minutes in.-All the way under.
691,00:30:30.13,00:30:30.13,Dave getting a mouthful.
692,00:30:31.37,00:30:31.37,"Here, Dave. Get it, Dave.Get it, Dave."
693,00:30:33.00,00:30:33.00,Butch with a good strategy.
694,00:30:34.30,00:30:34.30,"-You're the workhorse.-Come on, Dave."
695,00:30:35.53,00:30:35.53,"-You're holding that steady.-Come on, Dave."
696,00:30:36.93,00:30:36.93,Tambaqui has three kilograms.
697,00:30:40.00,00:30:40.00,"That a way to work, Jaburu."
698,00:30:41.87,00:30:41.87,Jaburu has three kilograms.
699,00:30:45.50,00:30:45.50,-You guys are dead even.-(indistinct voices)
700,00:30:48.03,00:30:48.03,Three kilograms each.
701,00:30:49.53,00:30:49.53,Matthew's got a mouthful.Dropped it.
702,00:30:51.37,00:30:51.37,"Oh, Deena stepped on it."
703,00:30:53.13,00:30:53.13,"Matthew picking it upoff the ground, anyway."
704,00:30:55.70,00:30:55.70,You're going to needsome dental floss tonight.
705,00:30:56.97,00:30:56.97,Dave with a big piece.
706,00:30:59.53,00:30:59.53,That moved the scale.
707,00:31:01.10,00:31:01.10,Tambaqui with four kilograms.
708,00:31:02.93,00:31:02.93,Roger can't get itout of his mouth.
709,00:31:04.67,00:31:04.67,-It's stuck in his teeth.-Bite it out of my mouth.
710,00:31:07.07,00:31:07.07,"PROBST: Wow, Butch just tooka piece out of Roger's mouth."
711,00:31:09.47,00:31:09.47,-That's teamwork.-Whatever.
712,00:31:11.53,00:31:11.53,(Shawna groans)
713,00:31:13.73,00:31:13.73,"PROBST: Tambaqui with a slightlead, just over four kilograms."
714,00:31:17.10,00:31:17.10,Rob going for a big piece.
715,00:31:19.23,00:31:19.23,Matthew helping out.
716,00:31:21.20,00:31:21.20,You guys need it.
717,00:31:22.50,00:31:22.50,Nice piece by Rob.
718,00:31:24.03,00:31:24.03,(groaning)
719,00:31:26.70,00:31:26.70,"-Tambaqui at six kilograms.-Go, go, go, go!"
720,00:31:28.77,00:31:28.77,-PROBST: Jaburuat five kilograms. -Right there.
721,00:31:31.37,00:31:31.37,PROBST:Dave getting a mouthful.
722,00:31:33.10,00:31:33.10,"Alex and Matthew, nice teamwork."
723,00:31:35.20,00:31:35.20,"-Jaburu's caught up. -Thereyou go, right there, Matthew."
724,00:31:37.50,00:31:37.50,Bite down harderand peel it back.
725,00:31:38.77,00:31:38.77,"-That's it, that's it!-Yeah!"
726,00:31:40.13,00:31:40.13,PROBST:Huge piece for Jaburu.
727,00:31:41.80,00:31:41.80,Jaburu now in the leadat seven kilograms.
728,00:31:44.37,00:31:44.37,Tambaqui at six kilograms.
729,00:31:46.67,00:31:46.67,Tambaqui's lead slipping away.
730,00:31:47.97,00:31:47.97,"-Go, Heidi.-Go!"
731,00:31:49.50,00:31:49.50,-PROBST: Heidiwith a huge piece. -Hold on.
732,00:31:52.50,00:31:52.50,Jaburu and Tambaqui tied upwith that piece.
733,00:31:54.50,00:31:54.50,"Rip that off, Rob.Get that huge piece, you guys."
734,00:31:58.13,00:31:58.13,PROBST:Three minutes left.
735,00:32:00.50,00:32:00.50,"-Rob going for a big piece.-Keep going. Keep ripping, go."
736,00:32:02.60,00:32:02.60,PROBST:Huge piece for Jaburu.
737,00:32:05.27,00:32:05.27,Jaburu and Tambaquitied up with that piece.
738,00:32:09.67,00:32:09.67,It comes downto the last 60 seconds.
739,00:32:11.63,00:32:11.63,Everybody needs to be chewing.
740,00:32:12.77,00:32:12.77,"Everybody, chew, chew, chew.Go!"
741,00:32:16.03,00:32:16.03,(indistinct chatter)
742,00:32:19.07,00:32:19.07,Right here.
743,00:32:20.43,00:32:20.43,-Mmm.-Mmm. Ow.
744,00:32:21.77,00:32:21.77,-Aah!-Sorry.
745,00:32:22.93,00:32:22.93,PROBST:15 seconds!
746,00:32:24.10,00:32:24.10,"-HEIDI: Sorry, Roger.-It's all right."
747,00:32:25.27,00:32:25.27,-I'm so sorry.-15 seconds.
748,00:32:26.53,00:32:26.53,"Quickly, quickly."
749,00:32:28.50,00:32:28.50,"PROBST:Ten, nine, eight, seven,"
750,00:32:32.43,00:32:32.43,"six, five, four,"
751,00:32:35.43,00:32:35.43,"three, two, one. That's it!"
752,00:32:39.20,00:32:39.20,"Great competition, guys.Very close."
753,00:32:43.70,00:32:43.70,"Jaburu, let's check your scale."
754,00:32:48.00,00:32:48.00,"Jaburu,just under nine kilograms."
755,00:32:53.57,00:32:53.57,Checking Tambaqui's scale.
756,00:32:57.43,00:32:57.43,-Tambaqui just overnine kilograms. -(whooping)
757,00:33:00.53,00:33:00.53,"By a tiny margin,Tambaqui wins immunity."
758,00:33:03.77,00:33:03.77,(cheering and murmuring)
759,00:33:08.50,00:33:08.50,"Tambaqui, immunity goesback over to you. Well earned."
760,00:33:11.17,00:33:11.17,"-Try and keep it clean,would you? -Yeah. -Nice."
761,00:33:13.67,00:33:13.67,"-Nice. -Nice effort, guys.-Good job, guys."
762,00:33:15.67,00:33:15.67,-Whoo!-Safe from the vote.
763,00:33:16.70,00:33:16.70,Three more days in the Amazon.
764,00:33:18.13,00:33:18.13,"-Good job, guys. -Great job,guys. -Really proud of you guys."
765,00:33:20.37,00:33:20.37,"Jaburu, Tribal Council tonight."
766,00:33:23.13,00:33:23.13,"Sadly, somebody's going home."
767,00:33:24.60,00:33:24.60,"Head back to camp,get your stuff."
768,00:33:25.90,00:33:25.90,I'll see you over there.
769,00:33:35.63,00:33:35.63,(grunting)
770,00:33:37.70,00:33:37.70, Tambaqui!
771,00:34:03.97,00:34:03.97,"Any thoughts, anyone?"
772,00:34:08.50,00:34:08.50,"Well, I'll makea completely selfish statement,"
773,00:34:10.20,00:34:10.20,"'cause I'm... there's nohold bars here,"
774,00:34:11.70,00:34:11.70,"'cause I've been completelyhonest to begin with,"
775,00:34:13.43,00:34:13.43,and I don't want to go.
776,00:34:14.87,00:34:14.87,SHAWNA: I have to agree withDeena. I already told you guys.
777,00:34:17.30,00:34:17.30,I don't want either of the twogirls going before I do.
778,00:34:20.63,00:34:20.63,So I'll put my headon the chopping block.
779,00:34:22.53,00:34:22.53,"No, I don't want to,I don't want to go at all,"
780,00:34:24.70,00:34:24.70,"but I'm just saying, for thegirls' side, I'm, uh... I'm on."
781,00:34:29.13,00:34:29.13,"You had, like, this whole180-degree turnaround"
782,00:34:32.30,00:34:32.30,in your attitude just by stayingout here and being part
783,00:34:35.33,00:34:35.33,"of what happened when-whenthis switch took place,"
784,00:34:37.50,00:34:37.50,and that's awesome.
785,00:34:39.17,00:34:39.17,You guys are goingto make me me cry.
786,00:34:41.03,00:34:41.03,"Let's be honest.The reality is,"
787,00:34:42.97,00:34:42.97,"most likely,the choice is me or Matt."
788,00:34:45.37,00:34:45.37,"And Matt, I-I...I hope you don't take this"
789,00:34:47.87,00:34:47.87,"personally at all, that myvote's going your way, just..."
790,00:34:50.63,00:34:50.63,-Yeah. -...for the reasonthat I don't want
791,00:34:52.13,00:34:52.13,"-to vote any of them off.-Well, I would, uh,"
792,00:34:53.77,00:34:53.77,"for the same reason,trade votes with you."
793,00:34:56.47,00:34:56.47,"JENNA:  I don't know where to fall,"
794,00:34:57.87,00:34:57.87," because I don't want to vote for Shawna,"
795,00:34:59.37,00:34:59.37, 'cause I do feel close to her right now.
796,00:35:01.47,00:35:01.47,"I-I like her company, and"
797,00:35:03.97,00:35:03.97," between her and Matt,"
798,00:35:05.20,00:35:05.20, I like her company more than Matt's company.
799,00:35:06.97,00:35:06.97,My vote's probablygoing to Matt.
800,00:35:09.60,00:35:09.60,"And I don't want to do it,but I'm not getting rid of Alex."
801,00:35:13.80,00:35:13.80,He's helpedpull me through this.
802,00:35:17.03,00:35:17.03,ROB: I really thought that this meeting was going to go
803,00:35:20.03,00:35:20.03," that Shawna was going to say, ""Guys, you can vote me out,"""
804,00:35:23.00,00:35:23.00, and then everybody was going to start to get emotional.
