,begin,end,subtitles_text
805,00:35:25.87,00:35:25.87," Now Alex is saying he's going to vote for Matt,"
806,00:35:28.53,00:35:28.53, just because he won't vote for Shawna.
807,00:35:31.47,00:35:31.47," And Shawna says she's going to vote for Matt,"
808,00:35:33.37,00:35:33.37," so now Matt has two votes out of six, so"
809,00:35:35.97,00:35:35.97, this is really going to...  could go either way.
810,00:35:37.63,00:35:37.63,Either Mattor Shawna could get the boot.
811,00:35:40.00,00:35:40.00," Now, up until the other day, I was very excited"
812,00:35:42.43,00:35:42.43," about the prospect of getting rid of Matt,"
813,00:35:44.47,00:35:44.47, but I've been putting a lot of energy
814,00:35:45.47,00:35:45.47, into talking to this guy--
815,00:35:47.03,00:35:47.03, which is absolutely exhausting--
816,00:35:48.60,00:35:48.60, trying to get him on my side.
817,00:35:50.00,00:35:50.00,And now that I got the guyeating out
818,00:35:52.00,00:35:52.00,"of the palm of my hand,we're going to vote him off."
819,00:35:54.00,00:35:54.00,It sucks that the people
820,00:35:55.97,00:35:55.97,that I want to go areall on the other tribe.
821,00:35:59.57,00:35:59.57,(Shawna laughs)
822,00:36:02.07,00:36:02.07,(thunder rumbling)
823,00:36:32.23,00:36:32.23,Got a weird vibe tonight.
824,00:36:33.67,00:36:33.67,Is it sad tonight already?
825,00:36:36.67,00:36:36.67,"Yeah, you guys definitely have alook that I haven't seen before."
826,00:36:40.80,00:36:40.80,"Shawna, what's going on?"
827,00:36:42.73,00:36:42.73,"Well, I don't think anyone wantsto be here right now."
828,00:36:47.10,00:36:47.10,And we were so jazzed. The lastthing we want to do right now--
829,00:36:49.67,00:36:49.67,we had such a phenomenalchemistry between the six
830,00:36:52.77,00:36:52.77,of us-- and no one wants to seeanyone go.
831,00:36:56.10,00:36:56.10,But... we're here.
832,00:36:57.53,00:36:57.53,"And so, it's a total bummer."
833,00:36:59.60,00:36:59.60,"PROBST:Alex, anybody that you think,"
834,00:37:01.73,00:37:01.73,"""I almost wishI had met you back home,"
835,00:37:03.23,00:37:03.23,"""because this experienceis so weird that"
836,00:37:06.27,00:37:06.27,"it might make it hardto pursue anything?"""
837,00:37:08.30,00:37:08.30,"Yeah, totally."
838,00:37:09.77,00:37:09.77,"If I met Shawna not here,"
839,00:37:12.00,00:37:12.00,"yeah, totally, I'd be...I'd be all about,"
840,00:37:15.17,00:37:15.17,"like, asking her out and hangingout with her. She's awesome."
841,00:37:17.27,00:37:17.27,"PROBST:Deena, you're noticing this..."
842,00:37:18.77,00:37:18.77,"yeah, something's happening."
843,00:37:20.27,00:37:20.27,"Oh, yeah, there's some...there's some sexual heat there."
844,00:37:22.57,00:37:22.57,(laughter)
845,00:37:24.80,00:37:24.80,"No, it's been a lot of fun,and I-I do call it"
846,00:37:27.27,00:37:27.27,"the love shack, because, youknow, we all are right there."
847,00:37:29.80,00:37:29.80,"Um, there's a lot of positiveenergy that's being provided,"
848,00:37:33.03,00:37:33.03,"uh, when we talk aboutone another's lives, and"
849,00:37:35.80,00:37:35.80,it-it's really beena lot of fun.
850,00:37:37.90,00:37:37.90,"Now, within the love shack,"
851,00:37:39.80,00:37:39.80,"you still have to stay dry,you still have to eat."
852,00:37:43.33,00:37:43.33,"Matthew, let's talk aboutwhat's happening with roles."
853,00:37:46.27,00:37:46.27,"I relish the roleof, uh, provider, because"
854,00:37:51.47,00:37:51.47,"I think thatwe as a group need to eat well,"
855,00:37:55.90,00:37:55.90,and eating 12 fishfor dinner really is a...
856,00:37:59.83,00:37:59.83,is a great thing.
857,00:38:01.73,00:38:01.73,"Rob, what's your role?You're always good for a laugh."
858,00:38:04.40,00:38:04.40,Is that your role?
859,00:38:05.63,00:38:05.63,I like to tryto keep the tribe entertained.
860,00:38:08.23,00:38:08.23,I feel like anytimethat we're bored
861,00:38:10.70,00:38:10.70,"or just sitting arounddoing nothing,"
862,00:38:12.27,00:38:12.27,"that our energy levelis just sinking,"
863,00:38:13.93,00:38:13.93,"so I'm always tryingto think of a bunch of games,"
864,00:38:16.23,00:38:16.23,"or stupid songs to sing,or, you know, any sort of thing"
865,00:38:19.47,00:38:19.47,"that we could just havea group discussion about,"
866,00:38:21.43,00:38:21.43,"'cause I feel likeit really helps,"
867,00:38:22.50,00:38:22.50,"not only to break the ice,"
868,00:38:23.93,00:38:23.93,but also just to keepeverybody's energy level up.
869,00:38:26.33,00:38:26.33,"-And it's really fun. -PROBST:How about for you, Shawna?"
870,00:38:28.47,00:38:28.47,I know you've had some up daysand some down days
871,00:38:30.97,00:38:30.97,in these first 18 days.
872,00:38:32.50,00:38:32.50,-How are you feeling now?-I'm doing awesome.
873,00:38:35.27,00:38:35.27,I've gone from probablyone of my darkest hours
874,00:38:38.50,00:38:38.50,ever as a person--
875,00:38:39.87,00:38:39.87,"just completely in the dumps,just wanted out,"
876,00:38:43.00,00:38:43.00,"but... and then,all of a sudden, as soon as"
877,00:38:45.23,00:38:45.23,we get this infusion of energy
878,00:38:47.13,00:38:47.13,"from the guys,and the dynamics change,"
879,00:38:48.97,00:38:48.97,"and all of a sudden,the games picked up, and"
880,00:38:51.30,00:38:51.30,"it feels like it's a game,and it's fun..."
881,00:38:53.23,00:38:53.23,"you just.. all of a sudden,"
882,00:38:54.57,00:38:54.57,"I went to the most,like, ultimate high."
883,00:38:56.03,00:38:56.03,I'm glowing these days.
884,00:38:58.03,00:38:58.03,"So, give it to me. You arein this for the long haul then?"
885,00:39:00.90,00:39:00.90,-Are you here? -Of courseI'm in it for the long haul.
886,00:39:03.07,00:39:03.07,"No, I'm...You know, like, what I needed"
887,00:39:05.57,00:39:05.57,"was someone to take my head outof my butt, and they did it."
888,00:39:09.13,00:39:09.13,"Deena, is this a hard votefor you,"
889,00:39:10.97,00:39:10.97,"or because you're not partof this young group,"
890,00:39:13.23,00:39:13.23,"are you ableto just step back and say,"
891,00:39:15.07,00:39:15.07,"""At leastI don't have that headache""?"
892,00:39:17.10,00:39:17.10,"Fortunately, I can say thatI am part of this young group."
893,00:39:19.80,00:39:19.80,I would say that this was...
894,00:39:21.37,00:39:21.37,is the absolute most difficultvote that we have had to date.
895,00:39:25.30,00:39:25.30,"Difficult or not,it is time to vote."
896,00:39:28.47,00:39:28.47,"Jenna, you're up."
897,00:39:54.53,00:39:54.53,"I think you're oneof the nicest people I ever met,"
898,00:39:58.23,00:39:58.23,and you putwhat's good for others
899,00:40:00.27,00:40:00.27,before what's good for you.
900,00:40:02.77,00:40:02.77,"Unfortunately,"
901,00:40:04.30,00:40:04.30,that also makes you a reallyterrible Survivor player.
902,00:40:28.03,00:40:28.03,"Matt, I'm voting for you,because later on down the line,"
903,00:40:31.33,00:40:31.33,"you may be a threat,and, uh, I don't know."
904,00:40:35.23,00:40:35.23,We'll see what happens.
905,00:40:50.07,00:40:50.07,I'll go tally the votes.
906,00:41:01.97,00:41:01.97,"Once the votes are read,the decision is final."
907,00:41:03.97,00:41:03.97,The person voted outwill be asked
908,00:41:05.57,00:41:05.57,to leave the Tribal Council areaimmediately.
909,00:41:07.20,00:41:07.20,I'll read the votes.
910,00:41:10.23,00:41:10.23,First vote--
911,00:41:13.03,00:41:13.03,Shawna.
912,00:41:18.30,00:41:18.30,Matt.
913,00:41:20.43,00:41:20.43,"One vote-- Shawna,one vote-- Matt."
914,00:41:25.30,00:41:25.30,Shawna.
915,00:41:26.60,00:41:26.60,Two votes-- Shawna.
916,00:41:30.63,00:41:30.63,Two votes-- Matt.
917,00:41:33.57,00:41:33.57,"We're tied. Two votes-- Shawna,two votes-- Matt."
918,00:41:40.90,00:41:40.90,That's three votes-- Shawna.
919,00:41:44.80,00:41:44.80,Last vote.
920,00:41:47.93,00:41:47.93,Sixth person voted
921,00:41:48.93,00:41:48.93,out of the Amazon--
922,00:41:50.80,00:41:50.80,Shawna.
923,00:41:52.20,00:41:52.20,You need to bring me your torch.
924,00:42:06.03,00:42:06.03,"Shawna, the tribe has spoken."
925,00:42:22.57,00:42:22.57,"Well, this is certainly"
926,00:42:24.17,00:42:24.17,a rollercoasterof highs and lows.
927,00:42:26.87,00:42:26.87,"And this tribehas already had its fair share,"
928,00:42:29.33,00:42:29.33,including tough decisionslike you had to make tonight.
929,00:42:32.27,00:42:32.27,We're only 18 days in.
930,00:42:33.93,00:42:33.93,"Got to keep your head, because"
931,00:42:35.33,00:42:35.33,there is a lot morestill to come.
932,00:42:37.17,00:42:37.17,"Grab your torches,head back to camp."
933,00:42:39.13,00:42:39.13,Good night.
934,00:42:52.37,00:42:52.37,PROBST: Stay tuned for scenes from our next episode.
935,00:42:58.70,00:42:58.70,PROBST: Next time on Survivor...
936,00:43:01.13,00:43:01.13,-There it is.-Here's the key!
937,00:43:03.73,00:43:03.73,PROBST: The tribes learn the secret of the locked box.
938,00:43:06.53,00:43:06.53,"DEENA: I don't think I have seen Jaburu move that fast,"
939,00:43:09.23,00:43:09.23,ever.
940,00:43:10.13,00:43:10.13,PROBST: And it all comes off at the immunity challenge.
941,00:43:13.03,00:43:13.03,"-Heidi, do you want to pull yourpants down? -BUTCH: Oh, my!"
942,00:43:14.80,00:43:14.80,"-I'm not looking.-Oh, I'm looking."
943,00:43:16.73,00:43:16.73,"-Are you kidding me?-Oh, my God."
944,00:43:22.77,00:43:22.77,I went through so muchin this brief amount of time.
945,00:43:25.37,00:43:25.37,I don't think I've ever hada bigger crash course in life.
946,00:43:28.43,00:43:28.43," At age 24, I never thought"
947,00:43:30.03,00:43:30.03, I'd be so touched by an experience.
948,00:43:32.30,00:43:32.30," My trip may have ended here,"
949,00:43:33.87,00:43:33.87, but this is only the beginning of an absolutely new me.
950,00:43:38.07,00:43:38.07,"You guys, thank you so muchfor the time of my life."
951,00:43:41.13,00:43:41.13,You're awesome.
