,begin,end,subtitles_text
352,00:19:18.40,00:19:18.40,"and I wanted to say, ""You guys grow up."
353,00:19:20.60,00:19:20.60,"You're being babies about it. ""We got something, and anything"
354,00:19:23.17,00:19:23.17,"is better than nothing."" >> The blankets smell like crap."
355,00:19:27.60,00:19:27.60,The hammock smells like crap. The mosquito net smells like
356,00:19:30.93,00:19:30.93,crap. I-I'd call it a ghetto
357,00:19:32.70,00:19:32.70,Christmas. It's like asking for an
358,00:19:34.50,00:19:34.50,Incredible Hulk doll and... and getting your sister's Ken doll
359,00:19:37.57,00:19:37.57,painted green. It's just not the same thing.
360,00:19:42.23,00:19:42.23,>> It's a quick shot to the other side here.
361,00:19:44.23,00:19:44.23,"I've been through here. It's a really thick, thick"
362,00:19:46.07,00:19:46.07,jungle. >> Then just walk along
363,00:19:47.63,00:19:47.63,the coastline... >> Ryno and I are going to have
364,00:19:49.80,00:19:49.80,a go at fishing today with the spear because we
365,00:19:52.07,00:19:52.07,lost all of our fish hooks. So we decided to go on the other
366,00:19:54.70,00:19:54.70,side of the island. The big map indicated some
367,00:19:56.73,00:19:56.73,"dorsal fins, indicating sharks or fish, so we thought,"
368,00:19:59.60,00:19:59.60,"since we haven't had any luck around here, although we've"
369,00:20:02.17,00:20:02.17,"seen some fish, that we thought the other side of the island"
370,00:20:04.87,00:20:04.87,may have a multitude of fish. We going the right way?
371,00:20:16.27,00:20:16.27,What do you think? >> I don't know.
372,00:20:17.93,00:20:17.93,That looks like an opening down there.
373,00:20:19.50,00:20:19.50,See where the light is? >> Let's have a look.
374,00:20:22.00,00:20:22.00,Cool. >> We're going to make it.
375,00:20:26.27,00:20:26.27,>> I can see the coast? >> Yep.
376,00:20:33.37,00:20:33.37,">> There is looting this morning for the Drake Tribe,"
377,00:20:35.53,00:20:35.53,and they'll be coming over to take another item
378,00:20:38.23,00:20:38.23,"from the Morgan Tribe. >> If they want to cripple us,"
379,00:20:45.30,00:20:45.30,"they'll take our pot. They take our pot,"
380,00:20:48.07,00:20:48.07,"Morgan, as we know it, is no longer, 'cause there's"
381,00:20:50.43,00:20:50.43,"no longer... we can't cook food, we can't boil water,"
382,00:20:52.83,00:20:52.83,"we'll be dehydrated, end of game."
383,00:20:56.20,00:20:56.20,>> I hate to do this. >> Whatever.
384,00:20:57.90,00:20:57.90,">> I'm Trish. >> Hi, Trish, I'm Tijuana."
385,00:20:59.67,00:20:59.67,"Nice to meet you. >> Hi, Tijuana."
386,00:21:01.70,00:21:01.70,>> Come on. >> I feel so bad.
387,00:21:03.67,00:21:03.67,">> Yeah, whatever. >> I really do."
388,00:21:05.50,00:21:05.50,>> How are you guys doing over there?
389,00:21:07.17,00:21:07.17,">> We're doing okay. Hi, you guys."
390,00:21:08.80,00:21:08.80,>> Hi. >> I'm Trish.
391,00:21:10.17,00:21:10.17,>> I'm Darrah. >> Nice to meet you.
392,00:21:12.30,00:21:12.30,How are you guys doing? You making out okay?
393,00:21:14.57,00:21:14.57,>> Yeah. Our boys went to go fishing.
394,00:21:16.13,00:21:16.13,">> Oh, they have? Wow, yeah."
395,00:21:27.33,00:21:27.33,>> What? Not any further down?
396,00:21:30.33,00:21:30.33,>> This is definitely The Blair Witch Project.
397,00:21:32.63,00:21:32.63,>> All right. It could be just
398,00:21:36.43,00:21:36.43,a little farther down. >> Do you realize how dangerous
399,00:21:42.53,00:21:42.53,it is to not have water? Yeah.
400,00:21:47.63,00:21:47.63,>> So what do you think you guys are looking for?
401,00:21:49.57,00:21:49.57,>> Um... This is the coolest shelter
402,00:21:52.17,00:21:52.17,you have. >> Thank you.
403,00:21:53.53,00:21:53.53,Our tough men put that together. >> It's nice.
404,00:21:55.83,00:21:55.83,">> Yeah. >> Um, I guess what they want"
405,00:21:58.63,00:21:58.63,is the lantern. >> You guys are gonna take our
406,00:22:01.60,00:22:01.60,lantern? >> I know. I hate it.
407,00:22:03.13,00:22:03.13,"I was trying to talk them into, like, not taking anything."
408,00:22:05.07,00:22:05.07,"I was, like, so shot down, man. I was, like, just no way."
409,00:22:10.00,00:22:10.00,">> We're relieved they didn't take our pot, 'cause that's our"
410,00:22:12.07,00:22:12.07,"only pot, and that's kind of what we were wanting them to"
411,00:22:14.43,00:22:14.43,take was the lantern. That's what we were wanting
412,00:22:16.10,00:22:16.10,them to take last time. We probably ruined it
413,00:22:18.00,00:22:18.00,"by putting cooking oil in it, so it's probably not going to"
414,00:22:20.60,00:22:20.60,work. >> Is that it?
415,00:22:33.53,00:22:33.53,Why is this side so choppy? I thought the other side was
416,00:22:37.07,00:22:37.07,supposed to be calmer. >> That's where I think we are.
417,00:22:40.20,00:22:40.20,">> Oh, yeah? >> Yeah."
418,00:22:41.70,00:22:41.70,>> This is not accurate though. >> Clearly this is not the big
419,00:22:45.57,00:22:45.57,"cove as indicated on the map. It seems to me we went due east,"
420,00:22:50.17,00:22:50.17,pretty much a straight line. We should have hit the cove dead
421,00:22:52.93,00:22:52.93,"on and, uh... we didn't, so it's major league"
422,00:22:56.23,00:22:56.23,"frustrating for us. We need fish very, very badly."
423,00:23:01.33,00:23:01.33,"I mean, we don't have any energy."
424,00:23:03.07,00:23:03.07,We don't have any water. Phenomenally frustrating.
425,00:23:05.60,00:23:05.60,">> Both me and Savage are done. I mean, we're pretty much"
426,00:23:10.07,00:23:10.07,burned-out. I don't even know how long
427,00:23:12.07,00:23:12.07,"we've been out here, but, uh... I think the tribe's going"
428,00:23:14.33,00:23:14.33,"to be a little bit upset that we don't, uh..."
429,00:23:17.07,00:23:17.07,"have anything for them. >> So, last night, I woke up"
430,00:23:38.97,00:23:38.97,in the middle of the night. Couldn't sleep.
431,00:23:41.60,00:23:41.60,I saw that Rupert was up. I'd been meaning to talk to him.
432,00:23:43.87,00:23:43.87,I was a little hesitant because he's so gung-ho
433,00:23:46.43,00:23:46.43,on the whole Drake Tribe. I've been running every
434,00:23:50.63,00:23:50.63,single scenario through my head. >> Yeah?
435,00:23:53.53,00:23:53.53,>> Because you and I are screwed.
436,00:23:56.10,00:23:56.10,You and I are the two toughest of the 16.
437,00:23:58.30,00:23:58.30,">> Right. >> As soon as there's a merge,"
438,00:24:00.60,00:24:00.60,the strongest people are going to be the first people to go.
439,00:24:02.83,00:24:02.83,I know right now Rupert and myself are the biggest threats
440,00:24:04.80,00:24:04.80,"in our tribe. Between Jon, Trish and Sandra,"
441,00:24:07.33,00:24:07.33,"if they do really start putting it together, hell, yeah, they"
442,00:24:09.90,00:24:09.90,should get rid of us now. We don't need to win any more
443,00:24:12.37,00:24:12.37,immunities. >> Right.
444,00:24:15.17,00:24:15.17,">> At some point, we should lose."
445,00:24:18.90,00:24:18.90,"We can do it, but we have to get rid of Christa, and we have"
446,00:24:22.40,00:24:22.40,"to get rid of Trish, and we have to do it soon."
447,00:24:25.90,00:24:25.90,Can you do that? If to keep us... to keep this
448,00:24:29.30,00:24:29.30,"tribe together, yeah. Heck, yeah, I can."
449,00:24:31.70,00:24:31.70,>> That's what I wanted to hear. >> When Burt comes to me and
450,00:24:34.87,00:24:34.87,"says, ""We're going to get rid of some of our Drakes..."""
451,00:24:37.47,00:24:37.47,"As soon as he said that, I wanted to smack him"
452,00:24:39.93,00:24:39.93,"and say, you know, ""Traitor."" If this was a pirate culture,"
453,00:24:42.67,00:24:42.67,"he'd already be dead. >> If we go to immunity,"
454,00:24:45.47,00:24:45.47,"and we don't win, and we get rid of Christa,"
455,00:24:47.53,00:24:47.53,"we're in a good position. But, God, we've got to get rid"
456,00:24:49.90,00:24:49.90,of Christa. So this conversation is between
457,00:24:51.90,00:24:51.90,"you and me. >> Oh, most definitely."
458,00:24:53.37,00:24:53.37,">> And, as long as no one else knows, we can run the game."
459,00:24:57.03,00:24:57.03,">> Right. >> Knock, knock."
460,00:25:10.40,00:25:10.40,Who's there? Sea mail.
461,00:25:12.40,00:25:12.40,Sea mail who? Sea mail.
462,00:25:19.37,00:25:19.37,"""Familiar with the game of checkers?"
463,00:25:21.17,00:25:21.17,"""Familiar with the game of chess?"
464,00:25:23.77,00:25:23.77,"""Heard of professional wrestling?"
465,00:25:26.43,00:25:26.43,">> Uh-oh. >> ""Combined make a worthy"
466,00:25:28.47,00:25:28.47,"test."" >> ""Formulating strategies,"
467,00:25:31.53,00:25:31.53,"""take some time to think. To avoid the next"
468,00:25:33.77,00:25:33.77,"""Tribal Council, send your opponent in the drink."""
469,00:25:38.23,00:25:38.23,">> In the water, homes. >> Full contact chess, man."
470,00:25:40.70,00:25:40.70,">> Someone has to be dunked? >> We are, as a group, thinking"
471,00:25:44.63,00:25:44.63,"about throwing the challenge. The alliance that I'm with,"
472,00:25:47.33,00:25:47.33,we're all ready to get Christa out right now.
473,00:25:50.00,00:25:50.00,"And, therefore, are willing to back off from the challenge,"
474,00:25:52.97,00:25:52.97,and not give it 100%. >> My alliance is interested
475,00:26:11.10,00:26:11.10,in throwing the challenge to cut out a little bit of
476,00:26:13.73,00:26:13.73,"cancer in our tribe: namely, Burton."
477,00:26:17.47,00:26:17.47,"In that, I can sit out on a challenge."
478,00:26:19.43,00:26:19.43,"I already told them that, if I'm in a challenge,"
479,00:26:21.50,00:26:21.50,there's no way in hell that I would lose.
480,00:26:23.63,00:26:23.63,Throwing a challenge is the stupidest thing
481,00:26:26.10,00:26:26.10,that Drake could ever do. But will I stand back
482,00:26:29.97,00:26:29.97,"and let them do it? Yes, if that's what they want"
483,00:26:33.00,00:26:33.00,"to do. >> PROBST: Welcome, Drake,"
484,00:26:44.03,00:26:44.03,Morgan. First things first.
485,00:26:45.63,00:26:45.63,"Burton, I need the immunity idol."
486,00:26:48.03,00:26:48.03,Get that up here. Immunity back up for grabs.
487,00:26:55.33,00:26:55.33,"Okay. For today's immunity challenge, once again we look"
488,00:26:58.67,00:26:58.67,"to the world of pirates. Back in the day,"
489,00:27:01.43,00:27:01.43,"when they ruled the seas, it was only a matter of time"
490,00:27:04.27,00:27:04.27,before they wanted to board your ship.
491,00:27:06.17,00:27:06.17,And the only way to stop them from doing that was to engage
492,00:27:09.30,00:27:09.30,in battle. Each tribe member will move one
493,00:27:11.90,00:27:11.90,space at a time across the platform.
494,00:27:13.80,00:27:13.80,Your goal: get to the other side.
495,00:27:15.90,00:27:15.90,"If you are blocked by another tribe member,"
496,00:27:18.67,00:27:18.67,you will have to engage in a showdown.
497,00:27:20.57,00:27:20.57,"When two people decide to show down, it will be"
498,00:27:23.30,00:27:23.30,a battle of strength and balance.
499,00:27:25.53,00:27:25.53,"First person to hit the water is out, has to swim back to the"
500,00:27:29.70,00:27:29.70,"beginning, start again. The winner moves forward"
501,00:27:31.97,00:27:31.97,one space. The first tribe to get all their
502,00:27:34.60,00:27:34.60,tribe members to the other side wins immunity.
503,00:27:37.57,00:27:37.57,"And, along with immunity, a little something else we'll"
504,00:27:40.70,00:27:40.70,"save for after the challenge. All right, Drake, because you"
505,00:27:43.10,00:27:43.10,"have three extra members, you're sitting three people out."
506,00:27:45.03,00:27:45.03,You cannot sit the same people out in back-to-back challenges.
507,00:27:47.47,00:27:47.47,"Who's sitting out? Rupert, Trish, Burton,"
508,00:27:49.60,00:27:49.60,"you stay in the boat. Everybody else strategize,"
509,00:27:54.00,00:27:54.00,"wait for my ""go."" At stake: immunity, and a"
510,00:28:01.70,00:28:01.70,surprise reward for after the challenge.
511,00:28:05.17,00:28:05.17,"Drake, you won the coin toss. Who's moving first?"
512,00:28:07.43,00:28:07.43,Sandra makes the first move. First move for Morgan.
513,00:28:12.27,00:28:12.27,Osten on the course. Shawn.
514,00:28:15.03,00:28:15.03,Ryno. Michelle moving out
515,00:28:16.90,00:28:16.90,onto the course. Andrew makes his first move.
516,00:28:19.90,00:28:19.90,"A lot of showdowns lining up. T on the course now,"
517,00:28:24.40,00:28:24.40,with a smile on her face and ready to take somebody on.
518,00:28:28.33,00:28:28.33,Jon saves himself for last. Darrah on the board.
519,00:28:32.30,00:28:32.30,We have all ten tribe members out.
520,00:28:34.80,00:28:34.80,Now it's going to get good. Morgan.
521,00:28:38.87,00:28:38.87,Osten challenges Michelle. Here's what's going to happen.
522,00:28:41.57,00:28:41.57,"I'm going to tell you to put one foot in the white,"
523,00:28:43.83,00:28:43.83,"and then, when you both have a foot, I'm going to say, ""Go."""
524,00:28:46.77,00:28:46.77,"Once I say, ""Go,"" it's on. First person in the water"
525,00:28:49.37,00:28:49.37,"is out, and goes back to the start."
526,00:28:52.30,00:28:52.30,Here we go. Foot in the white.
527,00:28:57.87,00:28:57.87,Go. (screams)
528,00:29:03.90,00:29:03.90,"Michelle in. Osten doesn't even get wet,"
529,00:29:06.07,00:29:06.07,moves forward. Michelle goes back to the start.
530,00:29:08.87,00:29:08.87,Got another showdown: Ryno and N.Y.C.
531,00:29:12.40,00:29:12.40,Go! Ryno in.
532,00:29:18.93,00:29:18.93,Shawn doesn't get wet. Shawn moves forward.
533,00:29:22.60,00:29:22.60,"Ryno back to the start. Morgan, got another showdown."
534,00:29:26.40,00:29:26.40,Osten challenges Jon. Go!
535,00:29:31.97,00:29:31.97,Jon takes a bath. Osten moves forward.
536,00:29:35.40,00:29:35.40,That is one for Morgan. Take a spot in the Morgan boat.
537,00:29:38.03,00:29:38.03,Andrew challenges Michelle. Go!
538,00:29:43.53,00:29:43.53,Oh. Close.
539,00:29:46.33,00:29:46.33,"Waged a good battle, but Michelle's first in the"
540,00:29:48.43,00:29:48.43,"water, she's out. Andrew moves into the last spot,"
541,00:29:51.20,00:29:51.20,"and, with that, it's two Morgan, nothing Drake."
542,00:29:54.07,00:29:54.07,We have another challenge: Shawn taking on T.
543,00:29:57.37,00:29:57.37,Go! Yeah!
544,00:30:03.00,00:30:03.00,T first in. Gave it an effort.
545,00:30:05.13,00:30:05.13,Very good. T back to the start.
546,00:30:07.70,00:30:07.70,"That's one for Drake. >> Good job, Shawn."
547,00:30:11.10,00:30:11.10,">> PROBST: So, I got to ask at this point:"
548,00:30:12.80,00:30:12.80,"Obviously, it's a strong physical battle and your two..."
549,00:30:16.37,00:30:16.37,two of your strongest guys chose to sit out.
550,00:30:18.77,00:30:18.77,Why come? >> Wasn't my choice.
551,00:30:21.57,00:30:21.57,>> PROBST: Wasn't your choice? You guys have a rotation
552,00:30:23.80,00:30:23.80,"that doesn't change. All right, that works."
553,00:30:27.03,00:30:27.03,Drake. Michelle challenges another
554,00:30:30.53,00:30:30.53,showdown. Ryno moves into the spot.
555,00:30:34.27,00:30:34.27,"That's three Morgan members, one Drake member."
556,00:30:38.33,00:30:38.33,Morgan giving T the chance to take Jon in.
557,00:30:42.77,00:30:42.77,Jon first in the water! Take a swim back.
558,00:30:49.40,00:30:49.40,Christa in the water. Back to the start.
559,00:30:52.37,00:30:52.37,"Darrah moves forward. Darrah, you move forward."
560,00:30:56.37,00:30:56.37,"Sandra takes her last move. And, with that,"
561,00:30:58.67,00:30:58.67,Sandra's in for Drake. T moves to her last spot.
562,00:31:01.87,00:31:01.87,Morgan has their fourth member across.
563,00:31:03.27,00:31:03.27,"Michelle is in, and off the course."
564,00:31:07.53,00:31:07.53,"Darrah, the only remaining member of Morgan, needs to get"
565,00:31:09.80,00:31:09.80,in. Here's where we're at.
566,00:31:11.90,00:31:11.90,"Morgan at four, Drake at three. First tribe to get"
567,00:31:14.27,00:31:14.27,all members in wins immunity. Drake... and a little something
568,00:31:16.40,00:31:16.40,else. Morgan... just a matter of
569,00:31:20.00,00:31:20.00,playing it out now. Drake.
570,00:31:24.53,00:31:24.53,"Darrah, make the only move you can-- the last move."
571,00:31:28.27,00:31:28.27,"And, with that, Darrah moves in. Morgan wins their first"
572,00:31:31.07,00:31:31.07,challenge. Morgan wins immunity!
573,00:31:34.43,00:31:34.43,Morgan finally on the board. Congratulations.
574,00:31:42.43,00:31:42.43,"All right, Morgan, immunity for your tribe,"
575,00:31:45.67,00:31:45.67,and a little something else. I shall read the note.
576,00:31:49.70,00:31:49.70,"""Choose one tribe member from the opposing tribe"
577,00:31:52.30,00:31:52.30,"to come live with you until the next challenge."""
578,00:31:54.53,00:31:54.53,Here's what that means. You are going to choose
579,00:31:58.33,00:31:58.33,a tribe member from Drake right now.
580,00:31:59.93,00:31:59.93,They will leave with you right now.
581,00:32:01.60,00:32:01.60,They will not go to Tribal Council tomorrow night.
582,00:32:04.23,00:32:04.23,They cannot be voted out. They will participate with you
583,00:32:07.13,00:32:07.13,in the next reward challenge and share in that reward if you win.
584,00:32:11.40,00:32:11.40,"Who's it going to be, Savage? >> Rupert."
585,00:32:13.20,00:32:13.20,">> PROBST: Rupert, for the next short while you are now going"
586,00:32:15.97,00:32:15.97,"to be living with Morgan. Out of the boat, into the Morgan"
587,00:32:18.77,00:32:18.77,"boat. >> Rupert, all right, baby!"
588,00:32:22.30,00:32:22.30,">> We love you, Rupert. >> It's all good, baby."
589,00:32:28.20,00:32:28.20,">> It's all good. >> We love you, Rupert."
590,00:32:30.07,00:32:30.07,">> Love you guys. >> Hey, it'll only be temporary."
591,00:32:33.37,00:32:33.37,>> PROBST: And a nice welcome from Ryno.
592,00:32:35.43,00:32:35.43,"I think Morgan likes you, Rupert."
593,00:32:39.57,00:32:39.57,"Here you are, Darrah. Morgan, congratulations."
594,00:32:45.97,00:32:45.97,Head back to camp. Drake... I will see you
595,00:32:48.93,00:32:48.93,at Tribal Council. We have a lot to talk about.
596,00:32:51.40,00:32:51.40,"Head out, guys. >> It was a little scary that"
597,00:33:19.03,00:33:19.03,Rupert went away with the other tribe.
598,00:33:21.80,00:33:21.80,"It was kind of a shocker. And, uh, I got a little nervous"
599,00:33:25.13,00:33:25.13,after this immunity challenge. I'm thinking that I could be
600,00:33:28.20,00:33:28.20,"the next to go. >> Come on, it's me and you, the"
601,00:33:31.90,00:33:31.90,macho man versus the little man. >> I'm thinking that maybe Jon
602,00:33:35.07,00:33:35.07,"may go with Michelle, Shawn and Burton, but I highly doubt it."
603,00:33:41.23,00:33:41.23,"So, I'm going to keep positive thinking and continue to think"
604,00:33:42.83,00:33:42.83,"that he's with Trish, Sandra and I, even though Rupert's"
605,00:33:47.33,00:33:47.33,"gone. And, uh, hopefully it will be"
606,00:33:50.43,00:33:50.43,Burton to go instead of me. >> The way I see it... the way
607,00:33:58.27,00:33:58.27,"I see it, Jon, to be honest with you, there's four of us"
608,00:34:00.90,00:34:00.90,right here. I don't give a ... who they
609,00:34:03.30,00:34:03.30,vote for because there's no previous votes cast.
610,00:34:04.97,00:34:04.97,Sandra can go ... me. When... when we hear four votes
611,00:34:08.03,00:34:08.03,"for Christa, whatever the other three votes are for, you know"
612,00:34:11.27,00:34:11.27,that one of those votes were cast by those three people right
613,00:34:13.47,00:34:13.47,"there. And when they come back here,"
614,00:34:15.37,00:34:15.37,they're going to know they just sunk their own ship.
615,00:34:17.20,00:34:17.20,">> Jon claims he's fully onboard and, I've got to be honest, all"
616,00:34:20.80,00:34:20.80,the actions and all the things that Jon has said have been
617,00:34:23.27,00:34:23.27,very consistent over the past week about getting Christa
618,00:34:24.83,00:34:24.83,"off. >> You're a little nervous, but"
619,00:34:31.13,00:34:31.13,"once you've voted, uh, Christa gone, you know, show your"
620,00:34:34.10,00:34:34.10,"loyalty, we're all cool. We'll carry you to the end."
621,00:34:37.17,00:34:37.17,"That's... Burton's just worried right now, but he's going to be"
622,00:34:39.27,00:34:39.27,"going like, ""Oh, okay. I... I understand."""
623,00:34:42.17,00:34:42.17,>> There is a lot of scheming going on.
624,00:34:44.80,00:34:44.80,It's very funny. Some of the things that Jon
625,00:34:47.03,00:34:47.03,"comes back and tells, uh, Trish and Sandra and I."
626,00:34:49.93,00:34:49.93,>> Who do they think we're going to vote off-- Michelle?
627,00:34:52.53,00:34:52.53,"Tonight?! >> Yeah, yeah."
628,00:34:54.07,00:34:54.07,>> They think Michelle? >> Yeah.
629,00:34:56.47,00:34:56.47,>> I am somewhat afraid that Jon could be playing me.
630,00:35:00.60,00:35:00.60,>> Crack it open. >> It's just that he is talking
631,00:35:04.53,00:35:04.53,with Shawn and Burton and Michelle with such truth in his
632,00:35:07.90,00:35:07.90,"eyes, and I see it and observe it every day, and he does the"
633,00:35:10.60,00:35:10.60,"same thing to me, and it just makes me feel uneasy."
634,00:35:14.00,00:35:14.00,I just wish that he would talk to them a little bit less
635,00:35:15.90,00:35:15.90,convincingly. >> Do you want a little sugar
636,00:35:18.80,00:35:18.80,"in your drink? >> Don't drop it, dude."
637,00:35:21.67,00:35:21.67,">> Hey, you need to not drop it. (laughs)"
638,00:35:25.83,00:35:25.83,Whew! (laughs)
639,00:35:30.63,00:35:30.63,>> I am so stoked to go to Tribal Council.
640,00:35:32.57,00:35:32.57,I am stoked! I want to see it.
641,00:35:34.87,00:35:34.87,I can't wait. I think it's going to be
642,00:35:36.23,00:35:36.23,awesome. Ric Flair is voted off the
643,00:35:37.97,00:35:37.97,island. Knowing that I'm going nowhere.
644,00:35:41.97,00:35:41.97,"Ladies and gentlemen, we're going to get funky like a"
645,00:35:44.23,00:35:44.23,monkey. The game's going great for
646,00:35:45.97,00:35:45.97,Jonny Fairplay. I got a one-on-one alliance with
647,00:35:47.80,00:35:47.80,Shawn. I got a five-way alliance with
648,00:35:49.80,00:35:49.80,"myself, Trish, Rupert, Christa and Sandra."
649,00:35:55.47,00:35:55.47,"And I have a four-way alliance with myself, Shawn, Burton and"
650,00:35:57.53,00:35:57.53,"Michelle. He can do the strut, too!"
651,00:36:01.60,00:36:01.60,He can do the strut twice as fast!
652,00:36:03.17,00:36:03.17,I'm having a blast. It's even more fun than I
653,00:36:05.07,00:36:05.07,"imagined. I'm on paradise, and, uh,"
654,00:36:06.63,00:36:06.63,I'm a... I'm a freakin' puppet master.
655,00:36:09.17,00:36:09.17,That's all a guy can ask for. >> Turn around!
656,00:36:12.50,00:36:12.50,Turn around! >> Look at his white heinie.
657,00:36:15.37,00:36:15.37,"There's, like, this red back and then there's this pure white"
658,00:36:18.00,00:36:18.00,heinie. >> That's a sight to be had
659,00:36:19.83,00:36:19.83,right there. >> Darth Vader!
660,00:36:22.57,00:36:22.57,(laughter) >> PROBST: Behind each of you is
661,00:36:36.10,00:36:36.10,"a torch. I want you to grab a torch,"
662,00:36:38.30,00:36:38.30,"approach the flame, dip it and get fire."
663,00:36:40.63,00:36:40.63,We do this because fire represents your life in this
664,00:36:44.73,00:36:44.73,"game. As long as you have fire,"
665,00:36:47.77,00:36:47.77,"you're in the game. When your fire's gone, so are"
666,00:36:49.80,00:36:49.80,"you. Once you have fire, put it in a"
667,00:36:52.07,00:36:52.07,"slot and take a seat. For the first time, we have the"
668,00:36:59.53,00:36:59.53,"Drake Tribe at Tribal Council, minus Rupert, temporarily a"
669,00:37:02.80,00:37:02.80,"member of the Morgan Tribe. So, he can't be voted out"
670,00:37:06.47,00:37:06.47,"tonight. Jon, give me the state of"
671,00:37:08.80,00:37:08.80,"affairs for this tribe. >> Awesome, awesome, awesome,"
672,00:37:10.43,00:37:10.43,awesome. Happy tribe.
673,00:37:14.80,00:37:14.80,"That's it. Good tribe, couldn't be happier."
674,00:37:18.57,00:37:18.57,>> PROBST: Are you loaded? >> Yeah.
675,00:37:20.17,00:37:20.17,"(laughs) Like, you know, this isn't the"
676,00:37:23.80,00:37:23.80,"happiest of occasions, but you might as well make it as happy"
677,00:37:26.80,00:37:26.80,"as possible. >> PROBST: Michelle, any"
678,00:37:28.60,00:37:28.60,friendships developing 12 days in?
679,00:37:30.87,00:37:30.87,>> Tons of friendships. Everybody's a friend.
680,00:37:33.03,00:37:33.03,"We've, uh, been through some really strange, wild times"
681,00:37:35.80,00:37:35.80,"together, and everybody's kind of keeping an open mind about"
682,00:37:38.93,00:37:38.93,the situation. And we do come together more
683,00:37:41.50,00:37:41.50,"than... than I thought we did, so it's hard not to become"
684,00:37:43.70,00:37:43.70,friends with people. >> PROBST: Let's talk about
685,00:37:46.17,00:37:46.17,yesterday's challenge. I'm still a little confused.
686,00:37:49.33,00:37:49.33,"A very physical challenge, the first challenge we've had like"
687,00:37:52.67,00:37:52.67,"that, and you sit out Rupert and Burton, two of your strongest"
688,00:37:57.10,00:37:57.10,guys. And they tell me it's rotation
689,00:37:59.87,00:37:59.87,"with immunity at stake. Christa, is that true?"
690,00:38:02.53,00:38:02.53,">> Yeah, I think it's only fair. All of us want to have the"
691,00:38:06.33,00:38:06.33,"opportunity to participate. I mean, we only get the chance"
692,00:38:08.77,00:38:08.77,one in a lifetime to be out here.
693,00:38:10.33,00:38:10.33,">> PROBST: Is there a double-edged sword, Burton, to"
694,00:38:14.67,00:38:14.67,being a very successful tribe? The good news is you're not
695,00:38:18.27,00:38:18.27,losing anybody. The bad news is you can't get
696,00:38:21.77,00:38:21.77,rid of anybody. >> That's true.
697,00:38:23.90,00:38:23.90,"It is great to win everything because you avoid immunity,"
698,00:38:26.67,00:38:26.67,but at the same time you have absolutely no control over the
