,begin,end,subtitles_text
699,00:38:29.77,00:38:29.77,game itself. At some point that can come back
700,00:38:32.60,00:38:32.60,"to haunt you because if you wanted to send someone home,"
701,00:38:35.20,00:38:35.20,you wouldn't have the opportunity to.
702,00:38:36.83,00:38:36.83,">> PROBST: Jon, self-proclaimed ""good strategist,"" what are you"
703,00:38:40.30,00:38:40.30,"basing your vote on tonight? >> Um, by whatever the"
704,00:38:42.80,00:38:42.80,astrological signs tell me. >> PROBST: Is that a respectful
705,00:38:47.23,00:38:47.23,way to treat somebody that you've lived with for 12 days?
706,00:38:51.00,00:38:51.00,">> Maybe, maybe not. We'll find out in a few minutes."
707,00:38:55.87,00:38:55.87,">> PROBST: It is time to vote. Trish, you're up."
708,00:39:21.83,00:39:21.83,>> (whispers): You're the biggest threat that we have.
709,00:39:24.37,00:39:24.37,"We'll see you, buddy. >> Christa, this is a tough..."
710,00:39:38.00,00:39:38.00,"tough game, but I'm making strategic decisions."
711,00:39:57.67,00:39:57.67,">> Now, can you dig that, sucker?"
712,00:40:07.33,00:40:07.33,>> PROBST: I'll go tally the votes.
713,00:40:23.67,00:40:23.67,">> PROBST: Once the votes are read, the decision is final."
714,00:40:25.43,00:40:25.43,The person voted out will be asked to leave the Tribal
715,00:40:27.07,00:40:27.07,Council area immediately. I'll read the votes.
716,00:40:32.27,00:40:32.27,First vote... Christa.
717,00:40:41.40,00:40:41.40,"Burton. One vote Burton, one vote"
718,00:40:43.67,00:40:43.67,Christa. Christa.
719,00:40:50.67,00:40:50.67,That's two votes Christa. Burton.
720,00:40:56.47,00:40:56.47,"Two votes Burton, two votes Christa."
721,00:41:04.60,00:41:04.60,"Burton. That's three votes Burton,"
722,00:41:07.13,00:41:07.13,two votes Christa. First member of the Drake Tribe
723,00:41:13.53,00:41:13.53,voted out... Burton.
724,00:41:16.30,00:41:16.30,That's four votes. That's enough.
725,00:41:17.93,00:41:17.93,You need to bring me your torch. Last vote will remain a mystery.
726,00:41:26.97,00:41:26.97,"Burton, the tribe has spoken. It's time for you to go."
727,00:41:44.60,00:41:44.60,"Well, there was a lot of talk tonight about one big happy"
728,00:41:46.47,00:41:46.47,tribe. It should be interesting back at
729,00:41:48.70,00:41:48.70,camp. Grab your torches.
730,00:41:51.03,00:41:51.03,You can head back. Good night.
731,00:42:10.27,00:42:10.27,>> PROBST: Stay tuned for scenes from our next episode.
732,00:42:16.63,00:42:16.63,>> PROBST: Next time on Survivor:
733,00:42:18.27,00:42:18.27,A voting betrayal is exposed. >> I know what Shawn wrote on
734,00:42:21.47,00:42:21.47,"his card. >> My card said ""Burton."""
735,00:42:23.90,00:42:23.90,">> PROBST: With Rupert at Morgan, Drake worries."
736,00:42:26.43,00:42:26.43,>> My concern with Rupert is that he's giving away too
737,00:42:28.60,00:42:28.60,much information about us and not realizing it.
738,00:42:30.67,00:42:30.67,>> PROBST: And things are looking up for Morgan.
739,00:42:33.03,00:42:33.03,>> Probably the smartest thing this tribe ever did was get a
740,00:42:35.30,00:42:35.30,"hold of Rupert. >> I'm, uh, disappointed beyond"
741,00:42:41.43,00:42:41.43,"what words could explain. But, being a strategic player"
742,00:42:46.23,00:42:46.23,"and knowing the threat that I posed in my tribe, I probably"
743,00:42:49.37,00:42:49.37,would've done what the majority ended up doing.
744,00:42:51.73,00:42:51.73,It's going to be a lot harder without me.
745,00:42:53.30,00:42:53.30,"Uh, challenges are not going to be guaranteed as they were when"
746,00:42:56.33,00:42:56.33,"I was involved. Good luck to those left, and"
747,00:42:58.23,00:42:58.23,I'll see you on the other side.
