,begin,end,subtitles_text
356,00:22:47.53,00:22:47.53,"considered mine.They want to keep eating, they"
357,00:22:50.37,00:22:50.37,will let me use the damn spear.>> What happened?
358,00:22:53.33,00:22:53.33,>> I did it.>> You did it?
359,00:22:56.17,00:22:56.17,Bo is a bigger dumbass than hisdad.
360,00:22:58.83,00:22:58.83,"I mean, Big Tom is pretty dumb,but Bo is just-- he's out there,"
361,00:23:02.77,00:23:02.77,"too.All right. You  guys, you got to"
362,00:23:06.23,00:23:06.23,"police your zone and go...>> See you soon, all right?"
363,00:23:11.20,00:23:11.20,>> It's kind of like a dream tocome down here and see my
364,00:23:14.30,00:23:14.30,"brother.And remember, trust no one."
365,00:23:17.17,00:23:17.17,>> All right.>> I think my brother
366,00:23:19.20,00:23:19.20,"definitely knows what he'sdoing, but you know,"
367,00:23:21.20,00:23:21.20,"he only has seven days to goI believe, so you're going to"
368,00:23:24.07,00:23:24.07,see a lot of sneaky activitygoing on.
369,00:23:26.90,00:23:26.90,"Have fun.>> All right, buddy."
370,00:23:29.13,00:23:29.13,"Tell everybody I'm all set, allright?"
371,00:23:32.60,00:23:32.60,">> I can say once you get toa certain point, the pressure is"
372,00:23:36.80,00:23:36.80,"on you and you need to do somethings and my old man, he'll"
373,00:23:39.33,00:23:39.33,"fight to the end, as long ashe's walking, he'll fight so I"
374,00:23:42.23,00:23:42.23,ain't got to worry about him.>> Who's your mama?
375,00:24:11.57,00:24:11.57,Berry picking bucket.>> Berries.
376,00:24:19.10,00:24:19.10,>> Got a big-timechallenge.
377,00:24:20.67,00:24:20.67,">> ""If you think thisnext challenge is buckets of"
378,00:24:22.53,00:24:22.53,"fun, you'll build your own fire,then go for a run."
379,00:24:26.47,00:24:26.47,"The first person with yourflame in the sky, you'll be safe"
380,00:24:29.30,00:24:29.30,"for the vote for someone else'sgood-bye."""
381,00:24:32.47,00:24:32.47,">> Wow.Well, we got some tree mail."
382,00:24:34.83,00:24:34.83,It's got a bucket with a hole init and a letter basically saying
383,00:24:37.70,00:24:37.70,that it's going to be buckets offun.
384,00:24:42.20,00:24:42.20,I know I'm still a huge targetand I know if I don't win
385,00:24:45.63,00:24:45.63,"immunity, I may be the next togo."
386,00:25:02.97,00:25:02.97,>> PROBST: All right.Let's get to today's immunity
387,00:25:05.30,00:25:05.30,"challenge.Shii Ann, give it up."
388,00:25:07.83,00:25:07.83,>> I hate to part with it.>> PROBST: I know you do.
389,00:25:10.60,00:25:10.60,"Once again, immunity back up forgrabs."
390,00:25:13.83,00:25:13.83,Today's immunity challenge isgoing to test your ability to
391,00:25:16.73,00:25:16.73,make fire quickly and keep itgoing.
392,00:25:19.40,00:25:19.40,Here's how it works.You'll have two buckets.
393,00:25:21.87,00:25:21.87,One bucket you will use to buildfire.
394,00:25:24.07,00:25:24.07,The second bucket you will fillwith water.
395,00:25:26.33,00:25:26.33,"As you fill that second bucket,the weight of the water will"
396,00:25:29.10,00:25:29.10,cause that bucket to drop.That will cause the fire bucket
397,00:25:32.37,00:25:32.37,to lift.Your goal: get that fire bucket
398,00:25:34.87,00:25:34.87,high enough to light a fusewhich will ignite the wok at the
399,00:25:37.47,00:25:37.47,top of your structure.The first person to get their
400,00:25:39.97,00:25:39.97,fire to light the fuse winsimmunity.
401,00:25:42.80,00:25:42.80,Here's the rub.The bucket that you're putting
402,00:25:45.00,00:25:45.00,"water in has a hole in it, soyou're going to have to keep an"
403,00:25:48.83,00:25:48.83,"eye on your fire, making sureyou don't run out of matches"
404,00:25:52.43,00:25:52.43,while you chase down more water.Make sense?
405,00:25:54.63,00:25:54.63,">> Yes, sir.>> PROBST: we'll draw numbers"
406,00:25:56.47,00:25:56.47,for your positions and we'll getstarted.
407,00:26:02.37,00:26:02.37,"For immunity, survivors ready?Go!"
408,00:26:10.97,00:26:10.97,Mariano takes his entire pile.So does Amber.
409,00:26:17.20,00:26:17.20,>> First step is getting thatfire going.
410,00:26:28.43,00:26:28.43,Rupert's already has got fire.Shii Ann taking her time.
411,00:26:41.07,00:26:41.07,Rupert has fire and he's goingfor water.
412,00:26:44.20,00:26:44.20,Big Tom has fire.Big Tom going for the water.
413,00:26:50.67,00:26:50.67,Rupert and Big Tom filling uptheir water buckets.
414,00:26:54.43,00:26:54.43,"Mariano has fire.Boston Rob, Rupert and Big Tom"
415,00:27:00.83,00:27:00.83,filling their water buckets.Jenna has fire.
416,00:27:07.40,00:27:07.40,"Shii Ann with a good fire going,building something that's going"
417,00:27:09.73,00:27:09.73,to last.Amber still trying to get her
418,00:27:11.73,00:27:11.73,fire going.Boston Rob's bucket is moving.
419,00:27:20.77,00:27:20.77,This may do it.His fire bucket is up.
420,00:27:29.10,00:27:29.10,It doesn't look like the fire isgoing to be strong enough.
421,00:27:35.97,00:27:35.97,"Don't touch it, let it fall.Work that fire."
422,00:27:40.73,00:27:40.73,Boston Rob's fire went out.He had enough water but he had
423,00:27:43.87,00:27:43.87,no flame once it went up.That's why you guys got to keep
424,00:27:47.13,00:27:47.13,"an eye on your fire, make sureyour fire is still going or"
425,00:27:50.33,00:27:50.33,you're wasting your time.All the water's drained out of
426,00:27:53.67,00:27:53.67,Big Tom's bucket.Shii Ann's fire has gone out.
427,00:27:57.00,00:27:57.00,Everybody is starting over.We're dead even once again.
428,00:28:01.10,00:28:01.10,"Got to tend to your fire, builda fire that's going to last."
429,00:28:06.13,00:28:06.13,Boston Rob is down to his lastmatch.
430,00:28:09.97,00:28:09.97,Make sure you light somethingthat's going to stay lit.
431,00:28:13.33,00:28:13.33,"Wind playing a factor, got toprotect that flame."
432,00:28:29.07,00:28:29.07,>> I'm out.>> PROBST: Boston Rob is out of
433,00:28:31.57,00:28:31.57,"matches and has no fire, out ofthe competition."
434,00:28:36.10,00:28:36.10,"Boy, even with matches you guysare having a tough time getting"
435,00:28:39.17,00:28:39.17,fire.>> I'm out.
436,00:28:46.10,00:28:46.10,>> PROBST: Amber is out ofmatches.
437,00:28:47.93,00:28:47.93,Boston Rob and Amber out of thecompetition.
438,00:28:55.07,00:28:55.07,"You out of matches, Rupert?>> Yep."
439,00:28:58.10,00:28:58.10,>> PROBST: Rupert's out ofmatches.
440,00:29:00.17,00:29:00.17,Rupert out of the competition.Big Tom has another flame.
441,00:29:03.50,00:29:03.50,"Can he keep this one going?>> That's it, I'm out."
442,00:29:07.73,00:29:07.73,>> PROBST: Jenna is out ofmatches.
443,00:29:09.50,00:29:09.50,Down to Big Tom and Shii Ann andBig Tom has a fire going.
444,00:29:13.00,00:29:13.00,>> I'm out of patience.>> Where are the fire
445,00:29:15.57,00:29:15.57,"gods when you need them?>> PROBST: Tom, really doing a"
446,00:29:19.33,00:29:19.33,good job with the fire rightnow.
447,00:29:21.17,00:29:21.17,Patience is paying off.>> Go get that water.
448,00:29:24.10,00:29:24.10,>> PROBST: Shii Ann gettingclose.
449,00:29:31.43,00:29:31.43,>> Nice.>> PROBST: Each time you get a
450,00:29:33.37,00:29:33.37,"little closer, Big Tom.>> Come on, Tom."
451,00:29:35.40,00:29:35.40,You got it.>> PROBST: Shii Ann has fire.
452,00:29:40.17,00:29:40.17,">> Go, go, go.>> PROBST: Shii Ann's fire"
453,00:29:43.37,00:29:43.37,"getting stronger.>> Tom, a little momentum, not"
454,00:29:45.87,00:29:45.87,quite enough.This could be enough.
455,00:29:48.07,00:29:48.07,"This one might do it.Question is, is his fire going"
456,00:29:50.63,00:29:50.63,"to be strong enough?Close, close, close, just shy."
457,00:30:04.17,00:30:04.17,That's it.Big Tom!
458,00:30:08.00,00:30:08.00,"Wins immunity.>> Way to go, Tom."
459,00:30:12.57,00:30:12.57,Very good.>> PROBST: Came down to two and
460,00:30:15.73,00:30:15.73,nobody gave up.Big Tom pulled it out.
461,00:30:18.57,00:30:18.57,"Turn around here, buddy.Put this on."
462,00:30:22.90,00:30:22.90,">> Thank you, man.>> PROBST: You got it?"
463,00:30:25.73,00:30:25.73,>> My first...>> PROBST: Nice job.
464,00:30:28.47,00:30:28.47,You are safe tonight at TribalCouncil.
465,00:30:30.87,00:30:30.87,"The other five of you, not assecure."
466,00:30:33.13,00:30:33.13,Somebody going home tonight.You have the afternoon to think
467,00:30:35.03,00:30:35.03,about who that's going to be.We'll see you all at Tribal
468,00:30:36.87,00:30:36.87,Council.Go back to camp.
469,00:30:52.83,00:30:52.83,>> ♪ I'm going to surpriseeverybody.
470,00:30:55.07,00:30:55.07,♪ Here I come.Here comes Big Tom.
471,00:30:56.67,00:30:56.67,♪ Here he comes.I worried myself to death.
472,00:31:01.23,00:31:01.23,♪ I guess like everybodyI've worried myself to death...
473,00:31:04.17,00:31:04.17,I won immunity.I finally got one.
474,00:31:07.10,00:31:07.10,I was proud of it.See ya later.
475,00:31:09.53,00:31:09.53,>> I find the dynamicsin the tribe very interesting at
476,00:31:12.00,00:31:12.00,"this point, because now it'sdown to six and if anybody wants"
477,00:31:14.50,00:31:14.50,"to take a power position,they're going to have to use me"
478,00:31:17.13,00:31:17.13,"as a swing vote.I mean, if you went to Rob and"
479,00:31:20.87,00:31:20.87,"talked to him about voting forJenna instead of me, maybe, but"
480,00:31:24.43,00:31:24.43,that's pretty risky.You need to talk to Amber.
481,00:31:27.03,00:31:27.03,">> Well, I've said allalong, tonight I'd rather have"
482,00:31:28.90,00:31:28.90,Jenna go.I told you that.
483,00:31:31.67,00:31:31.67,">> Well, here's the thing.What I don't understand is, if"
484,00:31:33.50,00:31:33.50,"you want Jenna gone, why don'tyou just go talk to Amber?"
485,00:31:36.87,00:31:36.87,>> You're putting me likeI'm a damn hero here.
486,00:31:38.87,00:31:38.87,I can't do nothing.I'm like you.
487,00:31:41.17,00:31:41.17,"Why don't you vote her off?Me and you, we've got two votes."
488,00:31:43.77,00:31:43.77,>> Yeah.I'll vote her off.
489,00:31:45.77,00:31:45.77,">> All right, well, there's two.Now what are we going to do?"
490,00:31:48.70,00:31:48.70,The only way she can saveherself is to get three other
491,00:31:51.63,00:31:51.63,"people to vote off...Well, I'd like to vote Jenna"
492,00:31:54.03,00:31:54.03,off.I'd want Jenna gone because Rob
493,00:31:56.80,00:31:56.80,"and Amber pulls Jenna in, mybutt is on a highway to hell."
494,00:32:01.37,00:32:01.37,">> Big Tom wants Jenna out.>> Yeah, he hates Jenna."
495,00:32:05.13,00:32:05.13,>> He hates Jenna.>> I don't care who goes
496,00:32:06.93,00:32:06.93,as long as it's not me.>> I'm not going to
497,00:32:09.37,00:32:09.37,leave without trying.>> If you can get them
498,00:32:12.67,00:32:12.67,"to vote Jenna off, it would bebeautiful."
499,00:32:14.70,00:32:14.70,>> I'm feeling out a few people.I'm trying to see if there's any
500,00:32:17.80,00:32:17.80,way I can get a tentativealliance.
501,00:32:20.57,00:32:20.57,"I mean, each one of them isplanning to take a knife out and"
502,00:32:23.17,00:32:23.17,"stab the other in the back.So, I'll tell you who Big Tom"
503,00:32:27.47,00:32:27.47,"wants to vote out, and youtell..."
504,00:32:29.00,00:32:29.00,>> Rupert.>> No.
505,00:32:30.37,00:32:30.37,>> Jenna.If you would be willing to do
506,00:32:32.40,00:32:32.40,that.>> He told me that he was
507,00:32:34.53,00:32:34.53,annoyed with her.>> He hates her.
508,00:32:36.07,00:32:36.07,">> But unless he votedwith me, I can't do it."
509,00:32:38.37,00:32:38.37,>> But would you do it?>> Shii Ann is talking
510,00:32:40.50,00:32:40.50,about getting out Jenna.I don't know necessarily if I'm
511,00:32:43.13,00:32:43.13,"gonna, you know, 100% go alongwith it, but I'm gonna entertain"
512,00:32:45.70,00:32:45.70,"the idea, because this is theAll-Star."
513,00:32:48.10,00:32:48.10,"It's, uh, hard-core.You've got to play this game, I"
514,00:32:50.97,00:32:50.97,"think, more intense than you didbefore."
515,00:32:52.80,00:32:52.80,>> This looks like funtime for girl talk.
516,00:32:54.77,00:32:54.77,>> We're just talkingabout the stuff I'm gonna eat.
517,00:32:58.33,00:32:58.33,">> What are you gonna eat, ShiiAnn?"
518,00:33:00.27,00:33:00.27,">> Oh, my God, so much.>> Shii Ann's a scrambler."
519,00:33:02.83,00:33:02.83,"I can't even deal with her.I'm very, very annoyed with her."
520,00:33:06.07,00:33:06.07,"Let's put it that way.She opens her mouth, and I feel"
521,00:33:09.10,00:33:09.10,"like putting a gun in mine.>> No, but the only thing is,"
522,00:33:18.07,00:33:18.07,I made a deal.>> I realize you've got to go
523,00:33:20.87,00:33:20.87,"all the way, and if you can't go all the way, you've got to go"
524,00:33:23.33,00:33:23.33,all the way fighting.And that is how I'm choosing to
525,00:33:26.80,00:33:26.80,play the game.I can't wait to see what's gonna
526,00:33:29.10,00:33:29.10,happen.I mean...
527,00:33:31.10,00:33:31.10,>> It's going to be interesting.>> It's gonna be real
528,00:33:34.37,00:33:34.37,"interesting, because, you know,I know a lot of things about"
529,00:33:36.60,00:33:36.60,"this tribe, and it's all gonnacome out tonight at Tribal."
530,00:33:39.17,00:33:39.17,>> Yeah.>> Yeah.
531,00:34:04.23,00:34:04.23,>> PROBST: We'll now bring inthe members of our jury...
532,00:34:06.63,00:34:06.63,"Lex, Kathy and Alicia-- votedout at the last Tribal Council."
533,00:34:17.53,00:34:17.53,"All right, guys, let's talk alittle about roles."
534,00:34:20.20,00:34:20.20,"Jenna, who's working?Who isn't?"
535,00:34:22.77,00:34:22.77,">> Uh, Rupert's alwaysworking, catching fish and"
536,00:34:25.23,00:34:25.23,lugging some wood along with BigTom.
537,00:34:28.70,00:34:28.70,"Um, I've been the only person togo get plantains."
538,00:34:32.63,00:34:32.63,">> PROBST: What's Amber doing?>> Uh, Amber helps"
539,00:34:35.23,00:34:35.23,"make the plantains.She got water, and we cook."
540,00:34:38.70,00:34:38.70,>> PROBST: How about Boston Rob?What's he doing to keep a place
541,00:34:40.93,00:34:40.93,in this tribe?>> Boston Rob has been
542,00:34:43.90,00:34:43.90,"trying to fish, but the majorityof the work is definitely"
543,00:34:47.20,00:34:47.20,"Rupert and... Big Tom combined.>> PROBST: Boston Rob, do you"
544,00:34:50.87,00:34:50.87,"agree with the assessment,you're not really doing that"
545,00:34:52.67,00:34:52.67,"much?>> Uh, I don't think"
546,00:34:54.70,00:34:54.70,"that was the assessment, Jeff.>> I think I said..."
547,00:34:57.33,00:34:57.33,>> I probably haven'tbeen as productive.
548,00:35:00.23,00:35:00.23,"I mean, I've fished almost asmuch as Rupert, maybe not as"
549,00:35:03.70,00:35:03.70,"much, but I've tried as much.I haven't been as productive as"
550,00:35:07.33,00:35:07.33,"getting them, but I'm out theregiving it a shot."
551,00:35:10.03,00:35:10.03,">> PROBST: Amber, do you takethe past 33 days and look at the"
552,00:35:13.57,00:35:13.57,actions of people and factorthat in to who really still is
553,00:35:16.57,00:35:16.57,trustworthy?>> I'm definitely
554,00:35:18.63,00:35:18.63,factoring in the actions thatpeople have made in the last
555,00:35:20.80,00:35:20.80,"couple of days, let alone thewhole entire game."
556,00:35:23.37,00:35:23.37,People have changed a little bitsince day one.
557,00:35:26.27,00:35:26.27,"I know for me, paranoia aroundcamp is... it's insane, it's"
558,00:35:29.33,00:35:29.33,"ridiculous, you can't escape it,and... it's gotten to the point"
559,00:35:32.63,00:35:32.63,"where I'm annoyed with it.>> PROBST: Rupert, are you"
560,00:35:35.50,00:35:35.50,noticing that the paranoia iscausing an annoyance to the
561,00:35:38.80,00:35:38.80,point that it's starting tofracture relationships?
562,00:35:43.33,00:35:43.33,>> The paranoia in ourtribe has at times started to
563,00:35:48.27,00:35:48.27,"rip our tribe apart, ripalliances apart, rip friends"
564,00:35:51.33,00:35:51.33,"apart.>> This is funny,"
565,00:35:54.20,00:35:54.20,'cause you are the most paranoidperson.
566,00:35:56.00,00:35:56.00,( Jenna and Rupert talking )>> PROBST: Wait.
567,00:35:57.43,00:35:57.43,"So what happened, Rupert?>> When I brought fish"
568,00:36:00.83,00:36:00.83,"home, and I looked at everybodyand said, ""I'm taking one and"
569,00:36:03.37,00:36:03.37,"putting it on the fire right nowand I'm eating it, and I don't"
570,00:36:05.77,00:36:05.77,"give a damn what anybody elsedoes,"" it kind of freaked them"
571,00:36:08.17,00:36:08.17,"out a little bit.>> PROBST: Well, it's a fair"
572,00:36:10.67,00:36:10.67,"question, though.If your role is to provide fish,"
573,00:36:12.97,00:36:12.97,why should you be entitled tothe first one?
574,00:36:15.60,00:36:15.60,Somebody else is doing fire.Do they get to sit next...
575,00:36:17.63,00:36:17.63,closer to the fire?>> And if somebody's
576,00:36:19.50,00:36:19.50,"doing plantains, do they get toeat all that they want and then"
577,00:36:22.30,00:36:22.30,you cook yours later?>> That is why it
578,00:36:25.07,00:36:25.07,freaked everybody out--because... I just stepped up and
579,00:36:30.07,00:36:30.07,"said, ""Mine."">> I wasn't freaked out."
580,00:36:32.77,00:36:32.77,I thought he deserved to eat afish before the challenge.
581,00:36:34.70,00:36:34.70,"He went and caught it.>> You know, it's so"
582,00:36:36.63,00:36:36.63,"funny, this paranoia about thefood is mostly caused by one"
583,00:36:40.87,00:36:40.87,"person pointing it out, and thatperson would be Jenna."
584,00:36:44.57,00:36:44.57,"The person at camp who monitorsfood, plantains, fish, coconut,"
585,00:36:49.37,00:36:49.37,"who makes it, who tells us whenwe can make it, is Jenna."
586,00:36:54.17,00:36:54.17,">> PROBST: So, Shii Ann, why areyou asking Jenna?"
587,00:36:56.07,00:36:56.07,">> You've never asked me.>> Jenna, stop monitoring what"
588,00:36:58.37,00:36:58.37,what everyone is eating.And if Rupert catches 20 fish
589,00:37:01.10,00:37:01.10,"and he wants to eat them all,let him."
590,00:37:02.93,00:37:02.93,"Rupert, you deserve every singleone of those fish."
591,00:37:05.17,00:37:05.17,No one else here catches as manyfish or does as much work as
592,00:37:08.57,00:37:08.57,Rupert.So I don't blame him for putting
593,00:37:11.57,00:37:11.57,that first fish on the fire.I don't blame him if he wants to
594,00:37:14.73,00:37:14.73,"eat all 20 fish, because, goshdarn it, he earned it."
595,00:37:17.87,00:37:17.87,"I mean, I'm just gonna call itas see it."
596,00:37:19.90,00:37:19.90,"The people who are remaining,there's two power pairs, right?"
597,00:37:22.60,00:37:22.60,"There's Rupert and Jenna,there's Rob and Amber, there's"
598,00:37:24.97,00:37:24.97,no secret.I keep wondering why they've
599,00:37:27.33,00:37:27.33,"decided not to take Tom and I,who are swing votes, to"
600,00:37:30.43,00:37:30.43,eliminate one of the two of thepower pairs.
601,00:37:32.43,00:37:32.43,"You know, take one power coupleand just cut it up."
602,00:37:35.13,00:37:35.13,>> PROBST: you got everythingout?
603,00:37:36.93,00:37:36.93,">> No, uh, what should I say?No, I... See, I'm very torn"
604,00:37:40.80,00:37:40.80,tonight about who I should castmy vote for.
605,00:37:43.57,00:37:43.57,Whether or not I should cast avote for the person who I found
606,00:37:47.33,00:37:47.33,"most annoying on the tribe,or... if I should cast a vote"
607,00:37:51.33,00:37:51.33,"for the person who I think mightwin this game, and point them"
608,00:37:53.97,00:37:53.97,"out.>> PROBST: When you say, by"
609,00:37:57.47,00:37:57.47,"making that vote, you'll exposethem?"
610,00:37:59.17,00:37:59.17,">> Well, I'm not... By makingthat vote, I will be making a"
611,00:38:01.63,00:38:01.63,"statement.You know, I'm just going to say"
612,00:38:03.53,00:38:03.53,this.Tonight I'm going to be casting
613,00:38:05.63,00:38:05.63,my vote for the person who Ithink is playing the game the
614,00:38:08.77,00:38:08.77,"best, for the person who I thinkeveryone else on the tribe"
615,00:38:12.77,00:38:12.77,"should be looking out for, andfor the person who I think, if"
616,00:38:16.00,00:38:16.00,"people don't watch, will win themillion dollars."
617,00:38:20.73,00:38:20.73,So maybe this will help shake itup.
618,00:38:23.00,00:38:23.00,>> PROBST: Is that your goal?>> Yeah. I love the
619,00:38:25.17,00:38:25.17,unpredictable.I want to see what happens.
620,00:38:27.57,00:38:27.57,">> PROBST: Big Tom, you have thecoveted immunity."
621,00:38:30.40,00:38:30.40,"Formally, I will ask you if youwant to give it up."
622,00:38:32.73,00:38:32.73,>> I don't...That's the ignorantest thing
623,00:38:35.57,00:38:35.57,"that's been said here tonight.No-no offense to you, but, no, I"
624,00:38:40.33,00:38:40.33,don't want to give it up.>> PROBST: Big Tom gonna hold on
625,00:38:42.93,00:38:42.93,to immunity.You cannot vote for Big Tom.
626,00:38:45.27,00:38:45.27,Everybody else is fair game.It is time to find out what
627,00:38:47.57,00:38:47.57,exactly is going on within thistribe.
628,00:38:50.73,00:38:50.73,"Boston Rob, you're up.>> It's time for you"
629,00:39:14.20,00:39:14.20,"to go, and if you're wonderingif you can eat and how much you"
630,00:39:17.00,00:39:17.00,"can, because you think that Imonitor that, eat a lot, Shii"
631,00:39:19.50,00:39:19.50,"Ann, eat a lot.>> Amber, this vote is"
632,00:39:44.90,00:39:44.90,for you out of respect.You are the mastermind right
633,00:39:48.33,00:39:48.33,"now, so from one she-devil toanother, this is the vote I'm"
634,00:39:52.37,00:39:52.37,casting tonight.>> PROBST: I'll go tally the
635,00:39:58.00,00:39:58.00,"votes.Once the votes are read, the"
636,00:40:13.67,00:40:13.67,decision is final.The person voted out will be
637,00:40:15.73,00:40:15.73,asked to leave the TribalCouncil area immediately.
638,00:40:18.37,00:40:18.37,I'll read the votes.First vote...
639,00:40:23.47,00:40:23.47,Shii Ann.Shii Ann.
640,00:40:28.80,00:40:28.80,Two votes Shii Ann.Amber.
641,00:40:34.83,00:40:34.83,"Two votes Shii Ann, one voteAmber."
642,00:40:39.50,00:40:39.50,"Shii Ann.Three votes Shii Ann, one vote"
643,00:40:41.67,00:40:41.67,Amber.The 13th person voted out of the
644,00:40:47.00,00:40:47.00,tribe...Shii Ann.
645,00:40:49.57,00:40:49.57,That's enough-- you need tobring me your torch.
646,00:41:01.23,00:41:01.23,"Shii Ann, the tribe has spoken.>> Good luck, everyone."
647,00:41:06.50,00:41:06.50,>> PROBST: It's time for you togo.
648,00:41:16.50,00:41:16.50,"Well, Shii Ann went out of thisgame playing until the very end."
649,00:41:20.40,00:41:20.40,Obviously she wanted to stirthings up a little bit in camp.
650,00:41:22.70,00:41:22.70,"Guess the next few days willshow us what, if any, impact her"
651,00:41:26.47,00:41:26.47,words had.Grab your torches.
652,00:41:29.60,00:41:29.60,Head on back to camp.Captioning sponsored by
653,00:41:32.60,00:41:32.60,CBS PARAMOUNTNETWORK TELEVISION
654,00:41:37.60,00:41:37.60,Captioned by Media Access Group at WGBH 
655,00:41:40.60,00:41:40.60,access.wgbh.org>> PROBST: Next time on
656,00:41:51.30,00:41:51.30,"Survivor:  With only fiveall-stars left, paranoia reaches"
657,00:41:54.40,00:41:54.40,"new heights.>> I looked over, and my"
658,00:41:56.33,00:41:56.33,heart sank because Rob wasstanding right there.
659,00:41:59.57,00:41:59.57,>> We got problems.>> PROBST: And the battle lines
660,00:42:02.13,00:42:02.13,are drawn.>> Did you or did you
661,00:42:04.33,00:42:04.33,not tell me we needed to get Roboff?
662,00:42:05.93,00:42:05.93,>> Rob is...>> Did you or did you not tell
663,00:42:07.63,00:42:07.63,me we needed to get Rob off?>> The she-devil did her best.
664,00:42:15.73,00:42:15.73,I really tried.I played this game as hard as I
665,00:42:18.43,00:42:18.43,could.I played with the best of the
666,00:42:21.30,00:42:21.30,"best, but you know what?I knew I was outnumbered, and I"
667,00:42:23.70,00:42:23.70,"knew they were gonna vote meoff, so I just wanted to warn"
668,00:42:27.07,00:42:27.07,"everyone, don't forget littleAmber with her big green eyes"
669,00:42:30.70,00:42:30.70,"and her beautiful smile.Don't forget, she's playing for"
670,00:42:32.70,00:42:32.70,a million dollars.
