,begin,end,subtitles_text
0,00:00:00.00,00:00:00.00,>> PROBST: Previously on
1,00:00:02.40,00:00:02.40,Survivor:As the last original Mogo Mogo
2,00:00:05.57,00:00:05.57,member Shii Ann was introuble...
3,00:00:07.57,00:00:07.57,>> My best chance isto call everyone on their game
4,00:00:10.37,00:00:10.37,and stir it up before I leave.If you make it to the final
5,00:00:13.13,00:00:13.13,"two with your current strategy,I'll be shocked."
6,00:00:15.83,00:00:15.83,">> PROBST: At the RewardChallenge, a feast was on the"
7,00:00:18.53,00:00:18.53,line.Everything from a bowl of rice
8,00:00:21.47,00:00:21.47,to a full-on steak dinner withall the fixings.
9,00:00:23.80,00:00:23.80,The winner will be in the chargeof that menu.
10,00:00:26.50,00:00:26.50,The game exposed the tribe'strue feelings.
11,00:00:29.67,00:00:29.67,Who does not deserve to be anAll-Star?
12,00:00:32.43,00:00:32.43,Alicia.>> That's a shot in the heart.
13,00:00:35.80,00:00:35.80,I'll get 'em all later.>> PROBST: Rupert was the last
14,00:00:38.80,00:00:38.80,"one standing, earning the rightto divvy up the meal."
15,00:00:42.03,00:00:42.03,"Back at camp, Alicia was upsetat being named an undeserving"
16,00:00:45.50,00:00:45.50,"All-Star.>> You know, it's never"
17,00:00:47.73,00:00:47.73,fun to hear things aboutyourself that aren't flattering.
18,00:00:51.37,00:00:51.37,>> She's just being a bigbaby about it.
19,00:00:53.13,00:00:53.13,">> PROBST: At the reward dinner,a clear pecking order was"
20,00:00:56.10,00:00:56.10,"exposed when Rupert gave thebest meals to himself, Rob,"
21,00:01:01.33,00:01:01.33,"Jenna and Amber.>> I'm sure the fifth,"
22,00:01:03.33,00:01:03.33,"sixth and seventh weren't toohappy, but, hey, what can you do"
23,00:01:05.97,00:01:05.97,about that?>> PROBST: The next day Shii Ann
24,00:01:08.47,00:01:08.47,was still at risk despite herscrambling.
25,00:01:10.93,00:01:10.93,">> Yeah, we should talkactually."
26,00:01:12.73,00:01:12.73,">> I don't want to hear it.There's a plan, Shii Ann, and"
27,00:01:15.53,00:01:15.53,it's too late for anything tochange.
28,00:01:17.73,00:01:17.73,">> PROBST: With her neck on theline, Shii Ann came through for"
29,00:01:20.53,00:01:20.53,herself at the ImmunityChallenge.
30,00:01:22.10,00:01:22.10,">> Yes, take that!I need this more than all of you"
31,00:01:25.57,00:01:25.57,"guys!>> Yeah, don't get too"
32,00:01:27.40,00:01:27.40,"cocky, though.You've got to live with us, Shii"
33,00:01:29.67,00:01:29.67,Ann.>> PROBST: Shii Ann's victory
34,00:01:31.43,00:01:31.43,meant all bets were off.>> Should have been
35,00:01:33.20,00:01:33.20,"cutting deals with me, stupidpeople."
36,00:01:35.07,00:01:35.07,Let me just say that again:Stupid players.
37,00:01:37.80,00:01:37.80,">> PROBST: At Tribal Council,Alicia, Rupert and Boston Rob"
38,00:01:41.37,00:01:41.37,"were all at risk, but in theend, Alicia was voted out."
39,00:01:44.87,00:01:44.87,Alicia...>> Yes?
40,00:01:46.43,00:01:46.43,>> PROBST: ...the tribe hasspoken.
41,00:01:50.13,00:01:50.13,Six are left.Who will be voted out tonight?
42,00:01:53.77,00:01:53.77,Captioning sponsored byCBS PARAMOUNT
43,00:01:55.70,00:01:55.70,NETWORK TELEVISION(theme song playing)
44,00:02:32.57,00:02:32.57,♪ ♪>> It's so nice out.
45,00:03:29.20,00:03:29.20,>> This is the firstbeautiful day that I've
46,00:03:30.97,00:03:30.97,experienced here on ChabogaMogo and I've got to be honest.
47,00:03:35.00,00:03:35.00,It's not really brightening mymood because the longer I stay
48,00:03:37.77,00:03:37.77,"here, the more I realize I havevery few friends and now I'm"
49,00:03:41.70,00:03:41.70,stuck in a tribe with five otherpeople who don't necessarily
50,00:03:46.30,00:03:46.30,"trust me or even like me, andit's very alienating."
51,00:03:51.00,00:03:51.00,It's really unpleasant out here.>> There you go.
52,00:03:55.93,00:03:55.93,"Oh, my God-- nice, fresh milk.>> That's it?"
53,00:03:59.03,00:03:59.03,">> Yup.I'm cooking, too."
54,00:04:01.83,00:04:01.83,"I'm not having plantains today.You want them, you can cook them"
55,00:04:04.13,00:04:04.13,yourself.I'm not eating them.
56,00:04:05.80,00:04:05.80,>> I'm just reallytired of Jenna.
57,00:04:08.23,00:04:08.23,"I cannot stand her.The girl's a bitch, let's face"
58,00:04:12.83,00:04:12.83,"it, and, uh, she's bossier thananybody else here on this tribe."
59,00:04:16.77,00:04:16.77,">> I like eating offthe fire, so just take it, put"
60,00:04:19.23,00:04:19.23,it on the log and then we'll eatit.
61,00:04:20.50,00:04:20.50,>> She drives me  crazy.I just wanna strangle her!
62,00:04:32.80,00:04:32.80,">> Rupert, you're the man.>> I had a couple of"
63,00:04:38.70,00:04:38.70,"them that got off the spearthat were monsters, just"
64,00:04:43.03,00:04:43.03,monsters.I'd like to gut these guys.
65,00:04:46.47,00:04:46.47,"We'll come back and get 'em,clean 'em and eat 'em."
66,00:04:52.33,00:04:52.33,"When I came out of the ocean, Irealized that nobody was going"
67,00:04:57.33,00:04:57.33,"to help me clean fish, but theyall want to eat the fish."
68,00:05:03.67,00:05:03.67,I'm feeling used and abused.If somebody comes up and asks
69,00:05:08.47,00:05:08.47,"which fish is theirs, I'llprobably tell them the one that"
70,00:05:11.30,00:05:11.30,they caught and the one thatthey cleaned.
71,00:05:14.97,00:05:14.97,>> We usually get onefish per person.
72,00:05:17.53,00:05:17.53,">> If everybody guttedone, they'd be all done."
73,00:05:21.30,00:05:21.30,">> Rupert catches allthe fish, but Rupert catches all"
74,00:05:24.50,00:05:24.50,the fish because he's a big manwho can handle those tides.
75,00:05:26.77,00:05:26.77,"At 120 pounds, those tides wouldliterally crush me against the"
76,00:05:30.40,00:05:30.40,He comes up and only brings onefish up to cook for himself.
77,00:05:35.33,00:05:35.33,"It was like a slap in the face.Like next time when I'm hungry,"
78,00:05:38.40,00:05:38.40,"I'll cook only enough plantainsfor me, because I'm doing that"
79,00:05:40.90,00:05:40.90,"job.So, I wanted to tell him that I"
80,00:05:43.80,00:05:43.80,thought that was a bad move.>> Everybody can go down
81,00:05:46.63,00:05:46.63,there and gut a fish and put iton the fire.
82,00:05:48.40,00:05:48.40,>> Yes.You go out there and spend that
83,00:05:50.43,00:05:50.43,hour and a half fishing.We can't physically do that.
84,00:05:53.17,00:05:53.17,If we...>> How many fish have you
85,00:05:55.67,00:05:55.67,cleaned?>> I've cleaned one.
86,00:05:57.53,00:05:57.53,>> How many have they cleaned?None.
87,00:05:59.47,00:05:59.47,>> But you're talkingto someone who does help out.
88,00:06:01.57,00:06:01.57,I'm just saying we're doing theother things that...
89,00:06:04.00,00:06:04.00,>> But don't be mad at mebecause I'm starving and come
90,00:06:06.00,00:06:06.00,"back and put a fish on the fire.>> No, but my thing"
91,00:06:08.07,00:06:08.07,"is all of us, Rupert.I know you're bigger."
92,00:06:10.30,00:06:10.30,We all have the same hungerpangs.
93,00:06:12.43,00:06:12.43,>> Everybody could havegotten up and cleaned their own
94,00:06:14.07,00:06:14.07,damn fish.>> I was cooking.
95,00:06:15.93,00:06:15.93,>> And everybody else?What was everybody else doing?
96,00:06:18.70,00:06:18.70,>> I know.I'm not talking for everyone
97,00:06:20.90,00:06:20.90,else.>> My little Jenna had
98,00:06:23.37,00:06:23.37,the nerve to bitch at me aboutputting one of my fish on the
99,00:06:27.40,00:06:27.40,grill.She's just getting really a pain
100,00:06:30.20,00:06:30.20,"in the ass, and I'm very sorrythat I have an alliance with"
101,00:06:33.90,00:06:33.90,her.Jenna just got mad at me for
102,00:06:36.13,00:06:36.13,throwing the fish on there andsaying that I was eating in
103,00:06:39.07,00:06:39.07,front of you guys.>> You know what?
104,00:06:40.43,00:06:40.43,You eat that fish.Nobody is complaining.
105,00:06:43.23,00:06:43.23,You can eat all those fishes.You don't have to share with us
106,00:06:46.17,00:06:46.17,at all.I think that the dynamics are
107,00:06:48.53,00:06:48.53,"changing a lot in this tribe,and I wouldn't count me out yet"
108,00:06:52.87,00:06:52.87,"because she-devil has sometricks up her sleeves, and I'll"
109,00:06:56.17,00:06:56.17,be playing them.>> PROBST: Have a seat on the
110,00:07:06.73,00:07:06.73,bench.All right.
111,00:07:12.83,00:07:12.83,Today's challenge is for reward.And we thought this time maybe
112,00:07:16.87,00:07:16.87,we'll show you what the rewardis before we tell you about the
113,00:07:20.03,00:07:20.03,"challenge.Amber, here's your mom, Sheryl."
114,00:07:24.97,00:07:24.97,"Come on in, Sheryl!>> Oh, my God."
115,00:07:29.83,00:07:29.83,">> PROBST: Amber, get on thatmat."
116,00:07:39.97,00:07:39.97,">> Oh, my God.Oh, my God."
117,00:07:44.53,00:07:44.53,">> PROBST: All right, Sheryl.Sheryl, just take a spot right"
118,00:07:46.93,00:07:46.93,"there behind the rope.Rob, here's your brother, Mike."
119,00:07:50.07,00:07:50.07,>> Yeah!>> You look good.
120,00:08:01.00,00:08:01.00,"You grew a beard, too.Losing weight."
121,00:08:04.17,00:08:04.17,">> You too, huh?>> Yeah, on the South"
122,00:08:06.67,00:08:06.67,"Beach Diet.>> PROBST: Shii Ann, here's your"
123,00:08:14.50,00:08:14.50,"mom, Lily.>> Oh, mom."
124,00:08:22.67,00:08:22.67,"Oh, I love you.I miss you."
125,00:08:34.47,00:08:34.47,I'm sorry.>> Don't be sorry.
126,00:08:38.13,00:08:38.13,">> This is my mom,Lily."
127,00:08:39.67,00:08:39.67,">> PROBST: How does she look,Mom?"
128,00:08:41.83,00:08:41.83,>> LILY: Great.>> PROBST: Big Tom.
129,00:08:50.13,00:08:50.13,Get down here and say hello toyour son.
130,00:08:51.70,00:08:51.70,"Get in here.>> There he is, Big Dad."
131,00:08:56.23,00:08:56.23,">> Oh, Tommy boy!What's happening?"
132,00:09:01.30,00:09:01.30,>> Mom said she's getting buff.You'd better watch out.
133,00:09:03.87,00:09:03.87,">> You working?>> No, no."
134,00:09:06.60,00:09:06.60,"Hey, I wanted to go here anyhow.( applause )"
135,00:09:11.83,00:09:11.83,">> PROBST: Jenna, here's yourbrother, Ji."
136,00:09:13.90,00:09:13.90,>> Ji!How are the girls?
137,00:09:25.83,00:09:25.83,>> They're great.They're really fine.
138,00:09:28.53,00:09:28.53,Everyone's wonderful.Everything's great.
139,00:09:30.70,00:09:30.70,Everyone's just thinking aboutyou.
140,00:09:35.43,00:09:35.43,>> PROBST: Okay.Is that everybody?
141,00:09:36.73,00:09:36.73,>> No.>> Laura!
142,00:09:39.30,00:09:39.30,">> PROBST: I'm kidding.Rupert, come say hello to your"
143,00:09:42.67,00:09:42.67,"wife, Laura.>> JENNA M.: Oh!"
144,00:10:04.90,00:10:04.90,>> You just stay herefor a while.
145,00:10:06.73,00:10:06.73,">> LAURA: Oh, my gosh.>> Oh, God."
146,00:10:13.53,00:10:13.53,">> PROBST: Whoa, Rupert.Whoa!"
147,00:10:15.97,00:10:15.97,"All right, Laura, I gotta breakit up."
148,00:10:22.30,00:10:22.30,"Okay, let's get to theWe've put together a menu of"
149,00:10:27.27,00:10:27.27,indigenous items from everyplace we've been at on
150,00:10:30.07,00:10:30.07,Survivor.Each round will feature a
151,00:10:32.43,00:10:32.43,different food item.Each round we will lose one
152,00:10:34.60,00:10:34.60,"person.We'll start with six, we'll"
153,00:10:37.33,00:10:37.33,"work our way down to one.For the winner, here's what you"
154,00:10:41.30,00:10:41.30,get: an overnight-- loved oneand survivor.
155,00:10:45.53,00:10:45.53,"We're down to eight days.Eight days and six people, a"
156,00:10:48.00,00:10:48.00,one-in-six shot at a millionbucks.
157,00:10:50.00,00:10:50.00,You could refill their tank in away that could be the difference
158,00:10:52.83,00:10:52.83,in this game.A lot at stake.
159,00:10:55.90,00:10:55.90,"And in case you haven't figuredit out by now, you ain't eating"
160,00:10:58.53,00:10:58.53,nothing.You guys are doing the eating.
161,00:11:02.60,00:11:02.60,">> You got this, Ji.>> Oh, Mommy!"
162,00:11:05.77,00:11:05.77,>> Mind over matter.>> PROBST: I'll get the first
163,00:11:07.47,00:11:07.47,"item.>> Mind over matter, guy."
164,00:11:13.47,00:11:13.47,"Fish heads, very popular inMalaysia."
165,00:11:16.70,00:11:16.70,Okay. Let me explain the rules.Last person to finish is out.
166,00:11:20.73,00:11:20.73,So the first five move on.You need to show me an empty
167,00:11:23.60,00:11:23.60,"mouth.Once I say okay, you're good."
168,00:11:26.87,00:11:26.87,You can take a drink of waterafter that.
169,00:11:28.67,00:11:28.67,Everything's got to go down.Here we go.
170,00:11:31.67,00:11:31.67,"Three, two, one, eat.>> Go, Ji, the whole thing."
171,00:11:35.73,00:11:35.73,>> PROBST: First five to get itdown move on.
172,00:11:38.30,00:11:38.30,"Ji's got it all ready, all ofit in his mouth."
173,00:11:41.47,00:11:41.47,">> Oh, my gosh.My mom is not going"
174,00:11:43.23,00:11:43.23,to be able to finish it.>> PROBST: Lily fighting it a
175,00:11:45.03,00:11:45.03,little bit. It's all right.You're getting it down.
176,00:11:48.47,00:11:48.47,">> Nice job, Ji.Get that down."
177,00:11:50.23,00:11:50.23,Show him your empty mouth.>> PROBST: Ji is good.
178,00:11:54.20,00:11:54.20,>> Yes.>> PROBST: Lily's good.
179,00:11:57.33,00:11:57.33,">> Come on, Mike.>> Bo is good, Laura is good,"
180,00:12:01.03,00:12:01.03,"Coming down to the two on theend, Mike and Sheryl."
181,00:12:03.93,00:12:03.93,">> Come on.Three, two, one, swallow it."
182,00:12:06.23,00:12:06.23,There it is.>> PROBST: Mike's good.
183,00:12:08.40,00:12:08.40,( applause )>> This way you don't
184,00:12:12.10,00:12:12.10,"have to eat anything else.>> Spit it, Mike."
185,00:12:14.97,00:12:14.97,"You can rinse and spit.>> PROBST: Sheryl, now comes the"
186,00:12:18.23,00:12:18.23,hard part.>> I know.
187,00:12:19.50,00:12:19.50,>> PROBST: You got to go.No hugs good-bye.
188,00:12:21.87,00:12:21.87,>> I won't. Love you.Everyone sends their love.
189,00:12:24.27,00:12:24.27,">> Love you, Mom.>> Love you."
190,00:12:27.07,00:12:27.07,>> Thank you.>> PROBST: These are flying
191,00:12:33.17,00:12:33.17,cockroaches from right here inPanama.
192,00:12:35.17,00:12:35.17,"Ji, one for you and, Laura, anice plump cockroach for you."
193,00:12:40.67,00:12:40.67,"Three, two, one, eat.Ji's good."
194,00:12:48.20,00:12:48.20,"Bo's good.Laura, Lily and Mike."
195,00:12:52.97,00:12:52.97,Laura is good.It's between Mike and Laura.
196,00:12:56.40,00:12:56.40,">> Oh, I love you.>> PROBST: Mike is good."
197,00:12:59.23,00:12:59.23,"Lily, I'm sorry, you're out.>> That's okay, Mommy."
198,00:13:02.20,00:13:02.20,You don't want to live hereanyway.
199,00:13:03.97,00:13:03.97,"It's horrible.>> PROBST: Lily, it's time for"
200,00:13:06.30,00:13:06.30,"you to go.>> Mom, I love you."
201,00:13:08.40,00:13:08.40,Just tell everybody I love themand I say hi.
202,00:13:10.40,00:13:10.40,>> Love you.>> I'll be home soon.
203,00:13:12.93,00:13:12.93,">> PROBST: Good-bye, Lily.>> Love you, Mommy. Bye-bye."
204,00:13:18.83,00:13:18.83,">> PROBST: This is fafuru, theworst-smelling stuff in the"
205,00:13:23.30,00:13:23.30,"world.>> Don't smell it, Mike."
206,00:13:25.80,00:13:25.80,Don't smell it.>> PROBST: Fish that's been
207,00:13:28.30,00:13:28.30,marinating in seawater in thesun for three days.
208,00:13:32.03,00:13:32.03,"Boston Rob remembers it well,and to make it fun we'll do just"
209,00:13:34.87,00:13:34.87,"like we did in the Marquesas,hands behind your back."
210,00:13:38.70,00:13:38.70,Here we go.Three will move on.
211,00:13:40.97,00:13:40.97,"Three, two, one, eat.>> Swallow it down, Mike."
212,00:13:46.73,00:13:46.73,Just swallow the whole thingwhole.
213,00:13:48.40,00:13:48.40,>> PROBST: Bo's face says itall.
214,00:13:50.30,00:13:50.30,">> Swallow it, swallow, Mike.>> PROBST: Bo trying to keep it"
215,00:13:52.80,00:13:52.80,down.Bo's got it. You're good.
216,00:13:55.03,00:13:55.03,"You're moving on.>> Ji, it's mind over matter."
217,00:13:59.40,00:13:59.40,He's got it down.I can smell that burp.
218,00:14:01.47,00:14:01.47,Ji's in.We're looking for one more.
219,00:14:03.43,00:14:03.43,"It's Laura or Mike.>> Come on, Mike."
220,00:14:06.33,00:14:06.33,>> PROBST: Mind over matter.Swallow.
221,00:14:08.90,00:14:08.90,Swallow that last bit on yourtongue.
222,00:14:12.40,00:14:12.40,Mike's in.>> Yeah!
223,00:14:18.70,00:14:18.70,">> I give you credit for yours.>> PROBST: Laura, it's time to"
224,00:14:23.17,00:14:23.17,say good-bye.>> Okay.
225,00:14:25.70,00:14:25.70,>> I'll be home soon.>> I know.
226,00:14:27.87,00:14:27.87,>> I love you.>> PROBST: Next item...
227,00:14:36.30,00:14:36.30,tarantulas.We featured these in Thailand.
228,00:14:39.83,00:14:39.83,"They've been cooked, so they'renot harmful, and only two of"
229,00:14:44.23,00:14:44.23,you will move on.Make sure you show me that mouth
230,00:14:47.07,00:14:47.07,and make sure it's empty.Hands on the table.
231,00:14:49.67,00:14:49.67,"Three, two, one, eat.>> Go, Ji."
232,00:14:52.87,00:14:52.87,>> PROBST: Bo not wasting anytime.
233,00:14:54.30,00:14:54.30,"Shoves half of it down.>> That's it, Mike."
234,00:14:59.30,00:14:59.30,">> PROBST: No, no, no, no.Ji, I'm sorry, you took a"
235,00:15:04.47,00:15:04.47,"drink of water, you're out.>> No one said we couldn't."
236,00:15:08.07,00:15:08.07,>> Not during the timing youcan't.
237,00:15:10.07,00:15:10.07,">> PROBST: Yeah, I did say youcan't do it."
238,00:15:11.83,00:15:11.83,">> Mm-mm.>> PROBST: Yeah, I did."
239,00:15:13.07,00:15:13.07,"I clearly did.Ji, you're out."
240,00:15:14.70,00:15:14.70,"Bo and Mike you're moving on.Ji, you might not remember,"
241,00:15:18.13,00:15:18.13,"but I clearly said, ""Show me anempty mouth."
242,00:15:20.77,00:15:20.77,"Once I clear you, if it comes""up, you're okay, and then you"
243,00:15:24.30,00:15:24.30,"can take a drink of water.""I know you don't like the"
244,00:15:27.23,00:15:27.23,"decision, but you're out.It's time for you to go."
245,00:15:29.27,00:15:29.27,">> Gotcha. I love you, baby.>> Love you, too. Bye."
246,00:15:34.67,00:15:34.67,>> PROBST: It is down to Bo andMike.
247,00:15:37.43,00:15:37.43,"Final round, wichity grubs fromAustralia, and these are alive."
248,00:15:43.03,00:15:43.03,"When you have an empty mouth,completely empty, you show it to"
249,00:15:46.13,00:15:46.13,me.You ready to do this?
250,00:15:48.77,00:15:48.77,"Three, two, one, eat.Bo shoves the whole thing in his"
251,00:15:53.17,00:15:53.17,"mouth, it's down and he's in!>> Who's your daddy now?"
252,00:15:56.03,00:15:56.03,>> Whoa!>> Wow!
253,00:15:57.70,00:15:57.70,>> PROBST: Wow!>> Wow!
254,00:16:01.70,00:16:01.70,>> You're a sick kid.>> I didn't even see that.
255,00:16:04.70,00:16:04.70,">> Neither did I.>> Hey, you get this far, you"
256,00:16:07.93,00:16:07.93,might as well go after it.>> PROBST: I like that attitude.
257,00:16:10.30,00:16:10.30,"Mike?>> Yes, sir."
258,00:16:13.10,00:16:13.10,>> PROBST: great effort.It was nice having you out here.
259,00:16:15.53,00:16:15.53,>> Thank you.>> PROBST: It is time for you to
260,00:16:17.47,00:16:17.47,"go.>> Bring it home, baby."
261,00:16:19.27,00:16:19.27,">> Thanks.>> Take care, guys."
262,00:16:20.73,00:16:20.73,">> Nice to meet you, Mike.>> PROBST: Big Tom, join him out"
263,00:16:23.10,00:16:23.10,there.( grunts )
264,00:16:25.63,00:16:25.63,">> Oh, me old son, me old son.Me old boy, me old boy."
265,00:16:33.63,00:16:33.63,">> Wicked, wicked.>> PROBST: Okay, here's the"
266,00:16:36.53,00:16:36.53,deal.We've taken Camp Chapera where
267,00:16:40.40,00:16:40.40,"you used to live and we'veupgraded it a little bit,"
268,00:16:43.00,00:16:43.00,Probably like you wish it hadbeen when you lived there.
269,00:16:45.80,00:16:45.80,"You're going to spend the nightwith pop, see what it's like"
270,00:16:48.80,00:16:48.80,"being a survivor, and hey,if it's good for two, it's"
271,00:16:51.47,00:16:51.47,"better for four, right?So Big Tom, choose one survivor,"
272,00:16:55.37,00:16:55.37,"we'll bring their loved oneback, and the four of you will"
273,00:16:59.10,00:16:59.10,spend the night at Chapera.>> Rupert.
274,00:17:03.90,00:17:03.90,Rupert with Laura.>> I'm gonna pick aggravation
275,00:17:10.97,00:17:10.97,right there.>> PROBST: Boston Rob.
276,00:17:13.53,00:17:13.53,"Mike, get on back here.You're not done yet."
277,00:17:18.20,00:17:18.20,"Boy, it is going to be a partytonight with the four of you."
278,00:17:21.33,00:17:21.33,>> Yeah!>> Whoo!
279,00:17:46.37,00:17:46.37,">> Home again, home again!>> Home sweet home."
280,00:17:50.57,00:17:50.57,">> Wow, look at the food.>> That's the best thing"
281,00:17:55.33,00:17:55.33,I've tasted in the last 31 days.>> Here's to friends and
282,00:17:57.77,00:17:57.77,family.>> To friends and family.
283,00:18:00.17,00:18:00.17,">> Ooh, baby.It's good to drink beer with my"
284,00:18:03.23,00:18:03.23,I wished it had been hismother or my neighbor's
285,00:18:06.47,00:18:06.47,sister...after I seen what a romantic
286,00:18:12.00,00:18:12.00,"And I could have picked oldRupert, but I couldn't have"
287,00:18:14.67,00:18:14.67,stand to see him.I've never seen a man slobber
288,00:18:17.53,00:18:17.53,over a woman like he did hiswife.
289,00:18:19.67,00:18:19.67,There was slobber hanging downin his beard.
290,00:18:22.43,00:18:22.43,>> What do you thinkabout everybody back at camp?
291,00:18:25.00,00:18:25.00,>> Me?>> Yeah.
292,00:18:26.87,00:18:26.87,What do you think they'redoing right about now?
293,00:18:29.50,00:18:29.50,>> Amber's getting high on lifeor getting low on the ground.
294,00:18:33.60,00:18:33.60,Rupert's probably kissing andhunting his harpoon.
295,00:18:37.87,00:18:37.87,Jenna is running that mouth likea bell clapper and Shii Ann is
296,00:18:41.40,00:18:41.40,trying to make an alliance witha bush because she's tried
297,00:18:44.80,00:18:44.80,everybody else.( all chuckle )
298,00:18:47.83,00:18:47.83,">> That's all we've got left.>> Man, you both on that swing?"
299,00:19:00.87,00:19:00.87,"Swing away, swing away.>> One, two, three."
300,00:19:04.00,00:19:04.00,">> Oh!♪ Swing low, sweet chariot"
301,00:19:13.30,00:19:13.30,Coming to carry me home. ♪( drunken yelling )
302,00:19:20.17,00:19:20.17,>> BOTH: Who's your daddy?>> We tore it up.
303,00:19:24.13,00:19:24.13,We partied hard all night long.This is definitely what I needed
304,00:19:28.33,00:19:28.33,"to get to the end, just tofinish my game, you know, a"
305,00:19:32.07,00:19:32.07,little visit from home.>> Let's go for a walk on the
306,00:19:35.27,00:19:35.27,"beach and we'll give you guyssome time, all right?"
307,00:19:37.80,00:19:37.80,>> All right.>> To be completely
308,00:19:49.90,00:19:49.90,"honest with you, right now I'min an alliance with Amber first"
309,00:19:53.33,00:19:53.33,and foremost.>> What I got to do now is
310,00:19:56.63,00:19:56.63,I got to get Rob and Amber tokeep me with them.
311,00:20:00.03,00:20:00.03,">> I was, like, ""Lex, dome a favor, keep the girl and"
312,00:20:02.13,00:20:02.13,"I'll help you out on the reverseside."""
313,00:20:03.50,00:20:03.50,"He goes, ""All right."" Sweet.And the dumbass actually kept"
314,00:20:06.50,00:20:06.50,her and then I snaked him.>> I think me and Rob might
315,00:20:15.13,00:20:15.13,be first and second.That's all we said we was gonna
316,00:20:17.17,00:20:17.17,do.>> You know who my solid is?
317,00:20:19.37,00:20:19.37,It's Amber.>> Don't freakin' bank on it.
318,00:20:22.37,00:20:22.37,">> I'm banked on it.Dude, I'm telling you,"
319,00:20:24.37,00:20:24.37,"she won't switch.I'm guaranteeing, Mike."
320,00:20:26.90,00:20:26.90,I guarantee.I feel it that she's not gonna.
321,00:20:29.93,00:20:29.93,"Big Tom, though...>> You've got to do what you got"
322,00:20:32.77,00:20:32.77,to do.>> I don't trust him as
323,00:20:34.97,00:20:34.97,far as I can throw him.>> Welcome home.
324,00:20:59.83,00:20:59.83,>> Don't even tell ushow it was.
325,00:21:02.07,00:21:02.07,"Did you eat pizza, Rob?How you doing?"
326,00:21:04.70,00:21:04.70,">> Okay, how you doing?>> Today, Bo and Mike"
327,00:21:09.77,00:21:09.77,came back from their littleadventure with Big Tom and Rob.
328,00:21:13.67,00:21:13.67,We need wood!We need wood.
329,00:21:16.53,00:21:16.53,"Let's get 'em to...As soon as they came in, instead"
330,00:21:20.43,00:21:20.43,"of letting them sit down andrest and enjoy their visit here,"
331,00:21:23.87,00:21:23.87,"we put them to work, got themstarted, you know, helping us"
332,00:21:26.97,00:21:26.97,out at camp.>> That boy has been on the
333,00:21:30.00,00:21:30.00,"farm all his life.When he gets up in the morning,"
334,00:21:32.73,00:21:32.73,he knows what work is.He's used to it.
335,00:21:35.27,00:21:35.27,">> On the other hand, Roband his brother wouldn't help us"
336,00:21:38.87,00:21:38.87,get the wood.>> They didn't get
337,00:21:41.13,00:21:41.13,diddley-squat.>> Just take a nice cozy
338,00:21:43.33,00:21:43.33,seat here.>> Go spear yourself a fish.
339,00:21:45.73,00:21:45.73,>> You feeling pretty good?>> Yeah.
340,00:21:47.53,00:21:47.53,>> This will probablybe the only time you'll be in
341,00:21:49.70,00:21:49.70,"the ocean.>> Is the tide deep, or...?"
342,00:21:51.47,00:21:51.47,>> It's not bad.I took Bo out spearfishing.
343,00:21:53.90,00:21:53.90,"Big Tom wanted him to spearfishbadly, and I wasn't even going"
344,00:21:56.63,00:21:56.63,to give Bo a spear.>> Okay.
345,00:22:00.57,00:22:00.57,">> He won't kill you, Rupert.>> You know, I kind of"
346,00:22:04.03,00:22:04.03,"protect those spears, eventhough I don't talk about it."
347,00:22:06.57,00:22:06.57,"I protect those spears.This is hard fishing, you know."
348,00:22:15.93,00:22:15.93,Bo wasn't the greatest swimmer.He was using the spear to propel
349,00:22:19.50,00:22:19.50,"himself more than to fish.As we were fishing, I look at"
350,00:22:26.40,00:22:26.40,"Bo's spear, and the head of itis gone."
351,00:22:29.63,00:22:29.63,I had my flashbacks to when Seanlost his spear tip in Pearl
352,00:22:31.93,00:22:31.93,Island.>> A fine bunch of seamen.
353,00:22:35.97,00:22:35.97,What did he do?>> Lose the spear.
354,00:22:38.07,00:22:38.07,">> Oh, my God, no.>> I'm not as worried"
355,00:22:44.27,00:22:44.27,about it because I've got myspear that is now going to be
