,begin,end,subtitles_text
687,00:38:49.17,00:38:49.17,for you about tonight's vote? >> Toughest vote yet.
688,00:38:51.96,00:38:51.96,">> PROBST: For you? >> Oh, yeah."
689,00:38:53.92,00:38:53.92,>> PROBST: Why? >> Uh... kind of caught
690,00:38:55.88,00:38:55.88,in the middle. It's a vote I don't even want to
691,00:38:58.12,00:38:58.12,"cast, but I, you know, I've got to play the game."
692,00:39:01.67,00:39:01.67,">> PROBST: All right. Eliza, you have immunity."
693,00:39:04.25,00:39:04.25,"As always, you can keep it or assign it to somebody else."
694,00:39:06.92,00:39:06.92,">> I think I better hold on to it, Jeff."
695,00:39:08.75,00:39:08.75,">> Oh, give it to Twila. >> It's my first time."
696,00:39:10.79,00:39:10.79,">> PROBST: Okay, you cannot vote for Eliza."
697,00:39:12.71,00:39:12.71,Everybody else is fair game. It is time to vote.
698,00:39:15.21,00:39:15.21,"Scout, you're up. >> Jules, a wise woman once"
699,00:39:25.71,00:39:25.71,"gave me some good information: ""Go back to your roots, Jules."
700,00:39:30.17,00:39:30.17,"Rediscover your roots."" >> Twila, I have been"
701,00:39:47.08,00:39:47.08,waiting to vote you off since the day I met you.
702,00:39:50.25,00:39:50.25,"I cannot believe that 36 days later, I'm finally getting"
703,00:39:54.25,00:39:54.25,"this opportunity. >> It's tough, but I"
704,00:40:13.83,00:40:13.83,gotta play the game. >> PROBST: I'll go tally the
705,00:40:22.25,00:40:22.25,votes. >> PROBST: Once the votes are
706,00:40:35.79,00:40:35.79,"read, the decision is final. The person voted out will be"
707,00:40:38.17,00:40:38.17,asked to leave the Tribal Council area immediately.
708,00:40:40.00,00:40:40.00,I'll read the votes. First vote... Julie.
709,00:40:50.17,00:40:50.17,"Twila. One vote Julie, one vote Twila."
710,00:40:55.92,00:40:55.92,"Julie. Two votes Julie, one vote Twila."
711,00:41:02.50,00:41:02.50,"Twila. Two votes Twila, two votes"
712,00:41:06.00,00:41:06.00,Julie. I'll read the last vote.
713,00:41:10.79,00:41:10.79,The 14th person voted out of Survivor: Vanuatu...
714,00:41:15.62,00:41:15.62,Julie. You need to bring me your torch.
715,00:41:29.33,00:41:29.33,"Julie, the tribe has spoken. Well, you have made it to the"
716,00:41:45.54,00:41:45.54,"final four. Over the next three days, there"
717,00:41:48.12,00:41:48.12,"will be three Tribal Councils, two immunity challenges, one"
718,00:41:51.50,00:41:51.50,winner. Grab your torches and head back
719,00:41:54.42,00:41:54.42,to camp. Good night.
720,00:42:09.79,00:42:09.79,>> PROBST: Stay tuned for scenes from our next episode.
721,00:42:14.88,00:42:14.88,>> PROBST: Next time on Survivor:
722,00:42:17.08,00:42:17.08,">> I don't think you deserve to be here, Eliza."
723,00:42:18.71,00:42:18.71,You have done nothing but boil freakin' water.
724,00:42:21.17,00:42:21.17,>> I think Twila's a dumb bitch. >> PROBST: The heat is on.
725,00:42:24.00,00:42:24.00,>> I hope they kill each other. >> PROBST: Only three days are
726,00:42:26.71,00:42:26.71,"left. Next time, in a two-hour"
727,00:42:28.83,00:42:28.83,"special, find out who will become the sole survivor."
728,00:42:32.62,00:42:32.62,>> It's for a million bucks. That'll change your life.
729,00:42:39.29,00:42:39.29,">> Here I am. It's day 36, I'm done."
730,00:42:43.50,00:42:43.50,"Little bit of a surprise. You know, I-I thought Chris and"
731,00:42:46.17,00:42:46.17,I had this kind of straightforward brother-sister
732,00:42:48.58,00:42:48.58,"kind of slap-each-other-around relationship, and Chris was kind"
733,00:42:52.25,00:42:52.25,of my crutch today and he told me 100% that he was gonna vote
734,00:42:54.92,00:42:54.92,for Twila. I don't know if he changed the
735,00:42:56.50,00:42:56.50,last minute. I'm curious.
