,begin,end,subtitles_text
347,00:19:35.83,00:19:35.83,"immature and so obnoxious and annoying, and I hate the way"
348,00:19:39.96,00:19:39.96,she treats me. I hate...
349,00:19:42.17,00:19:42.17,"I mean, oh, my God. >> It just don't make no"
350,00:19:45.29,00:19:45.29,sense why she's being so freakin' childish over it.
351,00:19:48.12,00:19:48.12,I don't care. They can stay in the ground and
352,00:19:50.17,00:19:50.17,"rot, I ain't digging 'em up now. It's her way or no way."
353,00:19:53.21,00:19:53.21,Forget that. >> I'm so sick of Twila.
354,00:19:57.46,00:19:57.46,"I just want her to go home now. >> Full moon, Chris."
355,00:20:12.25,00:20:12.25,>> Awesome. >> It's like a challenge
356,00:20:17.08,00:20:17.08,all over again. >> No kidding.
357,00:20:19.79,00:20:19.79,>> It's going to be great. I like watching this.
358,00:20:31.17,00:20:31.17,">> Oh, wow. >> Do you see?"
359,00:20:33.04,00:20:33.04,">> Yeah, that is awesome. So Joe comes back and, you know,"
360,00:20:36.21,00:20:36.21,"we're like, okay. He goes, ""Look, I'm going to"
361,00:20:37.67,00:20:37.67,"take you up here."" So we all three took off up this"
362,00:20:40.12,00:20:40.12,little trail up the volcano. Watch the rocks.
363,00:20:41.71,00:20:41.71,">> Oh, my God, Chris. >> Oh..."
364,00:20:44.96,00:20:44.96,">> Oh, my God. Do you believe it?"
365,00:20:49.50,00:20:49.50,>> This is where we're going to sit and watch.
366,00:20:51.96,00:20:51.96,">> No way. Julie, do you see how close we"
367,00:20:54.12,00:20:54.12,are now? >> I know.
368,00:20:59.04,00:20:59.04,"Oh, my God. Gosh."
369,00:21:01.12,00:21:01.12,">> No way. >> Oh, my..."
370,00:21:05.79,00:21:05.79,>> It's like a time bomb. >> It is.
371,00:21:07.83,00:21:07.83,This is definitely like fireworks.
372,00:21:10.25,00:21:10.25,">> It was amazing because every time the volcano erupted,"
373,00:21:13.08,00:21:13.08,the volcanic rock would shoot out and it just glowed.
374,00:21:15.12,00:21:15.12,"It was like the Fourth of July. Oh, granny, give us a big one."
375,00:21:20.25,00:21:20.25,>> Oh... I saw a volcano exploding the
376,00:21:25.17,00:21:25.17,whole night. It was one of the most beautiful
377,00:21:27.38,00:21:27.38,things I've ever witnessed. >> There is absolutely no
378,00:21:35.21,00:21:35.21,other experience in my life I can compare it to.
379,00:21:37.96,00:21:37.96,>> Wow. >> I don't know if I'll
380,00:21:40.38,00:21:40.38,ever have another experience like it.
381,00:21:42.25,00:21:42.25,"I mean, how often do you get to sit at the mouth of a volcano"
382,00:21:45.04,00:21:45.04,and watch it explode? Is it talking to us or what?
383,00:21:52.67,00:21:52.67,>> It's saying good-bye. >> Got me scared.
384,00:21:56.21,00:21:56.21,I had to turn around. >> Just about home.
385,00:22:12.04,00:22:12.04,">> Oh, I see Chris and Jules coming."
386,00:22:13.75,00:22:13.75,"(animal call) >> Coming, slowpoke?"
387,00:22:17.21,00:22:17.21,">> I just filled your water jug, J.B."
388,00:22:19.96,00:22:19.96,I don't know where yours is or I'd fill it for you.
389,00:22:26.75,00:22:26.75,">> I knew that. I'm glad, yeah."
390,00:22:30.71,00:22:30.71,>> Where's Twila? How is her foot?
391,00:22:32.17,00:22:32.17,"I've been thinking about her. After the reward this morning,"
392,00:22:34.75,00:22:34.75,"we come back to camp. Right away, you know, Scout"
393,00:22:36.96,00:22:36.96,hugged me and she's thinking the same thing I'm thinking.
394,00:22:40.33,00:22:40.33,It's game time. I just let her know nothing has
395,00:22:44.04,00:22:44.04,changed. We're all four together and
396,00:22:46.08,00:22:46.08,"then, you know, Twila. She's a basket case."
397,00:22:48.33,00:22:48.33,You've got to reassure her. >> Coming back to camp
398,00:22:56.75,00:22:56.75,was perfect. Everything fell together.
399,00:22:58.42,00:22:58.42,"Everyone's thinking on the same terms, keeping an eye on things."
400,00:23:01.42,00:23:01.42,That's what I got to do. >> Come sit and talk to
401,00:23:05.12,00:23:05.12,me for a minute. I was thrilled to get Julie and
402,00:23:08.92,00:23:08.92,Chris back because presumably Julie has spoken to Chris about
403,00:23:12.33,00:23:12.33,voting for Twila. And if Chris is going to go for
404,00:23:15.58,00:23:15.58,"it, then I might go for it also. >> Everything is good."
405,00:23:19.33,00:23:19.33,Julie picked me for strategy. She's worried about her spot
406,00:23:22.83,00:23:22.83,in the game. She knows that us four have
407,00:23:25.04,00:23:25.04,"an alliance. >> Right, right."
408,00:23:26.54,00:23:26.54,"So if any one of the four of us wins immunity, we're voting"
409,00:23:31.12,00:23:31.12,Julie off. >> I don't know.
410,00:23:34.29,00:23:34.29,"Depends on, you know, our best interest in the game and how far"
411,00:23:39.12,00:23:39.12,we can go. I think without a doubt Twila is
412,00:23:42.58,00:23:42.58,"gonna stick with Scout, Scout is gonna stick with Twila."
413,00:23:45.21,00:23:45.21,">> Oh, yeah, definitely. >> That-that worries me"
414,00:23:48.25,00:23:48.25,a little bit. >> But if Julie stays in
415,00:23:50.58,00:23:50.58,"the game, we're automatically in the final three."
416,00:23:53.25,00:23:53.25,">> I'm open-minded to exactly what you said, because,"
417,00:23:56.25,00:23:56.25,"you know, me and Julie have talked and we had discussed"
418,00:23:58.75,00:23:58.75,us three... >> Mm-hmm.
419,00:24:00.33,00:24:00.33,>> ...as being better for all three of us.
420,00:24:03.62,00:24:03.62,>> Mm-hmm. >> Yeah.
421,00:24:11.04,00:24:11.04,I sat down with Eliza on the beach.
422,00:24:13.04,00:24:13.04,"We went over a scenario about me, her and Julie taking"
423,00:24:17.00,00:24:17.00,"out Twila. I mean, I don't trust Scout."
424,00:24:19.38,00:24:19.38,I don't trust Twila. I don't trust Eliza.
425,00:24:21.58,00:24:21.58,"I don't trust Julie, and they don't trust each other."
426,00:24:25.88,00:24:25.88,"And the most screwed-up thing about it is, I think they all"
427,00:24:28.62,00:24:28.62,trust me. So... it's... it's getting
428,00:24:32.17,00:24:32.17,really crazy. I've probably made it this way
429,00:24:35.25,00:24:35.25,myself because I am playing both sides.
430,00:24:38.25,00:24:38.25,Everything's good. We'll just have to see how this
431,00:24:40.25,00:24:40.25,"immunity challenge goes, and, you know, if it falls in the"
432,00:24:43.88,00:24:43.88,"right direction, we'll talk and do what's best for us..."
433,00:24:47.04,00:24:47.04,"to the final three. >> Oh, yeah."
434,00:24:49.75,00:24:49.75,"To the final two. >> Well, yeah, I mean, right."
435,00:24:52.71,00:24:52.71,>> Yeah. >> PROBST: Go ahead and have
436,00:25:05.75,00:25:05.75,"a seat, guys. Ready for today's Immunity"
437,00:25:07.38,00:25:07.38,Challenge? >> Mm-hmm.
438,00:25:09.38,00:25:09.38,">> PROBST: First things first, Chris."
439,00:25:11.38,00:25:11.38,Give it up. Immunity back up for grabs.
440,00:25:16.79,00:25:16.79,"For today's immunity challenge, I'm gonna tell you a story about"
441,00:25:19.71,00:25:19.71,"a legendary man in these parts, and then you're gonna have to"
442,00:25:23.17,00:25:23.17,answer a series of questions. Ready for the story?
443,00:25:25.21,00:25:25.21,">> Yeah. >> PROBST: All right, back in"
444,00:25:27.04,00:25:27.04,"the 1200s, this guy Chief Roy Mata comes to this land,"
445,00:25:29.62,00:25:29.62,conquers it. His first goal was to bring
446,00:25:32.54,00:25:32.54,"peace by uniting all of the tribes, and he accomplished"
447,00:25:35.08,00:25:35.08,"that. But sadly, the peace didn't"
448,00:25:37.96,00:25:37.96,"last very long. 15 years later, Roy Mata was"
449,00:25:41.08,00:25:41.08,"murdered, not by an enemy or a rival chief, but by his own"
450,00:25:44.12,00:25:44.12,"brother. Now, it certainly wasn't"
451,00:25:46.21,00:25:46.21,"forbidden to bury a chief on the land that he ruled, but the"
452,00:25:49.88,00:25:49.88,locals were so afraid of the power of the spirit of Roy Mata
453,00:25:53.04,00:25:53.04,that they took the body to a remote location and they buried
454,00:25:56.21,00:25:56.21,"him there with his 18 assistant chiefs, their wives and all of"
455,00:26:00.38,00:26:00.38,"Roy Mata's wives. Before being buried alive, the"
456,00:26:03.46,00:26:03.46,"men were given a strong brew of kava, not because it was"
457,00:26:07.25,00:26:07.25,customary but because it put them in a dream-like relaxed
458,00:26:10.04,00:26:10.04,"state. The women, however, were"
459,00:26:11.79,00:26:11.79,strangled to death before being buried.
460,00:26:13.67,00:26:13.67,"Once the ceremony was complete, the land was declared taboo, and"
461,00:26:17.42,00:26:17.42,nobody visited for seven centuries.
462,00:26:19.88,00:26:19.88,"One footnote, the name Roy Mata, not a popular name today."
463,00:26:22.54,00:26:22.54,"In fact, it has never been used since."
464,00:26:25.08,00:26:25.08,That is your story. Your challenge now to see how
465,00:26:27.21,00:26:27.21,much of that information you've retained.
466,00:26:29.21,00:26:29.21,Here's how it'll work. There are six huts scattered in
467,00:26:31.92,00:26:31.92,the jungle. You'll race to a hut where
468,00:26:33.62,00:26:33.62,"you'll find a puzzle. Put the puzzle together, which"
469,00:26:36.25,00:26:36.25,"has the question, read it and then choose between answer A or"
470,00:26:39.12,00:26:39.12,answer B. Attached to each answer is a bag
471,00:26:41.75,00:26:41.75,"full of tusks. Without looking, reach in and"
472,00:26:44.62,00:26:44.62,"pull one out. If you're wrong, you will grab a"
473,00:26:47.62,00:26:47.62,"black tusk, in which case you have to race back to the center,"
474,00:26:51.38,00:26:51.38,toss it in the urn and return to the hut to answer the question
475,00:26:54.21,00:26:54.21,"correctly. If you're right, you'll grab a"
476,00:26:56.58,00:26:56.58,"white tusk, bring that back to your post, put it on your"
477,00:26:59.71,00:26:59.71,necklace. There are six huts.
478,00:27:01.29,00:27:01.29,First person to get five answers correctly wins immunity.
479,00:27:06.21,00:27:06.21,Ready to do this? >> Let's roll.
480,00:27:08.04,00:27:08.04,>> PROBST: Here we go. For immunity and a guaranteed
481,00:27:10.58,00:27:10.58,spot in the final four. Survivors ready.
482,00:27:14.04,00:27:14.04,"Go! >> Okay. ""When Roy Mata"
483,00:27:34.54,00:27:34.54,"conquered the land, what was his first goal?"""
484,00:27:40.12,00:27:40.12,"""Unite the tribes."" >> PROBST: Eliza heads back"
485,00:27:47.04,00:27:47.04,first. She's got one right.
486,00:27:52.21,00:27:52.21,">> ""The body of Roy Mata was not buried on his"
487,00:27:54.33,00:27:54.33,"homeland..."" Because..."
488,00:27:59.17,00:27:59.17,"""It was forbidden by custom."" ""Locals feared his spirit."""
489,00:28:05.17,00:28:05.17,>> PROBST: Chris back. He's got one right.
490,00:28:08.42,00:28:08.42,">> ""Roy Mata was poisoned by..."""
491,00:28:14.50,00:28:14.50,"""A family..."" >> PROBST: Here's Julie."
492,00:28:17.92,00:28:17.92,"She's got one right. Eliza, Chris, Julie with"
493,00:28:20.29,00:28:20.29,"one right. >> ""Before being buried"
494,00:28:22.38,00:28:22.38,"alive, the men drank kava because..."""
495,00:28:24.42,00:28:24.42,"""It was customary."" >> PROBST: Twila has her first"
496,00:28:33.54,00:28:33.54,"one right. >> ""The wives of the assistant"
497,00:28:37.25,00:28:37.25,"chiefs serving under Roy Mata were also buried alive."""
498,00:28:50.83,00:28:50.83,">> PROBST: Scout got it wrong, throws it in the urn."
499,00:28:53.38,00:28:53.38,">> ""To this date, the name Roy Mata is..."""
500,00:28:58.42,00:28:58.42,"""Never used."" ""A popular name."" ""Never used."""
501,00:29:02.12,00:29:02.12,>> PROBST: Eliza heading back with her second question.
502,00:29:04.88,00:29:04.88,Eliza in the lead with two. Here's Julie back with another
503,00:29:08.42,00:29:08.42,one. Chris back with his second one.
504,00:29:13.08,00:29:13.08,Eliza extends her lead. Back with her third correct
505,00:29:17.54,00:29:17.54,answer. Julie racing back.
506,00:29:20.25,00:29:20.25,She's got her third. Looking for an opening hut.
507,00:29:24.75,00:29:24.75,"Chris trying to get in this. Eliza with three, Julie with"
508,00:29:28.21,00:29:28.21,"three, Chris with two. Eliza got her fourth one right."
509,00:29:32.92,00:29:32.92,Julie right behind her. She has her fourth one.
510,00:29:35.25,00:29:35.25,We're dead even. Between Eliza and Julie.
511,00:29:39.08,00:29:39.08,Julie waiting on a spot from Twila.
512,00:29:45.21,00:29:45.21,"Eliza with four, Julie with four."
513,00:29:48.00,00:29:48.00,"First one back with the white tusk wins immunity, guaranteed"
514,00:29:51.25,00:29:51.25,"spot in the final four. >> ""Before being buried"
515,00:29:54.12,00:29:54.12,"alive, the men drank kava because..."""
516,00:29:56.12,00:29:56.12,"""It relaxed them."" ""It was customary."""
517,00:29:58.83,00:29:58.83,"""It relaxed them."" >> PROBST: Here comes Eliza,"
518,00:30:01.46,00:30:01.46,"number five, and with that, Eliza wins immunity!"
519,00:30:06.58,00:30:06.58,"All right, Eliza. Get over here."
520,00:30:09.17,00:30:09.17,">> My first time. >> PROBST: Well, it's a good"
521,00:30:11.92,00:30:11.92,"time to be the first time. So the other four of you, after"
522,00:30:14.29,00:30:14.29,"36 days of making it this far, tonight the game will end for"
523,00:30:17.83,00:30:17.83,one of you. I'll see you tonight at Tribal
524,00:30:20.08,00:30:20.08,Council. Head on back to camp.
525,00:30:42.04,00:30:42.04,"(indistinct conversation) >> For the first time, I"
526,00:30:48.79,00:30:48.79,"won individual immunity today, and I am guaranteed a spot in"
527,00:30:52.71,00:30:52.71,the final four. It's awesome.
528,00:30:54.42,00:30:54.42,It's a great feeling. I'd like to win every immunity
529,00:30:57.04,00:30:57.04,challenge from here on out. This is gonna be the first
530,00:30:59.17,00:30:59.17,Tribal Council I haven't brought my bag to.
531,00:31:02.42,00:31:02.42,"I think that tonight Chris, Julie and I are going to shock"
532,00:31:06.71,00:31:06.71,"the hell out of everyone and vote off Twila, and it's just..."
533,00:31:10.79,00:31:10.79,it's a really exciting prospect. Chris has proved me right so
534,00:31:14.42,00:31:14.42,"far, and I just hope he continues to do so."
535,00:31:17.25,00:31:17.25,>> (indistinct talking) >> Yeah. Not a big deal.
536,00:31:22.00,00:31:22.00,>> What are they talking about?
537,00:31:25.17,00:31:25.17,>> I don't know. >> Putting a lot of trust
538,00:31:28.38,00:31:28.38,"in Chris, you know? He could guarantee himself a"
539,00:31:30.17,00:31:30.17,final-three spot with them. >> But... I don't think
540,00:31:33.42,00:31:33.42,"he'll do that. >> We're three, they're"
541,00:31:37.17,00:31:37.17,two. That's it.
542,00:31:39.17,00:31:39.17,"Case closed, right, Scout? >> Right, absolutely."
543,00:31:41.08,00:31:41.08,">> Nothing stops us. >> If I'm going home,"
544,00:31:44.08,00:31:44.08,you'd better tell me. >> You guys...
545,00:31:47.50,00:31:47.50,I'm here because of you guys. It's not changing.
546,00:31:50.50,00:31:50.50,"I mean, don't even doubt it. I would tell you, you got it?"
547,00:31:55.08,00:31:55.08,"We're going all the way, to the final three."
548,00:31:58.00,00:31:58.00,>> Okay. >> Scout and Twila are
549,00:32:00.04,00:32:00.04,definitely convinced that Julie's the next to go.
550,00:32:03.29,00:32:03.29,"And then there's me. I'm still weighing my options,"
551,00:32:07.08,00:32:07.08,"but I'm going back and forth like a teeter-totter, you know?"
552,00:32:10.21,00:32:10.21,"I'm thinking, one moment I think I'm gonna keep Julie around, and"
553,00:32:13.17,00:32:13.17,"the next moment, you know, I'm thinking maybe I better stick"
554,00:32:16.12,00:32:16.12,"with Twila and Scout. Now, just listen to me."
555,00:32:18.46,00:32:18.46,It's just a question. It's not what's gonna happen
556,00:32:21.12,00:32:21.12,necessarily. If I decide to vote Julie off
557,00:32:24.88,00:32:24.88,"tonight because I think it's best for me and you, that"
558,00:32:28.46,00:32:28.46,"doesn't affect me and your pact, right?"
559,00:32:31.21,00:32:31.21,">> The only thing is, you know Scout and Twila are not"
560,00:32:34.29,00:32:34.29,gonna go against each other. That means whichever one of us
561,00:32:37.21,00:32:37.21,"doesn't win immunity is going up against one of them, whichever"
562,00:32:40.67,00:32:40.67,"one we decide to vote off first, in a challenge at Tribal"
563,00:32:43.50,00:32:43.50,Council. >> I know.
564,00:32:45.46,00:32:45.46,">> That's what that means. And so yes, it doesn't affect"
565,00:32:47.67,00:32:47.67,"our pact, but that means that one of the two of us could end"
566,00:32:50.29,00:32:50.29,"up in the final three with two of them, meaning 100% we do not"
567,00:32:55.00,00:32:55.00,"end up in the final two. >> I know, I know."
568,00:32:59.96,00:32:59.96,">> What's up? >> I don't know, you tell me."
569,00:33:05.62,00:33:05.62,"What's up, Eliza? >> I don't know."
570,00:33:07.04,00:33:07.04,I just feel like you're ... with me.
571,00:33:09.21,00:33:09.21,">> You got immunity. >> You're right, I do"
572,00:33:10.88,00:33:10.88,"have immunity tonight, but if I don't have immunity tomorrow"
573,00:33:13.17,00:33:13.17,"night, then who's gone, T? I think you're a liar, T."
574,00:33:15.50,00:33:15.50,>> Who else has been lying? Are you in this alliance with us
575,00:33:19.12,00:33:19.12,to the end? >> I hadn't told a lie in
576,00:33:21.04,00:33:21.04,this game. >> And have you been
577,00:33:23.21,00:33:23.21,"talking to Julie about anything, or is that just... that's okay"
578,00:33:25.79,00:33:25.79,"for you to do? You said, swore to us that you"
579,00:33:28.04,00:33:28.04,"was in this final-four alliance till the end, so what've you"
580,00:33:30.12,00:33:30.12,"been talking to Julie about? >> Hey, I'm gonna listen"
581,00:33:32.21,00:33:32.21,"to her. >> And you're not saying,"
582,00:33:33.79,00:33:33.79,"""Okay, we would like to do this and this and get Twila and Scout"
583,00:33:36.33,00:33:36.33,"out of here"" or anything? >> I'm listening."
584,00:33:38.46,00:33:38.46,"I'm listening, and you know what?"
585,00:33:40.46,00:33:40.46,">> And you ain't said a word? >> I would consider it,"
586,00:33:42.88,00:33:42.88,because you've been trying to plot against me since day one.
587,00:33:44.58,00:33:44.58,>> You've been on the edge for the last three friggin'
588,00:33:46.88,00:33:46.88,days. You're driving everybody
589,00:33:48.88,00:33:48.88,friggin' nuts. Chill out.
590,00:33:51.83,00:33:51.83,You got one night that you know you ain't going nowhere.
591,00:33:54.08,00:33:54.08,Enjoy it. >> I will.
592,00:33:56.54,00:33:56.54,">> Now, Chris, what are you thinking?"
593,00:33:58.08,00:33:58.08,">> (laughs): What? I'm just laying here, you know,"
594,00:34:01.88,00:34:01.88,"in the hammock. >> No, you was talking to..."
595,00:34:03.75,00:34:03.75,I just come up. I was just kind of listening to
596,00:34:06.04,00:34:06.04,what was being said. >> I'm hearing Eliza out.
597,00:34:08.04,00:34:08.04,She's talking to me. >> Okay.
598,00:34:12.25,00:34:12.25,>> Everybody's scrambling. I just think I'm in a better
599,00:34:15.58,00:34:15.58,"position than, you know, Twila, Scout, Eliza, or Julie right now"
600,00:34:19.58,00:34:19.58,"because I'm-I'm, I'm pretty much the middle man, as far as I"
601,00:34:21.96,00:34:21.96,"know. You know, what them four have"
602,00:34:24.04,00:34:24.04,"conspired or talked about, I don't know."
603,00:34:26.38,00:34:26.38,"I don't trust any of them. They're thick as thieves, man."
604,00:34:29.50,00:34:29.50,They're all women. How do you trust any of them?
605,00:34:31.71,00:34:31.71,"So, I don't know what I'm going to do."
606,00:34:35.83,00:34:35.83,"I'm messing with both sides, but it's kind of easy to do right"
607,00:34:38.46,00:34:38.46,now. I need to do it to figure out
608,00:34:40.88,00:34:40.88,what my best option is right now.
609,00:34:43.04,00:34:43.04,It's probably in my best interest to go with you and
610,00:34:45.75,00:34:45.75,Eliza because Scout and Twila are too thick.
611,00:34:48.79,00:34:48.79,I haven't broke my word that often in this game and I thought
612,00:34:51.29,00:34:51.29,I would be a cutthroat piece of...
613,00:34:54.21,00:34:54.21,>> But isn't she easier to do that to than me?
614,00:34:56.92,00:34:56.92,>> What I'm comparing this to is my friendship with
615,00:34:59.21,00:34:59.21,you compared to my friendship with Twila.
616,00:35:01.25,00:35:01.25,>> Right. >> And my friendship with
617,00:35:03.25,00:35:03.25,"you is a hell of a lot more than my-- I mean, come on."
618,00:35:05.08,00:35:05.08,"We've joked around, and, you know, I call you my little"
619,00:35:07.08,00:35:07.08,sister. It's just... it's totally
620,00:35:09.12,00:35:09.12,different. We'll keep you.
621,00:35:10.83,00:35:10.83,We're gonna vote off Twila. >> Chris approaches me.
622,00:35:14.42,00:35:14.42,"He says he's gonna straight-out vote for Twila, basically saying"
623,00:35:17.83,00:35:17.83,that our friendship is weighing on his decision tonight.
624,00:35:23.42,00:35:23.42,I hope he keeps me around. That's all I can do.
625,00:35:25.79,00:35:25.79,I don't know for sure. I'm not going to be extremely
626,00:35:27.17,00:35:27.17,paranoid. I'm just really gonna be even
627,00:35:29.83,00:35:29.83,keel and hope that it goes in my favor.
628,00:35:33.83,00:35:33.83,>> I haven't liked the game since we merged.
629,00:35:36.04,00:35:36.04,>> We have no reason to be stressed.
630,00:35:38.08,00:35:38.08,I've made my decision. It's not gonna change.
631,00:35:40.79,00:35:40.79,"It's me, you, and Scout voting for Julie, and that's it."
632,00:35:44.67,00:35:44.67,That's not gonna change. I'm not even hesitating.
633,00:35:48.12,00:35:48.12,Me and Julie's become friends. I'm sending her home tonight.
634,00:35:53.50,00:35:53.50,>> Chris has guaranteed me that I'm not going home
635,00:35:55.50,00:35:55.50,tonight. Part of me wants to believe
636,00:35:57.58,00:35:57.58,"Chris wholeheartedly, but-- it's a game."
637,00:35:59.96,00:35:59.96,I just cannot do it. I cannot let my guard down.
638,00:36:02.62,00:36:02.62,You can't trust nobody now. Nobody.
639,00:36:04.58,00:36:04.58,You're playing for a million dollars.
640,00:36:06.58,00:36:06.58,"People have murdered for less than a million dollars,"
641,00:36:09.21,00:36:09.21,you know? Come on.
642,00:36:15.25,00:36:15.25,">> I'm excited to have immunity. >> I know, you ought to be."
643,00:36:21.25,00:36:21.25,>> I told Julie that I'm keeping her.
644,00:36:22.92,00:36:22.92,I told Twila that I'm keeping her.
645,00:36:25.25,00:36:25.25,I'm gonna put myself in the best possible situation to win the
646,00:36:29.04,00:36:29.04,game. It's tough right now.
647,00:36:32.58,00:36:32.58,I'm gonna have to make a decision before long.
648,00:36:52.17,00:36:52.17,">> PROBST: We'll now bring in the members of the jury: Sarge,"
649,00:36:55.17,00:36:55.17,"Chad, Leanne, and Ami-- voted out at the last Tribal Council."
650,00:37:03.38,00:37:03.38,"Welcome to Tribal Council. Well, let talk about 36 days, a"
651,00:37:08.00,00:37:08.00,"lot of wear and tear, physically and certainly emotionally."
652,00:37:11.33,00:37:11.33,Everybody here wants to win the game.
653,00:37:13.50,00:37:13.50,Have you guys started thinking about who deserves to win this
654,00:37:15.92,00:37:15.92,"game? Twila, is there any way that"
655,00:37:19.33,00:37:19.33,somebody could be unworthy of winning?
656,00:37:22.17,00:37:22.17,>> I don't know. >> Be honest.
657,00:37:25.71,00:37:25.71,>> PROBST: You don't know or you don't want to say?
658,00:37:28.79,00:37:28.79,">> You are being hard on me, you know that?"
659,00:37:31.08,00:37:31.08,">> PROBST: Am I? >> Yes, sir, you are."
660,00:37:32.92,00:37:32.92,>> PROBST: Are you saying there are people here tonight that
661,00:37:34.71,00:37:34.71,absolutely do not deserve to be in the final five.
662,00:37:40.83,00:37:40.83,">> Just tell him what you feel, Twila."
663,00:37:42.96,00:37:42.96,">> Yeah, come on. >> Why hold back now?"
664,00:37:45.42,00:37:45.42,">> My personal opinion is yes, there is."
665,00:37:50.25,00:37:50.25,">> It's me, by the way, in case anybody was wondering."
666,00:37:52.96,00:37:52.96,">> PROBST: Well, Twila, it's no secret you and Eliza have not"
667,00:37:55.33,00:37:55.33,"gotten along for a long time. >> No. No, there's no secret."
668,00:37:58.54,00:37:58.54,">> PROBST: Eliza, anybody here that doesn't deserve to be here."
669,00:38:00.83,00:38:00.83,">> Even though they would say the opposite of me, I think"
670,00:38:03.08,00:38:03.08,all the people sitting here deserve to be here.
671,00:38:05.62,00:38:05.62,That doesn't mean that I like them.
672,00:38:07.58,00:38:07.58,"That doesn't mean that I don't like other people, who are no"
673,00:38:11.08,00:38:11.08,"longer in the game, a million times more than I like some of"
674,00:38:14.21,00:38:14.21,"the people sitting here next to me, but I think we all deserve"
675,00:38:17.21,00:38:17.21,to be here. We wouldn't be here otherwise.
676,00:38:18.83,00:38:18.83,">> PROBST: What about you, Julie?"
677,00:38:20.75,00:38:20.75,"At this point, when you have to vote, obviously, it's strategic,"
678,00:38:22.92,00:38:22.92,"but is there any part of you starting to whittle things down,"
679,00:38:25.21,00:38:25.21,thinking who I want to go to the final four with are these people
680,00:38:28.46,00:38:28.46,"and this is why? >> Um... I guess, just"
681,00:38:30.79,00:38:30.79,"judging people. The longer you're with them, you"
682,00:38:33.54,00:38:33.54,"see their antics and tactics and I feel like I can, I know who I"
683,00:38:36.92,00:38:36.92,can trust and who I can't trust and who cares about me or who
684,00:38:39.79,00:38:39.79,"doesn't care about me. >> PROBST: At this point, do you"
685,00:38:42.25,00:38:42.25,think any of these other four care about you?
686,00:38:44.17,00:38:44.17,">> Yeah, I know that some do. >> PROBST: Chris, what's tough"
